{
    "text": "COMMUNIQUÉ DE PRESSE\nRésultats annuels 2023\n• La reprise de la production se confirme en 2023 grâce à la reconfiguration des programmes\nimmobiliers ;\n• Cette reprise a eu un impact significatif sur le chiffre d’affaires et la rentabilité du Groupe ;\n• L’endettement net a connu une baisse significative en 2023 ;\n• L’activité en Afrique de l’Ouest poursuit sa dynamique commerciale avec le lancement d’un\nprogramme de haut standing en Côte d’Ivoire et d’un programme économique au Sénégal ;\n1. INDICATEURS DE L’ACTIVITÉ DU GROUPE Evolution du volume de production – en UNITÉS\n1.1 Préventes : 7281\nPréventes par BU\n+216\n%\nLes préventes par BU se présentent comme suit :\nPréventes (unités) 2022 2023\nEco et MS 7327 7928\n2303\nHS 1004 1349\nTotal 8331 9277\nLes préventes de l’année 2023 s’élèvent à 9277 unités, en 2022 2023\nhausse de 11% par rapport à l’année 2022. Les filiales en\n1.3 Chiffre d’affaires :\nAfrique de l’Ouest ont contribué à hauteur de 30% à ces\npréventes. Le chiffre d’affaires consolidé de l’année 2023 s’élève à\nÀ date, le chiffre d’affaires sécurisé du Groupe s’élève à 2134 MMAD, et enregistre une hausse de 55% par rapport\n9,4 Md MAD : à l’année 2022.\nPlusieurs tranches de haut standing de la marque Presti-\n • 6,1 Md MAD au Maroc ; gia ont été livrées en 2023, notamment à Casablanca et à\nMarrakech.\n • 3,3 Md MAD en Afrique de l’Ouest.\nEvolution du chiffre d’affaires consolidé – en M MAD\n1.2 Production :\n2134\nLe groupe a finalisé la production de 7281 unités en 2023 +55 %\ncontre 2303 unités en 2022. La reprise de la production\nse confirme en 2023 grâce à la reconfiguration des pro- 1378\ngrammes immobiliers entamée depuis quelques années.\nCette reprise des chantiers a eu un impact significatif sur le\nchiffre d’affaires de l’année 2023 et impactera favorable-\nment celui de l’année 2024.\n2022 2023\nS.A. au capital de 4 025 512 540.00 Dhs - RC Casablanca 52405\nSiège social : Km 7, route de Rabat- Ain Sebaâ -CASABLANCA - www.groupeaddoha.com – ir.groupeaddoha.com\nCOMMUNIQUÉ DE PRESSE\nRésultats annuels 2023\nLa contribution des BU au chiffre d’affaires consolidé se 3.2 BFR :\ndétaille comme suit :\nLe BFR a baissé de 38 M MAD en 2023 et s’établit à près\nChiffre d'affaires de 13 Md MAD. Il reste maitrisé malgré la reprise de la\n2022 2023\nconsolidé en M MAD\nproduction et le lancement de plusieurs nouveaux chantiers\nEco et MS 1 280 1 104\nau Maroc et en Afrique de l’Ouest.\nHS 97 1 030\nIl est à noter que ce BFR comprend la valeur comptable de\nTotal 1 378 2 134\nla réserve foncière du Groupe.\n2. INDICATEURS DE RÉSULTAT CONSOLIDÉ\n3.3 Cash Flows :\n2.1 Marge brute :\nLes réalisations financières en 2023 et la maitrise du BFR\nLe taux de marge brute s’établit à 23% au 31 décembre\nont permis de générer un cash flow d’exploitation consolidé\n2023 contre 28% au 31 décembre 2022. Le chiffre d’affaires\nde 462 M MAD et un cash flow net de 110 M MAD, confir-\nen 2022 a porté sur une composante lotissement plus\nmant l’amélioration de la situation financière du Groupe par\nimportante qu’en 2023.\nrapport à 2022.\nEvolution du Cash flow d’exploitation\n2.2 Résultat des activités opérationnelles : et du cash flow net – en M MAD\nLe résultat des activités opérationnelles s’établit à 462\n208 M MAD en 2023 contre 109 M MAD en 2022,\nen évolution de 91%.\n2.3 Résultat Net Consolidé : 110\nRésultat Net Consolidé 2022\n2022 2023\n(en M MAD)\n2023\nGroupe 12 188 -65\nCash flow d’exploitation\n-154\nCash flow net\nLa reprise de la production et la bonne dynamique com-\nmerciale en 2023 ont contribué à la réalisation d’un résultat\n4. INDICATEURS DES COMPTES SOCIAUX DE DOUJA\nnet consolidé de 188 M MAD, en forte croissance par rap-\nPROMOTION GROUPE ADDOHA\nport à 2022.\nLes principaux indicateurs des comptes sociaux de Douja\n3. INDICATEURS BILANCIELS CONSOLIDÉS Promotion Groupe Addoha se présentent comme suit :\n3.1 Endettement net :\nEn M MAD 2 022 2 023\nL’endettement net du Groupe a baissé de 308 M MAD à fin\nChiffre d'affaires 294 883\ndécembre 2023 et s’établit à près de 4.3 Md MAD.\nRésultat d'exploitation -161 14\nLa dette au Maroc connait une baisse significative malgré\nRésultat net -214 15\nla hausse de la production. L’encours de la dette privée au\nMaroc a baissé de plus de 78% depuis le lancement du plan Capitaux propres 10 582 10 598\nde désendettement, réduisant ainsi l’exposition du Groupe\nEndettement net 3 337 2 964\nau marché financier de la dette privée. L’encours de cette\ndette privée au Maroc à date s’établit à près 850 M MAD et Le chiffre d’affaires de Douja Promotion a connu une\nsuit son plan d’amortissement normal. hausse de 200% grâce à la reprise de la production et des\nFin Fin livraisons sur plusieurs projets dans les différentes BUs de\nEn Md MAD\ndéc-2022 déc-2023 la société.\nEndettement net du Groupe 4,6 4,3\nLa société Douja Promotion retrouve sa capacité bénéfi-\nciaire en 2023 grâce à la hausse du chiffre d’affaires.\nLe gearing a baissé de 2 points au 31 décembre 2023 et\ns’établit à un niveau largement maitrisé de 30%. La société s’est désendettée de 373 M MAD en 2023.\nLIEN VERS LE RFA :\nLe Rapport Financier Annuel de la société DOUJA PROMOTION au titre de l’année 2023 est disponible sur le lien suivant :\nhttps://ir.groupeaddoha.com/publication?societe=ADDOHA&type=Rapport%20financier&annee=2023\nS.A. au capital de 4 025 512 540.00 Dhs - RC Casablanca 52405\nSiège social : Km 7, route de Rabat- Ain Sebaâ -CASABLANCA - www.groupeaddoha.com – ir.groupeaddoha.com\nCOMMUNIQUÉ DE PRESSE\nRésultats annuels 2023\n1 - Comptes sociaux\nPÉRIODE DU : 01/01/2023 AU : 31/12/2023 PÉRIODE DU : 01/01/2023 AU : 31/12/2023\nACTIF Brut Am eE to X prE t ri osR vsC e isI m iC oe nE n sts Net P E RX EE C NR E eC D tI EC NE T PASSIF auS 3IT 1U /1A 2T /I 2O 0N 23 aP u RE 3X E 1/E C 1R E 2C D /2I EC 0NE 2T 2\nIMMOBILISATIONS EN NON VALEUR (A) 4 417 560,68 3 984 048,56 433 512,12 1 067 024,26 CAPITAUX PROPRES\nF Cr ha ais rg P er se l i am ri en pa air re ts ir sur plusieurs exercices 4 2 1 56 07 05 06 00 ,, 06 08 3 9 53 04 00 04 08 ,, 05 06 2023 03 0 5 01 02 ,0,1 02 1 067 024,2 6 - Capital social ou personnel 4 025 512 540,00 4 025 512 540,00\nPrimes de remboursement des obligations - - - - F Moins : Actionnaires, capital souscrit non appele - -\nIMMOBILISATIONS INCORPORELLES (B) 11 567 619,51 9 070 832,03 2 496 787,48 3 282 843,48 Capital appele\nA C T e I Bm t r em d veo evb te si ll ,oi s mpa p ati e ro qmn us e e e n sn t , dr re oc ih tse ,r ec th ve a leurs similaires 213 683,9 3- - - 213 683,9 3- 204 735,9 3- N AI P r i m e d e m is s i o n , d d eo fn ut s v ioe nr ,s de a p p o r t 3 603 499 130,00 3 603 499 130,00\nI Fonds commercial - - - - N Ecarts de reevaluation - -\nAutres immobilisations incorporelles 11 353 935,58 9 070 832,03 2 283 103,55 3 078 107,55 Reserve legale 326 914 862,52 326 914 862,52\nF IMMOBILISATIONS CORPORELLES (C) 848 859 107,51 195 216 812,19 653 642 295,32 731 402 072,68 C Autres reserves - -\nTerrains 454 736 766,44 40 000 000,00 414 736 766,44 458 531 811,38 E Report a nouveau (2) 2 626 922 052,44 2 841 327 267,43\nMI C I Mno asn t ta es lt rlr a ieu t lc i o tt rnio asn n, s ste pc oh rtniques, materiel et outillage 32 6 74 5 6 1 8 06 2 31 2 0 783 5 06 6 ,, , 35 4 83 5 11 72 6 5 5 3 89 1 687 94 0 63 42 01,, ,89 70 27 211 5 26 6 13 64 8 800 11 943 ,,, 665 656 244 47 2 35 1 56 9 78 2 77 5 45 , ,3 4,1 022 M E R Re es su ul lt ta at ts n n ee t t ds e e ln 'e i xn es rt ca icn ec e (2 d ) affectation (2) 14 785 021,6 - 1 -214 405 214,9 9-\nM Mobilier, materiel de bureau et amenagements 26 460 061,19 24 588 997,74 1 871 063,45 2 524 430,66 N Total des capitaux propres (A) 10 597 633 606,57 10 582 848 584,96\nO divers T CAPITAUX PROPRES ASSIMILES (B) - -\nB Autres immobilisations corporelles 18 636 877,84 4 125 378,96 14 511 498,88 14 566 064,45 Subventions d'investissement - -\nI Immobilisations corporelles en cours 10 678 328,68 - 10 678 328,68 10 565 191,35 P Provisions reglementees - -\nL IMMOBILISATIONS FINANCIERES (D) 5 194 256 622,82 863 014 858,58 4 331 241 764,24 4 274 738 076,75 E DETTES DE FINANCEMENT (C) 2 166 521 089,43 2 513 931 946,01\nI APr uê tt rs e sim crm eo ab ni cli es se s financi eres 905 853,6 8- - - 905 853,6 8- 905 853,6 8- R Emprunts obligataires 896 683 333,22 972 354 166,61\nS Titres de participation 5 193 350 769,14 863 014 858,58 4 330 335 910,56 4 273 832 223,07 M Autres dettes de financement 1 269 837 756,21 1 541 577 779,40\nÉ Autres titres immobilises - - - - A PROVISIONS DURABLES POUR RISQUES ET CHARGES (D) - -\nE\nT\nOC ADA Tgim AmR i LT n e S Iu n t t D i (ao AE tn i\n+\no C Bd nO e\n+\nd CsN e +cV s DrE e d +R a EenS )ttcI eO e ssN di m- e A m fiC no aT b nI iF l cis e( eE me) s ent\n6 059 100 910,5\n- --\n2 1 071 286 551,3\n- --\n6 4 987 814 359,1\n- --\n6 5 010 490 017, 1\n- --\n7\nN NE E C AP P Ar r uo o gRv v mTi is s S ei io o nDn n tEs ap tp Co ioo u O nu r N r c\nd\nVr h ei Eas sq r R cgu S ree eIs Os\na\nnN\nc\ne- sP iA mS mS oI ( bE il)\nisees\n- - -- - - --\nA S T MO aC rcK hS a ( nF d) ises 7 4 92 69 5 3 23 91 1 2 94 78 8, ,9 730 24 141 16 35 70 4 9 52 15 4, ,1 26 1 7 818 27 3 6 98 170 43 62 43 ,5,7 24 6 8 87 20 1 8 793 16 0 0 57 41 ,, 96 94 T Diminution des dettes de financement - -\nC Mati ere et fournitures consommables - - - - TOTAL I (A+B+C+D+E) 12 764 154 696,00 13 096 780 530,97\nT Produits en cours 5 488 009 840,82 56 916 234,60 5 431 093 606,22 5 357 544 432,10 DETTES DU PASSIF CIRCULANT (F) 2 780 714 914,68 2 310 216 793,72\nI Produits intermediaires et produits residuels - - - - P Fournisseurs et comptes rattaches 460 101 742,08 360 521 265,44\nF Produits finis 976 029 429,35 43 360 176,35 932 669 253,00 691 500 584,55 A Clients crediteurs, avances et acomptes 998 099 134,96 931 568 013,61\nC C R FoE uA nN isC sE eS ur D s,E d L e bA iC teT uIF rs C , aIR vC anU cL eA sN eT t a(G c) comptes 4 45 99 2 4 59 54 5 4 40 96 4,6 ,12 1 87 379 40 12 5 9 411 1,0 ,02 1 4 3 87 91 7 10 433 08 815 3,6 ,100 4 605 6 82 3 56 19 4 14 73 6,6 ,180 S S Personnel 11 212 673,58 11 899 818,32\nRI C Pelie rsn ots\nn\nne et lcomptes rattaches 1 703 281 612,8 -3 13 430 121,7 8\n-\n1 689 851 491,0 -5 2 188 63 76\n9\n2 04 07 ,, 70 86 FI O Etr ag tanismes sociaux 293\n2\n8 04 02\n7\n6 39 83 1, ,3 33\n5\n293\n2\n6 03 48\n3\n3 80 19 7,, 07 60\nC Etat 296 797 333,42 - 296 797 333,42 245 404 200,65 C Comptes d'associes 519 510 503,58 535 649 003,58\nU Comptes d associes - - - - I Autres creanciers 388 554 107,81 90 116 463,10\nNA TL T\nE\n( E\nI CA C T leAu o R mt m REr eTe Sp nSs t E\nt\ne d sDTs e\ncE\nVdb\ni\nrAe Ci ct e L\nO\nureu E\nlN\nagr U nVs u R tEl sa S\nR\n)r Di Ss Ia E Ot Pi No L n -A A ACc CEt TMif IFE N (1T\n)\n(H) 1 6 7 42 0 46 8 30 1 14 8 81 9 50 3 62 8 57 ,, ,66 6 0 -6 7 70 3 9 64 08 7 0 25 68 1,, 52 63 -\n-\n1 6 65 45 0 0 89 1 782 1 1 99 336 089 4,, 64 ,1 0 -3 1 1 55 5 15 701 8 8 8 42 4 67 1 6 92 3 58 4 34 , ,, 6 22 8 2 -5 NU AR C\nL\nA\nE\nT\nOCUC\nA\nTo T Am R\nR\nLE Tp SS It Ie (DPs FR\nE\n+d GOe\nC\n+V Or He I NS )g I Vu O Ela N Rr Si Ss P Ia Ot Oi No U n -R-\nP\np R Aa ISs Ss Q Sif IU FE (ES\nl\neE mT eC nH tA\ns\nR ciG rcE uS\nla n\nt( sG ))\n(H)\n2\n921 800 557\n9\n23 208 276\n6\n76 8 97 0 47 , ,, 0 69 809\n-\n22 57 838\n4\n4 9 137 58 8 50 9\n6\n1 0 90 0 32 , ,0, 79 0 2-1\nTOTAL II (F+G+H+I+) 11 893 144 221,19 333 048 777,74 11 560 095 443,45 11 493 919 468,46 T TRESORERIE - PASSIF\nT R CE hS eO qR ueE sR eIE t v- aA leC uT rI sF a encaisser 137 909 728,62 - 137 909 728,62 23 764 999,45 Credits d'escompte - -\nBanque, T.G. et C.C.P. 1 544 974,60 - 1 544 974,60 1 079 353,25 Credits de tresorerie 60 000 000,00 17 734 677,11\nCaisse, Regies d avances et accreditifs 40 769,12 - 40 769,12 42 833,23 Banques ( Soldes Crediteurs ) 877 327 884,27 830 625 769,76\nTOTAL III 139 495 472,34 - 139 495 472,34 24 887 185,93 TOTAL III 937 327 884,27 848 360 446,87\nTOTAL GENERAL I + II + III 18 091 740 604,05 1 404 335 329,10 16 687 405 274,95 16 529 296 671,56 TOTAL GENERAL I + II + III 16 687 405 274,95 16 529 296 671,56\nCOMPTE DE PRODUITS ET CHARGES PÉRIODE DU : 01/01/2023 AU : 31/12/2023\nOPERATIONS\nNATURE à lP ar pop 1érr ie os de plC e ro s é n cpc eée 2drr ein o nda ten est s LT 'O E 3XT =A E R 1U +CX I 2D CE E PLT R'O E EXT CA E 4ERU DCX E ID C NE E T\nI PRODUITS D'EXPLOITATION 1 144 653 384,46 - 1 144 653 384,46 361 850 882,05\nVentes de marchandises (en l'etat) - - - -\nVentes de biens et services produits 882 949 455,47 - 882 949 455,47 294 015 620,42\nChiffre d'affaires 882 949 455,47 - 882 949 455,47 294 015 620,42\nVariation de stocks de produits (+/-) (1) 181 174 482,92 - 181 174 482,92 57 200 663,76\nImmobilisations produites par l’entreprise\n- - - -\npour elle-même\nSubvention d'exploitation - - - -\nAutres produits d'exploitation - - - -\nReprises d’exploitations: transfert\n80 529 446,07 - 80 529 446,07 10 634 597,87\nII de charges\nTOTAL I 1 144 653 384,46 - 1 144 653 384,46 361 850 882,05\nCHARGES D'EXPLOITATION 1 127 612 259,64 2 950 796,44 1 130 563 056,08 522 367 527,51\nAchats revendus (2) de marchandises - - - -\nAchats cosommes (2) de matière et de\n879 805 464,11 2 311 866,07 882 117 330,18 301 138 585,44\nFournitures\nAutres charges externes 75 686 467,71 180 354,77 75 866 822,48 78 124 689,47\nImpôts et taxes 11 343 765,32 458 575,60 11 802 340,92 12 084 455,72\nCharges de personnel 98 198 475,98 - 98 198 475,98 91 904 290,19\nAutres charges d'exploitaion 2 851 381,10 - 2 851 381,10 5 827 258,37\nDotations d'exploitation 59 726 705,42 - 59 726 705,42 33 288 248,32\nIII\nTOTAL II 1 127 612 259,64 2 950 796,44 1 130 563 056,08 522 367 527,51\nIV RESULTAT D'EXPLOITATIONS (I-II) 17 041 124,82 -2 950 796,44 14 090 328,38 -160 516 645,46\nPRODUITS FINANCIERS 822 277 603,78 0,00 822 277 603,78 159 194 412,31\nProduits des titres de participation et autres\n60 000 000,00 - 60 000 000,00 -\ntitres immobilises\nGains de change 27 834,80 - 27 834,80 16 593,98\nV Interêts et autres produits financiers 46 915 413,68 - 46 915 413,68 41 624 924,33\nReprise financi eres; transferts de charges 715 334 355,30 - 715 334 355,30 117 552 894,00\nTOTAL IV 822 277 603,78 - 822 277 603,78 159 194 412,31\nCHARGES FINANCIERES 708 215 372,26 22 928,84 708 238 301,10 212 163 512,88\nCharges d'inter ets 190 926 787,81 - 190 926 787,81 178 067 021,75\nPertes de changes 97 995,24 22 928,84 120 924,08 3 142 491,13\nVI Autres charges financi eres 517 190 589,21 - 517 190 589,21 -\nDotations financi eres - - - 30 954 000,00\nVII TOTAL V 708 215 372,26 22 928,84 708 238 301,10 212 163 512,88\nVIIIRESULTAT FINANCIER (IV - V) 114 062 231,52 -22 928,84 114 039 302,68 -52 969 100,57\nRESULTAT COURANT (III + V) 131 103 356,34 -2 973 725,28 128 129 631,06 -213 485 746,03\nPRODUITS NON COURANTS 124 862 334,43 - 124 862 334,43 9 032 357,82\nProduits des cessions d'immobilisation 121 578 535,50 - 121 578 535,50 1 332 741,21\nSubvention d'equilibre - - - -\nReprise sur subventions d'investissement - - - -\nIX Autres produits non courants 3 033 798,93 - 3 033 798,93 7 699 616,61\nReprises non courantes; transfert\n250 000,00 - 250 000,00 -\nde charges\nTOTAL VIII 124 862 334,43 - 124 862 334,43 9 032 357,82\nCHARGES NON COURANTES 236 038 837,88 - 236 038 837,88 8 089 383,78\nV aleurs nettes d’amortissements des Immobi-\n232 309 589,42 - 232 309 589,42 299 600,00\nlisations cédées\nX Subventions accordees - - - -\nXI Autres charges non courantes 3 729 248,46 - 3 729 248,46 7 789 783,78\nXII D otations non courantes aux amortissements\n- - - -\nXIII et aux provisions\nXIVTOTAL IX 236 038 837,88 - 236 038 837,88 8 089 383,78\nXV RESULTAT NON COURANT (VIII-IX) -111 176 503,45 - -111 176 503,45 942 974,04\nRESULTAT AVANT IMPOTS (VII+/-X) 19 926 852,89 -2 973 725,28 16 953 127,61 -212 542 771,99\nXIVIMPOTS SUR LES RESULTATS 2 168 106,00 - 2 168 106,00 1 862 443,00\nRESULTAT NET (XI-XII) 17 758 746,89 -2 973 725,28 14 785 021,61 -214 405 214,99\nTOTAL DES PRODUITS (I+VI+VIII) 2 091 793 322,67 530 077 652,18\nTOTAL DES CHARGES (II+V+IX+XII) 2 077 008 301,06 744 482 867,17\nRESULTAT NET\n14 785 021,61 -214 405 214,99\n(total des produits - total des charges\nS.A. au capital de 4 025 512 540.00 Dhs - RC Casablanca 52405\nSiège social : Km 7, route de Rabat- Ain Sebaâ -CASABLANCA - www.groupeaddoha.com – ir.groupeaddoha.com\nCOMMUNIQUÉ DE PRESSE\nRésultats annuels 2023\nS.A. au capital de 4 025 512 540.00 Dhs - RC Casablanca 52405\nSiège social : Km 7, route de Rabat- Ain Sebaâ -CASABLANCA - www.groupeaddoha.com – ir.groupeaddoha.com\nCOMMUNIQUÉ DE PRESSE\nRésultats annuels 2023\n2 - Comptes consolidés\nETAT DE SITUATION FINANCIÈRE ETAT DU RÉSULTAT GLOBAL\nACTIF MAD 31.12.2023 31.12.2022 EN MAD 31.12.2023 31.12.2022\nImmobilisations incorporelles 3 079 543 3 901 221 Chiffre d'affaires 2 134 135 320 1 377 780 080\nImmobilisations corporelles 524 336 167 590 088 507 Autres produits de l'activité 459 622 563 461 624 301\nImmeubles de placement 156 891 349 100 432 665 Produits des activités ordinaires 2 593 757 882 1 839 404 381\nTitres mis en équivalence 1 384 821 1 403 973 Achats consommés -2 097 675 163 -1 459 680 472\nAutres actifs financiers 4 613 333 5 812 822 Frais de personnel -166 868 974 -155 336 950\n- Dont prêts et créances 4 613 332 5 812 822 Impôts et taxes -25 432 990 -19 753 091\n- Dont actifs financiers détenus jusqu'à échéance 0 0 Amortissements et provisions d'exploitation -660 453 105 649 947\n- Dont titres disponibles à la vente 0 0 Autres produits et charges d'exploitation -159 279 789 -183 599 869\nActifs d’impôts différés 873 102 802 967 987 111 Charges d'exploitation courantes -2 449 917 369 -1 712 720 434\nAutres actifs non courants 0 56 171 Résultat d'exploitation courant 143 840 513 126 683 947\nTotal Actifs non courants 1 563 408 015 1 669 682 471 Cessions d'actifs 950 786 1 421 136\nStocks et encours 14 997 018 080 14 337 304 756 Charges de restructuration 0 0\nCréances clients 1 456 841 825 2 185 494 596 Cessions de filiales et participations 0 0\nAutres créances courantes nettes 2 213 600 593 2 175 879 399 Résultats sur instruments financiers 0 0\nAutres actifs financiers 0 0 Autres produits et charges d'exploitation non courants 63 209 333 -18 999 337\n-Dont actifs financiers AFS 0 0 Autres produits et charges d'exploitation 64 160 119 -17 578 201\n-Dont prêts et créances nets 0 0 Résultat des activités opérationnelles 208 000 632 109 105 746\n-Dont actifs financiers détenus jusqu'à échéances 0 0 Coût de l'endettement financier net -290 522 394 -268 130 030\nTrésorerie et équivalent de trésorerie 356 615 984 214 596 605 Autres produits financiers 167 883 097 149 801 990\nTotal Actifs courants 19 024 076 483 18 913 275 357 Autres charges financières 206 007 927 -5 079 495\nTOTAL ACTIF 20 587 484 498 20 582 957 828 Résultat financier 83 368 630 -123 407 535\nRésultat avant impôts des entreprises intégrées 291 369 262 -14 301 789\nPASSIF MAD 31.12.2023 31.12.2022 Impôts sur les bénéfices -14 388 540 -13 440 843\nCapital 4 025 512 540 4 025 512 540 Impôts différés -88 606 977 39 613 427\nPrimes d'émission et de fusion 3 567 681 085 3 034 811 680 Résultat net des entreprises intégrées 188 373 745 11 870 795\nRéserves consolidées 1 290 205 477 1 697 376 811 Part dans les résultats des sociétés mises en équivalence -19 152 -265 794\nRésultats consolidés 174 706 906 37 522 522 Résultat net des activités poursuivies 188 354 593 11 605 001\nEcarts de conversion 15 571 740 25 654 258 Résultat net des activités abandonnées 0 0\nCapitaux propres part du groupe 9 073 677 748 8 820 877 811 Résultat de l'ensemble consolidé 188 354 593 11 605 001\nRéserves minoritaires 818 415 578 848 428 272 Intérêts minoritaires -13 647 687 25 917 521\nRésultat minoritaire 13 647 687 -25 917 521 Résultat net - Part du groupe 174 706 906 37 522 522\nCapitaux propres part des minoritaires 832 063 265 822 510 752\nCapitaux propres d'ensemble 9 905 741 013 9 643 388 563 EN MAD 31.12.2023 31.12.2022\nDettes financières non courantes : 3 653 625 185 3 851 840 394 Résultat de base par action(En MAD) 0.43 0.09\n- -D Do on nt t d de et tt te es s e ren pv re ér ss e l ne ts é é et sa pb alis rs ue nm te itn rets de crédit 2 1 4 177 85 23 57 40 475 30 5 2 1 25 955 6 1 70 39 1 30 719 5 Résultat dilué par action (En MAD) 0.43 0.09\nProvisions non courantes 37 533 330 37 298 251\n31.12.2023 31.12.2022\nAvantages au personnel 0 0\nAutres passifs non courants 18 123 245 158 327 871 Résultat de l'ensemble consolidé 188 354 593 11 605 001\nImpôt différé passif 315 942 165 274 055 262 Autres éléments du résultat global\nTotal des passifs non courants 4 025 223 925 4 321 521 778 Ecart de conversion - -\nProvisions courantes 4 691 855 5 671 053 Réévaluation des instruments dérivés de couverture - -\nDettes financières courantes : 1 025 940 124 993 866 082 Réévaluation des actifs financiers disponibles à la vente - -\n-Dont dettes envers les établissements de crédit 1 025 940 124 993 866 082 Réévaluation des immobilisations - -\n-Dont dettes représentées par un titre 0 0 Ecart actuariels sur les régimes à préstations définies - -\nQuote-part du résultat global des sociétés mises\nDettes fournisseurs 1 733 558 009 1 675 625 810 en équivalence, net d'impôt - -\nAutres passifs courants 3 892 329 571 3 942 884 543 Effet d'Impôt - -\nTotal dettes courantes 6 656 519 560 6 618 047 488 Total autres éléments du résultat global (après impôt) - -\nTOTAL PASSIF 20 587 484 498 20 582 957 828 Résultat Global 188 354 593 11 605 001\nDont part du groupe 174 706 906 37 522 522\nDont part des intérêts minoritaires 13 647 687 - 25 917 521\nS.A. au capital de 4 025 512 540.00 Dhs - RC Casablanca 52405\nSiège social : Km 7, route de Rabat- Ain Sebaâ -CASABLANCA - www.groupeaddoha.com – ir.groupeaddoha.com\nCCOOMMMMUUNNIIQQUUÉÉ DDEE PPRREESSSSEE\nRRééssuullttaattss aannnnuueellss 22002231\nSS..AA.. aauu ccaappiittaall ddee 44 002255 551122 554400..0000 DDhhss -- RRCC CCaassaabbllaannccaa 5522440055\nSSiièèggee ssoocciiaall :: KKmm 77,, rroouuttee ddee RRaabbaatt-- AAiinn SSeebbaaââ --CCAASSAABBLLAANNCCAA -- wwwwww..ggrroouuppeeaaddddoohhaa..ccoomm –– iirr..ggrroouuppeeaaddddoohhaa..ccoomm",
    "tables": [
        [
            {
                "": "",
                "COMMUNIQUÉ DE PRESSE\nRésultats annuels 2023": ""
            }
        ],
        [
            {
                "": ""
            }
        ],
        [],
        [],
        [
            {
                "": ""
            }
        ],
        [
            {
                "": "",
                "COMMUNIQUÉ DE PRESSE\nRésultats annuels 2023": ""
            }
        ],
        [],
        [],
        [
            {
                "462\n110\n2022": "2023\n-65\nCash flow d’exploitation\n-154\nCash flow net"
            }
        ],
        [
            {
                "": ""
            },
            {
                "": ""
            },
            {
                "": ""
            },
            {
                "": ""
            },
            {
                "": ""
            },
            {
                "": ""
            },
            {
                "": ""
            },
            {
                "": ""
            },
            {
                "": ""
            }
        ],
        [
            {
                "2022": "12",
                "2023": "188"
            }
        ],
        [
            {
                "": ""
            }
        ],
        [
            {
                "": ""
            }
        ],
        [],
        [],
        [],
        [],
        [
            {
                "ACTIF": "",
                "EXERCICE": "Brut",
                "null": "Net",
                "EXERCICE\nPRECEDENT": "Net"
            }
        ],
        [
            {
                "PASSIF": "",
                "SITUATION\nau 31/12/2023": "",
                "EXERCICE\nPRECEDENT\nau 31/12/2022": ""
            }
        ],
        [
            {
                "A\nC\nT\nI\nF\nI\nM\nM\nO\nB\nI\nL\nI\nS\nÉ": "A\nC\nT\nI\nF\nC\nI\nR\nC\nU\nL\nA\nN\nT",
                "null": ""
            },
            {
                "A\nC\nT\nI\nF\nI\nM\nM\nO\nB\nI\nL\nI\nS\nÉ": "",
                "null": ""
            },
            {
                "A\nC\nT\nI\nF\nI\nM\nM\nO\nB\nI\nL\nI\nS\nÉ": "",
                "null": "5 16 529 296 671,56"
            }
        ],
        [
            {
                "F\nI\nN\nA\nN\nC\nE\nM\nE\nN\nT\nP\nE\nR\nM\nA\nN\nE\nN\nT": "P\nA\nS\nS\nI\nF\nC\nI\nR\nC\nU\nL\nA\nN\nT",
                "null": ""
            },
            {
                "F\nI\nN\nA\nN\nC\nE\nM\nE\nN\nT\nP\nE\nR\nM\nA\nN\nE\nN\nT": "",
                "null": ""
            },
            {
                "F\nI\nN\nA\nN\nC\nE\nM\nE\nN\nT\nP\nE\nR\nM\nA\nN\nE\nN\nT": "",
                "null": "16 529 296 671,56"
            }
        ],
        [
            {
                "": "",
                "NATURE": "",
                "OPERATIONS": "Propres\nà la période\n1",
                "null": "Concernant\nles périodes\nprécedentes\n2",
                "TOTAUX DE\nL'EXERCICE\n3 = 1 + 2": "",
                "TOTAUX DE\nL'EXERCICE\nPRECEDENT\n4": ""
            },
            {
                "": "I\nII\nIII\nIV\nV\nVI\nVII\nVIII\nIX\nX\nXI\nXII\nXIII\nXIV\nXV\nXIV",
                "NATURE": "",
                "OPERATIONS": "",
                "null": "",
                "TOTAUX DE\nL'EXERCICE\n3 = 1 + 2": "",
                "TOTAUX DE\nL'EXERCICE\nPRECEDENT\n4": ""
            },
            {
                "": "",
                "NATURE": "",
                "OPERATIONS": "",
                "null": "",
                "TOTAUX DE\nL'EXERCICE\n3 = 1 + 2": "",
                "TOTAUX DE\nL'EXERCICE\nPRECEDENT\n4": ""
            }
        ],
        [],
        [
            {
                "": "",
                "null": "",
                "COMMUNIQUÉ DE PRESSE\nRésultats annuels 2023": ""
            },
            {
                "": "",
                "null": "",
                "COMMUNIQUÉ DE PRESSE\nRésultats annuels 2023": ""
            },
            {
                "": "",
                "null": "",
                "COMMUNIQUÉ DE PRESSE\nRésultats annuels 2023": ""
            }
        ],
        [
            {
                "": "2 - Comptes consolidés",
                "COMMUNIQUÉ DE PRESSE\nRésultats annuels 2023": ""
            }
        ],
        [
            {
                "ACTIF MAD": "Immobilisations incorporelles 3 079 543 3 901 221\nImmobilisations corporelles 524 336 167 590 088 507\nImmeubles de placement 156 891 349 100 432 665\nTitres mis en équivalence 1 384 821 1 403 973\nAutres actifs financiers 4 613 333 5 812 822\n- Dont prêts et créances 4 613 332 5 812 822\n- Dont actifs financiers détenus jusqu'à échéance 0 0\n- Dont titres disponibles à la vente 0 0\nActifs d’impôts différés 873 102 802 967 987 111\nAutres actifs non courants 0 56 171",
                "31.12.2023": "",
                "31.12.2022": ""
            },
            {
                "ACTIF MAD": "Total Actifs non courants 1 563 408 015 1 669 682 471",
                "31.12.2023": "",
                "31.12.2022": ""
            },
            {
                "ACTIF MAD": "Stocks et encours 14 997 018 080 14 337 304 756\nCréances clients 1 456 841 825 2 185 494 596\nAutres créances courantes nettes 2 213 600 593 2 175 879 399\nAutres actifs financiers 0 0\n-Dont actifs financiers AFS 0 0\n-Dont prêts et créances nets 0 0\n-Dont actifs financiers détenus jusqu'à échéances 0 0\nTrésorerie et équivalent de trésorerie 356 615 984 214 596 605",
                "31.12.2023": "",
                "31.12.2022": ""
            },
            {
                "ACTIF MAD": "Total Actifs courants 19 024 076 483 18 913 275 357",
                "31.12.2023": "",
                "31.12.2022": ""
            },
            {
                "ACTIF MAD": "TOTAL ACTIF 20 587 484 498 20 582 957 828",
                "31.12.2023": "",
                "31.12.2022": ""
            }
        ],
        [
            {
                "EN MAD": "Chiffre d'affaires 2 134 135 320 1 377 780 080\nAutres produits de l'activité 459 622 563 461 624 301\nProduits des activités ordinaires 2 593 757 882 1 839 404 381\nAchats consommés -2 097 675 163 -1 459 680 472\nFrais de personnel -166 868 974 -155 336 950\nImpôts et taxes -25 432 990 -19 753 091\nAmortissements et provisions d'exploitation -660 453 105 649 947\nAutres produits et charges d'exploitation -159 279 789 -183 599 869\nCharges d'exploitation courantes -2 449 917 369 -1 712 720 434",
                "31.12.2023": "",
                "31.12.2022": ""
            },
            {
                "EN MAD": "Résultat d'exploitation courant 143 840 513 126 683 947",
                "31.12.2023": "",
                "31.12.2022": ""
            },
            {
                "EN MAD": "Cessions d'actifs 950 786 1 421 136\nCharges de restructuration 0 0\nCessions de filiales et participations 0 0\nRésultats sur instruments financiers 0 0\nAutres produits et charges d'exploitation non courants 63 209 333 -18 999 337\nAutres produits et charges d'exploitation 64 160 119 -17 578 201",
                "31.12.2023": "",
                "31.12.2022": ""
            },
            {
                "EN MAD": "Résultat des activités opérationnelles 208 000 632 109 105 746",
                "31.12.2023": "",
                "31.12.2022": ""
            },
            {
                "EN MAD": "Coût de l'endettement financier net -290 522 394 -268 130 030\nAutres produits financiers 167 883 097 149 801 990",
                "31.12.2023": "",
                "31.12.2022": ""
            },
            {
                "EN MAD": "Autres charges financières 206 007 927 -5 079 495",
                "31.12.2023": "",
                "31.12.2022": ""
            }
        ],
        [
            {
                "PASSIF MAD": "Capital 4 025 512 540 4 025 512 540\nPrimes d'émission et de fusion 3 567 681 085 3 034 811 680\nRéserves consolidées 1 290 205 477 1 697 376 811\nRésultats consolidés 174 706 906 37 522 522\nEcarts de conversion 15 571 740 25 654 258\nCapitaux propres part du groupe 9 073 677 748 8 820 877 811\nRéserves minoritaires 818 415 578 848 428 272\nRésultat minoritaire 13 647 687 -25 917 521\nCapitaux propres part des minoritaires 832 063 265 822 510 752",
                "31.12.2023": "",
                "31.12.2022": ""
            },
            {
                "PASSIF MAD": "Capitaux propres d'ensemble 9 905 741 013 9 643 388 563",
                "31.12.2023": "",
                "31.12.2022": ""
            },
            {
                "PASSIF MAD": "Dettes financières non courantes : 3 653 625 185 3 851 840 394\n-Dont dettes envers les établissements de crédit 2 475 370 750 2 555 109 019\n-Dont dettes représentées par un titre 1 178 254 435 1 296 731 375\nProvisions non courantes 37 533 330 37 298 251\nAvantages au personnel 0 0\nAutres passifs non courants 18 123 245 158 327 871\nImpôt différé passif 315 942 165 274 055 262",
                "31.12.2023": "",
                "31.12.2022": ""
            },
            {
                "PASSIF MAD": "Total des passifs non courants 4 025 223 925 4 321 521 778",
                "31.12.2023": "",
                "31.12.2022": ""
            },
            {
                "PASSIF MAD": "Provisions courantes 4 691 855 5 671 053\nDettes financières courantes : 1 025 940 124 993 866 082\n-Dont dettes envers les établissements de crédit 1 025 940 124 993 866 082\n-Dont dettes représentées par un titre 0 0\nDettes fournisseurs 1 733 558 009 1 675 625 810\nAutres passifs courants 3 892 329 571 3 942 884 543",
                "31.12.2023": "",
                "31.12.2022": ""
            },
            {
                "PASSIF MAD": "Total dettes courantes 6 656 519 560 6 618 047 488",
                "31.12.2023": "",
                "31.12.2022": ""
            },
            {
                "PASSIF MAD": "TOTAL PASSIF 20 587 484 498 20 582 957 828",
                "31.12.2023": "",
                "31.12.2022": ""
            }
        ],
        [
            {
                "Intérêts minoritaires -13 647 687 25 917 521": "Résultat net - Part du groupe 174 706 906 37 522 522"
            }
        ],
        [],
        [],
        [
            {
                "Autres éléments du résultat global\nEcart de conversion - -\nRéévaluation des instruments dérivés de couverture - -\nRéévaluation des actifs financiers disponibles à la vente - -\nRéévaluation des immobilisations - -\nEcart actuariels sur les régimes à préstations définies - -\nQuote-part du résultat global des sociétés mises\nen équivalence, net d'impôt - -\nEffet d'Impôt - -\nTotal autres éléments du résultat global (après impôt) - -": "Résultat Global 188 354 593 11 605 001"
            },
            {
                "Autres éléments du résultat global\nEcart de conversion - -\nRéévaluation des instruments dérivés de couverture - -\nRéévaluation des actifs financiers disponibles à la vente - -\nRéévaluation des immobilisations - -\nEcart actuariels sur les régimes à préstations définies - -\nQuote-part du résultat global des sociétés mises\nen équivalence, net d'impôt - -\nEffet d'Impôt - -\nTotal autres éléments du résultat global (après impôt) - -": "Dont part du groupe 174 706 906 37 522 522"
            },
            {
                "Autres éléments du résultat global\nEcart de conversion - -\nRéévaluation des instruments dérivés de couverture - -\nRéévaluation des actifs financiers disponibles à la vente - -\nRéévaluation des immobilisations - -\nEcart actuariels sur les régimes à préstations définies - -\nQuote-part du résultat global des sociétés mises\nen équivalence, net d'impôt - -\nEffet d'Impôt - -\nTotal autres éléments du résultat global (après impôt) - -": "Dont part des intérêts minoritaires 13 647 687 - 25 917 521"
            }
        ],
        [
            {
                "": "",
                "CCOOMMMMUUNNIIQQUUÉÉ DDEE PPRREESSSSEE\nRRééssuullttaattss aannnnuueellss 22002231": ""
            }
        ],
        [
            {
                "": "",
                "null": ""
            }
        ]
    ]
}