{
    "text": "RÉSULTATS ANNUELS 2023\nLe conseil d’administration d’AFMA s’est réuni le jeudi 21 mars 2024, sous la présidence de\nFaridBensaid,pourexaminerl’activitédugroupeAFMAetarrêterlescomptesdel’exercice2023.\nCHIFFRES CLÉS\nComptesconsolidésIFRS(enMDH) 2023 2022 Variation\nChiffred'affaires 258,8 243,7 6%\nEBITDA 122,7 115,3 6%\nRésultatd'exploitationcourant 105,8 99,7 6%\nRésultatnetconsolidé 62,5 61,5 2%\nRésultatnetpartdugroupe 59,9 59,3 1%\nRNPGretraitédechargesexceptionnelles 62,1 59,3 5%\nComptessociaux(enMDH) 2023 2022 Variation\nRésultatnet 57,8 54,6 6%\nRNretraitédechargesexceptionnelles 59,7 54,6 9%\nLe groupe AFMA maintient sa dynamique de croissance en enregistrant un chiffre d'affaires consolidé de 258,8 MDH\nen2023,comparéà243,7MDHen2022,cequireprésenteunecroissancede6%.\nLe résultat d'exploitation courant consolidé a également enregistré une augmentation de 6%, passant de 99,7 MDH\nen2022à105,8MDHen2023.\nLerésultatnetconsolidés'établità62,5MDHcontre61,5MDHen2022,soitunehaussede2%.\nLerésultatnetpartdugroupeaatteint60MDH,enregistrantainsiunehaussede1%parrapportàl'annéeprécédente.\nRetraité de charges exceptionnelles, le RNPG a atteint 62 MDH, enregistrant une croissance de 5% par rapport à l'année\nprécédente.\nLerésultatnetsociald’AFMASAs'estélevéà57,8MDH,enregistrantunecroissancede6%parrapportàl'exercice2022.\nLe conseil d’administration a décidé de proposer à l’assemblée générale ordinaire la distribution de dividendes\nàhauteurde55MDH,soit55dirhamsparaction.\nAFMAmaintient,ainsi,sapolitiquedecroissanceetsapositiondeleadersurlemarchénationalducourtageenassurance.\nCHIFFRE D’AFFAIRES RÉSULTAT NET RÉSULTAT NET\nCONSOLIDÉ PART DU GROUPE SOCIAL\n+5% +9%\n+6% +1% +6%\n244 259 59 60 62 58 60\n54\n2022 2023 2022 2023 2023 retraité 2022 2023 2023\nretraité\nLe communiqué financier annuel 2023 est disponible sur notre site internet : https://afma.ma/communication-financiere/\n© 2024 AFMA ASSUREUR CONSEIL\nUne entreprise de\nfinance@afmagroup.ma —+212 522 428 000\nComptes sociaux au 31 décembre 2023\nBILAN ACTIF BILAN PASSIF\n31/12/2023 31/12/2022 En MAD 31/12/2023 31/12/2022\nEn MAD Brut Amortissements Net Net\nprovisions CAPITAUX PROPRES\nIMMOBILISATION EN NON-VALEUR (A) 10 712 475,63 7 907 864,53 2 804 611,10 3 701 164,30\n* Frais préliminaires * Capital social ou personnel (1) 10 000 000,00 10 000 000,00\n* Charges à répartir sur plusieurs exercices 10 712 475,63 7 907 864,53 2 804 611,10 3 701 164,30 moins : actionnaires, capital souscrit non appelé\n* Primes de remboursements des obligations F capital appelé……………………………\nIMMOBILISATIONS INCORPORELLES (B) 13 406 267,45 3 613 358,65 9 792 908,80 5 425 358,77 I dont versé ......................................\n* Immobilisations en recherche et développement N * Primes d'émission, de fusion d'apport\nA C * * B Fore nv de st cs o, mm mar eq ru ce ias l, droits et valeurs similaires 12 173 254,77 3 613 358,65 8 559 896,12 5 425 358,77 A * Ecarts de réevaluation\nT * Autres immobilisations 1 233 012,68 1 233 012,68 N * Réserves légales 1 000 000,00 1 000 000,00\nI IMMOBILISATIONS CORPORELLES (C) 43 561 287,10 25 225 945,92 18 335 341,18 16 242 817,45 C * Réserves diverses\nF * Terrains E * Reports à nouveau (2) 48 015,96 464 703,09\nI * Constructions M * Résultats nets en instances d'affectation (2)\nM * Installations techniques, matériel et outillage 430 200,00 385 750,00 44 450,00 46 010,00 E * Résultat net de l'exercice (2) 57 839 036,82 54 583 312,87\nM * Matériel de transport 474 922,54 242 417,54 232 505,00 546 616,70 N Total des capitaux propres (A) 68 887 052,79 66 048 015,96\nO * Mobilier,matériel bureau et aménagements divers 41 370 041,59 24 597 778,38 16 772 263,21 13 415 951,17 T CAPITAUX PROPRES ASSIMILES (B) 800 000,00\nB * Autres Immobilis, corporelles\nI * Immobilis, corporelles en cours 1 286 122,97 1 286 122,97 2 234 239,58 E * Subventions d'investissement\nL R * Provisions réglementées 800 000,00\nIMMOBILISATIONS FINANCIERES (D) 79 830 407,24 79 830 407,24 79 414 924,04\nI * Prêts immobiliers M DETTES DE FINANCEMENTS (C) 21 852 929,93 25 155 284,57\nS E * Autres créances financières 154 684,45 154 684,45 139 201,25 A * Emprunts obligatoires\n* Titres de participation 79 675 722,79 79 675 722,79 79 275 722,79 N * Autres dettes de financements 21 852 929,93 25 155 284,57\n* Autres titres immobilisés E PROVISIONS DURABLES POUR RISQUES ET CHARGES (D)\nECARTS DE CONVERSION -ACTIF (E) N * Provisions pour risques\n* Diminution des créances immobilisées T * Provisions pour charges\n* Augmentation des dettes financières\nECARTS DE CONVERSION -PASSIF (E)\nTotal I ( A+B+C+D+E) 147 510 437,42 36 747 169,10110 763 268,32104 784 264,56\n* Augmentation des créances immobilisées\nSTOCKS (F)\n* Marchandises * Diminution des dettes de financements\nA * Matières et fournitures consommables Total I (A+B+C+D+E) 91 539 982,72 91 203 300,53\nC * Produits en cours DETTES DU PASSIF CIRCULANT (F) 581 736 239,72542 408 307,69\nT * Produits intérmédiaires et produits résiduels P * Fournisseurs et comptes rattachés 468 916 391,76 443 041 474,87\nI * Produits finis A * Clients créditeurs avances et acomptes 44 267 746,62 38 724 388,20\nF CREANCES DE L'ACTIF CIRCULANT (G) 601 536 056,81 17 978 850,71583 557 206,10546 718 266,87 S * Personnel 3 560 278,31 2 920 827,51\nC * * F Co liu er nn ti s es t. cd oé mb pit te eu sr s r, a ta tv aa cn hc ée ss et acomptes 4923 58 33 77 86 35 85 ,, 22 82 17 81 07 17 61 86 55 ,, 33 92 4743 76 36 60 14 58 29 ,, 89 90 4463 24 16 48 21 13 20 ,, 50 01 S * Organismes sociaux 2 720 200,93 2 981 556,92\nI * Personnel 295 904,34 295 904,34 302 069,33 I * Etat 6 472 341,46 6 133 497,30\nR C * * E Ct oa mt ptes d'associés 1 042 598,65 1 042 598,65 916 838,71 F * * C Auom trep st e Cs r éd a'a ns cs io ec rsié s 54 829 651,54 48 313 646,57\nU\nL * Autres Débiteurs 102 665 394,59 102 665 394,59 94 965 933,38 C * Comptes de régularisation Passif 969 629,10 292 916,32\nA * Comptes de régularisation Actif 1 156 665,73 1 156 665,73 851 082,94 I AUTRES PROVISIONS POUR RISQUES ET CHARGES (G) 208 996,62 208 996,62\nN TITRES & VALEUR DE PLACEMENT (H) 82 402,20 82 402,20 R ECARTS DE CONVERSION -PASSIF (Eléments circulants) (H)\nT ECARTS DE CONVERSION -ACTIF (I) C Total II ( F+G+H) 581 945 236,34542 617 304,31\nEléments circulants)\nU TRESORERIE -PASSIF 26 858 990,31 21 373 032,82\nTotal II ( F+G+H+I) 601 618 459,01 17 978 850,71583 639 608,30546 718 266,87\nT R T CR hèE qS uO eR s E eR t I vE a- leA urC sT àI F encaisser 5 9 24 11 0 3 53 72 8, ,7 55 6 5 9 24 11 0 3 53 72 8, ,7 55 6 3 691 106,23 RT * * C Cr ré éd di it ts s d d' ee s trc éo sm op rete rie\nE Banques, T.G et C.C.P 5 724 175,05 5 724 175,05 3 686 322,91 E * Banques ( soldes créditeurs ) 26 858 990,31 21 373 032,82\nS Caisses, Régies d'avance et accréditifs 6 579,14 6 579,14 4 783,32 S Total III 26 858 990,31 21 373 032,82\nO Total III 5 941 332,75 5 941 332,75 3 691 106,23\nTOTAL GENERAL I + II + III 755 070 229,18 54 726 019,81700 344 209,37655 193 637,66 O TOTAL GENERAL I+II+III 700 344 209,37655 193 637,66\nCOMPTE DE PRODUITS ET CHARGES\nEn MAD OPERATIONS TOTAUX DE TOTAUX DE\nPropres à Concernant les L'EXERCICE L'EXERCICE\nNATURE L’exercice exe précédents PRECEDENT\n1 2 3 = 1+2 4\nI PRODUITS D'EXPLOITATION\n* Ventes de marchandises (en l'Etat)\nE * Ventes de biens et services produits 215 365 348,43 215 365 348,43 204 434 227,30\nX Chiffre d'affaires 215 365 348,43 215 365 348,43204 434 227,30\nP * Variation stocks de produits (+) (1)\n* Immobilisations produites par l'entreprise pour\nL elle-même\nI * Subventions d'exploitation\nT * Autres produits d'exploitation 258 191,52 258 191,52 228 591,74\nA * Reprises expl. : transferts de charges 1 787 076,00 1 787 076,00 1 665 501,32\nT TOTAL I 217 410 615,95 217 410 615,95206 328 320,36\nI II CHARGES D'EXPLOITATION\nO * Achats revendus (2) de marchandises\nN * Achats consommés (2) de matière et fournitures 10 469 209,89 10 469 209,89 7 765 426,97\n* Autres charges externes 62 597 645,69 62 597 645,69 56 769 708,81\n* Impôts et taxes 1 989 309,77 1 989 309,77 1 863 845,38\n* Charges de personnel 52 062 723,71 52 062 723,71 53 196 426,63\n* Autres charges d'exploitation 500 000,00 500 000,00 500 000,00\n* dotations d'exploitation 9 440 560,77 9 440 560,77 9 064 955,57\nTOTAL II 137 059 449,83 137 059 449,83129 160 363,36\nIII RESULTAT D'EXPLOITATION (I -II) 80 351 166,12 77 167 957,00\nIV PRODUITS FINANCIERS\nF * Produits des titres de participation et autres titres\nI immobilisés 7 001 518,00 7 001 518,00 5 312 896,67\nN * Gains de change 9 708,82\nA * Intérêts et autres produits financiers 2 532 527,23 2 532 527,23 1 792 798,07\nN * Reprises financières, transferts de charges\nC TOTAL IV 9 534 045,23 9 534 045,23 7 115 403,56\nE V CHARGES FINANCIERES\nM * Charges d'intérêts 3 525 885,38 3 525 885,38 2 205 020,25\nE * Pertes de change 28 298,36 28 298,36 32 016,29\nN * Autres charges financières\nT * dotations financières\nTOTAL V 3 554 183,74 3 554 183,74 2 237 036,54\nVI RESULTAT FINANCIER (IV -V) 5 979 861,49 4 878 367,02\nVIIRESULTAT COURANT (III + VI) 86 331 027,61 82 046 324,02\nVIIRESULTAT COURANT (reports) 86 331 027,61 82 046 324,02\nVIIIPRODUIT NON COURANTS\nN * Produits des cessions d'immobilisation 5 000,00 5 000,00 48 200,00\nO * Subventions d'équilibre\nN * Reprise sur subventions d'investissement\n* Autres produits non courants 29 288,82 29 288,82 1 035 546,90\nC * Reprises non courantes : transferts de charges\nO TOTAL VIII 34 288,82 34 288,82 1 083 746,90\nR IX CHARGES NON COURANTS\n* Valeurs nettes d'amortissements des\nA immobilisations cédées 184 166,70 184 166,70\nN * Subventions accordées\nT * Autres charges non courantes 4 822 437,91 15 000,00 4 837 437,91 4 246 261,05\n* Dotations non courantes aux amortissements et 800 000,00 800 000,00\naux provisions\nTOTAL IX 5 806 604,61 15 000,00 5 821 604,61 4 246 261,05\nX RESULTAT NON COURANT(VIII-IX) -5 787 315,79 -3 162 514,15\nXI RESULTAT AVANT IMPOTS (VII+-X) 80 543 711,82 78 883 809,87\nXIIIMPOTS SUR LES RESULTATS 22 704 675,00 22 704 675,00 24 300 497,00\nXIIIRESULTAT NET (XI -XII) 57 839 036,82 54 583 312,87\nXIVTOTAL DES PRODUITS (I + IV + VIII ) 226 978 950,00214 527 470,82\nXVTOTAL DES CHARGES (II + V + IX + XII) 169 139 913,18159 944 157,95\nXVIRESULTAT NET 57 839 036,82 54 583 312,87\n© 2024 AFMA ASSUREUR CONSEIL\nUne entreprise de\nfinance@afmagroup.ma —+212 522 428 000\nComptes consolidés au 31 décembre 2023\nACTIF CONSOLIDE PASSIF CONSOLIDE\nEn MAD 31/12/2023 31/12/2022 En MAD 31/12/2023 31/12/2022\nGoodwill 68 733 760 68 733 760 Capital 10 000 000 10 000 000\nImmobilisations incorporelles 14 259 763 8 984 777 Réserves (*) (19 204 333) (23 534 468)\nRésultats 59 995 816 59 317 596\nImmobilisations corporelles (*) 83 429 790 85 177 009\nEcarts de conversion 44 151 13 472\nImmeubles de placement Capitaux propres part du groupe 50 835 634 45 796 600\nTitres mis en équivalence Réserves minoritaires 1 598 801 1 315 294\nRésultat minoritaire 2 477 432 2 128 095\nAutres actifs financiers\nEcarts de conversion (88) 8 617\n-Dont prêts et créances 540 222 532 102 Capitaux propres part des minoritaires 4 076 145 3 452 006\n-Dont actifs financiers détenus jusqu’à échéance Capitaux propres d'ensemble 54 911 779 49 248 606\nDettes financières non courantes : 92 774 914 104 765 555\n-Dont actifs financiers évalués à la juste valeur\n-Dont dettes envers les établissements de crédit 18 361 799 21 848 572\nActifs d’impôts différés 6 225 158 9 177 565 -Dont obligations locatives non courantes IFRS 16 74 413 115 82 916 983\nAutres actifs non courants Provisions non courantes\nAvantages au personnel 358 816 268 342\nTotal Actifs non courants 173 188 692 172 605 213\nImpôt différé passif 230 348 97 785\nStocks et encours net Total des passifs non courants 93 364 079 105 131 682\nCréances clients net 640 027 858 596 212 795 Provisions courantes 360 976 360 976\nDettes financières courantes : 56 596 239 42 849 600\nAutres créances courantes nettes 110 525 155 106 904 997\n-Dont dettes envers les établissements de crédit 45 557 331 32 767 841\nAutres actifs financiers -Dont obligations locatives non courantes IFRS 16 11 038 908 10 081 759\nTrésorerie et équivalent de trésorerie 19 664 112 11 097 276 Dettes fournisseurs 641 086 790 603 444 191\nAutres passifs courants 97 085 955 85 785 226\nTotal Actifs courants 770 217 125 714 215 068\nTotal dettes courantes 795 129 960 732 439 993\nTOTAL ACTIF 943 405 817 886 820 280 TOTAL PASSIF 943 405 817 886 820 280\nGroupe AFMA % de Type Méthode\nEntité Activité Pays\nen MAD 31/12/2023 31/12/2022 contrôle contrôle consolidation\nChiffre d'affaires 258 770 230 243 691 127\nAFMA SA Courtage en assurance Maroc Mère Mère Mère\nAutres produits de l'activité 11 084 13 026\nProduits des activités ordinaires 258 781 315 243 704 153 AFMA RABAT Courtage en assurance Maroc 100 CE IG\nAchats consommés (67 454 487) (59 790 835)\nCharges de personnel (65 850 338) (66 211 732) AFMA MARRAKECH Courtage en assurance Maroc 99.87 CE IG\nImpôts et taxes (2 741 458) (2 388 302)\nAFMA TANGER Courtage en assurance Maroc 99.8 CE IG\nAutres produits et charges d'exploitation\nDotations nettes aux amortissements,\n(16 926 806) (15 563 770) AFMA AGADIR Courtage en assurance Maroc 87.9 CE IG\ndépréciations et aux provisions\nCharges des activités ordinaires (152 973 090) (143 954 638)\nAFMA FES Courtage en assurance Maroc 99.93 CE IG\nRésultat d'exploitation courant 105 808 225 99 749 515\nAutres produits & charges d'exploitation non MCA Courtage en assurance Maroc 100 CE IG\n(6 519 341) (3 141 227)\ncourants\nRésultat d'exploitation 99 288 884 96 608 288 AFMA OUJDA Courtage en assurance Maroc 99 CE IG\nCoût de l'endettement net (6 816 627) (5 820 139)\nAutres produits financiers AFMA LAAYOUNE Courtage en assurance Maroc 100 CE IG\nAutres charges financières 454 692 108 658\nCAM Courtage en assurance Maroc 100 CE IG\nRésultat financier (6 361 935) (5 711 481)\nRésultat avant impôt des entreprises 92 926 949 90 896 808 AFMA AFRICA Courtage en assurance Maroc 99.6 CE IG\nintégrées\nImpôts sur les sociétés (27 355 542) (28 401 086) AFMA KENITRA Courtage en assurance Maroc 100 CE IG\nImpôt différé (3 098 159) (1 050 031)\nRésultat net des entreprises intégrées 62 473 248 61 445 691 SAFE ASSUR Courtage en assurance Maroc 51 CE IG\nPart dans les résultats des sociétés mises en\néquivalence ASSURANCE AL FAHD Courtage en assurance Maroc 70 CE IG\nRésultat net des activités poursuivies 62 473 248 61 445 691\nACR-AFMA Courtage en assurance Cote d’ivoire 61 CE IG\nRésultat net des activités abandonnées\nRésultat de l'ensemble consolidé 62 473 248 61 445 691\nJEAN BUSNOT MAROC Courtage en assurance Maroc 60 CE IG\nIntérêts minoritaires 2 477 432 2 128 095\nRésultat net -Part du Groupe 59 995 816 59 317 596 AFMA DAKHLA Courtage en assurance Maroc 100 CE IG\nRésultat de base par action(En MAD) 60,00 59,32\nAFMA MEKNES Courtage en assurance Maroc 100 CE IG\nRésultat dilué par action (En MAD) 60,00 59,32\n© 2024 AFMA ASSUREUR CONSEIL\nUne entreprise de\nfinance@afmagroup.ma —+212 522 428 000",
    "tables": [
        [
            {
                "": "",
                "null": "",
                "RÉSULTATS ANNUELS 2023\nLe conseil d’administration d’AFMA s’est réuni le jeudi 21 mars 2024, sous la présidence de\nFaridBensaid,pourexaminerl’activitédugroupeAFMAetarrêterlescomptesdel’exercice2023.\nCHIFFRES CLÉS\nComptesconsolidésIFRS(enMDH) 2023 2022 Variation\nChiffred'affaires 258,8 243,7 6%\nEBITDA 122,7 115,3 6%\nRésultatd'exploitationcourant 105,8 99,7 6%\nRésultatnetconsolidé 62,5 61,5 2%\nRésultatnetpartdugroupe 59,9 59,3 1%\nRNPGretraitédechargesexceptionnelles 62,1 59,3 5%\nComptessociaux(enMDH) 2023 2022 Variation\nRésultatnet 57,8 54,6 6%\nRNretraitédechargesexceptionnelles 59,7 54,6 9%\nLe groupe AFMA maintient sa dynamique de croissance en enregistrant un chiffre d'affaires consolidé de 258,8 MDH\nen2023,comparéà243,7MDHen2022,cequireprésenteunecroissancede6%.\nLe résultat d'exploitation courant consolidé a également enregistré une augmentation de 6%, passant de 99,7 MDH\nen2022à105,8MDHen2023.\nLerésultatnetconsolidés'établità62,5MDHcontre61,5MDHen2022,soitunehaussede2%.\nLerésultatnetpartdugroupeaatteint60MDH,enregistrantainsiunehaussede1%parrapportàl'annéeprécédente.\nRetraité de charges exceptionnelles, le RNPG a atteint 62 MDH, enregistrant une croissance de 5% par rapport à l'année\nprécédente.\nLerésultatnetsociald’AFMASAs'estélevéà57,8MDH,enregistrantunecroissancede6%parrapportàl'exercice2022.\nLe conseil d’administration a décidé de proposer à l’assemblée générale ordinaire la distribution de dividendes\nàhauteurde55MDH,soit55dirhamsparaction.\nAFMAmaintient,ainsi,sapolitiquedecroissanceetsapositiondeleadersurlemarchénationalducourtageenassurance.\nCHIFFRE D’AFFAIRES RÉSULTAT NET RÉSULTAT NET\nCONSOLIDÉ PART DU GROUPE SOCIAL\n+5% +9%\n+6% +1% +6%\n244 259 59 60 62 58 60\n54\n2022 2023 2022 2023 2023 retraité 2022 2023 2023\nretraité\nLe communiqué financier annuel 2023 est disponible sur notre site internet : https://afma.ma/communication-financiere/": "© 2024 AFMA ASSUREUR CONSEIL\nUne entreprise de\nfinance@afmagroup.ma —+212 522 428 000"
            }
        ],
        [
            {
                "ComptesconsolidésIFRS(enMDH)": "Chiffred'affaires",
                "2023": "258,8",
                "2022": "243,7",
                "Variation": "6%"
            },
            {
                "ComptesconsolidésIFRS(enMDH)": "EBITDA",
                "2023": "122,7",
                "2022": "115,3",
                "Variation": "6%"
            },
            {
                "ComptesconsolidésIFRS(enMDH)": "Résultatd'exploitationcourant",
                "2023": "105,8",
                "2022": "99,7",
                "Variation": "6%"
            },
            {
                "ComptesconsolidésIFRS(enMDH)": "Résultatnetconsolidé",
                "2023": "62,5",
                "2022": "61,5",
                "Variation": "2%"
            },
            {
                "ComptesconsolidésIFRS(enMDH)": "Résultatnetpartdugroupe",
                "2023": "59,9",
                "2022": "59,3",
                "Variation": "1%"
            },
            {
                "ComptesconsolidésIFRS(enMDH)": "RNPGretraitédechargesexceptionnelles",
                "2023": "62,1",
                "2022": "59,3",
                "Variation": "5%"
            },
            {
                "ComptesconsolidésIFRS(enMDH)": "Comptessociaux(enMDH)",
                "2023": "2023",
                "2022": "2022",
                "Variation": "Variation"
            },
            {
                "ComptesconsolidésIFRS(enMDH)": "Résultatnet",
                "2023": "57,8",
                "2022": "54,6",
                "Variation": "6%"
            },
            {
                "ComptesconsolidésIFRS(enMDH)": "RNretraitédechargesexceptionnelles",
                "2023": "59,7",
                "2022": "54,6",
                "Variation": "9%"
            }
        ],
        [
            {
                "": "",
                "null": "",
                "Comptes sociaux au 31 décembre 2023\nBILAN ACTIF BILAN PASSIF\n31/12/2023 31/12/2022 En MAD 31/12/2023 31/12/2022\nEn MAD Brut Amortissements Net Net\nprovisions CAPITAUX PROPRES\nIMMOBILISATION EN NON-VALEUR (A) 10 712 475,63 7 907 864,53 2 804 611,10 3 701 164,30\n* Frais préliminaires * Capital social ou personnel (1) 10 000 000,00 10 000 000,00\n* Charges à répartir sur plusieurs exercices 10 712 475,63 7 907 864,53 2 804 611,10 3 701 164,30 moins : actionnaires, capital souscrit non appelé\n* Primes de remboursements des obligations F capital appelé……………………………\nIMMOBILISATIONS INCORPORELLES (B) 13 406 267,45 3 613 358,65 9 792 908,80 5 425 358,77 I dont versé ......................................\n* Immobilisations en recherche et développement N * Primes d'émission, de fusion d'apport\nA C * * B Fore nv de st cs o, mm mar eq ru ce ias l, droits et valeurs similaires 12 173 254,77 3 613 358,65 8 559 896,12 5 425 358,77 A * Ecarts de réevaluation\nT * Autres immobilisations 1 233 012,68 1 233 012,68 N * Réserves légales 1 000 000,00 1 000 000,00\nI IMMOBILISATIONS CORPORELLES (C) 43 561 287,10 25 225 945,92 18 335 341,18 16 242 817,45 C * Réserves diverses\nF * Terrains E * Reports à nouveau (2) 48 015,96 464 703,09\nI * Constructions M * Résultats nets en instances d'affectation (2)\nM * Installations techniques, matériel et outillage 430 200,00 385 750,00 44 450,00 46 010,00 E * Résultat net de l'exercice (2) 57 839 036,82 54 583 312,87\nM * Matériel de transport 474 922,54 242 417,54 232 505,00 546 616,70 N Total des capitaux propres (A) 68 887 052,79 66 048 015,96\nO * Mobilier,matériel bureau et aménagements divers 41 370 041,59 24 597 778,38 16 772 263,21 13 415 951,17 T CAPITAUX PROPRES ASSIMILES (B) 800 000,00\nB * Autres Immobilis, corporelles\nI * Immobilis, corporelles en cours 1 286 122,97 1 286 122,97 2 234 239,58 E * Subventions d'investissement\nL R * Provisions réglementées 800 000,00\nIMMOBILISATIONS FINANCIERES (D) 79 830 407,24 79 830 407,24 79 414 924,04\nI * Prêts immobiliers M DETTES DE FINANCEMENTS (C) 21 852 929,93 25 155 284,57\nS E * Autres créances financières 154 684,45 154 684,45 139 201,25 A * Emprunts obligatoires\n* Titres de participation 79 675 722,79 79 675 722,79 79 275 722,79 N * Autres dettes de financements 21 852 929,93 25 155 284,57\n* Autres titres immobilisés E PROVISIONS DURABLES POUR RISQUES ET CHARGES (D)\nECARTS DE CONVERSION -ACTIF (E) N * Provisions pour risques\n* Diminution des créances immobilisées T * Provisions pour charges\n* Augmentation des dettes financières\nECARTS DE CONVERSION -PASSIF (E)\nTotal I ( A+B+C+D+E) 147 510 437,42 36 747 169,10110 763 268,32104 784 264,56\n* Augmentation des créances immobilisées\nSTOCKS (F)\n* Marchandises * Diminution des dettes de financements\nA * Matières et fournitures consommables Total I (A+B+C+D+E) 91 539 982,72 91 203 300,53\nC * Produits en cours DETTES DU PASSIF CIRCULANT (F) 581 736 239,72542 408 307,69\nT * Produits intérmédiaires et produits résiduels P * Fournisseurs et comptes rattachés 468 916 391,76 443 041 474,87\nI * Produits finis A * Clients créditeurs avances et acomptes 44 267 746,62 38 724 388,20\nF CREANCES DE L'ACTIF CIRCULANT (G) 601 536 056,81 17 978 850,71583 557 206,10546 718 266,87 S * Personnel 3 560 278,31 2 920 827,51\nC * * F Co liu er nn ti s es t. cd oé mb pit te eu sr s r, a ta tv aa cn hc ée ss et acomptes 4923 58 33 77 86 35 85 ,, 22 82 17 81 07 17 61 86 55 ,, 33 92 4743 76 36 60 14 58 29 ,, 89 90 4463 24 16 48 21 13 20 ,, 50 01 S * Organismes sociaux 2 720 200,93 2 981 556,92\nI * Personnel 295 904,34 295 904,34 302 069,33 I * Etat 6 472 341,46 6 133 497,30\nR C * * E Ct oa mt ptes d'associés 1 042 598,65 1 042 598,65 916 838,71 F * * C Auom trep st e Cs r éd a'a ns cs io ec rsié s 54 829 651,54 48 313 646,57\nU\nL * Autres Débiteurs 102 665 394,59 102 665 394,59 94 965 933,38 C * Comptes de régularisation Passif 969 629,10 292 916,32\nA * Comptes de régularisation Actif 1 156 665,73 1 156 665,73 851 082,94 I AUTRES PROVISIONS POUR RISQUES ET CHARGES (G) 208 996,62 208 996,62\nN TITRES & VALEUR DE PLACEMENT (H) 82 402,20 82 402,20 R ECARTS DE CONVERSION -PASSIF (Eléments circulants) (H)\nT ECARTS DE CONVERSION -ACTIF (I) C Total II ( F+G+H) 581 945 236,34542 617 304,31\nEléments circulants)\nU TRESORERIE -PASSIF 26 858 990,31 21 373 032,82\nTotal II ( F+G+H+I) 601 618 459,01 17 978 850,71583 639 608,30546 718 266,87\nT R T CR hèE qS uO eR s E eR t I vE a- leA urC sT àI F encaisser 5 9 24 11 0 3 53 72 8, ,7 55 6 5 9 24 11 0 3 53 72 8, ,7 55 6 3 691 106,23 RT * * C Cr ré éd di it ts s d d' ee s trc éo sm op rete rie\nE Banques, T.G et C.C.P 5 724 175,05 5 724 175,05 3 686 322,91 E * Banques ( soldes créditeurs ) 26 858 990,31 21 373 032,82\nS Caisses, Régies d'avance et accréditifs 6 579,14 6 579,14 4 783,32 S Total III 26 858 990,31 21 373 032,82\nO Total III 5 941 332,75 5 941 332,75 3 691 106,23\nTOTAL GENERAL I + II + III 755 070 229,18 54 726 019,81700 344 209,37655 193 637,66 O TOTAL GENERAL I+II+III 700 344 209,37655 193 637,66\nCOMPTE DE PRODUITS ET CHARGES\nEn MAD OPERATIONS TOTAUX DE TOTAUX DE\nPropres à Concernant les L'EXERCICE L'EXERCICE\nNATURE L’exercice exe précédents PRECEDENT\n1 2 3 = 1+2 4\nI PRODUITS D'EXPLOITATION\n* Ventes de marchandises (en l'Etat)\nE * Ventes de biens et services produits 215 365 348,43 215 365 348,43 204 434 227,30\nX Chiffre d'affaires 215 365 348,43 215 365 348,43204 434 227,30\nP * Variation stocks de produits (+) (1)\n* Immobilisations produites par l'entreprise pour\nL elle-même\nI * Subventions d'exploitation\nT * Autres produits d'exploitation 258 191,52 258 191,52 228 591,74\nA * Reprises expl. : transferts de charges 1 787 076,00 1 787 076,00 1 665 501,32\nT TOTAL I 217 410 615,95 217 410 615,95206 328 320,36\nI II CHARGES D'EXPLOITATION\nO * Achats revendus (2) de marchandises\nN * Achats consommés (2) de matière et fournitures 10 469 209,89 10 469 209,89 7 765 426,97\n* Autres charges externes 62 597 645,69 62 597 645,69 56 769 708,81\n* Impôts et taxes 1 989 309,77 1 989 309,77 1 863 845,38\n* Charges de personnel 52 062 723,71 52 062 723,71 53 196 426,63\n* Autres charges d'exploitation 500 000,00 500 000,00 500 000,00\n* dotations d'exploitation 9 440 560,77 9 440 560,77 9 064 955,57\nTOTAL II 137 059 449,83 137 059 449,83129 160 363,36\nIII RESULTAT D'EXPLOITATION (I -II) 80 351 166,12 77 167 957,00\nIV PRODUITS FINANCIERS\nF * Produits des titres de participation et autres titres\nI immobilisés 7 001 518,00 7 001 518,00 5 312 896,67\nN * Gains de change 9 708,82\nA * Intérêts et autres produits financiers 2 532 527,23 2 532 527,23 1 792 798,07\nN * Reprises financières, transferts de charges\nC TOTAL IV 9 534 045,23 9 534 045,23 7 115 403,56\nE V CHARGES FINANCIERES\nM * Charges d'intérêts 3 525 885,38 3 525 885,38 2 205 020,25\nE * Pertes de change 28 298,36 28 298,36 32 016,29\nN * Autres charges financières\nT * dotations financières\nTOTAL V 3 554 183,74 3 554 183,74 2 237 036,54\nVI RESULTAT FINANCIER (IV -V) 5 979 861,49 4 878 367,02\nVIIRESULTAT COURANT (III + VI) 86 331 027,61 82 046 324,02\nVIIRESULTAT COURANT (reports) 86 331 027,61 82 046 324,02\nVIIIPRODUIT NON COURANTS\nN * Produits des cessions d'immobilisation 5 000,00 5 000,00 48 200,00\nO * Subventions d'équilibre\nN * Reprise sur subventions d'investissement\n* Autres produits non courants 29 288,82 29 288,82 1 035 546,90\nC * Reprises non courantes : transferts de charges\nO TOTAL VIII 34 288,82 34 288,82 1 083 746,90\nR IX CHARGES NON COURANTS\n* Valeurs nettes d'amortissements des\nA immobilisations cédées 184 166,70 184 166,70\nN * Subventions accordées\nT * Autres charges non courantes 4 822 437,91 15 000,00 4 837 437,91 4 246 261,05\n* Dotations non courantes aux amortissements et 800 000,00 800 000,00\naux provisions\nTOTAL IX 5 806 604,61 15 000,00 5 821 604,61 4 246 261,05\nX RESULTAT NON COURANT(VIII-IX) -5 787 315,79 -3 162 514,15\nXI RESULTAT AVANT IMPOTS (VII+-X) 80 543 711,82 78 883 809,87\nXIIIMPOTS SUR LES RESULTATS 22 704 675,00 22 704 675,00 24 300 497,00\nXIIIRESULTAT NET (XI -XII) 57 839 036,82 54 583 312,87\nXIVTOTAL DES PRODUITS (I + IV + VIII ) 226 978 950,00214 527 470,82\nXVTOTAL DES CHARGES (II + V + IX + XII) 169 139 913,18159 944 157,95\nXVIRESULTAT NET 57 839 036,82 54 583 312,87": "© 2024 AFMA ASSUREUR CONSEIL\nUne entreprise de\nfinance@afmagroup.ma —+212 522 428 000"
            }
        ],
        [
            {
                "BILAN ACTIF": "En MAD",
                "null": "31/12/2022"
            },
            {
                "BILAN ACTIF": "",
                "null": "Net"
            },
            {
                "BILAN ACTIF": "A\nC\nT\nI\nF\nI\nM\nM\nO\nB\nI\nL\nI\nS\nE",
                "null": "3 701 164,30"
            },
            {
                "BILAN ACTIF": "",
                "null": "3 701 164,30"
            },
            {
                "BILAN ACTIF": "",
                "null": ""
            },
            {
                "BILAN ACTIF": "",
                "null": ""
            },
            {
                "BILAN ACTIF": "",
                "null": "5 425 358,77"
            },
            {
                "BILAN ACTIF": "",
                "null": "5 425 358,77"
            },
            {
                "BILAN ACTIF": "",
                "null": ""
            },
            {
                "BILAN ACTIF": "",
                "null": ""
            },
            {
                "BILAN ACTIF": "",
                "null": ""
            },
            {
                "BILAN ACTIF": "",
                "null": "16 242 817,45"
            },
            {
                "BILAN ACTIF": "",
                "null": "46 010,00\n546 616,70\n13 415 951,17\n2 234 239,58"
            },
            {
                "BILAN ACTIF": "",
                "null": ""
            },
            {
                "BILAN ACTIF": "",
                "null": ""
            },
            {
                "BILAN ACTIF": "",
                "null": ""
            },
            {
                "BILAN ACTIF": "",
                "null": ""
            },
            {
                "BILAN ACTIF": "",
                "null": ""
            },
            {
                "BILAN ACTIF": "",
                "null": ""
            },
            {
                "BILAN ACTIF": "",
                "null": "79 414 924,04"
            },
            {
                "BILAN ACTIF": "",
                "null": "139 201,25\n79 275 722,79"
            },
            {
                "BILAN ACTIF": "",
                "null": ""
            },
            {
                "BILAN ACTIF": "",
                "null": ""
            },
            {
                "BILAN ACTIF": "",
                "null": ""
            },
            {
                "BILAN ACTIF": "",
                "null": ""
            },
            {
                "BILAN ACTIF": "",
                "null": ""
            },
            {
                "BILAN ACTIF": "",
                "null": ""
            },
            {
                "BILAN ACTIF": "",
                "null": "104 784 264,56"
            },
            {
                "BILAN ACTIF": "A\nC\nT\nI\nF\nC\nI\nR\nC\nU\nL\nA\nN\nT",
                "null": ""
            },
            {
                "BILAN ACTIF": "",
                "null": ""
            },
            {
                "BILAN ACTIF": "",
                "null": ""
            },
            {
                "BILAN ACTIF": "",
                "null": ""
            },
            {
                "BILAN ACTIF": "",
                "null": ""
            },
            {
                "BILAN ACTIF": "",
                "null": ""
            },
            {
                "BILAN ACTIF": "",
                "null": "546 718 266,87"
            },
            {
                "BILAN ACTIF": "",
                "null": "3 468 130,01\n446 214 212,50\n302 069,33\n916 838,71\n94 965 933,38\n851 082,94"
            },
            {
                "BILAN ACTIF": "",
                "null": ""
            },
            {
                "BILAN ACTIF": "",
                "null": ""
            },
            {
                "BILAN ACTIF": "",
                "null": ""
            },
            {
                "BILAN ACTIF": "",
                "null": ""
            },
            {
                "BILAN ACTIF": "",
                "null": ""
            },
            {
                "BILAN ACTIF": "",
                "null": ""
            },
            {
                "BILAN ACTIF": "",
                "null": ""
            },
            {
                "BILAN ACTIF": "",
                "null": ""
            },
            {
                "BILAN ACTIF": "",
                "null": ""
            },
            {
                "BILAN ACTIF": "",
                "null": "546 718 266,87"
            },
            {
                "BILAN ACTIF": "T\nR\nE\nS\nO",
                "null": "3 691 106,23\n3 686 322,91\n4 783,32"
            },
            {
                "BILAN ACTIF": "",
                "null": ""
            },
            {
                "BILAN ACTIF": "",
                "null": ""
            },
            {
                "BILAN ACTIF": "",
                "null": ""
            },
            {
                "BILAN ACTIF": "",
                "null": "3 691 106,23"
            },
            {
                "BILAN ACTIF": "",
                "null": "655 193 637,66"
            }
        ],
        [
            {
                "BILAN PASSIF": "En MAD",
                "null": "31/12/2022"
            },
            {
                "BILAN PASSIF": "F\nI\nN\nA\nN\nC\nE\nM\nE\nN\nT\nE\nR\nM\nA\nN\nE\nN\nT\nP\nA\nS\nS\nI\nF\nC\nI\nR\nC\nU\nT\nR\nE\nS\nO",
                "null": "10 000 000,00\n1 000 000,00\n464 703,09\n54 583 312,87"
            },
            {
                "BILAN PASSIF": "",
                "null": ""
            },
            {
                "BILAN PASSIF": "",
                "null": ""
            },
            {
                "BILAN PASSIF": "",
                "null": ""
            },
            {
                "BILAN PASSIF": "",
                "null": ""
            },
            {
                "BILAN PASSIF": "",
                "null": ""
            },
            {
                "BILAN PASSIF": "",
                "null": ""
            },
            {
                "BILAN PASSIF": "",
                "null": ""
            },
            {
                "BILAN PASSIF": "",
                "null": ""
            },
            {
                "BILAN PASSIF": "",
                "null": ""
            },
            {
                "BILAN PASSIF": "",
                "null": ""
            },
            {
                "BILAN PASSIF": "",
                "null": ""
            },
            {
                "BILAN PASSIF": "",
                "null": "66 048 015,96"
            },
            {
                "BILAN PASSIF": "",
                "null": ""
            },
            {
                "BILAN PASSIF": "",
                "null": ""
            },
            {
                "BILAN PASSIF": "",
                "null": ""
            },
            {
                "BILAN PASSIF": "",
                "null": "25 155 284,57"
            },
            {
                "BILAN PASSIF": "",
                "null": "25 155 284,57"
            },
            {
                "BILAN PASSIF": "",
                "null": ""
            },
            {
                "BILAN PASSIF": "",
                "null": ""
            },
            {
                "BILAN PASSIF": "",
                "null": ""
            },
            {
                "BILAN PASSIF": "",
                "null": ""
            },
            {
                "BILAN PASSIF": "",
                "null": ""
            },
            {
                "BILAN PASSIF": "",
                "null": "91 203 300,53"
            },
            {
                "BILAN PASSIF": "",
                "null": ""
            },
            {
                "BILAN PASSIF": "",
                "null": ""
            },
            {
                "BILAN PASSIF": "",
                "null": "542 408 307,69"
            },
            {
                "BILAN PASSIF": "",
                "null": "443 041 474,87\n38 724 388,20\n2 920 827,51\n2 981 556,92\n6 133 497,30\n48 313 646,57\n292 916,32"
            },
            {
                "BILAN PASSIF": "",
                "null": ""
            },
            {
                "BILAN PASSIF": "",
                "null": ""
            },
            {
                "BILAN PASSIF": "",
                "null": ""
            },
            {
                "BILAN PASSIF": "",
                "null": ""
            },
            {
                "BILAN PASSIF": "",
                "null": ""
            },
            {
                "BILAN PASSIF": "",
                "null": ""
            },
            {
                "BILAN PASSIF": "",
                "null": ""
            },
            {
                "BILAN PASSIF": "",
                "null": "208 996,62"
            },
            {
                "BILAN PASSIF": "",
                "null": ""
            },
            {
                "BILAN PASSIF": "",
                "null": "542 617 304,31"
            },
            {
                "BILAN PASSIF": "",
                "null": "21 373 032,82\n21 373 032,82"
            },
            {
                "BILAN PASSIF": "",
                "null": ""
            },
            {
                "BILAN PASSIF": "",
                "null": ""
            },
            {
                "BILAN PASSIF": "",
                "null": ""
            },
            {
                "BILAN PASSIF": "",
                "null": "21 373 032,82"
            },
            {
                "BILAN PASSIF": "",
                "null": "655 193 637,66"
            }
        ],
        [
            {
                "COMPTE DE PRODUITS ET CHARGES": "En MAD\nNATURE",
                "null": "TOTAUX DE\nL'EXERCICE\nPRECEDENT\n4"
            },
            {
                "COMPTE DE PRODUITS ET CHARGES": "",
                "null": ""
            },
            {
                "COMPTE DE PRODUITS ET CHARGES": "",
                "null": ""
            },
            {
                "COMPTE DE PRODUITS ET CHARGES": "",
                "null": ""
            },
            {
                "COMPTE DE PRODUITS ET CHARGES": "E\nX\nP\nL\nI\nT\nA\nT\nI\nO\nN\nF\nI\nN\nA\nN\nC\nE\nM\nE\nN\nT\nN\nO\nN\nC\nO\nR\nA\nN\nT",
                "null": "204 434 227,30"
            },
            {
                "COMPTE DE PRODUITS ET CHARGES": "",
                "null": ""
            },
            {
                "COMPTE DE PRODUITS ET CHARGES": "",
                "null": ""
            },
            {
                "COMPTE DE PRODUITS ET CHARGES": "",
                "null": "204 434 227,30"
            },
            {
                "COMPTE DE PRODUITS ET CHARGES": "",
                "null": "228 591,74\n1 665 501,32"
            },
            {
                "COMPTE DE PRODUITS ET CHARGES": "",
                "null": ""
            },
            {
                "COMPTE DE PRODUITS ET CHARGES": "",
                "null": ""
            },
            {
                "COMPTE DE PRODUITS ET CHARGES": "",
                "null": ""
            },
            {
                "COMPTE DE PRODUITS ET CHARGES": "",
                "null": ""
            },
            {
                "COMPTE DE PRODUITS ET CHARGES": "",
                "null": "206 328 320,36"
            },
            {
                "COMPTE DE PRODUITS ET CHARGES": "",
                "null": "7 765 426,97\n56 769 708,81\n1 863 845,38\n53 196 426,63\n500 000,00\n9 064 955,57"
            },
            {
                "COMPTE DE PRODUITS ET CHARGES": "",
                "null": ""
            },
            {
                "COMPTE DE PRODUITS ET CHARGES": "",
                "null": ""
            },
            {
                "COMPTE DE PRODUITS ET CHARGES": "",
                "null": ""
            },
            {
                "COMPTE DE PRODUITS ET CHARGES": "",
                "null": ""
            },
            {
                "COMPTE DE PRODUITS ET CHARGES": "",
                "null": ""
            },
            {
                "COMPTE DE PRODUITS ET CHARGES": "",
                "null": ""
            },
            {
                "COMPTE DE PRODUITS ET CHARGES": "",
                "null": ""
            },
            {
                "COMPTE DE PRODUITS ET CHARGES": "",
                "null": "129 160 363,36"
            },
            {
                "COMPTE DE PRODUITS ET CHARGES": "",
                "null": "77 167 957,00"
            },
            {
                "COMPTE DE PRODUITS ET CHARGES": "",
                "null": "5 312 896,67\n9 708,82\n1 792 798,07"
            },
            {
                "COMPTE DE PRODUITS ET CHARGES": "",
                "null": ""
            },
            {
                "COMPTE DE PRODUITS ET CHARGES": "",
                "null": ""
            },
            {
                "COMPTE DE PRODUITS ET CHARGES": "",
                "null": ""
            },
            {
                "COMPTE DE PRODUITS ET CHARGES": "",
                "null": ""
            },
            {
                "COMPTE DE PRODUITS ET CHARGES": "",
                "null": "7 115 403,56"
            },
            {
                "COMPTE DE PRODUITS ET CHARGES": "",
                "null": "2 205 020,25\n32 016,29"
            },
            {
                "COMPTE DE PRODUITS ET CHARGES": "",
                "null": ""
            },
            {
                "COMPTE DE PRODUITS ET CHARGES": "",
                "null": ""
            },
            {
                "COMPTE DE PRODUITS ET CHARGES": "",
                "null": ""
            },
            {
                "COMPTE DE PRODUITS ET CHARGES": "",
                "null": ""
            },
            {
                "COMPTE DE PRODUITS ET CHARGES": "",
                "null": "2 237 036,54"
            },
            {
                "COMPTE DE PRODUITS ET CHARGES": "",
                "null": "4 878 367,02"
            },
            {
                "COMPTE DE PRODUITS ET CHARGES": "",
                "null": "82 046 324,02"
            },
            {
                "COMPTE DE PRODUITS ET CHARGES": "",
                "null": "82 046 324,02"
            },
            {
                "COMPTE DE PRODUITS ET CHARGES": "",
                "null": "48 200,00\n1 035 546,90"
            },
            {
                "COMPTE DE PRODUITS ET CHARGES": "",
                "null": ""
            },
            {
                "COMPTE DE PRODUITS ET CHARGES": "",
                "null": ""
            },
            {
                "COMPTE DE PRODUITS ET CHARGES": "",
                "null": ""
            },
            {
                "COMPTE DE PRODUITS ET CHARGES": "",
                "null": ""
            },
            {
                "COMPTE DE PRODUITS ET CHARGES": "",
                "null": ""
            },
            {
                "COMPTE DE PRODUITS ET CHARGES": "",
                "null": "1 083 746,90"
            },
            {
                "COMPTE DE PRODUITS ET CHARGES": "",
                "null": "4 246 261,05"
            },
            {
                "COMPTE DE PRODUITS ET CHARGES": "",
                "null": ""
            },
            {
                "COMPTE DE PRODUITS ET CHARGES": "",
                "null": ""
            },
            {
                "COMPTE DE PRODUITS ET CHARGES": "",
                "null": ""
            },
            {
                "COMPTE DE PRODUITS ET CHARGES": "",
                "null": ""
            },
            {
                "COMPTE DE PRODUITS ET CHARGES": "",
                "null": "4 246 261,05"
            },
            {
                "COMPTE DE PRODUITS ET CHARGES": "",
                "null": "-3 162 514,15"
            },
            {
                "COMPTE DE PRODUITS ET CHARGES": "",
                "null": "78 883 809,87"
            },
            {
                "COMPTE DE PRODUITS ET CHARGES": "",
                "null": "24 300 497,00"
            },
            {
                "COMPTE DE PRODUITS ET CHARGES": "",
                "null": "54 583 312,87"
            },
            {
                "COMPTE DE PRODUITS ET CHARGES": "",
                "null": "214 527 470,82"
            },
            {
                "COMPTE DE PRODUITS ET CHARGES": "",
                "null": "159 944 157,95"
            },
            {
                "COMPTE DE PRODUITS ET CHARGES": "",
                "null": "54 583 312,87"
            }
        ],
        [
            {
                "": "",
                "null": "",
                "Comptes consolidés au 31 décembre 2023\nACTIF CONSOLIDE PASSIF CONSOLIDE\nEn MAD 31/12/2023 31/12/2022 En MAD 31/12/2023 31/12/2022\nGoodwill 68 733 760 68 733 760 Capital 10 000 000 10 000 000\nImmobilisations incorporelles 14 259 763 8 984 777 Réserves (*) (19 204 333) (23 534 468)\nRésultats 59 995 816 59 317 596\nImmobilisations corporelles (*) 83 429 790 85 177 009\nEcarts de conversion 44 151 13 472\nImmeubles de placement Capitaux propres part du groupe 50 835 634 45 796 600\nTitres mis en équivalence Réserves minoritaires 1 598 801 1 315 294\nRésultat minoritaire 2 477 432 2 128 095\nAutres actifs financiers\nEcarts de conversion (88) 8 617\n-Dont prêts et créances 540 222 532 102 Capitaux propres part des minoritaires 4 076 145 3 452 006\n-Dont actifs financiers détenus jusqu’à échéance Capitaux propres d'ensemble 54 911 779 49 248 606\nDettes financières non courantes : 92 774 914 104 765 555\n-Dont actifs financiers évalués à la juste valeur\n-Dont dettes envers les établissements de crédit 18 361 799 21 848 572\nActifs d’impôts différés 6 225 158 9 177 565 -Dont obligations locatives non courantes IFRS 16 74 413 115 82 916 983\nAutres actifs non courants Provisions non courantes\nAvantages au personnel 358 816 268 342\nTotal Actifs non courants 173 188 692 172 605 213\nImpôt différé passif 230 348 97 785\nStocks et encours net Total des passifs non courants 93 364 079 105 131 682\nCréances clients net 640 027 858 596 212 795 Provisions courantes 360 976 360 976\nDettes financières courantes : 56 596 239 42 849 600\nAutres créances courantes nettes 110 525 155 106 904 997\n-Dont dettes envers les établissements de crédit 45 557 331 32 767 841\nAutres actifs financiers -Dont obligations locatives non courantes IFRS 16 11 038 908 10 081 759\nTrésorerie et équivalent de trésorerie 19 664 112 11 097 276 Dettes fournisseurs 641 086 790 603 444 191\nAutres passifs courants 97 085 955 85 785 226\nTotal Actifs courants 770 217 125 714 215 068\nTotal dettes courantes 795 129 960 732 439 993\nTOTAL ACTIF 943 405 817 886 820 280 TOTAL PASSIF 943 405 817 886 820 280\nGroupe AFMA % de Type Méthode\nEntité Activité Pays\nen MAD 31/12/2023 31/12/2022 contrôle contrôle consolidation\nChiffre d'affaires 258 770 230 243 691 127\nAFMA SA Courtage en assurance Maroc Mère Mère Mère\nAutres produits de l'activité 11 084 13 026\nProduits des activités ordinaires 258 781 315 243 704 153 AFMA RABAT Courtage en assurance Maroc 100 CE IG\nAchats consommés (67 454 487) (59 790 835)\nCharges de personnel (65 850 338) (66 211 732) AFMA MARRAKECH Courtage en assurance Maroc 99.87 CE IG\nImpôts et taxes (2 741 458) (2 388 302)\nAFMA TANGER Courtage en assurance Maroc 99.8 CE IG\nAutres produits et charges d'exploitation\nDotations nettes aux amortissements,\n(16 926 806) (15 563 770) AFMA AGADIR Courtage en assurance Maroc 87.9 CE IG\ndépréciations et aux provisions\nCharges des activités ordinaires (152 973 090) (143 954 638)\nAFMA FES Courtage en assurance Maroc 99.93 CE IG\nRésultat d'exploitation courant 105 808 225 99 749 515\nAutres produits & charges d'exploitation non MCA Courtage en assurance Maroc 100 CE IG\n(6 519 341) (3 141 227)\ncourants\nRésultat d'exploitation 99 288 884 96 608 288 AFMA OUJDA Courtage en assurance Maroc 99 CE IG\nCoût de l'endettement net (6 816 627) (5 820 139)\nAutres produits financiers AFMA LAAYOUNE Courtage en assurance Maroc 100 CE IG\nAutres charges financières 454 692 108 658\nCAM Courtage en assurance Maroc 100 CE IG\nRésultat financier (6 361 935) (5 711 481)\nRésultat avant impôt des entreprises 92 926 949 90 896 808 AFMA AFRICA Courtage en assurance Maroc 99.6 CE IG\nintégrées\nImpôts sur les sociétés (27 355 542) (28 401 086) AFMA KENITRA Courtage en assurance Maroc 100 CE IG\nImpôt différé (3 098 159) (1 050 031)\nRésultat net des entreprises intégrées 62 473 248 61 445 691 SAFE ASSUR Courtage en assurance Maroc 51 CE IG\nPart dans les résultats des sociétés mises en\néquivalence ASSURANCE AL FAHD Courtage en assurance Maroc 70 CE IG\nRésultat net des activités poursuivies 62 473 248 61 445 691\nACR-AFMA Courtage en assurance Cote d’ivoire 61 CE IG\nRésultat net des activités abandonnées\nRésultat de l'ensemble consolidé 62 473 248 61 445 691\nJEAN BUSNOT MAROC Courtage en assurance Maroc 60 CE IG\nIntérêts minoritaires 2 477 432 2 128 095\nRésultat net -Part du Groupe 59 995 816 59 317 596 AFMA DAKHLA Courtage en assurance Maroc 100 CE IG\nRésultat de base par action(En MAD) 60,00 59,32\nAFMA MEKNES Courtage en assurance Maroc 100 CE IG\nRésultat dilué par action (En MAD) 60,00 59,32": "© 2024 AFMA ASSUREUR CONSEIL\nUne entreprise de\nfinance@afmagroup.ma —+212 522 428 000"
            }
        ],
        [
            {
                "ACTIF CONSOLIDE": "En MAD",
                "null": "31/12/2022"
            },
            {
                "ACTIF CONSOLIDE": "",
                "null": ""
            },
            {
                "ACTIF CONSOLIDE": "",
                "null": ""
            },
            {
                "ACTIF CONSOLIDE": "",
                "null": ""
            },
            {
                "ACTIF CONSOLIDE": "",
                "null": ""
            },
            {
                "ACTIF CONSOLIDE": "",
                "null": ""
            },
            {
                "ACTIF CONSOLIDE": "",
                "null": ""
            },
            {
                "ACTIF CONSOLIDE": "",
                "null": ""
            },
            {
                "ACTIF CONSOLIDE": "",
                "null": ""
            },
            {
                "ACTIF CONSOLIDE": "",
                "null": ""
            },
            {
                "ACTIF CONSOLIDE": "",
                "null": ""
            },
            {
                "ACTIF CONSOLIDE": "",
                "null": ""
            },
            {
                "ACTIF CONSOLIDE": "",
                "null": ""
            },
            {
                "ACTIF CONSOLIDE": "",
                "null": ""
            },
            {
                "ACTIF CONSOLIDE": "",
                "null": ""
            },
            {
                "ACTIF CONSOLIDE": "",
                "null": ""
            },
            {
                "ACTIF CONSOLIDE": "",
                "null": ""
            },
            {
                "ACTIF CONSOLIDE": "",
                "null": ""
            },
            {
                "ACTIF CONSOLIDE": "",
                "null": ""
            },
            {
                "ACTIF CONSOLIDE": "",
                "null": ""
            }
        ],
        [
            {
                "PASSIF CONSOLIDE": "En MAD",
                "null": "31/12/2022"
            },
            {
                "PASSIF CONSOLIDE": "",
                "null": ""
            },
            {
                "PASSIF CONSOLIDE": "",
                "null": ""
            },
            {
                "PASSIF CONSOLIDE": "",
                "null": ""
            },
            {
                "PASSIF CONSOLIDE": "",
                "null": ""
            },
            {
                "PASSIF CONSOLIDE": "",
                "null": ""
            },
            {
                "PASSIF CONSOLIDE": "",
                "null": ""
            },
            {
                "PASSIF CONSOLIDE": "",
                "null": ""
            },
            {
                "PASSIF CONSOLIDE": "",
                "null": ""
            },
            {
                "PASSIF CONSOLIDE": "",
                "null": ""
            },
            {
                "PASSIF CONSOLIDE": "",
                "null": ""
            },
            {
                "PASSIF CONSOLIDE": "",
                "null": ""
            },
            {
                "PASSIF CONSOLIDE": "",
                "null": ""
            },
            {
                "PASSIF CONSOLIDE": "",
                "null": ""
            },
            {
                "PASSIF CONSOLIDE": "",
                "null": ""
            },
            {
                "PASSIF CONSOLIDE": "",
                "null": ""
            },
            {
                "PASSIF CONSOLIDE": "",
                "null": ""
            },
            {
                "PASSIF CONSOLIDE": "",
                "null": ""
            },
            {
                "PASSIF CONSOLIDE": "",
                "null": ""
            },
            {
                "PASSIF CONSOLIDE": "",
                "null": ""
            },
            {
                "PASSIF CONSOLIDE": "",
                "null": ""
            },
            {
                "PASSIF CONSOLIDE": "",
                "null": ""
            },
            {
                "PASSIF CONSOLIDE": "",
                "null": ""
            },
            {
                "PASSIF CONSOLIDE": "",
                "null": ""
            },
            {
                "PASSIF CONSOLIDE": "",
                "null": ""
            },
            {
                "PASSIF CONSOLIDE": "",
                "null": ""
            }
        ],
        [
            {
                "Groupe AFMA": "en MAD",
                "null": "31/12/2022"
            },
            {
                "Groupe AFMA": "",
                "null": ""
            },
            {
                "Groupe AFMA": "",
                "null": ""
            },
            {
                "Groupe AFMA": "",
                "null": ""
            },
            {
                "Groupe AFMA": "",
                "null": ""
            },
            {
                "Groupe AFMA": "",
                "null": ""
            },
            {
                "Groupe AFMA": "",
                "null": ""
            },
            {
                "Groupe AFMA": "",
                "null": ""
            },
            {
                "Groupe AFMA": "",
                "null": ""
            },
            {
                "Groupe AFMA": "",
                "null": ""
            },
            {
                "Groupe AFMA": "",
                "null": ""
            },
            {
                "Groupe AFMA": "",
                "null": ""
            },
            {
                "Groupe AFMA": "",
                "null": ""
            },
            {
                "Groupe AFMA": "",
                "null": ""
            },
            {
                "Groupe AFMA": "",
                "null": ""
            },
            {
                "Groupe AFMA": "",
                "null": ""
            },
            {
                "Groupe AFMA": "",
                "null": ""
            },
            {
                "Groupe AFMA": "",
                "null": ""
            },
            {
                "Groupe AFMA": "",
                "null": ""
            },
            {
                "Groupe AFMA": "",
                "null": ""
            },
            {
                "Groupe AFMA": "",
                "null": ""
            },
            {
                "Groupe AFMA": "",
                "null": ""
            },
            {
                "Groupe AFMA": "",
                "null": ""
            },
            {
                "Groupe AFMA": "",
                "null": ""
            },
            {
                "Groupe AFMA": "",
                "null": ""
            },
            {
                "Groupe AFMA": "",
                "null": ""
            },
            {
                "Groupe AFMA": "",
                "null": ""
            },
            {
                "Groupe AFMA": "",
                "null": ""
            },
            {
                "Groupe AFMA": "",
                "null": ""
            }
        ],
        []
    ]
}