{
    "text": "AVIS DE CONVOCATION\nDES ACTIONNAIRES\nCasablanca, le 26 avril 2024\nSociété anonyme au capital de 502 945 280 dirhams\nSiège social : Casablanca – 64, avenue Lalla Yacout\nR.C. n°137 à Casablanca\nLes actionnaires de la société Auto Hall, société anonyme au capital de 502 945 280 dirhams, sont priés de bien vouloir assister\nà la réunion de l’Assemblée générale ordinaire qui se tiendra à Casablanca, km12 autoroute Casablanca-Rabat,\nle Mercredi 29 mai 2024, à 11 heures,\nà l’effet de délibérer et de statuer sur les points à l’ordre du jour suivant :\n- Rapport de gestion du Conseil d’administration sur l’exercice clos le 31 décembre 2023,\n- Rapport des commissaires aux comptes concernant le même exercice,\n- R apport spécial des commissaires aux comptes sur les conventions susceptibles d’être visées par les articles 56 et suivants de la loi\nn°17/95 telle que modifiée et complétée,\n- Approbation s’il y a lieu de ces rapports, bilan, comptes et quitus aux administrateurs,\n- Affectation des résultats,\n- Mandat d’administrateurs,\n- Pouvoirs en vue de l’accomplissement des formalités légales.\nLes actionnaires titulaires d’actions nominatives devront avoir été préalablement inscrits en compte, en nominatif pur ou en nominatif\nadministré, cinq jours avant la réunion. Ils seront admis à cette assemblée sur simple justification de leur identité.\nLes actionnaires propriétaires d’actions au porteur devront déposer ou faire adresser par leur banque au siège social, cinq jours avant la\nréunion, les attestations constatant leur inscription en compte auprès d’un intermédiaire habilité.\nConformément aux dispositions de loi n°17/95 relative aux sociétés anonymes telle que modifiée et complétée, les actionnaires réunissant\nles conditions exigées par l’article 117 de ladite loi, disposent d’un délai de 10 jours à compter de la publication du présent avis pour\ndemander l’inscription de projets de résolutions à l’ordre du jour de cette assemblée.\nLa société tient à la disposition des actionnaires l’ensemble des informations relatives à la réunion : modalités de participation et de vote,\nétats de synthèses de l’exercice 2023, rapports de gestion et des commissaires aux comptes sur son site web : www.autohall.ma.\nPROJET DE RÉSOLUTIONS\nEXERCICE 2023\nPREMIÈRE RÉSOLUTION\nL’Assemblée générale après avoir constaté :\n- qu’elle a été régulièrement convoquée,\n- q u’elle réunit le quorum du quart au moins du capital social pour la tenue des assemblées générales ordinaires prévu par la loi et par\nl’article 29 des statuts,\n- que les modalités de participation et de vote, le rapport de gestion, le texte et l’exposé des motifs des projets de résolutions présentés\npar le Conseil d’administration, le rapport des commissaires aux comptes sur les comptes de l’exercice 2023 ainsi que leur rapport\nspécial sur les conventions susceptibles d’être visées par les articles 56 et suivants de la loi n°17/95 telle que complétée et modifiée,\nl’inventaire, les états de synthèse arrêtés au 31 décembre 2023, ont été tenus à la disposition des actionnaires à partir de la date de\nconvocation de l’assemblée,\ndécide de délibérer valablement sur les questions inscrites à l’ordre du jour et donne en conséquence décharge de sa convocation\nrégulière au Conseil d’administration.\nDEUXIÈME RÉSOLUTION\nL’Assemblée générale, après avoir entendu lecture des rapports du Conseil d’administration et des commissaires aux comptes, approuve\nle bilan et les comptes de l’exercice 2023 tels qu’ils sont présentés ainsi que les opérations traduites dans ces comptes.\nTROISIÈME RÉSOLUTION\nL’Assemblée générale, après avoir entendu lecture du rapport spécial des commissaires aux comptes sur les conventions relevant des\narticles 56 et suivants de la loi n°17/95 relative aux sociétés anonymes telle que modifiée et complétée, approuve les conclusions dudit\nrapport et les conventions qui y sont mentionnées.\nQUATRIÈME RÉSOLUTION\nL’Assemblée générale décide sur proposition du Conseil d’administration, d’affecter le bénéfice net de l’exercice comme suit :\nBénéfice net de l’exercice …… ………. ............ ............ ............ . . Dhs 169 650 517,99\nqui, ajouté au report à nouveau antérieur de .... ............ ............ . . Dhs 1 176 999,60\nforme un total de .... ............ ............ . . Dhs 170 827 517,59\nà affecter comme suit :\naux actionnaires à titre de dividende ... ............ . . . . . . . . . . . . . . Dhs 100 589 056,00\nau poste report à nouveau ...... ............ ............ . . . . . . . . . . . . . . Dhs 70 238 461,59\nsoit un total de .. ............ . . . . . . . . . . . . . . . . . . . . . . . . . . Dhs 170 827 517,59\nA la suite de cette affectation :\n- i l sera attribué un dividende de 2 dirhams à chacune des 50 294 528 actions formant le capital social. Conformément à l’article 32 des\nstatuts, l’Assemblée décide la date de mise en paiement de ce dividende à compter du 1er juillet 2024.\n- L e montant du poste report à nouveau, d’un solde antérieur créditeur de 1 176 999,60 dirhams, sera augmenté et formera un nouveau\nsolde créditeur de 70 238 461,59 dirhams.\n- Le montant des réserves facultatives reste au niveau de 596.402.127,57 dirhams.\nCINQUIÈME RÉSOLUTION\nL’Assemblée générale décide de renouveler le mandat d’Administrateur de Monsieur Bouchaïb NAJIOULLAH pour une durée de six\nannées qui prendra fin avec l’assemblée générale appelée à statuer sur les comptes de l’exercice 2029.\nSIXIÈME RÉSOLUTION\nL’Assemblée générale décide de renouveler le mandat d’Administrateur de la Société AMANA, représentée par Moulay Souleimane\nCHERKAOUI pour une durée de six années qui prendra fin avec l’assemblée générale appelée à statuer sur les comptes de l’exercice\n2029.\nSEPTIÈME RÉSOLUTION\nL’Assemblée générale décide de nommer en qualité de nouvel administrateur Madame ........................ pour une durée de six années qui\nprendra fin avec l’assemblée générale appelée à statuer sur les comptes de l’exercice 2029.\nHUITIÈME RÉSOLUTION\nEn conséquence de la cinquième, de la sixième et de la septième résolution, le Conseil se compose comme suit et les mandats des\nAdministrateurs prendront fin avec les Assemblées appelées à statuer sur les comptes des exercices indiqués ci-après :\nMonsieur Karim GHELLAB Président 2026\nMonsieur Abdellatif GUERRAOUI Administrateur, Président Honoraire 2028\nLalla Zoubida EL YACOUBI Administrateur 2025\nLalla Noufissa EL YACOUBI Administrateur 2025\nMoulay Omar CHERKAOUI Administrateur 2025\nMoulay Souleimane CHERKAOUI Administrateur 2025\nMonsieur Khalid CHEDDADI Administrateur 2028\nMadame Nadia FASSI FEHRI Administrateur indépendant 2027\nMonsieur Mohammed Saad HASSAR Administrateur 2025\nMonsieur Bouchaïb NAJIOULLAH Administrateur indépendant 2029\nMonsieur M’hamed SAGOU Administrateur indépendant 2028\nMadame Administrateur 2029\nLa société AMANA représentée par Moulay Souleimane CHERKAOUI Administrateur 2029\nNEUVIÈME RÉSOLUTION\nL’Assemblée générale donne aux membres du Conseil d’administration quitus entier et sans réserve de l’exécution de leurs mandats\npour l’exercice 2023.\nDIXIÈME RÉSOLUTION\nL’Assemblée générale décide de conférer tous pouvoirs au porteur d’une copie ou d’un extrait certifié conforme du procès-verbal de la\nprésente assemblée pour effectuer les formalités prévues par la loi.\nLe Conseil d’administration\nÀ propos de Auto Hall Auto Hall s.a\nAuto Hall est un groupe automobile marocain jouant un rôle essentiel dans la distribution de matériels roulants de diverses marques au Maroc depuis 1907. Km 12, Autoroute Casa-Rabat,\nFort de son expérience et de son expertise, le Groupe propose un portefeuille de plus de 15 marques de renom dans les domaines du matériel roulant, des Sortie Al Qods- Casablanca Maroc\nmines, des travaux publics, de l’agriculture et des lubrifiants. Pour garantir un service de qualité et une proximité avec ses clients, le Groupe Auto Hall dispose Téléphone: 0522 76 14 00/01/02\nd’un réseau étendu de plus de 65 succursales à travers le Royaume, qui lui assure une présence élargie pour répondre efficacement aux besoins des clients Fax: 0522 76 14 14/15\net pour offrir un service après-vente de qualité. Email: autohall@autohall.ma\nBILAN ACTIF du 01/01/2023 au 31/12/2023\nEXERCICE EXERCICE\nACTIF (En dirhams) PRÉCÉDENT\nBrut AMORT & PROV Net Net\nÉ S\nI L I\nB\nO\nM\nM\nI\nF\nI T\nC\nA\nIMMOBILISATIONS EN NON VALEURS (A) 59 418 834,05 46 202 377,89 13 216 456,16 24 431 321,10\n*Frais préliminaires 0,00 0,00 0,00\n*Charges à répartir sur plusieurs exercices 59 418 834,05 46 202 377,89 13 216 456,16 24 431 321,10\n*Primes de remboursement des obligations\nIMMOBILISATIONS INCORPORELLES (B) 2 800 000,00 560 000,00 2 240 000,00 140 000,00\n*Immobilisations en recherche et développement 2 800 000,00 560 000,00 2 240 000,00 0,00\n*Brevets, marques, droits et valeurs similaires 0,00 0,00 0,00 0,00 *Fonds commercial 0,00 140 000,00\n*Autres immobilisations incorporelles IMMOBILISATIONS CORPORELLES (C) 741 590 553,24 328 942 795,11 412 647 758,13 473 685 024,36\n*Terrains 110 989 862,49 110 989 862,49 147 095 510,29\n*Constructions 321 011 071,65 192 846 157,15 128 164 914,50 155 007 417,46\n*Installations techniques, matériel et outillage 55 154 775,54 42 447 516,47 12 707 259,07 14 200 588,27\n*Matériel de transport 155 595 757,63 33 734 968,80 121 860 788,83 119 022 755,68\n*Mobilier, matériel de bureau 81 273 316,00 59 914 152,69 21 359 163,31 23 541 355,69 *Autres immobilisations corporelles 0,00 0,00\n*Immobilisations corporelles en cours 17 565 769,93 17 565 769,93 14 817 396,97\nIMMOBILISATIONS FINANCIÈRES (D) 1 011 929 105,00 0,00 1 011 929 105,00 802 119 105,00\n*Prêts immobilisés 261 215,00 261 215,00 36 215,00\n*Autres créances financières 0,00\n*Titres de participation 1 011 667 890,00 1 011 667 890,00 802 082 890,00\n*Autres titres immobilisés\nÉCARTS DE CONVERSION, ACTIF (E) 0,00 0,00 0,00 0,00\n*Diminution des créances immobilisées\n*Augmentation des dettes de finance\nTOTAL I (A+B+C+D+E) 1 815 738 492,29 375 705 173,00 1 440 033 319,29 1 300 375 450,46\nT N\nA\nL\nU\nC\nR\nI C\nF\nI\nT\nC\nA\nSTOCKS (F) 229 919 587,44 15 780 956,28 214 138 631,16 141 114 505,25\n*Marchandises 226 066 761,57 15 752 216,00 210 314 545,57 137 979 615,39\n*Matières et fournitures consommables 0,00 *Produits en cours 3 852 825,87 28 740,28 3 824 085,59 3 134 889,86\n*Produits intermédiaires et produits résiduels 0,00\n*Produits finis 0,00\nCRÉANCES DE L'ACTIF CIRCULANT (G) 2 352 850 943,97 48 888 543,65 2 303 962 400,32 1 783 972 608,30\n*Fournis, débiteurs,avances et acomptes 87 968 325,65 87 968 325,65 41 193 006,63\n*Clients et comptes rattachés 835 321 992,55 48 888 543,65 786 433 448,90 1 025 895 816,07\n*Personnel 3 273 373,27 3 273 373,27 4 180 229,69\n*État 103 817 071,99 103 817 071,99 114 951 174,35\n*Comptes associés et sociétés du groupe 1 321 641 020,18 1 321 641 020,18 593 978 752,89\n*Autres débiteurs 0,00 0,00\n*Comptes de régularisation Actif 829 160,33 829 160,33 3 773 628,67\nTITRES ET VALEURS DE PLACEMENT (H) 0,00 0,00\nÉ (éC léA mR eT nS t sD cE i rC cuO lN anV tE sR )SION, ACTIF (I) 5 458,20 5 458,20 6 682,57\nTOTAL II (F+G+H+I) 2 582 775 989,61 64 669 499,93 2 518 106 489,68 1 925 093 796,12 EIREROSÉRT\nBILAN PASSIF du 01/01/2023 au 31/12/2023\nEXERCICE\nPASSIF (En dirhams) EXERCICE PRÉCÉDENT\nCapitaux propres\nTRÉSORERIE, ACTIF\n*Chèques et valeurs à encaisser 598 731,19 598 731,19 1 535 253,87\n*Banques TG et CP 74 419 847,37 74 419 847,37 29 561 158,53\n*Caisse, régie d'avance et accréditifs 1 577 883,41 1 577 883,41 1 207 975,80\nTOTAL III 76 596 461,97 0,00 76 596 461,97 32 304 388,20\nTOTAL GÉNÉRAL I+II+III 4 475 110 943,87 440 374 672,93 4 034 736 270,94 3 257 773 634,78\nT N\nE\nN A\nM R E\nP\nT\nN\nE\nM E\nC\nN A\nN\nI F\nCapital social 502 945 280,00 502 945 280,00\nMoins, actionnaires, capital souscrit non appelé capital appelé\nPrime d'émission, de fusion, d'apport 251 021 566,80 251 021 566,80\nÉcarts de réévaluation\nRéserve légale 50 294 528,00 50 294 528,00\nAutres réserves 596 402 127,57 496 402 127,57\nReport à nouveau (2) 1 176 999,60 11 511 843,78 Résultats nets en instance d'affectation (2)\nRésultat net de l'exercice 169 650 517,99 265 696 003,82\nRésultat avant impôts\nTOTAL DES CAPITAUX PROPRES (A) 1 571 491 019,96 1 577 871 349,97\nCAPITAUX PROPRES ASSIMILÉS (B)\nSubventions d'investissement\nProvisions réglementées\nDETTES DE FINANCEMENT (C)\nEmprunts obligataires\nAutres dettes de financement\nPROVISIONS DURABLES POUR RISQUES ET CHARGES (D)\nProvisions pour risques\nProvisions pour charges\nT N\nA L\nU\nC R\nI C\nF\nI S S\nA\nP\nÉCARTS DE CONVERSION, PASSIF (E)\nAugmentation des créances immobilisées\nDiminution des dettes de financement\nTOTAL I (A+B+C+D+E) 1 571 491 019,96 1 577 871 349,97\nDETTES DU PASSIF CIRCULANT (F) Fournisseurs et comptes rattachés 541 218 202,52 566 699 263,78\nClient créditeurs, avances et acomptes 12 839 182,34 22 055 499,06\nPersonnel 1 714 594,44 2 718 416,06\nOrganismes sociaux 10 228 573,51 10 119 381,06\nÉtat 5 623 327,11 5 722 785,12\nComptes associés et sociétés du groupe 498 994 831,89 403 479 051,10\nAutres créances 3 426 621,91 3 633 800,37\nComptes de régularisation passif 68 219 903,66 65 207 287,32\n1 142 265 237,38 1 079 635 483,87\nAUTRES PROVISIONS POUR RISQUES ET CHARGES (G) 980 013,60 6 682,55\nÉCARTS DE CONVERSION, PASSIF (éléments circulants) (H) 259 952,60 TOTAL II (F+G+H) 1 143 245 250,98 1 079 902 119,02\nEIREROSÉRT TRÉSORERIE, PASSIF Crédits d'escompte\nCrédits de trésorerie 1 320 000 000,00 600 000 000,00\nBanques (soldes créditeurs) 165,79\nTOTAL III 1 320 000 000,00 600 000 165,79\nTOTAL GÉNÉRAL (I+II+III) 4 034 736 270,94 3 257 773 634,78\nCOMPTE DE PRODUITS ET CHARGES (Hors Taxes) ÉTAT DES SOLDES DE GESTION ( E S G )\nOPÉRATIONS I TABLEAU DE FORMATION DES RÉSULTATS ( T F R )\nDÉSIGNATION l’exeP rcro icp er e (1 à ) C po rn éc ce éer dxn eea nrn c tst ic l (ee 2ss ) de l’e x 3T e o =rt ca 1iu +ce 2x de l’exT eo rt ca iu ce 4x (Montants en dhs) Ex ae urc 3ic 1e d d éu c e1 m ja bn rv ei e 2 Er 0 X22 3 E0 2 R3 C ICE\nEXERCICE\nPRÉCÉDENT\n1 Ventes de marchandises (en l’état ) 3 374 495 801,21 3 353 625 966,75\n2 - Achats revendus de marchandises 2 969 142 792,05 2 889 599 035,35\nI = MARGE BRUTE SUR VENTES EN L’ÉTAT 405 353 009,16 464 026 931,40\n+ PRODUCTION DE L’ EXERCICE : ( 3 + 4 + 5 ) 179 198 634,16 183 217 687,26\n3 Ventes de biens et services produits 179 198 634,16 183 217 687,26 II\n4 Variation de stocks de produits\n5 Immobilisations produites par l’entreprise pour elle-même\n- CONSOMMATION DE L’EXERCICE : ( 6 + 7 ) 278 255 842,28 255 682 922,13\nIII 6 Achats consommés de matières et fournitures 41 217 129,35 38 045 422,65\n7 Autres charges externes 237 038 712,93 217 637 499,48\nIV = VALEUR AJOUTÉE : ( I + II + III ) 306 295 801,04 391 561 696,53\n8 + Subventions d’exploitation\nV 9 - Impôts et taxes 12 089 218,54 13 112 044,43\n10 - Charges de personnel 195 730 673,66 196 855 953,50\n= EXCÉDENT BRUT D’EXPLOITATION ( E B E )\n98 475 908,84 181 593 698,60 = OU INSUFFISANCE BRUTE D’EXPLOITATION ( I B E)\n11 + Autres produits d’exploitation 2 289 600,00 2 776 800,00 12 - Autres charges d’exploitation 5 198 337,14 5 195 829,78\n13 + Reprises d’exploitation : transferts de charges 1 869 417,59 3 627 604,05\n14 - Dotations d’exploitation 75 444 067,06 66 983 884,78\nVI = RÉSULTAT D’EXPLOITATION ( + ou - ) 21 992 522,23 115 818 388,09\nVII RÉSULTAT FINANCIER 24 264 007,04 26 298 738,85\nVIII = RÉSULTAT COURANT ( + ou - ) 46 256 529,27 142 117 126,94\nIX RÉSULTAT NON COURANT 157 760 796,72 163 777 529,88\n15 - Impôts sur les résultats 34 366 808,00 40 198 653,00\nX = RÉSULTAT NET DE L’EXERCICE ( + ou - ) 169 650 517,99 265 696 003,82\nII CAPACITÉ D’AUTOFINANCEMENT ( C A F ) - AUTOFINANCEMENT\nRésultat de l’exercice\n1 * Bénéfice 169 650 517,99 265 696 003,82\n* Perte\n2 + Dotations d’exploitation (1) 73 257 113,19 64 525 287,19\n3 + Dotations financières (1)\n4 + Dotations non courantes (1)\n5 - Reprises d’exploitation (2) 6 - Reprises financières (2)\n7 - Reprises non courantes (2) (3)\n8 - Produits des cessions des immobilisations 279 475 296,03 247 371 586,94\n9 + Valeurs nettes des immobilisations cédées 119 941 126,85 70 237 799,07\nI CAPACITÉ D’AUTOFINANCEMENT ( C A F ) 83 373 462,00 153 087 503,14\n10 - Distributions de bénéfices 176 030 848,00 176 030 848,00\nII AUTOFINANCEMENT -92 657 386,00 -22 943 344,86\n(1) à l’exclusion des dotations relatives aux actifs et passifs circulants et à la trésorerie\n(2) à l’exclusion des reprises relatives aux actifs circulants et à la trésorerie\n(3) Y compris reprises sur subventions d’investissement\nN\nO\nI T\nA\nT\nI O\nL P\nX E\nI PRODUITS D’EXPLOITATION\n*Ventes de marchandises (en l'état) 3 374 495 801,21 3 374 495 801,21 3 353 625 966,75\n*Ventes de biens et services produits 179 198 634,16 179 198 634,16 183 217 687,26\n*Chiffre d'affaires 3 553 694 435,37 0,00 3 553 694 435,37 3 536 843 654,01\n*Variation de stocks de produits (+ ou -) (I) 0,00 0,00\n* I pm om uro eb li ll eis -mat êio mns e produites par l'entreprise 0,00 0,00\n*Subventions d'exploitation 0,00 0,00\n*Autres produits d'exploitation 2 289 600,00 2 289 600,00 2 776 800,00\n* R che ap rr gis ee ss d'exploitation, transfert de 1 869 417,59 1 869 417,59 3 627 604,05\nTOTAL I 3 557 853 452,96 0,00 3 557 853 452,96 3 543 248 058,06\nII Charges d'exploitation *Achats revendus (2) de marchandises 2 969 122 586,77 20 205,28 2 969 142 792,05 2 889 599 035,35\n* A foc uh ra nt its u c reo snsommés (2) de matières et 41 209 172,10 7 957,25 41 217 129,35 38 045 422,65\n*Autres charges externes 236 540 387,09 498 325,84 237 038 712,93 217 637 499,48\n*Impôts et taxes 11 796 320,40 292 898,14 12 089 218,54 13 112 044,43\n*Charges de personnel 195 730 673,66 195 730 673,66 196 855 953,50\n*Autres charges d'exploitation 5 198 337,14 5 198 337,14 5 195 829,78\n*Dotations d'exploitation 75 444 067,06 75 444 067,06 66 983 884,78\nTOTAL II 3 535 041 544,22 819 386,51 3 535 860 930,73 3 427 429 669,97\nR\nE\nI C\nN\nA\nN\nI\nF\nIII RÉSULTAT D'EXPLOITATION (I-II) 22 811 908,74 -819 386,51 21 992 522,23 115 818 388,09\nIV Produits financiers\n* P auro trd eu si t ts it rd ee ss i mtit mre os b d ile is ép sarticipation et 37 400 000,00 37 400 000,00 32 000 000,00\n*Gains de change 49 174,33 49 174,33 33 235,13\n*Intérêts et autres produits financiers 38 823 553,45 38 823 553,45 23 012 296,59\n* cR hae rp gr eis ses financières, transferts de 6 682,55 6 682,55 2 992,00\nTOTAL IV 76 279 410,33 0,00 76 279 410,33 55 048 523,72\nV Charges financières\n*Charges d'intérêts 51 996 275,32 51 996 275,32 28 718 631,52\n*Pertes de change 13 669,77 13 669,77 24 149,60\n*Autres charges financières 0,00 0,00 321,20\n*Dotations financières 5 458,20 5 458,20 6 682,55\nTOTAL V 52 015 403,29 0,00 52 015 403,29 28 749 784,87\nVI RÉSULTAT FINANCIER (IV-V) 24 264 007,04 0,00 24 264 007,04 26 298 738,85\nVII RÉSULTAT COURANT (III+VI) 47 075 915,78 -819 386,51 46 256 529,27 142 117 126,94\nVIIIPRODUITS NON COURANTS\nR\nE\nI C\nN\nA N\nI\nF\nÉTATS FINANCIERS\nSOCIAUX\nAU 31 DÉCEMBRE 2023\n* Produits des cessions d'immobilisations 279 475 296,03 279 475 296,03 247 371 586,94\n*Autres produits non courants 6 356 399,15 6 356 399,15 27 513 173,49\n* Reprises sur subventions\nd'investissements\n* R eprises non courantes, transferts de\ncharges\nTOTAL VIII 285 831 695,18 0,00 285 831 695,18 274 884 760,43 IX CHARGES NON COURANTES\n* V ima mle ou brs il in se at tt ioe ns sd c'a ém déo ert sissements des 119 941 126,85 119 941 126,85 70 237 799,07\n*Subventions accordées 0,00 0,00\n*Autres charges non courantes 8 129 771,61 0,00 8 129 771,61 40 869 431,48\n* a D mot oa rt ti io sn ss e mno en n tc so eu tr a an ut xe ps ra ou vx is ions 0,00 0,00\nTOTAL IX 128 070 898,46 0,00 128 070 898,46 111 107 230,55\nX RÉSULTAT NON COURANT (VIII-IX) 157 760 796,72 0,00 157 760 796,72 163 777 529,88\nXI RÉSULTAT AVANT IMPÔTS (VII+X) 204 836 712,50 (819 386,51) 204 017 325,99 305 894 656,82\nXII IMPÔTS SUR LES RÉSULTATS 34 366 808,00 0,00 34 366 808,00 40 198 653,00\nXIII RÉSULTAT NET (XI-XII) 170 469 904,50 (819 386,51) 169 650 517,99 265 696 003,82\nXIV TOTAL DES PRODUITS (I+IV+VIII) 3 919 964 558,47 0,00 3 919 964 558,47 3 873 181 342,21\nXV TOTAL DES CHARGES (II+V+IX+XIII) 3 749 494 653,97 819 386,51 3 750 314 040,48 3 607 485 338,39\nXVI R toÉ taS lU dL eT sA cT h N aE rgT e ( sT )otal des produits - 170 469 904,50 -819 386,51 169 650 517,99 265 696 003,82\nAuto HALL S.A. Km 12, Autoroute Casa-Rabat, Sortie Al Qods- Casablanca Maroc Téléphone: 0522 76 14 00/01/02 Fax: 0522 76 14 14/15 Email: autohall@autohall.ma\nÉTATS FINANCIERS\nSOCIAUX\nAU 31 DÉCEMBRE 2023\nTABLEAU DE FINANCEMENT DE L’EXERCICE\nI Synthèse des masses du bilan\nExercice du 1 janvier 2023\n(Montants en dhs)\nau 31 décembre 2023\nExercice Exercice Variation (a-b)\nMASSES précédent\n(a) (b) Emplois (c) Ressources (d)\n1 Financement permanent 1 571 491 019,96 1 577 871 349,97 6 380 330,01\n2 Moins actif immobilisé 1 440 033 319,29 1 300 375 450,46 139 657 868,83\n3 = Fonds de roulement fonctionnel (1-2) (A) 131 457 700,67 277 495 899,51 146 038 198,84\n4 Actif circulant 2 518 106 489,68 1 925 093 796,12 593 012 693,56\n5 Moins passif circulant 1 143 245 250,98 1 079 902 119,02 63 343 131,96\n6 = Besoins de financement global (4-5) (B) 1 374 861 238,70 845 191 677,10 529 669 561,60\n7 = Trésorerie nette (actif-passif) (A - B) (1 243 403 538,03) (567 695 777,59) 675 707 760,44\nII Emplois et Ressources\nEXERCICE EXERCICE PRÉCÉDENT\nEMPLOIS RESSOURCES EMPLOIS RESSOURCES\nRESSOURCES STABLES DE L’EXERCICE (FLUX)\nAUTOFINANCEMENT (A) 0,00 (92 657 386,00) 0,00 (22 943 344,86)\nCapacité d’autofinancement 83 373 462,00 153 087 503,14\n- Distribution de bénéfices 176 030 848,00 176 030 848,00\nCESSIONS ET RÉDUCTIONS D’IMMOBILISATIONS (B) 0,00 279 475 296,03 0,00 247 371 586,94\nCession d’immobilisations incorporelles\nCession d’immobilisations corporelles 279 475 296,03 247 371 586,94\nCession d’immobilisations financières\nRécupérations sur créances immobilisées\nAUGMENTATIONS DES CAPITAUX PROPRES ET ASSIMILÉS (C) 0,00 0,00 0,00 0,00\nAugmentations de capital, apports\nSubventions d’investissement\nAUGMENTATIONS DES DETTES DE FINANCEMENT (D)\nI. TOTAL DES RESSOURCES STABLES (A+B+C+D) 0,00 186 817 910,03 224 428 242,08\nEMPLOIS STABLES DE L’EXERCICE (FLUX)\nACQUISITIONS ET AUGMENTATIONS D’IMMOBILISATIONS (E) 332 187 206,99 0,00 208 849 483,88 0,00\nAcquisition d’immobilisations incorporelles 2 800 000,00\nAcquisition d’immobilisations corporelles 119 577 206,99 198 849 483,88\nAcquisition d’immobilisations financières 209 810 000,00 10 000 000,00\nAugmentation des créances immobilisées\nREMBOURSEMENTS DES CAPITAUX PROPRES (F)\nREMBOURSEMENTS DES DETTES DE FINANCEMENT (G)\nEMPLOIS EN NON VALEURS (H) 668 901,88 1 363 920,15\nII. TOTAL - EMPLOIS STABLES (E+F+G+H) 332 856 108,87 0,00 210 213 404,03 0,00\nIII. VARIATION DU BESOIN DE FINANCEMENT GLOBAL (BFG) 529 669 561,60 0,00 542 613 596,03\nIV. VARIATION DE LA TRÉSORERIE 0,00 675 707 760,44 528 398 757,98\nTOTAL GÉNÉRAL 862 525 670,47 862 525 670,47 752 827 000,06 752 827 000,06\nÉTAT DES DÉROGATIONS\nExercice Clos au 31 décembre 2023\nINFLUENCE DES DÉROGATIONS SUR LE PATRIMOINE, LA SITUATION FINANCIÈRE ET\nINDICATION DES DÉROGATIONS JUSTIFICATIONS DES DÉROGATIONS\nLES RÉSULTATS\nI Dérogations aux principes comptables fondamentaux NÉANT NÉANT\nII Dérogations aux méthodes d’évaluation NÉANT NÉANT\nIII Dérogations aux règles d’établissement des états de synthèse NÉANT NÉANT\nÉTAT DES CHANGEMENTS DE MÉTHODES\nExercice Clos au 31 décembre 2023\nNATURE DES CHANGEMENTS JUSTIFICATION DU CHANGEMENT INFLUENCE SUR LE PATRIMOINE, LA SITUATION FINANCIÈRE ET LES RÉSULTATS\n\"I. Changements affectant les méthodes d'évaluation\" NÉANT NÉANT\n\"II. Changements affectant les règles de présentation\" NÉANT NÉANT\nINDICATION DES METHODES D’EVALUATION APPLIQUEES PAR L’ENTREPRISE\nExercice Clos au 31 décembre 2023\nI - ACTIF IMMOBILISE\nA. Evaluation à l'entrée\n1. Immobilisations en non-valeurs Valeur nominale\n2. Immobilisations incorporelles Coût d'aquisition\n3. Immobilisations corporelles Coût d'aquisition\n4. Immobilisations financières Prix d'achat\nB. Corrections de valeurs\n1. Méthodes d'amortissements Linéaire\n2. Méthodes d'évaluation des provisions pour dépréciation Selon le risque\n3. Méthodes de détermination des écarts de conversion - Actif\niI - ACTIF CIRCULANT (Hors trésorerie)\nA. Evaluation à l'entrée\n1. Stocks\n- Matières premières et marchandises Coût d'aquisition\n- Produits finis et en cours Néant\n2. Créances Montant nominal\n3. Titres et valeurs de placement Prix d'achat\nB. Corrections de valeurs\nLes provisions sur créances ordinaires sont calculées sur la base de l’ancienneté des créances. La règle de provisionnement stipule des taux de provisionnement de 15% à 60% selon\n2. Méthodes d'évaluation des provisions pour dépréciation l’antériorité des créances allant de 1an à 5ans. Les provisions pour créances douteuses ou précontentieuses sont déterminées au cas par cas en fonction de l’appréciation du risque par\nle management de la société.\n3. Méthodes de détermination des écarts de conversion - Actif\niII - FINANCEMENT PERMANENT\n1. Méthodes de réévaluation Néant\n2. Méthodes d'évaluation des provisions réglementées Selon budget trienal\n3. Dettes de financement permanent Néant\n4. Méthodes d'évaluation des provisions durables pour risques et\nSelon risque\ncharges\n5. Méthodes de détermination des écarts de conversion - Passif\niV - PASSIF CIRCULANT (Hors trésorerie)\n1. Dettes du passif circulant Coût réel d'entrée\n2. Méthodes d'évaluation des autres provisions pour risques et\nSelon risque\ncharges\n3. Méthodes de détermination des écarts de conversion - Passif\nv - TRESORERIE\n1. Trésorerie - Actif Coût réel d'entrée\n2. Trésorerie - Passif Coût réel d'entrée\n1. Méthodes d'évaluation des provisions pour dépréciation Néant\nAuto HALL S.A. Km 12, Autoroute Casa-Rabat, Sortie Al Qods- Casablanca Maroc Téléphone: 0522 76 14 00/01/02 Fax: 0522 76 14 14/15 Email: autohall@autohall.ma\nÉTATS FINANCIERS\nSOCIAUX\nAU 31 DÉCEMBRE 2023\nTABLEAU DES IMMOBILISATIONS AUTRES QUE FINANCIÈRES\n(Montants en dhs) Exercice Clos au 31 décembre 2023\nAUGMENTATION DIMINUTION MONTANT\nMONTANT BRUT\nNATURE DÉBUT EXERCICE Acquisition Produ pc ot uio rn e p lla er -m l’ êe mnt ereprise Virement Cession Retrait Virement FIN EB XR EU RT C ICE\nIMMOBILISATION EN NON-VALEURS 59 819 014,53 668 901,88 0,00 0,00 0,00 1 069 082,36 0,00 59 418 834,05\n* Frais préliminaires 0,00\n* Charges à répartir sur plusieurs exercices 59 819 014,53 668 901,88 1 069 082,36 59 418 834,05\n* Primes de remboursement obligations 0,00\nIMMOBILISATIONS INCORPORELLES 140 000,00 2 800 000,00 0,00 0,00 140 000,00 0,00 0,00 2 800 000,00\n* Immobilisation en recherche et développement 2 800 000,00 2 800 000,00\n* Brevets, marques, droits et valeurs similaires 0,00\n* Fonds commercial 140 000,00 140 000,00 0,00\n* Autres immobilisations incorporelles 0,00\nIMMOBILISATIONS CORPORELLES 828 093 098,59 119 577 207,29 0,00 199 660,00 206 079 752,64 0,00 199 660,00 741 590 553,24\n* Terrains 147 095 510,29 36 105 647,80 110 989 862,49\n* Constructions 397 789 223,14 9 944 791,80 57 020,00 86 779 963,29 321 011 071,65\n* Installations techniques, matériel et outillage 53 625 052,98 1 608 958,57 79 236,01 55 154 775,54\n* Matériel de transport 137 839 571,42 100 871 091,75 83 114 905,54 155 595 757,63\n* Mobilier, matériel de bureau et aménagements 76 926 343,79 4 204 332,21 142 640,00 81 273 316,00\n* Autres immobilisations corporelles Informatiques 0,00 0,00\n* Immobilisations corporelles en cours 14 817 396,97 2 948 032,96 199 660,00 17 565 769,93\nTotal 888 052 113,12 123 046 109,17 0,00 199 660,00 206 219 752,64 1 069 082,36 199 660,00 803 809 387,29\nTABLEAU DES AMORTISSEMENTS\n(Montants en dhs) Exercice Clos au 31 décembre 2023\nCumul début exercice Dotation de l'exercice Amortissements sur immobilisations Cumul d'amortissement fin exercice\nNATURE\n1 2 sorties 3 4 =1+2+3\nIMMOBILISATION EN NON-VALEURS 35 387 693,43 11 883 766,82 1 069 082,36 46 202 377,89\n* Frais préliminaires 0,00\n* Charges à répartir sur plusieurs exercices 35 387 693,43 11 883 766,82 1 069 082,36 46 202 377,89\n* Primes de remboursement des obligations 0,00\nIMMOBILISATIONS INCORPORELLES 0,00 560 000,00 0,00 560 000,00\n* Immobilisation en recherche et développement 0,00 560 000,00 560 000,00\n* Brevets, marques, droits et valeurs similaires 0,00\n* Fonds commercial 0,00\n* Autres immobilisations incorporelles 0,00\nIMMOBILISATIONS CORPORELLES 354 408 074,23 60 813 346,37 86 278 625,49 328 942 795,11\n* Terrains 0,00\n* Constructions 242 781 805,68 16 770 636,18 66 706 284,71 192 846 157,15\n* Installations techniques, matériel et outillage 39 424 464,71 3 101 721,79 78 670,03 42 447 516,47\n* Matériel de transport 18 816 815,74 34 411 823,81 19 493 670,75 33 734 968,80\n* Mobilier, matériel de bureau et aménagement 53 384 988,10 6 529 164,59 59 914 152,69\n* Autres immobilisations corporelles Informatique 0,00\n* Immobilisations corporelles en cours 0,00\nTOTAL GENERAL 389 795 767,66 73 257 113,19 87 347 707,85 375 705 173,00\nTABLEAU DES TITRES DE PARTICIPATION\n(Montants en dhs) Exercice Clos au 31 décembre 2023\nValeur Extraits des derniers états de synthèse de la Produits inscrits\nParticipation Prix\nRaison sociale de la société Secteur d’activité Capital social Comptable société émettrice au C P C de\nN° IF au capital en % d’acquisition global\némettrice 1 2 Nette Date de Situation nette Résultat net l’exercice\n3 4\n5 clôture 6 7 8 9\nDIAMOND MOTORS 1050178 Automobile 50 000 000,00 99,99 49 600 000,00 49 600 000,00 31/12/2023 59 005 988,00 4 105 119,85 4 700 000,00\nSCAMA 1050164 Automobile 200 000 000,00 99,99 139 995 500,00 139 995 500,00 31/12/2023 223 155 599,37 6 006 791,26 12 000 000,00\nSOMMA 1048137 Matériel agricole & TP 91 666 500,00 99,99 61 994 000,00 61 994 000,00 31/12/2023 94 986 562,86 4 289 793,32 0,00\nSM2A 4902757 Automobile 150 000 000,00 99,99 144 959 900,00 144 959 900,00 31/12/2023 159 262 383,79 5 596 922,30 9 400 000,00\nLEADER LOCATION 40276844 Location de voitures 30 000 000,00 99,99 29 999 500,00 29 999 500,00 31/12/2023 30 471 439,46 -1 311 705,46 0,00\nAUTO HALL.COM 40104933 Communication & publicité 500 000,00 99,99 499 400,00 499 400,00 31/12/2023 928 375,37 274 782,08 1 500 000,00\nAUTO HALL CAPITAL\n14443027 Services financiers 10 000 000,00 100,00 10 000 000,00 10 000 000,00 31/12/2023 11 228 215,02 379 512,85 0,00\nDEVELOPPEMENT\nAUTO HALL VEHICULES\n40241074 Automobile 100 000 000,00 99,99 70 000 000,00 70 000 000,00 31/12/2023 109 378 428,07 3 806 427,85 7 800 000,00\nINDUSTRIELS\nAUTO HALL IMMOBILIER 15170665 Immobilier 200 000 000,00 0,00 200 000 000,00 200 000 000,00 31/12/2023 136 439 313,51 -19 011 150,74 0,00\nSMVN 15188504 15188504 100 000 000,00 100,00 100 000 000,00 100 000 000,00 31/12/2023 82 743 691,00 -6 272 953,47 0,00\nAFRICA MOTORS 15241708 Automobile 50 000 000,00 100,00 50 000 000,00 50 000 000,00 31/12/2023 -14 863 944,86 -39 149 387,25 0,00\nAUTO HALL OCCASION 48591836 Vente véhicules d'occasion 30 000 000,00 100,00 30 000 000,00 30 000 000,00 31/12/2023 6 180 385,70 -10 521 070,00 0,00\nLEADER LOCATION CAMIONS 50360519 Location des camions 15 000 000,00 100,00 15 000 000,00 15 000 000,00 31/12/2023 12 482 173,51 -1 128 824,99 0,00\nAUTO HALL LUXURY 14423440 Automobile 30 000 000,00 100,00 30 000 000,00 30 000 000,00 31/12/2023 -1 900 845,61 -6 340 494,15 0,00\nSMAM 52639337 Automobile 10 000 000,00 100,00 10 000 000,00 10 000 000,00 31/12/2023 12 005 150,59 1 889 081,00 2 000 000,00\nAUTRES 0 0,00 0,00 34 590,00 34 590,00 31/12/2023 0,00 0,00 0,00\nSOUSCRIPTION PART\n0 0,00 0,00 69 585 000,00 69 585 000,00 31/12/2023 0,00 0,00 0,00\nRESIDUELLES\nTOTAL 1 067 166 500,00 -- 1 011 667 890,00 1 011 667 890,00 863 702 688,59 -57 593 691,37 37 400 000,00\nTABLEAU DES PROVISIONS\n(Montants en dhs) Exercice Clos au 31 décembre 2023\nMontant début Dotations Reprises\nNature Montant fin d’exercice\nd’exercice d’exploitation financières non courantes d’exploitation financières non courantes\n1 Provisions pour dépréciation de l’actif immobilisé 0,00\n2 Provisions réglementées 0,00\n3 Provisions durables pour risques et charges 0,00\nSOUS TOTAL (A) 0,00 0,00 0,00 0,00 0,00 0,00 0,00 0,00\n4 Provisions pour dépréciation de l’actif circulant 63 134 254,77 2 186 953,87 651 708,71 64 669 499,93\n( hors trésorerie )(Clients et stocks)\n5 Autres provisions pour risques et charges 6 682,55 5 458,20 974 555,40 6 682,55 980 013,60\n6 Provisions pour dépréciation des comptes de trésorerie 0,00 0,00\nSOUS TOTAL (B) 63 140 937,32 2 186 953,87 5 458,20 974 555,40 651 708,71 6 682,55 0,00 65 649 513,53\nTOTAL ( A + B ) 63 140 937,32 2 186 953,87 5 458,20 974 555,40 651 708,71 6 682,55 0,00 65 649 513,53\nAuto HALL S.A. Km 12, Autoroute Casa-Rabat, Sortie Al Qods- Casablanca Maroc Téléphone: 0522 76 14 00/01/02 Fax: 0522 76 14 14/15 Email: autohall@autohall.ma\nÉTATS FINANCIERS\nSOCIAUX\nAU 31 DÉCEMBRE 2023\nTABLEAU DES CRÉANCES\n(Montants en dhs) Exercice Clos au 31 décembre 2023\nANALYSE PAR ÉCHÉANCE AUTRES ANALYSES\nCRÉANCES TOTAL Échues et non Montants Montants sur l’État et Montants sur les Montants\nPlus d’un an Moins d’un an représentés\nrecouvrées en devises organismes publics entreprises liées\npar des effets\nDE L’ACTIF IMMOBILISÉ 261 215,00\n* Prêts immobilisés 261 215,00 36 215,00 225 000,00\n* Autres créances financières\nDE L’ACTIF CIRCULANT 2 352 850 943,97 13 249 842,88 2 252 126 999,43 87 474 101,66 100 490,00 103 817 071,99 1 375 375 477,00 11 827 813,86\n* Fournisseurs débiteurs, avances et acomptes 87 968 325,65 87 826 294,41 142 031,24\n* Clients et comptes rattachés 835 321 992,55 13 249 842,88 734 884 902,66 87 187 247,01 100 490,00 53 734 456,82 11 827 813,86\n* Personnel 3 273 373,27 3 273 373,27\n* État 103 817 071,99 103 817 071,99 103 817 071,99\n* Comptes d’associés et sociétés du groupe 1 321 641 020,18 1 321 641 020,18 1 321 641 020,18\n* Autres débiteurs\n* Comptes de régularisation - Actif 829 160,33 684 336,92 144 823,41\nTABLEAU DES DETTES\n(Montants en dhs) Exercice Clos au 31 décembre 2023\nANALYSE PAR ÉCHÉANCE AUTRES ANALYSES\nDETTES TOTAL Échues et non Montants Montants sur l’État Montants sur les Montants représentés\nPlus d’un an Moins d’un an\nrecouvrées en devises et organismes publics entreprises liées par des effets\nDE FINANCEMENT\n* Emprunts obligataires\n* Autres dettes de financement\nDU PASSIF CIRCULANT 1 142 265 237,38 140 165 686,25 988 917 999,29 13 181 551,84 180 907,23 15 851 900,62 960 519 519,51 143 676 299,79\n* Fournisseurs et comptes rattachés 541 218 202,52 140 165 686,25 390 596 163,84 10 456 352,43 180 907,23 461 360 779,29 143 676 299,79\n* Clients créditeurs, avances et acomptes 12 839 182,34 10 113 982,93 2 725 199,41 163 908,33\n* Personnel 1 714 594,44 1 714 594,44\n* Organismes sociaux 10 228 573,51 10 228 573,51 10 228 573,51\n* État 5 623 327,11 5 623 327,11 5 623 327,11\n* Clients créditeurs, avances et acomptes 498 994 831,89 498 994 831,89 498 994 831,89\n* Autres créanciers 3 426 621,91 3 426 621,91\n* Comptes de régularisation - Passif 68 219 903,66 68 219 903,66\nTABLEAU DES SÛRETÉS RÉELLES DONNÉES OU REÇUES\nExercice Clos au 31 décembre 2023\nTIERS CRÉDITEURS OU DÉBITEURS MONTANT SC ÛO RU EV TE ÉRT PAR LA NAT (1U )RE DD ’IA NT SE C E RT IP L TI IE OU N O (2B )J (E 3)T VALEUR COMPTABL DE A N TE ET DT EE CD LE Ô L TA U S RÛ ERETÉ DONNÉE À LA\n* Sûretés données\n* Sûretés reçues\n- MACHKOUR MOHAMED 786 000,00 Nantissment matériel (4 tracteurs)\n- EDDLYMY HAMID 21 879 942,20 Saisie exécutée à hau Ute nu 3r èd me e1 . b4 i0 e0 n. 0 e0 st0 e,0 n0 c ( op uro rsd u di et d ve e nv te ente de 2 biens saisis). membre du personnel\n- IZARZAR NABIL 1 973 173,67 Saisie conservatoire sur appartement TF 34743/61 membre du personnel\n- EL MOUDDEN Mohamed 693 086,88 Saisie conservatoire sur maison R+2\n(1) Gage : 1- Hypothèque : 2- Nantissement : 3- Warrant : 4- Autres : 5- (à préciser)\n(2) préciser si la sûreté est donnée au profit d’entreprises ou de personnes tierces (sûretés données)\n(entreprises liées, associés, membres du personnel)\n(3) préciser si la sûreté reçue par l’entreprise provient de personnes tierces autres que le débiteur (sûretés reçues)\nENGAGEMENTS FINANCIERS REÇUS OU DONNÉS HORS OPÉRATIONS DE CRÉDIT-BAIL\n(Montants en dhs) Exercice Clos au 31 décembre 2023\nENGAGEMENTS DONNÉS M EO XN ET RA CN ICT ES PM RE ÉO X CN E ÉT R DA C EN IC NT ES\nT\n*Avals et cautions 61 068 000,00 41 018 740,00\n- Cautions provisoires 7 142 000,00 4 447 000,00\n- Cautions définitives 5 093 000,00 4 524 740,00\n- Retenues de garanties 17 185 000,00 11 288 000,00\n- Cautions étrangères 4 315 000,00 4 411 000,00\n- Cautions diverses 27 333 000,00 16 348 000,00\n*Autres engagements donnés -\n- Autres cautions 45 000 000 Euro 45 000 000 Euro\n- Crédits documentaires\n- Saisie arrêt\n- Engagement prime de départ à la retraite\nTOTAL (1) 61 068 000,00 41 018 740,00\n45 000 000 Euro 45 000 000 Euro\n(1) dont engagements à l'égard d'entreprise liées 45 000 000 Euro 45 000 000 Euro\nENGAGEMENTS REÇUS MONTANTS EXERCICE MONTANTS EXERCICE PRÉCÉDENT\n* Avals et cautions\nmarchandises 200 000 000,00\nTotal 200 000 000,00\nLe rapport financier de l’année 2023 serait disponible, à partir du 30 avril 2023, sur le site internet d'Auto Hall www.autohall.ma.\nAuto HALL S.A. Km 12, Autoroute Casa-Rabat, Sortie Al Qods- Casablanca Maroc Téléphone: 0522 76 14 00/01/02 Fax: 0522 76 14 14/15 Email: autohall@autohall.ma\nÉTATS FINANCIERS\nSOCIAUX\nAU 31 DÉCEMBRE 2023\nAuto HALL S.A. Km 12, Autoroute Casa-Rabat, Sortie Al Qods- Casablanca Maroc Téléphone: 0522 76 14 00/01/02 Fax: 0522 76 14 14/15 Email: autohall@autohall.ma\nÉTATS FINANCIERS\nCONSOLIDÉS\nAU 31 DÉCEMBRE 2023\nPRINCIPES COMPTABLES DE CONSOLIDATION\nPRINCIPES COMPTABLES l’acquisition d’immobilisations. De ce fait, aucun retraitement n’a été effectué par norme IFRS 16, entrée en vigueur à partir du 1er janvier 2019 et qui vient remplacer\nEn application de l’avis n° 5 du Conseil National de la Comptabilité (CNC) du 26 mai le groupe pour ce cas. la norme IAS 17 portant sur les contrats de location financement. Les contrats de\n2005 et conformément aux dispositions de la circulaire du Conseil Déontologique Les durées de vie retenues des immobilisations sont les suivantes : location simple dont dispose le groupe sont conclus entre entités appartenant au\ndes Valeurs Mobilières (CDVM), les comptes consolidés du groupe Auto Hall ont été Constructions (gros œuvres) 30 ans périmètre de consolidation. En conséquence les charges et produits qui en résultent\nétablis en conformité avec les normes comptables internationales IFRS (International Aménagements des constructions 3 à 20 ans s’annulent dans les comptes consolidés.\nFinancial Reporting Standards) telle qu’adoptés par la commission européenne. Installations techniques, matériel et outillage 2 à 15 ans Par ailleurs, le groupe Auto Hall dispose de contrats de leasing. Ces contrats continuent\nMatériel informatique 5 ans de faire l’objet de retraitement conformément à la norme IFRS 16.\nPÉRIMÈTRE ET MÉTHODES DE CONSOLIDATION Matériel de transport 4 à 10 ans - Incertitude relative aux traitements fiscaux -IFRIC 23-\nToutes les sociétés entrant dans le périmètre sont contrôlées exclusivement par le Matériel, mobilier de bureau 10 ans Le Groupe a établi un diagnostic et une étude d’impact pour la mise en œuvre de\ngroupe et donc consolidées par intégration globale. Enfin, le groupe n’a pas opté pour la réévaluation des immobilisations corporelles. l’interprétation IFRIC 23, entrée en vigueur à partir du 1er janvier 2019, en procédant\nPRINCIPALES RÈGLES APPLIQUÉES - Avantages au personnel -IAS 19- par une revue des sources d’incertitudes fiscales (IS) déterminées par la Direction,\n- Immobilisations incorporelles -IAS 38- Conformément à la norme IAS 19, les obligations au titre des avantages postérieurs puis par l’évaluation et le chiffrage des risques liés à ces incertitudes afin de refléter\nElles comprennent exclusivement un fonds commercial, non amortissable. La à l’emploi du régime à prestations définies sont calculées annuellement par un au mieux le montant décaissable lors d’un contrôle fiscal.\ncomptabilisation de ce fond est effectuée au coût historique diminué de la perte de actuaire indépendant. - IFRS 9 :\nvaleur éventuelle estimée à chaque clôture par le management du groupe. - Retraitement des impôts -IAS 12- La classification des actifs financiers en norme IFRS 9 prend en compte le modèle\n- Immobilisations corporelles -IAS 16- Les impôts différés résultant de la neutralisation des différences temporaires introduites par économique de l’entité pour la gestion des actifs financiers et les caractéristiques des\nLes immobilisations corporelles sont comptabilisées au bilan pour leur coût d’acquisition les règles fiscales et des retraitements de consolidation sont calculés société par société. flux de trésorerie contractuels de l’actif. Ce volet n’a pas d’impact significatif pour le\nou de revient, diminué des amortissements et des pertes de valeur éventuellement - Actions propres -IAS 32- Groupe Auto Hall (hors fonds de titrisation FT Mobility)\nconstatées. Les amortissements sont calculés selon la méthode linéaire, en fonction Les actions de la société Auto Hall détenues par elle ou par ses filiales sont portées Avec la création du Fonds, et dans le cadre de cette norme, le Gpe a introduit le\nde la durée de vie estimée des actifs concernés en tenant compte également des en diminution des capitaux propres consolidés. Les résultats de cessions réalisés sur nouveau modèle de dépréciation, prospectif, fondé sur les « pertes attendues ECL ».\nvaleurs résiduelles pour le cas du matériel de transport. ces titres sont exclus du résultat net et sont imputés aux capitaux propres. Il s’agit des pertes de crédit attendues sur les créances que l’entreprise s’attend à ne\nIl est à noter également que les sociétés du groupe ne disposent pas de frais financiers - Contrats de location -IFRS 16- pas recouvrer, pondérées par la probabilité de survenance de ces pertes sur toute\nqui peuvent faire l’objet d’une intégration dans le coût des immobilisations corporelles. Le Groupe a établi un diagnostic et une étude d’impact pour la mise en œuvre de la la durée de vie de l’instrument.\nEn plus, aucune subvention d’investissement n’a été reçue par le groupe pour\nSociétés Activité % contrôle\nAuto Hall A ms as te ém rieb l la ing de u se tt r ic eo l m etm de er c Ti .a Pl .isation de véhicules industriels de marque Mitsubishi Fuso et la distribution de voitures particulières, de véhicules utilitaires légers, de matériel agricole et de 100%\nSCAMA Importation et Commercialisation des véhicules de marque Ford. 100%\nDiamond Motors Importation et Commercialisation des véhicules de marque Mitsubishi. 100%\nSOMMA (fusion absorption de SOBERMA) Importation et Commercialisation de matériel agricole, TP et mines de marque New Holland, Casa, Belaz et autres. 100%\nLeader Location LD Location longue durée de véhicules sans chauffeur 100%\nAuto Hall.com’ Société de communication 100%\nSMAA Importation et commercialisation de véhicules de marque Opel 100%\nAuto Hall Véhicules Industriels Assemblage et commercialisation de véhicules industriels 100%\nAuto Hall Capital Développement Fonds d’investissement 100%\nAuto Hall Immobilier Fonds d’investissement ou autres opérations immobilières 100%\nSMVN Importation et commercialisation des véhicules de marque Nissan 100%\nAfrica Motors Importation et commercialisation de marque DFSK/ Foton /Gaz et Chery 100%\nAuto Hall Occasion Vente de matériel d’occasion 100%\nLeader Location Camion Location longue durée de camions 100%\nAuto Hall Luxury Motors Importation et commercialisation de véhicules de marque Maserti 100%\nFT ‘’Auto Moblity’’ Fonds de titrisation de créances des clients Auto Hall contractées auprès du partenaire SOFAC et dont les parts résiduelles sont détenues exclusivement par Auto Hall. 100%\nSociété Marocaine de l’Automobile Moderne Commercialisation de véhicules de marques Fiat, Jeep & Alfa Romeo (Partenariat FCA Stellantis) 100%\nBILAN ACTIF COMPTE DE RÉSULTAT\nACTIF (En dirhams) 31 décembre 2023 31 décembre 2022 (En dirhams) 31 décembre 2023 31 décembre 2022\nGoodwill 22 148 218,93 22 148 218,93 Chiffre d'affaires 4 912 106 381,56 4 831 136 612,44\nCoût des biens vendus 4 111 663 436,84 3 950 790 016,67\nImmobilisations incorporelles 55 189 006,71 55 056 900,46\nCharges externes 161 852 116,31 155 881 119,19\nImmobilisations corporelles 2 018 971 130,70 1 928 179 529,32\nCharges de personnel 263 039 933,18 266 884 950,55\nAutres instruments financiers * 639 565 361,74* 577 896,03 Impôts et taxes 23 327 063,63 24 518 036,28\nImpôts différés actif 32 394 355,00 29 699 701,40 Dotations d'exploitations 247 727 420,83 197 546 592,21\nReprises d'exploitations 17 023 766,77 22 280 546,32\nActifs non courants 2 768 268 073,08 2 035 662 246,14\nAutres produits 307 089 236,20 184 626 686,23\nStocks 1 558 037 685,63 1 425 132 595,61\nAutres charges 220 926 103,46 183 689 882,16\nComptes clients 956 069 862,25 969 902 293,14 RÉSULTAT OPÉRATIONNEL 207 683 310,28 258 733 247,93\nAutres créances d'exploitation 517 140 619,77 457 149 015,60 Produits financiers 56 437 933,96 23 168 755,67\nCharges financières 167 023 375,09 101 155 878,57\nTrésorerie et équivalents de trésorerie 458 722 499,22 84 190 468,07\nRÉSULTAT FINANCIER -110 585 441,13 -77 987 122,90\nActifs courants 3 489 970 666,87 2 936 374 372,42\nRÉSULTAT CONSOLIDÉ AVANT IMPÔT 97 097 869,15 180 746 125,03\nTOTAL ACTIF 6 258 238 739,95 4 972 036 618,56 Charges d'impôt 69 218 371,52 80 682 053,35\n(*) : dont 637.854.702,70 dhs provenant du FT Auto Mobility - Impôt exigible 53 596 084,32 66 913 440,23\n- Impôt différé 15 622 287,20 13 768 613,12\nRÉSULTAT NET CONSOLIDÉ 27 879 497,63* 100 064 071,69\nBILAN PASSIF (*) : dont 1.323.581,84 dhs provenant du FT Auto Mobility\nPASSIF (En dirhams) 31 décembre 2023 31 décembre 2022 TABLEAU DE FLUX DE TRÉSORERIE\nCapital social 502 945 280,00 502 945 280,00\n(En milliers de dirhams) 31 décembre 2023 31 décembre 2022\nPrime d'émission 251 021 566,80 251 021 566,80\nFlux de trésorerie d'exploitation 688 132 -341 669\nRéserves consolidées 761 143 339,20 839 944 731,77 Résultat net consolidé 27 879 100 064\nRésultats consolidés de l'exercice** 27 879 497,63** 100 064 071,68 Dotations aux amortissements 232 888 182 959\nCapitaux propres part groupe 1 542 989 683,63 1 693 975 650,26 Élimination des impôts différés 15 623 13 769\nIntérêts minoritaires Produits de cession des immobilisations corporelles 290 025 144 983\nCapitaux propres 1 542 989 683,63 1 693 975 650,26 VNC sur cession d'actifs 182 361 113 247\nAutres passifs non courants* 1 010 236 974,13* 243 530 068,88 Variation du besoin en fond de roulement -191 557 -948 689\nImpôts différés passif 139 335 552,96 121 333 903,88 Autres produits/charges non encaissables 37\nPassifs non courants 2 692 562 210,71 2 058 839 623,02 Coût de l'endettement 130 913 51 961\nDettes fournisseurs 718 333 899,78 744 293 600,55\nFlux de trésorerie d'investissement -1 441 322 -662 010\nAutres passifs courants 262 491 819,92 249 024 531,31 Décaissements liés aux acquisitions des immobilisations -512 207 -511 671\nAutres passifs financiers à court terme 2 584 850 809,54 1 919 878 863,69 Encaissements liés aux cessions d'immobilisations corporelles -290 025 -144 983\nPassifs courants 3 565 676 529,24 2 913 196 995,54 Variation des autres instruments financiers* -640 307*\nTOTAL PASSIF 6 258 238 739,95 4 972 036 618,56 Autres mouvements (GW&Autres Mvts) 1 217 -5 356\n(*) : dont 574.719.176,44 dhs provenant du FT Auto Mobility Flux de trésorerie de financement 462 750 -290 577\n(**) : dont 1.323.581,84 dhs provenant du FT Auto Mobility\nDividendes mis en paiement au cours de l'exercice -176 031 -176 031\nDividendes convertis en actions\nVARIATION DES CAPITAUX PROPRES\nRemboursement des dettes de financement -37 210 -63 053\n(En milliers de dirhams) Capital d'émiP sr si im one coR né ss oe lr idve és s coR né ss ou ll it da ét dT uo t ga rl o P ua pr et minoI rn it té ar irê et Total Coût de l'endettement -130 913 -51 961\nCapitaux propres au 31 décembre Nouveaux emprunts 300 000\n2022 502 945 251 022 839 945 100 064 1 693 976 1 693 976\nDividendes -176 031 -176 031 -176 031 Titres de créances émis* 505 134*\nAffectation de résultat 100 064 -100 064 Autres 1 770 468\nRésultat net de l’exercice 27 879 27 879 27 879 Variation de trésorerie nette -290 440 -1 294 256\nA pru ot pre res sMouvements sur les capitaux -2 835 -2 835 -2 835 Trésorerie d'ouverture -1 835 688 -541 432\nTrésorerie de clôture -2 126 128 -1 835 688\nCapitaux propres au 31 décembre\n2023 502 945 251 022 761 143 27 879 1 542 989 1 542 989 (*) : valeurs relatives au FT Auto Mobiity\nAuto HALL S.A. Km 12, Autoroute Casa-Rabat, Sortie Al Qods- Casablanca Maroc Téléphone: 0522 76 14 00/01/02 Fax: 0522 76 14 14/15 Email: autohall@autohall.ma\nÉTATS FINANCIERS\nCONSOLIDÉS\nAU 31 DÉCEMBRE 2023\nAuto HALL S.A. Km 12, Autoroute Casa-Rabat, Sortie Al Qods- Casablanca Maroc Téléphone: 0522 76 14 00/01/02 Fax: 0522 76 14 14/15 Email: autohall@autohall.ma",
    "tables": [
        [
            {
                "AVIS DE CONVOCATION\nDES ACTIONNAIRES": "Casablanca, le 26 avril 2024"
            },
            {
                "AVIS DE CONVOCATION\nDES ACTIONNAIRES": "Société anonyme au capital de 502 945 280 dirhams\nSiège social : Casablanca – 64, avenue Lalla Yacout\nR.C. n°137 à Casablanca\nLes actionnaires de la société Auto Hall, société anonyme au capital de 502 945 280 dirhams, sont priés de bien vouloir assister\nà la réunion de l’Assemblée générale ordinaire qui se tiendra à Casablanca, km12 autoroute Casablanca-Rabat,\nle Mercredi 29 mai 2024, à 11 heures,\nà l’effet de délibérer et de statuer sur les points à l’ordre du jour suivant :\n- Rapport de gestion du Conseil d’administration sur l’exercice clos le 31 décembre 2023,\n- Rapport des commissaires aux comptes concernant le même exercice,\n- R apport spécial des commissaires aux comptes sur les conventions susceptibles d’être visées par les articles 56 et suivants de la loi\nn°17/95 telle que modifiée et complétée,\n- Approbation s’il y a lieu de ces rapports, bilan, comptes et quitus aux administrateurs,\n- Affectation des résultats,\n- Mandat d’administrateurs,\n- Pouvoirs en vue de l’accomplissement des formalités légales.\nLes actionnaires titulaires d’actions nominatives devront avoir été préalablement inscrits en compte, en nominatif pur ou en nominatif\nadministré, cinq jours avant la réunion. Ils seront admis à cette assemblée sur simple justification de leur identité.\nLes actionnaires propriétaires d’actions au porteur devront déposer ou faire adresser par leur banque au siège social, cinq jours avant la\nréunion, les attestations constatant leur inscription en compte auprès d’un intermédiaire habilité.\nConformément aux dispositions de loi n°17/95 relative aux sociétés anonymes telle que modifiée et complétée, les actionnaires réunissant\nles conditions exigées par l’article 117 de ladite loi, disposent d’un délai de 10 jours à compter de la publication du présent avis pour\ndemander l’inscription de projets de résolutions à l’ordre du jour de cette assemblée.\nLa société tient à la disposition des actionnaires l’ensemble des informations relatives à la réunion : modalités de participation et de vote,\nétats de synthèses de l’exercice 2023, rapports de gestion et des commissaires aux comptes sur son site web : www.autohall.ma.\nPROJET DE RÉSOLUTIONS\nEXERCICE 2023\nPREMIÈRE RÉSOLUTION\nL’Assemblée générale après avoir constaté :\n- qu’elle a été régulièrement convoquée,\n- q u’elle réunit le quorum du quart au moins du capital social pour la tenue des assemblées générales ordinaires prévu par la loi et par\nl’article 29 des statuts,\n- que les modalités de participation et de vote, le rapport de gestion, le texte et l’exposé des motifs des projets de résolutions présentés\npar le Conseil d’administration, le rapport des commissaires aux comptes sur les comptes de l’exercice 2023 ainsi que leur rapport\nspécial sur les conventions susceptibles d’être visées par les articles 56 et suivants de la loi n°17/95 telle que complétée et modifiée,\nl’inventaire, les états de synthèse arrêtés au 31 décembre 2023, ont été tenus à la disposition des actionnaires à partir de la date de\nconvocation de l’assemblée,\ndécide de délibérer valablement sur les questions inscrites à l’ordre du jour et donne en conséquence décharge de sa convocation\nrégulière au Conseil d’administration."
            }
        ],
        [
            {
                "ÉTATS FINANCIERS\nSOCIAUX\nAU 31 DÉCEMBRE 2023": "BILAN ACTIF du 01/01/2023 au 31/12/2023 BILAN PASSIF du 01/01/2023 au 31/12/2023\nEXERCICE EXERCICE EXERCICE\nACTIF (En dirhams) PRÉCÉDENT PASSIF (En dirhams) EXERCICE PRÉCÉDENT\nBrut AMORT & PROV Net Net\nIMMOBILISATIONS EN NON VALEURS (A) 59 418 834,05 46 202 377,89 13 216 456,16 24 431 321,10 Capitaux propres\n*Frais préliminaires 0,00 0,00 0,00 Capital social 502 945 280,00 502 945 280,00\n*Charges à répartir sur plusieurs exercices 59 418 834,05 46 202 377,89 13 216 456,16 24 431 321,10 Moins, actionnaires, capital souscrit non appelé capital appelé\n*Primes de remboursement des obligations Prime d'émission, de fusion, d'apport 251 021 566,80 251 021 566,80\nIMMOBILISATIONS INCORPORELLES (B) 2 800 000,00 560 000,00 2 240 000,00 140 000,00 T N Écarts de réévaluation\n*Immobilisations en recherche et développement 2 800 000,00 560 000,00 2 240 000,00 0,00 E Réserve légale 50 294 528,00 50 294 528,00\nÉ S *Brevets, marques, droits et valeurs similaires 0,00 0,00 0,00 0,00 *Fonds commercial 0,00 140 000,00 N A Autres réserves 596 402 127,57 496 402 127,57\nI L I *Autres immobilisations incorporelles IMMOBILISATIONS CORPORELLES (C) 741 590 553,24 328 942 795,11 412 647 758,13 473 685 024,36 M R E Report à nouveau (2) 1 176 999,60 11 511 843,78 Résultats nets en instance d'affectation (2)\nB *Terrains 110 989 862,49 110 989 862,49 147 095 510,29 P Résultat net de l'exercice 169 650 517,99 265 696 003,82\nO *Constructions 321 011 071,65 192 846 157,15 128 164 914,50 155 007 417,46 T Résultat avant impôts\nM *Installations techniques, matériel et outillage 55 154 775,54 42 447 516,47 12 707 259,07 14 200 588,27 N TOTAL DES CAPITAUX PROPRES (A) 1 571 491 019,96 1 577 871 349,97\nM *Matériel de transport 155 595 757,63 33 734 968,80 121 860 788,83 119 022 755,68 E CAPITAUX PROPRES ASSIMILÉS (B)\nI *Mobilier, matériel de bureau 81 273 316,00 59 914 152,69 21 359 163,31 23 541 355,69 *Autres immobilisations corporelles 0,00 0,00 M E Subventions d'investissement\nF *Immobilisations corporelles en cours 17 565 769,93 17 565 769,93 14 817 396,97 C Provisions réglementées\nI T IMMOBILISATIONS FINANCIÈRES (D) 1 011 929 105,00 0,00 1 011 929 105,00 802 119 105,00 N A DETTES DE FINANCEMENT (C)\nC *Prêts immobilisés 261 215,00 261 215,00 36 215,00 N Emprunts obligataires\nA *Autres créances financières 0,00 I F Autres dettes de financement\n*Titres de participation 1 011 667 890,00 1 011 667 890,00 802 082 890,00 PROVISIONS DURABLES POUR RISQUES ET CHARGES (D)\n*Autres titres immobilisés Provisions pour risques\nÉCARTS DE CONVERSION, ACTIF (E) 0,00 0,00 0,00 0,00 Provisions pour charges\n*Diminution des créances immobilisées\n*Augmentation des dettes de finance ÉCARTS DE CONVERSION, PASSIF (E)\nTOTAL I (A+B+C+D+E) 1 815 738 492,29 375 705 173,00 1 440 033 319,29 1 300 375 450,46 Augmentation des créances immobilisées\nSTOCKS (F) 229 919 587,44 15 780 956,28 214 138 631,16 141 114 505,25 Diminution des dettes de financement\n*Marchandises 226 066 761,57 15 752 216,00 210 314 545,57 137 979 615,39 TOTAL I (A+B+C+D+E) 1 571 491 019,96 1 577 871 349,97\nT N *Matières et fournitures consommables 0,00 *Produits en cours 3 852 825,87 28 740,28 3 824 085,59 3 134 889,86 T N DETTES DU PASSIF CIRCULANT (F) Fournisseurs et comptes rattachés 541 218 202,52 566 699 263,78\nA *Produits intermédiaires et produits résiduels 0,00 A L Client créditeurs, avances et acomptes 12 839 182,34 22 055 499,06\nL *Produits finis 0,00 U\nU CRÉANCES DE L'ACTIF CIRCULANT (G) 2 352 850 943,97 48 888 543,65 2 303 962 400,32 1 783 972 608,30 C R Personnel 1 714 594,44 2 718 416,06\nC *Fournis, débiteurs,avances et acomptes 87 968 325,65 87 968 325,65 41 193 006,63 I C Organismes sociaux 10 228 573,51 10 119 381,06\nR *Clients et comptes rattachés 835 321 992,55 48 888 543,65 786 433 448,90 1 025 895 816,07 F État 5 623 327,11 5 722 785,12\nI C *Personnel 3 273 373,27 3 273 373,27 4 180 229,69 I S S Comptes associés et sociétés du groupe 498 994 831,89 403 479 051,10\n*État 103 817 071,99 103 817 071,99 114 951 174,35 A Autres créances 3 426 621,91 3 633 800,37\nF *Comptes associés et sociétés du groupe 1 321 641 020,18 1 321 641 020,18 593 978 752,89 P Comptes de régularisation passif 68 219 903,66 65 207 287,32\nI *Autres débiteurs 0,00 0,00\nT *Comptes de régularisation Actif 829 160,33 829 160,33 3 773 628,67 1 142 265 237,38 1 079 635 483,87\nC AUTRES PROVISIONS POUR RISQUES ET CHARGES (G) 980 013,60 6 682,55\nTITRES ET VALEURS DE PLACEMENT (H) 0,00 0,00\nA É (éC léA mR eT nS t sD cE i rC cuO lN anV tE sR )SION, ACTIF (I) 5 458,20 5 458,20 6 682,57 ÉCARTS DE CONVERSION, PASSIF (éléments circulants) (H) 259 952,60 TOTAL II (F+G+H) 1 143 245 250,98 1 079 902 119,02\nTOTAL II (F+G+H+I) 2 582 775 989,61 64 669 499,93 2 518 106 489,68 1 925 093 796,12 EIREROSÉRT TRÉSORERIE, ACTIF EIREROSÉRT TRÉSORERIE, PASSIF Crédits d'escompte\n*Chèques et valeurs à encaisser 598 731,19 598 731,19 1 535 253,87\nCrédits de trésorerie 1 320 000 000,00 600 000 000,00\n*Banques TG et CP 74 419 847,37 74 419 847,37 29 561 158,53\n*Caisse, régie d'avance et accréditifs 1 577 883,41 1 577 883,41 1 207 975,80 Banques (soldes créditeurs) 165,79\nTOTAL III 76 596 461,97 0,00 76 596 461,97 32 304 388,20 TOTAL III 1 320 000 000,00 600 000 165,79\nTOTAL GÉNÉRAL I+II+III 4 475 110 943,87 440 374 672,93 4 034 736 270,94 3 257 773 634,78 TOTAL GÉNÉRAL (I+II+III) 4 034 736 270,94 3 257 773 634,78\nCOMPTE DE PRODUITS ET CHARGES (Hors Taxes) ÉTAT DES SOLDES DE GESTION ( E S G )\nOPÉRATIONS I TABLEAU DE FORMATION DES RÉSULTATS ( T F R )\nDÉSIGNATION l’exeP rcro icp er e (1 à ) C po rn éc ce éer dxn eea nrn c tst ic l (ee 2ss ) de l’e x 3T e o =rt ca 1iu +ce 2x de l’exT eo rt ca iu ce 4x (Montants en dhs) Ex ae urc 3ic 1e d d éu c e1 m ja bn rv ei e 2 Er 0 X22 3 E0 2 R3 C ICE\nEXERCICE\nPRÉCÉDENT I PRODUITS D’EXPLOITATION\n1 Ventes de marchandises (en l’état ) 3 374 495 801,21 3 353 625 966,75 *Ventes de marchandises (en l'état) 3 374 495 801,21 3 374 495 801,21 3 353 625 966,75\n2 - Achats revendus de marchandises 2 969 142 792,05 2 889 599 035,35 *Ventes de biens et services produits 179 198 634,16 179 198 634,16 183 217 687,26\n*Chiffre d'affaires 3 553 694 435,37 0,00 3 553 694 435,37 3 536 843 654,01\nI = MARGE BRUTE SUR VENTES EN L’ÉTAT 405 353 009,16 464 026 931,40 *Variation de stocks de produits (+ ou -) (I) 0,00 0,00\n+ PRODUCTION DE L’ EXERCICE : ( 3 + 4 + 5 ) 179 198 634,16 183 217 687,26 N * I pm om uro eb li ll eis -mat êio mns e produites par l'entreprise 0,00 0,00\n3 Ventes de biens et services produits 179 198 634,16 183 217 687,26 II O *Subventions d'exploitation 0,00 0,00\n4 Variation de stocks de produits I T *Autres produits d'exploitation 2 289 600,00 2 289 600,00 2 776 800,00\n5 Immobilisations produites par l’entreprise pour elle-même A * R che ap rr gis ee ss d'exploitation, transfert de 1 869 417,59 1 869 417,59 3 627 604,05\nT\n- CONSOMMATION DE L’EXERCICE : ( 6 + 7 ) 278 255 842,28 255 682 922,13 I O TOTAL I 3 557 853 452,96 0,00 3 557 853 452,96 3 543 248 058,06\nIII 6 Achats consommés de matières et fournitures 41 217 129,35 38 045 422,65 L P II Charges d'exploitation *Achats revendus (2) de marchandises 2 969 122 586,77 20 205,28 2 969 142 792,05 2 889 599 035,35\n7 Autres charges externes 237 038 712,93 217 637 499,48 X E * A foc uh ra nt its u c reo snsommés (2) de matières et 41 209 172,10 7 957,25 41 217 129,35 38 045 422,65\nIV = VALEUR AJOUTÉE : ( I + II + III ) 306 295 801,04 391 561 696,53 *Autres charges externes 236 540 387,09 498 325,84 237 038 712,93 217 637 499,48\n8 + Subventions d’exploitation *Impôts et taxes 11 796 320,40 292 898,14 12 089 218,54 13 112 044,43\nV 9 - Impôts et taxes 12 089 218,54 13 112 044,43 *Charges de personnel 195 730 673,66 195 730 673,66 196 855 953,50\n*Autres charges d'exploitation 5 198 337,14 5 198 337,14 5 195 829,78\n10 - Charges de personnel 195 730 673,66 196 855 953,50 *Dotations d'exploitation 75 444 067,06 75 444 067,06 66 983 884,78\n= EXCÉDENT BRUT D’EXPLOITATION ( E B E ) TOTAL II 3 535 041 544,22 819 386,51 3 535 860 930,73 3 427 429 669,97\n98 475 908,84 181 593 698,60 = OU INSUFFISANCE BRUTE D’EXPLOITATION ( I B E) III RÉSULTAT D'EXPLOITATION (I-II) 22 811 908,74 -819 386,51 21 992 522,23 115 818 388,09\nIV Produits financiers\n11 + Autres produits d’exploitation 2 289 600,00 2 776 800,00 12 - Autres charges d’exploitation 5 198 337,14 5 195 829,78 * P auro trd eu si t ts it rd ee ss i mtit mre os b d ile is ép sarticipation et 37 400 000,00 37 400 000,00 32 000 000,00\nR *Gains de change 49 174,33 49 174,33 33 235,13\n13 + Reprises d’exploitation : transferts de charges 1 869 417,59 3 627 604,05 E *Intérêts et autres produits financiers 38 823 553,45 38 823 553,45 23 012 296,59\n14 - Dotations d’exploitation 75 444 067,06 66 983 884,78 I C * cR hae rp gr eis ses financières, transferts de 6 682,55 6 682,55 2 992,00\nN\nVI = RÉSULTAT D’EXPLOITATION ( + ou - ) 21 992 522,23 115 818 388,09 A TOTAL IV 76 279 410,33 0,00 76 279 410,33 55 048 523,72\nVII RÉSULTAT FINANCIER 24 264 007,04 26 298 738,85 N V Charges financières\nI\nVIII = RÉSULTAT COURANT ( + ou - ) 46 256 529,27 142 117 126,94 F *Charges d'intérêts 51 996 275,32 51 996 275,32 28 718 631,52\n*Pertes de change 13 669,77 13 669,77 24 149,60\nIX RÉSULTAT NON COURANT 157 760 796,72 163 777 529,88 *Autres charges financières 0,00 0,00 321,20\n15 - Impôts sur les résultats 34 366 808,00 40 198 653,00 *Dotations financières 5 458,20 5 458,20 6 682,55\nTOTAL V 52 015 403,29 0,00 52 015 403,29 28 749 784,87\nX = RÉSULTAT NET DE L’EXERCICE ( + ou - ) 169 650 517,99 265 696 003,82 VI RÉSULTAT FINANCIER (IV-V) 24 264 007,04 0,00 24 264 007,04 26 298 738,85\nII CAPACITÉ D’AUTOFINANCEMENT ( C A F ) - AUTOFINANCEMENT VII RÉSULTAT COURANT (III+VI) 47 075 915,78 -819 386,51 46 256 529,27 142 117 126,94\nRésultat de l’exercice VIIIPRODUITS NON COURANTS\n* Produits des cessions d'immobilisations 279 475 296,03 279 475 296,03 247 371 586,94\n1 * Bénéfice 169 650 517,99 265 696 003,82\n*Autres produits non courants 6 356 399,15 6 356 399,15 27 513 173,49\n* Perte * Reprises sur subventions\nd'investissements\n2 + Dotations d’exploitation (1) 73 257 113,19 64 525 287,19\nR * R eprises non courantes, transferts de\n3 + Dotations financières (1) E charges\n4 + Dotations non courantes (1) I C TOTAL VIII 285 831 695,18 0,00 285 831 695,18 274 884 760,43 IX CHARGES NON COURANTES\nN\n5 - Reprises d’exploitation (2) 6 - Reprises financières (2) A N * V ima mle ou brs il in se at tt ioe ns sd c'a ém déo ert sissements des 119 941 126,85 119 941 126,85 70 237 799,07\nI *Subventions accordées 0,00 0,00\n7 - Reprises non courantes (2) (3) F *Autres charges non courantes 8 129 771,61 0,00 8 129 771,61 40 869 431,48\n8 - Produits des cessions des immobilisations 279 475 296,03 247 371 586,94 * a D mot oa rt ti io sn ss e mno en n tc so eu tr a an ut xe ps ra ou vx is ions 0,00 0,00\n9 + Valeurs nettes des immobilisations cédées 119 941 126,85 70 237 799,07 TOTAL IX 128 070 898,46 0,00 128 070 898,46 111 107 230,55\nI CAPACITÉ D’AUTOFINANCEMENT ( C A F ) 83 373 462,00 153 087 503,14 X RÉSULTAT NON COURANT (VIII-IX) 157 760 796,72 0,00 157 760 796,72 163 777 529,88\nXI RÉSULTAT AVANT IMPÔTS (VII+X) 204 836 712,50 (819 386,51) 204 017 325,99 305 894 656,82\n10 - Distributions de bénéfices 176 030 848,00 176 030 848,00 XII IMPÔTS SUR LES RÉSULTATS 34 366 808,00 0,00 34 366 808,00 40 198 653,00\nII AUTOFINANCEMENT -92 657 386,00 -22 943 344,86 XIII RÉSULTAT NET (XI-XII) 170 469 904,50 (819 386,51) 169 650 517,99 265 696 003,82\nXIV TOTAL DES PRODUITS (I+IV+VIII) 3 919 964 558,47 0,00 3 919 964 558,47 3 873 181 342,21\n(1) à l’exclusion des dotations relatives aux actifs et passifs circulants et à la trésorerie XV TOTAL DES CHARGES (II+V+IX+XIII) 3 749 494 653,97 819 386,51 3 750 314 040,48 3 607 485 338,39\n(2) à l’exclusion des reprises relatives aux actifs circulants et à la trésorerie\n(3) Y compris reprises sur subventions d’investissement XVI R toÉ taS lU dL eT sA cT h N aE rgT e ( sT )otal des produits - 170 469 904,50 -819 386,51 169 650 517,99 265 696 003,82\nAuto HALL S.A. Km 12, Autoroute Casa-Rabat, Sortie Al Qods- Casablanca Maroc Téléphone: 0522 76 14 00/01/02 Fax: 0522 76 14 14/15 Email: autohall@autohall.ma"
            }
        ],
        [
            {
                "BILAN ACTIF du 01/01/2023 au 31/12/2023": "",
                "null": "EXERCICE\nPRÉCÉDENT\nNet"
            },
            {
                "BILAN ACTIF du 01/01/2023 au 31/12/2023": "",
                "null": ""
            },
            {
                "BILAN ACTIF du 01/01/2023 au 31/12/2023": "É\nS\nI\nL\nI\nB\nO\nM\nM\nI\nF\nI\nT\nC\nA",
                "null": "24 431 321,10"
            },
            {
                "BILAN ACTIF du 01/01/2023 au 31/12/2023": "",
                "null": "0,00"
            },
            {
                "BILAN ACTIF du 01/01/2023 au 31/12/2023": "",
                "null": "24 431 321,10"
            },
            {
                "BILAN ACTIF du 01/01/2023 au 31/12/2023": "",
                "null": ""
            },
            {
                "BILAN ACTIF du 01/01/2023 au 31/12/2023": "",
                "null": "140 000,00"
            },
            {
                "BILAN ACTIF du 01/01/2023 au 31/12/2023": "",
                "null": "0,00"
            },
            {
                "BILAN ACTIF du 01/01/2023 au 31/12/2023": "",
                "null": "0,00"
            },
            {
                "BILAN ACTIF du 01/01/2023 au 31/12/2023": "",
                "null": "140 000,00"
            },
            {
                "BILAN ACTIF du 01/01/2023 au 31/12/2023": "",
                "null": ""
            },
            {
                "BILAN ACTIF du 01/01/2023 au 31/12/2023": "",
                "null": "473 685 024,36"
            },
            {
                "BILAN ACTIF du 01/01/2023 au 31/12/2023": "",
                "null": "147 095 510,29"
            },
            {
                "BILAN ACTIF du 01/01/2023 au 31/12/2023": "",
                "null": "155 007 417,46"
            },
            {
                "BILAN ACTIF du 01/01/2023 au 31/12/2023": "",
                "null": "14 200 588,27"
            },
            {
                "BILAN ACTIF du 01/01/2023 au 31/12/2023": "",
                "null": "119 022 755,68"
            },
            {
                "BILAN ACTIF du 01/01/2023 au 31/12/2023": "",
                "null": "23 541 355,69"
            },
            {
                "BILAN ACTIF du 01/01/2023 au 31/12/2023": "",
                "null": "0,00"
            },
            {
                "BILAN ACTIF du 01/01/2023 au 31/12/2023": "",
                "null": "14 817 396,97"
            },
            {
                "BILAN ACTIF du 01/01/2023 au 31/12/2023": "",
                "null": "802 119 105,00"
            },
            {
                "BILAN ACTIF du 01/01/2023 au 31/12/2023": "",
                "null": "36 215,00"
            },
            {
                "BILAN ACTIF du 01/01/2023 au 31/12/2023": "",
                "null": ""
            },
            {
                "BILAN ACTIF du 01/01/2023 au 31/12/2023": "",
                "null": "802 082 890,00"
            },
            {
                "BILAN ACTIF du 01/01/2023 au 31/12/2023": "",
                "null": ""
            },
            {
                "BILAN ACTIF du 01/01/2023 au 31/12/2023": "",
                "null": "0,00"
            },
            {
                "BILAN ACTIF du 01/01/2023 au 31/12/2023": "",
                "null": ""
            },
            {
                "BILAN ACTIF du 01/01/2023 au 31/12/2023": "",
                "null": ""
            },
            {
                "BILAN ACTIF du 01/01/2023 au 31/12/2023": "",
                "null": "1 300 375 450,46"
            },
            {
                "BILAN ACTIF du 01/01/2023 au 31/12/2023": "T\nN\nA\nL\nU\nC\nR\nI\nC\nF\nI\nT\nC\nA",
                "null": "141 114 505,25"
            },
            {
                "BILAN ACTIF du 01/01/2023 au 31/12/2023": "",
                "null": "137 979 615,39"
            },
            {
                "BILAN ACTIF du 01/01/2023 au 31/12/2023": "",
                "null": ""
            },
            {
                "BILAN ACTIF du 01/01/2023 au 31/12/2023": "",
                "null": "3 134 889,86"
            },
            {
                "BILAN ACTIF du 01/01/2023 au 31/12/2023": "",
                "null": ""
            },
            {
                "BILAN ACTIF du 01/01/2023 au 31/12/2023": "",
                "null": ""
            },
            {
                "BILAN ACTIF du 01/01/2023 au 31/12/2023": "",
                "null": "1 783 972 608,30"
            },
            {
                "BILAN ACTIF du 01/01/2023 au 31/12/2023": "",
                "null": "41 193 006,63"
            },
            {
                "BILAN ACTIF du 01/01/2023 au 31/12/2023": "",
                "null": "1 025 895 816,07"
            },
            {
                "BILAN ACTIF du 01/01/2023 au 31/12/2023": "",
                "null": "4 180 229,69"
            },
            {
                "BILAN ACTIF du 01/01/2023 au 31/12/2023": "",
                "null": "114 951 174,35"
            },
            {
                "BILAN ACTIF du 01/01/2023 au 31/12/2023": "",
                "null": "593 978 752,89"
            },
            {
                "BILAN ACTIF du 01/01/2023 au 31/12/2023": "",
                "null": "0,00"
            },
            {
                "BILAN ACTIF du 01/01/2023 au 31/12/2023": "",
                "null": "3 773 628,67"
            },
            {
                "BILAN ACTIF du 01/01/2023 au 31/12/2023": "",
                "null": "0,00"
            },
            {
                "BILAN ACTIF du 01/01/2023 au 31/12/2023": "",
                "null": "6 682,57"
            },
            {
                "BILAN ACTIF du 01/01/2023 au 31/12/2023": "",
                "null": "1 925 093 796,12"
            },
            {
                "BILAN ACTIF du 01/01/2023 au 31/12/2023": "EIREROSÉRT",
                "null": ""
            },
            {
                "BILAN ACTIF du 01/01/2023 au 31/12/2023": "",
                "null": "1 535 253,87"
            },
            {
                "BILAN ACTIF du 01/01/2023 au 31/12/2023": "",
                "null": "29 561 158,53"
            },
            {
                "BILAN ACTIF du 01/01/2023 au 31/12/2023": "",
                "null": "1 207 975,80"
            },
            {
                "BILAN ACTIF du 01/01/2023 au 31/12/2023": "",
                "null": "32 304 388,20"
            },
            {
                "BILAN ACTIF du 01/01/2023 au 31/12/2023": "",
                "null": "3 257 773 634,78"
            }
        ],
        [
            {
                "BILAN PASSIF du 01/01/2023 au 31/12/2023": "",
                "null": "EXERCICE\nPRÉCÉDENT"
            },
            {
                "BILAN PASSIF du 01/01/2023 au 31/12/2023": "",
                "null": ""
            },
            {
                "BILAN PASSIF du 01/01/2023 au 31/12/2023": "T\nN\nE\nN\nA\nM\nR\nE\nP\nT\nN\nE\nM\nE\nC\nN\nA\nN\nI\nF",
                "null": "502 945 280,00"
            },
            {
                "BILAN PASSIF du 01/01/2023 au 31/12/2023": "",
                "null": ""
            },
            {
                "BILAN PASSIF du 01/01/2023 au 31/12/2023": "",
                "null": "251 021 566,80"
            },
            {
                "BILAN PASSIF du 01/01/2023 au 31/12/2023": "",
                "null": ""
            },
            {
                "BILAN PASSIF du 01/01/2023 au 31/12/2023": "",
                "null": "50 294 528,00"
            },
            {
                "BILAN PASSIF du 01/01/2023 au 31/12/2023": "",
                "null": "496 402 127,57"
            },
            {
                "BILAN PASSIF du 01/01/2023 au 31/12/2023": "",
                "null": "11 511 843,78"
            },
            {
                "BILAN PASSIF du 01/01/2023 au 31/12/2023": "",
                "null": ""
            },
            {
                "BILAN PASSIF du 01/01/2023 au 31/12/2023": "",
                "null": "265 696 003,82"
            },
            {
                "BILAN PASSIF du 01/01/2023 au 31/12/2023": "",
                "null": ""
            },
            {
                "BILAN PASSIF du 01/01/2023 au 31/12/2023": "",
                "null": "1 577 871 349,97"
            },
            {
                "BILAN PASSIF du 01/01/2023 au 31/12/2023": "",
                "null": ""
            },
            {
                "BILAN PASSIF du 01/01/2023 au 31/12/2023": "",
                "null": ""
            },
            {
                "BILAN PASSIF du 01/01/2023 au 31/12/2023": "",
                "null": ""
            },
            {
                "BILAN PASSIF du 01/01/2023 au 31/12/2023": "",
                "null": ""
            },
            {
                "BILAN PASSIF du 01/01/2023 au 31/12/2023": "",
                "null": ""
            },
            {
                "BILAN PASSIF du 01/01/2023 au 31/12/2023": "",
                "null": ""
            },
            {
                "BILAN PASSIF du 01/01/2023 au 31/12/2023": "",
                "null": ""
            },
            {
                "BILAN PASSIF du 01/01/2023 au 31/12/2023": "",
                "null": ""
            },
            {
                "BILAN PASSIF du 01/01/2023 au 31/12/2023": "",
                "null": ""
            },
            {
                "BILAN PASSIF du 01/01/2023 au 31/12/2023": "T\nN\nA\nL\nU\nC\nR\nI C\nF\nI S\nS\nA\nP",
                "null": ""
            },
            {
                "BILAN PASSIF du 01/01/2023 au 31/12/2023": "",
                "null": ""
            },
            {
                "BILAN PASSIF du 01/01/2023 au 31/12/2023": "",
                "null": ""
            },
            {
                "BILAN PASSIF du 01/01/2023 au 31/12/2023": "",
                "null": "1 577 871 349,97"
            },
            {
                "BILAN PASSIF du 01/01/2023 au 31/12/2023": "",
                "null": ""
            },
            {
                "BILAN PASSIF du 01/01/2023 au 31/12/2023": "",
                "null": "566 699 263,78"
            },
            {
                "BILAN PASSIF du 01/01/2023 au 31/12/2023": "",
                "null": "22 055 499,06"
            },
            {
                "BILAN PASSIF du 01/01/2023 au 31/12/2023": "",
                "null": "2 718 416,06"
            },
            {
                "BILAN PASSIF du 01/01/2023 au 31/12/2023": "",
                "null": "10 119 381,06"
            },
            {
                "BILAN PASSIF du 01/01/2023 au 31/12/2023": "",
                "null": "5 722 785,12"
            },
            {
                "BILAN PASSIF du 01/01/2023 au 31/12/2023": "",
                "null": "403 479 051,10"
            },
            {
                "BILAN PASSIF du 01/01/2023 au 31/12/2023": "",
                "null": "3 633 800,37"
            },
            {
                "BILAN PASSIF du 01/01/2023 au 31/12/2023": "",
                "null": "65 207 287,32"
            },
            {
                "BILAN PASSIF du 01/01/2023 au 31/12/2023": "",
                "null": "1 079 635 483,87"
            },
            {
                "BILAN PASSIF du 01/01/2023 au 31/12/2023": "",
                "null": "6 682,55"
            },
            {
                "BILAN PASSIF du 01/01/2023 au 31/12/2023": "",
                "null": "259 952,60"
            },
            {
                "BILAN PASSIF du 01/01/2023 au 31/12/2023": "",
                "null": "1 079 902 119,02"
            },
            {
                "BILAN PASSIF du 01/01/2023 au 31/12/2023": "EIREROSÉRT",
                "null": ""
            },
            {
                "BILAN PASSIF du 01/01/2023 au 31/12/2023": "",
                "null": ""
            },
            {
                "BILAN PASSIF du 01/01/2023 au 31/12/2023": "",
                "null": "600 000 000,00"
            },
            {
                "BILAN PASSIF du 01/01/2023 au 31/12/2023": "",
                "null": "165,79"
            },
            {
                "BILAN PASSIF du 01/01/2023 au 31/12/2023": "",
                "null": "600 000 165,79"
            },
            {
                "BILAN PASSIF du 01/01/2023 au 31/12/2023": "",
                "null": "3 257 773 634,78"
            }
        ],
        [
            {
                "COMPTE DE PRODUITS ET CHARGES (Hors Taxes)": "",
                "null": "Totaux\nde l’exercice\n4"
            },
            {
                "COMPTE DE PRODUITS ET CHARGES (Hors Taxes)": "",
                "null": ""
            },
            {
                "COMPTE DE PRODUITS ET CHARGES (Hors Taxes)": "N\nO\nI\nT\nA\nT\nI\nO\nL\nP\nX\nE",
                "null": ""
            },
            {
                "COMPTE DE PRODUITS ET CHARGES (Hors Taxes)": "",
                "null": "3 353 625 966,75"
            },
            {
                "COMPTE DE PRODUITS ET CHARGES (Hors Taxes)": "",
                "null": "183 217 687,26"
            },
            {
                "COMPTE DE PRODUITS ET CHARGES (Hors Taxes)": "",
                "null": "3 536 843 654,01"
            },
            {
                "COMPTE DE PRODUITS ET CHARGES (Hors Taxes)": "",
                "null": "0,00"
            },
            {
                "COMPTE DE PRODUITS ET CHARGES (Hors Taxes)": "",
                "null": "0,00"
            },
            {
                "COMPTE DE PRODUITS ET CHARGES (Hors Taxes)": "",
                "null": "0,00"
            },
            {
                "COMPTE DE PRODUITS ET CHARGES (Hors Taxes)": "",
                "null": "2 776 800,00"
            },
            {
                "COMPTE DE PRODUITS ET CHARGES (Hors Taxes)": "",
                "null": "3 627 604,05"
            },
            {
                "COMPTE DE PRODUITS ET CHARGES (Hors Taxes)": "",
                "null": "3 543 248 058,06"
            },
            {
                "COMPTE DE PRODUITS ET CHARGES (Hors Taxes)": "",
                "null": ""
            },
            {
                "COMPTE DE PRODUITS ET CHARGES (Hors Taxes)": "",
                "null": "2 889 599 035,35"
            },
            {
                "COMPTE DE PRODUITS ET CHARGES (Hors Taxes)": "",
                "null": "38 045 422,65"
            },
            {
                "COMPTE DE PRODUITS ET CHARGES (Hors Taxes)": "",
                "null": "217 637 499,48"
            },
            {
                "COMPTE DE PRODUITS ET CHARGES (Hors Taxes)": "",
                "null": "13 112 044,43"
            },
            {
                "COMPTE DE PRODUITS ET CHARGES (Hors Taxes)": "",
                "null": "196 855 953,50"
            },
            {
                "COMPTE DE PRODUITS ET CHARGES (Hors Taxes)": "",
                "null": "5 195 829,78"
            },
            {
                "COMPTE DE PRODUITS ET CHARGES (Hors Taxes)": "",
                "null": "66 983 884,78"
            },
            {
                "COMPTE DE PRODUITS ET CHARGES (Hors Taxes)": "",
                "null": "3 427 429 669,97"
            },
            {
                "COMPTE DE PRODUITS ET CHARGES (Hors Taxes)": "R\nE\nI\nC\nN\nA\nN\nI\nF",
                "null": "115 818 388,09"
            },
            {
                "COMPTE DE PRODUITS ET CHARGES (Hors Taxes)": "",
                "null": ""
            },
            {
                "COMPTE DE PRODUITS ET CHARGES (Hors Taxes)": "",
                "null": "32 000 000,00"
            },
            {
                "COMPTE DE PRODUITS ET CHARGES (Hors Taxes)": "",
                "null": "33 235,13"
            },
            {
                "COMPTE DE PRODUITS ET CHARGES (Hors Taxes)": "",
                "null": "23 012 296,59"
            },
            {
                "COMPTE DE PRODUITS ET CHARGES (Hors Taxes)": "",
                "null": "2 992,00"
            },
            {
                "COMPTE DE PRODUITS ET CHARGES (Hors Taxes)": "",
                "null": "55 048 523,72"
            },
            {
                "COMPTE DE PRODUITS ET CHARGES (Hors Taxes)": "",
                "null": ""
            },
            {
                "COMPTE DE PRODUITS ET CHARGES (Hors Taxes)": "",
                "null": "28 718 631,52"
            },
            {
                "COMPTE DE PRODUITS ET CHARGES (Hors Taxes)": "",
                "null": "24 149,60"
            },
            {
                "COMPTE DE PRODUITS ET CHARGES (Hors Taxes)": "",
                "null": "321,20"
            },
            {
                "COMPTE DE PRODUITS ET CHARGES (Hors Taxes)": "",
                "null": "6 682,55"
            },
            {
                "COMPTE DE PRODUITS ET CHARGES (Hors Taxes)": "",
                "null": "28 749 784,87"
            },
            {
                "COMPTE DE PRODUITS ET CHARGES (Hors Taxes)": "",
                "null": "26 298 738,85"
            },
            {
                "COMPTE DE PRODUITS ET CHARGES (Hors Taxes)": "",
                "null": "142 117 126,94"
            },
            {
                "COMPTE DE PRODUITS ET CHARGES (Hors Taxes)": "",
                "null": ""
            },
            {
                "COMPTE DE PRODUITS ET CHARGES (Hors Taxes)": "R\nE\nI\nC\nN\nA\nN\nI\nF",
                "null": "247 371 586,94"
            },
            {
                "COMPTE DE PRODUITS ET CHARGES (Hors Taxes)": "",
                "null": "27 513 173,49"
            },
            {
                "COMPTE DE PRODUITS ET CHARGES (Hors Taxes)": "",
                "null": ""
            },
            {
                "COMPTE DE PRODUITS ET CHARGES (Hors Taxes)": "",
                "null": ""
            },
            {
                "COMPTE DE PRODUITS ET CHARGES (Hors Taxes)": "",
                "null": "274 884 760,43"
            },
            {
                "COMPTE DE PRODUITS ET CHARGES (Hors Taxes)": "",
                "null": ""
            },
            {
                "COMPTE DE PRODUITS ET CHARGES (Hors Taxes)": "",
                "null": "70 237 799,07"
            },
            {
                "COMPTE DE PRODUITS ET CHARGES (Hors Taxes)": "",
                "null": "0,00"
            },
            {
                "COMPTE DE PRODUITS ET CHARGES (Hors Taxes)": "",
                "null": "40 869 431,48"
            },
            {
                "COMPTE DE PRODUITS ET CHARGES (Hors Taxes)": "",
                "null": "0,00"
            },
            {
                "COMPTE DE PRODUITS ET CHARGES (Hors Taxes)": "",
                "null": "111 107 230,55"
            },
            {
                "COMPTE DE PRODUITS ET CHARGES (Hors Taxes)": "",
                "null": "163 777 529,88"
            },
            {
                "COMPTE DE PRODUITS ET CHARGES (Hors Taxes)": "",
                "null": "305 894 656,82"
            },
            {
                "COMPTE DE PRODUITS ET CHARGES (Hors Taxes)": "",
                "null": "40 198 653,00"
            },
            {
                "COMPTE DE PRODUITS ET CHARGES (Hors Taxes)": "",
                "null": "265 696 003,82"
            },
            {
                "COMPTE DE PRODUITS ET CHARGES (Hors Taxes)": "",
                "null": "3 873 181 342,21"
            },
            {
                "COMPTE DE PRODUITS ET CHARGES (Hors Taxes)": "",
                "null": "3 607 485 338,39"
            },
            {
                "COMPTE DE PRODUITS ET CHARGES (Hors Taxes)": "",
                "null": "265 696 003,82"
            }
        ],
        [
            {
                "ÉTAT DES SOLDES DE GESTION ( E S G )": "I TABLEAU DE FORMATION DES RÉSULTATS ( T F R )",
                "null": ""
            },
            {
                "ÉTAT DES SOLDES DE GESTION ( E S G )": "(Montants en dhs)",
                "null": ""
            },
            {
                "ÉTAT DES SOLDES DE GESTION ( E S G )": "",
                "null": "EXERCICE\nPRÉCÉDENT"
            },
            {
                "ÉTAT DES SOLDES DE GESTION ( E S G )": "",
                "null": "3 353 625 966,75"
            },
            {
                "ÉTAT DES SOLDES DE GESTION ( E S G )": "",
                "null": "2 889 599 035,35"
            },
            {
                "ÉTAT DES SOLDES DE GESTION ( E S G )": "I",
                "null": "464 026 931,40"
            },
            {
                "ÉTAT DES SOLDES DE GESTION ( E S G )": "II",
                "null": "183 217 687,26"
            },
            {
                "ÉTAT DES SOLDES DE GESTION ( E S G )": "",
                "null": "183 217 687,26"
            },
            {
                "ÉTAT DES SOLDES DE GESTION ( E S G )": "",
                "null": ""
            },
            {
                "ÉTAT DES SOLDES DE GESTION ( E S G )": "",
                "null": ""
            },
            {
                "ÉTAT DES SOLDES DE GESTION ( E S G )": "III",
                "null": "255 682 922,13"
            },
            {
                "ÉTAT DES SOLDES DE GESTION ( E S G )": "",
                "null": "38 045 422,65"
            },
            {
                "ÉTAT DES SOLDES DE GESTION ( E S G )": "",
                "null": "217 637 499,48"
            },
            {
                "ÉTAT DES SOLDES DE GESTION ( E S G )": "IV",
                "null": "391 561 696,53"
            },
            {
                "ÉTAT DES SOLDES DE GESTION ( E S G )": "V",
                "null": ""
            },
            {
                "ÉTAT DES SOLDES DE GESTION ( E S G )": "",
                "null": "13 112 044,43"
            },
            {
                "ÉTAT DES SOLDES DE GESTION ( E S G )": "",
                "null": "196 855 953,50"
            },
            {
                "ÉTAT DES SOLDES DE GESTION ( E S G )": "",
                "null": "181 593 698,60"
            },
            {
                "ÉTAT DES SOLDES DE GESTION ( E S G )": "",
                "null": ""
            },
            {
                "ÉTAT DES SOLDES DE GESTION ( E S G )": "",
                "null": "2 776 800,00"
            },
            {
                "ÉTAT DES SOLDES DE GESTION ( E S G )": "",
                "null": "5 195 829,78"
            },
            {
                "ÉTAT DES SOLDES DE GESTION ( E S G )": "",
                "null": "3 627 604,05"
            },
            {
                "ÉTAT DES SOLDES DE GESTION ( E S G )": "",
                "null": "66 983 884,78"
            },
            {
                "ÉTAT DES SOLDES DE GESTION ( E S G )": "VI",
                "null": "115 818 388,09"
            },
            {
                "ÉTAT DES SOLDES DE GESTION ( E S G )": "VII",
                "null": "26 298 738,85"
            },
            {
                "ÉTAT DES SOLDES DE GESTION ( E S G )": "VIII",
                "null": "142 117 126,94"
            },
            {
                "ÉTAT DES SOLDES DE GESTION ( E S G )": "IX",
                "null": "163 777 529,88"
            },
            {
                "ÉTAT DES SOLDES DE GESTION ( E S G )": "",
                "null": "40 198 653,00"
            },
            {
                "ÉTAT DES SOLDES DE GESTION ( E S G )": "X",
                "null": "265 696 003,82"
            },
            {
                "ÉTAT DES SOLDES DE GESTION ( E S G )": "II CAPACITÉ D’AUTOFINANCEMENT ( C A F ) - AUTOFINANCEMENT",
                "null": ""
            },
            {
                "ÉTAT DES SOLDES DE GESTION ( E S G )": "",
                "null": ""
            },
            {
                "ÉTAT DES SOLDES DE GESTION ( E S G )": "",
                "null": "265 696 003,82"
            },
            {
                "ÉTAT DES SOLDES DE GESTION ( E S G )": "",
                "null": ""
            },
            {
                "ÉTAT DES SOLDES DE GESTION ( E S G )": "",
                "null": "64 525 287,19"
            },
            {
                "ÉTAT DES SOLDES DE GESTION ( E S G )": "",
                "null": ""
            },
            {
                "ÉTAT DES SOLDES DE GESTION ( E S G )": "",
                "null": ""
            },
            {
                "ÉTAT DES SOLDES DE GESTION ( E S G )": "",
                "null": ""
            },
            {
                "ÉTAT DES SOLDES DE GESTION ( E S G )": "",
                "null": ""
            },
            {
                "ÉTAT DES SOLDES DE GESTION ( E S G )": "",
                "null": ""
            },
            {
                "ÉTAT DES SOLDES DE GESTION ( E S G )": "",
                "null": "247 371 586,94"
            },
            {
                "ÉTAT DES SOLDES DE GESTION ( E S G )": "",
                "null": "70 237 799,07"
            },
            {
                "ÉTAT DES SOLDES DE GESTION ( E S G )": "I",
                "null": "153 087 503,14"
            },
            {
                "ÉTAT DES SOLDES DE GESTION ( E S G )": "",
                "null": "176 030 848,00"
            },
            {
                "ÉTAT DES SOLDES DE GESTION ( E S G )": "II",
                "null": "-22 943 344,86"
            }
        ],
        [
            {
                "ÉTATS FINANCIERS\nSOCIAUX\nAU 31 DÉCEMBRE 2023": "TABLEAU DE FINANCEMENT DE L’EXERCICE\nI Synthèse des masses du bilan\nExercice du 1 janvier 2023\n(Montants en dhs)\nau 31 décembre 2023\nExercice Exercice Variation (a-b)\nMASSES précédent\n(a) (b) Emplois (c) Ressources (d)\n1 Financement permanent 1 571 491 019,96 1 577 871 349,97 6 380 330,01\n2 Moins actif immobilisé 1 440 033 319,29 1 300 375 450,46 139 657 868,83\n3 = Fonds de roulement fonctionnel (1-2) (A) 131 457 700,67 277 495 899,51 146 038 198,84\n4 Actif circulant 2 518 106 489,68 1 925 093 796,12 593 012 693,56\n5 Moins passif circulant 1 143 245 250,98 1 079 902 119,02 63 343 131,96\n6 = Besoins de financement global (4-5) (B) 1 374 861 238,70 845 191 677,10 529 669 561,60\n7 = Trésorerie nette (actif-passif) (A - B) (1 243 403 538,03) (567 695 777,59) 675 707 760,44\nII Emplois et Ressources\nEXERCICE EXERCICE PRÉCÉDENT\nEMPLOIS RESSOURCES EMPLOIS RESSOURCES\nRESSOURCES STABLES DE L’EXERCICE (FLUX)\nAUTOFINANCEMENT (A) 0,00 (92 657 386,00) 0,00 (22 943 344,86)\nCapacité d’autofinancement 83 373 462,00 153 087 503,14\n- Distribution de bénéfices 176 030 848,00 176 030 848,00\nCESSIONS ET RÉDUCTIONS D’IMMOBILISATIONS (B) 0,00 279 475 296,03 0,00 247 371 586,94\nCession d’immobilisations incorporelles\nCession d’immobilisations corporelles 279 475 296,03 247 371 586,94\nCession d’immobilisations financières\nRécupérations sur créances immobilisées\nAUGMENTATIONS DES CAPITAUX PROPRES ET ASSIMILÉS (C) 0,00 0,00 0,00 0,00\nAugmentations de capital, apports\nSubventions d’investissement\nAUGMENTATIONS DES DETTES DE FINANCEMENT (D)\nI. TOTAL DES RESSOURCES STABLES (A+B+C+D) 0,00 186 817 910,03 224 428 242,08\nEMPLOIS STABLES DE L’EXERCICE (FLUX)\nACQUISITIONS ET AUGMENTATIONS D’IMMOBILISATIONS (E) 332 187 206,99 0,00 208 849 483,88 0,00\nAcquisition d’immobilisations incorporelles 2 800 000,00\nAcquisition d’immobilisations corporelles 119 577 206,99 198 849 483,88\nAcquisition d’immobilisations financières 209 810 000,00 10 000 000,00\nAugmentation des créances immobilisées\nREMBOURSEMENTS DES CAPITAUX PROPRES (F)\nREMBOURSEMENTS DES DETTES DE FINANCEMENT (G)\nEMPLOIS EN NON VALEURS (H) 668 901,88 1 363 920,15\nII. TOTAL - EMPLOIS STABLES (E+F+G+H) 332 856 108,87 0,00 210 213 404,03 0,00\nIII. VARIATION DU BESOIN DE FINANCEMENT GLOBAL (BFG) 529 669 561,60 0,00 542 613 596,03\nIV. VARIATION DE LA TRÉSORERIE 0,00 675 707 760,44 528 398 757,98\nTOTAL GÉNÉRAL 862 525 670,47 862 525 670,47 752 827 000,06 752 827 000,06\nÉTAT DES DÉROGATIONS\nExercice Clos au 31 décembre 2023\nINFLUENCE DES DÉROGATIONS SUR LE PATRIMOINE, LA SITUATION FINANCIÈRE ET\nINDICATION DES DÉROGATIONS JUSTIFICATIONS DES DÉROGATIONS\nLES RÉSULTATS\nI Dérogations aux principes comptables fondamentaux NÉANT NÉANT\nII Dérogations aux méthodes d’évaluation NÉANT NÉANT\nIII Dérogations aux règles d’établissement des états de synthèse NÉANT NÉANT\nÉTAT DES CHANGEMENTS DE MÉTHODES\nExercice Clos au 31 décembre 2023\nNATURE DES CHANGEMENTS JUSTIFICATION DU CHANGEMENT INFLUENCE SUR LE PATRIMOINE, LA SITUATION FINANCIÈRE ET LES RÉSULTATS\n\"I. Changements affectant les méthodes d'évaluation\" NÉANT NÉANT\n\"II. Changements affectant les règles de présentation\" NÉANT NÉANT\nINDICATION DES METHODES D’EVALUATION APPLIQUEES PAR L’ENTREPRISE\nExercice Clos au 31 décembre 2023\nI - ACTIF IMMOBILISE\nA. Evaluation à l'entrée\n1. Immobilisations en non-valeurs Valeur nominale\n2. Immobilisations incorporelles Coût d'aquisition\n3. Immobilisations corporelles Coût d'aquisition\n4. Immobilisations financières Prix d'achat\nB. Corrections de valeurs\n1. Méthodes d'amortissements Linéaire\n2. Méthodes d'évaluation des provisions pour dépréciation Selon le risque\n3. Méthodes de détermination des écarts de conversion - Actif\niI - ACTIF CIRCULANT (Hors trésorerie)\nA. Evaluation à l'entrée\n1. Stocks\n- Matières premières et marchandises Coût d'aquisition\n- Produits finis et en cours Néant\n2. Créances Montant nominal\n3. Titres et valeurs de placement Prix d'achat\nB. Corrections de valeurs\nLes provisions sur créances ordinaires sont calculées sur la base de l’ancienneté des créances. La règle de provisionnement stipule des taux de provisionnement de 15% à 60% selon\n2. Méthodes d'évaluation des provisions pour dépréciation l’antériorité des créances allant de 1an à 5ans. Les provisions pour créances douteuses ou précontentieuses sont déterminées au cas par cas en fonction de l’appréciation du risque par\nle management de la société.\n3. Méthodes de détermination des écarts de conversion - Actif\niII - FINANCEMENT PERMANENT\n1. Méthodes de réévaluation Néant\n2. Méthodes d'évaluation des provisions réglementées Selon budget trienal\n3. Dettes de financement permanent Néant\n4. Méthodes d'évaluation des provisions durables pour risques et\nSelon risque\ncharges\n5. Méthodes de détermination des écarts de conversion - Passif\niV - PASSIF CIRCULANT (Hors trésorerie)\n1. Dettes du passif circulant Coût réel d'entrée\n2. Méthodes d'évaluation des autres provisions pour risques et\nSelon risque\ncharges\n3. Méthodes de détermination des écarts de conversion - Passif\nv - TRESORERIE\n1. Trésorerie - Actif Coût réel d'entrée\n2. Trésorerie - Passif Coût réel d'entrée\n1. Méthodes d'évaluation des provisions pour dépréciation Néant\nAuto HALL S.A. Km 12, Autoroute Casa-Rabat, Sortie Al Qods- Casablanca Maroc Téléphone: 0522 76 14 00/01/02 Fax: 0522 76 14 14/15 Email: autohall@autohall.ma"
            }
        ],
        [
            {
                "TABLEAU DE FINANCEMENT DE L’EXERCICE": "",
                "null": ""
            },
            {
                "TABLEAU DE FINANCEMENT DE L’EXERCICE": "",
                "null": ""
            },
            {
                "TABLEAU DE FINANCEMENT DE L’EXERCICE": "",
                "null": ""
            },
            {
                "TABLEAU DE FINANCEMENT DE L’EXERCICE": "",
                "null": "Ressources (d)"
            },
            {
                "TABLEAU DE FINANCEMENT DE L’EXERCICE": "1",
                "null": "63 343 131,96"
            },
            {
                "TABLEAU DE FINANCEMENT DE L’EXERCICE": "2",
                "null": ""
            },
            {
                "TABLEAU DE FINANCEMENT DE L’EXERCICE": "3",
                "null": ""
            },
            {
                "TABLEAU DE FINANCEMENT DE L’EXERCICE": "4",
                "null": ""
            },
            {
                "TABLEAU DE FINANCEMENT DE L’EXERCICE": "5",
                "null": ""
            },
            {
                "TABLEAU DE FINANCEMENT DE L’EXERCICE": "6",
                "null": ""
            },
            {
                "TABLEAU DE FINANCEMENT DE L’EXERCICE": "7",
                "null": "675 707 760,44"
            }
        ],
        [
            {
                "II Emplois et Ressources": "",
                "null": ""
            },
            {
                "II Emplois et Ressources": "",
                "null": "RESSOURCES"
            },
            {
                "II Emplois et Ressources": "RESSOURCES STABLES DE L’EXERCICE (FLUX)",
                "null": ""
            },
            {
                "II Emplois et Ressources": "AUTOFINANCEMENT (A)\nCapacité d’autofinancement\n- Distribution de bénéfices\nCESSIONS ET RÉDUCTIONS D’IMMOBILISATIONS (B)\nCession d’immobilisations incorporelles\nCession d’immobilisations corporelles\nCession d’immobilisations financières\nRécupérations sur créances immobilisées\nAUGMENTATIONS DES CAPITAUX PROPRES ET ASSIMILÉS (C)\nAugmentations de capital, apports\nSubventions d’investissement\nAUGMENTATIONS DES DETTES DE FINANCEMENT (D)",
                "null": "(22 943 344,86)\n153 087 503,14\n176 030 848,00\n247 371 586,94\n247 371 586,94\n0,00"
            },
            {
                "II Emplois et Ressources": "I. TOTAL DES RESSOURCES STABLES (A+B+C+D)",
                "null": "224 428 242,08"
            },
            {
                "II Emplois et Ressources": "EMPLOIS STABLES DE L’EXERCICE (FLUX)\nACQUISITIONS ET AUGMENTATIONS D’IMMOBILISATIONS (E)\nAcquisition d’immobilisations incorporelles\nAcquisition d’immobilisations corporelles\nAcquisition d’immobilisations financières\nAugmentation des créances immobilisées\nREMBOURSEMENTS DES CAPITAUX PROPRES (F)\nREMBOURSEMENTS DES DETTES DE FINANCEMENT (G)\nEMPLOIS EN NON VALEURS (H)",
                "null": "0,00"
            },
            {
                "II Emplois et Ressources": "II. TOTAL - EMPLOIS STABLES (E+F+G+H)",
                "null": "0,00"
            },
            {
                "II Emplois et Ressources": "III. VARIATION DU BESOIN DE FINANCEMENT GLOBAL (BFG)",
                "null": ""
            },
            {
                "II Emplois et Ressources": "IV. VARIATION DE LA TRÉSORERIE",
                "null": "528 398 757,98"
            },
            {
                "II Emplois et Ressources": "TOTAL GÉNÉRAL",
                "null": "752 827 000,06"
            }
        ],
        [
            {
                "ÉTAT DES DÉROGATIONS": "Exercice Clos au 31 décembre 2023",
                "null": ""
            },
            {
                "ÉTAT DES DÉROGATIONS": "INDICATION DES DÉROGATIONS",
                "null": "INFLUENCE DES DÉROGATIONS SUR LE PATRIMOINE, LA SITUATION FINANCIÈRE ET\nLES RÉSULTATS"
            },
            {
                "ÉTAT DES DÉROGATIONS": "I Dérogations aux principes comptables fondamentaux",
                "null": "NÉANT"
            },
            {
                "ÉTAT DES DÉROGATIONS": "II Dérogations aux méthodes d’évaluation",
                "null": "NÉANT"
            },
            {
                "ÉTAT DES DÉROGATIONS": "III Dérogations aux règles d’établissement des états de synthèse",
                "null": "NÉANT"
            }
        ],
        [
            {
                "ÉTAT DES CHANGEMENTS DE MÉTHODES": "Exercice Clos au 31 décembre 2023",
                "null": ""
            },
            {
                "ÉTAT DES CHANGEMENTS DE MÉTHODES": "NATURE DES CHANGEMENTS",
                "null": "INFLUENCE SUR LE PATRIMOINE, LA SITUATION FINANCIÈRE ET LES RÉSULTATS"
            },
            {
                "ÉTAT DES CHANGEMENTS DE MÉTHODES": "\"I. Changements affectant les méthodes d'évaluation\"",
                "null": "NÉANT"
            },
            {
                "ÉTAT DES CHANGEMENTS DE MÉTHODES": "\"II. Changements affectant les règles de présentation\"",
                "null": "NÉANT"
            }
        ],
        [
            {
                "INDICATION DES METHODES D’EVALUATION APPLIQUEES PAR L’ENTREPRISE": "Exercice Clos au 31 décembre 2023",
                "null": ""
            },
            {
                "INDICATION DES METHODES D’EVALUATION APPLIQUEES PAR L’ENTREPRISE": "I - ACTIF IMMOBILISE",
                "null": ""
            },
            {
                "INDICATION DES METHODES D’EVALUATION APPLIQUEES PAR L’ENTREPRISE": "A. Evaluation à l'entrée",
                "null": ""
            },
            {
                "INDICATION DES METHODES D’EVALUATION APPLIQUEES PAR L’ENTREPRISE": "1. Immobilisations en non-valeurs",
                "null": "Valeur nominale"
            },
            {
                "INDICATION DES METHODES D’EVALUATION APPLIQUEES PAR L’ENTREPRISE": "2. Immobilisations incorporelles",
                "null": "Coût d'aquisition"
            },
            {
                "INDICATION DES METHODES D’EVALUATION APPLIQUEES PAR L’ENTREPRISE": "3. Immobilisations corporelles",
                "null": "Coût d'aquisition"
            },
            {
                "INDICATION DES METHODES D’EVALUATION APPLIQUEES PAR L’ENTREPRISE": "4. Immobilisations financières",
                "null": "Prix d'achat"
            },
            {
                "INDICATION DES METHODES D’EVALUATION APPLIQUEES PAR L’ENTREPRISE": "B. Corrections de valeurs",
                "null": ""
            },
            {
                "INDICATION DES METHODES D’EVALUATION APPLIQUEES PAR L’ENTREPRISE": "1. Méthodes d'amortissements",
                "null": "Linéaire"
            },
            {
                "INDICATION DES METHODES D’EVALUATION APPLIQUEES PAR L’ENTREPRISE": "2. Méthodes d'évaluation des provisions pour dépréciation",
                "null": "Selon le risque"
            },
            {
                "INDICATION DES METHODES D’EVALUATION APPLIQUEES PAR L’ENTREPRISE": "3. Méthodes de détermination des écarts de conversion - Actif",
                "null": ""
            },
            {
                "INDICATION DES METHODES D’EVALUATION APPLIQUEES PAR L’ENTREPRISE": "iI - ACTIF CIRCULANT (Hors trésorerie)",
                "null": ""
            },
            {
                "INDICATION DES METHODES D’EVALUATION APPLIQUEES PAR L’ENTREPRISE": "A. Evaluation à l'entrée",
                "null": ""
            },
            {
                "INDICATION DES METHODES D’EVALUATION APPLIQUEES PAR L’ENTREPRISE": "1. Stocks",
                "null": ""
            },
            {
                "INDICATION DES METHODES D’EVALUATION APPLIQUEES PAR L’ENTREPRISE": "- Matières premières et marchandises",
                "null": "Coût d'aquisition"
            },
            {
                "INDICATION DES METHODES D’EVALUATION APPLIQUEES PAR L’ENTREPRISE": "- Produits finis et en cours",
                "null": "Néant"
            },
            {
                "INDICATION DES METHODES D’EVALUATION APPLIQUEES PAR L’ENTREPRISE": "2. Créances",
                "null": "Montant nominal"
            },
            {
                "INDICATION DES METHODES D’EVALUATION APPLIQUEES PAR L’ENTREPRISE": "3. Titres et valeurs de placement",
                "null": "Prix d'achat"
            },
            {
                "INDICATION DES METHODES D’EVALUATION APPLIQUEES PAR L’ENTREPRISE": "B. Corrections de valeurs",
                "null": ""
            },
            {
                "INDICATION DES METHODES D’EVALUATION APPLIQUEES PAR L’ENTREPRISE": "2. Méthodes d'évaluation des provisions pour dépréciation",
                "null": "Les provisions sur créances ordinaires sont calculées sur la base de l’ancienneté des créances. La règle de provisionnement stipule des taux de provisionnement de 15% à 60% selon\nl’antériorité des créances allant de 1an à 5ans. Les provisions pour créances douteuses ou précontentieuses sont déterminées au cas par cas en fonction de l’appréciation du risque par\nle management de la société."
            },
            {
                "INDICATION DES METHODES D’EVALUATION APPLIQUEES PAR L’ENTREPRISE": "3. Méthodes de détermination des écarts de conversion - Actif",
                "null": ""
            },
            {
                "INDICATION DES METHODES D’EVALUATION APPLIQUEES PAR L’ENTREPRISE": "iII - FINANCEMENT PERMANENT",
                "null": ""
            },
            {
                "INDICATION DES METHODES D’EVALUATION APPLIQUEES PAR L’ENTREPRISE": "1. Méthodes de réévaluation",
                "null": "Néant"
            },
            {
                "INDICATION DES METHODES D’EVALUATION APPLIQUEES PAR L’ENTREPRISE": "2. Méthodes d'évaluation des provisions réglementées",
                "null": "Selon budget trienal"
            },
            {
                "INDICATION DES METHODES D’EVALUATION APPLIQUEES PAR L’ENTREPRISE": "3. Dettes de financement permanent",
                "null": "Néant"
            },
            {
                "INDICATION DES METHODES D’EVALUATION APPLIQUEES PAR L’ENTREPRISE": "4. Méthodes d'évaluation des provisions durables pour risques et\ncharges",
                "null": "Selon risque"
            },
            {
                "INDICATION DES METHODES D’EVALUATION APPLIQUEES PAR L’ENTREPRISE": "5. Méthodes de détermination des écarts de conversion - Passif",
                "null": ""
            },
            {
                "INDICATION DES METHODES D’EVALUATION APPLIQUEES PAR L’ENTREPRISE": "iV - PASSIF CIRCULANT (Hors trésorerie)",
                "null": ""
            },
            {
                "INDICATION DES METHODES D’EVALUATION APPLIQUEES PAR L’ENTREPRISE": "1. Dettes du passif circulant",
                "null": "Coût réel d'entrée"
            },
            {
                "INDICATION DES METHODES D’EVALUATION APPLIQUEES PAR L’ENTREPRISE": "2. Méthodes d'évaluation des autres provisions pour risques et\ncharges",
                "null": "Selon risque"
            },
            {
                "INDICATION DES METHODES D’EVALUATION APPLIQUEES PAR L’ENTREPRISE": "3. Méthodes de détermination des écarts de conversion - Passif",
                "null": ""
            },
            {
                "INDICATION DES METHODES D’EVALUATION APPLIQUEES PAR L’ENTREPRISE": "v - TRESORERIE",
                "null": ""
            },
            {
                "INDICATION DES METHODES D’EVALUATION APPLIQUEES PAR L’ENTREPRISE": "1. Trésorerie - Actif",
                "null": "Coût réel d'entrée"
            },
            {
                "INDICATION DES METHODES D’EVALUATION APPLIQUEES PAR L’ENTREPRISE": "2. Trésorerie - Passif",
                "null": "Coût réel d'entrée"
            },
            {
                "INDICATION DES METHODES D’EVALUATION APPLIQUEES PAR L’ENTREPRISE": "1. Méthodes d'évaluation des provisions pour dépréciation",
                "null": "Néant"
            }
        ],
        [
            {
                "ÉTATS FINANCIERS\nSOCIAUX\nAU 31 DÉCEMBRE 2023": "TABLEAU DES IMMOBILISATIONS AUTRES QUE FINANCIÈRES\n(Montants en dhs) Exercice Clos au 31 décembre 2023\nAUGMENTATION DIMINUTION MONTANT\nMONTANT BRUT\nNATURE DÉBUT EXERCICE Acquisition Produ pc ot uio rn e p lla er -m l’ êe mnt ereprise Virement Cession Retrait Virement FIN EB XR EU RT C ICE\nIMMOBILISATION EN NON-VALEURS 59 819 014,53 668 901,88 0,00 0,00 0,00 1 069 082,36 0,00 59 418 834,05\n* Frais préliminaires 0,00\n* Charges à répartir sur plusieurs exercices 59 819 014,53 668 901,88 1 069 082,36 59 418 834,05\n* Primes de remboursement obligations 0,00\nIMMOBILISATIONS INCORPORELLES 140 000,00 2 800 000,00 0,00 0,00 140 000,00 0,00 0,00 2 800 000,00\n* Immobilisation en recherche et développement 2 800 000,00 2 800 000,00\n* Brevets, marques, droits et valeurs similaires 0,00\n* Fonds commercial 140 000,00 140 000,00 0,00\n* Autres immobilisations incorporelles 0,00\nIMMOBILISATIONS CORPORELLES 828 093 098,59 119 577 207,29 0,00 199 660,00 206 079 752,64 0,00 199 660,00 741 590 553,24\n* Terrains 147 095 510,29 36 105 647,80 110 989 862,49\n* Constructions 397 789 223,14 9 944 791,80 57 020,00 86 779 963,29 321 011 071,65\n* Installations techniques, matériel et outillage 53 625 052,98 1 608 958,57 79 236,01 55 154 775,54\n* Matériel de transport 137 839 571,42 100 871 091,75 83 114 905,54 155 595 757,63\n* Mobilier, matériel de bureau et aménagements 76 926 343,79 4 204 332,21 142 640,00 81 273 316,00\n* Autres immobilisations corporelles Informatiques 0,00 0,00\n* Immobilisations corporelles en cours 14 817 396,97 2 948 032,96 199 660,00 17 565 769,93\nTotal 888 052 113,12 123 046 109,17 0,00 199 660,00 206 219 752,64 1 069 082,36 199 660,00 803 809 387,29\nTABLEAU DES AMORTISSEMENTS\n(Montants en dhs) Exercice Clos au 31 décembre 2023\nCumul début exercice Dotation de l'exercice Amortissements sur immobilisations Cumul d'amortissement fin exercice\nNATURE\n1 2 sorties 3 4 =1+2+3\nIMMOBILISATION EN NON-VALEURS 35 387 693,43 11 883 766,82 1 069 082,36 46 202 377,89\n* Frais préliminaires 0,00\n* Charges à répartir sur plusieurs exercices 35 387 693,43 11 883 766,82 1 069 082,36 46 202 377,89\n* Primes de remboursement des obligations 0,00\nIMMOBILISATIONS INCORPORELLES 0,00 560 000,00 0,00 560 000,00\n* Immobilisation en recherche et développement 0,00 560 000,00 560 000,00\n* Brevets, marques, droits et valeurs similaires 0,00\n* Fonds commercial 0,00\n* Autres immobilisations incorporelles 0,00\nIMMOBILISATIONS CORPORELLES 354 408 074,23 60 813 346,37 86 278 625,49 328 942 795,11\n* Terrains 0,00\n* Constructions 242 781 805,68 16 770 636,18 66 706 284,71 192 846 157,15\n* Installations techniques, matériel et outillage 39 424 464,71 3 101 721,79 78 670,03 42 447 516,47\n* Matériel de transport 18 816 815,74 34 411 823,81 19 493 670,75 33 734 968,80\n* Mobilier, matériel de bureau et aménagement 53 384 988,10 6 529 164,59 59 914 152,69\n* Autres immobilisations corporelles Informatique 0,00\n* Immobilisations corporelles en cours 0,00\nTOTAL GENERAL 389 795 767,66 73 257 113,19 87 347 707,85 375 705 173,00\nTABLEAU DES TITRES DE PARTICIPATION\n(Montants en dhs) Exercice Clos au 31 décembre 2023\nValeur Extraits des derniers états de synthèse de la Produits inscrits\nParticipation Prix\nRaison sociale de la société Secteur d’activité Capital social Comptable société émettrice au C P C de\nN° IF au capital en % d’acquisition global\némettrice 1 2 Nette Date de Situation nette Résultat net l’exercice\n3 4\n5 clôture 6 7 8 9\nDIAMOND MOTORS 1050178 Automobile 50 000 000,00 99,99 49 600 000,00 49 600 000,00 31/12/2023 59 005 988,00 4 105 119,85 4 700 000,00\nSCAMA 1050164 Automobile 200 000 000,00 99,99 139 995 500,00 139 995 500,00 31/12/2023 223 155 599,37 6 006 791,26 12 000 000,00\nSOMMA 1048137 Matériel agricole & TP 91 666 500,00 99,99 61 994 000,00 61 994 000,00 31/12/2023 94 986 562,86 4 289 793,32 0,00\nSM2A 4902757 Automobile 150 000 000,00 99,99 144 959 900,00 144 959 900,00 31/12/2023 159 262 383,79 5 596 922,30 9 400 000,00\nLEADER LOCATION 40276844 Location de voitures 30 000 000,00 99,99 29 999 500,00 29 999 500,00 31/12/2023 30 471 439,46 -1 311 705,46 0,00\nAUTO HALL.COM 40104933 Communication & publicité 500 000,00 99,99 499 400,00 499 400,00 31/12/2023 928 375,37 274 782,08 1 500 000,00\nAUTO HALL CAPITAL\n14443027 Services financiers 10 000 000,00 100,00 10 000 000,00 10 000 000,00 31/12/2023 11 228 215,02 379 512,85 0,00\nDEVELOPPEMENT\nAUTO HALL VEHICULES\n40241074 Automobile 100 000 000,00 99,99 70 000 000,00 70 000 000,00 31/12/2023 109 378 428,07 3 806 427,85 7 800 000,00\nINDUSTRIELS\nAUTO HALL IMMOBILIER 15170665 Immobilier 200 000 000,00 0,00 200 000 000,00 200 000 000,00 31/12/2023 136 439 313,51 -19 011 150,74 0,00\nSMVN 15188504 15188504 100 000 000,00 100,00 100 000 000,00 100 000 000,00 31/12/2023 82 743 691,00 -6 272 953,47 0,00\nAFRICA MOTORS 15241708 Automobile 50 000 000,00 100,00 50 000 000,00 50 000 000,00 31/12/2023 -14 863 944,86 -39 149 387,25 0,00\nAUTO HALL OCCASION 48591836 Vente véhicules d'occasion 30 000 000,00 100,00 30 000 000,00 30 000 000,00 31/12/2023 6 180 385,70 -10 521 070,00 0,00\nLEADER LOCATION CAMIONS 50360519 Location des camions 15 000 000,00 100,00 15 000 000,00 15 000 000,00 31/12/2023 12 482 173,51 -1 128 824,99 0,00\nAUTO HALL LUXURY 14423440 Automobile 30 000 000,00 100,00 30 000 000,00 30 000 000,00 31/12/2023 -1 900 845,61 -6 340 494,15 0,00\nSMAM 52639337 Automobile 10 000 000,00 100,00 10 000 000,00 10 000 000,00 31/12/2023 12 005 150,59 1 889 081,00 2 000 000,00\nAUTRES 0 0,00 0,00 34 590,00 34 590,00 31/12/2023 0,00 0,00 0,00\nSOUSCRIPTION PART\n0 0,00 0,00 69 585 000,00 69 585 000,00 31/12/2023 0,00 0,00 0,00\nRESIDUELLES\nTOTAL 1 067 166 500,00 -- 1 011 667 890,00 1 011 667 890,00 863 702 688,59 -57 593 691,37 37 400 000,00\nTABLEAU DES PROVISIONS\n(Montants en dhs) Exercice Clos au 31 décembre 2023\nMontant début Dotations Reprises\nNature Montant fin d’exercice\nd’exercice d’exploitation financières non courantes d’exploitation financières non courantes\n1 Provisions pour dépréciation de l’actif immobilisé 0,00\n2 Provisions réglementées 0,00\n3 Provisions durables pour risques et charges 0,00\nSOUS TOTAL (A) 0,00 0,00 0,00 0,00 0,00 0,00 0,00 0,00\n4 Provisions pour dépréciation de l’actif circulant 63 134 254,77 2 186 953,87 651 708,71 64 669 499,93\n( hors trésorerie )(Clients et stocks)\n5 Autres provisions pour risques et charges 6 682,55 5 458,20 974 555,40 6 682,55 980 013,60\n6 Provisions pour dépréciation des comptes de trésorerie 0,00 0,00\nSOUS TOTAL (B) 63 140 937,32 2 186 953,87 5 458,20 974 555,40 651 708,71 6 682,55 0,00 65 649 513,53\nTOTAL ( A + B ) 63 140 937,32 2 186 953,87 5 458,20 974 555,40 651 708,71 6 682,55 0,00 65 649 513,53\nAuto HALL S.A. Km 12, Autoroute Casa-Rabat, Sortie Al Qods- Casablanca Maroc Téléphone: 0522 76 14 00/01/02 Fax: 0522 76 14 14/15 Email: autohall@autohall.ma"
            }
        ],
        [
            {
                "TABLEAU DES IMMOBILISATIONS AUTRES QUE FINANCIÈRES": "(Montants en dhs) Exercice Clos au 31 décembre 2023",
                "null": ""
            },
            {
                "TABLEAU DES IMMOBILISATIONS AUTRES QUE FINANCIÈRES": "AUGMENTATION\nMONTANT BRUT\nNATURE DÉBUT EXERCICE Acquisition Production par l’entreprise Virement\npour elle-même",
                "null": "MONTANT\nBRUT\nFIN EXERCICE"
            },
            {
                "TABLEAU DES IMMOBILISATIONS AUTRES QUE FINANCIÈRES": "",
                "null": ""
            },
            {
                "TABLEAU DES IMMOBILISATIONS AUTRES QUE FINANCIÈRES": "IMMOBILISATION EN NON-VALEURS 59 819 014,53 668 901,88 0,00 0,00 0,00 1 069 082,36 0,00 59 418 834,05",
                "null": ""
            },
            {
                "TABLEAU DES IMMOBILISATIONS AUTRES QUE FINANCIÈRES": "* Frais préliminaires 0,00\n* Charges à répartir sur plusieurs exercices 59 819 014,53 668 901,88 1 069 082,36 59 418 834,05\n* Primes de remboursement obligations 0,00",
                "null": ""
            },
            {
                "TABLEAU DES IMMOBILISATIONS AUTRES QUE FINANCIÈRES": "IMMOBILISATIONS INCORPORELLES 140 000,00 2 800 000,00 0,00 0,00 140 000,00 0,00 0,00 2 800 000,00",
                "null": ""
            },
            {
                "TABLEAU DES IMMOBILISATIONS AUTRES QUE FINANCIÈRES": "* Immobilisation en recherche et développement 2 800 000,00 2 800 000,00\n* Brevets, marques, droits et valeurs similaires 0,00\n* Fonds commercial 140 000,00 140 000,00 0,00\n* Autres immobilisations incorporelles 0,00",
                "null": ""
            },
            {
                "TABLEAU DES IMMOBILISATIONS AUTRES QUE FINANCIÈRES": "IMMOBILISATIONS CORPORELLES 828 093 098,59 119 577 207,29 0,00 199 660,00 206 079 752,64 0,00 199 660,00 741 590 553,24",
                "null": ""
            },
            {
                "TABLEAU DES IMMOBILISATIONS AUTRES QUE FINANCIÈRES": "* Terrains 147 095 510,29 36 105 647,80 110 989 862,49\n* Constructions 397 789 223,14 9 944 791,80 57 020,00 86 779 963,29 321 011 071,65\n* Installations techniques, matériel et outillage 53 625 052,98 1 608 958,57 79 236,01 55 154 775,54\n* Matériel de transport 137 839 571,42 100 871 091,75 83 114 905,54 155 595 757,63\n* Mobilier, matériel de bureau et aménagements 76 926 343,79 4 204 332,21 142 640,00 81 273 316,00\n* Autres immobilisations corporelles Informatiques 0,00 0,00\n* Immobilisations corporelles en cours 14 817 396,97 2 948 032,96 199 660,00 17 565 769,93",
                "null": ""
            },
            {
                "TABLEAU DES IMMOBILISATIONS AUTRES QUE FINANCIÈRES": "Total 888 052 113,12 123 046 109,17 0,00 199 660,00 206 219 752,64 1 069 082,36 199 660,00 803 809 387,29",
                "null": ""
            }
        ],
        [
            {
                "TABLEAU DES AMORTISSEMENTS": "(Montants en dhs) Exercice Clos au 31 décembre 2023",
                "null": ""
            },
            {
                "TABLEAU DES AMORTISSEMENTS": "NATURE",
                "null": "Cumul d'amortissement fin exercice\n4 =1+2+3"
            },
            {
                "TABLEAU DES AMORTISSEMENTS": "IMMOBILISATION EN NON-VALEURS",
                "null": "46 202 377,89"
            },
            {
                "TABLEAU DES AMORTISSEMENTS": "* Frais préliminaires",
                "null": "0,00"
            },
            {
                "TABLEAU DES AMORTISSEMENTS": "* Charges à répartir sur plusieurs exercices",
                "null": "46 202 377,89"
            },
            {
                "TABLEAU DES AMORTISSEMENTS": "* Primes de remboursement des obligations",
                "null": "0,00"
            },
            {
                "TABLEAU DES AMORTISSEMENTS": "IMMOBILISATIONS INCORPORELLES",
                "null": "560 000,00"
            },
            {
                "TABLEAU DES AMORTISSEMENTS": "* Immobilisation en recherche et développement",
                "null": "560 000,00"
            },
            {
                "TABLEAU DES AMORTISSEMENTS": "* Brevets, marques, droits et valeurs similaires",
                "null": "0,00"
            },
            {
                "TABLEAU DES AMORTISSEMENTS": "* Fonds commercial",
                "null": "0,00"
            },
            {
                "TABLEAU DES AMORTISSEMENTS": "* Autres immobilisations incorporelles",
                "null": "0,00"
            },
            {
                "TABLEAU DES AMORTISSEMENTS": "IMMOBILISATIONS CORPORELLES",
                "null": "328 942 795,11"
            },
            {
                "TABLEAU DES AMORTISSEMENTS": "* Terrains",
                "null": "0,00"
            },
            {
                "TABLEAU DES AMORTISSEMENTS": "* Constructions",
                "null": "192 846 157,15"
            },
            {
                "TABLEAU DES AMORTISSEMENTS": "* Installations techniques, matériel et outillage",
                "null": "42 447 516,47"
            },
            {
                "TABLEAU DES AMORTISSEMENTS": "* Matériel de transport",
                "null": "33 734 968,80"
            },
            {
                "TABLEAU DES AMORTISSEMENTS": "* Mobilier, matériel de bureau et aménagement",
                "null": "59 914 152,69"
            },
            {
                "TABLEAU DES AMORTISSEMENTS": "* Autres immobilisations corporelles Informatique",
                "null": "0,00"
            },
            {
                "TABLEAU DES AMORTISSEMENTS": "* Immobilisations corporelles en cours",
                "null": "0,00"
            },
            {
                "TABLEAU DES AMORTISSEMENTS": "TOTAL GENERAL",
                "null": "375 705 173,00"
            }
        ],
        [
            {
                "TABLEAU DES TITRES DE PARTICIPATION": "(Montants en dhs) Exercice Clos au 31 décembre 2023",
                "null": ""
            },
            {
                "TABLEAU DES TITRES DE PARTICIPATION": "Raison sociale de la société\némettrice",
                "null": "Produits inscrits\nau C P C de\nl’exercice\n9"
            },
            {
                "TABLEAU DES TITRES DE PARTICIPATION": "",
                "null": ""
            },
            {
                "TABLEAU DES TITRES DE PARTICIPATION": "DIAMOND MOTORS",
                "null": "4 700 000,00"
            },
            {
                "TABLEAU DES TITRES DE PARTICIPATION": "SCAMA",
                "null": "12 000 000,00"
            },
            {
                "TABLEAU DES TITRES DE PARTICIPATION": "SOMMA",
                "null": "0,00"
            },
            {
                "TABLEAU DES TITRES DE PARTICIPATION": "SM2A",
                "null": "9 400 000,00"
            },
            {
                "TABLEAU DES TITRES DE PARTICIPATION": "LEADER LOCATION",
                "null": "0,00"
            },
            {
                "TABLEAU DES TITRES DE PARTICIPATION": "AUTO HALL.COM",
                "null": "1 500 000,00"
            },
            {
                "TABLEAU DES TITRES DE PARTICIPATION": "AUTO HALL CAPITAL\nDEVELOPPEMENT",
                "null": "0,00"
            },
            {
                "TABLEAU DES TITRES DE PARTICIPATION": "AUTO HALL VEHICULES\nINDUSTRIELS",
                "null": "7 800 000,00"
            },
            {
                "TABLEAU DES TITRES DE PARTICIPATION": "AUTO HALL IMMOBILIER",
                "null": "0,00"
            },
            {
                "TABLEAU DES TITRES DE PARTICIPATION": "SMVN",
                "null": "0,00"
            },
            {
                "TABLEAU DES TITRES DE PARTICIPATION": "AFRICA MOTORS",
                "null": "0,00"
            },
            {
                "TABLEAU DES TITRES DE PARTICIPATION": "AUTO HALL OCCASION",
                "null": "0,00"
            },
            {
                "TABLEAU DES TITRES DE PARTICIPATION": "LEADER LOCATION CAMIONS",
                "null": "0,00"
            },
            {
                "TABLEAU DES TITRES DE PARTICIPATION": "AUTO HALL LUXURY",
                "null": "0,00"
            },
            {
                "TABLEAU DES TITRES DE PARTICIPATION": "SMAM",
                "null": "2 000 000,00"
            },
            {
                "TABLEAU DES TITRES DE PARTICIPATION": "AUTRES",
                "null": "0,00"
            },
            {
                "TABLEAU DES TITRES DE PARTICIPATION": "SOUSCRIPTION PART\nRESIDUELLES",
                "null": "0,00"
            },
            {
                "TABLEAU DES TITRES DE PARTICIPATION": "TOTAL",
                "null": "37 400 000,00"
            }
        ],
        [
            {
                "TABLEAU DES PROVISIONS": "(Montants en dhs) Exercice Clos au 31 décembre 2023",
                "null": ""
            },
            {
                "TABLEAU DES PROVISIONS": "Nature",
                "null": "Montant fin d’exercice"
            },
            {
                "TABLEAU DES PROVISIONS": "",
                "null": ""
            },
            {
                "TABLEAU DES PROVISIONS": "1 Provisions pour dépréciation de l’actif immobilisé",
                "null": "0,00"
            },
            {
                "TABLEAU DES PROVISIONS": "2 Provisions réglementées",
                "null": "0,00"
            },
            {
                "TABLEAU DES PROVISIONS": "3 Provisions durables pour risques et charges",
                "null": "0,00"
            },
            {
                "TABLEAU DES PROVISIONS": "SOUS TOTAL (A)",
                "null": "0,00"
            },
            {
                "TABLEAU DES PROVISIONS": "4 Provisions pour dépréciation de l’actif circulant",
                "null": "64 669 499,93"
            },
            {
                "TABLEAU DES PROVISIONS": "( hors trésorerie )(Clients et stocks)",
                "null": ""
            },
            {
                "TABLEAU DES PROVISIONS": "5 Autres provisions pour risques et charges",
                "null": "980 013,60"
            },
            {
                "TABLEAU DES PROVISIONS": "6 Provisions pour dépréciation des comptes de trésorerie",
                "null": "0,00"
            },
            {
                "TABLEAU DES PROVISIONS": "SOUS TOTAL (B)",
                "null": "65 649 513,53"
            },
            {
                "TABLEAU DES PROVISIONS": "TOTAL ( A + B )",
                "null": "65 649 513,53"
            }
        ],
        [
            {
                "ÉTATS FINANCIERS\nSOCIAUX\nAU 31 DÉCEMBRE 2023": "TABLEAU DES CRÉANCES\n(Montants en dhs) Exercice Clos au 31 décembre 2023\nANALYSE PAR ÉCHÉANCE AUTRES ANALYSES\nCRÉANCES TOTAL Échues et non Montants Montants sur l’État et Montants sur les Montants\nPlus d’un an Moins d’un an représentés\nrecouvrées en devises organismes publics entreprises liées\npar des effets\nDE L’ACTIF IMMOBILISÉ 261 215,00\n* Prêts immobilisés 261 215,00 36 215,00 225 000,00\n* Autres créances financières\nDE L’ACTIF CIRCULANT 2 352 850 943,97 13 249 842,88 2 252 126 999,43 87 474 101,66 100 490,00 103 817 071,99 1 375 375 477,00 11 827 813,86\n* Fournisseurs débiteurs, avances et acomptes 87 968 325,65 87 826 294,41 142 031,24\n* Clients et comptes rattachés 835 321 992,55 13 249 842,88 734 884 902,66 87 187 247,01 100 490,00 53 734 456,82 11 827 813,86\n* Personnel 3 273 373,27 3 273 373,27\n* État 103 817 071,99 103 817 071,99 103 817 071,99\n* Comptes d’associés et sociétés du groupe 1 321 641 020,18 1 321 641 020,18 1 321 641 020,18\n* Autres débiteurs\n* Comptes de régularisation - Actif 829 160,33 684 336,92 144 823,41\nTABLEAU DES DETTES\n(Montants en dhs) Exercice Clos au 31 décembre 2023\nANALYSE PAR ÉCHÉANCE AUTRES ANALYSES\nDETTES TOTAL Échues et non Montants Montants sur l’État Montants sur les Montants représentés\nPlus d’un an Moins d’un an\nrecouvrées en devises et organismes publics entreprises liées par des effets\nDE FINANCEMENT\n* Emprunts obligataires\n* Autres dettes de financement\nDU PASSIF CIRCULANT 1 142 265 237,38 140 165 686,25 988 917 999,29 13 181 551,84 180 907,23 15 851 900,62 960 519 519,51 143 676 299,79\n* Fournisseurs et comptes rattachés 541 218 202,52 140 165 686,25 390 596 163,84 10 456 352,43 180 907,23 461 360 779,29 143 676 299,79\n* Clients créditeurs, avances et acomptes 12 839 182,34 10 113 982,93 2 725 199,41 163 908,33\n* Personnel 1 714 594,44 1 714 594,44\n* Organismes sociaux 10 228 573,51 10 228 573,51 10 228 573,51\n* État 5 623 327,11 5 623 327,11 5 623 327,11\n* Clients créditeurs, avances et acomptes 498 994 831,89 498 994 831,89 498 994 831,89\n* Autres créanciers 3 426 621,91 3 426 621,91\n* Comptes de régularisation - Passif 68 219 903,66 68 219 903,66\nTABLEAU DES SÛRETÉS RÉELLES DONNÉES OU REÇUES\nExercice Clos au 31 décembre 2023\nTIERS CRÉDITEURS OU DÉBITEURS MONTANT SC ÛO RU EV TE ÉRT PAR LA NAT (1U )RE DD ’IA NT SE C E RT IP L TI IE OU N O (2B )J (E 3)T VALEUR COMPTABL DE A N TE ET DT EE CD LE Ô L TA U S RÛ ERETÉ DONNÉE À LA\n* Sûretés données\n* Sûretés reçues\n- MACHKOUR MOHAMED 786 000,00 Nantissment matériel (4 tracteurs)\n- EDDLYMY HAMID 21 879 942,20 Saisie exécutée à hau Ute nu 3r èd me e1 . b4 i0 e0 n. 0 e0 st0 e,0 n0 c ( op uro rsd u di et d ve e nv te ente de 2 biens saisis). membre du personnel\n- IZARZAR NABIL 1 973 173,67 Saisie conservatoire sur appartement TF 34743/61 membre du personnel\n- EL MOUDDEN Mohamed 693 086,88 Saisie conservatoire sur maison R+2\n(1) Gage : 1- Hypothèque : 2- Nantissement : 3- Warrant : 4- Autres : 5- (à préciser)\n(2) préciser si la sûreté est donnée au profit d’entreprises ou de personnes tierces (sûretés données)\n(entreprises liées, associés, membres du personnel)\n(3) préciser si la sûreté reçue par l’entreprise provient de personnes tierces autres que le débiteur (sûretés reçues)\nENGAGEMENTS FINANCIERS REÇUS OU DONNÉS HORS OPÉRATIONS DE CRÉDIT-BAIL\n(Montants en dhs) Exercice Clos au 31 décembre 2023\nENGAGEMENTS DONNÉS M EO XN ET RA CN ICT ES PM RE ÉO X CN E ÉT R DA C EN IC NT ES\nT\n*Avals et cautions 61 068 000,00 41 018 740,00\n- Cautions provisoires 7 142 000,00 4 447 000,00\n- Cautions définitives 5 093 000,00 4 524 740,00\n- Retenues de garanties 17 185 000,00 11 288 000,00\n- Cautions étrangères 4 315 000,00 4 411 000,00\n- Cautions diverses 27 333 000,00 16 348 000,00\n*Autres engagements donnés -\n- Autres cautions 45 000 000 Euro 45 000 000 Euro\n- Crédits documentaires\n- Saisie arrêt\n- Engagement prime de départ à la retraite\nTOTAL (1) 61 068 000,00 41 018 740,00\n45 000 000 Euro 45 000 000 Euro\n(1) dont engagements à l'égard d'entreprise liées 45 000 000 Euro 45 000 000 Euro\nENGAGEMENTS REÇUS MONTANTS EXERCICE MONTANTS EXERCICE PRÉCÉDENT\n* Avals et cautions\nmarchandises 200 000 000,00\nTotal 200 000 000,00\nLe rapport financier de l’année 2023 serait disponible, à partir du 30 avril 2023, sur le site internet d'Auto Hall www.autohall.ma.\nAuto HALL S.A. Km 12, Autoroute Casa-Rabat, Sortie Al Qods- Casablanca Maroc Téléphone: 0522 76 14 00/01/02 Fax: 0522 76 14 14/15 Email: autohall@autohall.ma"
            }
        ],
        [
            {
                "TABLEAU DES CRÉANCES": "(Montants en dhs)",
                "null": ""
            },
            {
                "TABLEAU DES CRÉANCES": "CRÉANCES",
                "null": ""
            },
            {
                "TABLEAU DES CRÉANCES": "",
                "null": "Montants\nreprésentés\npar des effets"
            },
            {
                "TABLEAU DES CRÉANCES": "DE L’ACTIF IMMOBILISÉ",
                "null": ""
            },
            {
                "TABLEAU DES CRÉANCES": "* Prêts immobilisés\n* Autres créances financières",
                "null": ""
            },
            {
                "TABLEAU DES CRÉANCES": "DE L’ACTIF CIRCULANT",
                "null": "11 827 813,86"
            },
            {
                "TABLEAU DES CRÉANCES": "* Fournisseurs débiteurs, avances et acomptes\n* Clients et comptes rattachés\n* Personnel\n* État\n* Comptes d’associés et sociétés du groupe\n* Autres débiteurs\n* Comptes de régularisation - Actif",
                "null": "11 827 813,86"
            }
        ],
        [
            {
                "TABLEAU DES DETTES": "(Montants en dhs) Exercice Clos au 31 décembre 2023",
                "null": ""
            },
            {
                "TABLEAU DES DETTES": "DETTES",
                "null": ""
            },
            {
                "TABLEAU DES DETTES": "",
                "null": "Montants représentés\npar des effets"
            },
            {
                "TABLEAU DES DETTES": "DE FINANCEMENT",
                "null": ""
            },
            {
                "TABLEAU DES DETTES": "* Emprunts obligataires\n* Autres dettes de financement",
                "null": ""
            },
            {
                "TABLEAU DES DETTES": "DU PASSIF CIRCULANT",
                "null": "143 676 299,79"
            },
            {
                "TABLEAU DES DETTES": "* Fournisseurs et comptes rattachés\n* Clients créditeurs, avances et acomptes\n* Personnel\n* Organismes sociaux\n* État\n* Clients créditeurs, avances et acomptes\n* Autres créanciers\n* Comptes de régularisation - Passif",
                "null": "143 676 299,79"
            }
        ],
        [
            {
                "TABLEAU DES SÛRETÉS RÉELLES DONNÉES OU REÇUES": "Exercice Clos au 31 décembre 2023",
                "null": ""
            },
            {
                "TABLEAU DES SÛRETÉS RÉELLES DONNÉES OU REÇUES": "TIERS CRÉDITEURS OU DÉBITEURS",
                "null": "VALEUR COMPTABLE NETTE DE LA SÛRETÉ DONNÉE À LA\nDATE DE CLÔTURE"
            },
            {
                "TABLEAU DES SÛRETÉS RÉELLES DONNÉES OU REÇUES": "* Sûretés données",
                "null": ""
            },
            {
                "TABLEAU DES SÛRETÉS RÉELLES DONNÉES OU REÇUES": "* Sûretés reçues",
                "null": ""
            },
            {
                "TABLEAU DES SÛRETÉS RÉELLES DONNÉES OU REÇUES": "- MACHKOUR MOHAMED",
                "null": ""
            },
            {
                "TABLEAU DES SÛRETÉS RÉELLES DONNÉES OU REÇUES": "- EDDLYMY HAMID",
                "null": ""
            },
            {
                "TABLEAU DES SÛRETÉS RÉELLES DONNÉES OU REÇUES": "- IZARZAR NABIL",
                "null": ""
            },
            {
                "TABLEAU DES SÛRETÉS RÉELLES DONNÉES OU REÇUES": "- EL MOUDDEN Mohamed",
                "null": ""
            }
        ],
        [
            {
                "ENGAGEMENTS FINANCIERS REÇUS OU DONNÉS HORS OPÉRATIONS DE CRÉDIT-BAIL": "(Montants en dhs)",
                "null": ""
            },
            {
                "ENGAGEMENTS FINANCIERS REÇUS OU DONNÉS HORS OPÉRATIONS DE CRÉDIT-BAIL": "ENGAGEMENTS DONNÉS",
                "null": "MONTANTS\nEXERCICE\nPRÉCÉDENT"
            },
            {
                "ENGAGEMENTS FINANCIERS REÇUS OU DONNÉS HORS OPÉRATIONS DE CRÉDIT-BAIL": "*Avals et cautions\n- Cautions provisoires\n- Cautions définitives\n- Retenues de garanties\n- Cautions étrangères\n- Cautions diverses\n*Autres engagements donnés\n- Autres cautions\n- Crédits documentaires\n- Saisie arrêt\n- Engagement prime de départ à la retraite\nTOTAL (1)",
                "null": "41 018 740,00\n4 447 000,00\n4 524 740,00\n11 288 000,00\n4 411 000,00\n16 348 000,00\n45 000 000 Euro"
            },
            {
                "ENGAGEMENTS FINANCIERS REÇUS OU DONNÉS HORS OPÉRATIONS DE CRÉDIT-BAIL": "",
                "null": ""
            },
            {
                "ENGAGEMENTS FINANCIERS REÇUS OU DONNÉS HORS OPÉRATIONS DE CRÉDIT-BAIL": "",
                "null": "41 018 740,00"
            },
            {
                "ENGAGEMENTS FINANCIERS REÇUS OU DONNÉS HORS OPÉRATIONS DE CRÉDIT-BAIL": "",
                "null": "45 000 000 Euro"
            },
            {
                "ENGAGEMENTS FINANCIERS REÇUS OU DONNÉS HORS OPÉRATIONS DE CRÉDIT-BAIL": "(1) dont engagements à l'égard d'entreprise liées",
                "null": "45 000 000 Euro"
            },
            {
                "ENGAGEMENTS FINANCIERS REÇUS OU DONNÉS HORS OPÉRATIONS DE CRÉDIT-BAIL": "ENGAGEMENTS REÇUS\n* Avals et cautions\nmarchandises\nTotal",
                "null": "MONTANTS EXERCICE PRÉCÉDENT"
            },
            {
                "ENGAGEMENTS FINANCIERS REÇUS OU DONNÉS HORS OPÉRATIONS DE CRÉDIT-BAIL": "",
                "null": ""
            },
            {
                "ENGAGEMENTS FINANCIERS REÇUS OU DONNÉS HORS OPÉRATIONS DE CRÉDIT-BAIL": "",
                "null": "200 000 000,00"
            },
            {
                "ENGAGEMENTS FINANCIERS REÇUS OU DONNÉS HORS OPÉRATIONS DE CRÉDIT-BAIL": "",
                "null": "200 000 000,00"
            }
        ],
        [
            {
                "ÉTATS FINANCIERS\nSOCIAUX\nAU 31 DÉCEMBRE 2023": "Auto HALL S.A. Km 12, Autoroute Casa-Rabat, Sortie Al Qods- Casablanca Maroc Téléphone: 0522 76 14 00/01/02 Fax: 0522 76 14 14/15 Email: autohall@autohall.ma"
            }
        ],
        [
            {
                "ÉTATS FINANCIERS\nCONSOLIDÉS\nAU 31 DÉCEMBRE 2023": "PRINCIPES COMPTABLES DE CONSOLIDATION\nPRINCIPES COMPTABLES l’acquisition d’immobilisations. De ce fait, aucun retraitement n’a été effectué par norme IFRS 16, entrée en vigueur à partir du 1er janvier 2019 et qui vient remplacer\nEn application de l’avis n° 5 du Conseil National de la Comptabilité (CNC) du 26 mai le groupe pour ce cas. la norme IAS 17 portant sur les contrats de location financement. Les contrats de\n2005 et conformément aux dispositions de la circulaire du Conseil Déontologique Les durées de vie retenues des immobilisations sont les suivantes : location simple dont dispose le groupe sont conclus entre entités appartenant au\ndes Valeurs Mobilières (CDVM), les comptes consolidés du groupe Auto Hall ont été Constructions (gros œuvres) 30 ans périmètre de consolidation. En conséquence les charges et produits qui en résultent\nétablis en conformité avec les normes comptables internationales IFRS (International Aménagements des constructions 3 à 20 ans s’annulent dans les comptes consolidés.\nFinancial Reporting Standards) telle qu’adoptés par la commission européenne. Installations techniques, matériel et outillage 2 à 15 ans Par ailleurs, le groupe Auto Hall dispose de contrats de leasing. Ces contrats continuent\nMatériel informatique 5 ans de faire l’objet de retraitement conformément à la norme IFRS 16.\nPÉRIMÈTRE ET MÉTHODES DE CONSOLIDATION Matériel de transport 4 à 10 ans - Incertitude relative aux traitements fiscaux -IFRIC 23-\nToutes les sociétés entrant dans le périmètre sont contrôlées exclusivement par le Matériel, mobilier de bureau 10 ans Le Groupe a établi un diagnostic et une étude d’impact pour la mise en œuvre de\ngroupe et donc consolidées par intégration globale. Enfin, le groupe n’a pas opté pour la réévaluation des immobilisations corporelles. l’interprétation IFRIC 23, entrée en vigueur à partir du 1er janvier 2019, en procédant\nPRINCIPALES RÈGLES APPLIQUÉES - Avantages au personnel -IAS 19- par une revue des sources d’incertitudes fiscales (IS) déterminées par la Direction,\n- Immobilisations incorporelles -IAS 38- Conformément à la norme IAS 19, les obligations au titre des avantages postérieurs puis par l’évaluation et le chiffrage des risques liés à ces incertitudes afin de refléter\nElles comprennent exclusivement un fonds commercial, non amortissable. La à l’emploi du régime à prestations définies sont calculées annuellement par un au mieux le montant décaissable lors d’un contrôle fiscal.\ncomptabilisation de ce fond est effectuée au coût historique diminué de la perte de actuaire indépendant. - IFRS 9 :\nvaleur éventuelle estimée à chaque clôture par le management du groupe. - Retraitement des impôts -IAS 12- La classification des actifs financiers en norme IFRS 9 prend en compte le modèle\n- Immobilisations corporelles -IAS 16- Les impôts différés résultant de la neutralisation des différences temporaires introduites par économique de l’entité pour la gestion des actifs financiers et les caractéristiques des\nLes immobilisations corporelles sont comptabilisées au bilan pour leur coût d’acquisition les règles fiscales et des retraitements de consolidation sont calculés société par société. flux de trésorerie contractuels de l’actif. Ce volet n’a pas d’impact significatif pour le\nou de revient, diminué des amortissements et des pertes de valeur éventuellement - Actions propres -IAS 32- Groupe Auto Hall (hors fonds de titrisation FT Mobility)\nconstatées. Les amortissements sont calculés selon la méthode linéaire, en fonction Les actions de la société Auto Hall détenues par elle ou par ses filiales sont portées Avec la création du Fonds, et dans le cadre de cette norme, le Gpe a introduit le\nde la durée de vie estimée des actifs concernés en tenant compte également des en diminution des capitaux propres consolidés. Les résultats de cessions réalisés sur nouveau modèle de dépréciation, prospectif, fondé sur les « pertes attendues ECL ».\nvaleurs résiduelles pour le cas du matériel de transport. ces titres sont exclus du résultat net et sont imputés aux capitaux propres. Il s’agit des pertes de crédit attendues sur les créances que l’entreprise s’attend à ne\nIl est à noter également que les sociétés du groupe ne disposent pas de frais financiers - Contrats de location -IFRS 16- pas recouvrer, pondérées par la probabilité de survenance de ces pertes sur toute\nqui peuvent faire l’objet d’une intégration dans le coût des immobilisations corporelles. Le Groupe a établi un diagnostic et une étude d’impact pour la mise en œuvre de la la durée de vie de l’instrument.\nEn plus, aucune subvention d’investissement n’a été reçue par le groupe pour\nSociétés Activité % contrôle\nAuto Hall A ms as te ém rieb l la ing de u se tt r ic eo l m etm de er c Ti .a Pl .isation de véhicules industriels de marque Mitsubishi Fuso et la distribution de voitures particulières, de véhicules utilitaires légers, de matériel agricole et de 100%\nSCAMA Importation et Commercialisation des véhicules de marque Ford. 100%\nDiamond Motors Importation et Commercialisation des véhicules de marque Mitsubishi. 100%\nSOMMA (fusion absorption de SOBERMA) Importation et Commercialisation de matériel agricole, TP et mines de marque New Holland, Casa, Belaz et autres. 100%\nLeader Location LD Location longue durée de véhicules sans chauffeur 100%\nAuto Hall.com’ Société de communication 100%\nSMAA Importation et commercialisation de véhicules de marque Opel 100%\nAuto Hall Véhicules Industriels Assemblage et commercialisation de véhicules industriels 100%\nAuto Hall Capital Développement Fonds d’investissement 100%\nAuto Hall Immobilier Fonds d’investissement ou autres opérations immobilières 100%\nSMVN Importation et commercialisation des véhicules de marque Nissan 100%\nAfrica Motors Importation et commercialisation de marque DFSK/ Foton /Gaz et Chery 100%\nAuto Hall Occasion Vente de matériel d’occasion 100%\nLeader Location Camion Location longue durée de camions 100%\nAuto Hall Luxury Motors Importation et commercialisation de véhicules de marque Maserti 100%\nFT ‘’Auto Moblity’’ Fonds de titrisation de créances des clients Auto Hall contractées auprès du partenaire SOFAC et dont les parts résiduelles sont détenues exclusivement par Auto Hall. 100%\nSociété Marocaine de l’Automobile Moderne Commercialisation de véhicules de marques Fiat, Jeep & Alfa Romeo (Partenariat FCA Stellantis) 100%\nBILAN ACTIF COMPTE DE RÉSULTAT\nACTIF (En dirhams) 31 décembre 2023 31 décembre 2022 (En dirhams) 31 décembre 2023 31 décembre 2022\nGoodwill 22 148 218,93 22 148 218,93 Chiffre d'affaires 4 912 106 381,56 4 831 136 612,44\nCoût des biens vendus 4 111 663 436,84 3 950 790 016,67\nImmobilisations incorporelles 55 189 006,71 55 056 900,46\nCharges externes 161 852 116,31 155 881 119,19\nImmobilisations corporelles 2 018 971 130,70 1 928 179 529,32\nCharges de personnel 263 039 933,18 266 884 950,55\nAutres instruments financiers * 639 565 361,74* 577 896,03 Impôts et taxes 23 327 063,63 24 518 036,28\nImpôts différés actif 32 394 355,00 29 699 701,40 Dotations d'exploitations 247 727 420,83 197 546 592,21\nReprises d'exploitations 17 023 766,77 22 280 546,32\nActifs non courants 2 768 268 073,08 2 035 662 246,14\nAutres produits 307 089 236,20 184 626 686,23\nStocks 1 558 037 685,63 1 425 132 595,61\nAutres charges 220 926 103,46 183 689 882,16\nComptes clients 956 069 862,25 969 902 293,14 RÉSULTAT OPÉRATIONNEL 207 683 310,28 258 733 247,93\nAutres créances d'exploitation 517 140 619,77 457 149 015,60 Produits financiers 56 437 933,96 23 168 755,67\nCharges financières 167 023 375,09 101 155 878,57\nTrésorerie et équivalents de trésorerie 458 722 499,22 84 190 468,07\nRÉSULTAT FINANCIER -110 585 441,13 -77 987 122,90\nActifs courants 3 489 970 666,87 2 936 374 372,42\nRÉSULTAT CONSOLIDÉ AVANT IMPÔT 97 097 869,15 180 746 125,03\nTOTAL ACTIF 6 258 238 739,95 4 972 036 618,56 Charges d'impôt 69 218 371,52 80 682 053,35\n(*) : dont 637.854.702,70 dhs provenant du FT Auto Mobility - Impôt exigible 53 596 084,32 66 913 440,23\n- Impôt différé 15 622 287,20 13 768 613,12\nRÉSULTAT NET CONSOLIDÉ 27 879 497,63* 100 064 071,69\nBILAN PASSIF (*) : dont 1.323.581,84 dhs provenant du FT Auto Mobility\nPASSIF (En dirhams) 31 décembre 2023 31 décembre 2022 TABLEAU DE FLUX DE TRÉSORERIE\nCapital social 502 945 280,00 502 945 280,00\n(En milliers de dirhams) 31 décembre 2023 31 décembre 2022\nPrime d'émission 251 021 566,80 251 021 566,80\nFlux de trésorerie d'exploitation 688 132 -341 669\nRéserves consolidées 761 143 339,20 839 944 731,77 Résultat net consolidé 27 879 100 064\nRésultats consolidés de l'exercice** 27 879 497,63** 100 064 071,68 Dotations aux amortissements 232 888 182 959\nCapitaux propres part groupe 1 542 989 683,63 1 693 975 650,26 Élimination des impôts différés 15 623 13 769\nIntérêts minoritaires Produits de cession des immobilisations corporelles 290 025 144 983\nCapitaux propres 1 542 989 683,63 1 693 975 650,26 VNC sur cession d'actifs 182 361 113 247\nAutres passifs non courants* 1 010 236 974,13* 243 530 068,88 Variation du besoin en fond de roulement -191 557 -948 689\nImpôts différés passif 139 335 552,96 121 333 903,88 Autres produits/charges non encaissables 37\nPassifs non courants 2 692 562 210,71 2 058 839 623,02 Coût de l'endettement 130 913 51 961\nDettes fournisseurs 718 333 899,78 744 293 600,55\nFlux de trésorerie d'investissement -1 441 322 -662 010\nAutres passifs courants 262 491 819,92 249 024 531,31 Décaissements liés aux acquisitions des immobilisations -512 207 -511 671\nAutres passifs financiers à court terme 2 584 850 809,54 1 919 878 863,69 Encaissements liés aux cessions d'immobilisations corporelles -290 025 -144 983\nPassifs courants 3 565 676 529,24 2 913 196 995,54 Variation des autres instruments financiers* -640 307*\nTOTAL PASSIF 6 258 238 739,95 4 972 036 618,56 Autres mouvements (GW&Autres Mvts) 1 217 -5 356\n(*) : dont 574.719.176,44 dhs provenant du FT Auto Mobility Flux de trésorerie de financement 462 750 -290 577\n(**) : dont 1.323.581,84 dhs provenant du FT Auto Mobility\nDividendes mis en paiement au cours de l'exercice -176 031 -176 031\nDividendes convertis en actions\nVARIATION DES CAPITAUX PROPRES\nRemboursement des dettes de financement -37 210 -63 053\n(En milliers de dirhams) Capital d'émiP sr si im one coR né ss oe lr idve és s coR né ss ou ll it da ét dT uo t ga rl o P ua pr et minoI rn it té ar irê et Total Coût de l'endettement -130 913 -51 961\nCapitaux propres au 31 décembre Nouveaux emprunts 300 000\n2022 502 945 251 022 839 945 100 064 1 693 976 1 693 976\nDividendes -176 031 -176 031 -176 031 Titres de créances émis* 505 134*\nAffectation de résultat 100 064 -100 064 Autres 1 770 468\nRésultat net de l’exercice 27 879 27 879 27 879 Variation de trésorerie nette -290 440 -1 294 256\nA pru ot pre res sMouvements sur les capitaux -2 835 -2 835 -2 835 Trésorerie d'ouverture -1 835 688 -541 432\nTrésorerie de clôture -2 126 128 -1 835 688\nCapitaux propres au 31 décembre\n2023 502 945 251 022 761 143 27 879 1 542 989 1 542 989 (*) : valeurs relatives au FT Auto Mobiity\nAuto HALL S.A. Km 12, Autoroute Casa-Rabat, Sortie Al Qods- Casablanca Maroc Téléphone: 0522 76 14 00/01/02 Fax: 0522 76 14 14/15 Email: autohall@autohall.ma"
            }
        ],
        [
            {
                "Sociétés": "Auto Hall",
                "Activité": "Assemblage et commercialisation de véhicules industriels de marque Mitsubishi Fuso et la distribution de voitures particulières, de véhicules utilitaires légers, de matériel agricole et de\nmatériel industriel et de T.P.",
                "% contrôle": "100%"
            },
            {
                "Sociétés": "SCAMA",
                "Activité": "Importation et Commercialisation des véhicules de marque Ford.",
                "% contrôle": "100%"
            },
            {
                "Sociétés": "Diamond Motors",
                "Activité": "Importation et Commercialisation des véhicules de marque Mitsubishi.",
                "% contrôle": "100%"
            },
            {
                "Sociétés": "SOMMA (fusion absorption de SOBERMA)",
                "Activité": "Importation et Commercialisation de matériel agricole, TP et mines de marque New Holland, Casa, Belaz et autres.",
                "% contrôle": "100%"
            },
            {
                "Sociétés": "Leader Location LD",
                "Activité": "Location longue durée de véhicules sans chauffeur",
                "% contrôle": "100%"
            },
            {
                "Sociétés": "Auto Hall.com’",
                "Activité": "Société de communication",
                "% contrôle": "100%"
            },
            {
                "Sociétés": "SMAA",
                "Activité": "Importation et commercialisation de véhicules de marque Opel",
                "% contrôle": "100%"
            },
            {
                "Sociétés": "Auto Hall Véhicules Industriels",
                "Activité": "Assemblage et commercialisation de véhicules industriels",
                "% contrôle": "100%"
            },
            {
                "Sociétés": "Auto Hall Capital Développement",
                "Activité": "Fonds d’investissement",
                "% contrôle": "100%"
            },
            {
                "Sociétés": "Auto Hall Immobilier",
                "Activité": "Fonds d’investissement ou autres opérations immobilières",
                "% contrôle": "100%"
            },
            {
                "Sociétés": "SMVN",
                "Activité": "Importation et commercialisation des véhicules de marque Nissan",
                "% contrôle": "100%"
            },
            {
                "Sociétés": "Africa Motors",
                "Activité": "Importation et commercialisation de marque DFSK/ Foton /Gaz et Chery",
                "% contrôle": "100%"
            },
            {
                "Sociétés": "Auto Hall Occasion",
                "Activité": "Vente de matériel d’occasion",
                "% contrôle": "100%"
            },
            {
                "Sociétés": "Leader Location Camion",
                "Activité": "Location longue durée de camions",
                "% contrôle": "100%"
            },
            {
                "Sociétés": "Auto Hall Luxury Motors",
                "Activité": "Importation et commercialisation de véhicules de marque Maserti",
                "% contrôle": "100%"
            },
            {
                "Sociétés": "FT ‘’Auto Moblity’’",
                "Activité": "Fonds de titrisation de créances des clients Auto Hall contractées auprès du partenaire SOFAC et dont les parts résiduelles sont détenues exclusivement par Auto Hall.",
                "% contrôle": "100%"
            },
            {
                "Sociétés": "Société Marocaine de l’Automobile Moderne",
                "Activité": "Commercialisation de véhicules de marques Fiat, Jeep & Alfa Romeo (Partenariat FCA Stellantis)",
                "% contrôle": "100%"
            }
        ],
        [
            {
                "BILAN ACTIF": "ACTIF (En dirhams)",
                "null": "31 décembre 2022"
            },
            {
                "BILAN ACTIF": "Goodwill",
                "null": "22 148 218,93"
            },
            {
                "BILAN ACTIF": "Immobilisations incorporelles",
                "null": "55 056 900,46"
            },
            {
                "BILAN ACTIF": "Immobilisations corporelles",
                "null": "1 928 179 529,32"
            },
            {
                "BILAN ACTIF": "Autres instruments financiers *",
                "null": "577 896,03"
            },
            {
                "BILAN ACTIF": "Impôts différés actif",
                "null": "29 699 701,40"
            },
            {
                "BILAN ACTIF": "Actifs non courants",
                "null": "2 035 662 246,14"
            },
            {
                "BILAN ACTIF": "Stocks",
                "null": "1 425 132 595,61"
            },
            {
                "BILAN ACTIF": "Comptes clients",
                "null": "969 902 293,14"
            },
            {
                "BILAN ACTIF": "Autres créances d'exploitation",
                "null": "457 149 015,60"
            },
            {
                "BILAN ACTIF": "Trésorerie et équivalents de trésorerie",
                "null": "84 190 468,07"
            },
            {
                "BILAN ACTIF": "Actifs courants",
                "null": "2 936 374 372,42"
            },
            {
                "BILAN ACTIF": "TOTAL ACTIF",
                "null": "4 972 036 618,56"
            }
        ],
        [
            {
                "COMPTE DE RÉSULTAT": "(En dirhams)",
                "null": "31 décembre 2022"
            },
            {
                "COMPTE DE RÉSULTAT": "Chiffre d'affaires",
                "null": "4 831 136 612,44"
            },
            {
                "COMPTE DE RÉSULTAT": "Coût des biens vendus",
                "null": "3 950 790 016,67"
            },
            {
                "COMPTE DE RÉSULTAT": "Charges externes",
                "null": "155 881 119,19"
            },
            {
                "COMPTE DE RÉSULTAT": "Charges de personnel",
                "null": "266 884 950,55"
            },
            {
                "COMPTE DE RÉSULTAT": "Impôts et taxes",
                "null": "24 518 036,28"
            },
            {
                "COMPTE DE RÉSULTAT": "Dotations d'exploitations",
                "null": "197 546 592,21"
            },
            {
                "COMPTE DE RÉSULTAT": "Reprises d'exploitations",
                "null": "22 280 546,32"
            },
            {
                "COMPTE DE RÉSULTAT": "Autres produits",
                "null": "184 626 686,23"
            },
            {
                "COMPTE DE RÉSULTAT": "Autres charges",
                "null": "183 689 882,16"
            },
            {
                "COMPTE DE RÉSULTAT": "RÉSULTAT OPÉRATIONNEL",
                "null": "258 733 247,93"
            },
            {
                "COMPTE DE RÉSULTAT": "Produits financiers",
                "null": "23 168 755,67"
            },
            {
                "COMPTE DE RÉSULTAT": "Charges financières",
                "null": "101 155 878,57"
            },
            {
                "COMPTE DE RÉSULTAT": "RÉSULTAT FINANCIER",
                "null": "-77 987 122,90"
            },
            {
                "COMPTE DE RÉSULTAT": "RÉSULTAT CONSOLIDÉ AVANT IMPÔT",
                "null": "180 746 125,03"
            },
            {
                "COMPTE DE RÉSULTAT": "Charges d'impôt",
                "null": "80 682 053,35"
            },
            {
                "COMPTE DE RÉSULTAT": "- Impôt exigible",
                "null": "66 913 440,23"
            },
            {
                "COMPTE DE RÉSULTAT": "- Impôt différé",
                "null": "13 768 613,12"
            },
            {
                "COMPTE DE RÉSULTAT": "RÉSULTAT NET CONSOLIDÉ",
                "null": "100 064 071,69"
            }
        ],
        [
            {
                "BILAN PASSIF": "PASSIF (En dirhams)",
                "null": "31 décembre 2022"
            },
            {
                "BILAN PASSIF": "Capital social",
                "null": "502 945 280,00"
            },
            {
                "BILAN PASSIF": "Prime d'émission",
                "null": "251 021 566,80"
            },
            {
                "BILAN PASSIF": "Réserves consolidées",
                "null": "839 944 731,77"
            },
            {
                "BILAN PASSIF": "Résultats consolidés de l'exercice**",
                "null": "100 064 071,68"
            },
            {
                "BILAN PASSIF": "Capitaux propres part groupe",
                "null": "1 693 975 650,26"
            },
            {
                "BILAN PASSIF": "Intérêts minoritaires",
                "null": ""
            },
            {
                "BILAN PASSIF": "Capitaux propres",
                "null": "1 693 975 650,26"
            },
            {
                "BILAN PASSIF": "Autres passifs non courants*",
                "null": "243 530 068,88"
            },
            {
                "BILAN PASSIF": "Impôts différés passif",
                "null": "121 333 903,88"
            },
            {
                "BILAN PASSIF": "Passifs non courants",
                "null": "2 058 839 623,02"
            },
            {
                "BILAN PASSIF": "Dettes fournisseurs",
                "null": "744 293 600,55"
            },
            {
                "BILAN PASSIF": "Autres passifs courants",
                "null": "249 024 531,31"
            },
            {
                "BILAN PASSIF": "Autres passifs financiers à court terme",
                "null": "1 919 878 863,69"
            },
            {
                "BILAN PASSIF": "Passifs courants",
                "null": "2 913 196 995,54"
            },
            {
                "BILAN PASSIF": "TOTAL PASSIF",
                "null": "4 972 036 618,56"
            }
        ],
        [
            {
                "TABLEAU DE FLUX DE TRÉSORERIE": "(En milliers de dirhams)",
                "null": "31 décembre 2022"
            },
            {
                "TABLEAU DE FLUX DE TRÉSORERIE": "Flux de trésorerie d'exploitation",
                "null": "-341 669"
            },
            {
                "TABLEAU DE FLUX DE TRÉSORERIE": "Résultat net consolidé",
                "null": "100 064"
            },
            {
                "TABLEAU DE FLUX DE TRÉSORERIE": "Dotations aux amortissements",
                "null": "182 959"
            },
            {
                "TABLEAU DE FLUX DE TRÉSORERIE": "Élimination des impôts différés",
                "null": "13 769"
            },
            {
                "TABLEAU DE FLUX DE TRÉSORERIE": "Produits de cession des immobilisations corporelles",
                "null": "144 983"
            },
            {
                "TABLEAU DE FLUX DE TRÉSORERIE": "VNC sur cession d'actifs",
                "null": "113 247"
            },
            {
                "TABLEAU DE FLUX DE TRÉSORERIE": "Variation du besoin en fond de roulement",
                "null": "-948 689"
            },
            {
                "TABLEAU DE FLUX DE TRÉSORERIE": "Autres produits/charges non encaissables",
                "null": "37"
            },
            {
                "TABLEAU DE FLUX DE TRÉSORERIE": "Coût de l'endettement",
                "null": "51 961"
            },
            {
                "TABLEAU DE FLUX DE TRÉSORERIE": "Flux de trésorerie d'investissement",
                "null": "-662 010"
            },
            {
                "TABLEAU DE FLUX DE TRÉSORERIE": "Décaissements liés aux acquisitions des immobilisations",
                "null": "-511 671"
            },
            {
                "TABLEAU DE FLUX DE TRÉSORERIE": "Encaissements liés aux cessions d'immobilisations corporelles",
                "null": "-144 983"
            },
            {
                "TABLEAU DE FLUX DE TRÉSORERIE": "Variation des autres instruments financiers*",
                "null": ""
            },
            {
                "TABLEAU DE FLUX DE TRÉSORERIE": "Autres mouvements (GW&Autres Mvts)",
                "null": "-5 356"
            },
            {
                "TABLEAU DE FLUX DE TRÉSORERIE": "Flux de trésorerie de financement",
                "null": "-290 577"
            },
            {
                "TABLEAU DE FLUX DE TRÉSORERIE": "Dividendes mis en paiement au cours de l'exercice",
                "null": "-176 031"
            },
            {
                "TABLEAU DE FLUX DE TRÉSORERIE": "Dividendes convertis en actions",
                "null": ""
            },
            {
                "TABLEAU DE FLUX DE TRÉSORERIE": "Remboursement des dettes de financement",
                "null": "-63 053"
            },
            {
                "TABLEAU DE FLUX DE TRÉSORERIE": "Coût de l'endettement",
                "null": "-51 961"
            },
            {
                "TABLEAU DE FLUX DE TRÉSORERIE": "Nouveaux emprunts",
                "null": ""
            },
            {
                "TABLEAU DE FLUX DE TRÉSORERIE": "Titres de créances émis*",
                "null": ""
            },
            {
                "TABLEAU DE FLUX DE TRÉSORERIE": "Autres",
                "null": "468"
            },
            {
                "TABLEAU DE FLUX DE TRÉSORERIE": "Variation de trésorerie nette",
                "null": "-1 294 256"
            },
            {
                "TABLEAU DE FLUX DE TRÉSORERIE": "Trésorerie d'ouverture",
                "null": "-541 432"
            },
            {
                "TABLEAU DE FLUX DE TRÉSORERIE": "Trésorerie de clôture",
                "null": "-1 835 688"
            }
        ],
        [
            {
                "VARIATION DES CAPITAUX PROPRES": "(En milliers de dirhams)",
                "null": "Total"
            },
            {
                "VARIATION DES CAPITAUX PROPRES": "Capitaux propres au 31 décembre\n2022",
                "null": "1 693 976"
            },
            {
                "VARIATION DES CAPITAUX PROPRES": "Dividendes",
                "null": "-176 031"
            },
            {
                "VARIATION DES CAPITAUX PROPRES": "Affectation de résultat",
                "null": ""
            },
            {
                "VARIATION DES CAPITAUX PROPRES": "Résultat net de l’exercice",
                "null": "27 879"
            },
            {
                "VARIATION DES CAPITAUX PROPRES": "Autres Mouvements sur les capitaux\npropres",
                "null": "-2 835"
            },
            {
                "VARIATION DES CAPITAUX PROPRES": "Capitaux propres au 31 décembre\n2023",
                "null": "1 542 989"
            }
        ],
        [
            {
                "ÉTATS FINANCIERS\nCONSOLIDÉS\nAU 31 DÉCEMBRE 2023": "Auto HALL S.A. Km 12, Autoroute Casa-Rabat, Sortie Al Qods- Casablanca Maroc Téléphone: 0522 76 14 00/01/02 Fax: 0522 76 14 14/15 Email: autohall@autohall.ma"
            }
        ]
    ]
}