{
    "text": "COMMUNICATION\nFINANCIÈRE\nRÉSULTATS AU 31 DÉCEMBRE 2023\nCOMPTES CONSOLIDÉS DU GROUPE CFG BANK\nAU 31 DÉCEMBRE 2023\nBilan IFRS au 31/12/23 (En milliers de DH) RAPPORT D’AUDIT SUR LES ÉTATS FINANCIERS CONSOLIDÉS\nACTIF 31/12/2023 31/12/2022\nValeurs en caisse, Banques Centrales, Trésor public, Service CP 405.210 593.633\nActifs financiers à la juste valeur par résultat 3.472.376 3.030.625\nActifs financiers détenus à des fins de transaction 3.472.376 3.030.625\nAutres actifs financiers à la juste valeur par résultat\nInstruments dérivés de couverture - - 7, Boulevard Driss Slaoui 4, Rue Maati Jazouli (Ex-Rue FRIOL)\nCasablanca Anfa- Casablanca\nActifs financiers à la juste valeur par capitaux propres 42.096 40.296 Maroc Maroc\nInstruments de dettes comptabilisées à la juste valeur par capitaux propres\nrecyclables Aux Actionnaires de\nInstruments de dettes comptabilisées à la juste valeur par capitaux propres 42.096 40.296 CFG Bank S.A.\nnon recyclables 5/7, rue Ibnou Toufail\nCasablanca\nTitres au coût amorti 677.026 682.432\nPrêts et créances sur les établissements de crédit et assimilés, au coût amorti 690.614 332.824 RAPPORT DES COMMISSAIRES AUX COMPTES SUR LES ETATS\nPrêts et créances sur la clientèle, au coût amorti 14.251.253 8.806.412\nEXERCICE\nDF UIN 1A ERN JC AIE NR VS\nIE\nC RO AN US 3O 1L DID EE CS\nEMBRE 2023\nEcart de réévaluation actif des portefeuilles couverts en taux\nPlacements des activités d'assurance Opinion\nActifs d'impôt exigible 188.452 150.890 Nous avons effectué l’audit des états financiers consolidés ci-joints de CFG Bank et de ses filiales (Groupe CFG Bank), qui comprennent\nl’état consolidé de la situation financière au 31 décembre 2023, ainsi que l’état consolidé du résultat global, l’état consolidé des variations\nActifs d'impôt différé 154.344 148.306 des capitaux propres et le tableau consolidé des flux de trésorerie pour l’exercice clos à cette date, ainsi que les notes annexes, y compris un\nComptes de régularisation et autres actifs 1.095.272 657.006 résumé des principales méthodes comptables. Ces états financiers consolidés font ressortir un montant de capitaux propres consolidés de\nActifs non courants destinés à être cédés - - KMAD 1.688.165 dont un bénéfice net consolidé de KMAD 177.568.\nParticipations dans des entreprises mises en équivalence Nous certifions que les états financiers consolidés cités au premier paragraphe ci-dessus sont réguliers et sincères et donnent, dans tous leurs aspects\nImmeubles de placement significatifs, une image fidèle de la situation financière consolidée du groupe au 31 décembre 2023, ainsi que de sa performance financière consolidée\nImmobilisations corporelles 758.428 579.516 et de ses flux de trésorerie consolidés pour l’exercice clos à cette date, conformément aux Normes Internationales d’Information Financière (IFRS).\nImmobilisations incorporelles 275.009 225.988 Fondement de l’opinion\nEcarts d'acquisition 124.142 124.142\nTotal ACTIF 22.134.222 15.372.070 Nous avons effectué notre audit selon les Normes de la Profession au Maroc. Les responsabilités qui nous incombent en vertu de ces normes\nsont plus amplement décrites dans la section « Responsabilités de l’auditeur à l’égard de l’audit des états financiers consolidés » du présent\nrapport. Nous sommes indépendants du groupe conformément aux règles de déontologie qui s’appliquent à l’audit des états financiers\nPASSIF 31/12/2023 31/12/2022 consolidés au Maroc et nous nous sommes acquittés des autres responsabilités déontologiques qui nous incombent selon ces règles. Nous\nestimons que les éléments probants que nous avons obtenus sont suffisants et appropriés pour fonder notre opinion d’audit.\nBanques centrales, Trésor public, CCP\nPassifs financiers à la juste valeur par résultat Questions clés de l’audit\nPassifs financiers détenus à des fins de transaction\nLes questions clés de l’audit sont les questions qui, selon notre jugement professionnel, ont été les plus importantes dans l’audit des états\nPassifs financiers à la juste valeur par résultat sur option financiers consolidés de la période considérée. Ces questions ont été traitées dans le contexte de notre audit des états financiers consolidés pris\nInstruments dérivés de couverture dans leur ensemble et aux fins de la formation de notre opinion sur ceux-ci, et nous n’exprimons pas une opinion distincte sur ces questions.\nDettes envers les établissements de crédit et assimilés 5.312.223 2.865.367\nRisque de crédit et dépréciations sur les portefeuilles de prêts à la clientèle\nDettes envers la clientèle 8.647.054 8.032.909\nRisque identifié Notre réponse d’audit\nTitres de créance émis 4.825.859 2.398.945 Les prêts et créances à la clientèle sont porteurs d’un risque de crédit qui expose Nous avons concentré nos travaux sur les encours et\nEcart de réévaluation passif des portefeuilles couverts en taux le groupe à une perte potentielle si les clients ou les contreparties s’avèrent portefeuilles de prêts à la clientèle les plus significatifs\nPassifs d'impôt exigible 71.120 87.745 i dn éc pa rp éa cb iale tis o nd se dfa ei sre ti nfa éc ee s à à le cou urs v re irn g ca eg re ism qe un et .s financiers. Le groupe constitue des e et n trn eo pt ra ism esm e pn rt éss eu nr t anle t s df ein sa n rc ise qm ue en st s spa éc cc io fir qd ué es s .aux\nPassifs d'impôt différé 63.739 68.675 Ces dépréciations sont estimées selon les dispositions de la norme IFRS 9 - Nous avons pris connaissance du dispositif de contrôle\nComptes de régularisation et autres passifs 1.121.886 641.236 Instruments financiers. interne du groupe et des contrôles, que nous avons jugé\nDettes liées aux actifs non courants destinés à être cédés - - L cl’ ié ev na tèlu lea ti ro en q ud ie es rt p l’e er xte es rc id ce e c dr ué d juit ga et mte en nd tu e ds e p lao u pr a l re t s d ep o lr ate dfe iru ei clle tios nd , e n op tr aê mts m à e nla t c cl ré és d ip t o eu t r à n lo ’étr ve a a luu ad tii ot, n r e dla et sif s p eà r tl e’a sp p ar tté ec nia dt uio en s .du risque de\nPassifs techniques des contrats d'assurance pour : Sur les aspects de dépréciation, nos travaux d’audit ont\nconsisté principalement à :\nProvisions 2.375 2.375 • déterminer les critères de classification des encours selon qu’ils sont sains • examiner le dispositif de gouvernance et tester les\nSubventions et fonds assimilés (Bucket 1), dégradés (Bucket 2) ou en défaut (Bucket 3) ; contrôles clés mis en place au niveau du groupe ;\nD Cae ptt ie as tu s xu pb ro or pd ro en snées et fonds spéciaux de garantie 1. 4 60 81 8. .8 10 61 5 4 80 71 3. .5 23 85 3 • • la e é ms tat ei bm sli ue r rr d e l ee ds m e p so r on pjt eea rcn tt et io sd n e ass t tm ep nae dcrt ure o es - s éa .ct ote nn od mu ie qs u ee sn dfo on nc tt i lo en s d ime ps ad cif tf sé r se on nt te is n tB éu gc rék se t ds a; ns • p s ea o in u na r dl cy els a se s r Bs l e ue r cs k lp e er s ti sn e c 1ni p c ea o tu u 2x r s ap ua e r t 3a 1ém v dè a ét lr u ce e es r m r le bet rse e n d 2u é 0s p 2 rp 3éa c ;r i ale t ig or no su p ae u\no Capital et réserves liées 1.333.469 1.558.867 Les informations qualitatives concernant les modalités d’évaluation et de • d ’t ee ns cte or u rle s ec na lc Bu ul cd ke es ts p 1e r ete t s 2 a ;ttendues sur une sélection\no Réserves consolidées 302.052 -615.001 comptabilisation des pertes de crédit attendues sont détaillées dans la note « • tester les principales hypothèses retenues par la\nPart du groupe 291.293 -626.019 Normes et principes comptables » de l’annexe aux états financiers consolidés.direction pour l’estimation des dépréciations des encours\nAu 31 décembre 2023, le montant brut des prêts et créances sur la clientèle, en Bucket 3.\nPart des minoritaires 10.759 11.018 exposé au risque de crédit s’élève à MMAD 14.400; le montant total des Nous avons également examiné les informations\no Gains et pertes comptabilisés directement en capitaux propres -124.924 -124.924 dépréciations y afférentes s’élève à MMAD 149. présentées dans les notes de l’annexe aux états\nPart du groupe -124.924 -124.924 Nous avons considéré que l’appréciation du risque de crédit et l’évaluation des financiers consolidés relatives au risque de crédit.\ndépréciations constituent un point clé de l’audit, ces éléments faisant appel au\nPart des minoritaires jugement et aux estimations de la direction.\no Résultat net de l'exercice 177.568 54.341\nPart du groupe 166.026 43.886 Responsabilités de la direction et des responsables de la gouvernance à l’égard des états financiers consolidés\nPart des minoritaires 11.542 10.455\nLa direction est responsable de la préparation et de la présentation fidèle des états financiers consolidés conformément aux IFRS, ainsi que\nTotal PASSIF 22.134.222 15.372.070 du contrôle interne qu’elle considère comme nécessaire pour permettre la préparation d’états financiers consolidés exempts d’anomalies\nsignificatives, que celles-ci résultent de fraudes ou d’erreurs.\nCOMPTE DE RESULTAT CONSOLIDE (En milliers de DH) Lors de la préparation des états financiers consolidés, c’est à la direction qu’il incombe d’évaluer la capacité du groupe à poursuivre son exploitation,\nde communiquer, le cas échéant, les questions relatives à la continuité de l’exploitation et d’appliquer le principe comptable de continuité\nd’exploitation, sauf si la direction a l’intention de liquider le groupe ou de cesser son activité ou si aucune autre solution réaliste ne s’offre à elle.\n31/12/2023 31/12/2022\nIl incombe aux responsables de la gouvernance de surveiller le processus d’information financière du groupe.\nIntérêts, rémunérations et produits assimilés 574.933 435.713\nIntérêts, rémunérations et charges assimilés -310.201 -184.981 Responsabilités de l’auditeur à l’égard de l’audit des états financiers consolidés\nMarge d'intérêt 264.732 250.732\nNos objectifs sont d’obtenir l’assurance raisonnable que les états financiers consolidés pris dans leur ensemble sont exempts d’anomalies\nCommissions (produits) 340.539 321.607 significatives, que celles-ci résultent de fraudes ou d’erreurs et de délivrer un rapport de l’auditeur contenant notre opinion. L’assurance\nCommissions (charges) -78.103 -71.092 raisonnable correspond à un niveau élevé d’assurance, qui ne garantit toutefois pas qu’un audit réalisé conformément aux normes de la\nMarges sur commissions 262.436 250.515 profession au Maroc permettra toujours de détecter toute anomalie significative qui pourrait exister. Les anomalies peuvent résulter de fraudes\nou d’erreurs et elles sont considérées comme significatives lorsqu’il est raisonnable de s’attendre à ce que, individuellement ou collectivement,\nGains ou pertes nets résultants des couvertures de position nette elles puissent influer sur les décisions économiques que les utilisateurs des états financiers consolidés prennent en se fondant sur ceux-ci.\nGains ou pertes nets sur instruments financiers à la juste valeur par résultat 75.770 -32.822\nGains ou pertes nets sur actifs/passifs de transaction 75.633 -32.840 Dans le cadre d’un audit réalisé conformément aux normes de la profession au Maroc, nous exerçons notre jugement professionnel et faisons preuve\nGains ou pertes nets sur autres actifs/passifs à la juste valeur par résultat 137 18 d’esprit critique tout au long de cet audit. En outre :\n• nous identifions et évaluons les risques que les états financiers consolidés comportent des anomalies significatives, que celles-ci résultent de\nGains ou pertes nets des instruments financiers à la juste valeur par capitaux fraudes ou d’erreurs, concevons et mettons en œuvre des procédures d’audit en réponse à ces risques et réunissons des éléments probants\npropres suffisants et appropriés pour fonder notre opinion. Le risque de non-détection d’une anomalie significative résultant d’une fraude est plus élevé\nGains ou pertes nets sur instruments de dettes comptabilisés en capitaux que celui d’une anomalie significative résultant d’une erreur, car la fraude peut impliquer la collusion, la falsification, les omissions volontaires, les\npropres recyclables fausses déclarations ou le contournement du contrôle interne ;\nRémunération des instruments de capitaux propres comptabilisés en capi-\ntaux propres non recyclables (dividendes) • nous acquérons une compréhension des éléments du contrôle interne pertinents pour l’audit afin de concevoir des procédures d’audit\nappropriées aux circonstances, et non dans le but d’exprimer une opinion sur l’efficacité du contrôle interne du groupe ;\nGains ou pertes nets sur actifs financiers disponibles à la vente\nGains ou pertes nets résultant de la décomptabilisation d'actifs financiers au coût • nous apprécions le caractère approprié des méthodes comptables retenues et le caractère raisonnable des estimations comptables faites\namort par la direction, de même que des informations y afférentes fournies par cette dernière ;\nGains ou pertes nets résultant du reclassement d'actifs financiers au coût amorti\nen actifs financiers à la juste valeur par résultat • nous tirons conclusion quant au caractère approprié de l’utilisation par la direction du principe comptable de continuité d’exploitation et, selon les\néléments probants obtenus, quant à l’existence ou non d’une incertitude significative liée à des événements ou situations susceptibles de jeter\nGains ou pertes nets résultant du reclassement d'actifs financiers à la juste un doute important sur la capacité du groupe à poursuivre son exploitation. Si nous concluons à l’existence d’une incertitude significative, nous\nvaleur par capitaux propres en actifs financiers à la juste valeur par résultat sommes tenus d’attirer l’attention des lecteurs de notre rapport sur les informations fournies dans les états financiers au sujet de cette incertitude\nProduits nets des activités d'assurance ou, si ces informations ne sont pas adéquates, d’exprimer une opinion modifiée. Nos conclusions s’appuient sur les éléments probants obtenus\nProduits des autres activités 58.056 32.552 jusqu’à la date de notre rapport. Des événements ou situations futurs pourraient par ailleurs amener le groupe à cesser son exploitation ;\nCharges des autres activités -3.600 -583 • nous évaluons la présentation d’ensemble, la structure et le contenu des états financiers consolidés, y compris les informations fournies\nProduit net bancaire 657.394 500.394 dans les notes, et apprécions si les états financiers consolidés représentent les opérations et événements sous-jacents d’une manière\nCharges générales d'exploitation -377.578 -331.558 propre à donner une image fidèle ;\nDotations aux amortissements et aux dépréciations des immobilisations corpo- -56.132 -55.094 • nous obtenons des éléments probants suffisants et appropriés concernant l’information financière des entités et activités du groupe pour\nrelles et incorporelles exprimer une opinion sur les états financiers consolidés. Nous sommes responsables de la direction, de la supervision et de la réalisation\nRésultat Brut d'exploitation 223.684 113.742 de l’audit du groupe. Nous assumons l’entière responsabilité de l’opinion d’audit.\nCoût du risque -24.859 -30.984\nNous communiquons aux responsables de la gouvernance notamment l’étendue et le calendrier prévus des travaux d’audit et nos\nRésultat d'exploitation 198.825 82.758 constatations importantes, y compris toute déficience importante du contrôle interne que nous aurions relevée au cours de notre audit.\nQuote-part du résultat net des entreprises associées et des coentreprises mises en\néquivalence\nGains ou pertes nets sur autres actifs -4.575 -2.937 Casablanca, le 24 avril 2024\nVariation de valeur des écarts d'acquisition Les Commissaires aux Comptes\nRésultat avant impôt 194.250 79.821\nImpôt sur les résultats -16.682 -25.480\nRésultat net d'impôt des activités arrêtés ou en cours de cession\nRésultat net 177.568 54.341\nIntérêts minoritaires 11.542 10.455\nRésultat net part du groupe 166.026 43.886\n31/12/2023 31/12/2022\nRésultat par action 5.07 1.90\nRésultat dilué par action 5.07 1.90\nLe résultat par action au 31/12/2022 est calculé sur la même base que 2023 après split de nominal.\nCOMPTES SOCIAUX DE CFG BANK S.A.\nAU 31 DÉCEMBRE 2023\nBILAN (En milliers de DH) RAPPORT DES COMMAISSAIRES AUX COMPTES\nSUR LES COMPTES SOCIAUX\nACTIF 31/12/2023 31/12/2022\nValeurs en caisse Banques centrales, Trésor public, Service des chèques postaux 404.999 593.632\n. Banques centrales, Trésor public, Service des chèques postaux 217.532 470.044\n. Valeurs en caisse 187.467 123.588\nCréances sur les établissements de crédit et assimilés : 674.223 312.585\n. A vue 423.429 159.155\n. A terme 250.794 153.430 7, Boulevard Driss Slaoui 4, Rue Maati Jazouli (Ex-Rue FRIOL)\nCréances sur la clientèle 13.124.770 8.075.225 C Ma as roa cblanca A Mn af ra o- c Casablanca\n. Crédits de trésorerie et à la consommation 1.167.483 4.575.596\n. Crédits à l'équipement 5.774.219 - Aux Actionnaires de\n. Crédits immobiliers 3.767.623 3.290.381 CFG Bank S.A.\n5/7, rue Ibnou Toufail\n. Autres crédits 2.415.445 209.248 Casablanca\nCréances acquises par affacturage - -\nTitres de transaction et de placement 3.429.734 3.005.301 RAP EP XO ER RT C IG CE EN DE UR A 1EL R D JAES N VC IO ERM M AUIS 3S 1A DIR EE CS E A MU BX R C EO 2M 02P 3TES\n. Bons du Trésor et valeurs assimilées 2.801.813 2.752.025\n. Autres titres de créance 251.511 66.614 Audit des états de synthèse\n. Titres de propriété 376.410 186.662\nOpinion\nAutres actifs 454.417 273.127 Conformément à la mission qui nous a été confiée par votre Assemblée Générale ordinaire, nous avons effectué l’audit des états de synthèse\nTitres d'investissement 677.026 682.432 ci-joints de CFG Bank S.A., qui comprennent le bilan au 31 décembre 2023, le compte de produits et charges, l’état des soldes de gestion, le\ntableau de flux de trésorerie pour l’exercice clos à cette date ainsi que l’état des informations complémentaire (ETIC). Ces états de synthèse\n. Bons du Trésor et valeurs assimilées font ressortir un montant de capitaux propres et assimilés de KMAD 2.048.481 compte tenu d’un bénéfice net de KMAD 104.712.\n. Autres titres de créance 677.026 682.432\nTitres de participation et emplois assimilés 314.901 307.835 Nous certifions que les états de synthèse cités au premier paragraphe ci-dessus sont réguliers et sincères et donnent, dans tous leurs aspects\nsignificatifs, une image fidèle du résultat des opérations de l’exercice écoulé ainsi que de la situation financière et du patrimoine de CFG Bank\nTitres mis en équivalence - - S.A. au 31 décembre 2023 conformément au référentiel comptable en vigueur au Maroc.\n. Entreprises à caractère financier\n. Autres entreprises Fondement de l’opinion\nCréances subordonnées Nous avons effectué notre audit selon les Normes de la Profession au Maroc. Les responsabilités qui nous incombent en vertu de ces normes\nImmobilisations données en crédit-bail et en location 1.403.654 1.101.420 sont plus amplement décrites dans la section « Responsabilités de l’auditeur à l’égard de l’audit des états de synthèse » du présent rapport.\nNous sommes indépendants de la banque conformément aux règles de déontologie qui s’appliquent à l’audit des états de synthèse au Maroc\nImmobilisations incorporelles 446.927 398.511 et nous nous sommes acquittés des autres responsabilités déontologiques qui nous incombent selon ces règles. Nous estimons que les\nImmobilisations corporelles 482.059 307.020 éléments probants que nous avons obtenus sont suffisants et appropriés pour fonder notre opinion d’audit.\nTOTAL DE L'ACTIF 21.412.711 15.057.087 Questions clés de l’audit\nPASSIF 31/12/2023 31/12/2022 Les questions clés de l’audit sont les questions qui, selon notre jugement professionnel, ont été les plus importantes dans l’audit des états\nde synthèse de la période considérée. Ces questions ont été traitées dans le contexte de notre audit des états de synthèse pris dans leur\nBanques centrales, Trésor public, Service des chèques postaux - - ensemble et aux fins de la formation de notre opinion sur ceux-ci, et nous n’exprimons pas une opinion distincte sur ces questions.\nDettes envers les établissements de crédit et assimilés 5.292.243 2.852.634\n. A vue 470.157 - Evaluation du risque de crédit sur les crédits à la clientèle\n. A terme 4.822.086 2.852.634 Risque identifié Notre réponse d’audit\nLes crédits à la clientèle sont porteurs d’un risque de crédit qui expose la banque à une Nous avons pris connaissance du dispositif de\nDépôts de la clientèle 8.596.885 8.072.277 perte potentielle si les clients ou les contreparties s’avèrent incapables de faire face à leurs contrôle interne de la banque et des contrôles\n. Comptes à vue créditeurs 6.405.715 5.828.076 engagements financiers. clés relatifs à la classification des créances et à\nl’évaluation des provisions y afférentes.\n. Comptes d'épargne 858.614 783.517 Des provisions destinées à couvrir ce risque sont constitués par la banque. Ces dernières\n. Dépôts à terme 1.237.554 1.429.925 sont calculées en application des dispositions de la circulaire 19/G/2002 de Bank Al Maghrib Nos travaux d’audit ont principalement consisté à :\n. Autres comptes créditeurs 95.001 30.759 relative à la classification des créances et à leur couverture par les provisions, des règles • étudier la conformité au Plan Comptable des\nde la banque centrale relatives au provisionnement des créances sensibles ainsi que des Etablissements de Crédit (PCEC) et notamment\nTitres de créances émis 4.825.861 2.398.945 politiques internes fixées par le Management de la banque. à la circulaire 19/G/2002 de Bank Al Maghrib des\n. Titres de créance négociable émis 4.825.861 2.398.945 principes mis en œuvre par la banque ;\nL’évaluation des provisions en couverture des créances sur la clientèle requiert : • examiner le dispositif de gouvernance et tester\n. Emprunts obligataires émis • l’identification des créances en souffrance et des créances sensibles ; les contrôles clés mis en place au niveau de la\n. Autres titres de créance émis • l’évaluation du montant des provisions en fonction des différentes catégories de banque ;\nclassification des créances et des garanties dont dispose la banque. • tester par sondage la correcte classification des\nAutres passifs 617.411 410.541 créances dans les catégories appropriées ;\nProvisions pour risques et charges 31.831 32.257 Au 31 décembre 2023, le montant des créances envers la clientèle s’élève à MMAD 13.251 • tester l’évaluation des provisions sur une\ncomprenant des provisions pour dépréciation des créances en souffrance de MMAD 126.1. sélection de créances sensibles et en souffrance.\nProvisions réglementées\nSubventions, fonds publics affectés et fonds spéciaux de garantie Nous avons considéré que l’appréciation du risque de crédit relatif aux créances sur la clientèle\nDettes subordonnées 401.801 401.535 e ét t al n’é t v da elu mat oio nn ta d ne tss sp igro nv ifi is ci ao tn ifs s ey t a faff ié sare nn t t ae ps pc eo l n as ut it juu ge en mt u en n t p eo t in at u xc l eé s d time al’ ta iou nd sit , d c ee ls a é dl ié rem ce tion nts .\nEcarts de réévaluation\nRéserves et primes liées au capital 633.310 986.991 Responsabilités de la direction et des responsables de la gouvernance à l’égard des états de synthèse\nCapital 700.159 571.876\nLa direction est responsable de la préparation et de la présentation fidèle de états de synthèse, conformément au référentiel comptable\nActionnaires. Capital non versé (-) en vigueur au Maroc, ainsi que du contrôle interne qu’elle considère comme nécessaire pour permettre la préparation d’états de synthèse\nReport à nouveau (+/-) 208.499 -647.011 exempts d’anomalies significatives, que celles-ci résultent de fraudes ou d’erreurs.\nRésultats nets en instance d'affectation (+/-) Lors de la préparation des états de synthèse, c’est à la direction qu’il incombe d’évaluer la capacité de la banque à poursuivre son exploitation,\nRésultat net (+/-) 104.712 -22.958 de communiquer, le cas échéant, les questions se rapportant à la continuité de l’exploitation et d’appliquer le principe comptable de continuité\nd’exploitation, sauf si la direction a l’intention de liquider la banque ou de cesser son activité ou si aucune autre solution réaliste ne s’offre à elle.\nTOTAL DU PASSIF 21.412.711 15.057.087\nIl incombe aux responsables de la gouvernance de surveiller le processus d’information financière de la banque.\nCOMPTE DE PRODUITS ET CHARGES (En milliers de DH) Responsabilités de l’auditeur à l’égard de l’audit des états de synthèse\n31/12/2023 31/12/2022 Nos objectifs sont d’obtenir l’assurance raisonnable que les états de synthèse pris dans leur ensemble sont exempts d’anomalies significatives,\nque celles-ci résultent de fraudes ou d’erreurs et de délivrer un rapport de l’auditeur contenant notre opinion. L’assurance raisonnable\nPRODUITS D'EXPLOITATION BANCAIRE 1.051.304 780.874 correspond à un niveau élevé d’assurance, qui ne garantit toutefois pas qu’un audit réalisé conformément aux normes de la profession au\nIntérêts et produits assimilés sur opérations avec les établissements de crédit 18.829 1.665 Maroc permettra toujours de détecter toute anomalie significative qui pourrait exister. Les anomalies peuvent résulter de fraudes ou d’erreurs et\nelles sont considérées comme significatives lorsqu’il est raisonnable de s’attendre à ce que, individuellement ou collectivement, elles puissent\nIntérêts et produits assimilés sur opérations avec la clientèle 425.224 313.988 influer sur les décisions économiques que les utilisateurs des états de synthèse prennent en se fondant sur ceux-ci.\nIntérêts et produits assimilés sur titres de créance 86.455 96.409\nProduits sur titres de propriété 35.296 27.532 Dans le cadre d’un audit réalisé conformément aux normes de la profession au Maroc, nous exerçons notre jugement professionnel et\nfaisons preuve d’esprit critique tout au long de cet audit. En outre :\nProduits sur opérations de crédit-bail et de location 147.984 90.977 • nous identifions et évaluons les risques que les états de synthèse comportent des anomalies significatives, que celles-ci résultent de fraudes\nCommissions sur prestations de service 109.377 101.509 ou d’erreurs, concevons et mettons en œuvre des procédures d’audit en réponse à ces risques, et réunissons des éléments probants suffisants\nAutres produits bancaires 228.138 148.794 et appropriés pour fonder notre opinion. Le risque de non-détection d’une anomalie significative résultant d’une fraude est plus élevé que celui\nd’une anomalie significative résultant d’une erreur, car la fraude peut impliquer la collusion, la falsification, les omissions volontaires, les fausses\nCHARGES D'EXPLOITATION BANCAIRE 556.854 447.847 déclarations ou le contournement du contrôle interne ;\nIntérêts et charges assimilées sur opérations avec les établissements de crédit 94.586 36.301\nIntérêts et charges assimilées sur opérations avec la clientèle 59.176 54.745 • nous acquérons une compréhension des éléments du contrôle interne pertinents pour l’audit afin de concevoir des procédures d’audit appropriées\naux circonstances, et non dans le but d’exprimer une opinion sur l’efficacité du contrôle interne de la banque ;\nIntérêts et charges assimilées sur titres de créance émis 155.346 92.531\nCharges sur opérations de crédit-bail et de location 99.904 72.643 • nous apprécions le caractère approprié des méthodes comptables retenues et le caractère raisonnable des estimations comptables faites par la\nAutres charges bancaires 147.842 191.628 direction, de même que des informations y afférentes fournies par cette dernière ;\nPRODUIT NET BANCAIRE 494.450 333.026 • nous tirons une conclusion quant au caractère approprié de l’utilisation par la direction du principe comptable de continuité d’exploitation et, selon\nProduits d'exploitation non bancaire 477 1.489 les éléments probants obtenus, quant à l’existence ou non d’une incertitude significative liée à des événements ou situations susceptibles de jeter\nun doute important sur la capacité de la banque à poursuivre son exploitation. Si nous concluons à l’existence d’une incertitude significative, nous\nCharges d'exploitation non bancaire 164 847 sommes tenus d’attirer l’attention des lecteurs de notre rapport sur les informations fournies dans les états de synthèse au sujet de cette incertitude\nCHARGES GENERALES D'EXPLOITATION 347.245 323.133 ou, si ces informations ne sont pas adéquates, d’exprimer une opinion modifiée. Nos conclusions s’appuient sur les éléments probants obtenus\nCharges de personnel 172.552 152.084 jusqu’à la date de notre rapport. Des événements ou situations futurs pourraient par ailleurs amener la banque à cesser son exploitation ;\nImpôts et taxes 4.610 3.817 • nous évaluons la présentation d’ensemble, la structure et le contenu des états de synthèse, y compris les informations fournies dans l’ETIC, et\nCharges externes 85.263 77.669 apprécions si les états de synthèse représentent les opérations et événements sous-jacents d’une manière propre à donner une image fidèle.\nAutres charges générales d'exploitation 45.026 51.695\nNous communiquons aux responsables de la gouvernance notamment l’étendue et le calendrier prévus des travaux d’audit et nos constatations\nDotations aux amortissements et aux provisions des immobilisations incorporelles 39.793 37.868 importantes, y compris toute déficience importante du contrôle interne que nous aurions relevée au cours de notre audit.\net corporelles\nDotations aux amortissements sur écarts d'acquisition Vérifications et informations spécifiques\nReprises sur écarts d'acquisition\nNous avons procédé également aux vérifications spécifiques prévues par la loi et nous nous sommes assurés notamment de la sincérité et\nDOTATIONS AUX PROVISIONS ET PERTES SUR CREANCES IRRECOUVRABLES 97.518 48.310 de la concordance, des informations données dans le rapport de gestion du Conseil d’Administration destiné aux actionnaires avec les états\nDotations aux provisions pour créances et engagements par signature en souffrance 93.162 43.767 de synthèse de la banque.\nPertes sur créances irrécouvrables 338 593\nCasablanca, le 24 avril 2024\nAutres dotations aux provisions 4.019 3.950\nREPRISES DE PROVISIONS ET RECUPERATIONS SUR CREANCES AMORTIES 57.795 19.040 Les Commissaires aux Comptes\nReprises de provisions pour créances et engagements par signature en souffrance 47.172 7.194\nRécupérations sur créances amorties 12 16\nAutres reprises de provisions 10.611 11.830\nRESULTAT COURANT 107.794 -18.734\nProduits non courants 840 957\nCharges non courantes 1.359 2.087\nRESULTAT AVANT IMPOTS 107.275 -19.863\nImpôts sur les résultats 2.563 3.095\nRESULTAT NET DE l'EXERCICE 104.712 -22.958\nLes états annexes aux états de synthèse annuels individuels et consolidés ont déjà été publiés en date du 28 février 2024 et n’ont subi aucune modification.\nLien rapport financier : https://www.cfgbank.com/particuliers/cfg-bank-et-moi/communication-financiere/",
    "tables": [
        [
            {
                "ACTIF": "",
                "31/12/2023": "405.210",
                "31/12/2022": ""
            },
            {
                "ACTIF": "",
                "31/12/2023": "3.472.376",
                "31/12/2022": ""
            },
            {
                "ACTIF": "",
                "31/12/2023": "3.472.376",
                "31/12/2022": ""
            },
            {
                "ACTIF": "",
                "31/12/2023": "",
                "31/12/2022": ""
            },
            {
                "ACTIF": "",
                "31/12/2023": "-",
                "31/12/2022": ""
            },
            {
                "ACTIF": "",
                "31/12/2023": "42.096",
                "31/12/2022": ""
            },
            {
                "ACTIF": "",
                "31/12/2023": "",
                "31/12/2022": ""
            },
            {
                "ACTIF": "",
                "31/12/2023": "42.096",
                "31/12/2022": ""
            },
            {
                "ACTIF": "",
                "31/12/2023": "677.026",
                "31/12/2022": ""
            },
            {
                "ACTIF": "",
                "31/12/2023": "690.614",
                "31/12/2022": ""
            },
            {
                "ACTIF": "",
                "31/12/2023": "14.251.253",
                "31/12/2022": ""
            },
            {
                "ACTIF": "",
                "31/12/2023": "",
                "31/12/2022": ""
            },
            {
                "ACTIF": "",
                "31/12/2023": "",
                "31/12/2022": ""
            },
            {
                "ACTIF": "",
                "31/12/2023": "188.452",
                "31/12/2022": ""
            },
            {
                "ACTIF": "",
                "31/12/2023": "154.344",
                "31/12/2022": ""
            },
            {
                "ACTIF": "",
                "31/12/2023": "1.095.272",
                "31/12/2022": ""
            },
            {
                "ACTIF": "",
                "31/12/2023": "-",
                "31/12/2022": ""
            },
            {
                "ACTIF": "",
                "31/12/2023": "",
                "31/12/2022": ""
            },
            {
                "ACTIF": "",
                "31/12/2023": "",
                "31/12/2022": ""
            },
            {
                "ACTIF": "",
                "31/12/2023": "758.428",
                "31/12/2022": ""
            },
            {
                "ACTIF": "",
                "31/12/2023": "275.009",
                "31/12/2022": ""
            },
            {
                "ACTIF": "",
                "31/12/2023": "124.142",
                "31/12/2022": ""
            },
            {
                "ACTIF": "Total ACTIF",
                "31/12/2023": "22.134.222",
                "31/12/2022": "15.372.070"
            }
        ],
        [
            {
                "PASSIF": "",
                "31/12/2023": "",
                "31/12/2022": ""
            },
            {
                "PASSIF": "",
                "31/12/2023": "",
                "31/12/2022": ""
            },
            {
                "PASSIF": "",
                "31/12/2023": "",
                "31/12/2022": ""
            },
            {
                "PASSIF": "",
                "31/12/2023": "",
                "31/12/2022": ""
            },
            {
                "PASSIF": "",
                "31/12/2023": "",
                "31/12/2022": ""
            },
            {
                "PASSIF": "",
                "31/12/2023": "5.312.223",
                "31/12/2022": ""
            },
            {
                "PASSIF": "",
                "31/12/2023": "8.647.054",
                "31/12/2022": ""
            },
            {
                "PASSIF": "",
                "31/12/2023": "4.825.859",
                "31/12/2022": ""
            },
            {
                "PASSIF": "",
                "31/12/2023": "",
                "31/12/2022": ""
            },
            {
                "PASSIF": "",
                "31/12/2023": "71.120",
                "31/12/2022": ""
            },
            {
                "PASSIF": "",
                "31/12/2023": "63.739",
                "31/12/2022": ""
            },
            {
                "PASSIF": "",
                "31/12/2023": "1.121.886",
                "31/12/2022": ""
            },
            {
                "PASSIF": "",
                "31/12/2023": "-",
                "31/12/2022": ""
            },
            {
                "PASSIF": "",
                "31/12/2023": "",
                "31/12/2022": ""
            },
            {
                "PASSIF": "",
                "31/12/2023": "2.375",
                "31/12/2022": ""
            },
            {
                "PASSIF": "",
                "31/12/2023": "",
                "31/12/2022": ""
            },
            {
                "PASSIF": "",
                "31/12/2023": "401.801",
                "31/12/2022": ""
            },
            {
                "PASSIF": "",
                "31/12/2023": "1.688.165",
                "31/12/2022": ""
            },
            {
                "PASSIF": "",
                "31/12/2023": "1.333.469",
                "31/12/2022": ""
            },
            {
                "PASSIF": "",
                "31/12/2023": "302.052",
                "31/12/2022": ""
            },
            {
                "PASSIF": "",
                "31/12/2023": "291.293",
                "31/12/2022": ""
            },
            {
                "PASSIF": "",
                "31/12/2023": "10.759",
                "31/12/2022": ""
            },
            {
                "PASSIF": "",
                "31/12/2023": "-124.924",
                "31/12/2022": ""
            },
            {
                "PASSIF": "",
                "31/12/2023": "-124.924",
                "31/12/2022": ""
            },
            {
                "PASSIF": "",
                "31/12/2023": "",
                "31/12/2022": ""
            },
            {
                "PASSIF": "",
                "31/12/2023": "177.568",
                "31/12/2022": ""
            },
            {
                "PASSIF": "",
                "31/12/2023": "166.026",
                "31/12/2022": ""
            },
            {
                "PASSIF": "",
                "31/12/2023": "11.542",
                "31/12/2022": ""
            },
            {
                "PASSIF": "Total PASSIF",
                "31/12/2023": "22.134.222",
                "31/12/2022": "15.372.070"
            }
        ],
        [
            {
                "Risque de crédit et dépréciations sur les portefeuilles de prêts à la clientèle": "Risque identifié",
                "null": "Notre réponse d’audit"
            },
            {
                "Risque de crédit et dépréciations sur les portefeuilles de prêts à la clientèle": "Les prêts et créances à la clientèle sont porteurs d’un risque de crédit qui expose\nle groupe à une perte potentielle si les clients ou les contreparties s’avèrent\nincapables de faire face à leurs engagements financiers. Le groupe constitue des\ndépréciations destinées à couvrir ce risque.\nCes dépréciations sont estimées selon les dispositions de la norme IFRS 9 -\nInstruments financiers.\nL’évaluation des pertes de crédit attendues pour les portefeuilles de prêts à la\nclientèle requiert l’exercice du jugement de la part de la direction, notamment\npour :\n• déterminer les critères de classification des encours selon qu’ils sont sains\n(Bucket 1), dégradés (Bucket 2) ou en défaut (Bucket 3) ;\n• estimer le montant des pertes attendues en fonction des différentes Buckets ;\n• établir des projections macro-économiques dont les impacts sont intégrés dans\nla mesure des pertes attendues.\nLes informations qualitatives concernant les modalités d’évaluation et de\ncomptabilisation des pertes de crédit attendues sont détaillées dans la note «\nNormes et principes comptables » de l’annexe aux états financiers consolidés.\nAu 31 décembre 2023, le montant brut des prêts et créances sur la clientèle,\nexposé au risque de crédit s’élève à MMAD 14.400; le montant total des\ndépréciations y afférentes s’élève à MMAD 149.\nNous avons considéré que l’appréciation du risque de crédit et l’évaluation des\ndépréciations constituent un point clé de l’audit, ces éléments faisant appel au\njugement et aux estimations de la direction.",
                "null": "Nous avons concentré nos travaux sur les encours et\nportefeuilles de prêts à la clientèle les plus significatifs\net notamment sur les financements accordés aux\nentreprises présentant des risques spécifiques.\nNous avons pris connaissance du dispositif de contrôle\ninterne du groupe et des contrôles, que nous avons jugé\nclés pour notre audit, relatifs à l’appréciation du risque de\ncrédit et à l’évaluation des pertes attendues.\nSur les aspects de dépréciation, nos travaux d’audit ont\nconsisté principalement à :\n• examiner le dispositif de gouvernance et tester les\ncontrôles clés mis en place au niveau du groupe ;\n• analyser les principaux paramètres retenus par le groupe\npour classer les encours et évaluer les dépréciations au\nsein des Buckets 1 et 2 au 31 décembre 2023 ;\n• tester le calcul des pertes attendues sur une sélection\nd’encours en Buckets 1 et 2 ;\n• tester les principales hypothèses retenues par la\ndirection pour l’estimation des dépréciations des encours\nen Bucket 3.\nNous avons également examiné les informations\nprésentées dans les notes de l’annexe aux états\nfinanciers consolidés relatives au risque de crédit."
            }
        ],
        [
            {
                "": "",
                "31/12/2023": "574.933",
                "31/12/2022": ""
            },
            {
                "": "",
                "31/12/2023": "-310.201",
                "31/12/2022": ""
            },
            {
                "": "",
                "31/12/2023": "264.732",
                "31/12/2022": ""
            },
            {
                "": "",
                "31/12/2023": "340.539",
                "31/12/2022": ""
            },
            {
                "": "",
                "31/12/2023": "-78.103",
                "31/12/2022": ""
            },
            {
                "": "",
                "31/12/2023": "262.436",
                "31/12/2022": ""
            },
            {
                "": "",
                "31/12/2023": "",
                "31/12/2022": ""
            },
            {
                "": "",
                "31/12/2023": "75.770",
                "31/12/2022": ""
            },
            {
                "": "",
                "31/12/2023": "75.633",
                "31/12/2022": ""
            },
            {
                "": "",
                "31/12/2023": "137",
                "31/12/2022": ""
            },
            {
                "": "",
                "31/12/2023": "",
                "31/12/2022": ""
            },
            {
                "": "",
                "31/12/2023": "",
                "31/12/2022": ""
            },
            {
                "": "",
                "31/12/2023": "",
                "31/12/2022": ""
            },
            {
                "": "",
                "31/12/2023": "",
                "31/12/2022": ""
            },
            {
                "": "",
                "31/12/2023": "",
                "31/12/2022": ""
            },
            {
                "": "",
                "31/12/2023": "",
                "31/12/2022": ""
            },
            {
                "": "",
                "31/12/2023": "",
                "31/12/2022": ""
            },
            {
                "": "",
                "31/12/2023": "",
                "31/12/2022": ""
            },
            {
                "": "",
                "31/12/2023": "58.056",
                "31/12/2022": ""
            },
            {
                "": "",
                "31/12/2023": "-3.600",
                "31/12/2022": ""
            },
            {
                "": "",
                "31/12/2023": "657.394",
                "31/12/2022": ""
            },
            {
                "": "",
                "31/12/2023": "-377.578",
                "31/12/2022": ""
            },
            {
                "": "",
                "31/12/2023": "-56.132",
                "31/12/2022": ""
            },
            {
                "": "",
                "31/12/2023": "223.684",
                "31/12/2022": ""
            },
            {
                "": "",
                "31/12/2023": "-24.859",
                "31/12/2022": ""
            },
            {
                "": "",
                "31/12/2023": "198.825",
                "31/12/2022": ""
            },
            {
                "": "",
                "31/12/2023": "",
                "31/12/2022": ""
            },
            {
                "": "",
                "31/12/2023": "-4.575",
                "31/12/2022": ""
            },
            {
                "": "",
                "31/12/2023": "",
                "31/12/2022": ""
            },
            {
                "": "",
                "31/12/2023": "194.250",
                "31/12/2022": ""
            },
            {
                "": "",
                "31/12/2023": "-16.682",
                "31/12/2022": ""
            },
            {
                "": "",
                "31/12/2023": "",
                "31/12/2022": ""
            },
            {
                "": "",
                "31/12/2023": "177.568",
                "31/12/2022": ""
            },
            {
                "": "",
                "31/12/2023": "11.542",
                "31/12/2022": ""
            },
            {
                "": "Résultat net part du groupe",
                "31/12/2023": "166.026",
                "31/12/2022": "43.886"
            }
        ],
        [
            {
                "": "",
                "31/12/2023": "5.0",
                "31/12/2022": ""
            },
            {
                "": "",
                "31/12/2023": "5.0",
                "31/12/2022": ""
            }
        ],
        [
            {
                "ACTIF": "",
                "31/12/2023": "404.999",
                "31/12/2022": ""
            },
            {
                "ACTIF": "",
                "31/12/2023": "217.532",
                "31/12/2022": ""
            },
            {
                "ACTIF": "",
                "31/12/2023": "187.467",
                "31/12/2022": ""
            },
            {
                "ACTIF": "",
                "31/12/2023": "674.223",
                "31/12/2022": ""
            },
            {
                "ACTIF": "",
                "31/12/2023": "423.429",
                "31/12/2022": ""
            },
            {
                "ACTIF": "",
                "31/12/2023": "250.794",
                "31/12/2022": ""
            },
            {
                "ACTIF": "",
                "31/12/2023": "13.124.770",
                "31/12/2022": ""
            },
            {
                "ACTIF": "",
                "31/12/2023": "1.167.483",
                "31/12/2022": ""
            },
            {
                "ACTIF": "",
                "31/12/2023": "5.774.219",
                "31/12/2022": ""
            },
            {
                "ACTIF": "",
                "31/12/2023": "3.767.623",
                "31/12/2022": ""
            },
            {
                "ACTIF": "",
                "31/12/2023": "2.415.445",
                "31/12/2022": ""
            },
            {
                "ACTIF": "",
                "31/12/2023": "-",
                "31/12/2022": ""
            },
            {
                "ACTIF": "",
                "31/12/2023": "3.429.734",
                "31/12/2022": ""
            },
            {
                "ACTIF": "",
                "31/12/2023": "2.801.813",
                "31/12/2022": ""
            },
            {
                "ACTIF": "",
                "31/12/2023": "251.511",
                "31/12/2022": ""
            },
            {
                "ACTIF": "",
                "31/12/2023": "376.410",
                "31/12/2022": ""
            },
            {
                "ACTIF": "",
                "31/12/2023": "454.417",
                "31/12/2022": ""
            },
            {
                "ACTIF": "",
                "31/12/2023": "677.026",
                "31/12/2022": ""
            },
            {
                "ACTIF": "",
                "31/12/2023": "",
                "31/12/2022": ""
            },
            {
                "ACTIF": "",
                "31/12/2023": "677.026",
                "31/12/2022": ""
            },
            {
                "ACTIF": "",
                "31/12/2023": "314.901",
                "31/12/2022": ""
            },
            {
                "ACTIF": "",
                "31/12/2023": "-",
                "31/12/2022": ""
            },
            {
                "ACTIF": "",
                "31/12/2023": "",
                "31/12/2022": ""
            },
            {
                "ACTIF": "",
                "31/12/2023": "",
                "31/12/2022": ""
            },
            {
                "ACTIF": "",
                "31/12/2023": "",
                "31/12/2022": ""
            },
            {
                "ACTIF": "",
                "31/12/2023": "1.403.654",
                "31/12/2022": ""
            },
            {
                "ACTIF": "",
                "31/12/2023": "446.927",
                "31/12/2022": ""
            },
            {
                "ACTIF": "",
                "31/12/2023": "482.059",
                "31/12/2022": ""
            },
            {
                "ACTIF": "",
                "31/12/2023": "",
                "31/12/2022": ""
            },
            {
                "ACTIF": "TOTAL DE L'ACTIF",
                "31/12/2023": "21.412.711",
                "31/12/2022": "15.057.087"
            }
        ],
        [
            {
                "PASSIF": "",
                "31/12/2023": "-",
                "31/12/2022": ""
            },
            {
                "PASSIF": "",
                "31/12/2023": "5.292.243",
                "31/12/2022": ""
            },
            {
                "PASSIF": "",
                "31/12/2023": "470.157",
                "31/12/2022": ""
            },
            {
                "PASSIF": "",
                "31/12/2023": "4.822.086",
                "31/12/2022": ""
            },
            {
                "PASSIF": "",
                "31/12/2023": "8.596.885",
                "31/12/2022": ""
            },
            {
                "PASSIF": "",
                "31/12/2023": "6.405.715",
                "31/12/2022": ""
            },
            {
                "PASSIF": "",
                "31/12/2023": "858.614",
                "31/12/2022": ""
            },
            {
                "PASSIF": "",
                "31/12/2023": "1.237.554",
                "31/12/2022": ""
            },
            {
                "PASSIF": "",
                "31/12/2023": "95.001",
                "31/12/2022": ""
            },
            {
                "PASSIF": "",
                "31/12/2023": "4.825.861",
                "31/12/2022": ""
            },
            {
                "PASSIF": "",
                "31/12/2023": "4.825.861",
                "31/12/2022": ""
            },
            {
                "PASSIF": "",
                "31/12/2023": "",
                "31/12/2022": ""
            },
            {
                "PASSIF": "",
                "31/12/2023": "",
                "31/12/2022": ""
            },
            {
                "PASSIF": "",
                "31/12/2023": "617.411",
                "31/12/2022": ""
            },
            {
                "PASSIF": "",
                "31/12/2023": "31.831",
                "31/12/2022": ""
            },
            {
                "PASSIF": "",
                "31/12/2023": "",
                "31/12/2022": ""
            },
            {
                "PASSIF": "",
                "31/12/2023": "",
                "31/12/2022": ""
            },
            {
                "PASSIF": "",
                "31/12/2023": "401.801",
                "31/12/2022": ""
            },
            {
                "PASSIF": "",
                "31/12/2023": "",
                "31/12/2022": ""
            },
            {
                "PASSIF": "",
                "31/12/2023": "633.310",
                "31/12/2022": ""
            },
            {
                "PASSIF": "",
                "31/12/2023": "700.159",
                "31/12/2022": ""
            },
            {
                "PASSIF": "",
                "31/12/2023": "",
                "31/12/2022": ""
            },
            {
                "PASSIF": "",
                "31/12/2023": "208.499",
                "31/12/2022": ""
            },
            {
                "PASSIF": "",
                "31/12/2023": "",
                "31/12/2022": ""
            },
            {
                "PASSIF": "",
                "31/12/2023": "104.712",
                "31/12/2022": ""
            },
            {
                "PASSIF": "",
                "31/12/2023": "",
                "31/12/2022": ""
            },
            {
                "PASSIF": "TOTAL DU PASSIF",
                "31/12/2023": "21.412.711",
                "31/12/2022": "15.057.087"
            }
        ],
        [
            {
                "Evaluation du risque de crédit sur les crédits à la clientèle": "Risque identifié",
                "null": "Notre réponse d’audit"
            },
            {
                "Evaluation du risque de crédit sur les crédits à la clientèle": "Les crédits à la clientèle sont porteurs d’un risque de crédit qui expose la banque à une\nperte potentielle si les clients ou les contreparties s’avèrent incapables de faire face à leurs\nengagements financiers.\nDes provisions destinées à couvrir ce risque sont constitués par la banque. Ces dernières\nsont calculées en application des dispositions de la circulaire 19/G/2002 de Bank Al Maghrib\nrelative à la classification des créances et à leur couverture par les provisions, des règles\nde la banque centrale relatives au provisionnement des créances sensibles ainsi que des\npolitiques internes fixées par le Management de la banque.\nL’évaluation des provisions en couverture des créances sur la clientèle requiert :\n• l’identification des créances en souffrance et des créances sensibles ;\n• l’évaluation du montant des provisions en fonction des différentes catégories de\nclassification des créances et des garanties dont dispose la banque.\nAu 31 décembre 2023, le montant des créances envers la clientèle s’élève à MMAD 13.251\ncomprenant des provisions pour dépréciation des créances en souffrance de MMAD 126.1.\nNous avons considéré que l’appréciation du risque de crédit relatif aux créances sur la clientèle\net l’évaluation des provisions y afférentes constituent un point clé de l’audit, ces éléments\nétant de montants significatifs et faisant appel au jugement et aux estimations de la direction.",
                "null": "Nous avons pris connaissance du dispositif de\ncontrôle interne de la banque et des contrôles\nclés relatifs à la classification des créances et à\nl’évaluation des provisions y afférentes.\nNos travaux d’audit ont principalement consisté à :\n• étudier la conformité au Plan Comptable des\nEtablissements de Crédit (PCEC) et notamment\nà la circulaire 19/G/2002 de Bank Al Maghrib des\nprincipes mis en œuvre par la banque ;\n• examiner le dispositif de gouvernance et tester\nles contrôles clés mis en place au niveau de la\nbanque ;\n• tester par sondage la correcte classification des\ncréances dans les catégories appropriées ;\n• tester l’évaluation des provisions sur une\nsélection de créances sensibles et en souffrance."
            }
        ],
        [
            {
                "": "",
                "31/12/2023": "1.051.304",
                "31/12/2022": ""
            },
            {
                "": "",
                "31/12/2023": "18.829",
                "31/12/2022": ""
            },
            {
                "": "",
                "31/12/2023": "425.224",
                "31/12/2022": ""
            },
            {
                "": "",
                "31/12/2023": "86.455",
                "31/12/2022": ""
            },
            {
                "": "",
                "31/12/2023": "35.296",
                "31/12/2022": ""
            },
            {
                "": "",
                "31/12/2023": "147.984",
                "31/12/2022": ""
            },
            {
                "": "",
                "31/12/2023": "109.377",
                "31/12/2022": ""
            },
            {
                "": "",
                "31/12/2023": "228.138",
                "31/12/2022": ""
            },
            {
                "": "",
                "31/12/2023": "556.854",
                "31/12/2022": ""
            },
            {
                "": "",
                "31/12/2023": "94.586",
                "31/12/2022": ""
            },
            {
                "": "",
                "31/12/2023": "59.176",
                "31/12/2022": ""
            },
            {
                "": "",
                "31/12/2023": "155.346",
                "31/12/2022": ""
            },
            {
                "": "",
                "31/12/2023": "99.904",
                "31/12/2022": ""
            },
            {
                "": "",
                "31/12/2023": "147.842",
                "31/12/2022": ""
            },
            {
                "": "",
                "31/12/2023": "494.450",
                "31/12/2022": ""
            },
            {
                "": "",
                "31/12/2023": "477",
                "31/12/2022": ""
            },
            {
                "": "",
                "31/12/2023": "164",
                "31/12/2022": ""
            },
            {
                "": "",
                "31/12/2023": "347.245",
                "31/12/2022": ""
            },
            {
                "": "",
                "31/12/2023": "172.552",
                "31/12/2022": ""
            },
            {
                "": "",
                "31/12/2023": "4.610",
                "31/12/2022": ""
            },
            {
                "": "",
                "31/12/2023": "85.263",
                "31/12/2022": ""
            },
            {
                "": "",
                "31/12/2023": "45.026",
                "31/12/2022": ""
            },
            {
                "": "",
                "31/12/2023": "39.793",
                "31/12/2022": ""
            },
            {
                "": "",
                "31/12/2023": "",
                "31/12/2022": ""
            },
            {
                "": "",
                "31/12/2023": "",
                "31/12/2022": ""
            },
            {
                "": "",
                "31/12/2023": "97.518",
                "31/12/2022": ""
            },
            {
                "": "",
                "31/12/2023": "93.162",
                "31/12/2022": ""
            },
            {
                "": "",
                "31/12/2023": "338",
                "31/12/2022": ""
            },
            {
                "": "",
                "31/12/2023": "4.019",
                "31/12/2022": ""
            },
            {
                "": "",
                "31/12/2023": "57.795",
                "31/12/2022": ""
            },
            {
                "": "",
                "31/12/2023": "47.172",
                "31/12/2022": ""
            },
            {
                "": "",
                "31/12/2023": "12",
                "31/12/2022": ""
            },
            {
                "": "",
                "31/12/2023": "10.611",
                "31/12/2022": ""
            },
            {
                "": "",
                "31/12/2023": "107.794",
                "31/12/2022": ""
            },
            {
                "": "",
                "31/12/2023": "840",
                "31/12/2022": ""
            },
            {
                "": "",
                "31/12/2023": "1.359",
                "31/12/2022": ""
            },
            {
                "": "",
                "31/12/2023": "107.275",
                "31/12/2022": ""
            },
            {
                "": "",
                "31/12/2023": "2.563",
                "31/12/2022": ""
            },
            {
                "": "",
                "31/12/2023": "104.712",
                "31/12/2022": ""
            }
        ]
    ]
}