{
    "text": "INDICATEURS D’ACTIVITÉ DU 1er TRIMESTRE 2024*\nFAITS MARQUANTS DE LA PÉRIODE PERSPECTIVES\nNéant AFRIQUIA GAZ compte poursuivre sur sa lancée. Ses résultats au\nINDICATEURS SOCIAUX D’AFRIQUIA GAZ premier trimestre la confortent dans la réalisation de ses objectifs.\nTONNAGE ET CHIFFRE D’AFFAIRES INDICATEURS CONSOLIDÉS\nTonnage (en tonnes)\nCHIFFRE D’AFFAIRES CONSOLIDÉ (en millions de dirhams)\nEn Tonnes T1-2024 T1-2023 Variation en %\nEn MDH T1-2024 T1-2023 Variation en %\nTonnage 319 086 310 479 2,8 %\nC coh nif sfr oe li dd é’affaires 2 046 2 449 -16,5 %\n• T1 : correspond au 1er trimestre de l’exercice\n• T1 : correspond au 1er trimestre de l’exercice\nFruit de l’effort commercial continu, le total des quantités vendues\npar AFRIQUIA GAZ enregistre une hausse de 2,8% au 1er trimestre Au 31 mars 2024, AFRIQUIA GAZ affiche un chiffre d’affaires\n2024 par rapport à la même période de l’année précédente pour consolidé de 2 046 MDH, soit une baisse de 16,5% par rapport\ns’inscrire à 319 086 Tonnes. au premier trimestre de l’exercice précédent, sous l’effet de la\ncontraction du prix de reprise.\nChiffre d’affaires (en millions de Dirhams) :\nINVESTISSEMENTS CONSOLIDÉS (en millions de dirhams)\nEn MDH T1-2024 T1-2023 Variation en %\nEn MDH T1-2024 T1-2023 Variation en %\nChiffre d’affaires social 2 014 2 299 -12,4 %\nInvestissements 135,6 113,3 19,6 %\nLe chiffre d’affaires du 1er trimestre 2024 recule quant à lui de\nLe montant des investissements consolidés s’élève à 135,6 MDH\n12,4% pour s’afficher à 2 014 MDH. Ce retrait est imputable à la\nau 1er trimestre de l’exercice 2024, en croissance de 19,6% par\nbaisse du prix de reprise de 12,1%.\nrapport à la même période de l’année précédente.\nINVESTISSEMENTS (en millions de dirhams)\nENDETTEMENT FINANCIER NET CONSOLIDÉ\nEn MDH T1-2024 T1-2023 Variation en %\n(en millions de dirhams)\nInvestissements 122,6 100,1 22,5 %\nEn MDH Au 31/03/2024 Au 31/03/2023\nÀ fin mars 2024, les investissements s’élèvent à 122,6 MDH, en\nEndettement financier net 1 850,1 2 114,8\naugmentation de 22,5% par rapport à la même période de l’année\nÀ fin mars 2024, l’endettement financier net d’AFRIQUIA GAZ\nprécédente, portant pour l’essentiel sur l’injection de bouteilles afin\ns’établit à 1 850,1 MDH contre 2 114,8 MDH un an plus tôt.\nde répondre aux besoins du marché.\nVARIATION DE PÉRIMÈTRE DE CONSOLIDATION\nENDETTEMENT FINANCIER NET (en millions de dirhams)\nNéant\nEn MDH Au 31/03/2024 Au 31/03/2023\nEndettement financier net 888,8 1 333,8\n*Indicateurs établis sur la base d’une situation provisoire au 31 mars 2024.\nL’endettement financier net d’AFRIQUIA GAZ ressort, au 31 mars\nLe communiqué trimestriel T1 – 2024 est disponible sur notre site internet :\n2024, à 888,8 MDH contre 1 333,8 MDH un an plus tôt. http://www.afriquiagaz.com/index.php/communiques-de-presse\nContact Communication Financière : Othmane KADIRI\nTél. : 05 22 35 22 90 I E-mail : communication.financiere@akwagroup.com",
    "tables": [
        [
            {
                "En Tonnes": "Tonnage",
                "T1-2024": "319 086",
                "T1-2023": "310 479",
                "Variation en %": "2,8 %"
            }
        ],
        [
            {
                "En MDH": "Chiffre d’affaires\nconsolidé",
                "T1-2024": "2 046",
                "T1-2023": "2 449",
                "Variation en %": "-16,5 %"
            }
        ],
        [
            {
                "En MDH": "Chiffre d’affaires social",
                "T1-2024": "2 014",
                "T1-2023": "2 299",
                "Variation en %": "-12,4 %"
            }
        ],
        [
            {
                "En MDH": "Investissements",
                "T1-2024": "135,6",
                "T1-2023": "113,3",
                "Variation en %": "19,6 %"
            }
        ],
        [
            {
                "En MDH": "Investissements",
                "T1-2024": "122,6",
                "T1-2023": "100,1",
                "Variation en %": "22,5 %"
            }
        ],
        [
            {
                "En MDH": "Endettement financier net",
                "Au 31/03/2024": "1 850,1",
                "Au 31/03/2023": "2 114,8"
            }
        ],
        [
            {
                "En MDH": "Endettement financier net",
                "Au 31/03/2024": "888,8",
                "Au 31/03/2023": "1 333,8"
            }
        ]
    ]
}