{
    "text": "COMMUNIQUÉ FINANCIER\nRÉSULTATS AU 31 MARS 2024\nCRÉDIT DU MAROC : DES INDICATEURS EN EVOLUTION,\nFRUIT D’UNE STRATEGIE ACTIVE DE DEVELOPPEMENT\nLe Conseil de Surveillance de Crédit du Maroc s’est réuni le 16 mai 2024, sous la présidence de Monsieur Mohamed\nHassan BENSALAH, pour examiner l’activité et les comptes arrêtés au 31 mars 2024.\nRENFORCEMENT DE LA DYNAMIQUE COMMERCIALE ET DE LA SOLIDITE FINANCIERE ENCOURS CRÉDITS ENCOURS RESSOURCES\nBILAN\nBONNE DYNAMIQUE DES CRÉDITS +7,1 % 53 222 53 061\n49 695 51 672\nAu cours du premier trimestre 2024, Crédit du Maroc a poursuivi son soutien au développement\n+7,1 % +2,7 %\nde l’économie marocaine en intensifiant ses efforts de financement des ménages et des entreprises.\nAinsi, Crédit du Maroc a généré, sur les douze derniers mois, une hausse de 7,1 % des emplois clientèle\nqui se sont élevés à 53 222 MDH. Cette performance a été portée par :\n• une augmentation des crédits aux particuliers de 3,4 % à 20 609 MDH, tant au niveau du crédit\nà l’habitat qu’au niveau du crédit à la consommation qui ont progressé respectivement Mars 2023 Mars 2024 Mars 2023 Mars 2024\nde 3,2 % et de 4,0 % ; En millions de dirhams\n• une croissance des crédits aux entreprises de 9,4 % à 31 347 MDH, bénéficiant des progressions\ndu crédit à l’équipement (22,6 %), du crédit-bail (14,4 %) et du crédit court terme (2,6 %).\nCRÉDIT HABITAT CRÉDIT À\nLA CONSOMMATION\nCROISSANCE SOUTENUE DE LA COLLECTE BILAN +2,7 %\n16 386 16 913\nA fin mars 2024, les ressources bilan ont affiché une amélioration de 2,7 % à 53 061 MDH par rapport\nau 1er trimestre 2023 grâce, notamment à la bonne tenue des ressources à vue et des ressources d’épargne\n+3,2 %\nqui ont augmenté respectivement de 1,6 % et de 1,9 % à 37 137 MDH et à 10 152 MDH. Pour leur part,\nles dépôts à terme se sont hissés à 4 091 MDH, soit en évolution de 36,4 %.\n3 553 3 696\n+4 %\nPROGRESSION CONTINUE DU PRODUIT NET BANCAIRE +10 %\nLe produit net bancaire consolidé s’est élevé, au titre du 1er trimestre 2024, à 791 MDH, enregistrant ainsi Mars 2023 Mars 2024 Mars 2023 Mars 2024\nune progression de 10 % par rapport au 1er trimestre 2023. Cette performance résulte de la contribution En millions de dirhams\npositive de l’ensemble des activités de la Banque.\nLa marge nette d’intérêt a atteint 583 MDH, en hausse annuelle de 7,1 %, tirée par l’élargissement du fonds\nRESSOURCES À VUE RESSOURCES D’ÉPARGNE\nde commerce et la poursuite de la dynamique commerciale.\nPour sa part, la marge sur commissions s’est établie à 131 MDH, en évolution de 5,4 % grâce aux performances 37 137\n36 548\ngénérées par les filières spécialisées dont la banque transactionnelle, le commerce extérieur, la monétique,\nle cash-management et le digital. +1,6 %\nDe son côté, le résultat des opérations de marché a enregistré une hausse significative de 28,2 % et a atteint\n101 MDH, bénéficiant, notamment de l’orientation positive de l’activité obligataire. 9 958 10 152\n+1,9 %\nEnfin, les filiales de Crédit du Maroc ont contribué positivement au PNB global, avec un revenu de l’ordre\nde 59 MDH, en amélioration de 8,7 % par rapport au premier trimestre 2023.\nMars 2023 Mars 2024 Mars 2023 Mars 2024\nPERFORMANCE NOTABLE DU RÉSULTAT BRUT D’EXPLOITATION +18,5 %\nEn millions de dirhams\nLe résultat brut d’exploitation s’est apprécié de 18,5 % à 400 MDH au premier trimestre 2024\ngrâce à la hausse du PNB consolidé. Le coefficient d’exploitation s’est amélioré de 366 points\nPRODUIT NET BANCAIRE CHARGES D’EXPLOITATION\nde base pour s’établir à 49,4 %.\n791\nEn ce qui concerne les investissements, Crédit du Maroc a engagé, sur le premier trimestre 2024, un montant 719\ntotal de 85 MDH principalement pour des investissements sur la plateforme technologique.\n10,0 %\n381 391\nPOURSUITE DE LA POLITIQUE ANTICIPATIVE DU RISQUE\n+2,4 %\nLe coût du risque consolidé du premier trimestre 2024 s’est fixé à 65 MDH. La hausse maîtrisée du coût\ndu risque de 6,5 MDH traduit la poursuite d’une politique prudente en matière de provisionnement.\nLes créances en souffrance ont évolué de 8 %, soit 4 107 MDH avec un taux de créances douteuses\nMars 2023 Mars 2024 Mars 2023 Mars 2024\net litigieuses maîtrisé à 7,7 % et un taux de couverture des créances en souffrance établi à 86 %.\nEn millions de dirhams\nAMELIORATION DE LA CAPACITÉ BÉNÉFICIAIRE +16,5 %\nGrâce à la croissance soutenue de l’activité commerciale et à sa gestion rigoureuse des charges et du risque, RÉSULTAT BRUT COÛT DU RISQUE\nCrédit du Maroc a affiché un résultat net part du groupe de 159 MDH, en hausse de 16,5 %. D’EXPLOITATION\n400\n338\nPOURSUITE DE LA STRATEGIE DE DEVELOPPEMENT ET D’INNOVATION\nDE LA BANQUE\n+18,5 %\nUN POSITIONNEMENT STRATÉGIQUE AUTOUR DE LA FAMILLE +11,2 % 65\n59\nAu cours du premier trimestre 2024, Crédit du Maroc a lancé une vaste campagne de communication\nmulticanale axée sur son nouveau positionnement de banque de la famille. Ce nouveau positionnement Mars 2023 Mars 2024 Mars 2023 Mars 2024\nse déploie à travers une nouvelle offre de banque au quotidien clairement tarifée et compétitive ainsi En millions de dirhams\nque sur des solutions de financement adaptées aux besoins des familles. La Banque accompagne ainsi\nses clients dans leurs projets de vie à travers des parcours plus fluides et une expérience digitale aux meilleurs\nRÉSULTAT NET RATIO DE SOLVABILITÉ\nstandards.\nPART DU GROUPE\nUNE APPLICATION BANCAIRE ENRICHIE\n137 159\nCrédit du Maroc a également poursuivi son engagement en faveur de l’innovation et l’amélioration\n+16,5 %\ncontinue de l’expérience client au travers de la mise sur le marché d’une nouvelle version MIN 12 %\nde l’application MyCDM. Celle-ci a été enrichie de nouvelles fonctionnalités qui offrent un parcours amélioré\n14,22 % 13,63 %\net une sécurité plus renforcée, notamment avec ‘’CDM secure’’.\nUNE NOUVELLE FILIALE DÉDIÉE AU MARCHÉ DES CAPITAUX\nMars 2023 Mars 2024 Mars 2023 Mars 2024\nCrédit du Maroc consolide sa position sur le marché financier avec la création de \"CDM Capital Bourse\". En millions de dirhams En pourcentage\nCette nouvelle filiale, qui s’inscrit dans le cadre de la nouvelle stratégie de développement de la banque\nd’investissement de Crédit du Maroc, offrira une expertise pointue dans le conseil, l’exécution\net l’intermédiation concernant les instruments financiers.\nContact Presse : Mouna Benrhanem - mouna.benrhanem@cdm.ma\nSite web : wwww.creditdumaroc.ma - Centre de Relation Clients : 3232\nCRÉDIT DU MAROC, société anonyme à Directoire et à Conseil de Surveillance, au capital de 1.088.121.400 Dhs, RC n° 28.717, agréée en qualité d’établissement de crédit\npar arrêté du Ministre des Finances et des Investissements n° 2348-94 du 23 août 1994 relatif aux établissements de crédit agréés de plein droit en qualité de banque.\nSiège social : 201, boulevard d’Anfa, Casablanca - Site web : www.creditdumaroc.ma\nRÉSULTATS FINANCIERS CONSOLIDÉS IFRS AU 31 MARS 2024\nBILAN CONSOLIDÉ COMPTE DE RÉSULTAT CONSOLIDÉ ATTESTATION DES COMMISSAIRES AUX COMPTES\nIFRS AU 31 MARS 2024 IFRS AU 31 MARS 2024\n(En milliers de DH) (En milliers de DH)\nACTIF CONSOLIDÉ 31/03/2024 31/12/2023 COMPTE DE RÉSULTAT 31/03/2024 31/03/2023\nValeurs en caisse, Banques centrales, Trésor public, Service 1 723 545 2 265 791 Intérêts, rémunérations et produits assimilés 752 970 652 230\ndes chèques postaux Intérêts, rémunérations et charges assimilés 170 126 108 027\nActifs financiers à la juste valeur par résultat 3 261 204 2 596 910\nActifs financiers détenus à des fins de transactions 3 0 41 354 2 366 801 Marge d'Intérêt 582 845 544 203\nAutres actifs financiers à la juste valeur par résultat 219 850 230 109 Commissions (Produits) 139 310 131 276\nInstruments dérivés de couverture - - Commissions (Charges) 8 389 7 056\nActifs financiers à la juste valeur par capitaux propres 1 341 5 83 1 054 279 Marge sur Commissions 130 921 124 220\nI pn as rt r cu am pie tn at us x d pe r od re et st e res cc yo cm lap bt la esbilisés à la juste valeur 1 341 5 83 1 054 279 G nea ti tn es ou pertes nets résultant des couvertures de position - -\nI vn as lt er uu rm pe an rt cs a d pe it c aa up x it pa ru ox p rp er so p nore ns r c eo cm ycp lata bb leil sisés à la juste - - G vaa li en us r o pu a p r e rért se us lt n ae tts sur instruments financiers à la juste 100 730 78 577\nTitres au coût amorti 926 951 1 397 240\nGains ou pertes nets sur actifs/passifs de transaction 96 946 85 502\nP asrê sit ms ie lét sc ,r aé ua n cc oe ûs t s au mr ole rs ti Etablissements de crédit et 5 742 790 6 012 399 Gains ou pertes nets sur autres actifs/passifs à la juste 3 783 -6.925\nPrêts et créances sur la clientèle, au coût amorti 53 221 776 51 061 669 valeur par résultat\nEcart de réévaluation actif des portefeuilles couvert en taux - - Gains ou pertes nets des instruments financiers à la juste - -\nPlacements des activités d'assurance - - valeur par capitaux propres\nActifs d'Impôt exigible 1 651 3 253 Gains ou pertes nets sur instruments de dettes - -\nActifs d'impôt différé 148 3 95 159 7 89 comptabilisés en capitaux propres recyclables\nComptes de régularisation et autres actifs 489 817 422 280 Rémunération des instruments de capitaux propres\nActifs non courants destinés à être cédés - - comptabilisés en capitaux propres non recyclables - -\nParticipations dans des entreprises mises en équivalence - - (dividendes)\nImmeubles de placement - - Gains ou pertes nets sur actifs financiers disponibles à la - -\nImmobilisations corporelles 1 496 299 1 495 747 vente\nImmobilisations incorporelles 787 415 795 981 Gains ou pertes nets résultant de la décomptabilisation - -\nEcarts d'acquisition - - d'actifs financiers au coût amorti\nTOTAL 69 141 429 67 2 65 3 38 Gains ou pertes nets résultant du reclassement d'actifs\nfinanciers au coût amorti en actifs financiers à la juste valeur - -\n(En milliers de DH) par résultat\nPASSIF CONSOLIDÉ 31/03/2024 31/12/2023 Gains ou pertes nets résultant du reclassement d'actifs\nBanques centrales, Trésor public, Service des chèques financiers à la juste valeur par capitaux propres en actifs - -\npostaux 93 884 financiers à la juste valeur par résultat\nPassifs financiers à la juste valeur par résultat 19 681 15 984 Produits des autres activités 4 007 1 601\nPassifs financiers détenus à des fins de transaction 19 681 15 984 Charges des autres activités 27 977 29 654\nPassifs financiers à la juste valeur par résultat sur option - - PRODUIT NET BANCAIRE 790 526 718 948\nInstruments dérivés de couverture - - Charges générales d'exploitation 316 167 332 372\nDettes envers les Etablissements de crédit et assimilés 1 014 115 1 137 272 Dotations aux amortissements et aux dépréciations\nDettes envers la clientèle 53 060 613 51 755 426 des immobilisations incorporelles et corporelles 74 344 49 0 68\nTitres de créance émis 3 534 641 3 4 24 402\nRésultat Brut d'Exploitation 400 015 337 508\nPassifs d'impôt exigibles 51 4 312 125 097\nCoût du risque -65 042 -58 507\nPassifs d'impôt différé 16 057 17 8 85\nComptes de régularisation et autres passifs 2 383 237 1 891 556 Résultat d'Exploitation 334 973 279 001\nDettes liées aux actifs non courants destinés à être cédés - - Quote-Part du résultat net des entreprises associées - -\nProvisions techniques des contrats d'assurance - - et des coentreprises mises en équivalence\nProvisions 557 3 62 565 955 Gains ou pertes nets sur autres actifs -3 385 -7 482\nSubventions et fonds assimilés - - Variations de valeur des écarts d'aquisition - -\nDettes subordonnées et fonds spéciaux de garantie 1 2 63 4 49 1 2 50 969 Résultat avant Impôt 331 588 271 519\nCapitaux propres 7 240 750 7 079 907 Impôts sur les résultats 170 433 134 405\nCapital et réserves liées 4 346 514 4 346 514 Résultat net d’impôt des activités arrêtées ou en cours\nRéserves consolidées 2 696 878 2 197 909 de cession - -\nPart du groupe 2 651 1 66 2 147 3 34\nRésultat net 161 155 137 114\nPart des minoritaires 45 7 112 50 576\nIntérêts minoritaires 1 926 447\nGains et pertes comptabilisés directement en capitaux\npropres 36 203 37 259 résultat net Part du groupe 159 229 136 667\nPart du groupe 36 203 37 259 Résultat par action 14,63 12,56\nPart des minoritaires - - Résultat dilué par action 14,63 12,56\nRésultat net de l’exercice 161 1 55 498 225\nPart du groupe 159 229 503 089\nPart des minoritaires 1 926 -4 8 64\nTOTAL 69 141 429 67 2 65 3 38\nCOMPTES SOCIAUX AU 31 MARS 2024\nBILAN AU 31 MARS 2024 COMPTE DE PRODUITS ET CHARGES\n(En milliers de DH) (En milliers de DH) AU 31 MARS 2024\nACTIF 31/03/2024 31/12/2023 HORS BILAN 31/03/2024 31/12/2023 (En milliers de DH)\nValeurs en caisse, Banques centrales, Trésor public, ENGAGEMENTS DONNÉS 13 023 68 7 12 181 5 74\n1 723 627 2 265 665 LIBELLÉ 31/03/2024 31/03/2023\nService des chèques postaux Engagements de financement donnés en faveur\nCréances sur les établissements de crédit et assimilés 6 9 93 520 7 405 972 d'établissements de crédit et assimilés - - PRODUITS D'EXPLOITATION BANCAIRE 929 239 815 828\nEngagements de financement donnés en faveur Intérêts, rémunérations et produits assimilés sur opérations\n. À vue 2 271 085 917 518 de la clientèle 6 211 559 5 698 3 27 avec les établissements 78 100 39 7 30\nC. . À r Cé rt a ée n drm c ite se s d s eu tr r l éa s c ol rie en rit eè ele t à la consom& m& ati& on &&&&&& 5 & 20 4 0 9 &7 1!32 50 \" 32 & 8 # 54 5 0&3 $ 836 &# 4 \"& 96 % 1 0 &4 8 38 56 !8 & 6 ! 64 1 &&8 & 15 13 94 EeE t nn gg a aa ss gg i ee m mm ilé ee s nn tt ss dd ee gg aa rr aa nn tt ii ee dd '' oo rr dd rr ee dd e'é t laa b cl li is e. n d te è lecrédit 2 4 4 39 129 831 18 0 2 4 2 19 83 9 4 78 58 9 I a In nvt teé écr rê êlat ts s c, elr ieé tn m ptè ru oln e dé ura itt sio an ss s e imt ip lér so d su ui rt s t ita rs es sim di elé s c rs éu ar no cp eérations 6 2 165 85 55 34 56 11 6 9 16 58 6\n. Crédits à l'équipement 9 82 1 155 9 663 379 Titres achetés à réméré - - Produits sur titres de propriété et certificats de Sukuk 1 316 1\nAutres titres à livrer - -\n. Crédits immobiliers 18 930 157 18 581 240 Produits sur titres de Moudaraba et moucharaka - -\nENGAGEMENTS REÇUS 3 107 485 2 9 98 3 00\n. Autres crédits 2 026 034 2 2 30 945 Engagements de financement reçus d'établis. de crédit Produits sur immobilisations en crédit-bail et en location - -\nCréances acquises par affacturage 615 252 715 251 et assimilés - - Produits sur immobilisations données en Ijara - -\nTitres de transaction et de placement 4 467 674 3 491 778 Engagements de garantie reçus d'établis. de crédit 3 107 485 2 9 98 3 00 Commissions sur prestations de service 102 745 95 087\n. Bons du Trésor et valeurs assimilées 3 6 28 856 3 05 1 102 et assimilés Autres produits bancaires 104 670 102 885\nEngagements de garantie reçus de l'État et d'organismes\n. Autres titres de créance 723 6 79 325 537 de garantie divers - - Transfert de charges sur dépôts d'investissement reçus - -\n. Titres de propriété 115 139 115 139 Titres vendus à réméré - - CHARGES D'EXPLOITATION BANCAIRE 218 057 160 133\n. Certificats de Sukuk - - Titres de Moucharaka et Moudaraba à recevoir - - Intérêts et charges assimilées sur opérations\n17 427 23 374\nAutres actifs 381 142 368 111 Autres titres à recevoir - - avec les établissements\nTitres d'investissement 905 031 1 373 511 Intérêts et charges assimilées sur opérations\n120 5 26 65 120\n. Bons du Trésor et valeurs assimilées 905 031 1 373 511 avec la clientèle\n. Autres titres de créance - - ATTESTATION DES COMMISSAIRES AUX COMPTES Intérêts et charges assimilées sur titres de créance émis 36 194 17 679\n. Certificats de Sukuk - - Charges sur titres de Moudaraba et Moucharaka - -\nTitres de participation et emplois assimilés 297 331 303 775 Charges sur immobilisations en crédit-bail et en location - -\n. Participations dans les entreprises liées 254 848 260 577 Charges sur immobilisations données en Ijara - -\n. Autres titres de participation et emplois assimilés 42 4 83 43 198 Autres charges bancaires 43 910 53 959\n. Titres de Moudaraba et Moucharaka - - Transfert de produits sur dépôts d'investissement reçus - -\nCréances subordonnées - - PRODUIT NET BANCAIRE 711 182 655 695\nDépôts d’investissement placés - - Produits d'exploitation non bancaire 7 716 11 696\nImmobilisations données en crédit-bail et en location - - Charges d'exploitation non bancaire - -\nImmobilisations données en Ijara - - CHARGES GÉNÉRALES D'EXPLOITATION 376 7 18 372 844\nImmobilisations incorporelles 761 165 773 4 54 Charges de personnel 192 877 210 076\nImmobilisations corporelles 1 1 19 0 98 1 122 9 69 Impôts et taxes 1 024 1 179\nTotal de l'Actif 68 194 692 66 857 168 Charges externes 110 067 115 803\nAutres charges générales d'exploitation 412 358\n(En milliers de DH)\nDotatio ns aux amortissements et aux provisions des\n72 339 45 429\nPASSIF 31/03/2024 31/12/2023 immobilisations incorporelles et corporelles\nB poa sn tq au ue xs centrales, Trésor public, Service des chèques 93 247 CD RO ÉTA ANTI CO EN SS I A RU RX É CP OR UO VV RIS AIO BN LES S ET PERTES SUR 189 575 298 952\nDettes envers les établissements de crédit et assimilés 590 493 1 113 4 84 Dotations aux provisions pour créances et engagements\n167 555 199 840\n. À vue 275 2 07 751 840 par signature en souffrance\n. À terme 315 286 361 644 Pertes sur créances irrécouvrables 56 67 924\nDépôts de la clientèle 52 963 679 51 6 78 073 Autres dotations aux provisions 21 965 3 1 187\n. Comptes à vue créditeurs 37 0 44 9 93 35 888 190 REPRISES DE PROVISIONS ET RÉCUPERATIONS SUR 140 241 275 300\nCRÉANCES AMORTIES\n. Comptes d'épargne 10 151 860 10 0 70 8 45\nReprises de provisions pour créances et engagements par\n. Dépôts à terme 4 260 714 4 133 319 signature en souffrance 108 720 235 997\n. Autres comptes créditeurs 1 497 533 1 573 233 Récupérations sur créances amorties 5 2 27 4 071\n. Dettes envers la clientèle sur produits participatifs 8 5 80 12 485 Autres reprises de provisions 26 293 35 232\nTitres de créance émis 3 534 641 3 4 24 402 RÉSULTAT COURANT 292 845 270 896\n. Titres de créance négociables 3 534 641 3 4 24 402 Produits non courants 10 717 10 792\n. Emprunts obligataires - - Charges non courantes 75 8 95 57 715\n. Autres titres de créance émis - - RÉSULTAT AVANT IMPÔTS SUR LES RÉSULTATS 227 667 223 973\nAutres passifs 2 0 51 0 88 1 747 310 Impôts sur les résultats 93 999 95 558\nProvisions pour risques et charges 1 098 291 1 120 134 RÉSULTAT NET DE L'EXERCICE 133 668 128 416\nProvisions réglementées - -\nSubventions, fonds publics affectés et fonds spéciaux\n- -\nde garantie\nDettes subordonnées 1 945 157 1 9 23 507\nDépôts d’investissement reçus 27 570 -\nÉcarts de réévaluation - -\nRéserves et primes liées au capital 2 625 959 2 625 959\nCapital 1 088 121 1 088 121\nActionnaires. Capital non versé (-) - -\nReport à nouveau (+/-) 1 603 139 1 603 139\nRésultats nets en instance d'affectation (+/-) 532 791 -\nRésultat net de l'exercice (+/-) 133 6 68 532 791\nTotal du Passif 68 194 6 92 66 857 168\nCRÉDIT DU MAROC, société anonyme à Directoire et à Conseil de Surveillance, au capital de 1.088.121.400 Dhs, RC n° 28.717, agréée en qualité d’établissement de crédit\npar arrêté du Ministre des Finances et des Investissements n° 2348-94 du 23 août 1994 relatif aux établissements de crédit agréés de plein droit en qualité de banque.\nSiège social : 201, boulevard d’Anfa, Casablanca - Site web : www.creditdumaroc.ma",
    "tables": [
        [
            {
                "ACTIF CONSOLIDÉ": "",
                "31/03/2024": "1 723 545",
                "31/12/2023": ""
            },
            {
                "ACTIF CONSOLIDÉ": "",
                "31/03/2024": "3 261 204",
                "31/12/2023": ""
            },
            {
                "ACTIF CONSOLIDÉ": "",
                "31/03/2024": "3 0 41 354",
                "31/12/2023": ""
            },
            {
                "ACTIF CONSOLIDÉ": "",
                "31/03/2024": "219 850",
                "31/12/2023": ""
            },
            {
                "ACTIF CONSOLIDÉ": "",
                "31/03/2024": "-",
                "31/12/2023": ""
            },
            {
                "ACTIF CONSOLIDÉ": "",
                "31/03/2024": "1 341 5 83",
                "31/12/2023": ""
            },
            {
                "ACTIF CONSOLIDÉ": "",
                "31/03/2024": "1 341 5 83",
                "31/12/2023": ""
            },
            {
                "ACTIF CONSOLIDÉ": "",
                "31/03/2024": "-",
                "31/12/2023": ""
            },
            {
                "ACTIF CONSOLIDÉ": "",
                "31/03/2024": "926 951",
                "31/12/2023": ""
            },
            {
                "ACTIF CONSOLIDÉ": "",
                "31/03/2024": "5 742 790",
                "31/12/2023": ""
            },
            {
                "ACTIF CONSOLIDÉ": "",
                "31/03/2024": "53 221 776",
                "31/12/2023": ""
            },
            {
                "ACTIF CONSOLIDÉ": "",
                "31/03/2024": "-",
                "31/12/2023": ""
            },
            {
                "ACTIF CONSOLIDÉ": "",
                "31/03/2024": "-",
                "31/12/2023": ""
            },
            {
                "ACTIF CONSOLIDÉ": "",
                "31/03/2024": "1 651",
                "31/12/2023": ""
            },
            {
                "ACTIF CONSOLIDÉ": "",
                "31/03/2024": "148 3 95",
                "31/12/2023": ""
            },
            {
                "ACTIF CONSOLIDÉ": "",
                "31/03/2024": "489 817",
                "31/12/2023": ""
            },
            {
                "ACTIF CONSOLIDÉ": "",
                "31/03/2024": "-",
                "31/12/2023": ""
            },
            {
                "ACTIF CONSOLIDÉ": "",
                "31/03/2024": "-",
                "31/12/2023": ""
            },
            {
                "ACTIF CONSOLIDÉ": "",
                "31/03/2024": "-",
                "31/12/2023": ""
            },
            {
                "ACTIF CONSOLIDÉ": "",
                "31/03/2024": "1 496 299",
                "31/12/2023": ""
            },
            {
                "ACTIF CONSOLIDÉ": "",
                "31/03/2024": "787 415",
                "31/12/2023": ""
            },
            {
                "ACTIF CONSOLIDÉ": "",
                "31/03/2024": "-",
                "31/12/2023": ""
            },
            {
                "ACTIF CONSOLIDÉ": "TOTAL",
                "31/03/2024": "69 141 429",
                "31/12/2023": "67 2 65 3 38"
            }
        ],
        [
            {
                "COMPTE DE RÉSULTAT": "",
                "31/03/2024": "752 970",
                "31/03/2023": "652 230"
            },
            {
                "COMPTE DE RÉSULTAT": "",
                "31/03/2024": "170 126",
                "31/03/2023": "108 027"
            },
            {
                "COMPTE DE RÉSULTAT": "Marge d'Intérêt",
                "31/03/2024": "582 845",
                "31/03/2023": "544 203"
            },
            {
                "COMPTE DE RÉSULTAT": "",
                "31/03/2024": "139 310",
                "31/03/2023": "131 276"
            },
            {
                "COMPTE DE RÉSULTAT": "",
                "31/03/2024": "8 389",
                "31/03/2023": "7 056"
            },
            {
                "COMPTE DE RÉSULTAT": "Marge sur Commissions",
                "31/03/2024": "130 921",
                "31/03/2023": "124 220"
            },
            {
                "COMPTE DE RÉSULTAT": "",
                "31/03/2024": "-",
                "31/03/2023": "-"
            },
            {
                "COMPTE DE RÉSULTAT": "",
                "31/03/2024": "100 730",
                "31/03/2023": "78 577"
            },
            {
                "COMPTE DE RÉSULTAT": "",
                "31/03/2024": "96 946",
                "31/03/2023": "85 502"
            },
            {
                "COMPTE DE RÉSULTAT": "",
                "31/03/2024": "3 783",
                "31/03/2023": "-6.925"
            },
            {
                "COMPTE DE RÉSULTAT": "",
                "31/03/2024": "-",
                "31/03/2023": "-"
            },
            {
                "COMPTE DE RÉSULTAT": "",
                "31/03/2024": "-",
                "31/03/2023": "-"
            },
            {
                "COMPTE DE RÉSULTAT": "",
                "31/03/2024": "-",
                "31/03/2023": "-"
            },
            {
                "COMPTE DE RÉSULTAT": "",
                "31/03/2024": "-",
                "31/03/2023": "-"
            },
            {
                "COMPTE DE RÉSULTAT": "",
                "31/03/2024": "-",
                "31/03/2023": "-"
            },
            {
                "COMPTE DE RÉSULTAT": "",
                "31/03/2024": "-",
                "31/03/2023": "-"
            },
            {
                "COMPTE DE RÉSULTAT": "",
                "31/03/2024": "-",
                "31/03/2023": "-"
            },
            {
                "COMPTE DE RÉSULTAT": "",
                "31/03/2024": "4 007",
                "31/03/2023": "1 601"
            },
            {
                "COMPTE DE RÉSULTAT": "",
                "31/03/2024": "27 977",
                "31/03/2023": "29 654"
            },
            {
                "COMPTE DE RÉSULTAT": "PRODUIT NET BANCAIRE",
                "31/03/2024": "790 526",
                "31/03/2023": "718 948"
            },
            {
                "COMPTE DE RÉSULTAT": "",
                "31/03/2024": "316 167",
                "31/03/2023": "332 372"
            },
            {
                "COMPTE DE RÉSULTAT": "",
                "31/03/2024": "74 344",
                "31/03/2023": "49 0 68"
            },
            {
                "COMPTE DE RÉSULTAT": "Résultat Brut d'Exploitation",
                "31/03/2024": "400 015",
                "31/03/2023": "337 508"
            },
            {
                "COMPTE DE RÉSULTAT": "",
                "31/03/2024": "-65 042",
                "31/03/2023": "-58 507"
            },
            {
                "COMPTE DE RÉSULTAT": "Résultat d'Exploitation",
                "31/03/2024": "334 973",
                "31/03/2023": "279 001"
            },
            {
                "COMPTE DE RÉSULTAT": "",
                "31/03/2024": "-",
                "31/03/2023": "-"
            },
            {
                "COMPTE DE RÉSULTAT": "",
                "31/03/2024": "-3 385",
                "31/03/2023": "-7 482"
            },
            {
                "COMPTE DE RÉSULTAT": "",
                "31/03/2024": "-",
                "31/03/2023": "-"
            },
            {
                "COMPTE DE RÉSULTAT": "Résultat avant Impôt",
                "31/03/2024": "331 588",
                "31/03/2023": "271 519"
            },
            {
                "COMPTE DE RÉSULTAT": "",
                "31/03/2024": "170 433",
                "31/03/2023": "134 405"
            },
            {
                "COMPTE DE RÉSULTAT": "",
                "31/03/2024": "-",
                "31/03/2023": "-"
            },
            {
                "COMPTE DE RÉSULTAT": "Résultat net",
                "31/03/2024": "161 155",
                "31/03/2023": "137 114"
            },
            {
                "COMPTE DE RÉSULTAT": "",
                "31/03/2024": "1 926",
                "31/03/2023": "447"
            },
            {
                "COMPTE DE RÉSULTAT": "résultat net Part du groupe",
                "31/03/2024": "159 229",
                "31/03/2023": "136 667"
            },
            {
                "COMPTE DE RÉSULTAT": "",
                "31/03/2024": "14,63",
                "31/03/2023": "12,56"
            },
            {
                "COMPTE DE RÉSULTAT": "",
                "31/03/2024": "14,63",
                "31/03/2023": "12,56"
            }
        ],
        [
            {
                "PASSIF CONSOLIDÉ": "",
                "31/03/2024": "93",
                "31/12/2023": ""
            },
            {
                "PASSIF CONSOLIDÉ": "",
                "31/03/2024": "19 681",
                "31/12/2023": ""
            },
            {
                "PASSIF CONSOLIDÉ": "",
                "31/03/2024": "19 681",
                "31/12/2023": ""
            },
            {
                "PASSIF CONSOLIDÉ": "",
                "31/03/2024": "-",
                "31/12/2023": ""
            },
            {
                "PASSIF CONSOLIDÉ": "",
                "31/03/2024": "-",
                "31/12/2023": ""
            },
            {
                "PASSIF CONSOLIDÉ": "",
                "31/03/2024": "1 014 115",
                "31/12/2023": ""
            },
            {
                "PASSIF CONSOLIDÉ": "",
                "31/03/2024": "53 060 613",
                "31/12/2023": ""
            },
            {
                "PASSIF CONSOLIDÉ": "",
                "31/03/2024": "3 534 641",
                "31/12/2023": ""
            },
            {
                "PASSIF CONSOLIDÉ": "",
                "31/03/2024": "51 4 312",
                "31/12/2023": ""
            },
            {
                "PASSIF CONSOLIDÉ": "",
                "31/03/2024": "16 057",
                "31/12/2023": ""
            },
            {
                "PASSIF CONSOLIDÉ": "",
                "31/03/2024": "2 383 237",
                "31/12/2023": ""
            },
            {
                "PASSIF CONSOLIDÉ": "",
                "31/03/2024": "-",
                "31/12/2023": ""
            },
            {
                "PASSIF CONSOLIDÉ": "",
                "31/03/2024": "-",
                "31/12/2023": ""
            },
            {
                "PASSIF CONSOLIDÉ": "",
                "31/03/2024": "557 3 62",
                "31/12/2023": ""
            },
            {
                "PASSIF CONSOLIDÉ": "",
                "31/03/2024": "-",
                "31/12/2023": ""
            },
            {
                "PASSIF CONSOLIDÉ": "",
                "31/03/2024": "1 2 63 4 49",
                "31/12/2023": ""
            },
            {
                "PASSIF CONSOLIDÉ": "",
                "31/03/2024": "7 240 750",
                "31/12/2023": ""
            },
            {
                "PASSIF CONSOLIDÉ": "",
                "31/03/2024": "4 346 514",
                "31/12/2023": ""
            },
            {
                "PASSIF CONSOLIDÉ": "",
                "31/03/2024": "2 696 878",
                "31/12/2023": ""
            },
            {
                "PASSIF CONSOLIDÉ": "",
                "31/03/2024": "2 651 1 66",
                "31/12/2023": ""
            },
            {
                "PASSIF CONSOLIDÉ": "",
                "31/03/2024": "45 7 112",
                "31/12/2023": ""
            },
            {
                "PASSIF CONSOLIDÉ": "",
                "31/03/2024": "36 203",
                "31/12/2023": ""
            },
            {
                "PASSIF CONSOLIDÉ": "",
                "31/03/2024": "36 203",
                "31/12/2023": ""
            },
            {
                "PASSIF CONSOLIDÉ": "",
                "31/03/2024": "-",
                "31/12/2023": ""
            },
            {
                "PASSIF CONSOLIDÉ": "",
                "31/03/2024": "161 1 55",
                "31/12/2023": ""
            },
            {
                "PASSIF CONSOLIDÉ": "",
                "31/03/2024": "159 229",
                "31/12/2023": ""
            },
            {
                "PASSIF CONSOLIDÉ": "",
                "31/03/2024": "1 926",
                "31/12/2023": ""
            },
            {
                "PASSIF CONSOLIDÉ": "TOTAL",
                "31/03/2024": "69 141 429",
                "31/12/2023": "67 2 65 3 38"
            }
        ],
        [
            {
                "ACTIF": "",
                "31/03/2024": "1 723 627",
                "31/12/2023": ""
            },
            {
                "ACTIF": "",
                "31/03/2024": "6 9 93 520",
                "31/12/2023": ""
            },
            {
                "ACTIF": "",
                "31/03/2024": "2 271 085",
                "31/12/2023": ""
            },
            {
                "ACTIF": "",
                "31/03/2024": "4 722 436",
                "31/12/2023": ""
            },
            {
                "ACTIF": "",
                "31/03/2024": "50 9 30 8 53",
                "31/12/2023": ""
            },
            {
                "ACTIF": "",
                "31/03/2024": "&&&!\"&#&$\n20 153 508",
                "31/12/2023": ""
            },
            {
                "ACTIF": "",
                "31/03/2024": "9 82 1 155",
                "31/12/2023": ""
            },
            {
                "ACTIF": "",
                "31/03/2024": "18 930 157",
                "31/12/2023": ""
            },
            {
                "ACTIF": "",
                "31/03/2024": "2 026 034",
                "31/12/2023": ""
            },
            {
                "ACTIF": "",
                "31/03/2024": "615 252",
                "31/12/2023": ""
            },
            {
                "ACTIF": "",
                "31/03/2024": "4 467 674",
                "31/12/2023": ""
            },
            {
                "ACTIF": "",
                "31/03/2024": "3 6 28 856",
                "31/12/2023": ""
            },
            {
                "ACTIF": "",
                "31/03/2024": "723 6 79",
                "31/12/2023": ""
            },
            {
                "ACTIF": "",
                "31/03/2024": "115 139",
                "31/12/2023": ""
            },
            {
                "ACTIF": "",
                "31/03/2024": "-",
                "31/12/2023": ""
            },
            {
                "ACTIF": "",
                "31/03/2024": "381 142",
                "31/12/2023": ""
            },
            {
                "ACTIF": "",
                "31/03/2024": "905 031",
                "31/12/2023": ""
            },
            {
                "ACTIF": "",
                "31/03/2024": "905 031",
                "31/12/2023": ""
            },
            {
                "ACTIF": "",
                "31/03/2024": "-",
                "31/12/2023": ""
            },
            {
                "ACTIF": "",
                "31/03/2024": "-",
                "31/12/2023": ""
            },
            {
                "ACTIF": "",
                "31/03/2024": "297 331",
                "31/12/2023": ""
            },
            {
                "ACTIF": "",
                "31/03/2024": "254 848",
                "31/12/2023": ""
            },
            {
                "ACTIF": "",
                "31/03/2024": "42 4 83",
                "31/12/2023": ""
            },
            {
                "ACTIF": "",
                "31/03/2024": "-",
                "31/12/2023": ""
            },
            {
                "ACTIF": "",
                "31/03/2024": "-",
                "31/12/2023": ""
            },
            {
                "ACTIF": "",
                "31/03/2024": "-",
                "31/12/2023": ""
            },
            {
                "ACTIF": "",
                "31/03/2024": "-",
                "31/12/2023": ""
            },
            {
                "ACTIF": "",
                "31/03/2024": "-",
                "31/12/2023": ""
            },
            {
                "ACTIF": "",
                "31/03/2024": "761 165",
                "31/12/2023": ""
            },
            {
                "ACTIF": "",
                "31/03/2024": "1 1 19 0 98",
                "31/12/2023": ""
            },
            {
                "ACTIF": "Total de l'Actif",
                "31/03/2024": "68 194 692",
                "31/12/2023": "66 857 168"
            }
        ],
        [
            {
                "HORS BILAN": "ENGAGEMENTS DONNÉS",
                "31/03/2024": "13 023 68 7",
                "31/12/2023": "12 181 5 74"
            },
            {
                "HORS BILAN": "",
                "31/03/2024": "-",
                "31/12/2023": ""
            },
            {
                "HORS BILAN": "",
                "31/03/2024": "6 211 559",
                "31/12/2023": ""
            },
            {
                "HORS BILAN": "",
                "31/03/2024": "2 499 318",
                "31/12/2023": ""
            },
            {
                "HORS BILAN": "",
                "31/03/2024": "4 312 810",
                "31/12/2023": ""
            },
            {
                "HORS BILAN": "",
                "31/03/2024": "-",
                "31/12/2023": ""
            },
            {
                "HORS BILAN": "",
                "31/03/2024": "-",
                "31/12/2023": ""
            },
            {
                "HORS BILAN": "ENGAGEMENTS REÇUS",
                "31/03/2024": "3 107 485",
                "31/12/2023": "2 9 98 3 00"
            },
            {
                "HORS BILAN": "",
                "31/03/2024": "-",
                "31/12/2023": ""
            },
            {
                "HORS BILAN": "",
                "31/03/2024": "3 107 485",
                "31/12/2023": ""
            },
            {
                "HORS BILAN": "",
                "31/03/2024": "-",
                "31/12/2023": ""
            },
            {
                "HORS BILAN": "",
                "31/03/2024": "-",
                "31/12/2023": ""
            },
            {
                "HORS BILAN": "",
                "31/03/2024": "-",
                "31/12/2023": ""
            },
            {
                "HORS BILAN": "",
                "31/03/2024": "-",
                "31/12/2023": ""
            }
        ],
        [
            {
                "LIBELLÉ": "PRODUITS D'EXPLOITATION BANCAIRE",
                "31/03/2024": "929 239",
                "31/03/2023": "815 828"
            },
            {
                "LIBELLÉ": "",
                "31/03/2024": "78 100",
                "31/03/2023": ""
            },
            {
                "LIBELLÉ": "",
                "31/03/2024": "625 554",
                "31/03/2023": ""
            },
            {
                "LIBELLÉ": "",
                "31/03/2024": "16 853",
                "31/03/2023": ""
            },
            {
                "LIBELLÉ": "",
                "31/03/2024": "1 316",
                "31/03/2023": ""
            },
            {
                "LIBELLÉ": "",
                "31/03/2024": "-",
                "31/03/2023": ""
            },
            {
                "LIBELLÉ": "",
                "31/03/2024": "-",
                "31/03/2023": ""
            },
            {
                "LIBELLÉ": "",
                "31/03/2024": "-",
                "31/03/2023": ""
            },
            {
                "LIBELLÉ": "",
                "31/03/2024": "102 745",
                "31/03/2023": ""
            },
            {
                "LIBELLÉ": "",
                "31/03/2024": "104 670",
                "31/03/2023": ""
            },
            {
                "LIBELLÉ": "",
                "31/03/2024": "-",
                "31/03/2023": ""
            },
            {
                "LIBELLÉ": "CHARGES D'EXPLOITATION BANCAIRE",
                "31/03/2024": "218 057",
                "31/03/2023": "160 133"
            },
            {
                "LIBELLÉ": "",
                "31/03/2024": "17 427",
                "31/03/2023": ""
            },
            {
                "LIBELLÉ": "",
                "31/03/2024": "120 5 26",
                "31/03/2023": ""
            },
            {
                "LIBELLÉ": "",
                "31/03/2024": "36 194",
                "31/03/2023": ""
            },
            {
                "LIBELLÉ": "",
                "31/03/2024": "-",
                "31/03/2023": ""
            },
            {
                "LIBELLÉ": "",
                "31/03/2024": "-",
                "31/03/2023": ""
            },
            {
                "LIBELLÉ": "",
                "31/03/2024": "-",
                "31/03/2023": ""
            },
            {
                "LIBELLÉ": "",
                "31/03/2024": "43 910",
                "31/03/2023": ""
            },
            {
                "LIBELLÉ": "",
                "31/03/2024": "-",
                "31/03/2023": ""
            },
            {
                "LIBELLÉ": "PRODUIT NET BANCAIRE",
                "31/03/2024": "711 182",
                "31/03/2023": "655 695"
            },
            {
                "LIBELLÉ": "",
                "31/03/2024": "7 716",
                "31/03/2023": ""
            },
            {
                "LIBELLÉ": "",
                "31/03/2024": "-",
                "31/03/2023": ""
            },
            {
                "LIBELLÉ": "CHARGES GÉNÉRALES D'EXPLOITATION",
                "31/03/2024": "376 7 18",
                "31/03/2023": "372 844"
            },
            {
                "LIBELLÉ": "",
                "31/03/2024": "192 877",
                "31/03/2023": ""
            },
            {
                "LIBELLÉ": "",
                "31/03/2024": "1 024",
                "31/03/2023": ""
            },
            {
                "LIBELLÉ": "",
                "31/03/2024": "110 067",
                "31/03/2023": ""
            },
            {
                "LIBELLÉ": "",
                "31/03/2024": "412",
                "31/03/2023": ""
            },
            {
                "LIBELLÉ": "",
                "31/03/2024": "72 339",
                "31/03/2023": ""
            },
            {
                "LIBELLÉ": "DOTATIONS AUX PROVISIONS ET PERTES SUR\nCRÉANCES IRRÉCOUVRABLES",
                "31/03/2024": "189 575",
                "31/03/2023": "298 952"
            },
            {
                "LIBELLÉ": "",
                "31/03/2024": "167 555",
                "31/03/2023": ""
            },
            {
                "LIBELLÉ": "",
                "31/03/2024": "56",
                "31/03/2023": ""
            },
            {
                "LIBELLÉ": "",
                "31/03/2024": "21 965",
                "31/03/2023": ""
            },
            {
                "LIBELLÉ": "REPRISES DE PROVISIONS ET RÉCUPERATIONS SUR\nCRÉANCES AMORTIES",
                "31/03/2024": "140 241",
                "31/03/2023": "275 300"
            },
            {
                "LIBELLÉ": "",
                "31/03/2024": "108 720",
                "31/03/2023": ""
            },
            {
                "LIBELLÉ": "",
                "31/03/2024": "5 2 27",
                "31/03/2023": ""
            },
            {
                "LIBELLÉ": "",
                "31/03/2024": "26 293",
                "31/03/2023": ""
            },
            {
                "LIBELLÉ": "RÉSULTAT COURANT",
                "31/03/2024": "292 845",
                "31/03/2023": "270 896"
            },
            {
                "LIBELLÉ": "",
                "31/03/2024": "10 717",
                "31/03/2023": ""
            },
            {
                "LIBELLÉ": "",
                "31/03/2024": "75 8 95",
                "31/03/2023": ""
            },
            {
                "LIBELLÉ": "RÉSULTAT AVANT IMPÔTS SUR LES RÉSULTATS",
                "31/03/2024": "227 667",
                "31/03/2023": "223 973"
            },
            {
                "LIBELLÉ": "",
                "31/03/2024": "93 999",
                "31/03/2023": ""
            },
            {
                "LIBELLÉ": "RÉSULTAT NET DE L'EXERCICE",
                "31/03/2024": "133 668",
                "31/03/2023": "128 416"
            }
        ],
        [
            {
                "PASSIF": "",
                "31/03/2024": "93",
                "31/12/2023": ""
            },
            {
                "PASSIF": "",
                "31/03/2024": "590 493",
                "31/12/2023": ""
            },
            {
                "PASSIF": "",
                "31/03/2024": "275 2 07",
                "31/12/2023": ""
            },
            {
                "PASSIF": "",
                "31/03/2024": "315 286",
                "31/12/2023": ""
            },
            {
                "PASSIF": "",
                "31/03/2024": "52 963 679",
                "31/12/2023": ""
            },
            {
                "PASSIF": "",
                "31/03/2024": "37 0 44 9 93",
                "31/12/2023": ""
            },
            {
                "PASSIF": "",
                "31/03/2024": "10 151 860",
                "31/12/2023": ""
            },
            {
                "PASSIF": "",
                "31/03/2024": "4 260 714",
                "31/12/2023": ""
            },
            {
                "PASSIF": "",
                "31/03/2024": "1 497 533",
                "31/12/2023": ""
            },
            {
                "PASSIF": "",
                "31/03/2024": "8 5 80",
                "31/12/2023": ""
            },
            {
                "PASSIF": "",
                "31/03/2024": "3 534 641",
                "31/12/2023": ""
            },
            {
                "PASSIF": "",
                "31/03/2024": "3 534 641",
                "31/12/2023": ""
            },
            {
                "PASSIF": "",
                "31/03/2024": "-",
                "31/12/2023": ""
            },
            {
                "PASSIF": "",
                "31/03/2024": "-",
                "31/12/2023": ""
            },
            {
                "PASSIF": "",
                "31/03/2024": "2 0 51 0 88",
                "31/12/2023": ""
            },
            {
                "PASSIF": "",
                "31/03/2024": "1 098 291",
                "31/12/2023": ""
            },
            {
                "PASSIF": "",
                "31/03/2024": "-",
                "31/12/2023": ""
            },
            {
                "PASSIF": "",
                "31/03/2024": "-",
                "31/12/2023": ""
            },
            {
                "PASSIF": "",
                "31/03/2024": "1 945 157",
                "31/12/2023": ""
            },
            {
                "PASSIF": "",
                "31/03/2024": "27 570",
                "31/12/2023": ""
            },
            {
                "PASSIF": "",
                "31/03/2024": "-",
                "31/12/2023": ""
            },
            {
                "PASSIF": "",
                "31/03/2024": "2 625 959",
                "31/12/2023": ""
            },
            {
                "PASSIF": "",
                "31/03/2024": "1 088 121",
                "31/12/2023": ""
            },
            {
                "PASSIF": "",
                "31/03/2024": "-",
                "31/12/2023": ""
            },
            {
                "PASSIF": "",
                "31/03/2024": "1 603 139",
                "31/12/2023": ""
            },
            {
                "PASSIF": "",
                "31/03/2024": "532 791",
                "31/12/2023": ""
            },
            {
                "PASSIF": "",
                "31/03/2024": "133 6 68",
                "31/12/2023": ""
            },
            {
                "PASSIF": "Total du Passif",
                "31/03/2024": "68 194 6 92",
                "31/12/2023": "66 857 168"
            }
        ]
    ]
}