{
    "text": "INDICATEURS D’ACTIVITÉ DU 1er TRIMESTRE 2024*\nÀ l’issue du 1er trimestre de l’année 2024, MAGHREB OXYGENE poursuit sa mobilisation et son engagement pour afficher une stabilité\nde son chiffre d’affaires.\nFAITS MARQUANTS DE LA PÉRIODE PERSPECTIVES\nNéant. MAGHREB OXYGENE poursuit ses efforts, axés sur une croissance\ndurable. Son activité, pour les mois à venir, devrait se montrer en\nINDICATEURS SOCIAUX DE MAGHREB OXYGENE : ligne avec ses prévisions annuelles.\nCHIFFRE D’AFFAIRES (EN MILLIONS DE DIRHAMS)\nINDICATEURS CONSOLIDÉS\nEn MDH T1-2024 T1-2023 Variation en % CHIFFRE D’AFFAIRES CONSOLIDÉ (EN MILLIONS DE DIRHAMS)\nChiffre d’affaires\nsocial 72,2 72,3 -0,2% En MDH T1-2024 T1-2023 Variation en %\nChiffre d’affaires\n• T1 : correspond au 1er trimestre de l’exercice consolidé 70,6 71,1 -0,7%\nMaghreb Oxygène maintient sa dynamique commerciale. Au titre • T1 : correspond au 1er trimestre de l’exercice\ndu 1er trimestre 2024, son chiffre d’affaires se stabilise à 72,3 MDH En termes de situation consolidée, MAGHREB OXYGENE réalise\ncontre 72,2 MDH à la même période de l’année dernière. à fin mars 2024 un chiffre d’affaires de 70,6 MDH, soit un léger\nretrait de -0,7% comparativement à la même période de l’année\nINVESTISSEMENTS (EN MILLIONS DE DIRHAMS) précédente.\nEn MDH T1-2024 T1-2023 INVESTISSEMENTS CONSOLIDÉS (EN MILLIONS DE DIRHAMS)\nInvestissements 4,2 6,3 En MDH T1-2024 T1-2023\nInvestissements 4,2 6,3\nLe total des investissements s’élève à 4,2 MDH au 1er trimestre\n2024, en diminution de -33,1% comparativement à la même Le total des investissements consolidés s’élève à 4,2 MDH à\npériode de l’exercie précédent. Ces investissements portent fin mars 2024 contre 6,3 MDH un an plus tôt.\npour l’essentiel sur les bouteilles, le matériel cryogénique de\nENDETTEMENT FINANCIER NET CONSOLIDÉ : (EN MILLIONS\nstockage et les pièces de rechange diverses destinées aux DE DIRHAMS)\nunités de fabrication.\nEn MDH Au 31/03/2024 Au 31/03/2023\nENDETTEMENT FINANCIER NET : (EN MILLIONS DE DIRHAMS) Endettement financier net 91,1 86,2\nEn MDH Au 31/03/2024 Au 31/03/2023 L’endettement financier net consolidé augmente de 5,7% par\nrapport à la même période de l’exercice précédent, passant\nEndettement financier net 76,8 87,6\nde 86,2 MDH à 91,1 MDH.\nL’endettement financier net au 31 mars 2024 ressort à\nVARIATION DE PÉRIMÈTRE DE CONSOLIDATION :\n76,8 MDH contre 87,6 MDH un an plus tôt, soit une contraction\n• Néant\nde -12,3% sur la période.\n* Indicateurs établis sur la base d’une situation provisoire au 31 mars 2024.\nLe communiqué trimestriel T1 – 2024 est disponible sur notre site internet :\nhttp://www.maghreboxygene.ma/index.php/communiques-de-presse\nContact Communication Financière : OTHMANE KADIRI\nTél. : 05 22 35 22 90 I communication.financiere@akwagroup.com",
    "tables": [
        [
            {
                "En MDH": "Chiffre d’affaires\nsocial",
                "T1-2024": "72,2",
                "T1-2023": "72,3",
                "Variation en %": "-0,2%"
            }
        ],
        [
            {
                "En MDH": "Chiffre d’affaires\nconsolidé",
                "T1-2024": "70,6",
                "T1-2023": "71,1",
                "Variation en %": "-0,7%"
            }
        ],
        [
            {
                "En MDH": "Investissements",
                "T1-2024": "4,2",
                "T1-2023": "6,3"
            }
        ],
        [
            {
                "En MDH": "Investissements",
                "T1-2024": "4,2",
                "T1-2023": "6,3"
            }
        ],
        [
            {
                "En MDH": "Endettement financier net",
                "Au 31/03/2024": "91,1",
                "Au 31/03/2023": "86,2"
            }
        ],
        [
            {
                "En MDH": "Endettement financier net",
                "Au 31/03/2024": "76,8",
                "Au 31/03/2023": "87,6"
            }
        ]
    ]
}