{
    "text": "COMMUNIQUÉ DE PRESSE\nRabat, le 25 avril 2024\nRÉSULTATS CONSOLIDÉS DU 1er TRIMESTRE 2024\nDes résultats en croissance pour un début d’année encourageant :\n» Progression de la base client du Groupe (+2,7%) à 77,1 millions de clients ;\n» Croissance du chiffre d’affaires consolidé de 1,2%* portée par la performance des filiales ;\n» Hausse du chiffre d’affaires de la Data Mobile des filiales Moov Africa (+21,7%*) et de la Data\nFixe au Maroc (+7,6% tirée par la performance de l’activité FTTH) ;\n» Hausse de l’EBITDA ajusté du Groupe de 1,7%*, avec +1,4% pour le Maroc et +2,0%* pour les\nfiliales ;\n» Maintien d’un niveau soutenu d’investissement Groupe.\nLe Groupe Maroc Telecom affiche en ce premier trimestre 2024 de bons résultats opérationnels et\nfinanciers, en croissance par rapport à l’année dernière.\nL’activité dans les filiales Moov Africa, l’essor du Très Haut Débit Fixe du Groupe et les efforts\nconstants d’optimisation des coûts permettent au Groupe d’afficher des performances résilientes\nmalgré un environnement très concurrentiel.\nMaroc Telecom continue de s’appuyer sur une stratégie d’investissements ambitieuse pour\ncapitaliser sur la qualité de ses réseaux et se différencier par la performance et la qualité de service.\n*Maintien d’un taux de change constant MAD/Ouguiya/Franc CFA.\n1\nRÉSULTATS CONSOLIDES AJUSTES* DU GROUPE\nVariation\n(IFRS en millions MAD) à change\nT1 2023 T1 2024 Variation\nconstant\n(1)\nChiffre d'affaires 9 093 9 066 -0,3% 1,2%\nEBITDA ajusté 4 637 4 655 0,4% 1,7%\nMarge (%) 51,0% 51,3% 0,3 pt 0,2 pt\nEBITA ajusté 2 890 2 883 -0,3% 0,9%\nMarge (%) 31,8% 31,8% 0,0 pt -0,1 pt\nRésultat Net ajusté Part du Groupe 1 527 1 528 0,1% 0,5%\nMarge (%) 16,8% 16,9% 0,1 pt -0,1 pt\nCAPEX(2) 855 1 280 49,7% 52,4%\nDont fréquences et licences 0 0\nCAPEX/CA (hors fréquences et licences) 9,4% 14,1% 4,7 pt 4,7 pt\nCFFO ajusté 3 400 2 838 -16,5% -15,5%\nDette Nette 15 419 14 909 -3,3% -2,4%\nDette Nette/EBITDA(3) 0,8x 0,7x\n*Les ajustements des indicateurs financiers sont détaillés dans l’annexe 1.\n► Parc\nLa base clients du Groupe atteint 77,1 millions à fin mars 2024, en progression de 2,7%.\n► Chiffre d’affaires\nAu 31 mars 2024, le Groupe Maroc Telecom a réalisé un chiffre d’affaires consolidé(4) de\n9,1 milliards de dirhams, en hausse de 1,2% à taux de change constant(1), soutenu par les\nrevenus à l’International qui progressent de 3,8% à taux de change constant(1) et compensent\nen partie la baisse des revenus au Maroc (-1,3%).\n► Résultat opérationnel avant amortissements\nÀ fin mars 2024, le résultat opérationnel avant amortissements (EBITDA) ajusté du Groupe\nMaroc Telecom est en hausse de 1,7% à taux de change constant(1) pour atteindre 4 655 millions\nde dirhams, grâce à la croissance du chiffre d’affaires et aux efforts continus de maîtrise des\ncoûts opérationnels dans un contexte inflationniste.\nLe taux de marge d’EBITDA ajusté se maintient au niveau élevé de 51,3% en progression de\n0,2 pt à taux de change constant(1).\n► Résultat opérationnel\nÀ fin mars 2024, le résultat opérationnel (EBITA)(5) ajusté du Groupe Maroc Telecom s’établit à\n2 883 millions de dirhams, en hausse de 0,9% à taux de change constant(1). Le taux de marge\nd’exploitation ajusté se mantient à 31,8%.\n2\n► Résultat Net Part du Groupe\nAu premier trimestre 2024, le Résultat Net ajusté Part du Groupe ressort à 1 528 millions de\ndirhams, en hausse de 0,5% à taux de change constant(1).\n► Cash Flow\nLes flux nets de trésorerie opérationnels (CFFO(6)) ajustés s’établissent à 2 838 millions de\ndirhams, en baisse de 15,5% à taux de change constant(1) par rapport à la même période de\n2023 du fait de l’augmentation des investissements.\n3\nREVUE DES ACTIVITES DU GROUPE\nLes ajustements des indicateurs financiers « Maroc » et « International » sont détaillés dans\nl’annexe 1.\n Maroc\n(IFRS en millions MAD)\nT1 2023 T1 2024 Variation\nChiffre d'affaires 4 783 4 723 -1,3%\nMobile 2 833 2 713 -4,2%\nServices 2 691 2 586 -3,9%\nÉquipements et autres revenus 142 126 -11,1%\nFixe 2 386 2 461 3,1%\nDont Data Fixe* 1 056 1 137 7,6%\nÉlimination et autres revenus -436 -450\nEBITDA ajusté 2 626 2 662 1,4%\nMarge (%) 54,9% 56,4% 1,5 pt\nEBITA ajusté 1 753 1 824 4,0%\nMarge (%) 36,7% 38,6% 2,0 pt\nCAPEX(2) 416 529 26,9%\nDont fréquences et licences 0 0\nCAPEX/CA (hors fréquences et licences) 8,7% 11,2% 2,5 pt\nCFFO ajusté 2 061 1 878 -8,9%\nDette Nette 8 539 7 038 -17,6%\nDette Nette/EBITDA(3) 0,8x 0,6x\n*La Data Fixe regroupe l’Internet, la TV sur ADSL et les services Data aux entreprises.\nÀ fin mars 2024, les activités au Maroc affichent une baisse de 1,3% et atteignent 4 723 millions\nde dirhams. La croissance des activités de l’Internet Fixe (+7,6% tirée par la performance de\nl’activité FTTH) compense partiellement la baisse du Mobile au Maroc (-4,2%).\nLe résultat opérationnel avant amortissement (EBITDA) ajusté s’élève à 2 662 millions de\ndirhams, en hausse de 1,4% par rapport à la même période de l’année précédente grâce à la\nmaîtrise des charges opérationnelles. Le taux de marge d’EBITDA ajusté augmente de 1,5 pt\nsur un an et s’établit au niveau élevé de 56,4%.\nLe résultat opérationnel (EBITA)(5) ajusté ressort à 1 824 millions de dirhams, en croissance de\n4,0% grâce notamment à la hausse de l’EBITDA. Le taux de marge d’EBITA ajusté s’établit à\n38,6% en hausse de 2,0 pt par rapport à 2023.\nÀ fin mars 2024, les flux nets de trésorerie opérationnels (CFFO(6)) ajustés reculent de 8,9% pour\natteindre 1 878 millions de dirhams.\n4\nMobile\nUnité 31/03/2023 31/03/2024 Variation\nParc(8) (000) 19 159 19 323 0,9%\nPrépayé (000) 16 719 16 800 0,5%\nPostpayé (000) 2 440 2 523 3,4%\nDont Internet 3G/4G+(9) (000) 10 939 11 153 2,0%\nARPU(10) (MAD/mois) 45,7 42,7 -6,6%\nÀ fin mars 2024, le parc(8) Mobile compte 19,3 millions de clients, en hausse de 0,9% sur un an\navec un parc postpayé en hausse de 3,4% sur la même période.\nAu terme du premier trimestre 2024, le chiffre d’affaires Mobile affiche une baisse de 4,2% par\nrapport à la même période de l’année précédente.\nL’ARPU(10) mixte à fin mars 2024 s’élève à 42,7 dirhams, en retrait de 6,6% sur un an.\nFixe et Internet\nUnité 31/03/2023 31/03/2024 Variation\nLignes Fixe (000) 1 899 1 747 -8,0%\nAccès Haut Débit(11) (000) 1 677 1 536 -8,5%\nLe parc Fixe s’établit à plus de 1,7 million de lignes à fin mars 2024, en baisse de 8,0%.\nLes activités Fixe et Internet génèrent un chiffre d’affaires de 2,5 milliards de dirhams, en hausse\nde 3,1% par rapport à 2023. La croissance de la Data Fixe (+7,6%) compense la baisse de la\nVoix.\n5\n International\nIndicateurs financiers\nVariation\nà change\n(IFRS en millions MAD) T1 2023 T1 2024 Variation\nconstant\n(1)\nChiffre d'affaires 4 593 4 632 0,8% 3,8%\nDont services Mobile 4 238 4 248 0,3% 3,2%\nEBITDA ajusté 2 011 1 993 -0,9% 2,0%\nMarge (%) 43,8% 43,0% -0,8 pt -0,8 pt\nEBITA ajusté 1 137 1 059 -6,9% -3,9%\nMarge (%) 24,8% 22,9% -1,9 pt -1,9 pt\nCAPEX(2) 438 751 71,4% 76,5%\nDont fréquences et licences 0 0\nCAPEX/CA (hors fréquences et licences) 9,5% 16,2% 6,7 pt 6,7 pt\nCFFO ajusté 1 339 960 -28,3% -25,6%\nDette Nette 7 135 7 936 11,2% 13,2%\nDette Nette/EBITDA(3) 0,8x 0,9x\nAu cours du premier trimestre 2024, les activités du Groupe à l’International enregistrent un\nchiffre d’affaires de 4,6 milliards de dirhams, en hausse de 3,8% à taux de change constant(1),\nportées par la croissance de la Data Mobile (+21,7% à taux de change constant(1)) et de la\nData Fixe (+19,1% à taux de change constant(1)). Hors baisse des terminaisons d’appel, les\nrevenus des filiales progressent de 4,4% à taux de change constant(1).\nSur la même période, le résultat opérationnel avant amortissements (EBITDA) ajusté s’établit\nà 1 993 millions de dirhams, en hausse de 2,0% à taux de change constant(1) par rapport au\npremier trimestre 2023 grâce à la croissance du chiffre d’affaires.\nLe résultat opérationnel (EBITA)(5) ajusté du premier trimestre 2024 atteint 1 059 millions de\ndirhams, en retrait de 3,9% à taux de change constant(1).\nLes flux nets de trésorerie opérationnels ajustés (CFFO(6)) ressortent à 960 millions de dirhams\nà fin mars 2024, en recul de 25,6% à taux de change constant(1) sous l’effet principalement de\nla hausse des investissements.\n6\nIndicateurs opérationnels\nUnité 31/03/2023 31/03/2024 Variation\nMobile\nParc(8) (000) 51 780 53 872\nMauritanie 2 735 2 339 -14,5%\nBurkina Faso 10 994 11 691 6,3%\nGabon 1 570 1 636 4,2%\nMali 9 009 8 479 -5,9%\nCôte d’Ivoire 10 193 10 650 4,5%\nBénin 5 515 6 050 9,7%\nTogo 2 824 2 917 3,3%\nNiger 2 924 3 425 17,1%\nCentrafrique 219 268 22,2%\nTchad 5 797 6 418 10,7%\nFixe\nParc (000) 363 391\nMauritanie 46 21 -54,7%\nBurkina Faso 76 71 -6,0%\nGabon 46 57 22,4%\nMali 195 242 24,2%\nHaut Débit Fixe\nParc (11) (000) 165 219\nMauritanie 20 23 15,5%\nBurkina Faso 17 31 86,9%\nGabon 43 54 27,3%\nMali 86 110 28,1%\n7\nNotes :\n(1) Maintien d’un taux de change constant MAD/Ouguiya/Franc CFA.\n(2) Les CAPEX correspondent aux acquisitions d’immobilisations corporelles et incorporelles comptabilisées sur la\npériode.\n(3) Le ratio Dette Nette/EBITDA exclut l’impact de la norme IFRS16 et tient compte de l’annualisation de l’EBITDA.\n(4) Maroc Telecom consolide dans ses comptes la société Casanet ainsi que les filiales Moov Africa en Mauritanie,\nBurkina Faso, Gabon, Mali, Côte d’Ivoire, Bénin, Togo, Niger, Centrafrique, et Tchad.\n(5) L’EBITA correspond au résultat opérationnel avant les amortissements des actifs incorporels liés aux\nregroupements d’entreprises, les dépréciations des écarts d’acquisition et autres actifs incorporels liés aux\nregroupements d’entreprises et les autres produits et charges liés aux opérations d’investissements financiers et aux\nopérations avec les actionnaires (sauf lorsqu’elles sont directement comptabilisées en capitaux propres).\n(6) Le CFFO comprend les flux nets de trésorerie provenant des activités d’exploitation avant impôts, tels que\nprésentés dans le tableau des flux de trésorerie, ainsi que les dividendes reçus des sociétés mises en équivalence\net des participations non consolidées. Il comprend aussi les investissements industriels nets, qui correspondent aux\nsorties nettes de trésorerie liées aux acquisitions et cessions d’immobilisations corporelles et incorporelles.\n(7) Emprunts et autres passifs courants et non courants moins Trésorerie (et équivalents de trésorerie) y compris le\ncash bloqué pour emprunts bancaires.\n(8) Le parc actif est constitué des clients prépayés, ayant émis ou reçu un appel Voix (hors appel en provenance de\nl’ERPT concerné ou de ses Centres de Relations Clients) ou émis un SMS/MMS ou ayant fait usage des services\nData (hors échanges de données techniques avec le réseau de l’ERPT concerné) durant les trois derniers mois, et\ndes clients postpayés non résiliés.\n(9) Le parc actif de l’Internet Mobile 3G et 4G+ inclut les détenteurs d’un contrat d’abonnement postpayé (couplé ou\nnon avec une offre Voix) et les détenteurs d’une souscription de type prépayé au service Internet ayant effectué au\nmoins une recharge durant les trois derniers mois ou dont le crédit est valide et qui ont utilisé le service durant cette\npériode.\n(10) L’ARPU se définit comme le chiffre d’affaires (généré par les appels entrants et sortants et par les services de\ndonnées) net des promotions, hors roaming et ventes d’équipement, divisé par le parc moyen de la période. Il s’agit\nici de l’ARPU mixte des segments prépayé et postpayé.\n(11) Le parc Haut Débit inclut les accès ADSL, FTTH, les liaisons louées ainsi que le parc CDMA au Mali.\nAvertissement Important :\nDéclarations prospectives. Le présent communiqué de presse contient des déclarations et éléments de nature prévisionnelle relatifs à la\nsituation financière, aux résultats des opérations, à la stratégie et aux perspectives de Maroc Telecom ainsi qu’aux impacts de certaines\nopérations. Même si Maroc Telecom estime que ces déclarations prospectives reposent sur des hypothèses raisonnables, elles ne\nconstituent pas des garanties quant à la performance future de la société. Les résultats effectifs peuvent être très différents des déclarations\nprospectives en raison d'un certain nombre de risques et d'incertitudes connus ou inconnus, dont la plupart sont hors de notre contrôle,\nnotamment les risques décrits dans les documents publics déposés par Maroc Telecom auprès de l’Autorité Marocaine du marché des\ncapitaux (www.ammc.ma) et de l'Autorité des Marchés Financiers (www.amf-france.org), également disponibles en langue française sur\nnotre site (www.iam.ma). Le présent communiqué de presse contient des informations prospectives qui ne peuvent s'apprécier qu'au jour\nde sa diffusion. Maroc Telecom ne prend aucun engagement de compléter, mettre à jour ou modifier ces déclarations prospectives en raison\nd’une information nouvelle, d’un évènement futur ou de tout autre raison, sous réserve de la réglementation applicable notamment les articles\n2.19 et suivants de la circulaire de l’autorité marocaine du marché des capitaux et 223-1 et suivants du règlement général de l’Autorité des\nMarchés Financiers.\nMaroc Telecom est un opérateur global de télécommunications au Maroc, leader sur l’ensemble de ses segments d’activités, Fixe,\nMobile et Internet. Il s’est développé à l’international et est aujourd’hui présent dans onze pays en Afrique. Maroc Telecom est coté\nsimultanément à Casablanca et à Paris et ses actionnaires de référence sont la Société de Participation dans les\nTélécommunications (SPT)* (53%) et le Royaume du Maroc (22%).\n* SPT est une société de droit marocain contrôlée par Etisalat.\nContacts\nRelations investisseurs Relations presse\nrelations.investisseurs@iam.ma relations.presse@iam.ma\n8\nAnnexe 1 : Passage des indicateurs financiers ajustés aux indicateurs financiers publiés\nL’EBITDA ajusté, l’EBITA ajusté, le Résultat Net ajusté Part du Groupe et le CFFO ajusté, sont\ndes indicateurs à caractère non strictement comptable et doivent être considérés comme des\ninformations complémentaires. Ils illustrent mieux les performances du Groupe en excluant les\néléments exceptionnels.\nT1 2023 T1 2024\n(en millions MAD) Maroc International Groupe Maroc International Groupe\nEBITDA ajusté 2 626 2 011 4 637 2 662 1 993 4 655\nCharges exceptionnelles -70 -70\nEBITDA publié 2 626 2 011 4 637 2 592 1 993 4 585\nEBITA ajusté 1 753 1 137 2 890 1 824 1 059 2 883\nCharges exceptionnelles -70 -70\nEBITA publié 1 753 1 137 2 890 1 754 1 059 2 813\nRésultat Net ajusté Part du Groupe 1 527 1 528\nAugmentation du taux d'IS -15\nCharges exceptionnelles -50\nRésultat Net publié Part du Groupe 1 527 1 463\nCFFO ajusté 2 061 1 339 3 400 1 878 960 2 838\nCharges exceptionnelles -70 -70\nCFFO publié 2 061 1 339 3 400 1 808 960 2 768\nAnnexe 2 : Impact de la norme IFRS 16\nÀ fin mars 2024, les impacts de l'application de la norme IFRS16 sur les principaux indicateurs\nde Maroc Telecom se présentent comme suit :\nT1 2023 T1 2024\n(en millions MAD) Maroc International Groupe Maroc International Groupe\nEBITDA ajusté 65 78 143 67 76 143\nEBITA ajusté 4 11 15 2 12 14\nRésultat Net ajusté Part du Groupe -3 -5\nCFFO ajusté 65 78 143 67 76 143\nDette Nette 792 824 1 615 809 777 1 586\n9",
    "tables": [
        [
            {
                "T1 2023": "",
                "T1 2024": "",
                "Variation": "à change",
                "": ""
            },
            {
                "T1 2023": "",
                "T1 2024": "",
                "Variation": "constant",
                "": ""
            },
            {
                "T1 2023": "",
                "T1 2024": "",
                "Variation": "(1)",
                "": ""
            }
        ],
        [
            {
                "": "",
                "(IFRS en millions MAD)": "",
                "T1 2023": "4 783",
                "T1 2024": "4 723",
                "Variation": "-1,3%"
            },
            {
                "": "",
                "(IFRS en millions MAD)": "",
                "T1 2023": "2 833",
                "T1 2024": "2 713",
                "Variation": "-4,2%"
            },
            {
                "": "",
                "(IFRS en millions MAD)": "",
                "T1 2023": "2 691",
                "T1 2024": "2 586",
                "Variation": "-3,9%"
            },
            {
                "": "",
                "(IFRS en millions MAD)": "",
                "T1 2023": "142",
                "T1 2024": "126",
                "Variation": "-11,1%"
            },
            {
                "": "",
                "(IFRS en millions MAD)": "",
                "T1 2023": "2 386",
                "T1 2024": "2 461",
                "Variation": "3,1%"
            },
            {
                "": "",
                "(IFRS en millions MAD)": "",
                "T1 2023": "1 056",
                "T1 2024": "1 137",
                "Variation": "7,6%"
            },
            {
                "": "",
                "(IFRS en millions MAD)": "",
                "T1 2023": "-436",
                "T1 2024": "-450",
                "Variation": ""
            },
            {
                "": "",
                "(IFRS en millions MAD)": "",
                "T1 2023": "2 626",
                "T1 2024": "2 662",
                "Variation": "1,4%"
            },
            {
                "": "",
                "(IFRS en millions MAD)": "",
                "T1 2023": "54,9%",
                "T1 2024": "56,4%",
                "Variation": ""
            },
            {
                "": "",
                "(IFRS en millions MAD)": "",
                "T1 2023": "1 753",
                "T1 2024": "1 824",
                "Variation": "4,0%"
            },
            {
                "": "",
                "(IFRS en millions MAD)": "",
                "T1 2023": "36,7%",
                "T1 2024": "38,6%",
                "Variation": ""
            },
            {
                "": "",
                "(IFRS en millions MAD)": "",
                "T1 2023": "416",
                "T1 2024": "529",
                "Variation": "26,9%"
            },
            {
                "": "",
                "(IFRS en millions MAD)": "",
                "T1 2023": "0",
                "T1 2024": "0",
                "Variation": ""
            },
            {
                "": "",
                "(IFRS en millions MAD)": "",
                "T1 2023": "8,7%",
                "T1 2024": "11,2%",
                "Variation": ""
            },
            {
                "": "",
                "(IFRS en millions MAD)": "",
                "T1 2023": "2 061",
                "T1 2024": "1 878",
                "Variation": "-8,9%"
            },
            {
                "": "",
                "(IFRS en millions MAD)": "",
                "T1 2023": "8 539",
                "T1 2024": "7 038",
                "Variation": "-17,6%"
            }
        ],
        [
            {
                "null": "",
                "": "",
                "Unité": "",
                "31/03/2023": "",
                "31/03/2024": "",
                "Variation": ""
            },
            {
                "null": "",
                "": "",
                "Unité": "",
                "31/03/2023": "",
                "31/03/2024": "",
                "Variation": ""
            },
            {
                "null": "",
                "": "",
                "Unité": "",
                "31/03/2023": "",
                "31/03/2024": "",
                "Variation": ""
            },
            {
                "null": "",
                "": "",
                "Unité": "",
                "31/03/2023": "",
                "31/03/2024": "",
                "Variation": ""
            },
            {
                "null": "",
                "": "",
                "Unité": "",
                "31/03/2023": "",
                "31/03/2024": "",
                "Variation": ""
            },
            {
                "null": "",
                "": "",
                "Unité": "",
                "31/03/2023": "",
                "31/03/2024": "",
                "Variation": ""
            }
        ],
        [
            {
                "null": "",
                "Unité": "",
                "": "",
                "31/03/2023": "",
                "31/03/2024": "",
                "Variation": ""
            }
        ],
        [
            {
                "(IFRS en millions MAD)": "",
                "T1 2023": "",
                "T1 2024": "",
                "Variation": "à change",
                "": ""
            },
            {
                "(IFRS en millions MAD)": "",
                "T1 2023": "",
                "T1 2024": "",
                "Variation": "constant",
                "": ""
            },
            {
                "(IFRS en millions MAD)": "",
                "T1 2023": "",
                "T1 2024": "",
                "Variation": "(1)",
                "": ""
            },
            {
                "(IFRS en millions MAD)": "Chiffre d'affaires",
                "T1 2023": "4 593",
                "T1 2024": "4 632",
                "Variation": "",
                "": ""
            },
            {
                "(IFRS en millions MAD)": "Dont services Mobile",
                "T1 2023": "4 238",
                "T1 2024": "4 248",
                "Variation": "",
                "": ""
            },
            {
                "(IFRS en millions MAD)": "EBITDA ajusté",
                "T1 2023": "2 011",
                "T1 2024": "1 993",
                "Variation": "",
                "": ""
            },
            {
                "(IFRS en millions MAD)": "Marge (%)",
                "T1 2023": "43,8%",
                "T1 2024": "43,0%",
                "Variation": "",
                "": ""
            },
            {
                "(IFRS en millions MAD)": "EBITA ajusté",
                "T1 2023": "1 137",
                "T1 2024": "1 059",
                "Variation": "",
                "": ""
            },
            {
                "(IFRS en millions MAD)": "Marge (%)",
                "T1 2023": "24,8%",
                "T1 2024": "22,9%",
                "Variation": "",
                "": ""
            },
            {
                "(IFRS en millions MAD)": "CAPEX(2)",
                "T1 2023": "",
                "T1 2024": "",
                "Variation": "",
                "": ""
            },
            {
                "(IFRS en millions MAD)": "Dont fréquences et licences",
                "T1 2023": "",
                "T1 2024": "",
                "Variation": "",
                "": ""
            },
            {
                "(IFRS en millions MAD)": "CAPEX/CA (hors fréquences et licences)",
                "T1 2023": "",
                "T1 2024": "",
                "Variation": "",
                "": ""
            },
            {
                "(IFRS en millions MAD)": "CFFO ajusté",
                "T1 2023": "",
                "T1 2024": "",
                "Variation": "",
                "": ""
            },
            {
                "(IFRS en millions MAD)": "Dette Nette",
                "T1 2023": "7 135",
                "T1 2024": "7 936",
                "Variation": "",
                "": ""
            },
            {
                "(IFRS en millions MAD)": "Dette Nette/EBITDA(3)",
                "T1 2023": "0,8x",
                "T1 2024": "0,9x",
                "Variation": "",
                "": ""
            }
        ],
        [
            {
                "": "",
                "Unité": "",
                "31/03/2023": "",
                "31/03/2024": "",
                "Variation": ""
            },
            {
                "": "",
                "Unité": "(000)",
                "31/03/2023": "51 780",
                "31/03/2024": "53 872",
                "Variation": ""
            },
            {
                "": "",
                "Unité": "",
                "31/03/2023": "2 735",
                "31/03/2024": "2 339",
                "Variation": "-14,5%"
            },
            {
                "": "",
                "Unité": "",
                "31/03/2023": "10 994",
                "31/03/2024": "11 691",
                "Variation": "6,3%"
            },
            {
                "": "",
                "Unité": "",
                "31/03/2023": "1 570",
                "31/03/2024": "1 636",
                "Variation": "4,2%"
            },
            {
                "": "",
                "Unité": "",
                "31/03/2023": "9 009",
                "31/03/2024": "8 479",
                "Variation": "-5,9%"
            },
            {
                "": "",
                "Unité": "",
                "31/03/2023": "10 193",
                "31/03/2024": "10 650",
                "Variation": "4,5%"
            },
            {
                "": "",
                "Unité": "",
                "31/03/2023": "5 515",
                "31/03/2024": "6 050",
                "Variation": "9,7%"
            },
            {
                "": "",
                "Unité": "",
                "31/03/2023": "2 824",
                "31/03/2024": "2 917",
                "Variation": "3,3%"
            },
            {
                "": "",
                "Unité": "",
                "31/03/2023": "2 924",
                "31/03/2024": "3 425",
                "Variation": "17,1%"
            },
            {
                "": "",
                "Unité": "",
                "31/03/2023": "219",
                "31/03/2024": "268",
                "Variation": "22,2%"
            },
            {
                "": "",
                "Unité": "",
                "31/03/2023": "5 797",
                "31/03/2024": "6 418",
                "Variation": "10,7%"
            },
            {
                "": "",
                "Unité": "",
                "31/03/2023": "",
                "31/03/2024": "",
                "Variation": ""
            },
            {
                "": "",
                "Unité": "(000)",
                "31/03/2023": "363",
                "31/03/2024": "391",
                "Variation": ""
            },
            {
                "": "",
                "Unité": "",
                "31/03/2023": "46",
                "31/03/2024": "21",
                "Variation": "-54,7%"
            },
            {
                "": "",
                "Unité": "",
                "31/03/2023": "76",
                "31/03/2024": "71",
                "Variation": "-6,0%"
            },
            {
                "": "",
                "Unité": "",
                "31/03/2023": "46",
                "31/03/2024": "57",
                "Variation": "22,4%"
            },
            {
                "": "",
                "Unité": "",
                "31/03/2023": "195",
                "31/03/2024": "242",
                "Variation": "24,2%"
            },
            {
                "": "",
                "Unité": "",
                "31/03/2023": "",
                "31/03/2024": "",
                "Variation": ""
            },
            {
                "": "",
                "Unité": "(000)",
                "31/03/2023": "165",
                "31/03/2024": "219",
                "Variation": ""
            },
            {
                "": "",
                "Unité": "",
                "31/03/2023": "20",
                "31/03/2024": "23",
                "Variation": "15,5%"
            },
            {
                "": "",
                "Unité": "",
                "31/03/2023": "17",
                "31/03/2024": "31",
                "Variation": "86,9%"
            },
            {
                "": "",
                "Unité": "",
                "31/03/2023": "43",
                "31/03/2024": "54",
                "Variation": "27,3%"
            },
            {
                "": "",
                "Unité": "",
                "31/03/2023": "86",
                "31/03/2024": "110",
                "Variation": "28,1%"
            }
        ],
        [
            {
                "(10) L’ARPU se définit comme le chiffre d’affaires (généré par les appels entrants et sortants et par les services de": "données) net des promotions, hors roaming et ventes d’équipement, divisé par le parc moyen de la période. Il s’agit"
            },
            {
                "(10) L’ARPU se définit comme le chiffre d’affaires (généré par les appels entrants et sortants et par les services de": "ici de l’ARPU mixte des segments prépayé et postpayé."
            }
        ],
        [
            {
                "": "(en millions MAD)",
                "T1 2023": "Maroc",
                "null": "Groupe",
                "T1 2024": "Maroc"
            },
            {
                "": "EBITDA ajusté",
                "T1 2023": "2 626 2 011 4 637 2 662",
                "null": "4 655",
                "T1 2024": ""
            },
            {
                "": "Charges exceptionnelles\nEBITDA publié",
                "T1 2023": "",
                "null": "-70\n4 585",
                "T1 2024": "-70\n2 592"
            },
            {
                "": "",
                "T1 2023": "2 626",
                "null": "",
                "T1 2024": ""
            },
            {
                "": "EBITA ajusté",
                "T1 2023": "1 753",
                "null": "2 883",
                "T1 2024": "1 824"
            },
            {
                "": "Charges exceptionnelles\nEBITA publié",
                "T1 2023": "1 753",
                "null": "-70\n2 813",
                "T1 2024": "-70\n1 754"
            },
            {
                "": "",
                "T1 2023": "",
                "null": "",
                "T1 2024": ""
            },
            {
                "": "",
                "T1 2023": "",
                "null": "",
                "T1 2024": ""
            },
            {
                "": "",
                "T1 2023": "",
                "null": "",
                "T1 2024": ""
            },
            {
                "": "",
                "T1 2023": "",
                "null": "",
                "T1 2024": ""
            }
        ],
        [],
        [
            {
                "": "(en millions MAD)",
                "T1 2023": "Maroc",
                "null": "Groupe",
                "T1 2024": "Maroc"
            },
            {
                "": "EBITDA ajusté",
                "T1 2023": "65",
                "null": "",
                "T1 2024": "67"
            },
            {
                "": "EBITA ajusté",
                "T1 2023": "4",
                "null": "",
                "T1 2024": "2"
            },
            {
                "": "",
                "T1 2023": "",
                "null": "",
                "T1 2024": ""
            },
            {
                "": "",
                "T1 2023": "",
                "null": "",
                "T1 2024": "67"
            },
            {
                "": "",
                "T1 2023": "792",
                "null": "",
                "T1 2024": "809"
            }
        ]
    ]
}