{
    "text": "INDICATEURS D’ACTIVITÉ DU 4e TRIMESTRE 2023*\nFAITS MARQUANTS DE LA PÉRIODE :\nNéant.\nPERSPECTIVES\nINDICATEURS SOCIAUX DE MAGHREB OXYGENE\nMAGHREB OXYGENE poursuivra ses efforts dans le but d’améliorer\nCHIFFRE D’AFFAIRES (EN MILLIONS DE DIRHAMS)\nses indicateurs opérationnels et financiers.\nT4- T4- Variation Année Année Variation\nEn MDH 2023 2022 en % 2023 2022 en % INDICATEURS CONSOLIDÉS\nChiffre d’affaires social 81,0 69,3 +16,9 % 295,6 294,8 +0,3 %\nCHIFFRE D’AFFAIRES CONSOLIDÉ (EN MILLIONS DE DIRHAMS)\n• T4 : correspond au 4e trimestre de l’exercice\nT4- T4- Variation Année Année Variation\nAu titre du 4e trimestre 2022, le chiffre d’affaires affiche une En MDH 2023 2022 en % 2023 2022 en %\nChiffre d’affaires consolidé 79,4 68,4 +16,1 % 290,6 291,0 -0,2 %\ncroissance de 16,9 % comprativement à la même période de\nl’année précédente, passant de 69,3 MDH à 81,0 MDH. Cette • T4 : correspond au 4e trimestre de l’exercice\nperformance s’explique par la progression des ventes de gaz,\nEn termes de situation consolidée, le chiffre d’affaires du\nnotamment en industrie.\nquatrième trimestre 2023 s’améliore de 16,1 % comparativement\nAu 31 décembre 2023, le chiffres d’affaire de Maghreb Oxygène\nà la même période de l’année précédente.\nenregistre une légère augmentation de 0,3 % par rapport à 2022\nAu titre de l’exercice 2023, le chiffre d’affaires consolidé s’établit\npour s’établir à 295,6 MDH.\nà 290,6 MDH, en léger retrait de 0,2 % par rapport à 2022.\nINVESTISSEMENTS (EN MILLIONS DE DIRHAMS)\nINVESTISSEMENTS CONSOLIDÉS (EN MILLIONS DE DIRHAMS)\nEn MDH T4-2023 T4-2022 Année 2023 Année 2022\nEn MDH T4-2023 T4-2022 Année 2023 Année 2022\nInvestissements 9,5 7,9 27,2 19,5\nInvestissements 9,5 7,9 27,2 19,5\nLes investissements réalisés pour le 4e trimestre de l’année 2023 Sur le volet des investissements consolidés, l’enveloppe passe\ns’élèvent à 9,5 MDH contre 7,9 MDH en 2022, soit une hausse de 7,9 MDH au 4e trimestre 2022 à 9,5 MDH au titre de la même\nde 20,0 % comparativement à la même période de l’exercice période en 2023.\nprécédent. Ces investissements portent pour l’essentiel sur les Au 31 décembre 2023, Les investissements consolidés augmentent\nbouteilles, le matériel cryogénique de stockage et les pièces de de 39,9 % par rapport à l’exercice précédent, passant de\nrechange diverses destinées aux unités de fabrication. 19,5 MDH à 27,2 MDH.\nAu titre de l’année 2023, les investissements de Maghreb Oxygène\nENDETTEMENT FINANCIER NET CONSOLIDÉ (EN MILLIONS\nsont en croissance de 39,9 % et s’établissent à 27,2 MDH contre\nDE DIRHAMS)\n19,5 MDH un an plus tôt.\nEn MDH Année 2023 Année 2022\nEndettement financier net 85,5 79,0\nENDETTEMENT FINANCIER NET (EN MILLIONS DE DIRHAMS)\nEn MDH Année 2023 Année 2022 L’endettement financier net consolidé de MAGHREB OXYGENE\nEndettement financier net 79,2 68,7 à fin décembre 2023 s’établit à 85,5 MDH contre 79,0 MDH\nun an plus tôt, soit une augmentation de 8,3 %.\nL’endettement financier net à fin décembre 2023 s’affiche à\n79,2 MDH contre 68,7 MDH un an plus tôt, soit une augmentation\nVARIATION DU PÉRIMÈTRE DE CONSOLIDATION :\nde 15,2 % sur la période.\n• Néant\n* Indicateurs établis sur la base d’une situation provisoire au 31 décembre 2023.\nLe communiqué trimestriel T4 – 2023 est disponible sur notre site internet :\nhttp://www.maghreboxygene.ma/index.php/communiques-de-presse\nContact Communication Financière : Othmane KADIRI\nTél. : 05 22 35 22 90 I communication.financiere@akwagroup.com",
    "tables": [
        [
            {
                "En MDH": "Chiffre d’affaires social",
                "T4-\n2023": "81,0",
                "T4-\n2022": "69,3",
                "Variation\nen %": "+0,3 %",
                "Année\n2023": "295,6",
                "Année\n2022": "294,8"
            }
        ],
        [
            {
                "En MDH": "Chiffre d’affaires consolidé",
                "T4-\n2023": "79,4",
                "T4-\n2022": "68,4",
                "Variation\nen %": "-0,2 %",
                "Année\n2023": "290,6",
                "Année\n2022": "291,0"
            }
        ],
        [
            {
                "En MDH": "Investissements",
                "T4-2023": "9,5",
                "T4-2022": "7,9",
                "Année 2023": "27,2",
                "Année 2022": "19,5"
            }
        ],
        [
            {
                "En MDH": "Investissements",
                "T4-2023": "9,5",
                "T4-2022": "7,9",
                "Année 2023": "27,2",
                "Année 2022": "19,5"
            }
        ],
        [
            {
                "En MDH": "Endettement financier net",
                "Année 2023": "85,5",
                "Année 2022": "79,0"
            }
        ],
        [
            {
                "En MDH": "Endettement financier net",
                "Année 2023": "79,2",
                "Année 2022": "68,7"
            }
        ]
    ]
}