{
    "text": "COMMUNIQUÉ FINANCIER\n1er Trimestre\n2024\nCONSOLIDÉ Chiffre d’affaires (+10%)\n656\nMMAD de\nChiffre d’Affaires en croissance\nChiffre d’affaires\n+10%, soit\nconsolidé\nSothema a enregistré une hausse de son chiffre d’affaires consolidé qui s’est élevée\n+59 MMAD par\nà +10% à fin mars 2024, soit 656 MMAD contre 597 MMAD à la même période de\nrapport au l’exercice précédent. Cette croissance a été soutenue par la dynamique commerciale\nT1-2023 de Sothema et de ses filiales, notamment Axess Pharma au Maroc et West Afric\n656\né Pharma au Sénégal.\nd\nilo 597\nsn\no\nc\nse En MMAD mars-24 mars-23 Var Evol. %\nria\nffa Chiffre d'affaires 656 597 5 9 10%\n’d\ne\nrffih\nC\nMars-2024 Mars-2023\nInvestissement et endettement net Consolidé\nÀ fin mars 2024, Sothema a investi 83 MMAD contre 13 MMAD à la\nmême période de l’exercice précédent. Les investissements ont 506\nconcerné divers projets devant augmenter ses capacités industrielles 448\net technologiques. 83\nL'endettement net consolidé a atteint 506 MMAD à la fin du premier\nt hr aim use ss etr e\nd\ne2 50 82 4\nM\nMco An Dtr .e 448 MMAD à fin décembre 2023 3, s 2oi %t u ne tn\ne\nm\ne\nte\nn\ntn\ne\nm\nL\nt tr ri\nie\nm m e\neg\ns\nse\nt\nta\nr re\neri n\n22\n0g\n0 2 2\n3s\n4\n.’ ,é l cè ov ne\nt\nreà 33 02 %% àà\nl\nal a\nf\ninfi n\nd\nud u\nq\nup ar tre ièm mie er\nGearing\nssitse\nv n I 13\ne\ntte\nd n E\nMars-2024 Mars-2023 mars-2024 Déc-2023\nSOCIAL Chiffre d’affaires (+8%)\nCroissance des ventes de Sothema\n612\nSothema a enregistré une croissance de 8% de son chiffre d’affaires à la fin du premier 567\ntrimestre 2024, soit 612 MMAD contre 567 MMAD réalisés à la même période en 2023.\nse\nria\n612\nMMAD de\n+ 8%, soit\nffa\n’d\nChiffre d’affaires\n+45 MMAD par e rffih\nrapport au T1-2023 C\nmars-2024 mars-2023\nLancement de nouveaux produits\nSothema poursuit l’enrichissement de son portefeuille de produits conformément à sa politique qui consiste à améliorer son Time To\nMarket. À fin mars 2024, elle a mis sur le marché deux nouveaux produits à forte valeur ajoutée. Il est prévu, pour le reste de l’exercice\n2024, que Sothema obtienne neuf nouvelles Autorisations de mise sur le marché (AMM) au Maroc et 10 à l’international. Ces AMM\nconcernent des produits pharmaceutiques innovants apportant une valeur additionnelle indéniable au Business Model et des solutions\nthérapeutiques de premier ordre aux patients.\nPERSPECTIVES\nSothema veut contribuer au succès de la CSU\nLa perspective la plus prometteuse aussi bien pour les patients que pour les industriels pharmaceutiques étant la généralisation de la\nCouverture sociale universelle (CSU), Sothema entend contribuer à ce chantier stratégique pour le Maroc en lançant, de préférence en\nfabrication locale, les thérapeutiques les plus innovantes à des tarifs les plus bas, contribuant à l’enrichissement de son portefeuille par des\nproduits générateurs de valeur ainsi qu’à la pérennité du système de l’assurance maladie. Il s’agit d’un engagement sociétal qui vise à\nrenforcer l’arsenal thérapeutique du Maroc et des pays dans lesquels Sothema est implantée avec des traitements toujours innovants,\nchimiques et biologiques, ainsi que des génériques, des biosimilaires, des compléments alimentaires et des dispositifs médicaux. Avec une\ncinquantaine de lancements prévus dans les 3 prochains exercices, Sothema s’attend à un impact significatif sur la croissance de ses revenus\net de sa rentabilité sur le moyen et long terme.\nSOTHEMA, BP n°1 20180-Bouskoura - Maroc Tél : 05.22.43.70.40 LG Fax : 05.22.33.41.09- EMAIL : Sothema@sothema.ma Site : www.sothema.com\nLien vers la communication financière : http://sothema.com/web/publications-financieres/",
    "tables": [
        [
            {
                "": ""
            },
            {
                "": "COMMUNIQUÉ FINANCIER\n1er Trimestre\n2024\nCONSOLIDÉ Chiffre d’affaires (+10%)\n656\nMMAD de\nChiffre d’Affaires en croissance\nChiffre d’affaires\n+10%, soit\nconsolidé\nSothema a enregistré une hausse de son chiffre d’affaires consolidé qui s’est élevée\n+59 MMAD par\nà +10% à fin mars 2024, soit 656 MMAD contre 597 MMAD à la même période de\nrapport au l’exercice précédent. Cette croissance a été soutenue par la dynamique commerciale\nT1-2023 de Sothema et de ses filiales, notamment Axess Pharma au Maroc et West Afric\n656\né Pharma au Sénégal.\nd\nilo 597\nsn\no\nc\nse En MMAD mars-24 mars-23 Var Evol. %\nria\nffa Chiffre d'affaires 656 597 5 9 10%\n’d\ne\nrffih\nC\nMars-2024 Mars-2023\nInvestissement et endettement net Consolidé\nÀ fin mars 2024, Sothema a investi 83 MMAD contre 13 MMAD à la\nmême période de l’exercice précédent. Les investissements ont 506\nconcerné divers projets devant augmenter ses capacités industrielles 448\net technologiques. 83\nL'endettement net consolidé a atteint 506 MMAD à la fin du premier\nte\nt hr aim use ss etr e e2 50 82 4 Mco An Dtr .e 448 MMAD à fin décembre 2023 3, s 2oi %t u ne tn n\ne tn\nd M m e\ne m\nL ie eg se ta eri n 0g 3s .’ ,é l cè ov ne reà 33 02 %% àà al a infi n ud u up ar tre ièm mie er ssitse e\ntte\nt tr ri m m e s t r re 22 0 2 2 4 t l f d q Gearing v n I 13 d n E\nMars-2024 Mars-2023 mars-2024 Déc-2023\nSOCIAL Chiffre d’affaires (+8%)\nCroissance des ventes de Sothema\n612\nSothema a enregistré une croissance de 8% de son chiffre d’affaires à la fin du premier 567\ntrimestre 2024, soit 612 MMAD contre 567 MMAD réalisés à la même période en 2023.\nse\nria\nffa\n612 + 8%, soit\nMMAD de ’d\n+45 MMAD par e rffih\nChiffre d’affaires\nrapport au T1-2023 C\nmars-2024 mars-2023\nLancement de nouveaux produits\nSothema poursuit l’enrichissement de son portefeuille de produits conformément à sa politique qui consiste à améliorer son Time To\nMarket. À fin mars 2024, elle a mis sur le marché deux nouveaux produits à forte valeur ajoutée. Il est prévu, pour le reste de l’exercice\n2024, que Sothema obtienne neuf nouvelles Autorisations de mise sur le marché (AMM) au Maroc et 10 à l’international. Ces AMM\nconcernent des produits pharmaceutiques innovants apportant une valeur additionnelle indéniable au Business Model et des solutions\nthérapeutiques de premier ordre aux patients.\nPERSPECTIVES\nSothema veut contribuer au succès de la CSU\nLa perspective la plus prometteuse aussi bien pour les patients que pour les industriels pharmaceutiques étant la généralisation de la\nCouverture sociale universelle (CSU), Sothema entend contribuer à ce chantier stratégique pour le Maroc en lançant, de préférence en\nfabrication locale, les thérapeutiques les plus innovantes à des tarifs les plus bas, contribuant à l’enrichissement de son portefeuille par des\nproduits générateurs de valeur ainsi qu’à la pérennité du système de l’assurance maladie. Il s’agit d’un engagement sociétal qui vise à\nrenforcer l’arsenal thérapeutique du Maroc et des pays dans lesquels Sothema est implantée avec des traitements toujours innovants,\nchimiques et biologiques, ainsi que des génériques, des biosimilaires, des compléments alimentaires et des dispositifs médicaux. Avec une\ncinquantaine de lancements prévus dans les 3 prochains exercices, Sothema s’attend à un impact significatif sur la croissance de ses revenus\net de sa rentabilité sur le moyen et long terme."
            },
            {
                "": "SOTHEMA, BP n°1 20180-Bouskoura - Maroc Tél : 05.22.43.70.40 LG Fax : 05.22.33.41.09- EMAIL : Sothema@sothema.ma Site : www.sothema.com\nLien vers la communication financière : http://sothema.com/web/publications-financieres/"
            },
            {
                "": ""
            }
        ],
        [],
        [
            {
                "656\nMMAD de": "Chiffre d’affaire\nconsolidé",
                "null": "s"
            }
        ],
        [],
        [],
        [
            {
                "En MMAD": "Chiffre d'affaires",
                "mars-24": "656",
                "mars-23 Var": "597 5 9 10%",
                "Evol. %": ""
            }
        ],
        [
            {
                "null": "",
                "506\n448\nte\nn\ntn\ne\nm\ne\ntte\nd\nn\nE": "",
                "": ""
            },
            {
                "null": "",
                "506\n448\nte\nn\ntn\ne\nm\ne\ntte\nd\nn\nE": "mars-2024 Déc-2023",
                "": ""
            },
            {
                "null": "Chiffre d’affaires (+8%)",
                "506\n448\nte\nn\ntn\ne\nm\ne\ntte\nd\nn\nE": "",
                "": ""
            }
        ],
        [],
        [
            {
                "PERSPECTIVES": "Sothema veut contribuer au succès de la CSU",
                "": ""
            }
        ]
    ]
}