{
    "text": "COMMUNIQUÉ DE PRESSE RÉSULTATS AU 31 MARS 2024 CASABLANCA, LE 14 MAI 2024\nSOLIDITÉ OPÉRATIONNELLE ET FINANCIÈRE AU 31 MARS 2024\n\nExcellence industrielle confirmée par un taux de disponibilité de 93,5%\nHausse significative du Résultat Net Part du Groupe de 16,8%\n\nRenforcement continu de la solidité financière du Groupe\n\nCHIFFRES CLÉS CONSOLIDÉS EN MDH\n31 mars 2024 31 mars 2023 Variation en valeur Variation en %\nChiffre d'affaires 2 959 4 090 -1 131 -27,6%\nEBITDA 1 032 934 98 10,5%\nRésultat d'exploitation 822 732 89 12,2%\nRésultat financier -110 -99 -11 -10,8%\nRésultat net consolidé 364 328 36 11,1%\nRésultat net - Part du Groupe 284 243 41 16,8%\nIntérêts minoritaires 80 85 -5 -5,4%\nInvestissements consolidés (*) 22 15 7 47%\nEndettement net consolidé (*) 4 401 4 774 -373 -7,8%\n(*) Au 31 mars 2024, les comptes de JLEC 5&6 pris en compte pour la consolidation correspondent à l’arrêté du 1er Octobre 2023 au 31 décembre 2023, conformément\naux méthodes de consolidation adoptées par le Groupe TAQA Morocco.\nPERFORMANCE OPÉRATIONNELLE SOLIDE AU PREMIER TRIMESTRE essentiellement sur les projets d’exploitation et de maintenance\n2024 des Unités. L’endettement net a connu une amélioration de 7,8%,\nqui confirme le renforcement de la solidité financière du Groupe\nDurant le premier trimestre 2024, le Groupe TAQA Morocco a réalisé\nTAQA Morocco.\nune inspection de 11 jours au niveau de l’Unité 3 en adéquation avec\nle plan de maintenance. L’exécution réussie du plan de maintenance a ÉVOLUTION DU PÉRIMÈTRE DE CONSOLIDATION\npermis d’atteindre un taux de disponibilité global de 93,5%, comparé\nLe périmètre de consolidation de TAQA Morocco au 31 mars\nà 97,9% au premier trimestre 2023.\n2024 a connu l’intégration de la filiale TMGE (TAQA Morocco\nÉVOLUTION DU CHIFFRE D’AFFAIRES EN LIGNE AVEC LA TENDANCE Green Energy) qui portera les projets de développement vers les\nDES PRIX DU CHARBON ET AUGMENTATION DU RÉSULTAT NET PART énergies bas carbone.\nDU GROUPE\nPERSPECTIVES\nTAQA Morocco a réalisé un chiffre d’affaires consolidé de 2 959 MDH\nTAQA Morocco continue de capitaliser sur ses fondamentaux en\nau premier trimestre 2024, suite à la baisse du prix du charbon sur\nmatière d’excellence opérationnelle et de solidité financière afin\nle marché international et à la bonne performance opérationnelle\nd’optimiser davantage ses coûts de production et de déployer ses\ndes 6 unités de la centrale. La solide performance opérationnelle du\ndifférentes initiatives de développement stratégique. TAQA Morocco\ntrimestre a contribué à la nette amélioration du résultat d’exploitation\nest résolument engagée à exécuter son plan de développement\nconsolidé qui s’établit à 822 MDH, en hausse de 12,2%.\nstratégique dans la production d’énergie bas carbone et le\nAu terme du premier trimestre, le résultat net part du Groupe s’établit dessalement d’eau de mer.\nà 284 MDH, marquant une progression significative de 16,8% par\nrapport à 2023, reflétant la robustesse financière du Groupe.\nAUGMENTATION DES INVESTISSEMENTS ET RENFORCEMENT DE LA\nSOLIDITÉ FINANCIÈRE\nEn ligne avec son engagement continu envers l’amélioration de la\nperformance opérationnelle, les investissements du Groupe au titre\ndu trimestre s’élèvent à 22 MDH, en augmentation de 47%, et portent\nÀ propos de TAQA Morocco Filiale d’Abu Dhabi National Energy Company «TAQA»\nTAQA Morocco est le premier producteur privé d’électricité au Maroc. Créée en 1997, l’entreprise est le fruit de la volonté du TAQA Morocco • Siège Social : Km 23, Route secondaire 301\nRoyaume du Maroc de renforcer son mix énergétique pour se doter des ressources nécessaires à son industrialisation et son Commune Moulay Abdellah - province d’El jadida - Centrale Thermique Jorf\nessor économique. TAQA Morocco est le leader de production privée d’électricité et contribue à 35% de la demande nationale Lasfar - B.P.99 - Sidi Bouzid - El Jadida - Maroc\nd’électricité pour 18% de la capacité installée. Côtée à la Bourse de Casablanca depuis décembre 2013, TAQA Morocco se Tél : +212 523 380 000 - Fax : +212 523 345 375\npositionne en opérateur énergétique de référence au Maroc avec l’ambition d’accompagner la stratégie bas carbone du mix Contact : finance@taqamorocco.ma\nénergétique marocain et de soutenir le plan national de l’eau.\nRetrouvez ce communiqué de TAQA Morocco sur\nhttps://www.taqamorocco.ma/fr/investisseurs/communiques-et-comptes",
    "tables": [
        [
            {
                "": "",
                "null": ""
            },
            {
                "": "COMMUNIQUÉ DE PRESSE RÉSULTATS",
                "null": "AU 31 MARS 2024 CASABLANCA, LE 14 MAI 2024"
            },
            {
                "": "SOLIDITÉ OPÉRATIONNELLE ET FINANCIÈRE AU 31 MARS 2024\nExcellence industrielle confirmée par un taux de disponibilité de 93,5%\n\nHausse significative du Résultat Net Part du Groupe de 16,8%\n\nRenforcement continu de la solidité financière du Groupe\n\nCHIFFRES CLÉS CONSOLIDÉS EN MDH\n31 mars 2024 31 mars 2023 Variation en valeur Variation en %\nChiffre d'affaires 2 959 4 090 -1 131 -27,6%\nEBITDA 1 032 934 98 10,5%\nRésultat d'exploitation 822 732 89 12,2%\nRésultat financier -110 -99 -11 -10,8%\nRésultat net consolidé 364 328 36 11,1%\nRésultat net - Part du Groupe 284 243 41 16,8%\nIntérêts minoritaires 80 85 -5 -5,4%\nInvestissements consolidés (*) 22 15 7 47%\nEndettement net consolidé (*) 4 401 4 774 -373 -7,8%\n(*) Au 31 mars 2024, les comptes de JLEC 5&6 pris en compte pour la consolidation correspondent à l’arrêté du 1er Octobre 2023 au 31 décembre 2023, conformément\naux méthodes de consolidation adoptées par le Groupe TAQA Morocco.\nPERFORMANCE OPÉRATIONNELLE SOLIDE AU PREMIER TRIMESTRE essentiellement sur les projets d’exploitation et de maintenance\n2024 des Unités. L’endettement net a connu une amélioration de 7,8%,\nqui confirme le renforcement de la solidité financière du Groupe\nDurant le premier trimestre 2024, le Groupe TAQA Morocco a réalisé\nTAQA Morocco.\nune inspection de 11 jours au niveau de l’Unité 3 en adéquation avec\nle plan de maintenance. L’exécution réussie du plan de maintenance a ÉVOLUTION DU PÉRIMÈTRE DE CONSOLIDATION\npermis d’atteindre un taux de disponibilité global de 93,5%, comparé\nLe périmètre de consolidation de TAQA Morocco au 31 mars\nà 97,9% au premier trimestre 2023.\n2024 a connu l’intégration de la filiale TMGE (TAQA Morocco\nÉVOLUTION DU CHIFFRE D’AFFAIRES EN LIGNE AVEC LA TENDANCE Green Energy) qui portera les projets de développement vers les\nDES PRIX DU CHARBON ET AUGMENTATION DU RÉSULTAT NET PART énergies bas carbone.\nDU GROUPE\nPERSPECTIVES\nTAQA Morocco a réalisé un chiffre d’affaires consolidé de 2 959 MDH\nTAQA Morocco continue de capitaliser sur ses fondamentaux en\nau premier trimestre 2024, suite à la baisse du prix du charbon sur\nmatière d’excellence opérationnelle et de solidité financière afin\nle marché international et à la bonne performance opérationnelle\nd’optimiser davantage ses coûts de production et de déployer ses\ndes 6 unités de la centrale. La solide performance opérationnelle du\ndifférentes initiatives de développement stratégique. TAQA Morocco\ntrimestre a contribué à la nette amélioration du résultat d’exploitation\nest résolument engagée à exécuter son plan de développement\nconsolidé qui s’établit à 822 MDH, en hausse de 12,2%.\nstratégique dans la production d’énergie bas carbone et le\nAu terme du premier trimestre, le résultat net part du Groupe s’établit dessalement d’eau de mer.\nà 284 MDH, marquant une progression significative de 16,8% par\nrapport à 2023, reflétant la robustesse financière du Groupe.\nAUGMENTATION DES INVESTISSEMENTS ET RENFORCEMENT DE LA\nSOLIDITÉ FINANCIÈRE\nEn ligne avec son engagement continu envers l’amélioration de la\nperformance opérationnelle, les investissements du Groupe au titre\ndu trimestre s’élèvent à 22 MDH, en augmentation de 47%, et portent\nÀ propos de TAQA Morocco Filiale d’Abu Dhabi National Energy Company «TAQA»\nTAQA Morocco est le premier producteur privé d’électricité au Maroc. Créée en 1997, l’entreprise est le fruit de la volonté du TAQA Morocco • Siège Social : Km 23, Route secondaire 301\nRoyaume du Maroc de renforcer son mix énergétique pour se doter des ressources nécessaires à son industrialisation et son Commune Moulay Abdellah - province d’El jadida - Centrale Thermique Jorf\nessor économique. TAQA Morocco est le leader de production privée d’électricité et contribue à 35% de la demande nationale Lasfar - B.P.99 - Sidi Bouzid - El Jadida - Maroc\nd’électricité pour 18% de la capacité installée. Côtée à la Bourse de Casablanca depuis décembre 2013, TAQA Morocco se Tél : +212 523 380 000 - Fax : +212 523 345 375\npositionne en opérateur énergétique de référence au Maroc avec l’ambition d’accompagner la stratégie bas carbone du mix Contact : finance@taqamorocco.ma\nénergétique marocain et de soutenir le plan national de l’eau.\nRetrouvez ce communiqué de TAQA Morocco sur\nhttps://www.taqamorocco.ma/fr/investisseurs/communiques-et-comptes",
                "null": ""
            },
            {
                "": "",
                "null": ""
            }
        ],
        [],
        [
            {
                "EBITDA": "Résultat d'exploitation",
                "1 032": "822",
                "934": "732",
                "98": "89",
                "10,5%": "12,2%"
            },
            {
                "EBITDA": "Résultat financier",
                "1 032": "-110",
                "934": "-99",
                "98": "-11",
                "10,5%": "-10,8%"
            }
        ],
        [],
        []
    ]
}