{
    "text": "Résultats au 31 décembre 2023\nComptes Consolidés\nÉTAT DE LA SITUATION FINANCIÈRE AU 31 DÉCEMBRE 2023 B - ÉVÉNEMENTS SIGNIFICATIFS INTERVENUS AU COURS DE LA PÉRIODE\n(en milliers de dirhams) FAITS MARQUANTS\nACTIF 31-déc-23 31-déc-22 À fin décembre 2023, le chiffre d’affaires consolidé s’établit à 8 212 MDH, enregistrant une progression de +2,8%.\nGoodwill 7 372 391 7 372 391 • Le résultat d’exploitation courant s’élève à 2 978 MDH à fin décembre 2023, en progression de +10,5% par rapport\nImmobilisations incorporelles 101 464 106 651 à la même période en 2022. Cette évolution est liée principalement à la hausse du chiffre d’affaires ainsi qu’à\nImmobilisations corporelles 10 300 018 10 806 536 l’optimisation des coûts de production et à la consolidation de la performance opérationnelle.\nImmobilisations en droit d'usage 53 683 52 471\n• Le résultat net consolidé à 1 548 MDH en 2023, est en hausse de +11,2% par rapport à 2022 en raison de\nParticipations dans les entreprises associées 72 137 71 806\nAutres actifs financiers 92 715 96 706 l’évolution favorable du résultat d’exploitation et de la révision, en 2022, de la base d’impôt différé suite à la hausse\nDont Instruments dérivés de couverture progressive de l’IS de 2023 à 2025 prévue dans la loi de finance 2023.\nDont Prêts et créances non courants 92 715 96 706 • Le retour sur capitaux investis s’établit à 9,8%.\nDont Titres disponibles à la vente PERSPECTIVES\nCréances d'impôt et taxes 14 039 51 664\nImpôts différés actifs 3 149 Le secteur cimentier marocain devrait connaître des perspectives favorables avec l’impact positif attendu sur le\nAutres débiteurs non courants marché de la construction du programme d’aide directe au logement et de l’organisation de la CAN 2025 et de la\nActifs non-courants 18 006 450 18 558 374 coupe du monde 2030 au Maroc.\nAutres actifs financiers courants Dans ce contexte, LafargeHolcim Maroc poursuit ses efforts de différenciation commerciale et d’optimisation de\nDont Prêts et créances coûts, tout en continuant la réalisation d’avancées importantes de son programme de développement durable\nStocks et en-cours 644 907 625 726 telles que l’élargissement de la gamme de produits à faible empreinte carbone (notamment les gammes ECOPact\nCréances clients 1 032 640 914 938 et ECOPlanet), l’amélioration de l’efficacité énergétique, le développement de la biodiversité dans les carrières ou\nAutres débiteurs courants 302 112 292 372 l’optimisation de la consommation d’eau des sites industriels.\nTrésorerie et équivalent de trésorerie 153 686 139 957\nPar ailleurs, l’entreprise accélère la mise en œuvre de sa feuille de route de décarbonation, en maximisant\nActifs non courants détenus en vue de la vente\nActifs courants 2 133 345 1 972 993 l’utilisation de l’électricité verte (85% de la consommation en 2023) et des combustibles de substitution et en\nTOTAL ACTIF 20 139 795 20 531 367 optimisant la formulation de ses produits.\nC - PRINCIPES COMPTABLES\nPASSIF 31-déc-23 31-déc-22 En application de l’avis n°5 du Conseil National de la Comptabilité (CNC) du 26/05/2005 et conformément à la\nCapital 702 937 702 937 réglementation boursière en vigueur, les comptes consolidés du Groupe LafargeHolcim Maroc publiés, sont établis\nPrimes d’émission et de fusion 2 618 038 2 618 038 conformément aux International Financial Reporting Standards (IFRS) endossés au niveau européen.\nRéserves 6 548 265 6 627 915\nÉcarts de conversion D - PÉRIMÈTRE ET RÈGLES DE CONSOLIDATION\nRésultats net part du groupe 1 547 820 1 391 685 Le périmètre consolidé de LafargeHolcim Maroc comprend les sociétés suivantes :\nCapitaux propres attribuables aux actionnaires\n11 417 059 11 340 575\nordinaires de la société mère\nIntérêts minoritaires Société Activité % d’intérêt Méthode de\nCapitaux propres de l’ensemble consolidé 11 417 059 11 340 575 consolidation\nProvisions non courantes 149 097 162 423 LafargeHolcim Maroc Ciment, béton, granulat et 100,00% Intégration globale\nAvantages du personnel 619 036 703 632 mortier\nDettes financières non courantes 4 824 729 5 186 200 Geocycle Maroc Autres 100,00% Intégration globale\nDont Instruments dérivés de couverture\nCentrale Marocaine de Construction Autres 100,00% Intégration globale\nDont Dettes envers les établissements de crédit 4 785 971 5 147 838\nDont Dettes représentées par un titre Lafarge Ciments Sahara Ciment 100,00% Intégration globale\nDont Dettes liées aux contrats de location financement Andira Autres 100,00% Intégration globale\nDont Dettes liées aux contrats à droit d'usage 38 758 38 362\nLubasa Maroc Ciment 100,00% Intégration globale\nDont Autres dettes\nDettes d'impôts société Lafarge Calcinor Autres 50,00% Mise en équivalence\nImpôts différés passifs 1 017 957 1 009 146 CBM Ciment 50,00% Mise en équivalence\nPassifs non courants 6 610 819 7 061 401 MATEEN Autres 33,33% Mise en équivalence\nProvisions courantes 94 281 164 852\nDettes financières courantes 319 717 480 036 Ceval Autres 33,33% Mise en équivalence\nDont Instruments dérivés de couverture\nDont Dettes envers les établissements de crédit 304 794 465 929\nE - PRINCIPALES RÈGLES ET MÉTHODES ADOPTÉES\nDont Dettes représentées par un titre\nDont Dettes liées aux contrats de location financement Immobilisations corporelles - IAS 16 -\nDont Dettes liées aux contrats à droit d'usage 14 923 14 107 Les immobilisations corporelles sont évaluées selon la méthode du coût historique.\nDont Autres dettes Les méthodes d’amortissement des immobilisations corporelles sont les suivantes :\nDettes fournisseurs courantes 879 883 831 699\nAutres créditeurs courants 818 036 652 804 - les terrains de carrières sont amortis en fonction des tonnages extraits pendant l’exercice rapportés à la capacité\nPassifs liés aux actifs non courants détenus en vue de la vente d’extraction totale estimée de la carrière sur sa durée d’exploitation ;\nPassifs courants 2 111 917 2 129 391 - les autres terrains ne sont pas amortis ;\nTOTAL CAPITAUX PROPRES ET PASSIF 20 139 795 20 531 367 - les bâtiments administratifs sont amortis linéairement sur leur durée d’utilité estimée selon la décomposition\nsuivante : gros œuvres – charpente métallique : 50 ans, étanchéité, toiture et autres : 10 ans, agencements et\naménagements : 15 ans, installations techniques fixes : 25 ans, menuiserie15 ans ;\n- L es bâtiments industriels sont amortis sur une durée d’utilité allant de 20 à 30 ans ;\nCOMPTE DE RÉSULTAT CONSOLIDÉ AU 31 DÉCEMBRE 2023 - les matériels, équipements et installations sont amortis linéairement sur leur durée de vie estimée allant de\n8 à 30 ans.\n(en milliers de dirhams)\nGoodwill - IAS 36 -\nExercice clos 31-déc-23 31-déc-22 Conformément aux dispositions de la norme IAS 36 – Dépréciation d’actifs, les goodwills ne sont plus amortis\nChiffre d’affaires 8 212 021 7 985 055 depuis le 1er janvier 2006 (date de transition aux IFRS) mais sont testés au minimum une fois par an pour détecter\nAutres produits de l’activité d’éventuelles pertes de valeur.\nProduits des activités ordinaires 8 212 021 7 985 055 Provisions, passifs éventuels - IAS 37 -\nAchats (2 788 543) (2 761 898)\nAutres charges externes (1 078 678) (1 049 879) Conformément à IAS 37, le montant des provisions comptabilisé par le Groupe est basé sur la meilleure estimation\nFrais de personnel (629 974) (607 893) de la sortie d’avantages économiques futurs à la date où le Groupe a comptabilisé cette obligation. Le montant des\nImpôts et taxes (66 279) (62 796) provisions est ajusté à chaque date de clôture en tenant compte de l’évolution éventuelle de l’estimation de la sortie\nAmortissements et provisions d’exploitation (715 084) (579 178) d’avantages futurs attendus.\nAutres produits et charges d’exploitation 44 056 (227 641) Stocks - IAS 2 -\nCharges d’exploitation courantes (5 234 502) (5 289 285) Conformément à IAS 2, les stocks et en-cours de production industrielle sont évalués au plus bas de leur coût de\nRésultat d’exploitation courant 2 977 519 2 695 770 revient et de leur valeur nette de réalisation. Le calcul de dépréciation des stocks est fondé sur une analyse des\nCessions d’actifs 3 485 3 539 changements prévisibles de la demande, des technologies ou du marché afin de déterminer les stocks obsolètes\nCessions de filiales et participations 4 804 ou en excès.\nAutres produits et charges d’exploitation non courants (395 604) (198 068)\nImmobilisations incorporelles - IAS 38 -\nAutres produits et charges d’exploitation (392 119) (189 725)\nRésultat d’exploitation 2 585 400 2 506 045 Conformément aux critères établis par la norme IAS 38 – Immobilisations incorporelles, un actif est enregistré au\nCoût de l’endettement financier net bilan s’il est probable que les avantages économiques futurs liés à cet actif iront au Groupe.\nAutres produits financiers 11 478 8 513 Les immobilisations incorporelles comprennent essentiellement les logiciels. Ils sont amortis par annuités\nAutres charges financières (208 543) (228 086) constantes sur une durée n’excédant pas sept ans.\nRésultat financier (197 065) (219 573) Avantages au personnel - IAS 19 -\nRésultat avant impôt des entreprises intégrées 2 388 335 2 286 472\nImpôts sur les bénéfices (881 641) (783 203) Conformément à la norme IAS 19 - Avantages du personnel, les obligations au titre des avantages postérieurs à\nImpôts différés 27 763 (125 134) l’emploi du régime à prestations définies sont calculées, annuellement par des actuaires indépendants.\nRésultat net des entreprises intégrées 1 534 457 1 378 135 Cette méthode prend en compte, sur la base d’hypothèses actuarielles, la probabilité de durée de service future du\nPart dans les résultats des sociétés mises en équivalence 13 363 13 550 salarié, le niveau de rémunération futur, l’espérance de vie et la rotation du personnel.\nRésultat net des activités poursuivies 1 547 820 1 391 685 Le groupe a adopté l’option proposée par l’amendement de l’IAS 19, avantages au personnel, pour constater au\nRésultat net des activités abandonnées niveau des capitaux propres, les gains et pertes actuariels issus des changements des hypothèses actuarielles qui\nRésultat de l’ensemble consolidé 1 547 820 1 391 685 affectent l’évaluation des obligations.\nIntérêts minoritaires Impôt sur le résultat - IAS 12 -\nRésultat net - Part du Groupe 1 547 820 1 391 685\nConformément aux dispositions de la norme IAS 12 -Impôt sur le résultat-, les provisions pour impôts différés sont\nRésultat net par le nombre moyen d’actions de la période\n- de base 66,4 59,7 constituées selon la méthode du report variable et de la conception étendue sur les différences temporaires entre\n- dilué 66,4 59,7 les valeurs comptables des actifs et des passifs et leurs valeurs fiscales.\nLes impôts différés sont calculés par application de la législation fiscale en vigueur. Les actifs d’impôts différés ne\nsont constatés que si leur récupération est probable.\nLa charge d’impôts courants et différés est comptabilisée au compte de résultat de la période sauf s’ils sont générés\nA - DESCRIPTION DE L’ACTIVITÉ par une transaction ou un événement comptabilisé directement en capitaux propres.\nLafargeHolcim Maroc est une société anonyme de droit marocain. Elle a été constituée en 1981. Son siège social\nF - ÉVÉNEMENT POST-CLÔTURE\nest situé au 6, route de Mekka – Quartier Les Crêtes à Casablanca.\nAucun évènement post clôture significatif n’est intervenu depuis le 31 décembre 2023.\nPremier cimentier marocain, LafargeHolcim Maroc dispose d’une capacité de production supérieure à 14 millions\nde tonnes par an. Le groupe LafargeHolcim Maroc est organisé en deux branches d’activités : Ciments et Autres G - COMMUNICATION FINANCIÈRE\n(trading, granulats, bétons).\nLe jeu complet des états financiers consolidés du Groupe LafargeHolcim Maroc au 31 Décembre 2023 établis\nL’action LafargeHolcim Maroc est cotée à la Bourse de Casablanca depuis 1997. conformément aux normes internationales sera mis à votre disposition sur le site Internet de LafargeHolcim Maroc,\nLes termes “ LafargeHolcim Maroc ” et “la société mère”, utilisés ci-après, font référence à la société anonyme de à l’adresse suivante : www.lafargeholcim.ma à partir du 30 avril 2024.\ndroit marocain (hors filiales consolidées). Le terme “Groupe” fait référence à l’ensemble économique composé de la Ce jeu complet comprend outre l’état de la situation financière, le compte de résultat, l’état des flux de trésorerie,\nSociété LafargeHolcim Maroc et de ses filiales consolidées. Les états financiers sont présentés en dirhams arrondis l’état de variation des capitaux propres, la note aux principes comptables détaillée ainsi que les notes annexes\nau millier le plus proche. choisies conformément aux dispositions des normes IAS / IFRS.\nCes comptes annuels ont été arrêtés par le Conseil d’Administration du 27 mars 2024.\nLafargeHolcim Maroc, 6, route de Mekka, Quartier les Crêtes, Casablanca 20150 / R.C. Casablanca 40779 / I.F. 016 40 889 - I.C.E. 001561191000066\nRésultats au 31 décembre 2023\nComptes Sociaux\nBILAN ACTIF AU 31 DÉCEMBRE 2023 BILAN PASSIF AU 31 DÉCEMBRE 2023\nExercice Exercice Exercice\n(en dirhams) Brut Amortissements Net Précédent (en dirhams) Exercice Précédent\net provisions Net\nFINANCEMENT PERMANENT\nACTIF IMMOBILISÉ\nCAPITAUX PROPRES\nIMMOBILISATIONS EN NON VALEURS (A) 732 440 374,13 592 440 374,13 140 000 000,00 201 341 265,20\nCapital social ou personnel 702 937 200,00 702 937 200,00\nFrais préliminaires\nCharges à repartir sur plusieurs exercices 732 440 374,13 592 440 374,13 140 000 000,00 201 341 265,20 Moins : actionnaires, capital souscrit non appelé capital appelé\ndont versé.......\nPrimes de remboursement des obligations\nIMMOBILISATIONS INCORPORELLES (B) 7 954 341 088,45 177 018 555,84 7 777 322 532,61 7 782 288 070,74 Prime d’émission, de fusion, d’apport 5 162 347 194,49 5 162 347 194,49\nImmobilisation en recherche et développement Ecarts de réévaluation\nBrevets, marques, droits et valeurs similaires 50 442 369,23 50 100 981,31 341 387,92 Réserve légale 70 293 720,00 70 293 720,00\nFonds commercial 7 682 256 303,44 7 418 761,68 7 674 837 541,76 7 674 837 541,76 Autres réserves 2 580 368 389,58 2 791 998 447,19\nAutres immobilisations incorporelles 221 642 415,78 119 498 812,85 102 143 602,93 107 450 528,98\nReport à nouveau\nIMMOBILISATIONS CORPORELLES (C) 20 369 304 831,39 13 916 384 243,10 6 452 920 588,29 7 077 964 455,43\nRésultats nets en instance d’affectation\nTerrains 978 680 363,10 108 940 339,89 869 740 023,21 886 727 944,64\nConstructions 4 260 651 229,82 2 066 675 742,87 2 193 975 486,95 2 251 911 956,00 Résultat net de l’exercice 1 413 116 647,69 1 327 471 257,82\nInstallations techniques, matériel et outillage 14 266 310 136,51 11 545 753 974,40 2 720 556 162,11 3 178 477 643,69 Total des capitaux propres (A) 9 929 063 151,76 10 055 047 819,50\nMatériel de transport 46 731 801,49 21 348 559,09 25 383 242,40 32 156 874,49 CAPITAUX PROPRES ASSIMILÉS (B) 175 129 339,76 253 451 131,94\nMobilier, matériel de bureau et aménagements divers 224 992 175,91 134 241 298,57 90 750 877,34 96 551 592,40\nSubvention d'investissement\nAutres immobilisations corporelles 33 656 501,36 33 577 412,00 79 089,36 276 603,56\nProvisions réglementées 175 129 339,76 253 451 131,94\nImmobilisations corporelles en cours 558 282 623,20 5 846 916,28 552 435 706,92 631 861 840,65\nIMMOBILISATIONS FINANCIÈRES (D) 555 314 484,18 102 256 565,13 453 057 919,05 422 537 584,44 DETTES DE FINANCEMENT (C) 4 785 970 611,06 5 147 838 055,27\nPrêts immobilisés 23 209 759,21 520 664,57 22 689 094,64 26 901 138,03 Emprunts obligataires\nAutres créances financières 69 456 059,34 500 000,00 68 956 059,34 68 712 189,34 Autres dettes de financement 4 785 970 611,06 5 147 838 055,27\nTitres de participation 462 648 665,63 101 235 900,56 361 412 765,07 326 924 257,07 PROVISIONS DURABLES POUR RISQUES ET CHARGES (D) 194 393 525,03 169 394 158,73\nAutres titres immobilisés\nProvisions pour risques 75 606 322,31 66 146 035,70\nÉCARTS DE CONVERSION-ACTIF (E)\nProvisions pour charges 118 787 202,72 103 248 123,03\nDiminution des créances immobilisées\nAugmentation des dettes de financement ECARTS DE CONVERSION-PASSIF (E)\nTOTAL I (A+B+C+D+E) 29 611 400 778,15 14 788 099 738,20 14 823 301 039,95 15 484 131 375,81 Augmentation des créances immobilisées\nACTIF CIRCULANT Diminution des dettes de financement\nSTOCKS (F) 697 722 477,57 73 697 280,13 624 025 197,44 612 511 885,42 Total I (A+B+C+D+E) 15 084 556 627,61 15 625 731 165,44\nMarchandises 915 366,90 297 434,31 617 932,59 573 001,48\nPASSIF CIRCULANT\nMatières et fournitures consommables 501 232 949,16 73 361 345,63 427 871 603,53 473 432 702,17\nDETTES DU PASSIF CIRCULANT (F) 1 651 332 028,62 1 432 298 867,61\nProduits en cours\nProduits intermédiaires et produits résiduels 129 527 142,58 129 527 142,58 73 688 095,16 Fournisseurs et comptes rattachés 847 240 623,06 783 070 962,58\nProduits finis 66 047 018,93 38 500,19 66 008 518,74 64 818 086,61 Clients créditeurs, avances et acomptes 126 211 188,80 109 583 424,20\nCRÉANCES DE L'ACTIF CIRCULANT (G) 1 794 759 443,81 300 988 351,55 1 493 771 092,26 1 414 385 402,09 Personnel 150 346 841,51 114 906 047,62\nFournis débiteurs, avances et acomptes 6 313 282,02 6 313 282,02 7 770 377,35 Organismes sociaux 42 496 973,04 34 826 412,66\nClients et comptes rattachés 1 231 309 457,61 178 637 925,89 1 052 671 531,72 928 366 645,81\nEtat 284 836 119,03 189 726 267,78\nPersonnel 6 730 930,99 6 730 930,99 5 953 561,51\nComptes d’associés 75 118 205,15 72 118 205,15\nÉtat 76 978 107,02 76 978 107,02 129 180 851,96\nComptes d'associés 119 627 559,00 86 977 500,00 32 650 059,00 59,00 Autres créanciers 123 655 594,01 126 048 218,24\nAutres débiteurs 322 962 244,81 35 372 925,66 287 589 319,15 307 168 493,64 Comptes de régularisation-passif 1 426 484,02 2 019 329,38\nComptes de régularisation-Actif 30 837 862,36 30 837 862,36 35 945 412,82 AUTRES PROVISIONS POUR RISQUES ET CHARGES (G) 49 704 251,74 122 003 103,84\nTITRES ET VALEURS DE PLACEMENT (H)\nECARTS DE CONVERSION-PASSIF (Eléments circulants) (H) 2 775 863,00 2 305 584,00\nÉCARTS DE CONVERSION-ACTIF (I) 1 619 774,00 1 619 774,00 2 399 903,00\nTotal II (F+G+H) 1 703 812 143,36 1 556 607 555,45\n(Éléments circulants)\nTOTAL II (F+G+H+I ) 2 494 101 695,38 374 685 631,68 2 119 416 063,70 2 029 297 190,51 TRÉSORERIE\nTRÉSORERIE TRÉSORERIE-PASSIF 304 253 237,55 461 848 792,21\nTRÉSORERIE ACTIF 152 442 981,21 2 538 076,34 149 904 904,87 130 758 946,78 Crédits d’escompte\nChèques et valeurs à encaisser Crédits de trésorerie\nBanques, TG et CCP 152 442 981,21 2 538 076,34 149 904 904,87 130 758 946,78\nBanques (soldes créditeurs) 304 253 237,55 461 848 792,21\nCaisse, régie d'avances et accréditifs\nTOTAL III 152 442 981,21 2 538 076,34 149 904 904,87 130 758 946,78 Total III 304 253 237,55 461 848 792,21\nTOTAL GÉNÉRAL I+II+III 32 257 945 454,74 15 165 323 446,22 17 092 622 008,52 17 644 187 513,10 TOTAL GENERAL I+II+III 17 092 622 008,52 17 644 187 513,10\nCOMPTE DE PRODUITS ET CHARGES ( HORS TAXES ) AU 31 DÉCEMBRE 2023 COMPTE DE PRODUITS ET CHARGES ( HORS TAXES ) - SUITE -\n(en dirhams) Opérations (en dirhams) Opérations\nTOTAUX DE TOTAUX DE TOTAUX DE TOTAUX DE\nConcernant L’EXERCICE L’EXERCICE Concernant L’EXERCICE L’EXERCICE\nNATURE P l’ero xp er re cs ic à e les p re éx ce ér dc eic ne ts s 3=1+2 PRÉCÉDENT 4 NATURE P l’ero xp er re cs ic à e les p re éx ce ér dc eic ne ts s 3=1+2 PRÉCÉDENT 4\n1 2 1 2\nI PRODUITS D’EXPLOITATION VII RÉSULTAT COURANT (reports) 2 589 904 542,82 2 302 319 321,33\nVentes de marchandises (en l’état) 47 811 959,40 47 811 959,40 2 910 482,18\nVIII PRODUITS NON COURANTS\nVentes de biens et services produits 8 027 384 076,08 8 027 384 076,08 7 856 310 156,06\nChiffre d’affaires 8 075 196 035,48 8 075 196 035,48 7 859 220 638,24 Produits des cessions d’immobilisations 10 308 419,99 10 308 419,99 293 333,34\nVariation de stocks de produits 56 854 251,75 56 854 251,75 -19 233 725,20 Subventions d’équilibre\nImmobilisations produites par l’entreprise\nSubventions d’exploitation Reprises sur subventions\nAutres produits d’exploitation d’investissement\nReprises d’exploitation: transferts de charges 46 335 816,80 46 335 816,80 166 779 104,48 Autres produits non courants 8 939 129,55 8 939 129,55 6 458 779,89\nTotal I 8 178 386 104,03 8 178 386 104,03 8 006 766 017,52\nReprises non courantes ; transferts de\nII CHARGES D’EXPLOITATION charges 189 758 149,21 189 758 149,21 233 738 619,83\nAchats revendus de marchandises 46 260 499,38 46 260 499,38 1 820 555,78\nAchats consommés de matières et fournitures 2 683 142 755,69 2 683 142 755,69 2 699 795 314,82 Total VIII 209 005 698,75 209 005 698,75 240 490 733,06\nAutres charges externes 1 074 933 444,97 1 074 933 444,97 1 046 299 259,29 IX CHARGES NON COURANTES\nImpôts et taxes 63 790 439,23 63 790 439,23 60 765 553,72 Valeurs nettes d'amortissements des\n5 903 539,57 5 903 539,57\nCharges de personnel 622 049 602,85 622 049 602,85 587 612 503,70 immobilisations cédées\nAutres charges d’exploitation 22 441 946,17 22 441 946,17 134 445 326,97\nSubventions accordées\nDotations d’exploitation 919 021 480,96 919 021 480,96 934 416 800,00\nTotal II 5 431 640 169,25 5 431 640 169,25 5 465 155 314,28 Autres charges non courantes 240 268 129,89 240 268 129,89 325 403 631,27\nIII RÉSULTAT D’EXPLOITATION (I-II) 2 746 745 934,78 2 541 610 703,24\nDotations non courantes aux\nIV PRODUITS FINANCIERS amortissements et aux provisions 274 602 467,82 274 602 467,82 112 606 259,86\nProduits de titres de participation et autres\ntitres immobilisés 12 396 547,86 12 396 547,86 9 167 953,58 Total IX 520 774 137,28 520 774 137,28 438 009 891,13\nGains de change 4 696 602,37 4 696 602,37 7 048 992,43 X RÉSULTAT NON COURANT (VIII-IX) -311 768 438,53 -197 519 158,07\nIntérêts et autres produits financiers 10 386 770,29 10 386 770,29 8 281 210,97\nReprises financières ; transferts de charges 106 888 411,00 106 888 411,00 26 038 569,44 XI RÉSULTAT AVANT IMPÔTS (VII+X) 2 278 136 104,29 2 104 800 163,26\nTotal IV 134 368 331,52 134 368 331,52 50 536 726,42 XII IMPÔTS SUR LES SOCIÉTÉS 865 019 456,60 777 328 905,44\nV CHARGES FINANCIÈRES\nCharges d’intérêts 233 227 031,90 233 227 031,90 245 012 217,44 XIII RÉSULTAT NET (XI-XII) 1 413 116 647,69 1 327 471 257,82\nPertes de change 5 072 625,54 5 072 625,54 2 961 920,22\nXIV TOTAL DES PRODUITS (I+IV+VIII) 8 521 760 134,30 8 297 793 477,00\nAutres charges financières 268,41 268,41 534,65\nDotations financières 52 909 797,63 52 909 797,63 41 853 436,02 TOTAL DES CHARGES\nXV 7 108 643 486,61 6 970 322 219,18\nTotal V 291 209 723,48 291 209 723,48 289 828 108,33 (II +V+IX+XIII)\nVI RÉSULTAT FINANCIER (IV-V) -156 841 391,96 -239 291 381,91 RÉSULTAT NET\nXVI 1 413 116 647,69 1 327 471 257,82\nVII RÉSULTAT COURANT (III+VI) 2 589 904 542,82 2 302 319 321,33 (total des produits-total des charges)\nLafargeHolcim Maroc, 6, route de Mekka, Quartier les Crêtes, Casablanca 20150 / R.C. Casablanca 40779 / I.F. 016 40 889 - I.C.E. 001561191000066\nRésultats au 31 décembre 2023\nAux actionnaires de la société Aux actionnaires de la société\nLAFARGEHOLCIM MAROC S.A. MAZARS AUDIT & CONSEIL LAFARGEHOLCIM MAROC S.A. MAZARS AUDIT & CONSEIL\n37, Bd Abdellatif Ben Kaddour 6, Route de la Mecqu e – Californie 101, Bd Abdelmoumen 37, Bd Abdellatif Ben Kaddour 6, Route de la Mecqu e – Californie 101, Bd Abdelmoumen\n2 M0\na\nr0 o5 c0 Casablanca Q 20u 1a 5rt 0ie Cr ale ss\na\nbC lr aê nt ce as 2 M0 a3 r6 o0\nc\nCasablanc a 2 M0\na\nr0 o5 c0 Casablanca Q 20u 1a 5rt 0ie Cr ale ss\na\nbC lr aê nt ce as 2 M0 a3 r6 o0\nc\nCasablanca\nRAPPORT GENERAL DES COMMISSAIRES AUX COMPTES RAPPORT D’AUDIT SUR LES ETATS FINANCIERS CONSOLIDES\nEXERCICE DU 1er JANVIER AU 31 DECEMBRE 2023 EXERCICE DU 1ER JANVIER AU 31 DECEMBRE 2023\nAudit des états de synthèse Opinion\nOpinion Nous avons effectué l’audit des états financiers consolidés de LafargeHolcim Maroc S.A. et de ses filiales (Groupe LafargeHolcim\nC éto an tsfo drm\ne\né sym ne thn èt sà\ne\nl a\nc\nim -jois ins ti so n\nd\neq u lai n so ou cs\nié\na\nté\né Lté\na\nfc ao rgn efi Hée\no\nlp ca imr v Mo atr re\no\ncA s Ss .e Am\n.,\nb ql ué ie\nc\nG omén pé rera nl ne\ne\nd nu\nt\nl2 e7\nb\nj iu lain\nn\n2 a0 u2 33 1, n do éu cs\ne\nmav bo ren s\n2\ne 0f 2fe\n3\nc\n,\nt lu eé\nc\nl o’a mu pd ti et d de es M l’éa taro\nt\nc c) o, nq su oi lc ido ém dp er se n vn ae rin at\nt\nil o’é nt sa t\nd\nc eo sn cs ao pli id taé\nu\nd xe\np\nl ra\no\npsi rt eu sa t eio\nt\nn\nle\nfi tn aa bn lec aiè ur e\nc\noa nu\ns\n3 o1\nlid\nd éé dc ee sm flb ure\nx\n2 d0 e2 t3 ré, sa oin res ri\ni\neq u pe\no\nul’é\nr\nt la ’et\nx\nc eo rn cis co el id clé\no\nsd u\nà\nr cé es tu telt a dt\na\ng telo\n,\nb aa inl,\ns i\nproduits et charges, l’état des soldes de gestion, le tableau de financement pour l’exercice clos à cette date, ainsi que l’état des que les notes annexes, y compris des informations significatives sur les méthodes comptables. Ces états financiers consolidés font\ninformations complémentaires (ETIC). Ces états de synthèse font ressortir un montant de capitaux propres et assi milés de KMAD ressortir un montant de capitaux propres consolidés MAD 11.417 millions dont un bénéfice net consolidé de MAD 1.548 millions.\n10.104.192 dont un bénéfice net de KMAD 1.413.117. Nous certifions que les états financiers consolidés cités au premier paragraphe ci-dessus, sont réguliers et sincères et donnent dans\nN aso pu es\nc\nc tse r st ii gfio nn ifis\nc\naq tu ife\ns\n,l e us\nn\neé t ia mts\na\ngd ee fis dy èn lt eh è ds ue\nr\néci sté us\nlt\naa tu\nd\np er se om pie ér\nr\nap ta ior na sg r da ep h l’ee\nx\nc ei- rd cie cs es éu cs\no\ns uo lén t\na\nr ié ng su\ni\nl qie ur es de et s lain sc iè ture as\nti\noe nt d fio nn an\nn\ne cin èt r,\ne\nd ea tn ds uto pu as\nt\nrl ie -urs t po eu rs\nfo\nl re mu ars\nn\nca es p fie nc at ns cs ièig rn ei fi cc oa nt sif os l,\ni\ndu én ee eim\nt\nda eg e\ns\nefi sd è fll ue\nx\nd de\ne\nl a\ntr\nés sit ou ra et rio ien cfi on na sn oc lii dè ére\ns\nc po on us ro l’l eid xé ee\nr\ncd icu\ne\ng cro lou sp àe ca eu\nt\nt3 e1\nd\nd aé tec ,e cm ob nr fe\no\nr2 m0 é2 m3,\ne\na ni tn as ui q\nx\nu Ne\no\nd rme es sa\nmoine de la société LafargeHolcim Maroc S.A. au 31 décembre 2023, conformément au référentiel comptable en v igueur au Maroc. Internationales d’Information Financière (IFRS) telles qu’adoptées dans l’Union Européenne.\nFondement de l’opinion Fondement de l’opinion\nNous avons effectué notre audit selon les Normes de la Profession au Maroc. Les responsabilités qui nous incomb ent en vertu de Nous avons effectué notre audit selon les Normes de la Profession au Maroc. Les responsabilités qui nous incombent en vertu de\nc de us p n réo srm ene ts r as po pn ot rp tl .u Ns oaL um sA p sl oeF mm meAn et s Rd ié nc dGr éit peE es n d dHa an nsO t sla d Ls ee lCc at i so oIn cM « ié tR é e M cs op noA fn os rmRab éi mOlité es nC td ae u Sl x’a ru è.d gAit lee su. r d à e l d’é ég oa nr td o ld oe g il e’a qu ud ii t s d ’ae ps p é lit qa uts e nd te à s ly ’an uth dè its de e » s c ce os n sn oo lir dm ée ss » s do un t p p rélu ss e La nm t rAp al pe Fpm oe rAtn . t N Rd oé uc Gsri t se oEs m d Hman eOs s l ia nL ds ée Cpc eti no Idn Ma « n tR sMe ds up o Agn ros Rua pb ei Oli t cé os Cn d foe r mSl’a éu .md Aeite n.u t r a uà x l ’é règ ga lr ed s d de e l d’a éu od nit t od le os g ié et a qt us i fi sn ’aa pn pc lii qe urs e nt à\né rèta gt les sd\n.\ne\nN\ns oy un st h eè ss tie\nm\na ou\nn\nsM qa uro ec\nl\nee st én lo éu ms\ne\nn no tsu s\np\nrs oo bm am nte ss\nq\na uc eq nu oit uté ss\na\nd ve os\nn\nsa u ot bre tes\nn\nr ue ss p so on ns\nt\na sb ui fl fiit sé as\nn\nd tsé o en\nt\nt ao plo pg roiq pu re iés\ns\nq pu oi un ro fu os\nn\ndin ec ro nm ob tre en ot ps ie nl io on\nn\nces l i’ na cu od mit bd ee ns\nt\né st ea lots\nn\nfi cn ea sn rc èie gr ls\ne\nsc .o Nn oso ul sid eé ss\nt\nia mu\no\nM nsa qro uc\ne\ne let sn o éu lés\nm\nn eo nu ts\ns\ns po rom bm ae ns\nts\na qc uq eu i ntt oé us\ns\nd ae vs\no\na nu st r oe bs\nt\nere ns up so sn os na tb sil uit fé fis\ns\nad né to sn eto\nt\nl ao pg piq rou pe rs\nié\nq su pi on uo ru s\nRAPd’aPudiOt. RT GENERAL DES COMMISSAIRES AUX COMPTES RAPfon Pde Or no Rtre T op i Gnion E d’ Naud Eit. RAL DES COMMISSAIRES AUX COMPTES\nQuestions clés de l’audit Questions clés de l’audit\nLes questions clés de l’audit sont les questions qui, selon notre jugement professionnel, ont été les plus importantes dans l’audit des Les questions clés de l’audit sont les questions qui, selon notre jugement professionnel, ont été les plus importantes dans l’audit des\néEtatsX deE syRnthCèsIeC deE la pdériuode 1coEnsRid éJréAe. CNesV quIeEstiRons oAnt Uété 3tra1ité eDs dEansC le EcoMntexBte Rde nEot re2 a0ud2it d3es états de synthèse pris éEtatsX finEanRcieCrs cIoCnsEolid éds due la1 pEérRio dJe cAonNsidéVréIeE. CRes quAesUtion s3 o1nt éDté tEraiCtéeEs dMansB le cRonEtex te2 d0e n2o3tre audit des états financiers\ndans leur ensemble et aux fins de la formation de notre opinion sur ceux-ci, et nous n’exprimons pas une opinion distincte sur ces consolidés pris dans leur ensemble et aux fins de la formation de notre opinion sur ceux-ci, et nous n’exprimons pas une opinion\nquestions. distincte sur ces questions.\nQuestions clés identifiées Notre réponse Questions clés identifiées Notre réponse\nLe Bilan de la société comprend des immobilisations corporelles Nous avons pris connaissance des procédures mises en Le Bilan du groupe comprend des immobilisations corporelles Nous avons pris connaissance des procédures mises en\nprésentant des valeurs comptables nettes de MMAD 6 453 place par la direction dans le cadre des tests de dépréciation s’élevant à MMAD 10.300, représentant 51% du total des actifs place par la direction dans le cadre des tests de dépréciation\nreprésentant 38% du total des actifs de la société. notamment des jugements relatifs à la détermination des du groupe. notamment des jugements relatifs à la détermination des\nC f m r ea é te ac g us t r le e nc a u h m ec r é es dt i f d n éis n é t t a étp fe ta re i ir ov ou n o n rev ar se s a t, in b oo ut l n u nep es dr e , é e x éds t v lee e aorn s ln pu t cee eth isr ro fa,u n o nnn rdg mo r eeti aas m l nmq ’ee cu m n ene v te ds id rn eoe dt n e ldd an eé l eé ssp m og r c cé i eso ic él nn ai tta d t é i ct oi .i t oo i no nn sn c l s o uié u rd rà ee d n d e te ies l i a N d dn c i ’od r int eui uc dcsee it cils a ol ae v nd t. o e e an u ip s rn s e se i dr xt q ee a u m pd e ee i n s r tv é e ea s ll e d e cs eu o r c n v oe acn lt lu e tl sr ua ô i rod l e dné s ast e n c sr sl um é lrs ei n l am ca at pisi do r é ren esn d e dpe n ul cal a pec r ev o o a u cpl e e a l’ su r a sr bla us se nce C f m r ea é te ac g us t r le e nc a u h m ec r é es dt i f d n éis n é t t a étp fe a t re i ir ov ou n o n rv e ar se s a t, in b oo ut l n u nep es der , é e x éds t v lee e aorn s ln pu t ce e eth ir s ro fa,u n o nnn rdg mo r eeti aas m l nmq ’ee cu m n ene v te ds id rn uoe dt n e Gdd n eé rl eé osp mg u r cé i pesoc el nn ai .a td t it coii to oi non nsn c l s oi ué u rd rà ee d n d e te ies l i r N d d dn e i ’ éod r ic ne pui oc dc rsu ée it civ cs a o ar i v n aad to e tbe a in u ol iep s rn ns. e s .e i dr D xt q ee a au m p nd e e se i n s r ltv é e eea s s ll e d e c cs eu o a r c n sv o e ac on lt lu e ù tl sra u ô ui rod l ne dné s a is nt e n c dsr sl ium é c lrs eei n l am dca a et pisi d o r p é ren eesn rd e d tpe en el cal s da ec e t ev e o v a sup al t e a s ll e’u r a d u r bl ea rs ae n éc tée\nLa société réalise des tests de dépréciation sur ces d’estimation des tests de dépréciation. Le Groupe réalise des tests de dépréciation sur ces identifié et lorsque la valeur recouvrable a été appréhendée par\nimmobilisations corporelles en cas d’identification d’un indice de Pour les cas où un indice de perte de valeur a été identifié immobilisations corporelles en cas d’identification d’un indice de la valeur d’utilité :\nperte de valeur selon les principes décrits dans le paragraphe et lorsque la valeur actuelle a été appréhendée par la valeur perte de valeur selon les principes décrits dans le paragraphe - Nous avons revu la cohérence des hypothèses et des\n« Evaluation des immobilisations » de l’état A1 de l’ETIC « Etat actuelle des flux de trésorerie futurs : « Tests de dépréciation des actifs » de la Note 3.11 « Tests données clés des modèles de flux de trésorerie avec les\nd c vo ae n ls e s uin ta rf o t aér cem tu, a edt lèi lo esn . ls o rc so m qup elé lm a e van lt ea uir re cs o » m. pU tn ae b ld eé dp er é l’c ai ca tt ii fo en x d co èi dt eê t sre a - N d do oo n nu n ns é é a e ev s so c hn l is é s s tr oe d rv ie qu s u l ea m s c o eo d th è pé le rr ée s v n d ic see io fl nd ue nxs e d lh leey s p t .r o ét sh oè rs ee ris e e at v d ee cs l es d a c vo ae u n l x ed s uéé ta rtp a t rr ét eé s e cc fi , oi a n d ut a è vio n rsn ac l bi oe e lr et r s s .p q Le c u ar ot e ne v ss l aao ld el vie d ua é rv l es ra eu.l e crU u ocnr uo e vd m re d aps é bt p aa ler bc é lt eecif s is a d t t e» li eo ld n ’ mae cd ol to’ nia fi ttn e a ên x nte c tr e èx lee d e p ls ua s - - d N c Nao o oln u c un us sé l sa ae v vds o o uh n n i ms ss t ot eo e d xr si aèq té mlu e e ip nds a ée re lflst e uop sxn r a é d d nv a e ai gs lti e yro é s n l es’en o sxe ra delle c erits ei st. .u ed ne s iba ir li it th ém pé réti pq au re é ed se s p ar\nLe test de dépréciation des immobilisations corporelles - Nous avons testé par sondage l’exactitude arithmétique des élevé de la juste valeur diminuée des coûts de cession et de la la direction afin d’évaluer le niveau de marge entre la valeur\nest considéré comme un point clé de l’audit compte tenu calculs du modèle de flux de trésorerie. valeur d’utilité. recouvrable et la valeur comptable.\nd d p ée e o le s u vla r ém r a m do ie ’a n ent t sé a t tr n p ii ma t osl ati et s té ini og td nn iee sifi ls l eec m a tm t do i ef en s n t t ja e u en n gnt es t e mr ép rm esri nus e tl s t d e r ea d r qn e e us td isl dée up pu r ar fé a re c i ltn i a a ds t se uio om dn cb e iéql ge tu r é, éi p our - N l aa co d tu uis r ee la lc ev t io o en n t s laa e fi vx n aa ldm e’ uéin rv é a c l ol ue mes r p a l te an ba n ll i ey v .s ee as u d de e s me ans rgib ei li eté n tp reré lp aa vr aé le es u rp ar L e de s et t lc ae o s mnt s ad i te d é é rd ir aé é lp itcr éé o c m di ea m sti e o m n u o nd n e p tas o n ii nm tst m c plo ré isb d i dli es a a l n’t a sio u ln d es i ut rc c o eor nmp so p er t mee l bl te e les n , u - N d fineo a u d ns é c pa ierv é ro scn .ias t ie ox na pm ri én sé e l ne ts é ein sf o dr am na st i lo en s s a r ne nla et xiv ee ss a a uu xx é t te as tsts\napprécier les indices de perte de valeur et la valeur actuelle des montants significatifs en termes de dépréciation qui\ndes actifs. Les éléments de jugement incluent notamment des pourraient potentiellement en résulter et du fait du degré\nhypothèses relatives à l’évolution de l’activité de la société. élevé d’estimations et de jugement requis par le groupe pour\napprécier les indices de perte de valeur et la valeur recouvrable\nResponsabilités de la direction et des responsables de la gouvernance à l’égard des états de synthèse des actifs. Les éléments de jugement incluent notamment des\nhypothèses relatives à l’évolution de l’activité du Groupe.\nLa direction est responsable de la préparation et de la présentation fidèle des états de synthèse, conformément au référentiel comp-\ntable en vigueur au Maroc, ainsi que du contrôle interne qu’elle considère comme nécessaire pour permettre la préparation d’états de Responsabilités de la direction et des responsables de la gouvernance à l’égard des états financiers consolidés\nsynthèse exempts d’anomalies significatives, que celles-ci résultent de fraudes ou d’erreurs.\nLa direction est responsable de la préparation et de la présentation fidèle des états financiers consolidés conformément aux IFRS,\nLors de la préparation des états de synthèse, c’est à la direction qu’il incombe d’évaluer la capacité de la société à poursuivre son ainsi que du contrôle interne qu’elle considère comme nécessaire pour permettre la préparation d’états financiers consolidés exempts\nexploitation, de communiquer, le cas échéant, les questions se rapportant à la continuité de l’exploitation et d’appliquer le principe d’anomalies significatives, que celles-ci résultent de fraudes ou d’erreurs.\ncomptable de continuité d’exploitation, sauf si la direction a l’intention de liquider la société ou de cesser son activité ou si aucune\nLors de la préparation des états financiers consolidés, c’est à la direction qu’il incombe d’évaluer la capacité du groupe à poursuivre\nautre solution réaliste ne s’offre à elle.\nson exploitation, de communiquer, le cas échéant, les questions se rapportant à la continuité de l’exploitation et d’appliquer le principe\nIl incombe aux responsables de la gouvernance de surveiller le processus d’information financière de la société. comptable de continuité d’exploitation, sauf si la direction a l’intention de liquider le groupe ou de cesser son activité ou si aucune\nResponsabilités de l’auditeur à l’égard de l’audit des états de synthèse autre solution réaliste ne s’offre à elle.\nNos objectifs sont d’obtenir l’assurance raisonnable que les états de synthèse pris dans leur ensemble sont exempts d’anomalies Il incombe aux responsables de la gouvernance de surveiller le processus d’information financière du groupe.\nsignificatives, que celles-ci résultent de fraudes ou d’erreurs et de délivrer un rapport de l’auditeur contenant notre opinion. Responsabilités de l’auditeur à l’égard de l’audit des états financiers consolidés\nL’assurance raisonnable correspond à un niveau élevé d’assurance, qui ne garantit toutefois pas qu’un audit réalisé conformément Nos objectifs sont d’obtenir l’assurance raisonnable que les états financiers consolidés pris dans leur ensemble sont exempts d’ano-\naux normes de la profession au Maroc permettra toujours de détecter toute anomalie significative qui pourrait exister. Les anomalies malies significatives, que celles-ci résultent de fraudes ou d’erreurs et de délivrer un rapport de l’auditeur contenant notre opinion.\npeuvent résulter de fraudes ou d’erreurs et elles sont considérées comme significatives lorsqu’il est raisonnable de s’attendre à ce L’assurance raisonnable correspond à un niveau élevé d’assurance, qui ne garantit toutefois pas qu’un audit réalisé conformément\nque, individuellement ou collectivement, elles puissent influer sur les décisions économiques que les utilisateurs des états de synthèse aux normes de la profession au Maroc permettra toujours de détecter toute anomalie significative qui pourrait exister. Les anomalies\nprennent en se fondant sur ceux-ci. peuvent résulter de fraudes ou d’erreurs et elles sont considérées comme significatives lorsqu’il est raisonnable de s’attendre à ce\nDans le cadre d’un audit réalisé conformément aux normes de la profession au Maroc, nous exerçons notre jugement professionnel et que, individuellement ou collectivement, elles puissent influer sur les décisions économiques que les utilisateurs des états financiers\nfaisons preuve d’esprit critique tout au long de cet audit. En outre : consolidés prennent en se fondant sur ceux-ci.\n- nous identifions et évaluons les risques que les états de synthèse comportent des anomalies significatives, que celles-ci résultent de Dans le cadre d’un audit réalisé conformément aux normes de la profession au Maroc, nous exerçons notre jugement professionnel et\nfraudes ou d’erreurs, concevons et mettons en œuvre des procédures d’audit en réponse à ces risques, et réunissons des éléments faisons preuve d’esprit critique tout au long de cet audit. En outre :\nprobants suffisants et appropriés pour fonder notre opinion. Le risque de non-détection d’une anomalie significative résultant d’une - nous identifions et évaluons les risques que les états financiers consolidés comportent des anomalies significatives, que celles-ci\nfraude est plus élevé que celui d’une anomalie significative résultant d’une erreur, car la fraude peut impliquer la collusion, la falsifica- résultent de fraudes ou d’erreurs, concevons et mettons en œuvre des procédures d’audit en réponse à ces risques, et réunissons\ntion, les omissions volontaires, les fausses déclarations ou le contournement du contrôle interne ; des éléments probants suffisants et appropriés pour fonder notre opinion. Le risque de non-détection d’une anomalie significative\n- nous acquérons une compréhension des éléments du contrôle interne pertinents pour l’audit afin de concevoir des procédures d’audit résultant d’une fraude est plus élevé que celui d’une anomalie significative résultant d’une erreur, car la fraude peut impliquer la\nappropriées aux circonstances, et non dans le but d’exprimer une opinion sur l’efficacité du contrôle interne de la société ; collusion, la falsification, les omissions volontaires, les fausses déclarations ou le contournement du contrôle interne ;\n- nous apprécions le caractère approprié des méthodes comptables retenues et le caractère raisonnable des estimations comptables - nous acquérons une compréhension des éléments du contrôle interne pertinents pour l’audit afin de concevoir des procédures d’audit\nfaites par la direction, de même que des informations y afférentes fournies par cette dernière ; appropriées aux circonstances, et non dans le but d’exprimer une opinion sur l’efficacité du contrôle interne du groupe ;\n- nous tirons une conclusion quant au caractère approprié de l’utilisation par la direction du principe comptable de continuité d’exploi- - nous apprécions le caractère approprié des méthodes comptables retenues et le caractère raisonnable des estimations comptables\ntation et, selon les éléments probants obtenus, quant à l’existence ou non d’une incertitude significative liée à des événements ou faites par la direction, de même que des informations y afférentes fournies par cette dernière ;\nsituations susceptibles de jeter un doute important sur la capacité de la société à poursuivre son exploitation. Si nous concluons à - nous tirons une conclusion quant au caractère approprié de l’utilisation par la direction du principe comptable de continuité d’ex-\nl’existence d’une incertitude significative, nous sommes tenus d’attirer l’attention des lecteurs de notre rapport sur les informations ploitation et, selon les éléments probants obtenus, quant à l’existence ou non d’une incertitude significative liée à des événements\nfournies dans les états de synthèse au sujet de cette incertitude ou, si ces informations ne sont pas adéquates, d’exprimer une ou situations susceptibles de jeter un doute important sur la capacité du groupe à poursuivre son exploitation. Si nous concluons à\nopinion modifiée. Nos conclusions s’appuient sur les éléments probants obtenus jusqu’à la date de notre rapport. Des événements l’existence d’une incertitude significative, nous sommes tenus d’attirer l’attention des lecteurs de notre rapport sur les informations\nou situations futurs pourraient par ailleurs amener la société à cesser son exploitation ; fournies dans les états financiers au sujet de cette incertitude ou, si ces informations ne sont pas adéquates, d’exprimer une opinion\n- nous évaluons la présentation d’ensemble, la structure et le contenu des états de synthèse, y compris les informations fournies modifiée. Nos conclusions s’appuient sur les éléments probants obtenus jusqu’à la date de notre rapport. Des événements ou situa-\ndans l’ETIC, et apprécions si les états de synthèse représentent les opérations et événements sous-jacents d’une manière propre à tions futurs pourraient par ailleurs amener le groupe à cesser son exploitation ;\ndonner une image fidèle. - nous évaluons la présentation d’ensemble, la structure et le contenu des états financiers consolidés, y compris les informations four-\nNous communiquons aux responsables de la gouvernance notamment l’étendue et le calendrier prévus des travaux d’audit et nos nies dans les notes, et apprécions si les états financiers consolidés représentent les opérations et événements sous-jacents d’une\nconstatations importantes, y compris toute déficience importante du contrôle interne que nous aurions relevée au cours de notre audit. manière propre à donner une image fidèle.\nVérifications et informatio ns spéciV fié qr uif eic sations et informations spécifiques - n go rou us\np\no eb pte on uo\nr\nn es\nx\npd re ims eé rlé um ne en ots\np\nipV nr ié oor nbif ai scn uat rst i\nl\neos sun fs éfi tse aat\nt\nn sin t fisf\nn\noe artm\nn\na cap it epi ror son p csr\no\nisé nps sé occ lo idifn éicq seu\n.\nre Nnsa\no\nn ut\ns\nl e ss\no\nmin mfo erm\ns\na reti so pn os\nn\nfi sn aa bn lec siè dre es\nl\nad e ds\nir\nee cn tt ii oté ns\n,\nde et a lac t siv ui pté es\nr\nvd isu\ni on\nNous avons procédé également aux Nvoéurisfi caavtoionnss psrpoéccéidfiéq uéegsa lperméveunet sa upxa rv léar ilfoici aettio nnosu ssp néocuifsiq usoems mpreésv uaesss upraérs l an olotai metm neonuts d neo luas sommes et de la réalisation de l’audit dNu ogurso uapveo.n Ns opurosc aésdséu mégoanlesm l’eenntti èaruex revésrpifoicnastaiobnilsit és pdéec lif’oiqpuiensio np rdé’vauuedsi t.p ar la loi et nous nous sommes\nsincérité et la concordance, des inforamssautiroénss ndootnanmémese ndta dnes llea rsainpcpéorritt éd ee tg elas tcioonn cdour dCaonncsee, ild de’sa dinmfoinrmistartaiotinosn ddoensntiéneés a udxa nasc tlieo nrnaapipreorst de assurés notamment de la sincérité et la concordance, des informations données dans le rapport de\navec les états de synthèse de la socigéetést.ion du Conseil d’administration destiné aux actionnaires avec les états de synthèse de la société. N coo nu ss t ac to am tiom nu sn imiqu po on rts a na tu ex s ,r e ys cp oo gmn eps sa rtiib so l ne to s du ud t ee C dola én fisg ceo iieu l nv de c’aer dn mia mn inpc ioe srt rtn aao ntit ota enm ddm uee scn toint n él’ té r aôte ulen x d ianu ctee tir oe nnt e nl e aq iurc eea s l ne aon vud esr ci e alr eu sp ri r oéé ntv asu t ss r e dd leee vs sé yt enra tahv uèa su cex o dud er’ sa l u add esi t on ce oit ét rn teéo .as udit.\nCasablanca, le 9 avril 2024\nCasablanca, le 9 avril 2024 Casablanca, le 9 avril 2024 Casablanca, le 9 avril 2024\nLes Commissaires aux Comptes\nLes Commissaires aux Comptes\nLes Commissaires aux Comptes Les Commissaires aux Comptes\nERNST & YOUNG MAZARS AUDIT & CONSEIL ERNST & YOUNG MAZARS AUDIT & CONSEIL\nAbdelmejid FAIZ Adnane LOUKILI Abdelmejid FAIZ Adnane LOUKILI\nAssocié Associé Associé Associé\nLafargeHolcim Maroc, 6, route de Mekka, Quartier les Crêtes, Casablanca 20150 / R.C. Casablanca 40779 / I.F. 016 40 889 - I.C.E. 001561191000066\n(cid:3) 4 (cid:3) 4",
    "tables": [
        [
            {
                "ÉTAT DE LA SITUATION FINANCIÈRE AU 31 DÉCEMBRE 2023": "(en milliers de dirhams)"
            },
            {
                "ÉTAT DE LA SITUATION FINANCIÈRE AU 31 DÉCEMBRE 2023": "ACTIF 31-déc-23 31-déc-22"
            },
            {
                "ÉTAT DE LA SITUATION FINANCIÈRE AU 31 DÉCEMBRE 2023": "Goodwill 7 372 391 7 372 391\nImmobilisations incorporelles 101 464 106 651\nImmobilisations corporelles 10 300 018 10 806 536\nImmobilisations en droit d'usage 53 683 52 471\nParticipations dans les entreprises associées 72 137 71 806\nAutres actifs financiers 92 715 96 706\nDont Instruments dérivés de couverture\nDont Prêts et créances non courants 92 715 96 706\nDont Titres disponibles à la vente\nCréances d'impôt et taxes 14 039 51 664\nImpôts différés actifs 3 149\nAutres débiteurs non courants"
            },
            {
                "ÉTAT DE LA SITUATION FINANCIÈRE AU 31 DÉCEMBRE 2023": "Actifs non-courants 18 006 450 18 558 374"
            },
            {
                "ÉTAT DE LA SITUATION FINANCIÈRE AU 31 DÉCEMBRE 2023": "Autres actifs financiers courants\nDont Prêts et créances\nStocks et en-cours 644 907 625 726\nCréances clients 1 032 640 914 938\nAutres débiteurs courants 302 112 292 372\nTrésorerie et équivalent de trésorerie 153 686 139 957\nActifs non courants détenus en vue de la vente"
            },
            {
                "ÉTAT DE LA SITUATION FINANCIÈRE AU 31 DÉCEMBRE 2023": "Actifs courants 2 133 345 1 972 993"
            },
            {
                "ÉTAT DE LA SITUATION FINANCIÈRE AU 31 DÉCEMBRE 2023": "TOTAL ACTIF 20 139 795 20 531 367"
            },
            {
                "ÉTAT DE LA SITUATION FINANCIÈRE AU 31 DÉCEMBRE 2023": ""
            },
            {
                "ÉTAT DE LA SITUATION FINANCIÈRE AU 31 DÉCEMBRE 2023": "PASSIF 31-déc-23 31-déc-22"
            },
            {
                "ÉTAT DE LA SITUATION FINANCIÈRE AU 31 DÉCEMBRE 2023": "Capital 702 937 702 937\nPrimes d’émission et de fusion 2 618 038 2 618 038\nRéserves 6 548 265 6 627 915\nÉcarts de conversion\nRésultats net part du groupe 1 547 820 1 391 685"
            },
            {
                "ÉTAT DE LA SITUATION FINANCIÈRE AU 31 DÉCEMBRE 2023": "Capitaux propres attribuables aux actionnaires\n11 417 059 11 340 575\nordinaires de la société mère"
            },
            {
                "ÉTAT DE LA SITUATION FINANCIÈRE AU 31 DÉCEMBRE 2023": "Intérêts minoritaires"
            },
            {
                "ÉTAT DE LA SITUATION FINANCIÈRE AU 31 DÉCEMBRE 2023": "Capitaux propres de l’ensemble consolidé 11 417 059 11 340 575"
            },
            {
                "ÉTAT DE LA SITUATION FINANCIÈRE AU 31 DÉCEMBRE 2023": "Provisions non courantes 149 097 162 423\nAvantages du personnel 619 036 703 632\nDettes financières non courantes 4 824 729 5 186 200\nDont Instruments dérivés de couverture\nDont Dettes envers les établissements de crédit 4 785 971 5 147 838\nDont Dettes représentées par un titre\nDont Dettes liées aux contrats de location financement\nDont Dettes liées aux contrats à droit d'usage 38 758 38 362\nDont Autres dettes\nDettes d'impôts société\nImpôts différés passifs 1 017 957 1 009 146"
            },
            {
                "ÉTAT DE LA SITUATION FINANCIÈRE AU 31 DÉCEMBRE 2023": "Passifs non courants 6 610 819 7 061 401"
            },
            {
                "ÉTAT DE LA SITUATION FINANCIÈRE AU 31 DÉCEMBRE 2023": "Provisions courantes 94 281 164 852\nDettes financières courantes 319 717 480 036\nDont Instruments dérivés de couverture\nDont Dettes envers les établissements de crédit 304 794 465 929\nDont Dettes représentées par un titre\nDont Dettes liées aux contrats de location financement\nDont Dettes liées aux contrats à droit d'usage 14 923 14 107\nDont Autres dettes\nDettes fournisseurs courantes 879 883 831 699\nAutres créditeurs courants 818 036 652 804\nPassifs liés aux actifs non courants détenus en vue de la vente"
            },
            {
                "ÉTAT DE LA SITUATION FINANCIÈRE AU 31 DÉCEMBRE 2023": "Passifs courants 2 111 917 2 129 391"
            },
            {
                "ÉTAT DE LA SITUATION FINANCIÈRE AU 31 DÉCEMBRE 2023": "TOTAL CAPITAUX PROPRES ET PASSIF 20 139 795 20 531 367"
            }
        ],
        [
            {
                "COMPTE DE RÉSULTAT CONSOLIDÉ AU 31 DÉCEMBRE 2023": "(en milliers de dirhams)"
            },
            {
                "COMPTE DE RÉSULTAT CONSOLIDÉ AU 31 DÉCEMBRE 2023": "Exercice clos 31-déc-23 31-déc-22"
            },
            {
                "COMPTE DE RÉSULTAT CONSOLIDÉ AU 31 DÉCEMBRE 2023": "Chiffre d’affaires 8 212 021 7 985 055\nAutres produits de l’activité"
            },
            {
                "COMPTE DE RÉSULTAT CONSOLIDÉ AU 31 DÉCEMBRE 2023": "Produits des activités ordinaires 8 212 021 7 985 055"
            },
            {
                "COMPTE DE RÉSULTAT CONSOLIDÉ AU 31 DÉCEMBRE 2023": "Achats (2 788 543) (2 761 898)\nAutres charges externes (1 078 678) (1 049 879)\nFrais de personnel (629 974) (607 893)\nImpôts et taxes (66 279) (62 796)\nAmortissements et provisions d’exploitation (715 084) (579 178)\nAutres produits et charges d’exploitation 44 056 (227 641)"
            },
            {
                "COMPTE DE RÉSULTAT CONSOLIDÉ AU 31 DÉCEMBRE 2023": "Charges d’exploitation courantes (5 234 502) (5 289 285)"
            },
            {
                "COMPTE DE RÉSULTAT CONSOLIDÉ AU 31 DÉCEMBRE 2023": "Résultat d’exploitation courant 2 977 519 2 695 770"
            },
            {
                "COMPTE DE RÉSULTAT CONSOLIDÉ AU 31 DÉCEMBRE 2023": "Cessions d’actifs 3 485 3 539\nCessions de filiales et participations 4 804\nAutres produits et charges d’exploitation non courants (395 604) (198 068)"
            },
            {
                "COMPTE DE RÉSULTAT CONSOLIDÉ AU 31 DÉCEMBRE 2023": "Autres produits et charges d’exploitation (392 119) (189 725)"
            },
            {
                "COMPTE DE RÉSULTAT CONSOLIDÉ AU 31 DÉCEMBRE 2023": "Résultat d’exploitation 2 585 400 2 506 045"
            },
            {
                "COMPTE DE RÉSULTAT CONSOLIDÉ AU 31 DÉCEMBRE 2023": "Coût de l’endettement financier net\nAutres produits financiers 11 478 8 513\nAutres charges financières (208 543) (228 086)"
            },
            {
                "COMPTE DE RÉSULTAT CONSOLIDÉ AU 31 DÉCEMBRE 2023": "Résultat financier (197 065) (219 573)"
            },
            {
                "COMPTE DE RÉSULTAT CONSOLIDÉ AU 31 DÉCEMBRE 2023": "Résultat avant impôt des entreprises intégrées 2 388 335 2 286 472"
            },
            {
                "COMPTE DE RÉSULTAT CONSOLIDÉ AU 31 DÉCEMBRE 2023": "Impôts sur les bénéfices (881 641) (783 203)\nImpôts différés 27 763 (125 134)"
            },
            {
                "COMPTE DE RÉSULTAT CONSOLIDÉ AU 31 DÉCEMBRE 2023": "Résultat net des entreprises intégrées 1 534 457 1 378 135"
            },
            {
                "COMPTE DE RÉSULTAT CONSOLIDÉ AU 31 DÉCEMBRE 2023": "Part dans les résultats des sociétés mises en équivalence 13 363 13 550"
            },
            {
                "COMPTE DE RÉSULTAT CONSOLIDÉ AU 31 DÉCEMBRE 2023": "Résultat net des activités poursuivies 1 547 820 1 391 685"
            },
            {
                "COMPTE DE RÉSULTAT CONSOLIDÉ AU 31 DÉCEMBRE 2023": "Résultat net des activités abandonnées"
            },
            {
                "COMPTE DE RÉSULTAT CONSOLIDÉ AU 31 DÉCEMBRE 2023": "Résultat de l’ensemble consolidé 1 547 820 1 391 685"
            },
            {
                "COMPTE DE RÉSULTAT CONSOLIDÉ AU 31 DÉCEMBRE 2023": "Intérêts minoritaires"
            },
            {
                "COMPTE DE RÉSULTAT CONSOLIDÉ AU 31 DÉCEMBRE 2023": "Résultat net - Part du Groupe 1 547 820 1 391 685"
            },
            {
                "COMPTE DE RÉSULTAT CONSOLIDÉ AU 31 DÉCEMBRE 2023": "Résultat net par le nombre moyen d’actions de la période\n- de base 66,4 59,7\n- dilué 66,4 59,7"
            }
        ],
        [
            {
                "BILAN ACTIF AU 31 DÉCEMBRE 2023": "Exercice Exercice\n(en dirhams) Brut Amortissements Net Précédent\net provisions Net"
            },
            {
                "BILAN ACTIF AU 31 DÉCEMBRE 2023": "ACTIF IMMOBILISÉ"
            },
            {
                "BILAN ACTIF AU 31 DÉCEMBRE 2023": "IMMOBILISATIONS EN NON VALEURS (A) 732 440 374,13 592 440 374,13 140 000 000,00 201 341 265,20"
            },
            {
                "BILAN ACTIF AU 31 DÉCEMBRE 2023": "Frais préliminaires\nCharges à repartir sur plusieurs exercices 732 440 374,13 592 440 374,13 140 000 000,00 201 341 265,20\nPrimes de remboursement des obligations"
            },
            {
                "BILAN ACTIF AU 31 DÉCEMBRE 2023": "IMMOBILISATIONS INCORPORELLES (B) 7 954 341 088,45 177 018 555,84 7 777 322 532,61 7 782 288 070,74"
            },
            {
                "BILAN ACTIF AU 31 DÉCEMBRE 2023": "Immobilisation en recherche et développement\nBrevets, marques, droits et valeurs similaires 50 442 369,23 50 100 981,31 341 387,92\nFonds commercial 7 682 256 303,44 7 418 761,68 7 674 837 541,76 7 674 837 541,76\nAutres immobilisations incorporelles 221 642 415,78 119 498 812,85 102 143 602,93 107 450 528,98"
            },
            {
                "BILAN ACTIF AU 31 DÉCEMBRE 2023": "IMMOBILISATIONS CORPORELLES (C) 20 369 304 831,39 13 916 384 243,10 6 452 920 588,29 7 077 964 455,43"
            },
            {
                "BILAN ACTIF AU 31 DÉCEMBRE 2023": "Terrains 978 680 363,10 108 940 339,89 869 740 023,21 886 727 944,64\nConstructions 4 260 651 229,82 2 066 675 742,87 2 193 975 486,95 2 251 911 956,00\nInstallations techniques, matériel et outillage 14 266 310 136,51 11 545 753 974,40 2 720 556 162,11 3 178 477 643,69\nMatériel de transport 46 731 801,49 21 348 559,09 25 383 242,40 32 156 874,49\nMobilier, matériel de bureau et aménagements divers 224 992 175,91 134 241 298,57 90 750 877,34 96 551 592,40\nAutres immobilisations corporelles 33 656 501,36 33 577 412,00 79 089,36 276 603,56\nImmobilisations corporelles en cours 558 282 623,20 5 846 916,28 552 435 706,92 631 861 840,65"
            },
            {
                "BILAN ACTIF AU 31 DÉCEMBRE 2023": "IMMOBILISATIONS FINANCIÈRES (D) 555 314 484,18 102 256 565,13 453 057 919,05 422 537 584,44"
            },
            {
                "BILAN ACTIF AU 31 DÉCEMBRE 2023": "Prêts immobilisés 23 209 759,21 520 664,57 22 689 094,64 26 901 138,03\nAutres créances financières 69 456 059,34 500 000,00 68 956 059,34 68 712 189,34\nTitres de participation 462 648 665,63 101 235 900,56 361 412 765,07 326 924 257,07\nAutres titres immobilisés"
            },
            {
                "BILAN ACTIF AU 31 DÉCEMBRE 2023": "ÉCARTS DE CONVERSION-ACTIF (E)"
            },
            {
                "BILAN ACTIF AU 31 DÉCEMBRE 2023": "Diminution des créances immobilisées\nAugmentation des dettes de financement"
            },
            {
                "BILAN ACTIF AU 31 DÉCEMBRE 2023": "TOTAL I (A+B+C+D+E) 29 611 400 778,15 14 788 099 738,20 14 823 301 039,95 15 484 131 375,81"
            },
            {
                "BILAN ACTIF AU 31 DÉCEMBRE 2023": "ACTIF CIRCULANT"
            },
            {
                "BILAN ACTIF AU 31 DÉCEMBRE 2023": "STOCKS (F) 697 722 477,57 73 697 280,13 624 025 197,44 612 511 885,42"
            },
            {
                "BILAN ACTIF AU 31 DÉCEMBRE 2023": "Marchandises 915 366,90 297 434,31 617 932,59 573 001,48\nMatières et fournitures consommables 501 232 949,16 73 361 345,63 427 871 603,53 473 432 702,17\nProduits en cours\nProduits intermédiaires et produits résiduels 129 527 142,58 129 527 142,58 73 688 095,16\nProduits finis 66 047 018,93 38 500,19 66 008 518,74 64 818 086,61"
            },
            {
                "BILAN ACTIF AU 31 DÉCEMBRE 2023": "CRÉANCES DE L'ACTIF CIRCULANT (G) 1 794 759 443,81 300 988 351,55 1 493 771 092,26 1 414 385 402,09"
            },
            {
                "BILAN ACTIF AU 31 DÉCEMBRE 2023": "Fournis débiteurs, avances et acomptes 6 313 282,02 6 313 282,02 7 770 377,35\nClients et comptes rattachés 1 231 309 457,61 178 637 925,89 1 052 671 531,72 928 366 645,81\nPersonnel 6 730 930,99 6 730 930,99 5 953 561,51\nÉtat 76 978 107,02 76 978 107,02 129 180 851,96\nComptes d'associés 119 627 559,00 86 977 500,00 32 650 059,00 59,00\nAutres débiteurs 322 962 244,81 35 372 925,66 287 589 319,15 307 168 493,64\nComptes de régularisation-Actif 30 837 862,36 30 837 862,36 35 945 412,82"
            },
            {
                "BILAN ACTIF AU 31 DÉCEMBRE 2023": "TITRES ET VALEURS DE PLACEMENT (H)"
            },
            {
                "BILAN ACTIF AU 31 DÉCEMBRE 2023": "ÉCARTS DE CONVERSION-ACTIF (I) 1 619 774,00 1 619 774,00 2 399 903,00\n(Éléments circulants)\nTOTAL II (F+G+H+I ) 2 494 101 695,38 374 685 631,68 2 119 416 063,70 2 029 297 190,51"
            },
            {
                "BILAN ACTIF AU 31 DÉCEMBRE 2023": "TRÉSORERIE"
            },
            {
                "BILAN ACTIF AU 31 DÉCEMBRE 2023": "TRÉSORERIE ACTIF 152 442 981,21 2 538 076,34 149 904 904,87 130 758 946,78"
            },
            {
                "BILAN ACTIF AU 31 DÉCEMBRE 2023": "Chèques et valeurs à encaisser\nBanques, TG et CCP 152 442 981,21 2 538 076,34 149 904 904,87 130 758 946,78\nCaisse, régie d'avances et accréditifs"
            },
            {
                "BILAN ACTIF AU 31 DÉCEMBRE 2023": "TOTAL III 152 442 981,21 2 538 076,34 149 904 904,87 130 758 946,78"
            },
            {
                "BILAN ACTIF AU 31 DÉCEMBRE 2023": "TOTAL GÉNÉRAL I+II+III 32 257 945 454,74 15 165 323 446,22 17 092 622 008,52 17 644 187 513,10"
            }
        ],
        [
            {
                "BILAN PASSIF AU 31 DÉCEMBRE 2023": "Exercice\n(en dirhams) Exercice\nPrécédent"
            },
            {
                "BILAN PASSIF AU 31 DÉCEMBRE 2023": "FINANCEMENT PERMANENT"
            },
            {
                "BILAN PASSIF AU 31 DÉCEMBRE 2023": "CAPITAUX PROPRES"
            },
            {
                "BILAN PASSIF AU 31 DÉCEMBRE 2023": "Capital social ou personnel 702 937 200,00 702 937 200,00\nMoins : actionnaires, capital souscrit non appelé capital appelé\ndont versé.......\nPrime d’émission, de fusion, d’apport 5 162 347 194,49 5 162 347 194,49\nEcarts de réévaluation\nRéserve légale 70 293 720,00 70 293 720,00\nAutres réserves 2 580 368 389,58 2 791 998 447,19\nReport à nouveau\nRésultats nets en instance d’affectation\nRésultat net de l’exercice 1 413 116 647,69 1 327 471 257,82"
            },
            {
                "BILAN PASSIF AU 31 DÉCEMBRE 2023": "Total des capitaux propres (A) 9 929 063 151,76 10 055 047 819,50"
            },
            {
                "BILAN PASSIF AU 31 DÉCEMBRE 2023": "CAPITAUX PROPRES ASSIMILÉS (B) 175 129 339,76 253 451 131,94"
            },
            {
                "BILAN PASSIF AU 31 DÉCEMBRE 2023": "Subvention d'investissement\nProvisions réglementées 175 129 339,76 253 451 131,94"
            },
            {
                "BILAN PASSIF AU 31 DÉCEMBRE 2023": "DETTES DE FINANCEMENT (C) 4 785 970 611,06 5 147 838 055,27"
            },
            {
                "BILAN PASSIF AU 31 DÉCEMBRE 2023": "Emprunts obligataires\nAutres dettes de financement 4 785 970 611,06 5 147 838 055,27"
            },
            {
                "BILAN PASSIF AU 31 DÉCEMBRE 2023": "PROVISIONS DURABLES POUR RISQUES ET CHARGES (D) 194 393 525,03 169 394 158,73"
            },
            {
                "BILAN PASSIF AU 31 DÉCEMBRE 2023": "Provisions pour risques 75 606 322,31 66 146 035,70\nProvisions pour charges 118 787 202,72 103 248 123,03"
            },
            {
                "BILAN PASSIF AU 31 DÉCEMBRE 2023": "ECARTS DE CONVERSION-PASSIF (E)"
            },
            {
                "BILAN PASSIF AU 31 DÉCEMBRE 2023": "Augmentation des créances immobilisées\nDiminution des dettes de financement"
            },
            {
                "BILAN PASSIF AU 31 DÉCEMBRE 2023": "Total I (A+B+C+D+E) 15 084 556 627,61 15 625 731 165,44"
            },
            {
                "BILAN PASSIF AU 31 DÉCEMBRE 2023": "PASSIF CIRCULANT"
            },
            {
                "BILAN PASSIF AU 31 DÉCEMBRE 2023": "DETTES DU PASSIF CIRCULANT (F) 1 651 332 028,62 1 432 298 867,61"
            },
            {
                "BILAN PASSIF AU 31 DÉCEMBRE 2023": "Fournisseurs et comptes rattachés 847 240 623,06 783 070 962,58\nClients créditeurs, avances et acomptes 126 211 188,80 109 583 424,20\nPersonnel 150 346 841,51 114 906 047,62\nOrganismes sociaux 42 496 973,04 34 826 412,66\nEtat 284 836 119,03 189 726 267,78\nComptes d’associés 75 118 205,15 72 118 205,15\nAutres créanciers 123 655 594,01 126 048 218,24\nComptes de régularisation-passif 1 426 484,02 2 019 329,38"
            },
            {
                "BILAN PASSIF AU 31 DÉCEMBRE 2023": "AUTRES PROVISIONS POUR RISQUES ET CHARGES (G) 49 704 251,74 122 003 103,84"
            },
            {
                "BILAN PASSIF AU 31 DÉCEMBRE 2023": "ECARTS DE CONVERSION-PASSIF (Eléments circulants) (H) 2 775 863,00 2 305 584,00"
            },
            {
                "BILAN PASSIF AU 31 DÉCEMBRE 2023": "Total II (F+G+H) 1 703 812 143,36 1 556 607 555,45"
            },
            {
                "BILAN PASSIF AU 31 DÉCEMBRE 2023": "TRÉSORERIE"
            },
            {
                "BILAN PASSIF AU 31 DÉCEMBRE 2023": "TRÉSORERIE-PASSIF 304 253 237,55 461 848 792,21"
            },
            {
                "BILAN PASSIF AU 31 DÉCEMBRE 2023": "Crédits d’escompte\nCrédits de trésorerie\nBanques (soldes créditeurs) 304 253 237,55 461 848 792,21"
            },
            {
                "BILAN PASSIF AU 31 DÉCEMBRE 2023": "Total III 304 253 237,55 461 848 792,21"
            },
            {
                "BILAN PASSIF AU 31 DÉCEMBRE 2023": "TOTAL GENERAL I+II+III 17 092 622 008,52 17 644 187 513,10"
            }
        ],
        [
            {
                "COMPTE DE PRODUITS ET CHARGES ( HORS TAXES ) AU 31 DÉCEMBRE 2023": "(en dirhams) Opérations\nTOTAUX DE TOTAUX DE\nConcernant\nL’EXERCICE L’EXERCICE\nPropres à les exercices\nNATURE PRÉCÉDENT\nl’exercice précédents\n3=1+2 4\n1 2",
                "COMPTE DE PRODUITS ET CHARGES ( HORS TAXES ) - SUITE -": "(en dirhams) Opérations\nTOTAUX DE TOTAUX DE\nConcernant L’EXERCICE L’EXERCICE\nNATURE Propres à les exercices PRÉCÉDENT\nl’exercice précédents 3=1+2 4\n1 2"
            },
            {
                "COMPTE DE PRODUITS ET CHARGES ( HORS TAXES ) AU 31 DÉCEMBRE 2023": "I PRODUITS D’EXPLOITATION",
                "COMPTE DE PRODUITS ET CHARGES ( HORS TAXES ) - SUITE -": "VII RÉSULTAT COURANT (reports) 2 589 904 542,82 2 302 319 321,33"
            },
            {
                "COMPTE DE PRODUITS ET CHARGES ( HORS TAXES ) AU 31 DÉCEMBRE 2023": "Ventes de marchandises (en l’état) 47 811 959,40 47 811 959,40 2 910 482,18\nVentes de biens et services produits 8 027 384 076,08 8 027 384 076,08 7 856 310 156,06",
                "COMPTE DE PRODUITS ET CHARGES ( HORS TAXES ) - SUITE -": ""
            },
            {
                "COMPTE DE PRODUITS ET CHARGES ( HORS TAXES ) AU 31 DÉCEMBRE 2023": "",
                "COMPTE DE PRODUITS ET CHARGES ( HORS TAXES ) - SUITE -": "VIII PRODUITS NON COURANTS\nProduits des cessions d’immobilisations 10 308 419,99 10 308 419,99 293 333,34\nSubventions d’équilibre\nReprises sur subventions\nd’investissement\nAutres produits non courants 8 939 129,55 8 939 129,55 6 458 779,89\nReprises non courantes ; transferts de\n189 758 149,21 189 758 149,21 233 738 619,83\ncharges"
            },
            {
                "COMPTE DE PRODUITS ET CHARGES ( HORS TAXES ) AU 31 DÉCEMBRE 2023": "Chiffre d’affaires 8 075 196 035,48 8 075 196 035,48 7 859 220 638,24",
                "COMPTE DE PRODUITS ET CHARGES ( HORS TAXES ) - SUITE -": ""
            },
            {
                "COMPTE DE PRODUITS ET CHARGES ( HORS TAXES ) AU 31 DÉCEMBRE 2023": "Variation de stocks de produits 56 854 251,75 56 854 251,75 -19 233 725,20\nImmobilisations produites par l’entreprise\nSubventions d’exploitation\nAutres produits d’exploitation\nReprises d’exploitation: transferts de charges 46 335 816,80 46 335 816,80 166 779 104,48",
                "COMPTE DE PRODUITS ET CHARGES ( HORS TAXES ) - SUITE -": ""
            },
            {
                "COMPTE DE PRODUITS ET CHARGES ( HORS TAXES ) AU 31 DÉCEMBRE 2023": "Total I 8 178 386 104,03 8 178 386 104,03 8 006 766 017,52",
                "COMPTE DE PRODUITS ET CHARGES ( HORS TAXES ) - SUITE -": ""
            },
            {
                "COMPTE DE PRODUITS ET CHARGES ( HORS TAXES ) AU 31 DÉCEMBRE 2023": "II CHARGES D’EXPLOITATION",
                "COMPTE DE PRODUITS ET CHARGES ( HORS TAXES ) - SUITE -": ""
            },
            {
                "COMPTE DE PRODUITS ET CHARGES ( HORS TAXES ) AU 31 DÉCEMBRE 2023": "Achats revendus de marchandises 46 260 499,38 46 260 499,38 1 820 555,78\nAchats consommés de matières et fournitures 2 683 142 755,69 2 683 142 755,69 2 699 795 314,82\nAutres charges externes 1 074 933 444,97 1 074 933 444,97 1 046 299 259,29\nImpôts et taxes 63 790 439,23 63 790 439,23 60 765 553,72\nCharges de personnel 622 049 602,85 622 049 602,85 587 612 503,70\nAutres charges d’exploitation 22 441 946,17 22 441 946,17 134 445 326,97\nDotations d’exploitation 919 021 480,96 919 021 480,96 934 416 800,00",
                "COMPTE DE PRODUITS ET CHARGES ( HORS TAXES ) - SUITE -": ""
            },
            {
                "COMPTE DE PRODUITS ET CHARGES ( HORS TAXES ) AU 31 DÉCEMBRE 2023": "",
                "COMPTE DE PRODUITS ET CHARGES ( HORS TAXES ) - SUITE -": "Total VIII 209 005 698,75 209 005 698,75 240 490 733,06"
            },
            {
                "COMPTE DE PRODUITS ET CHARGES ( HORS TAXES ) AU 31 DÉCEMBRE 2023": "",
                "COMPTE DE PRODUITS ET CHARGES ( HORS TAXES ) - SUITE -": "IX CHARGES NON COURANTES"
            },
            {
                "COMPTE DE PRODUITS ET CHARGES ( HORS TAXES ) AU 31 DÉCEMBRE 2023": "",
                "COMPTE DE PRODUITS ET CHARGES ( HORS TAXES ) - SUITE -": "Valeurs nettes d'amortissements des\n5 903 539,57 5 903 539,57\nimmobilisations cédées\nSubventions accordées\nAutres charges non courantes 240 268 129,89 240 268 129,89 325 403 631,27\nDotations non courantes aux\n274 602 467,82 274 602 467,82 112 606 259,86\namortissements et aux provisions"
            },
            {
                "COMPTE DE PRODUITS ET CHARGES ( HORS TAXES ) AU 31 DÉCEMBRE 2023": "Total II 5 431 640 169,25 5 431 640 169,25 5 465 155 314,28",
                "COMPTE DE PRODUITS ET CHARGES ( HORS TAXES ) - SUITE -": ""
            },
            {
                "COMPTE DE PRODUITS ET CHARGES ( HORS TAXES ) AU 31 DÉCEMBRE 2023": "III RÉSULTAT D’EXPLOITATION (I-II) 2 746 745 934,78 2 541 610 703,24",
                "COMPTE DE PRODUITS ET CHARGES ( HORS TAXES ) - SUITE -": ""
            },
            {
                "COMPTE DE PRODUITS ET CHARGES ( HORS TAXES ) AU 31 DÉCEMBRE 2023": "IV PRODUITS FINANCIERS",
                "COMPTE DE PRODUITS ET CHARGES ( HORS TAXES ) - SUITE -": ""
            },
            {
                "COMPTE DE PRODUITS ET CHARGES ( HORS TAXES ) AU 31 DÉCEMBRE 2023": "Produits de titres de participation et autres\n12 396 547,86 12 396 547,86 9 167 953,58\ntitres immobilisés\nGains de change 4 696 602,37 4 696 602,37 7 048 992,43\nIntérêts et autres produits financiers 10 386 770,29 10 386 770,29 8 281 210,97\nReprises financières ; transferts de charges 106 888 411,00 106 888 411,00 26 038 569,44",
                "COMPTE DE PRODUITS ET CHARGES ( HORS TAXES ) - SUITE -": ""
            },
            {
                "COMPTE DE PRODUITS ET CHARGES ( HORS TAXES ) AU 31 DÉCEMBRE 2023": "",
                "COMPTE DE PRODUITS ET CHARGES ( HORS TAXES ) - SUITE -": "Total IX 520 774 137,28 520 774 137,28 438 009 891,13"
            },
            {
                "COMPTE DE PRODUITS ET CHARGES ( HORS TAXES ) AU 31 DÉCEMBRE 2023": "",
                "COMPTE DE PRODUITS ET CHARGES ( HORS TAXES ) - SUITE -": "X RÉSULTAT NON COURANT (VIII-IX) -311 768 438,53 -197 519 158,07"
            },
            {
                "COMPTE DE PRODUITS ET CHARGES ( HORS TAXES ) AU 31 DÉCEMBRE 2023": "",
                "COMPTE DE PRODUITS ET CHARGES ( HORS TAXES ) - SUITE -": "XI RÉSULTAT AVANT IMPÔTS (VII+X) 2 278 136 104,29 2 104 800 163,26"
            },
            {
                "COMPTE DE PRODUITS ET CHARGES ( HORS TAXES ) AU 31 DÉCEMBRE 2023": "Total IV 134 368 331,52 134 368 331,52 50 536 726,42",
                "COMPTE DE PRODUITS ET CHARGES ( HORS TAXES ) - SUITE -": "XII IMPÔTS SUR LES SOCIÉTÉS 865 019 456,60 777 328 905,44"
            },
            {
                "COMPTE DE PRODUITS ET CHARGES ( HORS TAXES ) AU 31 DÉCEMBRE 2023": "V CHARGES FINANCIÈRES",
                "COMPTE DE PRODUITS ET CHARGES ( HORS TAXES ) - SUITE -": ""
            },
            {
                "COMPTE DE PRODUITS ET CHARGES ( HORS TAXES ) AU 31 DÉCEMBRE 2023": "",
                "COMPTE DE PRODUITS ET CHARGES ( HORS TAXES ) - SUITE -": "XIII RÉSULTAT NET (XI-XII) 1 413 116 647,69 1 327 471 257,82"
            },
            {
                "COMPTE DE PRODUITS ET CHARGES ( HORS TAXES ) AU 31 DÉCEMBRE 2023": "Charges d’intérêts 233 227 031,90 233 227 031,90 245 012 217,44\nPertes de change 5 072 625,54 5 072 625,54 2 961 920,22\nAutres charges financières 268,41 268,41 534,65\nDotations financières 52 909 797,63 52 909 797,63 41 853 436,02",
                "COMPTE DE PRODUITS ET CHARGES ( HORS TAXES ) - SUITE -": ""
            },
            {
                "COMPTE DE PRODUITS ET CHARGES ( HORS TAXES ) AU 31 DÉCEMBRE 2023": "",
                "COMPTE DE PRODUITS ET CHARGES ( HORS TAXES ) - SUITE -": "XIV TOTAL DES PRODUITS (I+IV+VIII) 8 521 760 134,30 8 297 793 477,00"
            },
            {
                "COMPTE DE PRODUITS ET CHARGES ( HORS TAXES ) AU 31 DÉCEMBRE 2023": "",
                "COMPTE DE PRODUITS ET CHARGES ( HORS TAXES ) - SUITE -": "TOTAL DES CHARGES\nXV 7 108 643 486,61 6 970 322 219,18\n(II +V+IX+XIII)"
            },
            {
                "COMPTE DE PRODUITS ET CHARGES ( HORS TAXES ) AU 31 DÉCEMBRE 2023": "Total V 291 209 723,48 291 209 723,48 289 828 108,33",
                "COMPTE DE PRODUITS ET CHARGES ( HORS TAXES ) - SUITE -": ""
            },
            {
                "COMPTE DE PRODUITS ET CHARGES ( HORS TAXES ) AU 31 DÉCEMBRE 2023": "VI RÉSULTAT FINANCIER (IV-V) -156 841 391,96 -239 291 381,91",
                "COMPTE DE PRODUITS ET CHARGES ( HORS TAXES ) - SUITE -": "RÉSULTAT NET\nXVI 1 413 116 647,69 1 327 471 257,82\n(total des produits-total des charges)"
            },
            {
                "COMPTE DE PRODUITS ET CHARGES ( HORS TAXES ) AU 31 DÉCEMBRE 2023": "VII RÉSULTAT COURANT (III+VI) 2 589 904 542,82 2 302 319 321,33",
                "COMPTE DE PRODUITS ET CHARGES ( HORS TAXES ) - SUITE -": ""
            }
        ],
        [
            {
                "Questions clés identifiées": "Le Bilan de la société comprend des immobilisations corporelles\nprésentant des valeurs comptables nettes de MMAD 6 453\nreprésentant 38% du total des actifs de la société.\nCes actifs peuvent présenter un risque de dépréciation lié à des\nfacteurs internes ou externes, notamment des conditions de\nmarché défavorables, des changements de législations ou de\nréglementations, une évolution de l’environnement concurrentiel\net une détérioration de la performance de la société.\nLa société réalise des tests de dépréciation sur ces\nimmobilisations corporelles en cas d’identification d’un indice de\nperte de valeur selon les principes décrits dans le paragraphe\n« Evaluation des immobilisations » de l’état A1 de l’ETIC « Etat\ndes informations complémentaires ». Une dépréciation doit être\nconstatée, dès lors que la valeur comptable de l’actif excède sa\nvaleur actuelle.\nLe test de dépréciation des immobilisations corporelles\nest considéré comme un point clé de l’audit compte tenu\nde la matérialité des montants pris dans leur ensemble,\ndes montants significatifs en termes de dépréciation qui\npourraient potentiellement en résulter et du fait du degré\nélevé d’estimations et de jugement requis par la société pour\napprécier les indices de perte de valeur et la valeur actuelle\ndes actifs. Les éléments de jugement incluent notamment des\nhypothèses relatives à l’évolution de l’activité de la société.",
                "Notre réponse": "Nous avons pris connaissance des procédures mises en\nplace par la direction dans le cadre des tests de dépréciation\nnotamment des jugements relatifs à la détermination des\nindices de perte de valeur et la détermination de la valeur\nactuelle.\nNous avons examiné les contrôles clés mis en place par la\ndirection ainsi que ses conclusions sur la présence ou l’absence\nd’indicateurs de perte de valeur dans le cadre du processus\nd’estimation des tests de dépréciation.\nPour les cas où un indice de perte de valeur a été identifié\net lorsque la valeur actuelle a été appréhendée par la valeur\nactuelle des flux de trésorerie futurs :\n- Nous avons revu la cohérence des hypothèses et des\ndonnées clés des modèles de flux de trésorerie avec les\ndonnées historiques et prévisionnelles.\n- Nous avons testé par sondage l’exactitude arithmétique des\ncalculs du modèle de flux de trésorerie.\n- Nous avons examiné les analyses de sensibilité préparées par\nla direction afin d’évaluer le niveau de marge entre la valeur\nactuelle et la valeur comptable."
            }
        ],
        [
            {
                "Questions clés identifiées": "Le Bilan du groupe comprend des immobilisations corporelles\ns’élevant à MMAD 10.300, représentant 51% du total des actifs\ndu groupe.\nCes actifs peuvent présenter un risque de dépréciation lié à des\nfacteurs internes ou externes, notamment des conditions de\nmarché défavorables, des changements de législations ou de\nréglementations, une évolution de l’environnement concurrentiel\net une détérioration de la performance du Groupe.\nLe Groupe réalise des tests de dépréciation sur ces\nimmobilisations corporelles en cas d’identification d’un indice de\nperte de valeur selon les principes décrits dans le paragraphe\n« Tests de dépréciation des actifs » de la Note 3.11 « Tests\nde dépréciation et pertes de valeur des actifs » de l’annexe\naux états financiers consolidés. Une dépréciation doit être\nconstatée, dès lors que la valeur comptable de l’actif excède sa\nvaleur recouvrable. La valeur recouvrable est le montant le plus\nélevé de la juste valeur diminuée des coûts de cession et de la\nvaleur d’utilité.\nLe test de dépréciation des immobilisations corporelles\nest considéré comme un point clé de l’audit compte tenu\nde la matérialité des montants pris dans leur ensemble,\ndes montants significatifs en termes de dépréciation qui\npourraient potentiellement en résulter et du fait du degré\nélevé d’estimations et de jugement requis par le groupe pour\napprécier les indices de perte de valeur et la valeur recouvrable\ndes actifs. Les éléments de jugement incluent notamment des\nhypothèses relatives à l’évolution de l’activité du Groupe.",
                "Notre réponse": "Nous avons pris connaissance des procédures mises en\nplace par la direction dans le cadre des tests de dépréciation\nnotamment des jugements relatifs à la détermination des\nindices de perte de valeur et la détermination de la valeur\nrecouvrable.\nNous avons examiné les contrôles clés mis en place par la\ndirection ainsi que ses conclusions sur la présence ou l’absence\nd’indicateurs de perte de valeur dans le cadre des tests de\ndépréciation. Dans les cas où un indice de perte de valeur a été\nidentifié et lorsque la valeur recouvrable a été appréhendée par\nla valeur d’utilité :\n- Nous avons revu la cohérence des hypothèses et des\ndonnées clés des modèles de flux de trésorerie avec les\ndonnées historiques et prévisionnelles.\n- Nous avons testé par sondage l’exactitude arithmétique des\ncalculs du modèle de flux de trésorerie.\n- Nous avons examiné les analyses de sensibilité préparées par\nla direction afin d’évaluer le niveau de marge entre la valeur\nrecouvrable et la valeur comptable.\n- Nous avons examiné les informations relatives aux tests\nde dépréciation présentées dans les annexes aux états\nfinanciers."
            }
        ]
    ]
}