{
    "text": "COMMUNIQUÉ INDICATEURS ANNUELS\nFINANCIER au 31 Décembre 2023\nDES RÉSULTATS 2023 RECORD : EBE +24%, RNC +18%\nHAUSSE PROPOSÉE DU DIVIDENDE ORDINAIRE : +23%\nAprès un investissement cumulé de plus de 1 500 MDH en 5 ans, Mutandis reviendra à un capex normatif dès 2025. Cette perspective, ainsi que\nle désendettement instantané consécutif à la cession de l’activité bouteilles alimentaires, libèrent les cashflows en faveur de la rémunération des\nactionnaires. Il est ainsi proposé de porter le dividende ordinaire de 8,50 DH à 10,50 DH, payable dès 2024.\nEn date du 21/02/2024, la gérance a décidé d’arrêter les comptes sociaux et consolidés de l’exercice clos au 31 décembre 2023 comme suit :\nChiffre d’affaires consolidé 2023 : 2 442 MDH (+5% vs 2022 )\n- Détergents : Le CA de nos marques propres est en hausse de +3% vs 2022, tirée par le CA de la poudre machine\net de la lessive liquide. Le CA global (y compris export et MDD) est stable avec des volumes de vente en baisse\nde -5% compensés par les hausses de prix ;\n- Produits de la mer : Le CA conserves est stable vs 2022, en dépit de la baisse des volumes (-9%), grâce à CHIFFRE D’AFFAIRES CONSOLIDÉ\nl’effet mix et à la hausse des prix. Le CA global est également stable sur l’année ; EN MDH\n- Bouteilles alimentaires : Le CA baisse de -10% vs 2022 (effet indexation des prix sur le PET sans impact\n+5%\nsur la marge). Les volumes de la catégorie sont en légère baisse ( -5% à fin 2023), après une année 2022 2 442\nparticulièrement favorable ;\n2 329\n- Boissons : Le CA des boissons à base de fruits est en hausse de +41% vs 2022 et les volumes en hausse de\n710\n+73% grâce au succès du lancement de la nouvelle boisson Frut. Le CA de l’activité eau récemment acquise\n683\nest de 153 MDH sur la période et conforme à nos prévisions ; Détergents\n649\n- Season Brand : Le CA de Season brand est de 632 MDH , en hausse de +4% par rapport à 2022 grâce à la\nhausse des prix de vente sur la période, avec des volumes en légère baisse (-2%). Les nouveaux canaux de Produits de la mer 660\n276\ndistribution connaissent une progression rapide.\nBouteilles alimentaires 345\n246\nS’agissant du T4 2023, le chiffre d’affaires s’élève à 694 MDH (+7% vs T4 2022). Il est réparti comme suit : Boissons 79\nSeason brand 561 561\nT4 2023 VAR dh VAR vol\n2022 2023\nDétergents 171 -2% -3%\nProduits de la mer 209 +14% +6%\nBouteilles alimentaires 62 -16% -4%\nBoissons 72 +3% 0%\nSeason Brand 181 -8% -6%\nLes chiffres trimestriels et annuels par catégorie sont donnés sans l’élimination des ventes intragroupe pour une meilleure analyse de l’évolution de la\ncatégorie.\nExcédent Brut d’Exploitation (EBE) 2023 : 335 MDH (+24% vs 2022)\n- Amélioration des marges par la stabilisation des prix des intrants ;\n- Impact sur nos marges en année pleine de la hausse de nos prix de vente entamée progressivement en 2022 ;\n- Bonne maitrise des coûts fixes malgré le contexte inflationniste.\nRésultat Net Courant* 2023 : 125 MDH (+18%)\n- Hausse des amortissements consécutive aux programmes de développement initiés depuis 2019 ;\n- Hausse des frais financiers relative à la dette d’acquisition de Ain Ifrane ;\n- Le Résultat Net total (y compris éléments ponctuels, à caractère non récurrent) atteint également un niveau record, à 113 MDH (+13% vs 2022).\n* Hors éléments non courants et impôts différés\nCapex, Dette Nette et Dividende\n- Capex : L’investissement de l’année 2023 s’élève à 529 MDH, incluant la fin de la construction des 3 nouvelles usines et l’acquisition de Ain Ifrane.\n- Dette nette bancaire : 1 102 MDH (vs 739 MDH au 31 décembre 2022), soit un gearing de 44%.\n- Dividende ordinaire 2024 proposé : 10,5 DH par action, vs 8,5 DH en 2023, soit +23%.\nGuidance 2024 :\nLa guidance 2024 est présentée en excluant l’activité bouteilles alimentaires (cession anticipée au T1 2024) des deux exercices 2023 et 2024.\n- Chiffre d’affaires 2024 : ~+5%\n- EBE 2024 : +10% à +15%\n- RNC 2024 : +10% à +15%\n- Le Résultat Net total (y compris éléments non courants) comprendra la plus-value réalisée lors de la cession de l’activité bouteilles alimentaires\net ne sera donc pas représentatif de la rentabilité récurrente de Mutandis.\nLa guidance sera maintenue ou révisée lors de chaque publication trimestrielle.\nTous les chiffres sont issus des comptes consolidés aux normes IFRS audités, MDH = Millions DH\nMUTANDIS : 22, boulevard Abdelkrim El Khattabi CONTACT INVESTISSEURS :\nCasablanca, Maroc fmediouni@mutandis.com\nTéléphone : 05 22 98 43 88\nMARQUES PROPRES\nSociété en Commandite par Actions Faisant Appel Public à l’Epargne\nCapital 924.673.700 dirhams\nSiège Social : Casablanca, 22 boulevard Abdelkrim Al Khattabi\nRC Casablanca n° 180 175 - IF Casablanca n° 40165169\nAVIS DE REUNION VALANT AVIS DE CONVOCATION\nA L’ASSEMBLEE GENERALE ORDINAIRE ANNUELLE\nLe 3 avril 2024 à midi\nMesdames et Messieurs les actionnaires de la société MUTANDIS, Société en Commandite par Actions faisant appel public à\nl’épargne, au capital de 924.673.700 dirhams, dont le siège social est établi au 22 Boulevard Abdelkrim Al Khattabi à\nCasablanca, Maroc, immatriculée au Registre du Commerce de Casablanca sous le n°180 175 (ci-après la « Société »), sont\nconvoqués à l’Assemblée Générale Ordinaire Annuelle de la Société qui se tiendra au siège social de la Société (22 Boulevard\nAbdelkrim Al Khattabi, Casablanca, Maroc), le 3 avril 2024 à midi (ci-après « l’Assemblée Générale »).\nCi-après l’ordre du jour de cette Assemblée Générale, les modalités pratiques de participation à cette Assemblée\nGénérale, et le texte des résolutions qui seront soumises à votre approbation.\nLes actionnaires réunissant les conditions exigées par l’article 117 de la loi 17-95 relative aux Sociétés Anonymes\ntelle que modifiée et complétée disposent d’un délai de dix (10) jours à compter de la publication du présent avis pour\ndemander l’inscription de projets de résolutions à l’ordre du jour de l’Assemblée Générale. La demande d'inscription\ndes projets de résolutions à l'ordre du jour doit être déposée ou adressée au siège social de la Société contre accusé de\nréception dans le délai précité.\nTous les documents et informations prévus à l’article 121, 121 bis et 141 de la loi 17-95 relative aux Sociétés\nAnonymes telle que modifiée et complétée peuvent être consultés sur notre site Internet : www.mutandis.com.\nLe présent avis vaut avis de convocation, sous réserve qu’aucune modification ne soit apportée à l’ordre du jour, par\nsuite d’éventuelles demandes d’inscriptions de projets de résolutions ou de points à l’ordre du jour présentés par les\nactionnaires de la Société.\nLe Gérant\nORDRE DU JOUR\n1. Présentation du rapport du Gérant, du rapport du Conseil de Surveillance, et du rapport général des Commissaires\naux Comptes sur les comptes sociaux arrêtés au 31 décembre 2023 et approbation des comptes clos à cette\ndate ;\n2. Présentation du rapport du Gérant, du rapport du Conseil de Surveillance, et du rapport des Commissaires aux\nComptes sur les comptes consolidés au 31 décembre 2023 et approbation des comptes consolidés clos à cette\ndate ;\n3. Affectation du résultat de l’exercice clos le 31 décembre 2023 et distribution de sommes ;\n4. Rémunération des membres du Conseil de Surveillance ;\n5. Présentation du rapport spécial des Commissaires aux Comptes sur les conventions réglementées et\napprobation desdites conventions ;\n6. Quitus à conférer au Gérant pour sa gestion au titre de l’exercice clos le 31 décembre 2023 ;\n7. Décharge aux Commissaires aux Comptes pour leur mission au titre de l’exercice clos le 31 décembre 2023 ;\n8. Mandat des Commissaires aux Comptes ;\n9. Pouvoirs en vue de formalités.\nSCA au capital de 924.673.700 DH\nRC 180 175 – IF 40165169 – TP 34782735 - CNSS 7780027\n22, boulevard Abdelkrim Al Khattabi – 20.100 Casablanca – Maroc\nTel. +212 5 22 98 43 88 – Fax +212 5 22 98 34 60 – www.mutandis.com\nMODALITES DE PARTICIPATION\nTout actionnaire quel que soit le nombre d’actions qu’il possède peut participer à l’Assemblée Générale sur simple\njustification de son identité et de la propriété de ses actions.\nLes propriétaires d’actions au porteur doivent, pour avoir le droit de participer à cette Assemblée Générale, déposer au\nsiège social de MUTANDIS SCA à Casablanca, 22 boulevard Abdelkrim Al Khattabi, cinq (5) jours au plus avant la\ndate de la réunion, un certificat de dépôt délivré par l’établissement dépositaire de ces actions.\nTout actionnaire quel que soit le nombre d’actions qu’il possède peut y participer personnellement, par\ncorrespondance ou en donnant pouvoir à une personne de son choix parmi les personnes énumérées ci-après.\nModalités de vote par pouvoir\nUn actionnaire ne peut se faire représenter que par son conjoint, un ascendant, descendant ou par un autre actionnaire\njustifiant d'un pouvoir. Il peut également se faire représenter par toute personne morale ayant pour objet social la\ngestion de portefeuilles de valeurs mobilières.\nPour tout pouvoir d’un actionnaire adressé à la Société sans indication de mandataire, le président de l’Assemblée\nGénérale émet un vote favorable à l’adoption des projets de résolutions présentés par la Gérance et un vote\ndéfavorable à l’adoption de tous les autres projets de résolutions.\nLe modèle de pouvoir est mis à la disposition des actionnaires au siège social de la Société. Il peut également être\ntéléchargé sur le site internet de la Société : www.mutandis.com.\nLe pouvoir doit être accompagné de l’attestation originale délivrée par l’organisme dépositaire des actions et, (i) soit\nenvoyée par courrier recommandé avec accusé de réception, (ii) soit déposé contre accusé de réception (remise en\nmains propres), au siège social de MUTANDIS SCA à Casablanca, 22 boulevard Abdelkrim Al Khattabi, cinq (5)\njours au moins avant la réunion de l’Assemblée Générale.\nTout pouvoir non accompagné de l’original de l’attestation de propriété des actions et/ou non reçu dans le délai\nmentionné ci-dessus, ne sera pas pris en compte pour le vote des résolutions.\nModalités de vote par correspondance\nLes actionnaires peuvent voter au moyen d’un formulaire de vote par correspondance.\nCe formulaire est mis à la disposition des actionnaires au siège social de MUTANDIS SCA. Il peut également être\ntéléchargé sur le site internet de MUTANDIS SCA : www.mutandis.com. Il doit être envoyé au siège de la Société à\nCasablanca, 22 boulevard Abdelkrim Al Khattabi, accompagné de l’attestation originale délivrée par l’organisme\ndépositaire des actions soit par courrier recommandé avec accusé de réception, soit déposé contre accusé de réception\n(remise en mains propres), à l’adresse ci-dessus indiqué, au plus tard deux (2) jours avant la réunion de l’Assemblée\nGénérale.\nTout formulaire non accompagné de l’original de l’attestation de propriété des actions et/ou non reçu dans le délai\nmentionné ci-dessus, ne sera pas pris en compte pour le vote des résolutions.\nSCA au capital de 924.673.700 DH\nRC 180 175 – IF 40165169 – TP 34782735 - CNSS 7780027\n22, boulevard Abdelkrim Al Khattabi – 20.100 Casablanca – Maroc\nTel. +212 5 22 98 43 88 – Fax +212 5 22 98 34 60 – www.mutandis.com\nPROJET DE RESOLUTIONS\nPREMIERE RESOLUTION\nL'Assemblée Générale, après avoir entendu l’exposé du rapport du Gérant, l’exposé du rapport du Conseil de\nSurveillance, et à la lecture du rapport général des Commissaires aux Comptes, approuve les termes de ces rapports et\nles comptes sociaux arrêtés au 31 décembre 2023, tels qu'ils lui ont été présentés, lesquels font ressortir un bénéfice net\ncomptable de 30.316.449,72 dirhams.\nDEUXIEME RESOLUTION\nL’Assemblée Générale, après avoir entendu l’exposé du rapport du Gérant, l’exposé du rapport du Conseil de\nSurveillance, et à la lecture du rapport des Commissaires aux Comptes sur les comptes consolidés, approuve les termes\nde ces rapports et les comptes consolidés tels qu'ils lui ont été présentés, lesquels font ressortir un résultat consolidé de\n112.647.580,72 dirhams dont un résultat part du groupe de 112.704.964,87 dirhams.\nTROISIEME RESOLUTION\nLe Président rappelle que les montants distribuables se composent :\n• du résultat bénéficiaire de l’exercice clos au 31 décembre 2023 s’élevant à 30.316.449,72 dirhams diminué\nde la réserve légale,\n• du report à nouveau de 451.853,94 dirhams,\n• de la prime d'émission de 257.212.339,21 dirhams.\nL’Assemblée Générale décide d'affecter la somme de 1.515.822,49 dirhams à la réserve légale et de distribuer un\nmontant de 10,50 dirhams par action (dont 29.252.481,17 dirhams à prélever sur le bénéfice distribuable et\n68.129.485,82 dirhams à prélever sur la prime d'émission), soit un montant total de 97.381.966,99 dirhams réparti\ncomme suit :\n• 291.228,49 dirhams revenant à l’Associé Commandité,\n• 97.090.738,50 dirhams revenant aux Actionnaires Commanditaires.\nAprès la distribution, les capitaux propres de la Société s'établiront de la manière suivante :\nCapital social 924.673.700,00 dirhams\nRéserve légale 31.396.875,08 dirhams\nPrime d’émission 189.082.853,39 dirhams\nTotal capitaux propres 1.145.153.428,47 dirhams\nQUATRIEME RESOLUTION\nL’Assemblée Générale décide d’allouer aux membres du Conseil de Surveillance une rémunération d’un montant d’un\nmillion quatre cent vingt-huit mille cinq cent soixante et onze (1.428.571) dirhams bruts, au titre de l’exercice\n2024.\nLe Conseil de Surveillance répartira cette somme entre ses membres, dans les proportions qu’il jugera convenables.\nCINQUIEME RESOLUTION\nL'Assemblée Générale, après avoir entendu le rapport spécial des Commissaires aux Comptes sur les conventions visées\nnotamment à l’article 56 de la loi n°17-95 relative à la Société Anonyme telle que modifiée et complétée, déclare approuver ce\nrapport dans toutes ses dispositions, ainsi que les conventions, engagements et opérations, dont il fait état, conclus ou exécutés\nau cours de l’exercice clos le 31 décembre 2023.\nSCA au capital de 924.673.700 DH\nRC 180 175 – IF 40165169 – TP 34782735 - CNSS 7780027\n22, boulevard Abdelkrim Al Khattabi – 20.100 Casablanca – Maroc\nTel. +212 5 22 98 43 88 – Fax +212 5 22 98 34 60 – www.mutandis.com\nSIXIEME RESOLUTION\nL'Assemblée Générale donne quitus au Gérant pour sa gestion au cours de l'exercice clos le 31 décembre 2023.\nSEPTIEME RESOLUTION\nL'Assemblée Générale donne décharge aux Commissaires aux Comptes, le cabinet A. SAAIDI & ASSOCIES\nreprésenté par Madame Bahaa SAAIDI, ainsi que le cabinet GRANT THORNTON représenté par Monsieur Faiçal\nMEKOUAR, pour leur mission au titre de l'exercice clos le 31 décembre 2023.\nHUITIEME RESOLUTION\nL’Assemblée Générale, (i) constatant que les mandats des Commissaires aux Comptes le cabinet A.Saaidi &\nAssociés, représenté par Madame Bahaa SAAIDI, et le cabinet Grant Thornton, représenté par Monsieur Faiçal\nMEKOUAR, expirent à l’issue de la présente Assemblée Générale (ii) décide de nommer en qualité de nouveaux\nCommissaires aux Comptes de la Société le cabinet HDID & Associés représenté par Monsieur Mohamed HDID et\nle cabinet MAZARS représenté par Monsieur Adnane LOUKILI, à compter de ce jour et pour une période de trois\n(3) exercices, soit jusqu’à l’issue de l’Assemblée Générale Ordinaire Annuelle appelée à statuer sur les comptes de\nl’exercice clos le 31 décembre 2026.\nNEUVIEME RESOLUTION\nL’Assemblée Générale confère tous pouvoirs au porteur d’un original, d’une copie ou d’un extrait du présent procès-\nverbal aux fin d’accomplit toute formalités de dépôt, de publicités et autre qu’il appartiendra de faire.\n***\nSCA au capital de 924.673.700 DH\nRC 180 175 – IF 40165169 – TP 34782735 - CNSS 7780027\n22, boulevard Abdelkrim Al Khattabi – 20.100 Casablanca – Maroc\nTel. +212 5 22 98 43 88 – Fax +212 5 22 98 34 60 – www.mutandis.com\nMUTANDIS du 01/01/2023 au 31/12/2023\nBilan (Actif) (Modèle Normal)\nEXERCICE EXERCICE\nA C T I F Amortissement PRECEDENT\nBrut Net\ns et Provisions Net\nImmobilisations en non valeurs→[A] 12.417.497,40 7.726.993,96 4.690.503,44 4.174.002,92\nFrais préliminaires\nA\nCharges à répartir sur plusieurs exercices 12.417.497,40 7.726.993,96 4.690.503,44 4.174.002,92\nC Primes de remboursement des obligations\nImmobilisations incorporelles→ [B] 3.102.776,04 3.102.776,04 2.279,16\nT\nImmobilisations en Recherche et Dev.\nI Brevets, marques, droits et valeurs similaires 3.102.776,04 3.102.776,04 2.279,16\nFonds commercial\nF\nAutres immobilisations incorporelles\nImmobilisations corporelles →[C] 5.278.378,34 3.873.237,32 1.405.141,02 1.741.501,66\nI Terrains\nConstructions\nM\nInstallations techniques, matériel et outillage\nM\nMatériel de transport 298.446,45 281.650,39 16.796,06 5.499,39\nO Mobilier, Mat. de bureau, Aménag. Divers 4.979.931,89 3.591.586,93 1.388.344,96 1.736.002,27\nB Autres immobilisations corporelles\nImmobilisations corporelles en cours\nI\nImmobilisations financières→[D] 1.801.124.403,26 53.811.299,97 1.747.313.103,29 1.486.052.306,79\nL Prêts immobilisés\nAutres créances financières 168.854.038,64 9.261.737,59 159.592.301,05 193.304.950,55\nI\nTitres de participation 1.632.270.364,62 44.549.562,38 1.587.720.802,24 1.292.747.356,24\nS Autres titres immobilisés\nEcarts de conversion actif→ [E]\nE\nDiminution des créances immobilisées\nAugmentations des dettes de financement\nTOTAL (A+B+C+D+E) 1.821.923.055,04 68.514.307,29 1.753.408.747,75 1.491.970.090,53\nA Stocks→[F]\nC Marchandises\nMatières et fournitures consommables\nT\nProduits en cours\nI\nProduits intermédiaires et produits résiduels\nF\nProduits finis\nCréances de l'actif circulant→[G] 11.997.674,80 11.997.674,80 47.952.989,32\nC\nFournis. débiteurs, avances et acomptes 95.026,94 95.026,94 95.229,51\nI Clients et comptes rattachés 5.110.010,46 5.110.010,46 5.677.130,33\nR Personnel 344.824,74 344.824,74 353.221,08\nC Etat 2.288.161,74 2.288.161,74 2.290.974,61\nComptes d'associés\nU\nAutres débiteurs 4.050.405,10 4.050.405,10 38.963.560,17\nL\nComptes de régularisation- Actif 109.245,82 109.245,82 572.873,62\nA\nTitres valeurs de placement→[H] 20.176.777,01 20.176.777,01 20.502.617,62\nN\nEcarts de conversion actif→ [I]|Eléments\nT 86,16 86,16 1.781,47\ncirculants\nTOTAL II (F+G+H+I) 32.174.537,97 32.174.537,97 68.457.388,41\nTrésorerie-Actif 4.888.741,12 4.888.741,12 344.269,79\nT\nR Chèques et valeurs à encaisser\nE\nS Banques, T.G et C.C.P 4.874.573,07 4.874.573,07 334.290,66\n.\n. Caisse, Régie d'avances et accréditifs 14.168,05 14.168,05 9.979,13\n.\nTOTAL III 4.888.741,12 4.888.741,12 344.269,79\nTOTAL GENERAL I+II+III 1.858.986.334,13 68.514.307,29 1.790.472.026,84 1.560.771.748,73\nMUTANDIS du 01/01/2023 au 31/12/2023\nBilan (Passif) (Modèle Normal)\nEXERCICE\nP A S S I F EXERCICE\nPRECEDENT\nCAPITAUX PROPRES 1.242.535.395,45 1.291.404.638,95\nF Capital social ou personnel (1) 924.673.700,00 924.673.700,00\nMoins : actionnaires, capital souscrit non appelé\nI\nCapital appelé 924.673.700,00 924.673.700,00\nN\nDont versé 924.673.700,00 924.673.700,00\nA\nPrime d'émission, de fusion, d'apport 257.212.339,21 277.555.160,61\nN Ecarts de réévaluation\nC Réserve légale 29.881.052,59 26.809.668,50\nE Autres réserves\nM Report à nouveau (2) 451.853,93 938.428,00\nRésultat en instance d'affectation\nE\nRésultat net de l'exercice (2) 30.316.449,72 61.427.681,84\nN\nTotal des capitaux propres (A) 1.242.535.395,45 1.291.404.638,95\nT\nCapitaux propres assimilés (B)\nSubvention d'investissement\nP Provisions réglementées\nE Dettes de financement (C) 361.666.666,67 170.000.000,00\nR Emprunts obligataires\nAutres dettes de financement 361.666.666,67 170.000.000,00\nM\nProvisions durables pour risques et charges (D)\nA\nProvisions pour risques\nN\nProvisions pour charges\nE\nEcarts de conversion-passif (E)\nN\nAugmentation des créances immobilisées\nT Diminution des dettes de financement\nTOTAL I (A+B+C+D+E) 1.604.202.062,12 1.461.404.638,95\nDettes du passif circulant (F) 27.091.053,24 12.462.626,69\nP\nA Fournisseurs et comptes rattachés 772.336,62 1.316.922,44\nS Clients créditeurs, avances et acomptes\nS\nI Personnel 4.113.155,79 3.760.270,83\nF Organismes sociaux 869.001,66 741.236,44\nC Etat 1.424.219,05 2.134.634,27\nI Comptes d'associés\nR\nAutres créanciers 8.829.595,05 300.009,45\nC\nU Comptes de régularisation passif 11.082.745,07 4.209.553,26\nL\nAutres provisions pour risques et charges (G) 452.348,03 543.562,52\nA\nN Ecarts de conversion - passif (Eléments circulants) (H) 104,98\nT\nTOTAL II (F+G+H) 27.543.506,25 13.006.189,21\nTRESORERIE PASSIF 158.726.458,47 86.360.920,57\nT\nR Crédits d'escompte\nE\nS Crédits de trésorerie 100.000.000,00 50.000.000,00\n.\n. Banques (Soldes créditeurs) 58.726.458,47 36.360.920,57\n.\nTOTAL III 158.726.458,47 86.360.920,57\nTOTAL GENERAL I+II+III 1.790.472.026,84 1.560.771.748,73\nMUTANDIS du 01/01/2023 au 31/12/2023\nCompte de Produits et Charges (Hors Taxes)\nOPERATIONS\nTOTAUX DE\nConcernant les TOTAUX DE\nPropres à L'EXERCICE\nDESIGNATION exercices L'EXERCICE\nl'exercice PRECEDENT\nprécédents\n1 2 3 = 2 + 1 4\nPRODUITS D'EXPLOITATION 38.562.633,14 38.562.633,14 38.536.222,76\nVentes de marchandises (en l'état)\nVentes de biens et services produits 34.562.633,14 34.562.633,14 33.926.531,26\nE\nChiffres d'affaires 34.562.633,14 34.562.633,14 33.926.531,26\nX\nVariation de stocks de produits (1)\nI\nP Immobilisations produites par l'entreprise\npour elle-même\nL\nSubventions d'exploitation\nO Autres produits d'exploitation 4.000.000,00 4.000.000,00 4.000.000,00\nI Reprises d'exploitation : transferts de 609.691,50\ncharges\nA\nTotal I 38.562.633,14 38.562.633,14 38.536.222,76\nT\nCHARGES D'EXPLOITATION 31.563.854,09 8.703,84 31.572.557,93 31.552.192,14\nA Achats revendus(2) de marchandises\nAchats consommés(2) de matières et\nT 172.803,15 172.803,15 161.108,19\nfournitures\nII\nI Autres charges externes 10.122.046,67 8.703,84 10.130.750,51 6.914.254,48\nImpôts et taxes 546.571,83 546.571,83 476.386,69\nO\nCharges de personnel 17.347.664,55 17.347.664,55 21.229.470,02\nN\nAutres charges d'exploitation 300.000,00 300.000,00 300.000,00\nDotations d'exploitation 3.074.767,89 3.074.767,89 2.470.972,76\nIII Total II 31.563.854,09 8.703,84 31.572.557,93 31.552.192,14\nRESULTAT D'EXPLOITATION (I-II) 6.998.779,05 -8.703,84 6.990.075,21 6.984.030,62\nPRODUITS FINANCIERS 46.102.274,42 46.102.274,42 69.217.839,23\nProduits des titres de partic. Et autres\nF 35.829.134,45 35.829.134,45 51.092.479,08\ntitres immobilisés\nIV\nI Gains de change 602.731,42 602.731,42 7.736.407,82\nInterêts et autres produits financiers 9.668.627,08 9.668.627,08 10.388.951,76\nN\nReprises financières : transfert charges 1.781,47 1.781,47 0,57\nA\nTotal IV 46.102.274,42 46.102.274,42 69.217.839,23\nN\nCHARGES FINANCIERES 20.103.194,58 20.103.194,58 12.996.594,39\nC Charges d'interêts 19.746.291,12 19.746.291,12 12.993.666,21\nI Pertes de change 95.092,30 95.092,30 1.146,71\nV\nAutres charges financières\nE\nDotations financières 261.811,16 261.811,16 1.781,47\nR\nTotal V 20.103.194,58 20.103.194,58 12.996.594,39\nVI RESULTAT FINANCIER (IV-V) 25.999.079,84 25.999.079,84 56.221.244,84\nVII RESULTAT COURANT (III+VI) 32.997.858,89 -8.703,84 32.989.155,05 63.205.275,46\nMUTANDIS du 01/01/2023 au 31/12/2023\nCompte de Produits et Charges (Hors Taxes) (Suite)\nOPERATIONS\nTOTAUX DE\nConcernant TOTAUX DE\nPropres à L'EXERCICE\nDESIGNATION les exercices L'EXERCICE\nl'exercice PRECEDENT\nprécédents\n1 2 3 = 2 + 1 4\nVII RESULTAT COURANT (III+VI) 32.997.858,89 -8.703,84 32.989.155,05 63.205.275,46\nPRODUITS NON COURANTS 3.260.718,78 3.260.718,78 381.230,85\nProduits des cessions d'immobilisations 148.000,00\nN Subventions d'équilibre\nReprises sur subventions d'investissement\nVIII\nO\nAutres produits non courants 23.694,62 23.694,62 233.230,85\nN Reprises non courantes ; transferts de\n3.237.024,16 3.237.024,16\ncharges\nTotal VIII 3.260.718,78 3.260.718,78 381.230,85\nCHARGES NON COURANTES 5.721.706,11 5.721.706,11 244.744,47\nC\nValeurs nettes d'amortissements des\n117.000,00\nO immobilisations cédées\nSubventions accordées\nU IX\nAutres charges non courantes 5.721.706,11 5.721.706,11 127.744,47\nDotations non courantes aux\nR\namortissements et aux provisions\nA Total IX 5.721.706,11 5.721.706,11 244.744,47\nX RESULTAT NON COURANT (VIII-IX) -2.460.987,33 -2.460.987,33 136.486,38\nN\nXI RESULTAT AVANT IMPOTS (VII+X) 30.536.871,56 -8.703,84 30.528.167,72 63.341.761,84\nT\nXII IMPOTS SUR LES RESULTATS 211.718,00 211.718,00 1.914.080,00\nXII RESULTAT NET (XI-XII) 30.325.153,56 -8.703,84 30.316.449,72 61.427.681,84\nXIV TOTAL DES PRODUITS (I+IV+VII) 87.925.626,34 87.925.626,34 108.135.292,84\nXV TOTAL DES CHARGES (II+V+IX+XIII) 57.600.472,78 8.703,84 57.609.176,62 46.707.611,00\nRESULTAT NET|(total des produits-total\nXVI 30.325.153,56 -8.703,84 30.316.449,72 61.427.681,84\ndes charges)\nREFERENTIEL COMPTABLE\nLes états financiers consolidés du Groupe MUTANDIS sont préparés en conformité avec les normes\ncomptables internationales adoptées au sein de l’Union Européenne au 31 décembre 2023 et telles\nque publiées à cette même date.\nCes normes sont disponibles sur le site :\nhttp://ec.europa.eu/internal_market/accounting/ias/index_fr.htm.\nLes normes comptables internationales comprennent les IFRS (International Financial Reporting\nStandards), les IAS (International Accounting Standards) et leurs interprétations SIC (Standard\nInterpretation Commitee) et IFRIC (International Financial Reporting Interpretation Commitee).\nPERIMETRE DE CONSOLIDATION\nPérimètre au 31 décembre 2023\nMéthode de\nSociété % Contrôle % d'intérêt Type de contrôle\nconsolidation\nHOLDING\nMutandis 100,00% 100,00% Holding Intégration globale\nDETERGENTS\nDistra 99,99% 99,99% Contrôle exclusif Intégration globale\nBOUTEILLES ALIMENTAIRES\nCMB 100,00% 100,00% Contrôle exclusif Intégration globale\nPRODUITS DE LA MER\nLGMC 99,26% 99,26% Contrôle exclusif Intégration globale\nKama Pêche 100,00% 99,26% Contrôle exclusif Intégration globale\nRio Glace 100,00% 99,26% Contrôle exclusif Intégration globale\nBlue Fish Sourcing 75,00% 75,00% Contrôle exclusif Intégration globale\nBlue Fish Factory 98,00% 98,00% Contrôle exclusif Intégration globale\nBlue Fish Marinier 100,00% 100,00% Contrôle exclusif Intégration globale\nSEASON BRAND\nMutandis USA 100,00% 100,00% Contrôle exclusif Intégration globale\nSeason Brand LLC 100,00% 100,00% Contrôle exclusif Intégration globale\nBOISSONS AIN IFRANE\nEuro Africaine des Eaux 100,00% 99,99% Contrôle exclusif Intégration globale\nPérimètre au 31 décembre 2022\nMéthode de\nSociété % Contrôle % d'intérêt Type de contrôle\nconsolidation\nHOLDING\nMutandis 100,00% 100,00% Holding Intégration globale\nDETERGENTS\nDistra 99,99% 99,99% Contrôle exclusif Intégration globale\nBOUTEILLES ALIMENTAIRES\nCMB 100,00% 100,00% Contrôle exclusif Intégration globale\nPRODUITS DE LA MER\nLGMC 99,26% 99,26% Contrôle exclusif Intégration globale\nStar Shipping 100,00% 99,26% Contrôle exclusif Intégration globale\nKama Pêche 100,00% 99,26% Contrôle exclusif Intégration globale\nRio Glace 100,00% 99,26% Contrôle exclusif Intégration globale\nBlue Fish Sourcing 75,00% 75,00% Contrôle exclusif Intégration globale\nBlue Fish Factory 98,00% 98,00% Contrôle exclusif Intégration globale\nBlue Fish Marinier 100,00% 100,00% Contrôle exclusif Intégration globale\nSEASON BRAND\nMutandis USA 100,00% 100,00% Contrôle exclusif Intégration globale\nSeason Brand LLC 100,00% 100,00% Contrôle exclusif Intégration globale\nCompte de résultat consolidé\nen KMAD\n2022 2023\nChiffre d'affaires 2.328.908 2.442.144\nDétergents 683.097 710.293\nProduits de la mer 659.817 648.824\nBouteilles alimentaires 345.388 275.642\nSeason Brand 561.388 560.623\nBoissons et jus de fruits 79.195 246.302\nAutres 22 460\nVariation des stocks d'en-cours et produits finis 105.165 -124.859\nAchats consommés -1.698.501 -1.420.439\nCharges de personnel -267.703 -289.722\nCharges externes -192.656 -246.631\nImpôts et taxes -8.414 -27.529\nAutres produits de l'activité 1.995 1.561\nEBE 268.794 334.526\nDotations aux amortissements -89.631 -101.749\nDotations nettes de reprises aux provisions courantes -1.221 600\nAutres produits et charges d'exploitation -2.800 -5.621\nRésultat opérationnel courant 175.143 227.756\nAutres produits et charges opérationnels -3.555 -10.925\nRésultat opérationnel 171.588 216.831\nRésultat financier consolidé -29.874 -59.835\nRésultat avant impôt 141.714 156.996\nImpôts sur les bénéfices -37.190 -39.023\nImpôts différés sur retraitements IFRS -2.753 -4.235\nAutres Impôts différés -2.072 -1.090\nTotal Impôts sur les bénéfices -42.016 -44.349\nRésultat après impôt 99.698 112.648\nRésultat net total 99.698 112.648\nPart du groupe 99.524 112.705\nRésultat net courant (*) 105.325 124.663\n(*) Résultat net courant = Résultat net hors éléments à caractère non récurrents\nEtat de situation financière (Actif) en KMAD\n31.12.2022 31.12.2023\nGoodwill 410.576 645.299\nImmobilisations incorporelles 448.623 507.245\nImmobilisations corporelles 677.546 873.430\nImmeubles de placement 123.430 123.430\nAutres actifs financiers 131.844 228.044\nDont Instruments de capitaux propres évalués à la\n123.715 218.144\njuste valeur\nAutres actifs 8.128 9.900\nImpôts différés 6.490 6.145\nActifs non-courants 1.798.508 2.383.593\nStocks et en-cours 602.821 431.010\nClients et comptes rattachés 472.817 489.263\nComptes d'état 124.549 147.755\nAutres débiteurs 10.599 15.437\nAutres actifs courants 2.472 1.219\nVMP et autres placements 21.304 65.333\nTrésorerie et équivalents de trésorerie 101.690 196.929\nActifs courants 1.336.252 1.346.946\nTotal Actif 3.134.761 3.730.539\nEtat de situation financière (Passif)\nen KMAD\n31.12.2022 31.12.2023\nCapital 924.674 924.674\nRéserves 304.169 369.139\nRésultat de l'exercice 99.524 112.705\nTotal Capitaux propres, part du groupe 1.328.367 1.406.517\nIntérêts minoritaires 4.511 4.950\nTotal Intérêts minoritaires 4.511 4.950\nTotal des capitaux propres 1.332.878 1.411.468\nEmprunts et dettes financières 394.204 846.694\nImpôts différés 38.152 60.874\nAutres passifs long terme 0 0\nTotal Passifs non courants 432.356 907.568\nEmprunts et crédit à moins d'un an 250.348 337.813\nDont Intérêts courus et non échus 12.085 22.944\nBanques (soldes créditeurs) 292.742 302.215\nProvisions (part à moins d'un an) 14.301 21.047\nDettes fournisseurs 654.975 553.380\nComptes d'Etat 53.896 89.272\nAutres créditeurs 103.266 107.777\nTotal Passifs courants 1.369.527 1.411.504\nTotal des passifs 1.801.883 2.319.072\nTotal Passif 3.134.761 3.730.539\nBFR opérationnel (1) 491.316 425.377\nDette nette ajustée (2) 802.214 1.201.516\n(1) BFR Opérationnel = stocks+créances clients+créances d'état-dettes fournisseurs-dettes d'état\nDette nette ajustée = Emprunts et dettes financières + Emprunts et crédit à moins d'un an + banques créditrices - VMP -\n(2)\nTréso et Equivalent de Tréso - interêts courus non échus\nTableau de flux de trésorerie consolidés\nen KMAD\n2023.12 2022.12\nCapacité d'autofinancement 267.880 248.525\nImpôts payés 10.457 -30.206\nFlux de trésorerie liés aux activités opérationnelles 278.337 13.349\nAcquisitions/cessions de participation dans les filiales consolidées -293.527 477\nAcquisition nette d'immobilisations incorporelles -88.268 0\nAcquisition nette d'immobilisations corporelles -166.569 -211.446\nAcquisition nette des actifs financiers 19.246 -355\nDont variation des prêts et avances consentis -2.018 -355\nFlux de trésorerie liés aux activités d'investissement -529.118 -211.324\nAugmentation/réduction de capital 0 292.758\nCession (acquisition) nette d'actions propres 0 -6.613\nDividendes payés aux actionnaires du groupe et aux minoritaires -79.187 -79.175\nVariation de l'endettement 451.823 -234.522\nFlux de trésorerie liés aux activités de financement 372.636 -27.553\nIncidence de la variation des taux de change -2.919 5.371\nIncidence des changements de principes comptables 0 0\nVariation de la trésorerie 118.936 -220.157\nTrésorerie d'ouverture -181.833 38.324\nTrésorerie de clôture -62.898 -181.833\n(1) dont intérêts courus et non échus -12.085 -13.659\n(2) dont intérêts courus et non échus -22.944 -12.768\nLe rapport Financier Annuel 2023 est disponible sur le site internet : www.mutandis.com",
    "tables": [
        [
            {
                "": ""
            },
            {
                "": ""
            }
        ],
        [
            {
                "710": "649"
            },
            {
                "710": "276"
            },
            {
                "710": "246"
            },
            {
                "710": "561"
            }
        ],
        [
            {
                "683": "660"
            },
            {
                "683": "345"
            },
            {
                "683": ""
            },
            {
                "683": "79\n561"
            }
        ],
        [],
        [],
        [],
        [
            {
                "MUTANDIS": "",
                "null": "Bilan (Actif) (Modèle Normal)",
                "du 01/01/2023 au 31/12/2023": ""
            }
        ],
        [
            {
                "": "",
                "A C T I F": "",
                "EXERCICE": "Brut",
                "null": "Net",
                "EXERCICE\nPRECEDENT": ""
            },
            {
                "": "",
                "A C T I F": "",
                "EXERCICE": "",
                "null": "",
                "EXERCICE\nPRECEDENT": "Net"
            },
            {
                "": "A\nC\nT\nI\nF\nI\nM\nM\nO\nB\nI\nL\nI\nS\nE",
                "A C T I F": "Immobilisations en non valeurs→[A]",
                "EXERCICE": "12.417.497,40",
                "null": "4.690.503,44",
                "EXERCICE\nPRECEDENT": "4.174.002,92"
            },
            {
                "": "",
                "A C T I F": "Frais préliminaires",
                "EXERCICE": "",
                "null": "",
                "EXERCICE\nPRECEDENT": ""
            },
            {
                "": "",
                "A C T I F": "Charges à répartir sur plusieurs exercices",
                "EXERCICE": "12.417.497,40",
                "null": "4.690.503,44",
                "EXERCICE\nPRECEDENT": "4.174.002,92"
            },
            {
                "": "",
                "A C T I F": "Primes de remboursement des obligations",
                "EXERCICE": "",
                "null": "",
                "EXERCICE\nPRECEDENT": ""
            },
            {
                "": "",
                "A C T I F": "Immobilisations incorporelles→ [B]",
                "EXERCICE": "3.102.776,04",
                "null": "",
                "EXERCICE\nPRECEDENT": "2.279,16"
            },
            {
                "": "",
                "A C T I F": "Immobilisations en Recherche et Dev.",
                "EXERCICE": "",
                "null": "",
                "EXERCICE\nPRECEDENT": ""
            },
            {
                "": "",
                "A C T I F": "Brevets, marques, droits et valeurs similaires",
                "EXERCICE": "3.102.776,04",
                "null": "",
                "EXERCICE\nPRECEDENT": "2.279,16"
            },
            {
                "": "",
                "A C T I F": "Fonds commercial",
                "EXERCICE": "",
                "null": "",
                "EXERCICE\nPRECEDENT": ""
            },
            {
                "": "",
                "A C T I F": "Autres immobilisations incorporelles",
                "EXERCICE": "",
                "null": "",
                "EXERCICE\nPRECEDENT": ""
            },
            {
                "": "",
                "A C T I F": "Immobilisations corporelles →[C]",
                "EXERCICE": "5.278.378,34",
                "null": "1.405.141,02",
                "EXERCICE\nPRECEDENT": "1.741.501,66"
            },
            {
                "": "",
                "A C T I F": "Terrains",
                "EXERCICE": "",
                "null": "",
                "EXERCICE\nPRECEDENT": ""
            },
            {
                "": "",
                "A C T I F": "Constructions",
                "EXERCICE": "",
                "null": "",
                "EXERCICE\nPRECEDENT": ""
            },
            {
                "": "",
                "A C T I F": "Installations techniques, matériel et outillage",
                "EXERCICE": "",
                "null": "",
                "EXERCICE\nPRECEDENT": ""
            },
            {
                "": "",
                "A C T I F": "Matériel de transport",
                "EXERCICE": "298.446,45",
                "null": "16.796,06",
                "EXERCICE\nPRECEDENT": "5.499,39"
            },
            {
                "": "",
                "A C T I F": "Mobilier, Mat. de bureau, Aménag. Divers",
                "EXERCICE": "4.979.931,89",
                "null": "1.388.344,96",
                "EXERCICE\nPRECEDENT": "1.736.002,27"
            },
            {
                "": "",
                "A C T I F": "Autres immobilisations corporelles",
                "EXERCICE": "",
                "null": "",
                "EXERCICE\nPRECEDENT": ""
            },
            {
                "": "",
                "A C T I F": "Immobilisations corporelles en cours",
                "EXERCICE": "",
                "null": "",
                "EXERCICE\nPRECEDENT": ""
            },
            {
                "": "",
                "A C T I F": "Immobilisations financières→[D]",
                "EXERCICE": "1.801.124.403,26",
                "null": "1.747.313.103,29",
                "EXERCICE\nPRECEDENT": "1.486.052.306,79"
            },
            {
                "": "",
                "A C T I F": "Prêts immobilisés",
                "EXERCICE": "",
                "null": "",
                "EXERCICE\nPRECEDENT": ""
            },
            {
                "": "",
                "A C T I F": "Autres créances financières",
                "EXERCICE": "168.854.038,64",
                "null": "159.592.301,05",
                "EXERCICE\nPRECEDENT": "193.304.950,55"
            },
            {
                "": "",
                "A C T I F": "Titres de participation",
                "EXERCICE": "1.632.270.364,62",
                "null": "1.587.720.802,24",
                "EXERCICE\nPRECEDENT": "1.292.747.356,24"
            },
            {
                "": "",
                "A C T I F": "Autres titres immobilisés",
                "EXERCICE": "",
                "null": "",
                "EXERCICE\nPRECEDENT": ""
            },
            {
                "": "",
                "A C T I F": "Ecarts de conversion actif→ [E]",
                "EXERCICE": "",
                "null": "",
                "EXERCICE\nPRECEDENT": ""
            },
            {
                "": "",
                "A C T I F": "Diminution des créances immobilisées",
                "EXERCICE": "",
                "null": "",
                "EXERCICE\nPRECEDENT": ""
            },
            {
                "": "",
                "A C T I F": "Augmentations des dettes de financement",
                "EXERCICE": "",
                "null": "",
                "EXERCICE\nPRECEDENT": ""
            },
            {
                "": "A\nC\nT\nI\nF\nC\nI\nR\nC\nU\nL\nA\nN\nT",
                "A C T I F": "TOTAL (A+B+C+D+E)",
                "EXERCICE": "1.821.923.055,04",
                "null": "1.753.408.747,75",
                "EXERCICE\nPRECEDENT": "1.491.970.090,53"
            },
            {
                "": "",
                "A C T I F": "Stocks→[F]",
                "EXERCICE": "",
                "null": "",
                "EXERCICE\nPRECEDENT": ""
            },
            {
                "": "",
                "A C T I F": "Marchandises",
                "EXERCICE": "",
                "null": "",
                "EXERCICE\nPRECEDENT": ""
            },
            {
                "": "",
                "A C T I F": "Matières et fournitures consommables",
                "EXERCICE": "",
                "null": "",
                "EXERCICE\nPRECEDENT": ""
            },
            {
                "": "",
                "A C T I F": "Produits en cours",
                "EXERCICE": "",
                "null": "",
                "EXERCICE\nPRECEDENT": ""
            },
            {
                "": "",
                "A C T I F": "Produits intermédiaires et produits résiduels",
                "EXERCICE": "",
                "null": "",
                "EXERCICE\nPRECEDENT": ""
            },
            {
                "": "",
                "A C T I F": "Produits finis",
                "EXERCICE": "",
                "null": "",
                "EXERCICE\nPRECEDENT": ""
            },
            {
                "": "",
                "A C T I F": "Créances de l'actif circulant→[G]",
                "EXERCICE": "11.997.674,80",
                "null": "11.997.674,80",
                "EXERCICE\nPRECEDENT": "47.952.989,32"
            },
            {
                "": "",
                "A C T I F": "Fournis. débiteurs, avances et acomptes",
                "EXERCICE": "95.026,94",
                "null": "95.026,94",
                "EXERCICE\nPRECEDENT": "95.229,51"
            },
            {
                "": "",
                "A C T I F": "Clients et comptes rattachés",
                "EXERCICE": "5.110.010,46",
                "null": "5.110.010,46",
                "EXERCICE\nPRECEDENT": "5.677.130,33"
            },
            {
                "": "",
                "A C T I F": "Personnel",
                "EXERCICE": "344.824,74",
                "null": "344.824,74",
                "EXERCICE\nPRECEDENT": "353.221,08"
            },
            {
                "": "",
                "A C T I F": "Etat",
                "EXERCICE": "2.288.161,74",
                "null": "2.288.161,74",
                "EXERCICE\nPRECEDENT": "2.290.974,61"
            },
            {
                "": "",
                "A C T I F": "Comptes d'associés",
                "EXERCICE": "",
                "null": "",
                "EXERCICE\nPRECEDENT": ""
            },
            {
                "": "",
                "A C T I F": "Autres débiteurs",
                "EXERCICE": "4.050.405,10",
                "null": "4.050.405,10",
                "EXERCICE\nPRECEDENT": "38.963.560,17"
            },
            {
                "": "",
                "A C T I F": "Comptes de régularisation- Actif",
                "EXERCICE": "109.245,82",
                "null": "109.245,82",
                "EXERCICE\nPRECEDENT": "572.873,62"
            },
            {
                "": "",
                "A C T I F": "Titres valeurs de placement→[H]",
                "EXERCICE": "20.176.777,01",
                "null": "20.176.777,01",
                "EXERCICE\nPRECEDENT": "20.502.617,62"
            },
            {
                "": "",
                "A C T I F": "Ecarts de conversion actif→ [I]|Eléments\ncirculants",
                "EXERCICE": "86,16",
                "null": "86,16",
                "EXERCICE\nPRECEDENT": "1.781,47"
            },
            {
                "": "",
                "A C T I F": "TOTAL II (F+G+H+I)",
                "EXERCICE": "32.174.537,97",
                "null": "32.174.537,97",
                "EXERCICE\nPRECEDENT": "68.457.388,41"
            },
            {
                "": "T\nR\nE\nS\n.\n.\n.",
                "A C T I F": "Trésorerie-Actif",
                "EXERCICE": "4.888.741,12",
                "null": "4.888.741,12",
                "EXERCICE\nPRECEDENT": "344.269,79"
            },
            {
                "": "",
                "A C T I F": "Chèques et valeurs à encaisser",
                "EXERCICE": "",
                "null": "",
                "EXERCICE\nPRECEDENT": ""
            },
            {
                "": "",
                "A C T I F": "Banques, T.G et C.C.P",
                "EXERCICE": "4.874.573,07",
                "null": "4.874.573,07",
                "EXERCICE\nPRECEDENT": "334.290,66"
            },
            {
                "": "",
                "A C T I F": "Caisse, Régie d'avances et accréditifs",
                "EXERCICE": "14.168,05",
                "null": "14.168,05",
                "EXERCICE\nPRECEDENT": "9.979,13"
            },
            {
                "": "",
                "A C T I F": "TOTAL III",
                "EXERCICE": "4.888.741,12",
                "null": "4.888.741,12",
                "EXERCICE\nPRECEDENT": "344.269,79"
            },
            {
                "": "",
                "A C T I F": "TOTAL GENERAL I+II+III",
                "EXERCICE": "1.858.986.334,13",
                "null": "1.790.472.026,84",
                "EXERCICE\nPRECEDENT": "1.560.771.748,73"
            }
        ],
        [
            {
                "MUTANDIS": "",
                "null": "Bilan (Passif) (Modèle Normal)",
                "du 01/01/2023 au 31/12/2023": ""
            }
        ],
        [
            {
                "": "F\nI\nN\nA\nN\nC\nE\nM\nE\nN\nT\nP\nE\nR\nM\nA\nN\nE\nN\nT",
                "P A S S I F": "CAPITAUX PROPRES",
                "EXERCICE": "1.242.535.395,45",
                "EXERCICE\nPRECEDENT": "1.291.404.638,95"
            },
            {
                "": "",
                "P A S S I F": "Capital social ou personnel (1)",
                "EXERCICE": "924.673.700,00",
                "EXERCICE\nPRECEDENT": "924.673.700,00"
            },
            {
                "": "",
                "P A S S I F": "Moins : actionnaires, capital souscrit non appelé",
                "EXERCICE": "",
                "EXERCICE\nPRECEDENT": ""
            },
            {
                "": "",
                "P A S S I F": "Capital appelé",
                "EXERCICE": "924.673.700,00",
                "EXERCICE\nPRECEDENT": "924.673.700,00"
            },
            {
                "": "",
                "P A S S I F": "Dont versé",
                "EXERCICE": "924.673.700,00",
                "EXERCICE\nPRECEDENT": "924.673.700,00"
            },
            {
                "": "",
                "P A S S I F": "Prime d'émission, de fusion, d'apport",
                "EXERCICE": "257.212.339,21",
                "EXERCICE\nPRECEDENT": "277.555.160,61"
            },
            {
                "": "",
                "P A S S I F": "Ecarts de réévaluation",
                "EXERCICE": "",
                "EXERCICE\nPRECEDENT": ""
            },
            {
                "": "",
                "P A S S I F": "Réserve légale",
                "EXERCICE": "29.881.052,59",
                "EXERCICE\nPRECEDENT": "26.809.668,50"
            },
            {
                "": "",
                "P A S S I F": "Autres réserves",
                "EXERCICE": "",
                "EXERCICE\nPRECEDENT": ""
            },
            {
                "": "",
                "P A S S I F": "Report à nouveau (2)",
                "EXERCICE": "451.853,93",
                "EXERCICE\nPRECEDENT": "938.428,00"
            },
            {
                "": "",
                "P A S S I F": "Résultat en instance d'affectation",
                "EXERCICE": "",
                "EXERCICE\nPRECEDENT": ""
            },
            {
                "": "",
                "P A S S I F": "Résultat net de l'exercice (2)",
                "EXERCICE": "30.316.449,72",
                "EXERCICE\nPRECEDENT": "61.427.681,84"
            },
            {
                "": "",
                "P A S S I F": "Total des capitaux propres (A)",
                "EXERCICE": "1.242.535.395,45",
                "EXERCICE\nPRECEDENT": "1.291.404.638,95"
            },
            {
                "": "",
                "P A S S I F": "Capitaux propres assimilés (B)",
                "EXERCICE": "",
                "EXERCICE\nPRECEDENT": ""
            },
            {
                "": "",
                "P A S S I F": "Subvention d'investissement",
                "EXERCICE": "",
                "EXERCICE\nPRECEDENT": ""
            },
            {
                "": "",
                "P A S S I F": "Provisions réglementées",
                "EXERCICE": "",
                "EXERCICE\nPRECEDENT": ""
            },
            {
                "": "",
                "P A S S I F": "Dettes de financement (C)",
                "EXERCICE": "361.666.666,67",
                "EXERCICE\nPRECEDENT": "170.000.000,00"
            },
            {
                "": "",
                "P A S S I F": "Emprunts obligataires",
                "EXERCICE": "",
                "EXERCICE\nPRECEDENT": ""
            },
            {
                "": "",
                "P A S S I F": "Autres dettes de financement",
                "EXERCICE": "361.666.666,67",
                "EXERCICE\nPRECEDENT": "170.000.000,00"
            },
            {
                "": "",
                "P A S S I F": "Provisions durables pour risques et charges (D)",
                "EXERCICE": "",
                "EXERCICE\nPRECEDENT": ""
            },
            {
                "": "",
                "P A S S I F": "Provisions pour risques",
                "EXERCICE": "",
                "EXERCICE\nPRECEDENT": ""
            },
            {
                "": "",
                "P A S S I F": "Provisions pour charges",
                "EXERCICE": "",
                "EXERCICE\nPRECEDENT": ""
            },
            {
                "": "",
                "P A S S I F": "Ecarts de conversion-passif (E)",
                "EXERCICE": "",
                "EXERCICE\nPRECEDENT": ""
            },
            {
                "": "",
                "P A S S I F": "Augmentation des créances immobilisées",
                "EXERCICE": "",
                "EXERCICE\nPRECEDENT": ""
            },
            {
                "": "",
                "P A S S I F": "Diminution des dettes de financement",
                "EXERCICE": "",
                "EXERCICE\nPRECEDENT": ""
            },
            {
                "": "",
                "P A S S I F": "TOTAL I (A+B+C+D+E)",
                "EXERCICE": "1.604.202.062,12",
                "EXERCICE\nPRECEDENT": "1.461.404.638,95"
            },
            {
                "": "P\nA\nS\nS\nI\nF\nC\nI\nR\nC\nU\nL\nA\nN\nT",
                "P A S S I F": "Dettes du passif circulant (F)",
                "EXERCICE": "27.091.053,24",
                "EXERCICE\nPRECEDENT": "12.462.626,69"
            },
            {
                "": "",
                "P A S S I F": "Fournisseurs et comptes rattachés",
                "EXERCICE": "772.336,62",
                "EXERCICE\nPRECEDENT": "1.316.922,44"
            },
            {
                "": "",
                "P A S S I F": "Clients créditeurs, avances et acomptes",
                "EXERCICE": "",
                "EXERCICE\nPRECEDENT": ""
            },
            {
                "": "",
                "P A S S I F": "Personnel",
                "EXERCICE": "4.113.155,79",
                "EXERCICE\nPRECEDENT": "3.760.270,83"
            },
            {
                "": "",
                "P A S S I F": "Organismes sociaux",
                "EXERCICE": "869.001,66",
                "EXERCICE\nPRECEDENT": "741.236,44"
            },
            {
                "": "",
                "P A S S I F": "Etat",
                "EXERCICE": "1.424.219,05",
                "EXERCICE\nPRECEDENT": "2.134.634,27"
            },
            {
                "": "",
                "P A S S I F": "Comptes d'associés",
                "EXERCICE": "",
                "EXERCICE\nPRECEDENT": ""
            },
            {
                "": "",
                "P A S S I F": "Autres créanciers",
                "EXERCICE": "8.829.595,05",
                "EXERCICE\nPRECEDENT": "300.009,45"
            },
            {
                "": "",
                "P A S S I F": "Comptes de régularisation passif",
                "EXERCICE": "11.082.745,07",
                "EXERCICE\nPRECEDENT": "4.209.553,26"
            },
            {
                "": "",
                "P A S S I F": "Autres provisions pour risques et charges (G)",
                "EXERCICE": "452.348,03",
                "EXERCICE\nPRECEDENT": "543.562,52"
            },
            {
                "": "",
                "P A S S I F": "Ecarts de conversion - passif (Eléments circulants) (H)",
                "EXERCICE": "104,98",
                "EXERCICE\nPRECEDENT": ""
            },
            {
                "": "",
                "P A S S I F": "TOTAL II (F+G+H)",
                "EXERCICE": "27.543.506,25",
                "EXERCICE\nPRECEDENT": "13.006.189,21"
            },
            {
                "": "T\nR\nE\nS\n.\n.\n.",
                "P A S S I F": "TRESORERIE PASSIF",
                "EXERCICE": "158.726.458,47",
                "EXERCICE\nPRECEDENT": "86.360.920,57"
            },
            {
                "": "",
                "P A S S I F": "Crédits d'escompte",
                "EXERCICE": "",
                "EXERCICE\nPRECEDENT": ""
            },
            {
                "": "",
                "P A S S I F": "Crédits de trésorerie",
                "EXERCICE": "100.000.000,00",
                "EXERCICE\nPRECEDENT": "50.000.000,00"
            },
            {
                "": "",
                "P A S S I F": "Banques (Soldes créditeurs)",
                "EXERCICE": "58.726.458,47",
                "EXERCICE\nPRECEDENT": "36.360.920,57"
            },
            {
                "": "",
                "P A S S I F": "TOTAL III",
                "EXERCICE": "158.726.458,47",
                "EXERCICE\nPRECEDENT": "86.360.920,57"
            },
            {
                "": "",
                "P A S S I F": "TOTAL GENERAL I+II+III",
                "EXERCICE": "1.790.472.026,84",
                "EXERCICE\nPRECEDENT": "1.560.771.748,73"
            }
        ],
        [
            {
                "MUTANDIS": "",
                "null": "Compte de Produits et Charges (Hors Taxes)",
                "du 01/01/2023 au 31/12/2023": ""
            }
        ],
        [
            {
                "": "",
                "null": "Concernant les\nexercices\nprécédents",
                "DESIGNATION": "",
                "OPERATIONS": "Propres à\nl'exercice",
                "TOTAUX DE\nL'EXERCICE": "",
                "TOTAUX DE\nL'EXERCICE\nPRECEDENT": ""
            },
            {
                "": "",
                "null": "2",
                "DESIGNATION": "",
                "OPERATIONS": "1",
                "TOTAUX DE\nL'EXERCICE": "3 = 2 + 1",
                "TOTAUX DE\nL'EXERCICE\nPRECEDENT": "4"
            },
            {
                "": "E\nX\nP\nL\nO\nI\nA\nT\nA\nT\nI\nO\nN",
                "null": "",
                "DESIGNATION": "PRODUITS D'EXPLOITATION",
                "OPERATIONS": "38.562.633,14",
                "TOTAUX DE\nL'EXERCICE": "38.562.633,14",
                "TOTAUX DE\nL'EXERCICE\nPRECEDENT": "38.536.222,76"
            },
            {
                "": "",
                "null": "",
                "DESIGNATION": "Ventes de marchandises (en l'état)",
                "OPERATIONS": "",
                "TOTAUX DE\nL'EXERCICE": "",
                "TOTAUX DE\nL'EXERCICE\nPRECEDENT": ""
            },
            {
                "": "",
                "null": "",
                "DESIGNATION": "Ventes de biens et services produits",
                "OPERATIONS": "34.562.633,14",
                "TOTAUX DE\nL'EXERCICE": "34.562.633,14",
                "TOTAUX DE\nL'EXERCICE\nPRECEDENT": "33.926.531,26"
            },
            {
                "": "",
                "null": "",
                "DESIGNATION": "Chiffres d'affaires",
                "OPERATIONS": "34.562.633,14",
                "TOTAUX DE\nL'EXERCICE": "34.562.633,14",
                "TOTAUX DE\nL'EXERCICE\nPRECEDENT": "33.926.531,26"
            },
            {
                "": "",
                "null": "",
                "DESIGNATION": "Variation de stocks de produits (1)",
                "OPERATIONS": "",
                "TOTAUX DE\nL'EXERCICE": "",
                "TOTAUX DE\nL'EXERCICE\nPRECEDENT": ""
            },
            {
                "": "",
                "null": "",
                "DESIGNATION": "Immobilisations produites par l'entreprise\npour elle-même",
                "OPERATIONS": "",
                "TOTAUX DE\nL'EXERCICE": "",
                "TOTAUX DE\nL'EXERCICE\nPRECEDENT": ""
            },
            {
                "": "",
                "null": "",
                "DESIGNATION": "Subventions d'exploitation",
                "OPERATIONS": "",
                "TOTAUX DE\nL'EXERCICE": "",
                "TOTAUX DE\nL'EXERCICE\nPRECEDENT": ""
            },
            {
                "": "",
                "null": "",
                "DESIGNATION": "Autres produits d'exploitation",
                "OPERATIONS": "4.000.000,00",
                "TOTAUX DE\nL'EXERCICE": "4.000.000,00",
                "TOTAUX DE\nL'EXERCICE\nPRECEDENT": "4.000.000,00"
            },
            {
                "": "",
                "null": "",
                "DESIGNATION": "Reprises d'exploitation : transferts de\ncharges",
                "OPERATIONS": "",
                "TOTAUX DE\nL'EXERCICE": "",
                "TOTAUX DE\nL'EXERCICE\nPRECEDENT": "609.691,50"
            },
            {
                "": "",
                "null": "",
                "DESIGNATION": "Total I",
                "OPERATIONS": "38.562.633,14",
                "TOTAUX DE\nL'EXERCICE": "38.562.633,14",
                "TOTAUX DE\nL'EXERCICE\nPRECEDENT": "38.536.222,76"
            },
            {
                "": "",
                "null": "8.703,84",
                "DESIGNATION": "CHARGES D'EXPLOITATION",
                "OPERATIONS": "31.563.854,09",
                "TOTAUX DE\nL'EXERCICE": "31.572.557,93",
                "TOTAUX DE\nL'EXERCICE\nPRECEDENT": "31.552.192,14"
            },
            {
                "": "",
                "null": "",
                "DESIGNATION": "Achats revendus(2) de marchandises",
                "OPERATIONS": "",
                "TOTAUX DE\nL'EXERCICE": "",
                "TOTAUX DE\nL'EXERCICE\nPRECEDENT": ""
            },
            {
                "": "",
                "null": "",
                "DESIGNATION": "Achats consommés(2) de matières et\nfournitures",
                "OPERATIONS": "172.803,15",
                "TOTAUX DE\nL'EXERCICE": "172.803,15",
                "TOTAUX DE\nL'EXERCICE\nPRECEDENT": "161.108,19"
            },
            {
                "": "",
                "null": "8.703,84",
                "DESIGNATION": "Autres charges externes",
                "OPERATIONS": "10.122.046,67",
                "TOTAUX DE\nL'EXERCICE": "10.130.750,51",
                "TOTAUX DE\nL'EXERCICE\nPRECEDENT": "6.914.254,48"
            },
            {
                "": "",
                "null": "",
                "DESIGNATION": "Impôts et taxes",
                "OPERATIONS": "546.571,83",
                "TOTAUX DE\nL'EXERCICE": "546.571,83",
                "TOTAUX DE\nL'EXERCICE\nPRECEDENT": "476.386,69"
            },
            {
                "": "",
                "null": "",
                "DESIGNATION": "Charges de personnel",
                "OPERATIONS": "17.347.664,55",
                "TOTAUX DE\nL'EXERCICE": "17.347.664,55",
                "TOTAUX DE\nL'EXERCICE\nPRECEDENT": "21.229.470,02"
            },
            {
                "": "",
                "null": "",
                "DESIGNATION": "Autres charges d'exploitation",
                "OPERATIONS": "300.000,00",
                "TOTAUX DE\nL'EXERCICE": "300.000,00",
                "TOTAUX DE\nL'EXERCICE\nPRECEDENT": "300.000,00"
            },
            {
                "": "",
                "null": "",
                "DESIGNATION": "Dotations d'exploitation",
                "OPERATIONS": "3.074.767,89",
                "TOTAUX DE\nL'EXERCICE": "3.074.767,89",
                "TOTAUX DE\nL'EXERCICE\nPRECEDENT": "2.470.972,76"
            },
            {
                "": "",
                "null": "8.703,84",
                "DESIGNATION": "Total II",
                "OPERATIONS": "31.563.854,09",
                "TOTAUX DE\nL'EXERCICE": "31.572.557,93",
                "TOTAUX DE\nL'EXERCICE\nPRECEDENT": "31.552.192,14"
            },
            {
                "": "F\nI\nN\nA\nN\nC\nI\nE\nR",
                "null": "-8.703,84",
                "DESIGNATION": "RESULTAT D'EXPLOITATION (I-II)",
                "OPERATIONS": "6.998.779,05",
                "TOTAUX DE\nL'EXERCICE": "6.990.075,21",
                "TOTAUX DE\nL'EXERCICE\nPRECEDENT": "6.984.030,62"
            },
            {
                "": "",
                "null": "",
                "DESIGNATION": "PRODUITS FINANCIERS",
                "OPERATIONS": "46.102.274,42",
                "TOTAUX DE\nL'EXERCICE": "46.102.274,42",
                "TOTAUX DE\nL'EXERCICE\nPRECEDENT": "69.217.839,23"
            },
            {
                "": "",
                "null": "",
                "DESIGNATION": "Produits des titres de partic. Et autres\ntitres immobilisés",
                "OPERATIONS": "35.829.134,45",
                "TOTAUX DE\nL'EXERCICE": "35.829.134,45",
                "TOTAUX DE\nL'EXERCICE\nPRECEDENT": "51.092.479,08"
            },
            {
                "": "",
                "null": "",
                "DESIGNATION": "Gains de change",
                "OPERATIONS": "602.731,42",
                "TOTAUX DE\nL'EXERCICE": "602.731,42",
                "TOTAUX DE\nL'EXERCICE\nPRECEDENT": "7.736.407,82"
            },
            {
                "": "",
                "null": "",
                "DESIGNATION": "Interêts et autres produits financiers",
                "OPERATIONS": "9.668.627,08",
                "TOTAUX DE\nL'EXERCICE": "9.668.627,08",
                "TOTAUX DE\nL'EXERCICE\nPRECEDENT": "10.388.951,76"
            },
            {
                "": "",
                "null": "",
                "DESIGNATION": "Reprises financières : transfert charges",
                "OPERATIONS": "1.781,47",
                "TOTAUX DE\nL'EXERCICE": "1.781,47",
                "TOTAUX DE\nL'EXERCICE\nPRECEDENT": "0,57"
            },
            {
                "": "",
                "null": "",
                "DESIGNATION": "Total IV",
                "OPERATIONS": "46.102.274,42",
                "TOTAUX DE\nL'EXERCICE": "46.102.274,42",
                "TOTAUX DE\nL'EXERCICE\nPRECEDENT": "69.217.839,23"
            },
            {
                "": "",
                "null": "",
                "DESIGNATION": "CHARGES FINANCIERES",
                "OPERATIONS": "20.103.194,58",
                "TOTAUX DE\nL'EXERCICE": "20.103.194,58",
                "TOTAUX DE\nL'EXERCICE\nPRECEDENT": "12.996.594,39"
            },
            {
                "": "",
                "null": "",
                "DESIGNATION": "Charges d'interêts",
                "OPERATIONS": "19.746.291,12",
                "TOTAUX DE\nL'EXERCICE": "19.746.291,12",
                "TOTAUX DE\nL'EXERCICE\nPRECEDENT": "12.993.666,21"
            },
            {
                "": "",
                "null": "",
                "DESIGNATION": "Pertes de change",
                "OPERATIONS": "95.092,30",
                "TOTAUX DE\nL'EXERCICE": "95.092,30",
                "TOTAUX DE\nL'EXERCICE\nPRECEDENT": "1.146,71"
            },
            {
                "": "",
                "null": "",
                "DESIGNATION": "Autres charges financières",
                "OPERATIONS": "",
                "TOTAUX DE\nL'EXERCICE": "",
                "TOTAUX DE\nL'EXERCICE\nPRECEDENT": ""
            },
            {
                "": "",
                "null": "",
                "DESIGNATION": "Dotations financières",
                "OPERATIONS": "261.811,16",
                "TOTAUX DE\nL'EXERCICE": "261.811,16",
                "TOTAUX DE\nL'EXERCICE\nPRECEDENT": "1.781,47"
            },
            {
                "": "",
                "null": "",
                "DESIGNATION": "Total V",
                "OPERATIONS": "20.103.194,58",
                "TOTAUX DE\nL'EXERCICE": "20.103.194,58",
                "TOTAUX DE\nL'EXERCICE\nPRECEDENT": "12.996.594,39"
            },
            {
                "": "",
                "null": "",
                "DESIGNATION": "RESULTAT FINANCIER (IV-V)",
                "OPERATIONS": "25.999.079,84",
                "TOTAUX DE\nL'EXERCICE": "25.999.079,84",
                "TOTAUX DE\nL'EXERCICE\nPRECEDENT": "56.221.244,84"
            },
            {
                "": "",
                "null": "-8.703,84",
                "DESIGNATION": "RESULTAT COURANT (III+VI)",
                "OPERATIONS": "32.997.858,89",
                "TOTAUX DE\nL'EXERCICE": "32.989.155,05",
                "TOTAUX DE\nL'EXERCICE\nPRECEDENT": "63.205.275,46"
            }
        ],
        [
            {
                "MUTANDIS": "",
                "null": "Compte de Produits et Charges (Hors Taxes) (Suite)",
                "du 01/01/2023 au 31/12/2023": ""
            }
        ],
        [
            {
                "": "",
                "null": "Concernant\nles exercices\nprécédents",
                "DESIGNATION": "",
                "OPERATIONS": "Propres à\nl'exercice",
                "TOTAUX DE\nL'EXERCICE": "",
                "TOTAUX DE\nL'EXERCICE\nPRECEDENT": ""
            },
            {
                "": "",
                "null": "2",
                "DESIGNATION": "",
                "OPERATIONS": "1",
                "TOTAUX DE\nL'EXERCICE": "3 = 2 + 1",
                "TOTAUX DE\nL'EXERCICE\nPRECEDENT": "4"
            },
            {
                "": "N\nO\nN\nC\nO\nU\nR\nA\nN\nT",
                "null": "-8.703,84",
                "DESIGNATION": "RESULTAT COURANT (III+VI)",
                "OPERATIONS": "32.997.858,89",
                "TOTAUX DE\nL'EXERCICE": "32.989.155,05",
                "TOTAUX DE\nL'EXERCICE\nPRECEDENT": "63.205.275,46"
            },
            {
                "": "",
                "null": "",
                "DESIGNATION": "PRODUITS NON COURANTS",
                "OPERATIONS": "3.260.718,78",
                "TOTAUX DE\nL'EXERCICE": "3.260.718,78",
                "TOTAUX DE\nL'EXERCICE\nPRECEDENT": "381.230,85"
            },
            {
                "": "",
                "null": "",
                "DESIGNATION": "Produits des cessions d'immobilisations",
                "OPERATIONS": "",
                "TOTAUX DE\nL'EXERCICE": "",
                "TOTAUX DE\nL'EXERCICE\nPRECEDENT": "148.000,00"
            },
            {
                "": "",
                "null": "",
                "DESIGNATION": "Subventions d'équilibre",
                "OPERATIONS": "",
                "TOTAUX DE\nL'EXERCICE": "",
                "TOTAUX DE\nL'EXERCICE\nPRECEDENT": ""
            },
            {
                "": "",
                "null": "",
                "DESIGNATION": "Reprises sur subventions d'investissement",
                "OPERATIONS": "",
                "TOTAUX DE\nL'EXERCICE": "",
                "TOTAUX DE\nL'EXERCICE\nPRECEDENT": ""
            },
            {
                "": "",
                "null": "",
                "DESIGNATION": "Autres produits non courants",
                "OPERATIONS": "23.694,62",
                "TOTAUX DE\nL'EXERCICE": "23.694,62",
                "TOTAUX DE\nL'EXERCICE\nPRECEDENT": "233.230,85"
            },
            {
                "": "",
                "null": "",
                "DESIGNATION": "Reprises non courantes ; transferts de\ncharges",
                "OPERATIONS": "3.237.024,16",
                "TOTAUX DE\nL'EXERCICE": "3.237.024,16",
                "TOTAUX DE\nL'EXERCICE\nPRECEDENT": ""
            },
            {
                "": "",
                "null": "",
                "DESIGNATION": "Total VIII",
                "OPERATIONS": "3.260.718,78",
                "TOTAUX DE\nL'EXERCICE": "3.260.718,78",
                "TOTAUX DE\nL'EXERCICE\nPRECEDENT": "381.230,85"
            },
            {
                "": "",
                "null": "",
                "DESIGNATION": "CHARGES NON COURANTES",
                "OPERATIONS": "5.721.706,11",
                "TOTAUX DE\nL'EXERCICE": "5.721.706,11",
                "TOTAUX DE\nL'EXERCICE\nPRECEDENT": "244.744,47"
            },
            {
                "": "",
                "null": "",
                "DESIGNATION": "Valeurs nettes d'amortissements des\nimmobilisations cédées",
                "OPERATIONS": "",
                "TOTAUX DE\nL'EXERCICE": "",
                "TOTAUX DE\nL'EXERCICE\nPRECEDENT": "117.000,00"
            },
            {
                "": "",
                "null": "",
                "DESIGNATION": "Subventions accordées",
                "OPERATIONS": "",
                "TOTAUX DE\nL'EXERCICE": "",
                "TOTAUX DE\nL'EXERCICE\nPRECEDENT": ""
            },
            {
                "": "",
                "null": "",
                "DESIGNATION": "Autres charges non courantes",
                "OPERATIONS": "5.721.706,11",
                "TOTAUX DE\nL'EXERCICE": "5.721.706,11",
                "TOTAUX DE\nL'EXERCICE\nPRECEDENT": "127.744,47"
            },
            {
                "": "",
                "null": "",
                "DESIGNATION": "Dotations non courantes aux\namortissements et aux provisions",
                "OPERATIONS": "",
                "TOTAUX DE\nL'EXERCICE": "",
                "TOTAUX DE\nL'EXERCICE\nPRECEDENT": ""
            },
            {
                "": "",
                "null": "",
                "DESIGNATION": "Total IX",
                "OPERATIONS": "5.721.706,11",
                "TOTAUX DE\nL'EXERCICE": "5.721.706,11",
                "TOTAUX DE\nL'EXERCICE\nPRECEDENT": "244.744,47"
            },
            {
                "": "",
                "null": "",
                "DESIGNATION": "RESULTAT NON COURANT (VIII-IX)",
                "OPERATIONS": "-2.460.987,33",
                "TOTAUX DE\nL'EXERCICE": "-2.460.987,33",
                "TOTAUX DE\nL'EXERCICE\nPRECEDENT": "136.486,38"
            },
            {
                "": "",
                "null": "-8.703,84",
                "DESIGNATION": "RESULTAT AVANT IMPOTS (VII+X)",
                "OPERATIONS": "30.536.871,56",
                "TOTAUX DE\nL'EXERCICE": "30.528.167,72",
                "TOTAUX DE\nL'EXERCICE\nPRECEDENT": "63.341.761,84"
            },
            {
                "": "",
                "null": "",
                "DESIGNATION": "IMPOTS SUR LES RESULTATS",
                "OPERATIONS": "211.718,00",
                "TOTAUX DE\nL'EXERCICE": "211.718,00",
                "TOTAUX DE\nL'EXERCICE\nPRECEDENT": "1.914.080,00"
            },
            {
                "": "",
                "null": "-8.703,84",
                "DESIGNATION": "RESULTAT NET (XI-XII)",
                "OPERATIONS": "30.325.153,56",
                "TOTAUX DE\nL'EXERCICE": "30.316.449,72",
                "TOTAUX DE\nL'EXERCICE\nPRECEDENT": "61.427.681,84"
            }
        ],
        [
            {
                "": "8.703,84",
                "XIV": "XV",
                "TOTAL DES PRODUITS (I+IV+VII)": "TOTAL DES CHARGES (II+V+IX+XIII)",
                "87.925.626,34": "57.609.176,62",
                "108.135.292,84": "46.707.611,00"
            },
            {
                "": "-8.703,84",
                "XIV": "XVI",
                "TOTAL DES PRODUITS (I+IV+VII)": "RESULTAT NET|(total des produits-total\ndes charges)",
                "87.925.626,34": "30.316.449,72",
                "108.135.292,84": "61.427.681,84"
            }
        ],
        [
            {
                "Méthode de\nSociété % Contrôle % d'intérêt Type de contrôle\nconsolidation": "HOLDING\nMutandis 100,00% 100,00% Holding Intégration globale\nDETERGENTS\nDistra 99,99% 99,99% Contrôle exclusif Intégration globale\nBOUTEILLES ALIMENTAIRES\nCMB 100,00% 100,00% Contrôle exclusif Intégration globale\nPRODUITS DE LA MER\nLGMC 99,26% 99,26% Contrôle exclusif Intégration globale\nKama Pêche 100,00% 99,26% Contrôle exclusif Intégration globale\nRio Glace 100,00% 99,26% Contrôle exclusif Intégration globale\nBlue Fish Sourcing 75,00% 75,00% Contrôle exclusif Intégration globale\nBlue Fish Factory 98,00% 98,00% Contrôle exclusif Intégration globale\nBlue Fish Marinier 100,00% 100,00% Contrôle exclusif Intégration globale\nSEASON BRAND\nMutandis USA 100,00% 100,00% Contrôle exclusif Intégration globale\nSeason Brand LLC 100,00% 100,00% Contrôle exclusif Intégration globale\nBOISSONS AIN IFRANE\nEuro Africaine des Eaux 100,00% 99,99% Contrôle exclusif Intégration globale"
            }
        ],
        [
            {
                "Méthode de\nSociété % Contrôle % d'intérêt Type de contrôle\nconsolidation": "HOLDING\nMutandis 100,00% 100,00% Holding Intégration globale\nDETERGENTS\nDistra 99,99% 99,99% Contrôle exclusif Intégration globale\nBOUTEILLES ALIMENTAIRES\nCMB 100,00% 100,00% Contrôle exclusif Intégration globale\nPRODUITS DE LA MER\nLGMC 99,26% 99,26% Contrôle exclusif Intégration globale\nStar Shipping 100,00% 99,26% Contrôle exclusif Intégration globale\nKama Pêche 100,00% 99,26% Contrôle exclusif Intégration globale\nRio Glace 100,00% 99,26% Contrôle exclusif Intégration globale\nBlue Fish Sourcing 75,00% 75,00% Contrôle exclusif Intégration globale\nBlue Fish Factory 98,00% 98,00% Contrôle exclusif Intégration globale\nBlue Fish Marinier 100,00% 100,00% Contrôle exclusif Intégration globale\nSEASON BRAND\nMutandis USA 100,00% 100,00% Contrôle exclusif Intégration globale\nSeason Brand LLC 100,00% 100,00% Contrôle exclusif Intégration globale"
            }
        ],
        [
            {
                "null": "Chiffre d'affaires 2.328.908 2.442.144",
                "2022 2023": ""
            },
            {
                "null": "Détergents 683.097 710.293",
                "2022 2023": ""
            },
            {
                "null": "Produits de la mer 659.817 648.824",
                "2022 2023": ""
            },
            {
                "null": "Bouteilles alimentaires 345.388 275.642",
                "2022 2023": ""
            },
            {
                "null": "Season Brand 561.388 560.623",
                "2022 2023": ""
            },
            {
                "null": "Boissons et jus de fruits 79.195 246.302",
                "2022 2023": ""
            },
            {
                "null": "Autres 22 460",
                "2022 2023": ""
            },
            {
                "null": "Variation des stocks d'en-cours et produits finis 105.165 -124.859\nAchats consommés -1.698.501 -1.420.439\nCharges de personnel -267.703 -289.722\nCharges externes -192.656 -246.631\nImpôts et taxes -8.414 -27.529\nAutres produits de l'activité 1.995 1.561",
                "2022 2023": ""
            },
            {
                "null": "EBE 268.794 334.526",
                "2022 2023": ""
            },
            {
                "null": "Dotations aux amortissements -89.631 -101.749\nDotations nettes de reprises aux provisions courantes -1.221 600\nAutres produits et charges d'exploitation -2.800 -5.621",
                "2022 2023": ""
            },
            {
                "null": "Résultat opérationnel courant 175.143 227.756",
                "2022 2023": ""
            },
            {
                "null": "Autres produits et charges opérationnels -3.555 -10.925",
                "2022 2023": ""
            },
            {
                "null": "Résultat opérationnel 171.588 216.831",
                "2022 2023": ""
            },
            {
                "null": "Résultat financier consolidé -29.874 -59.835",
                "2022 2023": ""
            },
            {
                "null": "Résultat avant impôt 141.714 156.996",
                "2022 2023": ""
            },
            {
                "null": "Impôts sur les bénéfices -37.190 -39.023\nImpôts différés sur retraitements IFRS -2.753 -4.235\nAutres Impôts différés -2.072 -1.090",
                "2022 2023": ""
            },
            {
                "null": "Total Impôts sur les bénéfices -42.016 -44.349",
                "2022 2023": ""
            },
            {
                "null": "Résultat après impôt 99.698 112.648",
                "2022 2023": ""
            },
            {
                "null": "Résultat net total 99.698 112.648",
                "2022 2023": ""
            },
            {
                "null": "Part du groupe 99.524 112.705",
                "2022 2023": ""
            },
            {
                "null": "Résultat net courant (*) 105.325 124.663",
                "2022 2023": ""
            }
        ],
        [
            {
                "Actifs courants 1.336.252 1.346.946": "Total Actif 3.134.761 3.730.539"
            }
        ],
        [
            {
                "Total des passifs 1.801.883 2.319.072": "Total Passif 3.134.761 3.730.539"
            }
        ],
        [
            {
                "BFR opérationnel (1) 491.316 425.377": "Dette nette ajustée (2) 802.214 1.201.516"
            }
        ]
    ]
}