{
    "text": "RESULTATS TECHNIQUES AKDITAL\nSOMMAIRE\nRAPPEL DES CARACTERISTIQUES DE L'OPERATION 2\nSYNTHESE GLOBALE DES RESULTATS 3\nSYNTHESE DES RESULTATS PAR TYPE D'ORDRE 4\nSYNTHESE DES RESULTATS PAR QUALITE DE SOUSCRIPTEURS 5\nSTATISTIQUES PAR :\nCATEGORIE DE SOUSCRIPTEURS 6\nCATEGORIE DE SOUSCRIPTEURS : TYPE D'ORDRE 7\nCATEGORIE DE SOUSCRIPTEURS : INSTITUTIONNELS/ NON INSTITUTIONNELS 8\nCATEGORIE DE SOUSCRIPTEURS : PERSONNES MORALES/ PERSONNES PHYSIQUES 9\nREGION DE SOUSCRIPTION 10\nNATIONALITE DE SOUSCRIPTEURS 11\nPROFESSION DE SOUSCRIPTEURS : PERSONNES PHYSIQUES 12\nBourse de Casablanca\nRREESSUULLTTAATTSS TTEECCHHNNIIQQUUEESS AAKKDDIITTAALL\nRRAAPPPPEELL DDEESS CCAARRAACCTTEERRIISSTTIIQQUUEESS DDEE\nLL''OOPPEERRAATTIIOONN\nNature de l'opération Augmentation du Capital social réservée au public\nNombre d'actions offertes 1 492 537\nPrix (MAD) 670,00\nMontant global de l’opération en MAD\n999 999 790 MAD\n(prime d’émission incluse)\nPériode de souscription du 02/07/2024 au 09/07/2024 à 15h30 inclus\nBourse de Casablanca\n2\nRESULTATS TECHNIQUES AKDITAL\nSYNTHESE GLOBALE DES RESULTATS\nGLOBAL\nPrix de l'action en MAD 670,00\nMontant souscrit en MAD 29 034 177 980\nActions demandées 43 334 594\nActions attribuées 1 492 537\nTaux moyen de satisfaction de la demande * 3,44 %\nNombre de souscripteurs 16 623\nNombre de régions ayant souscrit 12\nNombre de nationalités différentes des souscripteurs 43\nMontant attribué en MAD 999 999 790\n((**)) LLee ttaauuxx ddee ssaattiissffaaccttiioonn eesstt llee rraappppoorrtt eennttrree llee nnoommbbrree dd''aaccttiioonnss aattttrriibbuuééeess eett llee nnoommbbrree dd''aaccttiioonnss ddeemmaannddééeess\nBourse de Casablanca\n3\nRESULTATS TECHNIQUES AKDITAL\nSYNTHESE DES RESULTATS PAR\nTYPE D'ORDRE\nType I\nMontant souscrit en MAD 27 603 169 200\nActions demandées 41 198 760\nActions attribuées 1 194 029\nTaux de satisfaction de la demande * 2,90 %\nNombre de souscripteurs 917\nNombre de nationalités différentes des souscripteurs 15\nType II\nMontant souscrit en MAD 1 431 008 780\nActions demandées 2 135 834\nActions attribuées 298 508\nTaux de satisfaction de la demande * 13,98 %\nNombre de souscripteurs 15 706\nNombre de nationalités différentes des souscripteurs 40\n(*) Le taux de satisfaction est le rapport entre le nombre d'actions attribuées et le nombre d'actions demandées\nBourse de Casablanca 4\nRESULTATS TECHNIQUES AKDITAL\nSYNTHESE DES RESULTATS PAR\nQUALITE DE SOUSCRIPTEURS\nInstitutionnels\nMontant souscrit en MAD 17 609 488 730\nActions demandées 26 282 819\nActions attribuées 761 118\nTaux de satisfaction de la demande * 2,90 %\nNombre de souscripteurs 361\nNombre de nationalités différentes des souscripteurs 12\nPersonnes morales\nMontant souscrit en MAD 3 189 353 430\nActions demandées 4 760 229\nActions attribuées 139 724\nTaux de satisfaction de la demande * 2,94 %\nNombre de souscripteurs 319\nNombre de nationalités différentes des souscripteurs 1\nPersonnes physiques\nMontant souscrit en MAD 8 235 335 820\nActions demandées 12 291 546\nActions attribuées 591 695\nTaux de satisfaction de la demande * 4,81 %\nNombre de souscripteurs 15 943\nNombre de nationalités différentes des souscripteurs 38\n(*) Le taux de satisfaction est le rapport entre le nombre d'actions attribuées et le nombre d'actions demandées\nBourse de Casablanca\n5\nRESULTATS TECHNIQUES AKDITAL\nSYNTHESE PAR CATEGORIE DE SOUSCRIPTEURS\nLibelle Qualite+ SOUSCRIPTEURS ACTIONS\nTAUX DE\nCATEGORIE DE SOUSCRIPTEURS NOMBRE PART DEMANDEES PART ATTRIBUEES PART SATISFA\nCTION *\nPersonnes physiques marocaines résidentes 15 456 92,98% 11 924 192 27,52% 574 554 38,50% 4,82 %\nOPCVM Obligataires 90 0,54% 8 975 072 20,71% 260 158 17,43% 2,90 %\nOPCVM Diversifiés 117 0,70% 6 627 365 15,29% 191 998 12,86% 2,90 %\nOPCVM Actions 104 0,63% 5 183 046 11,96% 149 636 10,03% 2,89 %\nPersonnes morales marocaines 311 1,87% 4 554 949 10,51% 133 753 8,96% 2,94 %\nInstitutionnels étrangers 22 0,13% 1 722 916 3,98% 49 925 3,34% 2,90 %\nPersonnes morales marocaines qualifiées 10 0,06% 1 492 530 3,44% 43 260 2,90% 2,90 %\nBanques de droit marocain 8 0,05% 923 613 2,13% 26 772 1,79% 2,90 %\nCompagnies d'assurances marocaines 7 0,04% 910 518 2,10% 26 391 1,77% 2,90 %\nOrganismes de pension et de retraite 3 0,02% 447 759 1,03% 12 978 0,87% 2,90 %\nPersonnes physiques marocaines non résidentes 327 1,97% 247 796 0,57% 11 689 0,78% 4,72 %\nAssociations 6 0,04% 187 305 0,43% 5 431 0,36% 2,90 %\nPersonnes physiques étrangères résidentes 143 0,86% 111 267 0,26% 4 947 0,33% 4,45 %\nPersonnes morales étrangères 2 0,01% 17 975 0,04% 540 0,04% 3,00 %\nPersonnes physiques étrangères non résidentes 12 0,07% 7 847 0,02% 406 0,03% 5,17 %\nIncapables majeurs 5 0,03% 444 0,00% 99 0,01% 22,30 %\nTotal 16 623 100,00% 43 334 594 100,00% 1 492 537 100,00% 3,44 %\n(*) Le taux de satisfaction est le rapport entre le nombre d'actions attribuées et le nombre d'actions demandées\nBourse de Casablanca\n6\nRESULTATS TECHNIQUES AKDITAL\nSYNTHESE PAR CATEGORIE DE SOUSCRIPTEURS / TYPE\nD'ORDRE\nSOUSCRIPTIONS ACTIONS\nTAUX\nCATEGORIE DE SOUSCRIPTEURS/TYPE DE\nNOMBRE PART DEMANDEES PART ATTRIBUEES PART\nD'ORDRE SATISF\nACTION\nPersonnes physiques marocaines résidentes 501 54,63 % 10 030 364 24,35 % 290 589 24,34 % 2,90 %\nOPCVM Obligataires 88 9,60 % 8 973 864 21,78 % 260 118 21,78 % 2,90 %\nOPCVM Diversifiés 82 8,94 % 6 599 446 16,02 % 191 298 16,02 % 2,90 %\nOPCVM Actions 75 8,18 % 5 142 213 12,48 % 149 056 12,48 % 2,90 %\nPersonnes morales marocaines 100 10,91 % 4 471 285 10,85 % 129 591 10,85 % 2,90 %\nInstitutionnels étrangers 20 2,18 % 1 721 018 4,18 % 49 885 4,18 % 2,90 %\nPersonnes morales marocaines qualifiées 10 1,09 % 1 492 530 3,62 % 43 260 3,62 % 2,90 %\nBanques de droit marocain 8 0,87 % 923 613 2,24 % 26 772 2,24 % 2,90 %\nCompagnies d'assurances marocaines 7 0,76 % 910 518 2,21 % 26 391 2,21 % 2,90 %\nOrganismes de pension et de retraite 3 0,33 % 447 759 1,09 % 12 978 1,09 % 2,90 %\nPersonnes physiques marocaines non résidentes 10 1,09 % 194 711 0,47 % 5 643 0,47 % 2,90 %\nAssociations 6 0,65 % 187 305 0,45 % 5 431 0,45 % 2,90 %\nPersonnes physiques étrangères résidentes 5 0,55 % 79 684 0,19 % 2 308 0,19 % 2,90 %\nPersonnes morales étrangères 1 0,11 % 17 950 0,04 % 521 0,04 % 2,90 %\nPersonnes physiques étrangères non résidentes 1 0,11 % 6 500 0,02 % 188 0,02 % 2,89 %\nType I 917 5,52% 41 198 760 95,07% 1 194 029 80,00% 2,90%\nPersonnes physiques marocaines résidentes 14 955 95,22 % 1 893 828 88,67 % 283 965 95,13 % 14,99 %\nPersonnes physiques marocaines non résidentes 317 2,02 % 53 085 2,49 % 6 046 2,03 % 11,39 %\nPersonnes morales marocaines 211 1,34 % 83 664 3,92 % 4 162 1,39 % 4,97 %\nPersonnes physiques étrangères résidentes 138 0,88 % 31 583 1,48 % 2 639 0,88 % 8,36 %\nOPCVM Diversifiés 35 0,22 % 27 919 1,31 % 700 0,23 % 2,51 %\nOPCVM Actions 29 0,18 % 40 833 1,91 % 580 0,19 % 1,42 %\nPersonnes physiques étrangères non résidentes 11 0,07 % 1 347 0,06 % 218 0,07 % 16,18 %\nIncapables majeurs 5 0,03 % 444 0,02 % 99 0,03 % 22,30 %\nInstitutionnels étrangers 2 0,01 % 1 898 0,09 % 40 0,01 % 2,11 %\nOPCVM Obligataires 2 0,01 % 1 208 0,06 % 40 0,01 % 3,31 %\nPersonnes morales étrangères 1 0,01 % 25 0,00 % 19 0,01 % 76,00 %\nType II 15 706 94,48% 2 135 834 4,93% 298 508 20,00% 13,98%\nTotal 16 623 100,00 % 43 334 594 100,00 % 1 492 537 100,00 % 3,44 %\n(*) Le taux de satisfaction est le rapport entre le nombre d'actions attribuées et le nombre d'actions demandées\nBourse de Casablanca\n7\nRESULTATS TECHNIQUES AKDITAL\nSYNTHESE PAR CATEGORIE DE SOUSCRIPTEURS\nInstitutionnels / Non Institutionnels\nSOUSCRIPTIONS ACTIONS\nTAUX\nNOMB DE\nCATEGORIE DE SOUSCRIPTEURS PART DEMANDEES PART ATTRIBUEES PART\nRE SATISF\nACTION\nPersonnes physiques marocaines résidentes 15 456 95,04 % 11 924 192 69,93 % 574 554 78,55 % 4,82 %\nPersonnes morales marocaines 311 1,91 % 4 554 949 26,71 % 133 753 18,29 % 2,94 %\nPersonnes physiques marocaines non résidentes 327 2,01 % 247 796 1,45 % 11 689 1,60 % 4,72 %\nAssociations 6 0,04 % 187 305 1,10 % 5 431 0,74 % 2,90 %\nPersonnes physiques étrangères résidentes 143 0,88 % 111 267 0,65 % 4 947 0,68 % 4,45 %\nPersonnes morales étrangères 2 0,01 % 17 975 0,11 % 540 0,07 % 3,00 %\nPersonnes physiques étrangères non résidentes 12 0,07 % 7 847 0,05 % 406 0,06 % 5,17 %\nIncapables majeurs 5 0,03 % 444 0,00 % 99 0,01 % 22,30 %\nNon institutionnels 16 262 97,83 % 17 051 775 39,35 % 731 419 49,01 % 4,29%\nOPCVM Obligataires 90 24,93 % 8 975 072 34,15 % 260 158 34,18 % 2,90 %\nOPCVM Diversifiés 117 32,41 % 6 627 365 25,22 % 191 998 25,23 % 2,90 %\nOPCVM Actions 104 28,81 % 5 183 046 19,72 % 149 636 19,66 % 2,89 %\nInstitutionnels étrangers 22 6,09 % 1 722 916 6,56 % 49 925 6,56 % 2,90 %\nPersonnes morales marocaines qualifiées 10 2,77 % 1 492 530 5,68 % 43 260 5,68 % 2,90 %\nBanques de droit marocain 8 2,22 % 923 613 3,51 % 26 772 3,52 % 2,90 %\nCompagnies d'assurances marocaines 7 1,94 % 910 518 3,46 % 26 391 3,47 % 2,90 %\nOrganismes de pension et de retraite 3 0,83 % 447 759 1,70 % 12 978 1,71 % 2,90 %\nInstitutionnels 361 2,17 % 26 282 819 60,65 % 761 118 50,99 % 2,90%\nTotal 16 623 100,00 % 43 334 594 100,00 % 1 492 537 100,00 % 3,44 %\n(*) Le taux de satisfaction est le rapport entre le nombre d'actions attribuées et le nombre d'actions demandées\nBourse de Casablanca\n8\nRESULTATS TECHNIQUES AKDITAL\nSYNTHESE PAR CATEGORIE DE SOUSCRIPTEURS\nPersonnes morales / Personnes physiques\nLibelle Qualite+ SOUSCRIPTIONS ACTIONS\nTAUX\nDE\nCATEGORIE DE SOUSCRIPTEURS NOMBRE PART DEMANDEES PART ATTRIBUEES PART\nSATISF\nACTION\nOPCVM Obligataires 90 13,24 % 8 975 072 28,91 % 260 158 28,88 % 2,90 %\nOPCVM Diversifiés 117 17,21 % 6 627 365 21,35 % 191 998 21,31 % 2,90 %\nOPCVM Actions 104 15,29 % 5 183 046 16,70 % 149 636 16,61 % 2,89 %\nPersonnes morales marocaines 311 45,74 % 4 554 949 14,67 % 133 753 14,85 % 2,94 %\nInstitutionnels étrangers 22 3,24 % 1 722 916 5,55 % 49 925 5,54 % 2,90 %\nPersonnes morales marocaines qualifiées 10 1,47 % 1 492 530 4,81 % 43 260 4,80 % 2,90 %\nBanques de droit marocain 8 1,18 % 923 613 2,98 % 26 772 2,97 % 2,90 %\nCompagnies d'assurances marocaines 7 1,03 % 910 518 2,93 % 26 391 2,93 % 2,90 %\nOrganismes de pension et de retraite 3 0,44 % 447 759 1,44 % 12 978 1,44 % 2,90 %\nAssociations 6 0,88 % 187 305 0,60 % 5 431 0,60 % 2,90 %\nPersonnes morales étrangères 2 0,29 % 17 975 0,06 % 540 0,06 % 3,00 %\nPersonnes morales 680 4,09 % 31 043 048 71,64 % 900 842 60,36 % 2,90 %\nPersonnes physiques marocaines résidentes 15 456 96,95 % 11 924 192 97,01 % 574 554 97,10 % 4,82 %\nPersonnes physiques marocaines non\n327 2,05 % 247 796 2,02 % 11 689 1,98 % 4,72 %\nrésidentes\nPersonnes physiques étrangères résidentes 143 0,90 % 111 267 0,91 % 4 947 0,84 % 4,45 %\nPersonnes physiques étrangères non résidentes 12 0,08 % 7 847 0,06 % 406 0,07 % 5,17 %\nIncapables majeurs 5 0,03 % 444 0,00 % 99 0,02 % 22,30 %\nPersonnes physiques 15 943 95,91 % 12 291 546 28,36 % 591 695 39,64 % 4,81 %\nTotal 16 623 100,00 % 43 334 594 100,00 % 1 492 537 100,00 % 3,44 %\n(*) Le taux de satisfaction est le rapport entre le nombre d'actions attribuées et le nombre d'actions demandées\nBourse de Casablanca\n9\nRESULTATS TECHNIQUES AKDITAL\nSYNTHESE PAR REGION DE\nSOUSCRIPTION\nLibelle Region+ SOUSCRIPTIONS ACTIONS\nTAUX DE\nREGION NOMBRE PART DEMANDEES PART ATTRIBUEES PART SATISFA\nCTION *\nCasablanca - Settat 9 889 59,49% 38 144 151 88,02% 1 240 874 83,14% 3,25 %\nRabat - Salé - Kénitra 2 490 14,98% 3 044 768 7,03% 124 908 8,37% 4,10 %\nFès - Meknès 1 479 8,90% 447 902 1,03% 36 392 2,44% 8,12 %\nTanger - Tétouan - Al Hoceima 736 4,43% 494 948 1,14% 25 232 1,69% 5,10 %\nOriental 649 3,90% 408 450 0,94% 21 956 1,47% 5,38 %\nSouss-Massa 585 3,52% 425 990 0,98% 20 821 1,40% 4,89 %\nMarrakech - Safi 534 3,21% 312 640 0,72% 16 597 1,11% 5,31 %\nBéni Mellal-Khénifra 147 0,88% 18 287 0,04% 2 880 0,19% 15,75 %\nDraâ - Tafilalet 79 0,48% 26 122 0,06% 2 050 0,14% 7,85 %\nLaâyoune-Sakia El Hamra 25 0,15% 10 826 0,02% 664 0,04% 6,13 %\nGuelmim-Oued Noun 6 0,04% 347 0,00% 103 0,01% 29,68 %\nEd Dakhla-Oued Eddahab 4 0,02% 163 0,00% 60 0,00% 36,81 %\nTotal 16 623 100,00% 43 334 594 100,00% 1 492 537 100,00% 3,44 %\n(*) Le taux de satisfaction est le rapport entre le nombre d'actions attribuées et le nombre d'actions demandées\nBourse de Casablanca\n10\nRREESSUULLTTAATTSS TTEECCHHNNIIQQUUEESS AAKKDDIITTAALL\nSSYYNNTTHHEESSEE PPAARR NNAATTIIOONNAALLIITTEE DDEE\nSSOOUUSSCCRRIIPPTTEEUURR\nLibelle Pays+ SOUSCRIPTIONS ACTIONS\nTAUX\nDE\nPAYS NOMBRE PART DEMANDEES PART ATTRIBUEES PART SATISF\nACTION\n*\nMAROC 16 386 98,57% 41 433 024 95,61% 1 434 721 96,13% 3,46 %\nIRLANDE 5 0,03% 667 241 1,54% 19 340 1,30% 2,90 %\nEMIRATS ARABES UNIS 7 0,04% 208 228 0,48% 6 086 0,41% 2,92 %\nETATS UNIS D'AMERIQUE 4 0,02% 194 448 0,45% 5 669 0,38% 2,92 %\nILES CAÏMANS 6 0,04% 193 296 0,45% 5 596 0,37% 2,90 %\nAFRIQUE DU SUD 1 0,01% 149 253 0,34% 4 326 0,29% 2,90 %\nNORVEGE 1 0,01% 149 253 0,34% 4 326 0,29% 2,90 %\nFRANCE 116 0,70% 85 744 0,20% 3 973 0,27% 4,63 %\nCANADA 9 0,05% 102 298 0,24% 3 048 0,20% 2,98 %\nLUXEMBOURG 3 0,02% 64 100 0,15% 1 850 0,12% 2,89 %\nROYAUME UNI 2 0,01% 32 410 0,07% 957 0,06% 2,95 %\nSUEDE 2 0,01% 24 040 0,06% 715 0,05% 2,97 %\nQATAR 3 0,02% 6 715 0,02% 223 0,01% 3,32 %\nALGERIE 4 0,02% 4 727 0,01% 189 0,01% 4,00 %\nESPAGNE 9 0,05% 1 262 0,00% 178 0,01% 14,10 %\nEGYPTE 3 0,02% 4 777 0,01% 169 0,01% 3,54 %\nBELGIQUE 8 0,05% 1 329 0,00% 148 0,01% 11,14 %\nTUNISIE 7 0,04% 612 0,00% 137 0,01% 22,39 %\nALLEMAGNE 5 0,03% 1 025 0,00% 99 0,01% 9,66 %\nARABIE SAOUDITE 4 0,02% 1 440 0,00% 79 0,01% 5,49 %\nITALIE 4 0,02% 470 0,00% 78 0,01% 16,60 %\nTOGO 4 0,02% 110 0,00% 73 0,00% 66,36 %\nPAYS-BAS 3 0,02% 1 300 0,00% 60 0,00% 4,62 %\nCÔTE D'IVOIRE 3 0,02% 569 0,00% 50 0,00% 8,79 %\nSUISSE 3 0,02% 658 0,00% 50 0,00% 7,60 %\nJORDANIE 2 0,01% 600 0,00% 40 0,00% 6,67 %\nROUMANIE 2 0,01% 1 000 0,00% 40 0,00% 4,00 %\nBURKINA FASO 2 0,01% 27 0,00% 24 0,00% 88,89 %\nARGENTINE 1 0,01% 223 0,00% 20 0,00% 8,97 %\nCAMEROUN 1 0,01% 800 0,00% 20 0,00% 2,50 %\nDANEMARK 1 0,01% 1 890 0,00% 20 0,00% 1,06 %\nGHANA 1 0,01% 149 0,00% 20 0,00% 13,42 %\nGUINÉE 1 0,01% 300 0,00% 20 0,00% 6,67 %\nIRAK 1 0,01% 75 0,00% 20 0,00% 26,67 %\nKOWEIT 1 0,01% 179 0,00% 20 0,00% 11,17 %\nLIBAN 1 0,01% 200 0,00% 20 0,00% 10,00 %\nNAURU 1 0,01% 200 0,00% 20 0,00% 10,00 %\nRUSSIE 1 0,01% 148 0,00% 20 0,00% 13,51 %\nSYRIE 1 0,01% 200 0,00% 20 0,00% 10,00 %\nUKRAINE 1 0,01% 209 0,00% 20 0,00% 9,57 %\nBENIN 1 0,01% 20 0,00% 19 0,00% 95,00 %\nLIBYE 1 0,01% 30 0,00% 19 0,00% 63,33 %\nEQUATEUR 1 0,01% 15 0,00% 15 0,00% 100,00 %\nTotal 16 623 100,00% 43 334 594 100,00% 1 492 537 100,00% 3,44 %\n(*) Le taux de satisfaction est le rapport entre le nombre d'actions attribuées et le nombre d'actions demandées\nBourse de Casablanca\n11\nRESULTATS TECHNIQUES AKDITAL\nSYNTHESE PAR PROFESSION DE SOUSCRIPTEURS\nPERSONNES PHYSIQUES\nLibelle Profession+ SOUSCRIPTIONS ACTIONS\nTAUX DE\nPROFESSION NOMBRE PART DEMANDEES PART ATTRIBUEES PART SATISFA\nCTION *\nSalariés secteur privé 6 076 38,11% 4 331 090 35,24% 215 739 36,46% 4,98 %\nRetraités 1 260 7,90% 2 181 789 17,75% 80 078 13,53% 3,67 %\nSans emploi 1 410 8,84% 1 965 761 15,99% 77 969 13,18% 3,97 %\nEtudiants 2 511 15,75% 933 496 7,59% 67 650 11,43% 7,25 %\nFonctionnaires 2 563 16,08% 852 219 6,93% 63 920 10,80% 7,50 %\nProfessions libérales 969 6,08% 1 030 468 8,38% 42 316 7,15% 4,11 %\nCommerçants 663 4,16% 695 469 5,66% 29 035 4,91% 4,17 %\nSalariés secteur public 400 2,51% 158 040 1,29% 10 524 1,78% 6,66 %\nIndustriels 36 0,23% 120 113 0,98% 3 077 0,52% 2,56 %\nAgriculteurs 27 0,17% 17 997 0,15% 865 0,15% 4,81 %\nArtisans 28 0,18% 5 104 0,04% 522 0,09% 10,23 %\nTotal 15 943 100,00% 12 291 546 100,00% 591 695 100,00% 4,81 %\n(*) Le taux de satisfaction est le rapport entre le nombre d'actions attribuées et le nombre d'actions demandées\nBourse de Casablanca\n12",
    "tables": [
        [],
        [
            {
                "RAPPEL DES CARACTERISTIQUES DE L'OPERATION": "SYNTHESE GLOBALE DES RESULTATS",
                "2": "3"
            },
            {
                "RAPPEL DES CARACTERISTIQUES DE L'OPERATION": "SYNTHESE DES RESULTATS PAR TYPE D'ORDRE",
                "2": "4"
            },
            {
                "RAPPEL DES CARACTERISTIQUES DE L'OPERATION": "SYNTHESE DES RESULTATS PAR QUALITE DE SOUSCRIPTEURS",
                "2": "5"
            },
            {
                "RAPPEL DES CARACTERISTIQUES DE L'OPERATION": "STATISTIQUES PAR :",
                "2": ""
            },
            {
                "RAPPEL DES CARACTERISTIQUES DE L'OPERATION": "CATEGORIE DE SOUSCRIPTEURS",
                "2": "6"
            },
            {
                "RAPPEL DES CARACTERISTIQUES DE L'OPERATION": "CATEGORIE DE SOUSCRIPTEURS : TYPE D'ORDRE",
                "2": "7"
            },
            {
                "RAPPEL DES CARACTERISTIQUES DE L'OPERATION": "CATEGORIE DE SOUSCRIPTEURS : INSTITUTIONNELS/ NON INSTITUTIONNELS",
                "2": "8"
            },
            {
                "RAPPEL DES CARACTERISTIQUES DE L'OPERATION": "CATEGORIE DE SOUSCRIPTEURS : PERSONNES MORALES/ PERSONNES PHYSIQUES",
                "2": "9"
            },
            {
                "RAPPEL DES CARACTERISTIQUES DE L'OPERATION": "REGION DE SOUSCRIPTION",
                "2": "10"
            },
            {
                "RAPPEL DES CARACTERISTIQUES DE L'OPERATION": "NATIONALITE DE SOUSCRIPTEURS",
                "2": "11"
            },
            {
                "RAPPEL DES CARACTERISTIQUES DE L'OPERATION": "PROFESSION DE SOUSCRIPTEURS : PERSONNES PHYSIQUES",
                "2": "12"
            }
        ],
        [],
        [
            {
                "Nature de l'opération": "Nombre d'actions offertes",
                "Augmentation du Capital social réservée au public": "1 492 537"
            },
            {
                "Nature de l'opération": "Prix (MAD)",
                "Augmentation du Capital social réservée au public": "670,00"
            },
            {
                "Nature de l'opération": "Montant global de l’opération en MAD\n(prime d’émission incluse)",
                "Augmentation du Capital social réservée au public": "999 999 790 MAD"
            },
            {
                "Nature de l'opération": "Période de souscription",
                "Augmentation du Capital social réservée au public": "du 02/07/2024 au 09/07/2024 à 15h30 inclus"
            }
        ],
        [
            {
                "Bourse de Casablanca": "",
                "null": "2"
            }
        ],
        [
            {
                "RESULTATS TECHNIQUES": "SYNTHESE GLOBALE DES RESULTATS\nGLOBAL\nPrix de l'action en MAD 670,00\nMontant souscrit en MAD 29 034 177 980\nActions demandées 43 334 594\nActions attribuées 1 492 537\nTaux moyen de satisfaction de la demande * 3,44 %\nNombre de souscripteurs 16 623\nNombre de régions ayant souscrit 12\nNombre de nationalités différentes des souscripteurs 43\nMontant attribué en MAD 999 999 790",
                "AKDITAL": "",
                "null": ""
            },
            {
                "RESULTATS TECHNIQUES": "((**)) LLee ttaauuxx ddee ssaattiissffaaccttiioonn eesstt llee rraappppoorrtt eennttrree llee nnoommbbrree dd''aaccttiioonnss aattttrriibbuuééeess eett llee nnoommbbrree dd''aaccttiioonnss ddeemmaannddééeess",
                "AKDITAL": "",
                "null": ""
            },
            {
                "RESULTATS TECHNIQUES": "",
                "AKDITAL": "",
                "null": ""
            },
            {
                "RESULTATS TECHNIQUES": "Bourse de Casablanca",
                "AKDITAL": "",
                "null": ""
            },
            {
                "RESULTATS TECHNIQUES": "",
                "AKDITAL": "",
                "null": "3"
            }
        ],
        [
            {
                "Prix de l'action en MAD": "Montant souscrit en MAD",
                "670,00": "29 034 177 980"
            },
            {
                "Prix de l'action en MAD": "Actions demandées",
                "670,00": "43 334 594"
            },
            {
                "Prix de l'action en MAD": "Actions attribuées",
                "670,00": "1 492 537"
            },
            {
                "Prix de l'action en MAD": "Taux moyen de satisfaction de la demande *",
                "670,00": "3,44 %"
            },
            {
                "Prix de l'action en MAD": "Nombre de souscripteurs",
                "670,00": "16 623"
            },
            {
                "Prix de l'action en MAD": "Nombre de régions ayant souscrit",
                "670,00": "12"
            },
            {
                "Prix de l'action en MAD": "Nombre de nationalités différentes des souscripteurs",
                "670,00": "43"
            },
            {
                "Prix de l'action en MAD": "Montant attribué en MAD",
                "670,00": "999 999 790"
            }
        ],
        [],
        [
            {
                "Type I\nMontant souscrit en MAD 27 603 169 200\nActions demandées 41 198 760\nActions attribuées 1 194 029\nTaux de satisfaction de la demande * 2,90 %\nNombre de souscripteurs 917\nNombre de nationalités différentes des souscripteurs 15": "Type II\nMontant souscrit en MAD 1 431 008 780\nActions demandées 2 135 834\nActions attribuées 298 508\nTaux de satisfaction de la demande * 13,98 %\nNombre de souscripteurs 15 706\nNombre de nationalités différentes des souscripteurs 40"
            }
        ],
        [
            {
                "Montant souscrit en MAD": "Actions demandées",
                "27 603 169 200": "41 198 760"
            },
            {
                "Montant souscrit en MAD": "Actions attribuées",
                "27 603 169 200": "1 194 029"
            },
            {
                "Montant souscrit en MAD": "Taux de satisfaction de la demande *",
                "27 603 169 200": "2,90 %"
            },
            {
                "Montant souscrit en MAD": "Nombre de souscripteurs",
                "27 603 169 200": "917"
            },
            {
                "Montant souscrit en MAD": "Nombre de nationalités différentes des souscripteurs",
                "27 603 169 200": "15"
            }
        ],
        [
            {
                "Montant souscrit en MAD": "Actions demandées",
                "1 431 008 780": "2 135 834"
            },
            {
                "Montant souscrit en MAD": "Actions attribuées",
                "1 431 008 780": "298 508"
            },
            {
                "Montant souscrit en MAD": "Taux de satisfaction de la demande *",
                "1 431 008 780": "13,98 %"
            },
            {
                "Montant souscrit en MAD": "Nombre de souscripteurs",
                "1 431 008 780": "15 706"
            },
            {
                "Montant souscrit en MAD": "Nombre de nationalités différentes des souscripteurs",
                "1 431 008 780": "40"
            }
        ],
        [],
        [],
        [
            {
                "Montant souscrit en MAD": "Actions demandées",
                "17 609 488 730": "26 282 819"
            },
            {
                "Montant souscrit en MAD": "Actions attribuées",
                "17 609 488 730": "761 118"
            },
            {
                "Montant souscrit en MAD": "Taux de satisfaction de la demande *",
                "17 609 488 730": "2,90 %"
            },
            {
                "Montant souscrit en MAD": "Nombre de souscripteurs",
                "17 609 488 730": "361"
            },
            {
                "Montant souscrit en MAD": "Nombre de nationalités différentes des souscripteurs",
                "17 609 488 730": "12"
            }
        ],
        [
            {
                "Personnes morales": "Montant souscrit en MAD",
                "null": "3 189 353 430"
            },
            {
                "Personnes morales": "Actions demandées",
                "null": "4 760 229"
            },
            {
                "Personnes morales": "Actions attribuées",
                "null": "139 724"
            },
            {
                "Personnes morales": "Taux de satisfaction de la demande *",
                "null": "2,94 %"
            },
            {
                "Personnes morales": "Nombre de souscripteurs",
                "null": "319"
            },
            {
                "Personnes morales": "Nombre de nationalités différentes des souscripteurs",
                "null": "1"
            }
        ],
        [
            {
                "Personnes physiques": "Montant souscrit en MAD",
                "null": "8 235 335 820"
            },
            {
                "Personnes physiques": "Actions demandées",
                "null": "12 291 546"
            },
            {
                "Personnes physiques": "Actions attribuées",
                "null": "591 695"
            },
            {
                "Personnes physiques": "Taux de satisfaction de la demande *",
                "null": "4,81 %"
            },
            {
                "Personnes physiques": "Nombre de souscripteurs",
                "null": "15 943"
            },
            {
                "Personnes physiques": "Nombre de nationalités différentes des souscripteurs",
                "null": "38"
            }
        ],
        [],
        [
            {
                "Libelle Qualite+": "CATEGORIE DE SOUSCRIPTEURS",
                "SOUSCRIPTEURS": "NOMBRE",
                "null": "TAUX DE\nSATISFA\nCTION *",
                "ACTIONS": "DEMANDEES"
            },
            {
                "Libelle Qualite+": "Personnes physiques marocaines résidentes",
                "SOUSCRIPTEURS": "15 456",
                "null": "4,82 %",
                "ACTIONS": "11 924 192"
            },
            {
                "Libelle Qualite+": "OPCVM Obligataires",
                "SOUSCRIPTEURS": "90",
                "null": "2,90 %",
                "ACTIONS": "8 975 072"
            },
            {
                "Libelle Qualite+": "OPCVM Diversifiés",
                "SOUSCRIPTEURS": "117",
                "null": "2,90 %",
                "ACTIONS": "6 627 365"
            },
            {
                "Libelle Qualite+": "OPCVM Actions",
                "SOUSCRIPTEURS": "104",
                "null": "2,89 %",
                "ACTIONS": "5 183 046"
            },
            {
                "Libelle Qualite+": "Personnes morales marocaines",
                "SOUSCRIPTEURS": "311",
                "null": "2,94 %",
                "ACTIONS": "4 554 949"
            },
            {
                "Libelle Qualite+": "Institutionnels étrangers",
                "SOUSCRIPTEURS": "22",
                "null": "2,90 %",
                "ACTIONS": "1 722 916"
            },
            {
                "Libelle Qualite+": "Personnes morales marocaines qualifiées",
                "SOUSCRIPTEURS": "10",
                "null": "2,90 %",
                "ACTIONS": "1 492 530"
            },
            {
                "Libelle Qualite+": "Banques de droit marocain",
                "SOUSCRIPTEURS": "8",
                "null": "2,90 %",
                "ACTIONS": "923 613"
            },
            {
                "Libelle Qualite+": "Compagnies d'assurances marocaines",
                "SOUSCRIPTEURS": "7",
                "null": "2,90 %",
                "ACTIONS": "910 518"
            },
            {
                "Libelle Qualite+": "Organismes de pension et de retraite",
                "SOUSCRIPTEURS": "3",
                "null": "2,90 %",
                "ACTIONS": "447 759"
            },
            {
                "Libelle Qualite+": "Personnes physiques marocaines non résidentes",
                "SOUSCRIPTEURS": "327",
                "null": "4,72 %",
                "ACTIONS": "247 796"
            },
            {
                "Libelle Qualite+": "Associations",
                "SOUSCRIPTEURS": "6",
                "null": "2,90 %",
                "ACTIONS": "187 305"
            },
            {
                "Libelle Qualite+": "Personnes physiques étrangères résidentes",
                "SOUSCRIPTEURS": "143",
                "null": "4,45 %",
                "ACTIONS": "111 267"
            },
            {
                "Libelle Qualite+": "Personnes morales étrangères",
                "SOUSCRIPTEURS": "2",
                "null": "3,00 %",
                "ACTIONS": "17 975"
            },
            {
                "Libelle Qualite+": "Personnes physiques étrangères non résidentes",
                "SOUSCRIPTEURS": "12",
                "null": "5,17 %",
                "ACTIONS": "7 847"
            },
            {
                "Libelle Qualite+": "Incapables majeurs",
                "SOUSCRIPTEURS": "5",
                "null": "22,30 %",
                "ACTIONS": "444"
            },
            {
                "Libelle Qualite+": "Total",
                "SOUSCRIPTEURS": "16 623",
                "null": "3,44 %",
                "ACTIONS": "43 334 594"
            }
        ],
        [
            {
                "Bourse de Casablanca": "",
                "null": "6"
            }
        ],
        [],
        [
            {
                "": "CATEGORIE DE SOUSCRIPTEURS/TYPE\nD'ORDRE",
                "SOUSCRIPTIONS": "NOMBRE",
                "null": "TAUX\nDE\nSATISF\nACTION",
                "ACTIONS": "DEMANDEES"
            },
            {
                "": "Personnes physiques marocaines résidentes",
                "SOUSCRIPTIONS": "501",
                "null": "2,90 %",
                "ACTIONS": "10 030 364"
            },
            {
                "": "OPCVM Obligataires",
                "SOUSCRIPTIONS": "88",
                "null": "2,90 %",
                "ACTIONS": "8 973 864"
            },
            {
                "": "OPCVM Diversifiés",
                "SOUSCRIPTIONS": "82",
                "null": "2,90 %",
                "ACTIONS": "6 599 446"
            },
            {
                "": "OPCVM Actions",
                "SOUSCRIPTIONS": "75",
                "null": "2,90 %",
                "ACTIONS": "5 142 213"
            },
            {
                "": "Personnes morales marocaines",
                "SOUSCRIPTIONS": "100",
                "null": "2,90 %",
                "ACTIONS": "4 471 285"
            },
            {
                "": "Institutionnels étrangers",
                "SOUSCRIPTIONS": "20",
                "null": "2,90 %",
                "ACTIONS": "1 721 018"
            },
            {
                "": "Personnes morales marocaines qualifiées",
                "SOUSCRIPTIONS": "10",
                "null": "2,90 %",
                "ACTIONS": "1 492 530"
            },
            {
                "": "Banques de droit marocain",
                "SOUSCRIPTIONS": "8",
                "null": "2,90 %",
                "ACTIONS": "923 613"
            },
            {
                "": "Compagnies d'assurances marocaines",
                "SOUSCRIPTIONS": "7",
                "null": "2,90 %",
                "ACTIONS": "910 518"
            },
            {
                "": "Organismes de pension et de retraite",
                "SOUSCRIPTIONS": "3",
                "null": "2,90 %",
                "ACTIONS": "447 759"
            },
            {
                "": "Personnes physiques marocaines non résidentes",
                "SOUSCRIPTIONS": "10",
                "null": "2,90 %",
                "ACTIONS": "194 711"
            },
            {
                "": "Associations",
                "SOUSCRIPTIONS": "6",
                "null": "2,90 %",
                "ACTIONS": "187 305"
            },
            {
                "": "Personnes physiques étrangères résidentes",
                "SOUSCRIPTIONS": "5",
                "null": "2,90 %",
                "ACTIONS": "79 684"
            },
            {
                "": "Personnes morales étrangères",
                "SOUSCRIPTIONS": "1",
                "null": "2,90 %",
                "ACTIONS": "17 950"
            },
            {
                "": "Personnes physiques étrangères non résidentes",
                "SOUSCRIPTIONS": "1",
                "null": "2,89 %",
                "ACTIONS": "6 500"
            },
            {
                "": "Type I",
                "SOUSCRIPTIONS": "917",
                "null": "2,90%",
                "ACTIONS": "41 198 760"
            },
            {
                "": "Personnes physiques marocaines résidentes",
                "SOUSCRIPTIONS": "14 955",
                "null": "14,99 %",
                "ACTIONS": "1 893 828"
            },
            {
                "": "Personnes physiques marocaines non résidentes",
                "SOUSCRIPTIONS": "317",
                "null": "11,39 %",
                "ACTIONS": "53 085"
            },
            {
                "": "Personnes morales marocaines",
                "SOUSCRIPTIONS": "211",
                "null": "4,97 %",
                "ACTIONS": "83 664"
            },
            {
                "": "Personnes physiques étrangères résidentes",
                "SOUSCRIPTIONS": "138",
                "null": "8,36 %",
                "ACTIONS": "31 583"
            },
            {
                "": "OPCVM Diversifiés",
                "SOUSCRIPTIONS": "35",
                "null": "2,51 %",
                "ACTIONS": "27 919"
            },
            {
                "": "OPCVM Actions",
                "SOUSCRIPTIONS": "29",
                "null": "1,42 %",
                "ACTIONS": "40 833"
            },
            {
                "": "Personnes physiques étrangères non résidentes",
                "SOUSCRIPTIONS": "11",
                "null": "16,18 %",
                "ACTIONS": "1 347"
            },
            {
                "": "Incapables majeurs",
                "SOUSCRIPTIONS": "5",
                "null": "22,30 %",
                "ACTIONS": "444"
            },
            {
                "": "Institutionnels étrangers",
                "SOUSCRIPTIONS": "2",
                "null": "2,11 %",
                "ACTIONS": "1 898"
            },
            {
                "": "OPCVM Obligataires",
                "SOUSCRIPTIONS": "2",
                "null": "3,31 %",
                "ACTIONS": "1 208"
            },
            {
                "": "Personnes morales étrangères",
                "SOUSCRIPTIONS": "1",
                "null": "76,00 %",
                "ACTIONS": "25"
            },
            {
                "": "Type II",
                "SOUSCRIPTIONS": "15 706",
                "null": "13,98%",
                "ACTIONS": "2 135 834"
            },
            {
                "": "Total",
                "SOUSCRIPTIONS": "16 623",
                "null": "3,44 %",
                "ACTIONS": "43 334 594"
            }
        ],
        [
            {
                "Bourse de Casablanca": "",
                "null": "7"
            }
        ],
        [],
        [
            {
                "": "CATEGORIE DE SOUSCRIPTEURS",
                "SOUSCRIPTIONS": "NOMB\nRE",
                "null": "TAUX\nDE\nSATISF\nACTION",
                "ACTIONS": "DEMANDEES"
            },
            {
                "": "Personnes physiques marocaines résidentes",
                "SOUSCRIPTIONS": "15 456",
                "null": "4,82 %",
                "ACTIONS": "11 924 192"
            },
            {
                "": "Personnes morales marocaines",
                "SOUSCRIPTIONS": "311",
                "null": "2,94 %",
                "ACTIONS": "4 554 949"
            },
            {
                "": "Personnes physiques marocaines non résidentes",
                "SOUSCRIPTIONS": "327",
                "null": "4,72 %",
                "ACTIONS": "247 796"
            },
            {
                "": "Associations",
                "SOUSCRIPTIONS": "6",
                "null": "2,90 %",
                "ACTIONS": "187 305"
            },
            {
                "": "Personnes physiques étrangères résidentes",
                "SOUSCRIPTIONS": "143",
                "null": "4,45 %",
                "ACTIONS": "111 267"
            },
            {
                "": "Personnes morales étrangères",
                "SOUSCRIPTIONS": "2",
                "null": "3,00 %",
                "ACTIONS": "17 975"
            },
            {
                "": "Personnes physiques étrangères non résidentes",
                "SOUSCRIPTIONS": "12",
                "null": "5,17 %",
                "ACTIONS": "7 847"
            },
            {
                "": "Incapables majeurs",
                "SOUSCRIPTIONS": "5",
                "null": "22,30 %",
                "ACTIONS": "444"
            },
            {
                "": "Non institutionnels",
                "SOUSCRIPTIONS": "16 262",
                "null": "4,29%",
                "ACTIONS": "17 051 775"
            },
            {
                "": "OPCVM Obligataires",
                "SOUSCRIPTIONS": "90",
                "null": "2,90 %",
                "ACTIONS": "8 975 072"
            },
            {
                "": "OPCVM Diversifiés",
                "SOUSCRIPTIONS": "117",
                "null": "2,90 %",
                "ACTIONS": "6 627 365"
            },
            {
                "": "OPCVM Actions",
                "SOUSCRIPTIONS": "104",
                "null": "2,89 %",
                "ACTIONS": "5 183 046"
            },
            {
                "": "Institutionnels étrangers",
                "SOUSCRIPTIONS": "22",
                "null": "2,90 %",
                "ACTIONS": "1 722 916"
            },
            {
                "": "Personnes morales marocaines qualifiées",
                "SOUSCRIPTIONS": "10",
                "null": "2,90 %",
                "ACTIONS": "1 492 530"
            },
            {
                "": "Banques de droit marocain",
                "SOUSCRIPTIONS": "8",
                "null": "2,90 %",
                "ACTIONS": "923 613"
            },
            {
                "": "Compagnies d'assurances marocaines",
                "SOUSCRIPTIONS": "7",
                "null": "2,90 %",
                "ACTIONS": "910 518"
            },
            {
                "": "Organismes de pension et de retraite",
                "SOUSCRIPTIONS": "3",
                "null": "2,90 %",
                "ACTIONS": "447 759"
            },
            {
                "": "Institutionnels",
                "SOUSCRIPTIONS": "361",
                "null": "2,90%",
                "ACTIONS": "26 282 819"
            },
            {
                "": "Total",
                "SOUSCRIPTIONS": "16 623",
                "null": "3,44 %",
                "ACTIONS": "43 334 594"
            }
        ],
        [],
        [
            {
                "Libelle Qualite+": "CATEGORIE DE SOUSCRIPTEURS",
                "SOUSCRIPTIONS": "NOMBRE",
                "null": "TAUX\nDE\nSATISF\nACTION",
                "ACTIONS": "DEMANDEES"
            },
            {
                "Libelle Qualite+": "OPCVM Obligataires",
                "SOUSCRIPTIONS": "90",
                "null": "2,90 %",
                "ACTIONS": "8 975 072"
            },
            {
                "Libelle Qualite+": "OPCVM Diversifiés",
                "SOUSCRIPTIONS": "117",
                "null": "2,90 %",
                "ACTIONS": "6 627 365"
            },
            {
                "Libelle Qualite+": "OPCVM Actions",
                "SOUSCRIPTIONS": "104",
                "null": "2,89 %",
                "ACTIONS": "5 183 046"
            },
            {
                "Libelle Qualite+": "Personnes morales marocaines",
                "SOUSCRIPTIONS": "311",
                "null": "2,94 %",
                "ACTIONS": "4 554 949"
            },
            {
                "Libelle Qualite+": "Institutionnels étrangers",
                "SOUSCRIPTIONS": "22",
                "null": "2,90 %",
                "ACTIONS": "1 722 916"
            },
            {
                "Libelle Qualite+": "Personnes morales marocaines qualifiées",
                "SOUSCRIPTIONS": "10",
                "null": "2,90 %",
                "ACTIONS": "1 492 530"
            },
            {
                "Libelle Qualite+": "Banques de droit marocain",
                "SOUSCRIPTIONS": "8",
                "null": "2,90 %",
                "ACTIONS": "923 613"
            },
            {
                "Libelle Qualite+": "Compagnies d'assurances marocaines",
                "SOUSCRIPTIONS": "7",
                "null": "2,90 %",
                "ACTIONS": "910 518"
            },
            {
                "Libelle Qualite+": "Organismes de pension et de retraite",
                "SOUSCRIPTIONS": "3",
                "null": "2,90 %",
                "ACTIONS": "447 759"
            },
            {
                "Libelle Qualite+": "Associations",
                "SOUSCRIPTIONS": "6",
                "null": "2,90 %",
                "ACTIONS": "187 305"
            },
            {
                "Libelle Qualite+": "Personnes morales étrangères",
                "SOUSCRIPTIONS": "2",
                "null": "3,00 %",
                "ACTIONS": "17 975"
            },
            {
                "Libelle Qualite+": "Personnes morales",
                "SOUSCRIPTIONS": "680",
                "null": "2,90 %",
                "ACTIONS": "31 043 048"
            },
            {
                "Libelle Qualite+": "Personnes physiques marocaines résidentes",
                "SOUSCRIPTIONS": "15 456",
                "null": "4,82 %",
                "ACTIONS": "11 924 192"
            },
            {
                "Libelle Qualite+": "Personnes physiques marocaines non\nrésidentes",
                "SOUSCRIPTIONS": "327",
                "null": "4,72 %",
                "ACTIONS": "247 796"
            },
            {
                "Libelle Qualite+": "Personnes physiques étrangères résidentes",
                "SOUSCRIPTIONS": "143",
                "null": "4,45 %",
                "ACTIONS": "111 267"
            },
            {
                "Libelle Qualite+": "Personnes physiques étrangères non résidentes",
                "SOUSCRIPTIONS": "12",
                "null": "5,17 %",
                "ACTIONS": "7 847"
            },
            {
                "Libelle Qualite+": "Incapables majeurs",
                "SOUSCRIPTIONS": "5",
                "null": "22,30 %",
                "ACTIONS": "444"
            },
            {
                "Libelle Qualite+": "Personnes physiques",
                "SOUSCRIPTIONS": "15 943",
                "null": "4,81 %",
                "ACTIONS": "12 291 546"
            },
            {
                "Libelle Qualite+": "Total",
                "SOUSCRIPTIONS": "16 623",
                "null": "3,44 %",
                "ACTIONS": "43 334 594"
            }
        ],
        [
            {
                "Bourse de Casablanca": "",
                "null": "9"
            }
        ],
        [],
        [
            {
                "Libelle Region+": "REGION",
                "SOUSCRIPTIONS": "NOMBRE",
                "null": "TAUX DE\nSATISFA\nCTION *",
                "ACTIONS": "DEMANDEES"
            },
            {
                "Libelle Region+": "Casablanca - Settat",
                "SOUSCRIPTIONS": "9 889",
                "null": "3,25 %",
                "ACTIONS": "38 144 151"
            },
            {
                "Libelle Region+": "Rabat - Salé - Kénitra",
                "SOUSCRIPTIONS": "2 490",
                "null": "4,10 %",
                "ACTIONS": "3 044 768"
            },
            {
                "Libelle Region+": "Fès - Meknès",
                "SOUSCRIPTIONS": "1 479",
                "null": "8,12 %",
                "ACTIONS": "447 902"
            },
            {
                "Libelle Region+": "Tanger - Tétouan - Al Hoceima",
                "SOUSCRIPTIONS": "736",
                "null": "5,10 %",
                "ACTIONS": "494 948"
            },
            {
                "Libelle Region+": "Oriental",
                "SOUSCRIPTIONS": "649",
                "null": "5,38 %",
                "ACTIONS": "408 450"
            },
            {
                "Libelle Region+": "Souss-Massa",
                "SOUSCRIPTIONS": "585",
                "null": "4,89 %",
                "ACTIONS": "425 990"
            },
            {
                "Libelle Region+": "Marrakech - Safi",
                "SOUSCRIPTIONS": "534",
                "null": "5,31 %",
                "ACTIONS": "312 640"
            },
            {
                "Libelle Region+": "Béni Mellal-Khénifra",
                "SOUSCRIPTIONS": "147",
                "null": "15,75 %",
                "ACTIONS": "18 287"
            },
            {
                "Libelle Region+": "Draâ - Tafilalet",
                "SOUSCRIPTIONS": "79",
                "null": "7,85 %",
                "ACTIONS": "26 122"
            },
            {
                "Libelle Region+": "Laâyoune-Sakia El Hamra",
                "SOUSCRIPTIONS": "25",
                "null": "6,13 %",
                "ACTIONS": "10 826"
            },
            {
                "Libelle Region+": "Guelmim-Oued Noun",
                "SOUSCRIPTIONS": "6",
                "null": "29,68 %",
                "ACTIONS": "347"
            },
            {
                "Libelle Region+": "Ed Dakhla-Oued Eddahab",
                "SOUSCRIPTIONS": "4",
                "null": "36,81 %",
                "ACTIONS": "163"
            },
            {
                "Libelle Region+": "Total",
                "SOUSCRIPTIONS": "16 623",
                "null": "3,44 %",
                "ACTIONS": "43 334 594"
            }
        ],
        [],
        [
            {
                "Libelle Pays+": "PAYS",
                "SOUSCRIPTIONS": "NOMBRE",
                "null": "TAUX\nDE\nSATISF\nACTION\n*",
                "ACTIONS": "DEMANDEES"
            },
            {
                "Libelle Pays+": "MAROC",
                "SOUSCRIPTIONS": "16 386",
                "null": "3,46 %",
                "ACTIONS": "41 433 024"
            },
            {
                "Libelle Pays+": "IRLANDE",
                "SOUSCRIPTIONS": "5",
                "null": "2,90 %",
                "ACTIONS": "667 241"
            },
            {
                "Libelle Pays+": "EMIRATS ARABES UNIS",
                "SOUSCRIPTIONS": "7",
                "null": "2,92 %",
                "ACTIONS": "208 228"
            },
            {
                "Libelle Pays+": "ETATS UNIS D'AMERIQUE",
                "SOUSCRIPTIONS": "4",
                "null": "2,92 %",
                "ACTIONS": "194 448"
            },
            {
                "Libelle Pays+": "ILES CAÏMANS",
                "SOUSCRIPTIONS": "6",
                "null": "2,90 %",
                "ACTIONS": "193 296"
            },
            {
                "Libelle Pays+": "AFRIQUE DU SUD",
                "SOUSCRIPTIONS": "1",
                "null": "2,90 %",
                "ACTIONS": "149 253"
            },
            {
                "Libelle Pays+": "NORVEGE",
                "SOUSCRIPTIONS": "1",
                "null": "2,90 %",
                "ACTIONS": "149 253"
            },
            {
                "Libelle Pays+": "FRANCE",
                "SOUSCRIPTIONS": "116",
                "null": "4,63 %",
                "ACTIONS": "85 744"
            },
            {
                "Libelle Pays+": "CANADA",
                "SOUSCRIPTIONS": "9",
                "null": "2,98 %",
                "ACTIONS": "102 298"
            },
            {
                "Libelle Pays+": "LUXEMBOURG",
                "SOUSCRIPTIONS": "3",
                "null": "2,89 %",
                "ACTIONS": "64 100"
            },
            {
                "Libelle Pays+": "ROYAUME UNI",
                "SOUSCRIPTIONS": "2",
                "null": "2,95 %",
                "ACTIONS": "32 410"
            },
            {
                "Libelle Pays+": "SUEDE",
                "SOUSCRIPTIONS": "2",
                "null": "2,97 %",
                "ACTIONS": "24 040"
            },
            {
                "Libelle Pays+": "QATAR",
                "SOUSCRIPTIONS": "3",
                "null": "3,32 %",
                "ACTIONS": "6 715"
            },
            {
                "Libelle Pays+": "ALGERIE",
                "SOUSCRIPTIONS": "4",
                "null": "4,00 %",
                "ACTIONS": "4 727"
            },
            {
                "Libelle Pays+": "ESPAGNE",
                "SOUSCRIPTIONS": "9",
                "null": "14,10 %",
                "ACTIONS": "1 262"
            },
            {
                "Libelle Pays+": "EGYPTE",
                "SOUSCRIPTIONS": "3",
                "null": "3,54 %",
                "ACTIONS": "4 777"
            },
            {
                "Libelle Pays+": "BELGIQUE",
                "SOUSCRIPTIONS": "8",
                "null": "11,14 %",
                "ACTIONS": "1 329"
            },
            {
                "Libelle Pays+": "TUNISIE",
                "SOUSCRIPTIONS": "7",
                "null": "22,39 %",
                "ACTIONS": "612"
            },
            {
                "Libelle Pays+": "ALLEMAGNE",
                "SOUSCRIPTIONS": "5",
                "null": "9,66 %",
                "ACTIONS": "1 025"
            },
            {
                "Libelle Pays+": "ARABIE SAOUDITE",
                "SOUSCRIPTIONS": "4",
                "null": "5,49 %",
                "ACTIONS": "1 440"
            },
            {
                "Libelle Pays+": "ITALIE",
                "SOUSCRIPTIONS": "4",
                "null": "16,60 %",
                "ACTIONS": "470"
            },
            {
                "Libelle Pays+": "TOGO",
                "SOUSCRIPTIONS": "4",
                "null": "66,36 %",
                "ACTIONS": "110"
            },
            {
                "Libelle Pays+": "PAYS-BAS",
                "SOUSCRIPTIONS": "3",
                "null": "4,62 %",
                "ACTIONS": "1 300"
            },
            {
                "Libelle Pays+": "CÔTE D'IVOIRE",
                "SOUSCRIPTIONS": "3",
                "null": "8,79 %",
                "ACTIONS": "569"
            },
            {
                "Libelle Pays+": "SUISSE",
                "SOUSCRIPTIONS": "3",
                "null": "7,60 %",
                "ACTIONS": "658"
            },
            {
                "Libelle Pays+": "JORDANIE",
                "SOUSCRIPTIONS": "2",
                "null": "6,67 %",
                "ACTIONS": "600"
            },
            {
                "Libelle Pays+": "ROUMANIE",
                "SOUSCRIPTIONS": "2",
                "null": "4,00 %",
                "ACTIONS": "1 000"
            },
            {
                "Libelle Pays+": "BURKINA FASO",
                "SOUSCRIPTIONS": "2",
                "null": "88,89 %",
                "ACTIONS": "27"
            },
            {
                "Libelle Pays+": "ARGENTINE",
                "SOUSCRIPTIONS": "1",
                "null": "8,97 %",
                "ACTIONS": "223"
            },
            {
                "Libelle Pays+": "CAMEROUN",
                "SOUSCRIPTIONS": "1",
                "null": "2,50 %",
                "ACTIONS": "800"
            },
            {
                "Libelle Pays+": "DANEMARK",
                "SOUSCRIPTIONS": "1",
                "null": "1,06 %",
                "ACTIONS": "1 890"
            },
            {
                "Libelle Pays+": "GHANA",
                "SOUSCRIPTIONS": "1",
                "null": "13,42 %",
                "ACTIONS": "149"
            },
            {
                "Libelle Pays+": "GUINÉE",
                "SOUSCRIPTIONS": "1",
                "null": "6,67 %",
                "ACTIONS": "300"
            },
            {
                "Libelle Pays+": "IRAK",
                "SOUSCRIPTIONS": "1",
                "null": "26,67 %",
                "ACTIONS": "75"
            },
            {
                "Libelle Pays+": "KOWEIT",
                "SOUSCRIPTIONS": "1",
                "null": "11,17 %",
                "ACTIONS": "179"
            },
            {
                "Libelle Pays+": "LIBAN",
                "SOUSCRIPTIONS": "1",
                "null": "10,00 %",
                "ACTIONS": "200"
            },
            {
                "Libelle Pays+": "NAURU",
                "SOUSCRIPTIONS": "1",
                "null": "10,00 %",
                "ACTIONS": "200"
            },
            {
                "Libelle Pays+": "RUSSIE",
                "SOUSCRIPTIONS": "1",
                "null": "13,51 %",
                "ACTIONS": "148"
            },
            {
                "Libelle Pays+": "SYRIE",
                "SOUSCRIPTIONS": "1",
                "null": "10,00 %",
                "ACTIONS": "200"
            },
            {
                "Libelle Pays+": "UKRAINE",
                "SOUSCRIPTIONS": "1",
                "null": "9,57 %",
                "ACTIONS": "209"
            },
            {
                "Libelle Pays+": "BENIN",
                "SOUSCRIPTIONS": "1",
                "null": "95,00 %",
                "ACTIONS": "20"
            },
            {
                "Libelle Pays+": "LIBYE",
                "SOUSCRIPTIONS": "1",
                "null": "63,33 %",
                "ACTIONS": "30"
            },
            {
                "Libelle Pays+": "EQUATEUR",
                "SOUSCRIPTIONS": "1",
                "null": "100,00 %",
                "ACTIONS": "15"
            },
            {
                "Libelle Pays+": "Total",
                "SOUSCRIPTIONS": "16 623",
                "null": "3,44 %",
                "ACTIONS": "43 334 594"
            }
        ],
        [],
        [
            {
                "Libelle Profession+": "PROFESSION",
                "SOUSCRIPTIONS": "NOMBRE",
                "null": "TAUX DE\nSATISFA\nCTION *",
                "ACTIONS": "DEMANDEES"
            },
            {
                "Libelle Profession+": "Salariés secteur privé",
                "SOUSCRIPTIONS": "6 076",
                "null": "4,98 %",
                "ACTIONS": "4 331 090"
            },
            {
                "Libelle Profession+": "Retraités",
                "SOUSCRIPTIONS": "1 260",
                "null": "3,67 %",
                "ACTIONS": "2 181 789"
            },
            {
                "Libelle Profession+": "Sans emploi",
                "SOUSCRIPTIONS": "1 410",
                "null": "3,97 %",
                "ACTIONS": "1 965 761"
            },
            {
                "Libelle Profession+": "Etudiants",
                "SOUSCRIPTIONS": "2 511",
                "null": "7,25 %",
                "ACTIONS": "933 496"
            },
            {
                "Libelle Profession+": "Fonctionnaires",
                "SOUSCRIPTIONS": "2 563",
                "null": "7,50 %",
                "ACTIONS": "852 219"
            },
            {
                "Libelle Profession+": "Professions libérales",
                "SOUSCRIPTIONS": "969",
                "null": "4,11 %",
                "ACTIONS": "1 030 468"
            },
            {
                "Libelle Profession+": "Commerçants",
                "SOUSCRIPTIONS": "663",
                "null": "4,17 %",
                "ACTIONS": "695 469"
            },
            {
                "Libelle Profession+": "Salariés secteur public",
                "SOUSCRIPTIONS": "400",
                "null": "6,66 %",
                "ACTIONS": "158 040"
            },
            {
                "Libelle Profession+": "Industriels",
                "SOUSCRIPTIONS": "36",
                "null": "2,56 %",
                "ACTIONS": "120 113"
            },
            {
                "Libelle Profession+": "Agriculteurs",
                "SOUSCRIPTIONS": "27",
                "null": "4,81 %",
                "ACTIONS": "17 997"
            },
            {
                "Libelle Profession+": "Artisans",
                "SOUSCRIPTIONS": "28",
                "null": "10,23 %",
                "ACTIONS": "5 104"
            },
            {
                "Libelle Profession+": "Total",
                "SOUSCRIPTIONS": "15 943",
                "null": "4,81 %",
                "ACTIONS": "12 291 546"
            }
        ]
    ]
}