{
    "text": "COMMUNICATION FINANCIÈRE RÉSULTATS AU 31 DÉCEMBRE 2023\nCasablanca, le 30 avril 2024\nCOMPTES SOCIAUX\n› Un résultat net part du groupe de 65 MDH, en recul de 24%\ndans un contexte international défavorable.\nComptes sociaux 2023 2022 Variation\n(en MDH)\n› Proposition de distribution d’un dividende de 21 DH par action.\nChiffre d’affaires 4.908 4.851 1%\nLe Conseil d’Administration de Sonasid s’est réuni le 13 mars 2024, sous la présidence de Monsieur\nSaïd Elhadi, pour arrêter les comptes de l’exercice 2023.\nEBITDA 264 303 -13%\nLe chiffre d’affaires social de Sonasid s’élève à 4 908 MDH en 2023, en hausse de 1% par rapport\nà la même période en 2022. Cette évolution est soutenue par des volumes de vente en\nRésultat d’exploitation 119 197 -40%\nprogression de 9% en 2023, qui ont permis de neutraliser l’impact de la tendance baissière des\nprix sur le chiffre d’affaires.\nRésultat net 79 121 -34%\nLe résultat d’exploitation s’établit à 119 MDH, en contraction de 40% par rapport à 2022. Cette\nbaisse est imputable à la forte dégradation des spreads entre ferraille et rond à béton sur le marché\ninternational, dont les effets ont néanmoins pu être atténués grâce aux initiatives stratégiques COMPTES CONSOLIDÉS\nmises en œuvre, axées sur le développement commercial, le renforcement de la compétitivité et le\nlancement de nouveaux produits à forte valeur ajoutée. Comptes consolidés 2023 2022 Variation\n(en MDH)\nLe résultat financier ressort à -6 MDH en 2023, en amélioration de 15 MDH par rapport à 2022, Chiffre d’affaires 4.996 4.888 2%\nsous l’effet d’une bonne maîtrise du bilan de change.\nRésultat net - Part du groupe 65 86 -24%\nLe résultat net social se situe ainsi à 79 MDH, en recul de 34% par rapport à 2022.\nSonasid conserve une structure bilancielle solide et résiliente avec une trésorerie excédentaire, DIVIDENDES\ny compris titres et valeurs de placement, de 756 MDH à fin décembre 2023. Le Conseil d’Administration proposera à l’Assemblée Générale des Actionnaires la distribution\nd’un dividende de 21 DH par action, au titre de l’exercice 2023.\nCOMPTES CONSOLIDÉS\nPERSPECTIVES\nA fin décembre 2023, le chiffre d’affaires consolidé s’établit à 4 996 MDH en croissance de 2%\nLe Groupe Sonasid compte maintenir son engagement en faveur d'un modèle économique\npar rapport à 2022.\ndurable, en bénéficiant d’une part, des nouvelles opportunités de croissance attendues au\nLe résultat net part du groupe s’établit à 65 MDH, en baisse de 24% par rapport à l’exercice\nniveau du marché marocain et en poursuivant, d’autre part, le développement de produits\nprécédent.\ninnovants à faible empreinte carbone.\nLes investissements réalisés au niveau du périmètre de consolidation s’établissent à 219 MDH\nà fin décembre 2023, en progression de 54% par rapport à 2022. Cet effort d’investissement\nrenforcé a essentiellement porté sur l’excellence opérationnelle et le développement de nouveaux\nproduits.\nExercice du 1er janvier au 31 décembre 2023\nBILAN ACTIF\nBILAN - ACTIF Au : 31/12/2023\nExercice Exercice Précedent\nACTIF\nBrut Amort. et prov. Net Net\nESILIBOMMI\nFITCA\nIMMOBILISATIONS EN NON VALEURS (A) - - -\n• Frais préliminaires - - -\n• Charges à repartir sur plusieurs exercices - - -\n• Primes de remboursement des obligations - - -\nIMMOBILISATIONS INCORPORELLES (B) 59.306.024,18 55.576.491,77 3.729.532,41 4.529.220,91\n• Immobilisation en recherche et développement - - -\n• Brevets, marques, droits et valeurs similaires 51.814.397,69 48.084.865,28 3.729.532,41 4.529.220,91\n• Fonds commercial 7.491.626,49 7.491.626,49 -\n• Autres immobilisations incorporelles - - -\nIMMOBILISATIONS CORPORELLES (C) 4.466.831.409,02 3.853.304.430,99 613.526.978,03 510.144.453,89\n• Terrains 113.576.646,66 - 113.576.646,66 104.798.703,64\n• Constructions 543.260.464,75 493.081.383,30 50.179.081,45 79.546.973,44\n• Installations techniques, matériel et outillage 3.704.544.370,85 3.287.119.152,05 417.425.218,80 275.448.744,46\n• Matériel de transport 34.872.066,22 33.679.806,09 1.192.260,13 1.239.058,01\n• Mobilier, matériel de bureau et aménag. divers 39.159.564,11 35.258.021,74 3.901.542,37 2.755.681,80\n• Autres immobilisations corporelles 4.166.067,81 4.166.067,81 -\n• Immobilisations corporelles en cours 27.252.228,62 27.252.228,62 46.355.292,54\nIMMOBILISATIONS FINANCIÈRES (D) 98.375.316,81 - 98.375.316,81 98.375.316,81\n• Prêts immobilisés 13.225,25 - 13.225,25 13.225,25\n• Autres créances financières 39.867.991,56 - 39.867.991,56 39.867.991,56\n• Titres de participation 58.494.100,00 - 58.494.100,00 58.494.100,00\n• Autres titres immobilisés - - -\nÉCARTS DE CONVERSION - ACTIF (E) - -\n• Diminution des créances immobilisées - -\n• Augmentation des dettes de financement - -\nTOTAL I (A+B+C+D+E) 4.624.512.750,01 3.908.880.922,76 715.631.827,25 613.048.991,61\nTNALUCRIC\nFITCA\nSTOCKS (F) 980.382.876,90 69.888.365,00 910.494.511,90 936.118.785,30\n• Marchandises 12.065.048,52 - 12.065.048,52 12.881.172,35\n• Matières et fournitures consommables 455.301.473,61 69.888.365,00 385.413.108,61 293.964.374,04\n• Produits en cours 189.929.017,43 - 189.929.017,43 70.125.949,37\n• Produits intermédiaires et produits résiduels 76.021.967,19 - 76.021.967,19 74.699.647,35\n• Produits finis 247.065.370,15 - 247.065.370,15 484.447.642,19\nCRÉANCES DE L’ACTIF CIRCULANT (G) 1.741.936.248,56 242.223.739,34 1.499.712.509,22 1.171.166.530,74\n• Fournisseurs débiteurs, avances et acomptes 11.978.117,79 - 11.978.117,79 25.025.054,70\n• Clients et comptes rattachés 1.562.924.723,07 231.870.524,56 1.331.054.198,51 1.040.738.302,18\n• Personnel - Débiteur 281.375,82 - 281.375,82 311.911,87\n• Etat - Débiteur 130.577.251,05 - 130.577.251,05 91.803.762,28\n• Comptes d’associés - - - -\n• Autres débiteurs 33.017.881,42 10.353.214,78 22.664.666,64 12.337.482,19\n• Comptes de régularisation - Actif 3.156.899,41 3.156.899,41 950.017,52\nTITRES VALEURS DE PLACEMENT (H) 480.231.796,06 - 480.231.796,06 809.735.705,26\nÉCARTS DE CONVERSION - ACTIF (I)\n1.857.963,97 - 1.857.963,97 10.271.673,00\n(Éléments circulants)\nTOTAL II (F+G+H+I) 3.204.408.885,49 312.112.104,34 2.892.296.781,15 2.927.292.694,30\nEIREROSÉRT\nCOMPTES SOCIAUX BILAN PASSIF\nBILAN - PASSIF (modèle normal) EXERCICE DU 01/01/2023 AU 31/12/2023\nPASSIF Exercice Exercice Précédent\nTRÉSORERIE - ACTIF 276.017.049,70 - 276.017.049,70 31.263.615,37\n• Chèques et valeurs à encaisser - - - 870.218,00\n• Banques, T.G et C.C.P. débiteurs 275.874.177,62 - 275.874.177,62 30.202.050,32\n• Caisses, Régies d’avances et accréditifs 142.872,08 - 142.872,08 191.347,05\nTOTAL III 276.017.049,70 - 276.017.049,70 31.263.615,37\nTOTAL GENERAL I+II+III 8.104.938.685,20 4.220.993.027,10 3.883.945.658,10 3.571.605.301,28\n(1) capital personnel débiteur (–)\n(2) bénéficiaire (+) ; déficitaire (–)\nTNENAMREP\nTNEMECNANIF\nCAPITAUX PROPRES\n• Capital social ou personnel (1) 390.000.000,00 390.000.000,00\n• Moins : actionnaires, capital souscrit non appelé\n• Capital appelé dont versé. 390.000.000,00 390.000.000,00\n• Primes d’émission, de fusion, d’apport 1.604.062,88 1.604.062,88\n• Écarts de réévaluation - -\n• Réserve légale 39.000.000,00 39.000.000,00\n• Autres réserves 845.654.313,94 845.654.313,94\n• Report à nouveau (2) 5.845.248,88 2.245.237,09\n• Résultats nets en instance d’affectation (2) - -\n• Résultat net de l’exercice (2) 79.097.609,38 120.600.011,79\nTOTAL DES CAPITAUX PROPRES (A) 1.361.201.235,08 1.399.103.625,70\nCAPITAUX PROPRES ASSIMILÉS (B)\n• Subventions d'investissement\n• Provisions réglementées pour amortissements dérogatoires - -\n• Provisions réglementées pour plus-values en instance d'imposition - -\n• Provisions réglementées pour investissements - -\n• Provisions réglementées pour reconstitution des gisements - -\n• Provisions réglementées pour acquisition et construction de logements - -\n• Autres provisions réglementées - -\nDETTES DE FINANCEMENT (C)\n• Emprunts obligataires - -\n• Emprunts auprès des établissements de crédit - -\n• Avances de l'Etat - -\n• Dettes rattachées à des participations et billets de fonds - -\n• Avances reçues et comptes courants bloqués - -\n• Fournisseurs d'immobilisations, cautionnements reçus et autres dettes de financement - -\nPROVISIONS DURABLES POUR RISQUES & CHARGES (D) 57.220.585,85 57.220.585,85\n• Provisions pour risques 57.220.585,85 57.220.585,85\n• Provisions pour charges - -\nÉCARTS DE CONVERSION - PASSIF (E)\n• Augmentation des créances immobilisées - -\n• Diminution des dettes de financement - -\nTotal I (A+B+C+D+E) - -\nTNALUCRIC\nFISSAP\nDETTES DU PASSIF CIRCULANT (F) 2.436.536.034,71 2.078.214.090,15\n• Fournisseurs et comptes rattachés 2.025.432.669,53 1.613.146.889,96\n• Clients créditeurs, avances et acomptes 9.452.205,94 156.346.373,90\n• Personnel - Créditeur 4.443.399,32 4.404.964,96\n• Organismes Sociaux 265.631,58 6.860.877,89\n• Etat - Créditeur 395.035.259,49 294.856.114,59\n• Comptes d'associés - Créditeurs 1.228.000,00 1.920.000,00\n• Autres Créanciers 678.868,85 678.868,85\n• Comptes de régularisation - Passif - -\nAUTRES PROVISIONS POUR RISQUES ET CHARGES (G) 28.259.004,97 36.672.714,00\nÉCARTS DE CONVERSION - PASSIF (Éléments circulants) (H) 728.797,49 394.285,58\nTotal II (F+G+H) 2.465.523.837,17 2.115.281.089,73\nEIREROSERT\nTRÉSORERIE - PASSIF\n• Crédits d’escompte - -\n• Crédits de trésorerie - -\n• Banques (soldes créditeurs) - -\nTotal III - -\nTOTAL GENERAL I+II+III 3.883.945.658,10 3.571.605.301,28\nCOMPTE PRODUITS ET CHARGES\n(HORS TAXES) (MODÈLE NORMAL)\nCOMPTE PRODUITS ET CHARGES (hors taxes) (modèle normal) Exercice du : 01/01/2023 au 31/12/2023\nOPERATIONS\nConcernant TOTAUX DE Situation\nNATURE L’EXERCICE comparative au Propres à l’exercice les exercices\n3=1+2 31/12/2020 1 précédents\n2\nNOITATIOLPXE\nI PRODUITS D’EXPLOITATION\n• Ventes de marchandises (en l'état) 21.648.698,58 21.648.698,58 18.687.908,95\n• Ventes de biens et services produits 4.886.545.893,26 4.886.545.893,26 4.831.985.506,55\n• Variation de stocks de produits(±) (1) -110.126.823,24 -110.126.823,24 218.215.953,50\n• Immobilisations produites par\n- - - -\nl'entreprise pour elle-même.\n• Subventions d'exploitation - - -\n• Autres produits d'exploitation - - - -\n• Reprises d'exploitation; transferts de charges. 116.572.898,74 116.572.898,74 108.391.289,70\nTOTAL I 4.914.640.667,34 - 4.914.640.667,34 5.177.280.658,70\nII CHARGES D’EXPLOITATION\n• Achats revendus (2) de marchandises 15.402.231,92 15.402.231,92 8.859.805,40\n• Achats consommés (2) de matières et fournitures 4.057.278.856,77 114.741,51 4.057.393.598,28 4.276.627.204,79\n• Autres charges externes 292.561.664,58 80.228,86 292.641.893,44 292.756.177,07\n• Impôts et taxes 62.210.625,46 62.210.625,46 57.465.187,20\n• Charges de personnel 189.967.150,93 189.967.150,93 160.441.930,19\n• Autres charges d'exploitation 1.228.000,00 1.228.000,00 1.908.000,00\n• Dotation d'exploitation 177.053.757,60 177.053.757,60 182.408.339,18\nTOTAL II 4.795.702.287,26 194.970,37 4.795.897.257,63 4.980.466.643,83\nIII RESULTAT D’EXPLOITATION (I-II) - - 118.743.409,71 196.814.014,87\nREICNANIF\nCOMPTE PRODUITS ET CHARGES (hors taxes) (modèle normal) Exercice du : 01/01/2023 au 31/12/2023\nOPERATIONS\nConcernant TOTAUX DE SITUATION\nNATURE L’EXERCICE COMPARATIVE Propres à l’exercice les exercices\n3=1+2 AU 31/12/2020 1 précédents\n2\nVII RESULTAT COURANT (reports) - - 112.821.569,85 176.258.624,69\nIV PRODUITS FINANCIERS\n• Produits des titres de participation et autres titres immo-\n- - - -\nbilisés.\n• Gains de change 21.683.961,62 - 21.683.961,62 6.866.137,68\n• Intérêts et autres produits financiers 10.405.947,86 - 10.405.947,86 14.466.521,35\n• Reprises financières; transfert de charges 10.271.673,00 - 10.271.673,00 7.050.146,30\nTOTAL IV 42.361.582,48 42.361.582,48 28.382.805,33\nV CHARGES FINANCIERES\n• Charges d'intérêts 27.409.654,12 - 27.409.654,12 7.612.934,23\n• Pertes de change 19.015.804,25 - 19.015.804,25 31.053.588,28\n• Autres charges financières - - -\n• Dotations financières 1.857.963,97 - 1.857.963,97 10.271.673,00\nTOTAL V 48.283.422,34 - 48.283.422,34 48.938.195,51\nVI RESULTAT FINANCIER (IV-V) - - -5.921.839,86 -20.555.390,18\nVII RESULTAT COURANT (III+VI) - - 112.821.569,85 176.258.624,69\nTNARUOC\nNON\nVIII VIII PRODUITS NON COURANT\n• Produits des cessions d'immobilisations 475.000,00 - 475.000,00 -\n• Subventions d'équilibre - - - -\n• Reprises sur subventions d'investissement - - - -\n• Autres produits non courants 21.846.537,66 - 21.846.537,66 25.503.894,96\n• Reprises non courantes; transferts de charges - - - 383.034,95\nTOTAL VIII 22.321.537,66 22.321.537,66 103.751.039,76\nIX CHARGES NON COURANTES\n• Valeurs nettes d'amortissements des\n8.361.482,73\nImmobilisations cédées.\n• Subventions accordées - - - -\n• Autres charges non courantes 18.517.727,13 18.517.727,13 14.530.020,75\n• Dotations non courantes aux amortissements\n- - - -\net aux provisions.\nTOTAL IX 18.517.727,13 - 18.517.727,13 22.891.503,48\nX RESULTAT NON COURANT (VIII±IX) 3.803.810,53 2.995.426,43\nXI RESULTAT AVANT IMPOTS (VII-X) 116.625.380,38 179.254.051,12\nXII IMPOTS SUR LES RESULTATS 37.527.771,00 58.654.039,33\nXIII RESULTAT NET (XI-XII) 79.097.609,38 120.600.011,79\nXIV TOTAL DES PRODUITS (I+IV+VIII) 4.979.323.787,48 5.231.550.393,94\nXV TOTAL DES CHARGES (II+V+IX+XII) 4.900.226.178,10 5.110.950.382,15\nXVI RESULTAT NET (PRODUITS-CHARGES) 79.097.609,38 120.600.011,79\nPASSAGE DU RESULTAT NET COMPTABLE AU RESULTAT NET FISCAL TABLEAU DES IMMOBILISATIONS AUTRES QUE FINANCIÈRES\nINTITULE Au : 31/12/2023\nTABLEAU DES IMMOBILISATIONS AUTRES QUE FINANCIÈRES Exercice du : 01/01/2023 au 31/12/2023\nMONTANT MONTANT\nAUGMENTATION REPRISES\nI - RESULTAT NET COMPTABLE\n• Bénéfice net 79.097.609,38 -\nPRODUCTION\nMONTANT BRUT\n• Perte nette - - MONTANT BRUT PAR\nNATURE FIN\nII - REINTEGRATIONS FISCALES 124.036.769,00 - DÉBUT EXERCICE ACQUISITION L’ENTREPRISE VIREMENT CESSION RETRAIT VIREMENT\nEXERCICE\n1. COURANTES 76.578.069,77\nPOUR\n• PROVISION POUR DEPRECIATION DES STOCKS 69.888.365,00 -\nELLE-MÊME\n• PROVISION POUR DEPRECIATION DES COMPTES CLIENTS 5.207.651,66 -\n• Excédent non déductible sur les cadeaux publicitaires 558.285,25 - IMMOBILISATIONS EN NON VALEURS 0,00 0,00 0,00 0,00 0,00 0,00 0,00 0,00\n• Dons non déductibles - - • Frais préliminaires 0,00 - - - - - 0,00 0,00\n• CHARGES DES EXERCICES ANTERIEURS 194.970,37 - • Charges à répartir sur plusieurs exercices 0,00 - - - - - 0,00 0,00\n• Provisions non déductibles - -\n• Primes de remboursement d'obligations 0,00 - - - - 0,00 0,00\n• Excédent non déductible sur les intérêts des comptes courants - -\n• ECART DE CONVERSION PASSIF 728.797,49 - IMMOBILISATIONS INCORPORELLES 58.574.063,18 0,00 0,00 731.961,00 0,00 0,00 0,00 59.306.024,18\n• Immobilisation en recherche et\nTOTAL DES RÉINTÉGRATIONS COURANTES 76.578.069,77 - 0,00 - - - - - 0,00 0,00\n2. NON COURANTES 47.458. 699,23 développement\n• Brevets, marques, droits et\n• Amendes, pénalités et majorations de retard 361.600,63 - 51.082.436,69 - - 731.961,00 - - 51.814.397,69\nvaleurs similaires\n• Cohésion sociale 9.460.329,00 -\n• Fonds commercial 7.491.626,49 - - - - - 7.491.626,49 7 491 626,49\n• Subvention d’investissement - -\n• Autres immobilisations incorporelles 0,00 - - - - - 0,00 0,00\n• Fraction de la plus-value réalisée par la Sté absorbée et dont l’imposition est différée entre les mains de la Sté absorbante» - -\n• IS 37.527.771,00 - IMMOBILISATIONS CORPORELLES 4.267.571.461,99 204.540.576,58 0,00 - 222.911.679,50 4.548.668,55 0,00 223.643.640,50 4.466.831.409,02\n• Autres charges non courantes non déductibles - - • Terrains 113.198.328,66 - - 378.318,00 - - - 113.576.646,66\nTOTAL DES RÉINTÉGRATIONS NON COURANTES 47.458.699,23 - • Constructions 540.932.485,50 - - 2.327.979,25 - - - 543.260.464,75\nIII - DEDUCTIONS FISCALES 85.860.095,94 • Installations techniques, maté-\n1. COURANTES 10 565 642,41 9 827 524,66 riel et outillage 3.487.174.697,14 - - 217.406.265,87 36.592,16 - - 3.704.544.370,85\n• Ecart de conversion passif exercice 2013 - 394.285,58 • Matériel de transport 38.971.358,17 - - 412.784,44 4.512.076,39 - - 34.872.066,22\n• Reprise provision pour depreciation des stocks - 85.264.024,99 • Mobilier, matériel de bureau et\n• Reprise provision pour depreciation des clients - 201.785,37 aménagement 36.773.232,17 - - 2.386.331,94 - - - 39.159.564,11\nTOTAL DES DÉDUCTIONS FISCALES COURANTES - 85.860.095,94 • Autres immobilisations corporelles 4.166.067,81 - - 0,00 - - - 4.166.067,81\n2. NON COURANTES 10 565 642,41 9 827 524,66\n• Immobilisations corporelles en cours 46.355.292,54 204.540.576,58 - - - - 223.643.640,50 27.252.228,62\n• Abattement sur le profit net global des cessions ou des retraits effectués au cours de l’exercice (art. 19 de l’I.s.) - -\nTotal 4.326.145.525,17 204.540.576,58 0,00 223.643.640,50 4.548.668,55 0,00 223.643.640,50 4.526.137.433,20\n• Reprise subvention d’investissement - -\n• Abattement de la plus-value constatée par la société absorbante sur les titres de participation détenus dans la Sté - -\n• Profit net global de cession exonéré en cas de réinvestissement du produit global des cessions - -\nTOTAL DES DÉDUCTIONS FISCALES NON COURANTES - -\nTOTAL 203.134.378,38 85.860.095,94\nIV - RESULTAT BRUT FISCAL Montants\nBénéfice brut si T1 > T2 (A) 117.274.282,44 -\nDéficit brut fiscal si T1 < T2 (B) - -\n• Déficit ou fraction de déficit correspondant à la dotation aux amortissements pratiqués - -\n• Surplus correspondant au déficit d’exploitation. - -\nV - REPORTS DEFICITAIRES IMPUTES (C) (1)\n• Exercice N-4 - -\n• Exercice N-3 - -\n• Exercice N-2 - -\n• Exercice N-1 - -\n• Déficit absorbé sur les amortissements indéfiniment reportables - -\nVI - RESULTAT NET FISCAL\nBénéfice net fiscal (A-C) - 117.274.282,44\nou Déficit net fiscal (B) - -\nVII - CUMUL DES REPORTS DE DEFICITS SUR AMORTISSEMENTS Montants\nVIII - CUMUL DES DEFICITS D’EXPLOITATION RESTANT A REPORTER FISCALEMENT\n• Exercice N-4 - -\n• Exercice N-3 - -\n• Exercice N-2 - -\n• Exercice N-1 - -\n(1) Dans la limite du montant du bénéfice brut fiscal (A)\nETAT DES SOLDES DE GESTION DETAIL DES POSTES DU CPC (CHARGES)\nETAT DES SOLDES DE GESTION ESG Exercice du : 01/01/2023 au 31/12/2023 DETAIL DES POSTES DU CPC (CHARGES) Exercice du : 01/01/2023 au 31/12/2023\nPOSTE Exercice Exercice précédent\nI - TABLEAU DE FORMATION DES RESULTATS (T.F.R.)\nCHARGES D’EXPLOITATION\nExercice Exercice précédent\n611 ACHATS REVENDUS DE MARCHANDISES\n1 • Ventes de marchandises en l'état 21.648.698,58 18.687.908,95\n• Achats de marchandises 14.427.826,15 17.977.666,43\n2 – • Achats revendus de marchandises 15.402.231,92 8.859.805,40 • Variation des stocks de marchandises 974.405,77 -9.117.861,03\nI = MARGE BRUTE SUR VENTES EN L’ETAT 6.246.466,66 9.828.103,55 TOTAL 15.402.231,92 8.859.805,40\nII + PRODUCTION DE L’EXERCICE : (3+4+5) 4.776.419.070,02 5.050.201.460,05 612 ACHATS CONSOMMÉS DE MATIÈRES ET FOURNITURES\n3 • Ventes de biens et services produits 4.886.545.893,26 4.831.985.506,55 • Achats de matières premières 3.189.324.106,35 3.353.173.122,32\n• Variation des stocks de matières premières -69.126.889,85 -96.332.041,67\n4 • Variation stocks de produits -110.126.823,24 218.215.953,50\n• Achats de matières et fournitures consommables et d’emballages 487.941.588,39 602.077.362,39\n5 • Immobilisations produites par l'entreprise pour elle-même - -\n• Variation des stocks de matières, fournitures et emballages - -4.754.365,40\nIII – CONSOMMATIONS DE L’EXERCICE : (6+7) 4.350.035.491,72 4.569.383.381,86\n• Achats non stockés de matières et fournitures 324.369.161,81 341.065.757,34\n6 • Achats consommés de matières et fournitures 4.057.393.598,28 4.276.627.204,79\n• Achats de travaux, études et prestations de service UTEE (I + II – III) 124.885.631,58 74.812.887,41\n7 • Autres charges externes 292.641.893,44 292.756.177,07 TOTAL 4.057.393.598,28 4.270.042.722,39\nIV = VALEUR AJOUTEE (I + II – III) 432.630.044,96 490.646.181,74 613/314 AUTRES CHARGES EXTERNES\n8 + • Subventions d'exploitation - - • Locations et charges locatives 16.075.420,47 14.369.824,94\nV 9 – • Impôts et taxes 62.210.625,46 57.465.187,20 • Redevances de crédit-bail 9.314.584,08 10.125.056,08\n• Entretien et réparations 5.188.225,86 3.325.080,16\n10 – • Charges de personnel 189.967.150,93 160.441.930,19\n• Primes d'assurances 19.661.311,78 19.285.850,66\n= EXCEDENT BRUT D’EXPLOITATION (EBE) 180.452.268,57 272.739.064,35\n• Rémunérations du personnel extérieur à l'entreprise 11.054.131,77 9.683.168,06\n= INSUFFISANCE BRUTE D’EXPLOITATION (IBE) - -\n• Rémunérations d'intermédiaires et honoraires 103.986.920,32 98.447.846,95\n11 + • Autres produits d'exploitation - - • Redevances pour brevets, marques, droits... 292.731,78 2.858.879,41\n12 – • Autres charges d'exploitation 1.228.000,00 1.908.000,00 • Transports 94.365.409,96 106.674.237,05\n13 + • Reprises d'exploitation : transferts de charges 116.572.898,74 108.391.289,70 • Déplacements, missions et réceptions 14.825.598,00 9.429.879,48\n14 – • Dotations d'exploitation 177.053.757,60 182.408.339,18 • Reste du poste des autres charges externes 17.877.559,42 18.556.354,28\nVI = RESULTAT D’EXPLOITATION (+ ou -) 118.743.409,71 196.814.014,87 TOTAL 292.641.893,44 292.756.177,07\n617 CHARGES DU PERSONNEL 10 565 642,41 9 827 524,66\nVII ± RESULTAT FINANCIER -5.921.839,86 -20.555.390,18\n• Rémunérations du personnel 132.511.516,16 132.885.325,18\nVIII = RESULTAT COURANT (+ ou -) 112.821.569,85 176.258.624,69\n• Charges sociales ( 6174) 35.733.426,70 35.966.667,72\nIX ± RESULTAT NON COURANT 3.803.810,53 2.995.426,43\n• Reste du poste des charges de personnel 21.722.208,07 5.571.142,55\n15 – Impôts sur les résultats 37.527.771,00 58.654.039,33\nTOTAL 189.967.150,93 174.423.135,45\nX = RESULTAT NET DE L'EXERCICE ( + ou – ) 79.097.609,38 120.600.011,79 618 AUTRES CHARGES D’EXPLOITATION 10 565 642,41 9 827 524,66\nII - CAPACITE D’AUTOFINANCEMENT (C.A.F.) - AUTOFINANCEMENT (par la méthode dite additive) • Jetons de présence 1.228.000,00 1.908.000,00\n1 • Pertes sur créances irrécouvrables 0,00 0,00\n• Bénéfice + 79.097.609,38 120.600.011,79 • Reste du poste des autres charges d'exploitation 0,00 0,00\nTOTAL 1.228.000,00 1.908.000,00\n– • Perte – - -\nCHARGES FINANCIÈRES\n2 + Dotation d'exploitation (1) 101.957.740,94 89.380.203,85\n638 AUTRES CHARGES FINANCIÈRES 10 565 642,41 9 827 524,66\n3 + Dotations financières (1) - -\n• Charges nettes sur cessions de titres et valeurs de placement 10 565 642,41 - -\n4 + Dotations non courantes (1) - - • Reste du poste des autres charges financières 0,00 0,00\n5 – Reprises d'exploitation (2) - - TOTAL\n6 – Reprises financières (2) - 6.460.598,88 CHARGES NON COURANTES\n7 – Reprises non courantes (2) (3) - 383.034,95 658 AUTRES CHARGES NON COURANTES 10 565 642,41 9 827 524,66\n• Pénalités sur marchés et dédits 0,00 0,00\n8 – Produits des cessions d'immobilisations 475.000,00 -\n• Rappels d'impôts (autres qu'impôts sur les résultats) 0,00 0,00\n9 + Valeurs nettes d'amortissements des immobilisations cédées. - 76.975,00\n• Pénalités et amendes fiscales ou pénales 361.600,63 427.247,00\nI CAPACITE D'AUTOFINANCEMENT (C.A.F.) 180.580.350,32 203.213.556,81\n• Créances devenues irrécouvrables 9.873,78 4.130,16\n10 – Distributions de bénéfices 117.000.000,00 148.200.000,00\n• Reste du poste des autres charges non courantes 9.559.453,82 14.098.643,59\nII = AUTOFINANCEMENT 63.580.350,32 55.013.556,81 TOTAL 9.930.928,23 14.530.020,75\n(1) A l’exclusion des dotations relatives aux actifs et passifs circulants et à la trésorerie.\n(2) A l’exclusion des reprises relatives aux actifs circulants et à la trésorerie.\n(3) Y compris reprises sur subventions d’investissements.\nDETAIL DES POSTES DU CPC TABLEAU DES BIENS EN CREDIT-BAIL\n(PRODUITS)\nPRODUITS D’EXPLOITATION Exercice Exercice précédent\nTABLEAU DES BIENS EN CREDIT-BAIL Exercice du : 01/01/2023 au 31/12/2023\n711 VENTES DE MARCHANDISES 10 565 642,41 9 827 524,66\nREDEVANCES RESTANT\n• Ventes de marchandises au Maroc 93.328,00 686.455,67 VALEUR DURÉE CUMUL DES MONTANT DE À PAYER PRIX D’ACHAT\n• Ventes de marchandises à l'étranger 21.555.370,58 18.001.453,28 RÉSIDUEL EN\nDATE DE LA ESTIMÉE DU THÉORIQUE EXERCICES L’EXERCICE\n• Reste du poste des ventes de marchandises 0,00 0,00 A MOINS D’UN A MOINS D’UN FIN\nRUBRIQUES 1ÈRE DURÉE DU DIEN D’AMORTISSE- PRÉCÉDENTS DES OBSERVATIONS\nTOTAL 21.648.698,58 18.687.908,95 ÉCHÉANCE CONTRAT EN À LA DATE MENT DU BIEN DES REDEVANCES AN AN DE CONTRAT\n712 VENTES DES BIENS ET SERVICES PRODUITS MOIS DU CONTRAT REDEVANCES\n• Ventes de biens au Maroc 4.415.733.831,81 4.691.266.817,64 1 2 3 4 5 6 7 8 9 10 11\n• Ventes de biens à l'étranger 201.803.404,83 52.701.055,57\n• Ventes de services au Maroc 33.128.698,90 19.773.978,40 NEANT\n• Ventes de services à l'étranger 0,00 0,00\nTOTAL - - - - - - - - - -\n• Redevances pour brevets, marques, droits... 0,00 0,00\n• Reste du poste des ventes et services produits 235.879.957,72 68.243.654,94\nTOTAL 4.886.545.893,26 4.831.985.506,55\nTABLEAU DES AMORTISSEMENTS\n713 VARIATION DES STOCKS DE PRODUITS 10 565 642,41 9 827 524,66\n• Variation des stocks de biens produits -491.885.607,25 -565.095.601,02\nTABLEAU DES AMORTISSEMENTS Exercice du : 01/01/2023 au 31/12/2023\n• Variation des stocks des services produits -3.781.081,37 -8.084.546,69\n• Variation des stocks des produits en cours 385.539.865,38 791.396.101,21 CUMUL AMORTISSEMENTS CUMUL\nDOTATION DE\nTOTAL -110.126.823,24 218.215.953,50 D’AMORTISSEMENT S/IMMOBILISATIONS D’AMORTISSMENT\nNATURE L’EXERCICE\n718 AUTRES PRODUITS D’EXPLOITATION 10 565 642,41 DÉBUT EXERCICE (2) SORTIES FIN EXERCICE\n(1) (3) (4) =1+2-3»\n• Jetons de présence reçus - -\n• Reste du poste (produits divers) - - IMMOBILISATIONS EN NON-VALEURS 0,00 0,00 0,00 0,00\nTOTAL - -\n• Frais préliminaires 0,00 0,00 - 0,00\n719 REPRISES D’EXPLOITATION; TRANSFERTS DE CHARGES 10 565 642,41\n• Charges à répartir sur plusieurs exercices 0,00 0,00 0,00 0,00\n• Reprises d'exploitation 85.465.810,36 98.628.986,43\n• Primes de remboursement des obligations 0,00 0,00 - 0,00\n• Transferts de charges 31.107.088,38 9.762.303,27\nTOTAL 116.572.898,74 108.391.289,70 IMMOBILISATIONS INCORPORELLES 34.033.387,24 1.531.649,50 0,00 48.084.865,28\nPRODUITS FINANCIERS • Immobilisation en recherche et développement 0,00 0,00 - 0,00\n738 INTÉRÊTS ET AUTRES PRODUITS FINANCIERS 10 565 642,41 9 827 524,66 • Brevets, marques, droits et valeurs similaires 46.553.215,78 1.531.649,50 - 48.084.865,28\n• Intérêts et produits assimilés 10.405.947,86 28.382.805,33\n• Fonds commercial 0,00 0,00 - 0,00\n• Revenus des créances rattachées à des participations - -\n• Autres Immobilisations incorporelles 0,00 0,00 - 0,00\n• Produits nets sur cessions de titres et valeurs de placement 10.405.947,86 10.777.535,81\nIMMOBILISATIONS CORPORELLES 2.779.703.816,63 100.426.091,44 4.548.668,55 3.853.304.430,99\n• Reste du poste intérêts et autres produits financiers 0,00 17.605.269,52\n• Terrains 0,00 0,00 0,00\nTOTAL 20.811.895,72 56.765.610,66\n• Constructions 469.785.137,08 23.296.246,22 0,00 493.081.383,30\n• Installations techniques, matériel et outillage 3.211.725.952,68 75.429.791,53 36.592,16 3.287.119.152,05\n• Matériel de transport 37.732.300,16 459.582,32 4.512.076,39 33.679.806,09\n• Mobilier, matériel de bureau et aménagements 34.017.550,37 1.240.471,37 0,00 35.258.021,74\n• Autres immobilisations corporelles 4.166.067,81 0,00 0,00 4.166.067,81\n• Immobilisations corporelles en cours 0,00 - - 0,00\nTABLEAU DES PROVISIONS TABLEAU DES TITRES DE PARTICIPATION\nTABLEAU DES PROVISIONS Exercice du : 01/01/2023 au 31/12/2023 TABLEAU DES TITRES DE PARTICIPATION EXERCICE DU 01/01/2023 AU 31/12/2023\nDOTATIONS REPRISES EXTRAIT DES DERNIERS ÉTATS\nMONTANT MONTANT PRODUITS\nNATURE DÉBUT NON NON FIN RAISON SECTEUR CAPITAL PARTICIPATION PRIX VALEUR DE SYNTHÈSE DE LA SOCIÉTÉ ÉMETTRICE INSCRITS AU\nEXERCICE D'EXPLOITATION FINANCIÈRES COURANTES D'EXPLOITATION FINANCIÈRES COURANTES EXERCICE SOCIALE N° IF D’ACTIVITÉ SOCIAL AU CAPITAL D’ACQUISITION COMPTABLE DATE DE CLÔ- SITUATION C.P.C. DE\nDE LA SOCIÉTÉ EN % GLOBAL NETTE RÉSULTAT NET\nTURE NETTE L’EXERCICE\nÉMETTRICE\nIMMOBILISATIONS EN NON VALEURS\n1 2 3 4 5 6 7 8 9\n1. Provisions pour dépréciation de LONGOMETAL\n7.491.626,49 - - - - - - 7.491.626,49 1087941 INDUSTRIE 60.346.000,00 96,93% 58.494.100,00 58.494.100,00 31/12/2023 72.516.955,37 7.706.679,92\nl’actif immobilisé ARMATURE\n2. Provisions réglementées - - - - - - - - TOTAL 60.346.000,00 58.494.100,00 58.494.100,00 72.516.955,37 7.706.679,92\n3. Provisions durables pour risques\n57.220.585,85 - - - - - - 57.220.585,85\net charges\nDETAIL DE LA TAXE SUR LA VALEUR AJOUTEE\nSOUS TOTAL (A) 64.712.212,34 0,00 0,00 0,00 0,00 0,00 0,00 64.712.212,34\n4. Provisions pour dépréciation de DETAIL DE LA TAXE SUR LA VALEUR AJOUTEE Exercice du : 01/01/2023 au 31/12/2023\n322.481.898,04 75.096.016,66 - 0,00 85.465.810,36 - - 312.112.104,34\nl’actif circulant (hors trésorerie) OPÉRATIONS DÉCLARATIONS\nSOLDE AU DÉBUT SOLDE FIN\nCOMPTABLES T.V.A.\n5. Autres provisions pour risques et 36.672.714,00 - 1.857.963,97 0,00 - 10.271.673,00 0,00 28.259.004,97 NATURE DE L’EXERCICE DE L’EXERCICE DE L’EXERCICE D’EXERCICE\ncharges 1 (1+2–3) = 4\n2 3\n6. Provisions pour dépréciation des\n0,00 - 0,00 - - 0,00 - 0,00 A - T.V.A. FACTURÉE 188.229.326,23 935.910.939,40 856.798.856,42 267.341.409,21\ncomptes de trésorerie\nB- T.V.A. RÉCUPÉRABLE 36.193.793,28 756.957.532,29 707.983.655,52 85.167.670,05\nSOUS TOTAL (B) 359.154.612,04 75.096.016,66 1.857.963,97 0,00 85.465.810,36 10.271.673,00 0,00 340.371.109,31\n• Crédit antérieur 0,00 - - 0,00\nTOTAL (A+B) 423.866.824,38 75.096.016,66 1.857.963,97 0,00 85.465.810,36 10.271.673,00 0,00 405.083.321,65\n• sur charges 34.962.703,55 750.283.393,02 702.059.894,54 83.186.202,03\n• sur immobilisations 1.231.089,73 6.674.139,27 5.923.760,98 1.981.468,02\nTABLEAU DES PLUS OU MOINS VALUES SUR CESSIONS C - T.V.A. DUE OU CRÉDIT DE T.V.A. = (A-B) 152.035.532,95 - - 182.173.739,16\nRETRAITS D’IMMOBILISATION\nTABLEAU DES PLUS OU MOINS VALUES SUR CESSIONS RETRAITS D’IMMOBILISATION Exercice du : 01/01/2023 au 31/12/2023\nAMORTISSE- VALEUR NETTE\nCOMPTE MONTANT PRODUIT DE\nDATE DE CESSION OU DE RETRAIT MENTS D’AMORTISSE- PLUS-VALUES MOINS-VALUES\nPRINCIPAL BRUT CESSION\nCUMULÉS MENTS\nImmobilisations Incorporelles 22+ 0,00 0,00 0,00 0,00 0,00 0,00\n- - - 0,00 - - -\n- - - 0,00 - - -\nNEANT\n- - - 0,00 - - -\n- - - 0,00 - - -\nImmobilisations Corporelles 23+ 4.548.668,55 4.548.668,55 0,00 475.000,00 475.000,00 0,00\n30/06/2023 233 4.548.668,55 4.548.668,55 0,00 475.000,00 475.000,00 -\n- - - - - - -\n- - - - - - -\n- - - - - - -\nImmobilisations Financières 24+ & 25+ 0,00 0,00 0,00 0,00 0,00 0,00\n- - - 0,00 - - -\nNEANT\n0,00\n0,00\n0,00\nTOTAL 0,00 0,00 0,00 0,00 0,00 0,00 0,00\nETAT DE REPARTITION DU CAPITAL SOCIAL ETAT D’AFFECTATION DES RESULTATS INTERVENUE AU COURS\nETAT DE REPARTITION DU CAPITAL SOCIAL - MONTANT DU CAPITAL : 390 000 000DH Au : 31/12/2023 DE L’EXERCICE\nNOMBRE DE TITRES VALEUR MONTANT DU CAPITAL\nETAT D’AFFECTATION DES RESULTATS INTERVENUE AU COURS DE L’EXERCICE Au : 31/12/2023\nNom, prénom ou NOMINALE DE\nraison sociale des ADRESSE CHAQUE ACTION A. ORIGINE DES RÉSULTATS A AFFECTER\nEXERCICE EXERCICE MONTANT B. AFFECTATION DES RESULTATS MONTANT\nprincipaux associés 2 PRÉCÉDENT ACTUEL OU PART SOUSCRIT APPELÉ LIBÉRÉ Décision AGO du 08 juin 2021\n1 3 4 SOCIALE 6 7 8 • Report à nouveau - • Réserve légale -\n5\n• Résultats nets en instance d'affectation 2.245.237,09 • Reserve spéciale pour investissement -\nNOUVELLES SIDERURGIE\n60, Rue d'Alger Casablanca 2.529.346 2.529.346 100,00 252.934.600,00 252.934.600,00 252.934.600,00\nINDUSTRIELLE • Résultat net de l’exercice 2013 0,00 • Tantièmes -\nM GUY MOTAIS de NARBONNE SONASID TWIN CENTER, Tour A, 18éme étage Casablanca 1 1 100,00 100,00 100,00 100,00 • Dividendes (affectés après distribution\n• Prélèvements sur les réserves 120.600.011,79 117.000.000,00\nà l’augmentation du Capital social)\nMr. ARROUB MOHAMED\nSONASID TWIN CENTER, Tour A, 18éme étage Casablanca 1 1 100,00 100,00 100,00 100,00\nRAMSES • Autres prélèvements - • Autres affectations (en instance d’affectation) 0,00\nM. Hassan BOUHEMOU SONASID TWIN CENTER, Tour A, 18éme étage Casablanca 1 1 100,00 100,00 100,00 100,00 • Report à nouveau 5.845.248,88\nM. Jean Claude Gerardy SONASID TWIN CENTER, Tour A, 18éme étage Casablanca 1 1 100,00 100,00 100,00 100,00 TOTAL A 122.845.248,88 TOTAL B 122.845.248,88\nM. Richard COMFORT SONASID TWIN CENTER, Tour A, 18éme étage Casablanca 1 1 100,00 100,00 100,00 100,00\nTOTAL A = TOTAL B\nM. Berold COSTA de BEAU-\nSONASID TWIN CENTER, Tour A, 18éme étage Casablanca 1 1 100,00 100,00 100,00 100,00\nREGARD\nTABLEAU DES OPÉRATIONS EN DEVISES COMPTABILISÉES PENDANT\nMr. LEFEVRE FRANCIS SONASID TWIN CENTER, Tour A, 18éme étage Casablanca 1 1 100,00 100,00 100,00 100,00\nMr. GENEST PASCAL SONASID TWIN CENTER, Tour A, 18éme étage Casablanca 1 1 100,00 100,00 100,00 100,00 L’EXERCICE\nM. Abdelouahab BEN SARI SONASID TWIN CENTER, Tour A, 18éme étage Casablanca 1 1 100,00 100,00 100,00 100,00\nMr TAZI MOHAMED HAKIM SONASID TWIN CENTER, Tour A, 18éme étage Casablanca 1 1 100,00 100,00 100,00 100,00 TABLEAU DES OPÉRATIONS EN DEVISES COMPTABILISÉES PENDANT L’EXERCICE Au : 31/12/2023\nMr,OURIAGLI HASSAN SONASID TWIN CENTER, Tour A, 18éme étage Casablanca 1 1 100,00 100,00 100,00 100,00 ENTRÉE CONTRE-VALEUR SORTIE CONTRE-VALEUR\nNATURE\nEN DH EN DH\nMr CEDRIC BOUZAR SONASID TWIN CENTER, Tour A, 18éme étage Casablanca 1 1 100,00 100,00 100,00 100,00\n• Financement permanent - -\nM,HUGUES FAUVILLE SONASID TWIN CENTER, Tour A, 18éme étage Casablanca 1 1 100,00 100,00 100,00 100,00\n• Immobilisations brutes - 107.423.687,57\nM,CHOLET VINCENT SONASID TWIN CENTER, Tour A, 18éme étage Casablanca 1 1 100,00 100,00 100,00 100,00\n• Rentrées sur immobilisations - -\nORDINI JEAN-PAUL SONASID TWIN CENTER, Tour A, 18éme étage Casablanca 1 0 100,00 0,00 0,00 0,00\n• Remboursement des dettes de financement - -\nM. SAID EL HADI SONASID TWIN CENTER, Tour A, 18éme étage Casablanca 0 1 100,00 100,00 100,00 100,00\n• Produits 215.520.388,69 -\nM. Rachid Benyakhlef SONASID TWIN CENTER, Tour A, 18éme étage Casablanca 1 1 100,00 100,00 100,00 100,00\n• Charges - 2.833.277.405,55\nCIMR 83, Av de l'Armée Royale CASABLANCA 1 1 100,00 100,00 100,00 100,00\nTOTAL DES ENTREES 215.520.388,69 -\nRMA WATANYA 16, Rue Abou Inane, Rabat 1 1 100,00 100,00 100,00 100,00\nTOTAL DES SORTIES - 2.940.701.093,12\nMCMA SONASID TWIN CENTER, Tour A, 18éme étage Casablanca 1 1 100,00 100,00 100,00 100,00 BALANCE DEVISES 2.725.180.704,43 -\nTAUD AYMAN SONASID TWIN CENTER, Tour A, 18éme étage Casablanca 1 1 100,00 100,00 100,00 100,00 TOTAL 2.940.701.093,12 2.940.701.093,12\nBOCK ANDRE MARIE\n2, Bd Moulay Youssef CASABLANCA 1 1 100,00 100,00 100,00 100,00\nFREDERIC\nATTIJARI WAFABANK SONASID TWIN CENTER, Tour A, 18éme étage Casablanca 1 1 100,00 100,00 100,00 100,00\nMme. LOULIDI FARAH SONASID TWIN CENTER, Tour A, 18éme étage Casablanca 1 1 100,00 100,00 100,00 100,00\nMr. LE GOUIC VINCENT SONASID TWIN CENTER, Tour A, 18éme étage Casablanca 1 1 100,00 100,00 100,00 100,00\nMr. SERRA CALLEJO JAVIER SONASID TWIN CENTER, Tour A, 18éme étage Casablanca 1 1 100,00 100,00 100,00 100,00\nM,QUINKE CHRISTIAN SONASID TWIN CENTER, Tour A, 18éme étage Casablanca 1 1 100,00 100,00 100,00 100,00\nSANAA BAKKAL SONASID TWIN CENTER, Tour A, 18éme étage Casablanca 1 1 100,00 100,00 100,00 100,00\nMAKRAM TARIQ SONASID TWIN CENTER, Tour A, 18éme étage Casablanca 1 1 100,00 100,00 100,00 100,00\nMr. TETTEROO PAUL Bourse de Casablanca 1 1 100,00 100,00 100,00 100,00\nERIC NIEDZELA SONASID TWIN CENTER, Tour A, 18éme étage Casablanca 0 1 100,00 100,00 100,00 100,00\nActions au Porteurs Bourse de Casablanca 1.370.625 1370624 100,00 137.062.400,00 137.062.400,00 137.062.400,00\nACTIONS AU PORTEURS 0 3.900.000 3.900.000 - 390.000.000 390.000.000 390 000 000\n(1) Quand le nombre des associés est inférieur ou égal à 10, l’entreprise doit déclarer tous les participants au capital.\nDans les autres cas, il y a lieu de ne mentionner que les 10 principaux associés par ordre d’importance décroissante.\nETAT DES CHANGEMENTS DE METHODES TABLEAU DE FINANCEMENT DE L’EXERCICE (MODÈLE NORMAL)\nETAT DES CHANGEMENTS DE METHODES Au : 31/12/2023 TABLEAU DE FINANCEMENT DE L’EXERCICE (modèle normal) Exercice du : 01/01/2023 au 31/12/2023\nINFLUENCE SUR LE PATRIMOINE, I. SYNTHESE DES MASSES DU BILAN\nJUSTIFICATION DU\nNATURE DES CHANGEMENTS LA SITUATION FINANCIERE ET Variations a - b\nCHANGEMENT\nLES RESULTATS. MASSES Exercice Exercice précédent Emplois Ressources\nI. Changements affectant les méthodes d’évaluation NEANT NEANT c d\nII. Changements affectant les règles de présentation NEANT NEANT 1 Financement Permanent 1.418.421.820,93 1.456.324.211,55 37.902.390,62 0,00\n2 Moins actif immobilisé 715.631.827,25 613.048.991,61 102.582.835,64 0,00\n3 = FONDS DE ROULEMENT FONCTIONNEL (1-2) (A) 702.789.993,68 843.275.219,94 140.485.226,26 0,00\n4 Actif circulant 2.892.296.781,15 2.927.292.694,30 0,00 34.995.913,15\nETAT DES DEROGATIONS\n5 Moins Passif circulant 2.465.523.837,17 2.115.281.089,73 0,00 350.242.747,44\n6 = BESOIN DE FINANCEMENT GLOBAL (4-5) (B) 426.772.943,98 812.011.604,57 0,00 385.238.660,59\nETAT DES DEROGATIONS Au : 31/12/2023\n7 TRESORERIE NETTE (ACTIF - PASSIF) = A - B 276.017.049,70 31.263.615,37 244.753.434,33 0,00\nINFLUENCE DES DEROGATIONS SUR\nJUSTIFICATION DES\nINDICATION DES DEROGATIONS LE PATRIMOINE, LA SITUATION\nDEROGATIONS\nFINANCIERE ET LES RESULTATS. II. EMPLOIS ET RESSOURCES\nI. Dérogations aux principes comptables fondamentaux NEANT NEANT EXERCICE EXERCICE PRECEDENT\nII. Dérogations aux méthodes d’évaluation NEANT NEANT EMPLOIS RESSOURCES EMPLOIS RESSOURCES\nIII. Dérogations aux règles d’établissement et de présentation I. RESSOURCES STABLES DE L’EXERCICE (FLUX)\nNEANT NEANT\ndes états de synthèse • AUTOFINANCEMENT (A) 117.000.000,00 180.580.350,32 148.200.000,00 203.213.556,81\n• Capacité d'autofinancement 0,00 180.580.350,32 0,00 203.213.556,81\n• Distributions de bénéfices 117.000.000,00 0,00 148.200.000,00 0,00\n• CESSIONS ET REDUCTIONS D’IMMOBILISATIONS (B) 0,00 475.000,00 0,00 0,00\n• Cession d'immobilisations incorporelles 0,00 0,00 0,00 0,00\n• Cession d'immobilisations corporelles 0,00 475.000,00 0,00 0,00\n• Cession d'immobilisations financières 0,00 0,00 0,00 0,00\n• Récupération sur créances immobilisées 0,00 0,00 0,00 0,00\n• AUGMENTATION DES CAPITAUX PROPRES ET ASSIMILES (C) 0,00 0,00 0,00 0,00\n• Augmentations de capital, apports 0,00 0,00 0,00 0,00\n• Subventions d’investissement 0,00 0,00 0,00 0,00\n• AUGMENTATION DES DETTES DE FINANCEMENT (D) 0,00 0,00 0,00 0,00\n(nettes de primes de remboursement) 0,00 0,00 0,00 0,00\nTOTAL I - RESSOURCES STABLES (A+B+C+D) 0,00 64.055.350,32 0,00 55.013.556,81\nII. EMPLOIS STABLES DE L’EXERCICE (FLUX) 0 0 0 0\n• ACQUISITIONS D’IMMOBILISATIONS (E) 204.540.576,58 0,00 136.006.761,72 0,00\n• Acquisitions d'immobilisations incorporelles 0,00 0 0,00 0\n• Acquisitions d'immobilisations corporelles 204.540.576,58 0 135.992.761,72 0\n• Acquisitions d'immobilisations financières 0,00 0,00 0,00 0,00\n• Augmentations des créances immobilisées 0,00 0,00 14.000,00 0,00\n• REMBOURSEMENT DES CAPITAUX PROPRES (F) - - -\n• REMBOURSEMENT DES DETTES DE FINANCEMENT (G) 0,00 - 0,00 -\n• EMPLOIS EN NON-VALEURS (H) 0,00 - 0,00 -\nTOTAL II - EMPLOIS STABLES (E+F+G+H) 204.540.576,58 0 136.006.761,72 0\nIII. VARIATION DU BESOIN DE FINANCEMENT GLOBAL\n0,00 385.238.660,59 0,00 64.194.377,73\n(B.F.G.)\nIV. VARIATION DE LA TRESORERIE 0,00 385.238.660,59 0,00 64.194.377,73\nTOTAL GENERAL 449.294.010,91 449.294.010,91 136.006.761,72 136.006.761,72\nINDICATION DES METHODES D’EVALUATION APPLIQUEES PAR L’ENTREPRISE DETAIL DES NON-VALEURS\nDETAIL DES NON-VALEURS\nINDICATION DES METHODES D’EVALUATION APPLIQUEES PAR L’ENTREPRISE\nCOMPTE PRINCIPAL INTITULE MONTANT\nNe sont reprises ci-dessous que les méthodes propres à la Société.\n211 FRAIS PRELIMINAIRES\nI. ACTIF IMMOBILISE\nA. EVALUATION DE L’ENTREPRISE\n1. Immobilisations en non-valeurs au coût réel suivant facture ou contrat\n2. Immobilisations incorporelles au coût réel suivant facture ou contrat\n3. Immobilisations corporelles au coût réel suivant facture ou contrat\n4. Immobilisations financières au prix d'aquisition\nB. CORRECTIONS DE VALEUR\n1. Méthodes d’amortissements linéaire suivant taux d’usage généralement admis\nmatériel obsolète: suivant valeur d’usage\n2. Méthodes d’évaluation des provisions pour dépréciation titres de participation: suivant situation nette de la société concernée\n3. Méthodes de détermination des écarts de conversion - Actif Différence entre le cours historique et le cours de clôture\nII. ACTIF CIRCULANT (Hors trésorerie)\nA. EVALUATION A L’ENTREE\nMarchandises et matières premières: coût d’achat comprenant les\n1. Stocks frais d’approche et n’incluant pas les charges indirectes et les frais\nfinanciers selon la méthode du PRMP mensuel\nProduits finis:coût direct de production n’incluant pas les frais\n2. Créances financiers selon la méthode du PRMP mensuel.\ncoût réel (sur facture)\n3. Titres et valeurs de placement prix d’acquisition\nB. CORRECTIONS DE VALEUR\nstock pièces de rechange : Un inventaire Qualitatif + Une Provision statistique pour\nrotation longue du stock, en dehor des articles stratégique:\n{1 - 2} : Provision = 25% x Valeur du stock à la clôture\n{2 - 3} : Provision = 50% x Valeur du stock à la clôture\n1. Méthodes d’évaluation des provisions pour dépréciation\n{3 - 4} : Provision = 75% x Valeur du stock à la clôture\n4 et Plus: Provision = Valeur du stock à la clôture\nstock Matière et Produit Finis : Un inventaire Qualitatif\ncréances : suivant dégré d’insolvabilité au cas par cas\n2. Méthodes de détermination des écarts de conversion - Actif Différence entre le cours historique et le cours de clôture\nIII. FINANCEMENT PERMANENT\n1. Méthodes de réévaluation Néant\n2. Méthodes d’évaluation des provisions réglementées amortissement dégressif selon la réglementation fiscale\n3. Dettes de financement permanent Montant octroyé par la banque suivant contrat\n4. Méthodes d’évaluation des provisions durables pour risques et charges selon l’estimation à la fin de l’exercice des charges à payer\n5. Méthodes de détermination des écarts de conversion - Passif différence entre le cours historique et le cours de clôture\nIV. PASSIF CIRCULANT (Hors trésorerie)\ncoût réel selon facture ou contrat\n1. Dettes du passif circulant conversion des dettes en devises au cours négocié ou de clôture à la fin de\nl’exercice\n2. Méthodes d’évaluation des autres provisions pour risques et charges\n3. Méthodes de détermination des écarts de conversion - Passsif différence entre le cours historique et le cours de clôture\nV. TRESORERIE\n1. Trésorerie - Actif suivant pièces bancaires\n2. Trésorerie - Passif suivant pièces bancaires\n3. Méthodes d’évaluation des provisions pour dépréciation\nTNAEN\n2112 Frais préalables au démarrage\n2113 Frais d'augmentation du capital\n2114 Frais sur opérations de fusions, scissions et transformations\n2116 Frais de prospection\n2117 Frais de publicité\n2118 Autres frais préliminaires\n212 CHARGES A REPARTIR SUR PLUSIEURS EXERCICES\n21210000 Frais d'acquisition des immobilisations JORF\n21210000 Frais d'acquisition des Logements JORF\n21210000 Frais d'acquisition des Logements ACIERIE\n21210000 Frais d'acquisition des Logements\n21210000 Frais d'acquisition terrains\n21210000 Frais d'acquisition des Plateaux TWIN CENT\n213 CHARGES A REPARTIR SUR PLUSIEURS EXERCICES\n2130 Primes de remboursement des obligations\nTOTAL\nTABLEAU DES CREANCES\nTABLEAU DES CREANCES Au : 31/12/2023\nANALYSE PAR ECHEANCE AUTRES ANALYSES\nMONTANTS\nSUR MONTANTS SUR MONTANTS\nCREANCES TOTAL ECHUES ET NON MONTANTS PLUS D’UN AN MOINS D’UN AN L’ETAT ET LES ENTRE- REPRÉSENTÉS\nREOUVRÉE EN DEVISES\nORGANISMES PRISES LIEES PAR EFFETS\nPOUBLICS\nDE L’ACTIF IMMOBILISÉ - - - - - - - -\n• Prêts immobilisés - - - - - - - 0,00\n• Autres créances financières - - - - - - - 0,00\nDE L’ACTIF CIRCULANT 1.741.936.248,56 242.223.739,34 1.499.712.509,22 1.499.712.509,22 - - 242.223.739,34 -\n• Fournisseurs débiteurs, 11.978.117,79 - 11.978.117,79 11.978.117,79 - - - -\navances et acomptes\n• Clients et comptes rattachés 1.562.924.723,07 231.870.524,56 1.331.054.198,51 1.331.054.198,51 - - 231.870.524,56 -\n• Personnel 281.375,82 - 281.375,82 281.375,82 - - - -\n• Etat 130.577.251,05 - 130.577.251,05 130.577.251,05 - - - -\n• Comptes d'associés - - - - - - - -\n• Autres débiteurs 33.017.881,42 10.353.214,78 22.664.666,64 22.664.666,64 - - 10.353.214,78 -\n• Comptes de régularisation-Actif 3.156.899,41 - 3.156.899,41 3.156.899,41 - - - -\nTABLEAU DES DETTES\nTABLEAU DES DETTES Au : 31/12/2023\nANALYSE PAR ECHEANCE AUTRES ANALYSES\nMONTANTS MONTANTS\nMONTANTS\nDETTES TOTAL ECHUES ET NON MONTANTS EN VIS-À-VIS L’ETAT VIS-À-VIS DES\nPLUS D’UN AN MOINS D’UN AN REPRÉSENTÉS PAR\nPAYÉES DEVISES ET ORGANISMES ENTRESPRISES\nEFFETS\nPOUBLICS LIÉES\nDE FINANCEMENT\n• Prêts immobilisés - - - - - - - -\n• Autres créances financières - - - - - - - -\nDU PASSIF CIRCULANT -1.582.190.046,55 - -1.582.190.046,55 - - -90.394.390,86 -1.228.000,00 -\n• Fournisseurs et comptes rattachés -1.475.993.181,58 - -1.475.993.181,58 - - - - -\n• Clients créditeurs, avances et acomptes -9.452.205,94 - -9.452.205,94 - - - - -\n• Personnel -4.443.399,32 - -4.443.399,32 - - - - -\n• Organismes sociaux -265.631,58 - -265.631,58 - - -265.631,58 - -\n• Etat -90.128.759,28 - -90.128.759,28 - - -90.128.759,28 - -\n• Comptes d'associés -1.228.000,00 - -1.228.000,00 - - - -1.228.000,00 -\n• Autres créanciers -678.868,85 - -678.868,85 - - - - -\n• Comptes de régularisation - Passif - - - - - - - -\nRAPPORT GÉNÉRAL\nDES COMMISSAIRES\nAUX COMPTES\nSUR LES COMPTES\nSOCIAUX\nSONASID\nPage4\na\na\n29 2024\nrapport. Des evenements ou situations futurs pourraient par ailleurs amener la societe\ncesser son exploitation ;\n• Nous evaluons la presentation d'ensemble, lai structure et le contenu des etats de\nsynthese, y compris les informations fournies dans l'ETIC, et apprecions si les etats de\nsynthese representent les operations et evenements sous-jacents d'une maniere propre\ndonner une image fidele.\nNous communiquons aux responsables de la gouvernance notamment l'etendue et le calendrier\nprevus des travaux d'audit et nos constatations importantes, y compris toute deficience\nimportante du controle interne que nous aurions relevee au cours de notre audit.\nVerifications et informations specifiques\nNous avons procede egalement aux verifications specfiques prevues par la loi et nous nous\nsommes assures notamment de la sincerite et de la concordance, des informations donnees dans\nle rapport de gestion du Conseil d'administration destine aux actionnaires avec les etats de\nsynthese de la societe.\nCasablanca, le avril\nLes Commissaires aux Comptes\nDELOITTE AUDIT PwCMaroc\nSakina Bensouda Karachi Mohamed Rqibate\nAssociee Associe\nRAPPORT SPÉCIAL\nDES COMMISSAIRES\nAUX COMPTES\nPrestations ou produits livres ou fournis: Le montant comptabilise en charges en 2023\na\ns'eleve KMAD 46 130.\nSommes re�ues ou versees : En 2023, le montant decaisse au titre de cette convention est\nKMAD39695.\n2.7 Convention ecrite de don pour la fondation AL MADA\nEntites et personne concernees : AL MADA en tant qu'actionnaire detenant indirectement\nplus de 5% des actions de SONASID.\nNature et objet de la convention: Il s'agit ici d'une convention conclue le 1er janvier 2012\npar laquelle SONASID accorde des dons a la fondation AL MADA.\nPrestations ou produits livres ou fournis: Au cours de l'exercice 2023, SONASID a\na\naccorde la fondation AL MADA des dons pour un montant de KMAD 2 500.\nSommes re�ues ou versees : En 2023, le montant decaisse au titre de cette convention\na\ns'eleve KMAD 2 500.\n2.8 Convention ecrite de gestion de tresorerie avec Nouvelles Siderurgies\nIndustrielles (NSI)\nSE On Nt Ait Se Is\nD\ne t personnes concernees: Nouvelles Siderurgies Industrielles (NSI), actionnaire\nPdaegteen4a nt directement plus de 5% des actions de SONASID.\nNature et objet de la convention: Cette convention conclue le 31 mai 2006 prevoit la\na\ncentralisation des operations de tresorerie, de conseils et d'assistance dans le but d'optimiser\nla fois le recours au credit et le placement des excedents de tresorerie.\nModalites essentielles : Cette convention prevoit une remuneration du compte courant\na\nSONASID fixee un taux de rendement moyen annuel de 2,75%.\nPrestations ou produits livres ou fournis : Aucun montant n'a ete comptabilise en charge\nau titre de cette convention en 2023.\nSommes re�ues ou versees : Aucun decaissement n'a ete effectue au titre de cette convention\ncourant l'exercice 2023.\nCasablanca, le 29 avril 2024\nLes Commissaires aux Comptes\nDELOITTE AUDIT PwCMaroc\nc7\nC\n'&J �\n)7 )1\n!'\\')\n>. r•s a t;..bla �nca 21, 88 ,o\n1.-1-2•\nSakina Bensouda Korachi\nAssociee\nCOMPTES CONSOLIDÉS\nExercice du 1er janvier au 31 décembre 2023\nCOMPTE DE RÉSULTAT CONSOLIDÉ ETAT DU RÉSULTAT GLOBAL CONSOLIDÉ EN MILLIIERS DE MAD\n2023.12 2022.12\nKMAD 2023.12 2022.12 Variation\nEXERCICES DU 1ER JANVIER AU 31 DÉCEMBRE\n• Chiffre d'affaires 4.995.795 4.888.161 2%\nRÉSULTAT DE L’EXERCICE 65.251 86.147\n• Autres produits de l'activité -112.448 236.270 -148% • Autres éléments du résultat global (bruts d’impôts) - -\nProduits des activités ordinaires 4.883.347 5.124.431 -5% • Ecart de conversion des activités à l'étranger - -\n• Pertes et profits relatifs à la réévaluation des Actifs financiers disponibles à la vente - -\n• Achats -4.082.092 -4.282.473 -5%\n• Partie efficace des produits ou pertes sur instruments de couverture de flux\n• Autres charges externes -301.377 -293.456 3% - -\nde trésorerie\n• Frais de personnel -213.949 -185.364 15%\n• Variation de la réserve de réévaluation des immobilisations - -\n• Impôts et taxes -63.044 -57.704 9% • Ecarts actuariels sur les obligations des régimes à prestations définies 30.218 28.765\n• Amortissements et provisions d'exploitation -136.648 -155.687 -12% • Impôt sur le résultat sur les autres éléments du résultat global -9.490 -8.917\n• Quote Part des autres éléments du résultat global dans les entreprises associées 20.728 19.848\n• Autres produits et charges d'exploitation 30.704 13.046 135%\n• Autres éléments du résultat global nets d'impôts 20.728 19.848\nCharges d'exploitation courantes -4.766.406 -4.961.638 -4%\nRESULTAT GLOBAL TOTAL DE L›ANNEE 85.979 105.995\nRésultat d'exploitation courant 116.941 162.793 -28%\nDONT INTÉRÊTS MINORITAIRES 267 274\n• Cessions d'actifs 475 -77 -717% RÉSULTAT NET - PART DU GROUPE 85.712 105.721\n• Résultats sur instruments financiers -14.484 22.780 -164%\n• Autres produits et charges d'exploitation non courants 2.240 237 845%\nAutres produits et charges d'exploitation -11.769 22.940 -151%\nRésultat des activités opérationnelles 105.172 185.733 -43%\n• Produits d'intérêts 10.778 14.657 -26%\n• Charges d'intérêts -34.302 -12.550 173%\n• Autres produits et charges financiers 11.412 -35.933 -132%\nRésultat financier -12.112 -33.826 -64%\nRésultat avant impôts des entreprises intégrées 93.060 151.907 -39%\n• Impôts sur les bénéfices -41.891 -64.510 -35%\n• Impôts différés 14.082 -1.250 -1227%\nRésultat net des entreprises intégrées 65.251 86.147 -24%\n• Intérêts minoritaires 174 217 -20%\nRésultat net - Part du groupe 65.077 85.930 -24%\nRésultat net par action en dirhams 16,69 22,03\n- de base 16,69 22,03\n- dilué 16,69 22,03\nRésultat net par action des activités poursuivies en dirhams 16,69 22,03\n- de base 16,69 22,03\n- dilué 16,69 22,03\nETATS DE LA SITUATION FINANCIÈRE VARIATION DES CAPITAUX PROPRES CONSOLIDÉS\nActif (En KMAD) 2023.12 2022.12 Variation Primes\nPart du Participations\nd'émission, de Résultat de\n• Immobilisations incorporelles 4.419 5.667 -22% En KMAD Capital fusion Réserves l'exercice groupe dans ne donnant TOTAL\nle résultat pas le contrôle\net d'apport\n• Immobilisations corporelles 1.272.015 1.170.357 9%\n• Immobilisations en droit d'usage 99.524 102.927 -3% Situation à la clôture de l'exercice\n390.000 1.604 1.388.754 107.770 1.888.128 2.007 1.890.135\n2021.12\n• Autres actifs financiers 39.962 39.962 0%\n• Affectation du résultat de\n• Impôts différés actifs - 1.267 -100% 107.770 -107.770 - -\nl'exercice N-1\n• Autres débiteurs non courants 158.065 168.042 -6%\n• Dividendes versés -148.200 -148.200 -148.200\nActifs non-courants 1.573.985 1.488.222 6%\n• Changement de méthodes\n• Autres actifs financiers courants 9.922 24.406 -59% - -\ncomptables\n• Stocks et en-cours 975.673 1.012.111 -4% • Part du groupe dans\n85.930 85.930 274 86.204\nle résultat\n• Créances clients 1.314.860 1.007.176 31%\n• Gains et pertes actuariels 28.682 28.682 28.682\n• Autres débiteurs courants 240.600 197.083 22%\n• Trésorerie et équivalent de trésorerie 768.137 851.638 -10% • Autres mouvements -9.781 -9.781 -9.781\nActifs courants 3.309.192 3.092.414 7% Situation à la clôture de l'exercice\n390.000 1.604 1.367.225 85.930 1.844.760 2.280 1.847.040\n2022.12\nTOTAL ACTIF 4.883.177 4.580.636 7%\n• Affectation du résultat de\nPassif (En KMAD) 2023.12 2022.12 Variation 85.930 -85.930 - -\nl'exercice N-1\n• Capital 390.000 390.000 0%\n• Dividendes versés -117.000 -117.000 -117.000\n• Primes d'émission et de fusion 1.604 1.604 0%\n• Changement de méthodes\n- -\ncomptables\n• Réserves 1.357.260 1.367.225 -1%\n• Part du groupe dans le résultat 65.077 65.077 267 65.344\n• Résultats net part du groupe 65.077 85.930 -24%\n• Gains et pertes actuariels 30.125 30.125 30.125\nCapitaux propres attribuables aux actionnaires ordinaires de la société mère 1.813.941 1.844.760 -2%\n• Autres mouvements -9.490 -9.490 -9.490\n• Participations ne donnant pas le contrôle 2.547 2.280 12%\nSituation à la clôture de l'exercice\nCapitaux propres de l'ensemble consolidé 1.816.488 1.847.040 -2% 390.000 1.604 1.357.260 65.077 1.813.941 2.547 1.816.488\n2023.12\n• Provisions non courantes 59.799 59.799 0%\n• Avantages du personnel 97.196 121.185 -20%\n• Dettes financières non courantes 109.759 109.047 1%\n• Impôts différés passifs 216.158 230.727 -6%\n• Autres créditeurs non courants 17.865 20.508 -13%\nPassifs non courants 500.777 541.266 -7%\n• Provisions courantes 26.901 26.901 0%\n• Dettes financières courantes - - -\n• Dettes fournisseurs courantes 2.032.644 1.619.035 26%\n• Autres créditeurs courants 506.367 546.394 -7%\nPassifs courants 2.565.912 2.192.330 17%\nTOTAL PASSIF 3.066.689 2.733.596 12%\nTOTAL CAPITAUX PROPRES ET PASSIF 4.883.177 4.580.636 7%\nTABLEAU DE FLUX DE TRÉSORERIE CONSOLIDÉ\nKMAD 2023.12 2022.12\n• Résultat net de l'ensemble consolidé 65.251 86.147\nAJUSTEMENTS :\n• Elim. des amortissements et provisions 145.223 166.152\n• Elim. des profits / pertes de réévaluation (juste valeur) 14.484 -22.780\n• Elim. des résultats de cession et des pertes et profits de dilution -475 77\nCAPACITÉ D'AUTOFINANCEMENT APRÈS COÛT DE L'ENDETTEMENT FINANCIER NET ET\n224.483 229.596\nIMPÔT\n• Elim. de la charge (produit) d'impôt 27.809 65.760\n• Elim. du coût de l'endettement financier net 34.302 12.550\nCAPACITÉ D'AUTOFINANCEMENT AVANT COÛT DE L'ENDETTEMENT FINANCIER NET ET\n286.594 307.906\nIMPÔT\n• Incidence de la variation du BFR Impôts différés 58.604 -57.330\n• Impôts payés -41.891 -64.510\nFLUX DE TRÉSORERIE LIÉS AUX ACTIVITÉS OPÉRATIONNELLES 303.307 186.066\n• Acquisition d'immobilisations corporelles et incorporelles -236.001 -147.410\n• Variation des autres actifs financiers - -15\n• Cession d'immobilisations corporelles et incorporelles 475 0\n• Intérêts financiers versés -34.302 -12.550\nFLUX DE TRÉSORERIE LIÉS AUX ACTIVITÉS D›INVESTISSEMENT -269.828 -159.975\n• Variations de dettes résultant de contrats location 712 -6.664\n• Dividendes payés aux actionnaires de la mère -117.000 -148.200\n• Variation des comptes courants associés -692 534\nFLUX DE TRÉSORERIE LIÉS AUX ACTIVITÉS DE FINANCEMENT -116.980 -154.330\n• Incidence des changements de principes comptables - -\nVARIATION DE LA TRÉSORERIE -83.501 -128.239\n• Trésorerie d'ouverture 851.638 979.877\n• Trésorerie de clôture 768.137 851.638\nVARIATION DE LA TRÉSORERIE -83.501 -128.239\nNOTES AUX\nCOMPTES\nCONSOLIDES\nSOMMAIRE\nNOTE 1. DESCRIPTION DE L’ACTIVITE\nNOTE 2. ÉVENEMENTS SIGNIFICATIFS INTERVENUS AU COURS DE L’EXERCICE\nNOTE 17. STOCKS ET EN-COURS\nNOTE 3. RÈGLES ET MÉTHODES COMPTABLES\nNOTE 18. CREANCES CLIENTS ET AUTRES DEBITEURS\nNOTE 4. EVOLUTION DU PERIMETRE DE CONSOLIDATION AU COURS DE LA PERIODE\nNOTE 19. TRESORERIE ET EQUIVALENTS DE TRESORERIE\nNOTE 5. INFORMATIONS SECTORIELLES\nNOTE 20. CAPITAUX PROPRES\nNOTE 6. CHIFFRE D’AFFAIRES\nNOTE 21. PROVISIONS\nNOTE 7. ACHATS ET AUTRES CHARGES EXTERNES\nNOTE 22. AVANTAGES DU PERSONNEL\nNOTE 8. FRAIS DE PERSONNEL ET EFFECTIFS\nNOTE 23. DETTES FINANCIERES\nNOTE 9. AMORTISSEMENTS ET PROVISIONS D’EXPLOITATION NOTE 10. AUTRES PRODUITS ET\nNOTE 24. DETTES FOURNISSEURS ET AUTRES CREDITEURS\nCHARGES D’EXPLOITATION NOTE 11. RESULTAT FINANCIER\nNOTE 25. INSTRUMENTS FINANCIERS NOTE 26. CONTRATS DE LOCATION NOTE 27. AUTRES\nNOTE 12. IMPOTS\nENGAGEMENTS NOTE 28. PASSIFS EVENTUELS\nNOTE 13. RESULTAT PAR ACTION\nNOTE 29. PARTIES LIEES\nNOTE 14. IMMOBILISATIONS INCORPORELLES\nNOTE 30. TABLEAU DES FLUX DE TRESORERIE\nNOTE 15. IMMOBILISATIONS CORPORELLES ET IMMEUBLES DE PLACEMENT\nNOTE 31. EVENEMENTS POSTERIEURS A LA CLOTURE\nNOTE 16. AUTRES ACTIFS FINANCIERS\nNOTE 32. PERIMETRE DE CONSOLIDATION AU 31 DECEMBRE 2023\nNOTE 1. DESCRIPTION DE L’ACTIVITE 3.2. Bases d’évaluation\nLe Groupe SONASID intervient dans le secteur de l’industrie sidérurgique au Maroc. Les états financiers consolidés sont présentés en millions de dirhams (MDH), arrondis au million\nPremier Acteur dans le secteur du BTP, la société Sonasid est le leader sidérurgique marocain sur les le plus proche, ils sont établis selon la convention du coût historique à l’exception de certaines\nproduits longs (rond à béton & fil machines). catégories d’actifs et passifs conformément aux principes édictés par les IFRS. Les catégories\nAvec plus de 700 collaborateurs et à travers ses sites industriels situés à Nador et à Jorf concernées sont mentionnées dans les notes suivantes.\nLasfar, Sonasid a une capacité de production annuelle de plus d’un million de tonnes destinée\nprincipalement au secteur de la construction nationale. 3.3. Utilisation d’estimations et hypothèses\nLe groupe Sonasid se positionne également sur le marché des armatures industrielles et des L’établissement des états financiers consolidés, en conformité avec les normes comptables\narmatures « bâtiment » à travers sa filiale Longométal Armatures. internationales en vigueur, a conduit le Groupe à faire des estimations et formuler des hypothèses\nayant une incidence sur les états financiers et les notes les accompagnants.\nLe Groupe procède à ces estimations et appréciations de façon continue sur la base de son\nNOTE 2. ÉVENEMENTS SIGNIFICATIFS INTERVENUS AU COURS DE L’EXERCICE\nexpérience passée ainsi que de divers autres facteurs jugés raisonnables qui constituent le\nL’année 2023 n’a pas connu d’événements significatifs en termes de variation de périmètre.\nfondement de ces appréciations.\nAfin de se conformer aux normes IFRS, une réévaluation des actifs et des passifs d’impôts différés a\nLes montants qui figurent dans ses futurs états financiers consolidés sont susceptibles de différer de\nété réalisée en utilisant les taux d’impôt prévus par la loi de finance selon le principe de symétrie.\nces estimations en fonction de l’évolution de ces hypothèses ou de conditions différentes.\nLes principales estimations significatives faites par le Groupe portent notamment sur l’évolution des\nNOTE 3. RÈGLES ET MÉTHODES COMPTABLES\nengagements envers les salariés, les goodwill, les immobilisations, les stocks, les impôts différés et\n3.1. Référentiel comptable\nles provisions.\nEn application de l’avis n°5 du Conseil National de la Comptabilité (CNC) du 26/05/2005 et\nconformément aux dispositions de l’article 6, paragraphe 6.2 de la circulaire n°06/05 du Conseil\na) Dépréciation des stocks\nDéontologique des Valeurs Mobilières (CDVM) du 13 octobre 2005, les états financiers consolidés du\nLes stocks et en-cours de production industrielle sont évalués au plus bas de leur coût de revient et\nGroupe Sonasid sont préparés en conformité avec les normes comptables internationales adoptées\nde leur valeur nette de réalisation. Le calcul de dépréciation des stocks est fondé sur une analyse\nau sein de l’Union Européenne au 31 Décembre 2023 et telles que publiées à cette même date.\ndes changements prévisibles de la demande, des technologies ou du marché afin de déterminer les\nLes normes comptables internationales comprennent les IFRS (International Financial Reporting\nstocks obsolètes ou en excès.\nStandards), les IAS (International Accounting Standards) et leurs interprétations SIC et IFRIC\nLes dépréciations sont comptabilisées parmi les charges d’exploitation courantes ou en charges de\n(Standards Interpretations Committee et International Financial Reporting Interpretations\nrestructuration, le cas échéant, suivant la nature des montants concernés.\nCommittee).\nLes stocks de pièces de rechange sont dépréciés selon la méthode du slow-moving. Cette méthode\nAinsi, les états financiers consolidés du Groupe Sonasid donnent une image fidèle de sa situation\npermet de constater une provision statistique pour rotation longue du stock basée sur la date du\nfinancière, de ses résultats et de ses flux de trésorerie pour l’exercice annuel arrêté au 31 décembre\ndernier mouvement. La provision est calculée selon les règles ci-après :\n2023 conformément aux normes comptables internationales (IAS/IFRS).\n- Articles obsolètes sont provisionnés automatiquement à 100% quelques soit leur nature\n- Articles non obsolètes sont provisionnés selon leur nature :\nLes comptes consolidés du Groupe ont été arrêtés le 13 Mars 2024 par le Conseil d’Administration.\n- Articles stratégiques : aucune provision n’est à constater\n- Articles non stratégiques : à provisionner selon la grille ci-dessous :\nLes principes et méthodes comptables du Groupe sont décrits ci-après.\n% Provision\n• Entre 1 et 2 ans 25%\n• Entre 2 et 3 ans 50%\n• Entre 3 et 4 ans 75%\n• Plus de quatre ans 100%\nb) Dépréciation des créances clients et des prêts d) Impôts différés\nConformément à IFRS 9, une dépréciation des créances clients et des prêts est comptabilisée si Les impôts différés actifs comptabilisés résultent pour l’essentiel des déficits fiscaux reportables et\nla valeur actualisée des encaissements futurs est inférieure à la valeur nominale. Le montant de des différences temporelles déductibles entre les valeurs comptables et fiscales des actifs et passifs.\nla dépréciation prend en compte la capacité du débiteur à honorer sa dette et l’ancienneté de la Les actifs relatifs au report en avant des pertes fiscales sont reconnus s’il est probable que le Groupe\ncréance. Un taux de recouvrabilité plus faible que celui estimé ou la défaillance de nos principaux disposera de bénéfices imposables futurs sur lesquels ces pertes fiscales pourront être imputées.\nclients peut avoir un impact négatif sur nos résultats futurs.\nLes estimations de bénéfices futurs sont réalisées à partir des budgets et prévisions de résultats\ncomptables, ajustés des ajustements fiscaux. Ces estimations sont réalisées sur la base\nc) Provisions\nd’hypothèses de marché qui pourraient ne pas être confirmées dans le futur.\nLe montant des provisions comptabilisé par le Groupe est basé sur la meilleure estimation de la sortie\nd’avantages économiques futurs à la date où le Groupe a comptabilisé cette obligation. Le montant\nLes actifs et passifs d’impôts différés, quel que soit leur échéance, doivent être compensés lorsqu’ils\ndes provisions est ajusté à chaque date de clôture en tenant compte de l’évolution éventuelle de\nsont prélevés par la même autorité fiscale et concernent une même entité fiscale qui dispose du\nl’estimation de la sortie d’avantages futurs attendue.\ndroit de compenser les actifs et passifs d’impôts exigibles. Ainsi, chaque entité du Groupe a procédé\nLorsque l’effet temps est significatif sur l’évaluation d’une obligation de sortie d’avantages futurs, les\nà la compensation de ces impôts différés actifs et passifs.\nprovisions sont actualisées, l’effet de désactualisation étant comptabilisé ultérieurement en charges\nfinancières.\nLa provision pour risque foncier : e) Provision pour retraite et autres avantages postérieurs à l’emploi\nProvision pour risque foncier au 31/12/2023 s’élève à 53 MMAD. Le Groupe participe à des régimes de retraites à cotisations définies. Par ailleurs, certains autres\nCette provision est calculée sur la base du risque lié aux oppositions en cours et de la révision avantages postérieurs à l’emploi tels que la couverture médicale, les indemnités de départ en retraite\npotentielle des indemnités d’expropriation sur la base des derniers jugements. et les médailles de travail font l’objet de provisions. L’ensemble de ces engagements est calculé sur\nL’évaluation du risque potentiel n’inclut pas les risques inhérents au dol. le fondement de calculs actuariels reposant sur des hypothèses telles que le taux d’actualisation, le\ntaux d’inflation médicale, les augmentations de salaires futurs, le taux de rotation du personnel et les\ntables de mortalité. Ces hypothèses sont généralement mises à jour annuellement. (cf. Note 22)\nf) Juste valeur des dérivés et des autres instruments financiers\nLa juste valeur des instruments financiers qui ne sont pas négociés sur un marché actif est\ndéterminée à l’aide des techniques d’évaluation. Le Groupe sélectionne les méthodes et retient les\nhypothèses qui lui paraissent les plus adéquates en se basant principalement sur les conditions de\nmarché existant à la date de chaque clôture. (cf. Note 25)\n3.4. Principes de consolidation 3.4.5. Date de clôture\n3.4.1. Filiales Toutes les sociétés du Groupe sont consolidées à partir de comptes annuels arrêtés au 31 Décembre\nLes sociétés dans lesquelles le Groupe exerce un contrôle exclusif de fait ou de droit sont 2023.\nconsolidées selon la méthode de l’intégration globale.\n3.5. Conversion des opérations en monnaies étrangères\nLe groupe contrôle une entité faisant l‘objet d‘un investissement si et seulement si tous les La monnaie fonctionnelle de la société Sonasid est le dirham, marocain, qui est également la\néléments ci-dessous sont réunis: monnaie de présentation des comptes consolidés du Groupe.\n(a) il détient le pouvoir sur l’entité faisant l‘objet de l’investissement ;\n(b) il est exposé ou a droit à des rendements variables en raison de ses liens avec l’entité faisant Les transactions en monnaies étrangères (c’est-à-dire dans une monnaie différente de la monnaie\nl‘objet d‘un investissement ; fonctionnelle de l’entité) sont converties au cours de change en vigueur à la date de la transaction.\n(c) il a la capacité d’exercer son pouvoir sur l’entité faisant l‘objet d‘un investissement de Les actifs et passifs libellés en devises étrangères sont évalués au cours en vigueur à la date de\nmanière à influer sur le montant des rendements qu’il obtient. Les états financiers des sociétés clôture ou au cours de la couverture qui leur est affectée le cas échéant.\ncontrôlées sont consolidés dès que le contrôle devient effectif et jusqu’à ce que ce contrôle Les différences de change correspondantes sont enregistrées au compte de résultat.\ncesse.\n3.6. Regroupements d’entreprises\nPour déterminer si une entité du groupe exerce un contrôle sur une autre, il est tenu compte Les acquisitions de filiales sont comptabilisées selon la méthode de l’acquisition. Le coût\négalement de l’existence et de l’effet des droits de vote potentiels exerçables à la date d’arrêté d’acquisition comprend, à la date de prise de contrôle les éléments suivants :\ndes comptes. Cependant, la répartition entre le pourcentage d’intérêt du groupe et les intérêts • Les éventuels instruments de capitaux propres émis par le Groupe en échange du contrôle de\nminoritaires est déterminée sur la base du pourcentage actuel d’intérêt. l’entité acquise ;\n• Les éventuels instruments de capitaux propres émis par le Groupe en échange du contrôle de\nLa quote-part de résultat net et de capitaux propres est présentée sur la ligne « intérêts minoritaires ». l’entité acquise ;\n• Les ajustements éventuels du prix d’acquisition.\n3.4.2. Participations dans les entreprises associées et coentreprises Les actifs, passifs, passifs éventuels identifiables de l’entité acquise qui répondent aux critères de\nConformément à la norme IFRS 11 « Partenariats », le contrôle est considéré comme conjoint comptabilisation énoncés par la norme IFRS 3 sont comptabilisés à la juste valeur à l’exception des\nlorsque les décisions concernant les activités pertinentes du partenariat requièrent le consentement actifs (ou groupe d’actifs), répondant aux dispositions de la norme IFRS 5 pour une qualification\nunanime du Groupe et des autres parties partageant le contrôle. Le Groupe ne dispose actuellement d’actifs non courants destinés à être cédés, alors comptabilisés et évalués à la juste valeur diminuée\npas dans son périmètre de consolidation d’entreprise associée ou de co-entreprise. des coûts nécessaires à la vente.\n3.4.3. Exclusions du périmètre de consolidation Dans le cas d’une première consolidation d’une entité, le Groupe procède dans un délai n’excédant\nConformément aux dispositions des IFRS, il n’y a pas d’exemption au périmètre de consolidation du pas un an à compter de la date d’acquisition à l’évaluation de tous les actifs, passifs et passifs\nGroupe. éventuels à leur juste valeur.\n3.4.4. Retraitements de consolidation\nToutes les transactions intragroupes, ainsi que les actifs et passifs réciproques significatifs entre\nles sociétés consolidées par intégration globale sont éliminés. Il en est de même pour les résultats\ninternes au Groupe (dividendes, plus-values...).\n3.7. Immobilisations incorporelles *F1 : constructions en dur <=R+2\nLes éléments comptabilisés en immobilisations incorporelles sont essentiellement des logiciels. F2 : constructions en dur >R+2\nF3 : Bâtiment industriel en dur (entrepôt, magasins,etc)\nLes immobilisations incorporelles sont inscrites au coût d’acquisition initial diminué du cumul des F4 : Bâtiment industriel- construction légère- structure métallique\namortissements et des éventuelles pertes de valeur. F5 : Bâtiment industriel- construction lourde- structure métallique\nF6 : Bâtiment en copropriété\nLes immobilisations incorporelles identifiables acquises dont la durée d’utilité est définie sont F7 : Aménagements extérieurs/terrains non construits.\namorties en fonction de leur propre durée d’utilité dès leur mise en service.\n• Installations techniques, matériel et outillage de 3 à 35 ans\n• Matériel de transport de 1 à 9 ans\nLes immobilisations incorporelles identifiables acquises dont la durée d’utilité est indéfinie, ne sont • Mobilier, matériel de bureau et aménagements divers de 2 à 7 ans\n• Autres immobilisations corporelles de 2 à 5 ans\npas amorties mais font l’objet, tous les ans, de tests de perte de valeur ou dès l’apparition d’indices\nsusceptibles de remettre en cause la valeur comptabilisée au bilan. Le cas échéant, une perte de Le mode d’amortissement retenu par le Groupe est le mode linéaire. L’ensemble des dispositions\nvaleur est enregistrée. concernant les immobilisations corporelles est également appliqué aux actifs corporels détenus par\nl’intermédiaire d’un contrat de location.\nLes immobilisations incorporelles dont la durée d’utilité est définie sont amorties selon le mode A chaque date de clôture, le Groupe revoit les valeurs résiduelles et les durées d’utilité des\nlinéaire, sur les périodes suivantes : immobilisations corporelles et adapte les plans d’amortissement de façon prospective en cas de\n- Logiciels : de 3 à 4 ans variation par rapport à l’exercice précédent.\n3.8. Immobilisations corporelles\nConformément à la norme IAS 16, les immobilisations corporelles sont comptabilisées au coût\nd’acquisition historique ou de fabrication initial, diminué du cumul des amortissements et, le\ncas échéant, du cumul des pertes de valeur.\nLes intérêts financiers des capitaux utilisés pour financer les investissements, pendant la\npériode précédant leur mise en exploitation, sont partis intégrante du coût historique.\nLes coûts d’entretien courants sont comptabilisés en charges de la période à l’exception de\nceux qui prolongent la durée d’utilisation ou augmentent la valeur du bien concerné qui sont\nalors immobilisés.\nLes amortissements sont généralement pratiqués en fonction des durées d’utilisation (durée\nd’utilité) suivantes :\nF 1* F 2* F 3* F 4* F 5* F 6* F 7*\n• Gros œuvres – Charpente métallique 50 ans 50 ans 50 ans 25 ans 33 ans 40 ans\n• Etanchéité, toiture et autres 10 ans 10 ans 10 ans 10 ans 10 ans\n• gencements et aménagements 15 ans 15 ans 15 ans 15 ans 15 ans 20 ans\n• Installations techniques fixes 25 ans 25 ans 25 ans 20 ans 20 ans\n• Menuiserie intérieure & extérieure 15 ans 15 ans 15 ans 15 ans 15 ans\n• Les pénalités de résiliation anticipée lorsque le Groupe est raisonnablement certain\n3.9. Contrats de location d’exercer l’option de sortie à la date de prise d’effet du contrat.\nDéfinition d’un contrat de location : Pour déterminer la valeur actuelle des paiements de loyers, le Groupe utilise son taux marginal\nUn contrat est, ou contient, un contrat de location s’il octroie le droit d’utiliser un d’endettement à la date de prise d’effet du contrat lorsque le taux implicite du contrat n’est\nactif sous-jacent pendant une période déterminée, en échange d’une contrepartie. pas aisément déterminable. Il s’agit du taux que le preneur obtiendrait pour financer un actif\nA la date de conclusion d’un contrat, le groupe Sonasid détermine s’il remplit les de valeur identique, dans un environnement économique similaire, et sur une durée et avec\ndeux conditions cumulatives suivantes pour être qualifié de contrat de location : son des garanties similaires. Ce taux est déterminé sur la base des taux d’obligations d’Etat et des\nexécution dépend de l’utilisation d’un actif identifié et il confère le droit de contrôler spreads de crédit spécifiques selon la localisation de l’actif loué et la durée du contrat, ajusté\nl’utilisation de cet actif identifié. Les contrats de location sont comptabilisés au bilan d’un facteur de duration afin de tenir compte du profil des paiements de loyers.\ndu Groupe, avec constatation : La dette de loyers est comptabilisée au coût amorti, selon la méthode du taux d’intérêt\n• d’un actif représentant le droit d’utiliser l’actif sous-jacent pendant la durée du effectif. A chaque clôture, elle est augmentée des intérêts de la période et diminuée du\ncontrat, montant des paiements effectués.\n• d’une dette au titre de l’obligation de paiement des loyers. La dette de loyers est réévaluée en cas de révision des loyers variables basés sur un indice ou\nun taux, ou lorsque le Groupe modifie son appréciation du caractère raisonnablement certain\nDroits d’utilisation : de l’exercice d’une option de renouvellement ou de résiliation anticipée. Dans un tel cas, la\nLe droit d’utilisation est évalué initialement à son coût à la date de prise d’effet du valeur comptable du droit d’utilisation est ajustée pour un montant équivalent ou, si elle a déjà\ncontrat, i.e. la date à laquelle l’actif sous-jacent est mis à disposition du Groupe. Le été ramenée à zéro, l’impact est comptabilisé en compte de résultat.\ncoût d’un droit d’utilisation comprend :\n• Le montant initial de la dette de loyers Durée des contrats de location\n• Les paiements d’avance, nets le cas échéant des avantages reçus du bailleur, La durée d’un contrat de location correspond à la période non résiliable, augmentée (ou\n• Les coûts directs initiaux encourus, et réduite) des périodes couvertes par une option de renouvellement (ou de résiliation) lorsque\n• Les coûts estimés de remise en état de l’actif loué, si applicable. cette dernière est raisonnablement certaine d’être exercée. Le management exerce son\nLe Groupe sonasid amorti le droit d’utilisation sur une base linéaire sur la durée du jugement pour déterminer la durée d’un contrat de location lorsque ce dernier inclut des\ncontrat, ou sur la durée d’utilité de l’actif sous-jacent dans l’un des deux cas suivants : options de renouvellement exerçables uniquement par le Groupe. Il tient compte de tous les\n• Le contrat transfère au preneur la propriété juridique du bien loué à l’issue du facteurs pertinents qui créent une incitation économique à exercer ou non l’option, tels que\ncontrat, ou l’existence d’agencements significatifs entrepris dans les actifs immobiliers loués. Après la\n• preneur dispose d’une option d’achat de l’actif et son exercice est date de prise d’effet du contrat, le Groupe peut être amené à réviser la durée d’un contrat\nraisonnablement certain à la date de signature du contrat en cas d’évènement ou de changement de circonstance significatif sous son contrôle et qui\naffecte le caractère raisonnablement certain d’exercice (ou de non-exercice) d’une option de\nComme pour les autres actifs corporels du Groupe, le droit d’utilisation est par ailleurs renouvellement, ou de résiliation\nsoumis aux tests de dépréciation, conformément à la norme IAS 36 Dépréciation\nd’actifs. Contrats de courte durée ou portant sur des actifs de faible valeur\nLe Groupe applique l’exemption de comptabilisation au bilan des contrats de courte durée\nDette de loyers : (i.e. contrats ayant une durée inférieure ou égale à 12 mois, sans option de renouvellement, à\nLa dette de loyers est évaluée initialement pour la valeur actualisée des paiements leur date de prise d’effet) et des contrats portant sur des actifs de faible valeur (comprenant\ndus sur la durée du contrat. Ces paiements comprennent : principalement les locations d’équipements informatique). Les loyers associés sont constatés\n• Les loyers fixes (y compris ceux considérés comme fixes en substance) diminués en charge au compte de résultat de manière linéaire sur la durée du contrat.\ndes avantages à recevoir,\n3.10. Test de dépréciation et pertes de valeur des actifs La valeur recouvrable d’une UGT correspond au montant le plus élevé entre sa valeur d’utilité\nConcernant les tests de dépréciation des immobilisations incorporelles et corporelles, la norme IAS 36 (flux de trésorerie futurs actualisés) et sa juste valeur sur le marché.\n« Dépréciation d’actifs » précise que lorsque des événements ou modifications d’environnement de\nmarché indiquent un risque de dépréciation de ces immobilisations, celles-ci font l’objet d’une revue Ainsi, pour une filiale non cotée, la valeur recouvrable des UGT est déterminée à partir des\ndétaillée afin de déterminer si leur valeur nette comptable est inférieure à leur valeur recouvrable (la projections actualisées des flux de trésorerie futurs d’exploitation, sur une durée de cinq ans\nplus élevée de la valeur d’utilité et de la juste valeur (diminuée des coûts de vente) pouvant conduire à et d’une valeur terminale. Le taux d’actualisation retenu pour ces calculs et le coût moyen\nla comptabilisation d’une perte de valeur. La valeur d’utilité est estimée en calculant la valeur actuelle pondéré du capital diffèrent en fonction des UGT et des secteurs d’activités dans lesquels elles\ndes flux de trésorerie futurs. La juste valeur repose sur les informations disponibles jugées les plus interviennent.\nfiables (données de marché, transactions récentes ...).\nPour une filiale cotée, la valeur recouvrable de l’Unité Génératrice de Trésorerie (UGT) retenue\nLa fermeture planifiée de certains sites, des réductions d’effectifs complémentaires ainsi que la révision est sa capitalisation boursière à moins que celle-ci soit inférieure à la valeur nette comptable,\nà la baisse des perspectives de marché peuvent, dans certains cas, être considérées comme des auquel cas, une estimation de la valeur d’utilité est effectuée.\nindices de perte de valeur.\nApproche :\nAinsi, conformément aux dispositions de la norme IAS 36, le Groupe examine au moins une fois par an • Prise en compte de la capitalisation boursière si inférieure au montant des capitaux\nles valeurs comptables des immobilisations corporelles et incorporelles à durée d’utilité définie afin propres comme indice de perte de valeur\nd’apprécier s’il existe un quelconque indice montrant que ces actifs ont pu perdre de la valeur. Si un tel • Utilisation de la méthode DCF en se basant sur un BP validé par le Conseil d’Administration\nindice existe, la valeur recouvrable de l’actif est estimée afin de déterminer, s’il y a lieu, le montant de la sur un horizon de 5 ans pour évaluer la valeur recouvrable des UGT.\nperte de valeur. pour évaluer la valeur d’utilisation des actifs\n• Sonasid est considérée comme une Unité Génératrice de trésorerie (interdépendance\nLes immobilisations incorporelles à durée d’utilité indéfinie font l’objet d’un test de dépréciation entre les usines)\nannuel, qu’il y’ait ou non un indice de perte de valeur . Un test de dépréciation complémentaire\nestréalisé à chaque fois qu’un indice de perte de valeur a pu être identifié.\nLe Groupe a déterminé que le plus petit niveau auquel les actifs pouvaient être testés pour perte de\nvaleur était distinctement Sonasid et Longométal.\nLorsque la valeur recouvrable d’une UGT est inférieure à sa valeur comptable, une perte de valeur\nest alors comptabilisée en résultat. Cette perte de valeur est affectée en premier lieu sur la valeur\nau bilan du goodwill. Le reliquat est affecté au reste des actifs inclus dans l’UGT au prorata de leur\nvaleur comptable.\n3.11. Stocks 3.12. Actifs financiers\nLes stocks et en-cours de production industrielle sont évalués au plus bas de leur coût de revient ou Conformément à l’IFRS 9, les actifs financiers doivent être classés selon les quatre catégories\nde leur valeur nette de réalisation. suivantes :\nLe coût de revient correspond au coût d’acquisition ou aux coûts de production encourus pour • Actifs financiers au coût amorti ;\namener les stocks dans l’état et à l’endroit où ils se trouvent. Ces derniers comprennent, sur la base • Actifs financiers à la juste valeur par le biais du résultat (« juste valeur par résultat ») ;\nd’un niveau normal d’activité, les charges directes et indirectes de production. Les coûts de revient • Actifs financiers à la juste valeur en contrepartie des autres éléments du résultat global\nsont généralement calculés selon la méthode du coût moyen pondéré. recyclables (« juste valeur par capitaux propres – recyclables ») ;\nLa valeur nette de réalisation des stocks correspond au prix de vente estimé dans le cours normal de • Actifs financiers à la juste valeur en contrepartie des autres éléments du résultat global non\nl’activité diminué des coûts estimés pour achever les produits et des coûts estimés nécessaires pour recyclables (« juste valeur par capitaux propres – non recyclables »).\nréaliser la vente. Le classement des actifs financiers requiert d’opérer une distinction entre instruments de dettes et\ninstruments de capitaux propres.\n3.12.1. Evaluation des créances clients et actifs financiers non courants\nLes créances clients, prêts et autres actifs financiers non courants sont considérés comme des actifs\némis par l’entreprise et sont comptabilisés selon la méthode du coût amorti.\nLes créances commerciales liées aux ventes de biens ou de services font l’objet de provisions pour\ndépréciation conformément aux dispositions de la méthode simplifiée prévues par la norme IFRS 9.\nCes créances font ainsi l’objet d’une provision pour pertes de crédit attendues à maturité dès leur\ncomptabilisation initiale sans qu’il soit procédé à une analyse de l’évolution du risque de crédit depuis\ncette comptabilisation.\nLes pertes de crédit attendues à maturité sont calculées pour l’ensemble des créances\ncommerciales (y compris celles non échues et/ou dont le risque de crédit ne s’est pas dégradé) en\nutilisant une méthode statistique, basée sur des données historiques, retraitées le cas échéant des\névènements exceptionnels passés et d’informations observables prospectives.\nCes provisions statistiques sont déterminées par classe homogène de créances commerciales, en\nfonction de la nature des activités, des produits et des clients et permettent de refléter le taux de\nperte attendue à maturité en fonction de l’ancienneté des créances commerciales. Ce taux de perte\nfait l’objet d’un suivi régulier.\n3.13. Trésorerie et équivalents de trésorerie Les taux d’impôt retenus sont ceux votés ou quasi adoptés à la date de clôture de l’exercice en\nConformément à la norme lAS 7 « Tableau des flux de trésorerie », la trésorerie et équivalents de fonction des juridictions fiscales.\ntrésorerie figurant au bilan, comprend la trésorerie (fonds de caisse et dépôts à vue) ainsi que les Le montant d’impôts différés est déterminé pour chaque entité fiscale.\néquivalents de trésorerie (placements à court terme, très liquides, qui sont facilement convertibles Les actifs d’impôts relatifs aux différences temporelles et aux reports déficitaires ne sont\nen un montant connu de trésorerie et qui sont soumis à un risque négligeable de changement de comptabilisés que dans la mesure où il est probable qu’un profit imposable futur déterminé avec\nvaleur). Les placements dans des actions cotées, les placements dont l’échéance initiale est à court suffisamment de précision sera dégagé au niveau de l’entité fiscale.\nou moyen terme sans possibilité de sortie anticipée ainsi que les comptes bancaires faisant l’objet de Les impôts exigibles et/ou différés sont comptabilisés au compte de résultat de la période sauf s’ils\nrestrictions (comptes bloqués) autres que celles liées à des réglementations propres à certains pays sont générés par une transaction ou un événement comptabilisé directement en capitaux propres.\nou secteurs a activités (contrôle des changes, etc.) sont exclus de la trésorerie et des équivalents de\ntrésorerie du tableau des flux de trésorerie. Une entité du Groupe doit compenser les actifs et passifs d’impôt exigible si, et seulement si, cette\nentité :\nLes découverts bancaires liés à des opérations de financement sont également exclus de la\ntrésorerie et des équivalents de trésorerie. (a) a un droit juridiquement exécutoire de compenser les montants comptabilisés ; et\n(b) a l’intention, soit de régler le montant net, soit de réaliser l’actif et de régler le passif\n3.14. Décomptabilisation des actifs financiers simultanément.\nUn actif financier est décomptabilisé si les droits contractuels sur les flux de trésorerie liés à cet actif\nfinancier arrivent à expiration ou si cet actif a été transféré. Une entité du Groupe doit compenser les actifs et passifs d’impôt différé si, et seulement si, cette\nentité :\n3.15. Impôts différés (a) a un droit juridiquement exécutoire de compenser les actifs et passifs d’impôt exigible; et\nLe Groupe comptabilise les impôts différés pour l’ensemble des différences temporelles existantes (b) les actifs et passifs d’impôts différés concernent des impôts sur le résultat prélevés par la\nentre les valeurs fiscales et comptables des actifs et des passifs du bilan, à l’exception de : même autorité fiscale.\na) la comptabilisation initiale du goodwill, ou ;\nb) la comptabilisation initiale d’un actif ou d’un passif dans une transaction qui : Ainsi, les soldes nets d’impôts différés sont déterminés au niveau de chaque entité fiscale.\n- n’est pas un regroupement d’entreprises; et\n- au moment de la transaction, n’affecte ni le bénéfice comptable ni le bénéfice imposable\n(perte fiscale).\n- à la date de transaction ne donne pas lieu à des montants égaux de différences temporaires\ndéductibles et imposables\n3.16. Avantages du personnel environnemental dont l’extinction devrait se traduire par une sortie de ressource, une provision\nLes engagements du Groupe au titre des régimes de couverture maladie à prestations définies et correspondant aux coûts futurs estimés est comptabilisée sans tenir compte des indemnités\ndes indemnités de fin de carrière sont déterminés, conformément à la norme IAS 19, sur la base de d’assurance éventuelles (seules les indemnités d’assurance quasi certaines sont comptabilisées à\nla méthode des unités de crédit projetées, en tenant compte des conditions économiques propres à l’actif du bilan). Lorsque le Groupe ne dispose pas d’un échéancier de reversement fiable ou lorsque\nchaque pays (essentiellement le Maroc pour le Groupe). Les engagements sont couverts par des l’effet du passage du temps est non significatif, l’évolution de ces provisions se fait sur la base des\nprovisions inscrites au bilan au fur et à mesure de l’acquisition des droits par les salariés. Les coûts non actualisés. Les autres coûts environnementaux sont comptabilisés en charges de la\nprovisions sont déterminées de la façon suivante : période où ils sont encourus..\n• la méthode actuarielle utilisée est la méthode dite des unités de crédits projetés\n(« projected unit credit method ») qui stipule que chaque période de service donne lieu à 3.18. Frais d’augmentation de capital\nconstatation d’une unité de droit à prestation et évalue séparément chacune de ces unités pour Les frais d’augmentation de capital sont imputés sur les primes d’émission, de fusion ou d’apport.\nobtenir l’obligation finale. Ces calculs intègrent des hypothèses de mortalité, de rotation du\npersonnel et de projection des salaires futurs… 3.19. Passifs financiers\n• Le groupe comptabilise immédiatement la totalité des écarts actuariels en OCI car cela est 3.19.1. Dettes financières\nrequis par la norme IAS 19. Les emprunts et autres passifs financiers porteurs d’intérêt sont évalués selon la méthode du coût\namorti en utilisant le taux d’intérêt effectif de l’emprunt. Les frais et primes d’émission viennent\nLes indemnités de départ en retraite font également l’objet d’une provision. Cette dernière est impacter la valeur à l’entrée et sont étalés sur la durée de vie de l’emprunt via le taux d’intérêt\névaluée en tenant compte de la probabilité de la présence des salariés dans le Groupe, à leur date effectif.\nde départ en retraite. Cette provision est actualisée.\nDans le cas des dettes financières issues de la comptabilisation des contrats de location la dette\n3.17. Provisions pour risques et charges financière constatée en contrepartie de l’actif droit d’utilisation est initialement comptabilisée à la\nLe Groupe comptabilise une provision dès lors qu’il existe une obligation légale ou implicite envers juste valeur du bien loué ou, si celle-ci est inférieure, à la valeur actualisée des paiements minimaux\nun tiers qui se traduira par une sortie de ressources, sans contrepartie attendue, nécessaire pour au titre de la location.\néteindre cette obligation et pouvant être estimée de façon fiable. Les montants comptabilisés en\nprovisions tiennent compte d’un échéancier de décaissements et sont actualisés lorsque l’effet du 3.19.2. Autres passifs financiers\npassage du temps est significatif. Cet effet est comptabilisé en résultat financier. Les autres passifs financiers concernent essentiellement les dettes fournisseurs et les autres\nLes provisions pour restructuration sont comptabilisées dès lors que le Groupe a établi un plan créditeurs. Ces passifs financiers sont comptabilisés au coût amorti.unité de droit à prestation et\nformalisé et détaillé dont l’annonce a été faite aux parties concernées. évalue séparément chacune de ces unités pour obtenir l’obligation finale. Ces calculs intègrent des\nLorsqu’une obligation légale, contractuelle ou implicite rend nécessaire le réaménagement de hypothèses de mortalité, de rotation du personnel et de projection des salaires futurs…\nsites, une provision pour frais de remise en état est comptabilisée en autres charges d’exploitation.\nElle est comptabilisée sur la durée d’exploitation du site en fonction du niveau de production et 3.20. Produits des activités ordinaires\nd’avancement de l’exploitation dudit site. Les produits des activités ordinaires du Groupe sont composés principalement des natures suivantes\nLes coûts engagés pour limiter ou prévenir des risques environnementaux et engendrant des de chiffre d’affaires :\navantages économiques futurs, tels que l’allongement des durées de vie des immobilisations, - ventes de marchandises ;\nl’accroissement de la capacité de production et l’amélioration du niveau de sécurité, sont - ventes de biens et services produits ;\nimmobilisés. Lorsque le Groupe estime qu’il a une obligation légale ou implicite lié à un risque - revenus locatifs.\nLes produits des activités ordinaires sont comptabilisés quand les biens ou les services promis aux 3.24. Liste des normes et interprétations :\nclients sont fournis et pour un montant de la contrepartie que le Groupe s’attend à avoir droit en Normes ou amendements applicables obligatoirement à compter\néchange de ces biens ou services. du 1er janvier 2023\nLes normes et interprétations applicables, de façon obligatoire, à compter du 1er janvier 2023 n’ont\nCe principe fondamental est présenté sous forme d’un modèle en cinq étapes : pas eu d’impact significatif sur les comptes consolidés du groupe Sonasid au 31 décembre 2023.\n- Identifier les contrats avec des clients, Elles concernent principalement :\n- Identifier les obligations de prestation prévues au contrat, • IFRS 17 « Contrats d’assurance » : cette norme établit les principes pour la comptabilisation,\n- Déterminer le prix de transaction, l’évaluation et la présentation des contrats d’assurance ;\n- Répartir le prix de transaction entre les différentes obligations de prestation prévues au • Amendement à IAS 12 « Impôts différés relatifs aux actifs et passifs résultant d’une transaction\ncontrat, et unique » : cet amendement supprime l’exemption de comptabilisation initiale des impôts différés\n- Comptabiliser les produits des activités ordinaires lorsque le Groupe a rempli (ou à mesure pour les transactions résultant des différences temporaires taxables et déductibles d’un même\nqu’elle remplit) une obligation de prestation. montant ;\n• y amendements à IAS 8 « Définition des estimations comptables » : ces amendements clarifient\nLes produits des activités ordinaires sont évalués à la juste valeur de la contrepartie reçue ou à les différences entre les méthodes comptables et les estimations comptables. Les estimations\nrecevoir. Les produits des loyers sont comptabilisés de façon linéaire sur les durées fermes des comptables sont désormais définies comme « des montants monétaires dans les états financiers\nbaux. En conséquence, les dispositions particulières et avantages définis dans les contrats de bail qui sont sujets à des incertitudes en ce qui concerne leur évaluation » ;\n(franchise, droit d’entrée…) sont étalés sur la durée ferme du bail. • amendements à IAS 12 « Réforme fiscale internationale – Modèle de règles du Pilier 2 » : ces\namendements prévoient une exemption temporaire à la constatation d’imposition différée induite\nLes remises commerciales ou rabais pour quantité sont comptabilisés en déduction du revenu à par Pilier 2.\nl’exception des actions commerciales prenant la forme d’attribution de produits gratuits qui sont\ncomptabilisés dans le coût des ventes et provisionnés conformément aux dispositions d’IAS 37 Normes et interprétations adoptées par l’IASB mais non encore applicables\n« Provisions, passifs éventuels et actifs éventuels ». au 31 décembre 2023\nLe Groupe Sonasid n’a anticipé aucune des nouvelles normes et amendements mentionnés ci-après\nLes produits des activités ordinaires relatifs à la vente de biens et d’équipements sont comptabilisés qui pourraient le concerner et dont l’application n’est pas obligatoire au 1er janvier 2023 :\nlorsqu’il existe un accord formel avec le client, que la livraison est intervenue, que le montant du • amendements à IAS 1 « Passifs non courants assortis de clauses restrictives » ;\nrevenu peut être mesuré de façon fiable et qu’il est probable que les avantages économiques • amendements à IFRS 16 « Passifs de location dans le cadre d’une cession-bail » ;\nassociés à cette transaction reviendront au Groupe. • amendements à IAS 7 et IFRS 7 « Accords de financements fournisseurs » ;\n• amendement à IAS 21 « Absence de convertibilité ».\n3.21. Autres produits de l’activité\nLes autres produits liés à l’activité incluent des produits à caractère non récurrent ou non 3.25. Evaluation à la juste valeur (IFRS 13)\ndirectement liés aux opérations décrites dans le paragraphe « chiffre d’affaires ». 3.25.1 Hiérarchie de la juste valeur\nTous les instruments financiers pour lesquels la juste valeur est comptabilisée ou mentionnée dans les\n3.22. Coût de l’endettement net présents états financiers sont classés selon la hiérarchie prévue par la norme IFRS 13.\nIl inclut les charges et produits d’intérêts sur les emprunts bancaires, les emprunts obligataires et les En effet, cette norme classe selon trois niveaux d’importance les données d’entrée des techniques\nautres dettes financières (y compris dettes sur contrat de location financement). d’évaluation utilisées pour déterminer la juste valeur :\nNiveau 1 :\nLes coûts d’emprunts qui sont directement attribuables à l’acquisition, la construction ou la Les données de ce niveau s’entendent des prix cotés sur des marchés actifs pour des actifs ou des\nproduction d’un actif sont incorporés dans le coût de cet actif. passifs identiques auxquels l’entité peut avoir accès à la date d’évaluation.\nNiveau 2 :\n3.23. Résultat par action Les données d’entrée de ce niveau 2 sont des données, autres que les prix cotés inclus dans les\nLe résultat de base par action est calculé en divisant le résultat net part du Groupe par le nombre données d’entrée de niveau 1, qui sont observables pour l’actif ou le passif, soit directement, soit\nmoyen d’actions en circulation au cours de l’exercice. Le nombre moyen d’actions en circulation de indirectement.\nla période et des exercices antérieurs présentés est calculé hors actions d’auto détention et actions Niveau 3 :\ndétenues dans le cadre de plans d’options d’achat. Les données d’entrée de ce niveau sont les données d’entrée concernant l’actif ou le passif qui sont\nA ce jour, le Groupe n’a pas émis d’instrument financier ayant un effet dilutif. Dès lors, le résultat de fondées sur des données non observables.\nbase par action est équivalent au résultat dilué par action.\n3.25.2 Techniques d’évaluation NOTE 7. ACHATS ET AUTRES CHARGES EXTERNES\nLes titres cotés sont évalués au cours de bourse de clôture, sauf lorsque ce dernier est jugé Les achats et les autres charges externes se décomposent comme suit :\nimpertinent par rapport à la valeur des titres concernés.\nEN MILLIONS DE MAD 2023 2022\nLes titres non cotés sont évalués en fonction de leur valeur recouvrable\n• Achats revendus de marchandises (98,0) (57,1)\nLes instruments dérivés sont évalués à leur valeur marché à la date de clôture. • Achats consommés de matières et fournitures (3 984,1) (4 225,4)\nACHATS (4 082,1) (4 282,5)\n• Loyers opérationnels 3,6 (2,3)\n• Entretien et réparations (5,8) (3,5)\nNOTE 4. EVOLUTION DU PERIMETRE DE CONSOLIDATION AU COURS DE L’EXERCICE\n• Rémunération de personnel extérieur à l'entreprise (11,7) (14,0)\n4.1. Cessions • Charges externes diverses (287,5) (273,6)\nAUTRES CHARGES EXTERNES (301,4) (293,5)\nLe Groupe n’a cédé aucune entité au cours de l’année 2023.\nTOTAL ACHATS ET AUTRES CHARGES EXTERNES (4 383,5) (4 575,9)\n4.2. Acquisitions\nNOTE 8. FRAIS DE PERSONNEL ET EFFECTIFS\nLe Groupe n’a pas procédé à aucune acquisition d’entités au cours de l’année 2023.\n8.1. Frais de personnel\nLes charges de personnel de l’année 2023 sont détaillées, ci-dessous, par nature de coût\nNOTE 5. INFORMATIONS SECTORIELLES\nLe Groupe Sonasid intervient principalement dans le secteur de la sidérurgie. L’activité est intégrée EN MILLIONS DE MAD 2023 2022\nverticalement et le groupe de produits commercialisés par le Groupe ne comportent pas des risques • Salaires et traitements (152,6) (133,0)\n• Autres charges sociales (55,1) (44,1)\net une rentabilité sensiblement différents.\n• Dotations nettes aux provisions pour avantages du personnel (6,2) (8,3)\nPar ailleurs, la quasi-totalité de son activité est réalisée au Maroc. TOTAL (213,9) (185,4)\nDe ce fait, aucun niveau d’information sectorielle ou par zone géographique n’a été retenu.\n8.2. Effectifs moyens\nNOTE 6. CHIFFRE D’AFFAIRES\nLes effectifs moyens des entreprises consolidées par intégration globale se ventilent comme suit :\nLes produits des activités ordinaires du Groupe Sonasid se décomposent de la manière suivante :\nEN MILLIONS DE MAD 2023 2022 2023 2022 Var %\n• Chiffre d'affaires 4 995,8 4 888,2 • Cadres 120 113 (6,2%)\n• Autres produits de l'activité -112,4 236,3 • Non cadres 598 610 (2,0%)\nTOTAL PRODUITS DES ACTIVITÉS ORDINAIRES 4 883,3 5 124,4 TOTAL 718 723 (0,7%)\nLe chiffre d’affaires se décompose globalement comme suit :\n8.3. Rémunérations des organes d’administration et de direction\nL’information relative à la rémunération des organes d’administration et de direction figure dans la\nEN MILLIONS DE MAD 2023 2022\nNote 29 relative aux parties liées.\n• Production vendue de biens et services 4 642,2 4 557,0\n• Ventes de Marchandises en l’état 353,6 331,1\nCHIFFRE D'AFFAIRES 4 995,8 4 888,2\nNOTE 9. AMORTISSEMENTS ET PROVISIONS D’EXPLOITATION 10.2. Résultats sur dérivés\nLes variations d’amortissements et de provisions ayant un impact sur le résultat d’exploitation Ce poste enregistre principalement la variation de juste valeur des dérivés de change en Trading.\ncourant pour les périodes closes les 31 Décembre 2022 et 31 Décembre 2023 se décomposent\ncomme suit :\nNOTE 11. RESULTAT FINANCIER\nEN MILLIONS DE MAD 2023 2022 Les résultats financiers au 31 Décembre 2023 et Décembre 2022 se décomposent de la façon\nAMORTISSEMENTS NETS IMPACTANT LE RÉSULTAT D'EXPLOITATION COURANT\nsuivante :\n• Immobilisations incorporelles (2,0) (2,0)\n• Immobilisations corporelles (122,6) (142,3) EN MILLIONS DE MAD 2023 2022\n• Immobilisations en droit d’usage (14,4) (13,6) PRODUITS D'INTÉRÊTS 10,8 14,7\nSOUS-TOTAL (139,0) (157,9) CHARGES D'INTÉRÊTS (34,3) (12,6)\nPROVISIONS ET PERTES DE VALEUR NETTES IMPACTANT LE RÉSULTAT D'EXPLOITATION COURANT • Reprises des pertes de valeur\n• Stocks et créances 2,3 2,2 • Gains et pertes de change 11,4 (33,9)\n• Provisions pour risques et charges • Autres charges financières (2,0)\nSOUS-TOTAL 2,3 (2,2) AUTRES PRODUITS ET CHARGES FINANCIERS 11,4 (35,9)\nTOTAL (136,6) (155,7) RÉSULTAT FINANCIER (12,1) (33,8)\nDONT AMORTISSEMENTS ET PROVISIONS DES ACTIVITÉS POURSUIVIES (136,6) (155,7)\nDONT AMORTISSEMENTS ET PROVISIONS DES ACTIVITÉS NON POURSUIVIES Le poste « produits d’intérêts » comprend essentiellement les intérêts sur les placements des\nexcédents de trésorerie.\nUne description des variations d’amortissement et de perte de valeur des immobilisations est incluse Le poste « Autres charges financières » est lié à l’impact de l’actualisation des provisions pour risques\ndans les notes 14 et 15 de ces états financiers. et charges conformément à IAS 37.\nLe détail des variations des pertes de valeur relative aux stocks et aux créances est inclus dans les NOTE 12. IMPOTS\nnotes 17 et 18 de ces états financiers. 12.1. Charge d’impôt\n12.1.1. Reconnue en compte de résultat\nLes mouvements de provisions pour risques et charges sont détaillés dans la note 21 de ces états La charge d’impôt pour les exercices clos les 31 Décembre 2023 et 2022, s’analyse comme suit :\nfinanciers.\nEN MILLIONS DE MAD 2023 2022\nCHARGE D'IMPÔT COURANT\n• Charge de l'exercice (41,9) (64,5)\nNOTE 10. AUTRES PRODUITS ET CHARGES D’EXPLOITATION\n• Ajustement de la charge d'impôt provenant d'exercices antérieurs 0,0 0,0\nLes autres produits et charges d’exploitation s’analysent de la façon suivante : (41,9) (64,5)\nCHARGES / PRODUITS D'IMPÔTS DIFFÉRÉS\nEN MILLIONS DE MAD 2023 2022\n• Variations des différences temporaires 15,2 9,1\n• Cession d'actifs 0,5 (0,1)\n• Variations des taux d'imposition (1,1) (10,4)\n• Résultats sur dérivés de change – Trading (14,5) 22,8\n• Variation des déficits fiscaux antérieurs\n• Autres produits et charges d'exploitation 30,7 13,0\n(14,1) (1,3)\n• Autres produits et charges d'exploitation non courante* 2,2 0,2\nTOTAL PRODUITS ET CHARGES D'EXPLOITATION 18,9 36,0 CHARGE / PRODUIT TOTAL D'IMPÔT (27,8) (65,8)\n*Ce poste est détaillé dans le tableau suivant\nLa charge d’impôt courant correspond aux montants payés ou restant à payer à court terme aux\nadministrations fiscales au titre de la période\n10.1. Autres produits et charges d’exploitation non courants\nEN MILLIONS DE MAD 2023 2022\n• Autres produits non courants 23,1 25,5\n• Autres charges non courantes (20,9) (25,3)\nTOTAL AUTRES PRODUITS ET CHARGES D'EXPLOITATION NON COURANTS 2,2 0,2\n12.1.2. Impôts différés comptabilisés au bilan Le résultat de base par action est de 16,69 Dirhams au 31 Décembre 2023 contre 22,03 Dirhams au\n31 Décembre 2022.\nACTIF PASSIF NET\nEN MILLIONS DE MAD 31-déc-23 31-déc-23 31-déc-23 31-déc-23 31-déc-23 31-déc-23 EXERCICES CLOS LE 31 DÉCEMBRE 2023 2022\n• Résultat net de l’exercice imputable aux actionnaires de la société-mère 65,1 85,9\nIMPÔTS DIFFÉRÉS\n• Nombre d'actions retenu pour le calcul du résultat par action 3 900 000 3 900 000\n• Provenant des différences temporaires 158,1 168,0 216,2 230,7 (58,1) (62,7)\nRÉSULTAT DE BASE PAR ACTION DES ACTIVITÉS POURSUIVIES 16,69 MAD 22,03 MAD\n• Provenant des déficits fiscaux 0,0 0,0 0,0 0,0 0,0 0,0\nRÉSULTAT DILUÉ PAR ACTION DES ACTIVITÉS POURSUIVIES 16,69 MAD 22,03 MAD\n• Provenant des crédits d'impôt\nTOTAL 158,1 168,0 216,2 230,7 (58,1) (62,7)\nNOTE 14. IMMOBILISATIONS INCORPORELLES\n12.1.3. Preuve d’impôt\nConcessions brevets\nEN MILLIONS DE MAD Logiciels Autres Total\net droits similaires\nEN MILLIONS DE MAD 2023 2022\nVALEURS BRUTES\nRÉSULTAT NET DE L'ENSEMBLE CONSOLIDÉ 65,3 86,1\n• Quote-part de résultat des sociétés mises en équivalence AU 1ER JANVIER 2022 54,8 54,8\n• Acquisitions 0,8 0,8\nRÉSULTAT NET DE L'ENSEMBLE CONSOLIDÉ (HORS S.M.E) 65,1 85,9\n• Impôt sur les bénéfices (41,9) (64,5) • Autres mouvements\nAU 31 DÉCEMBRE 2022 55,6 55,6\n• Impôts différés 14,1 (1,3)\nTOTAL CHARGE FISCALE (27,8) (65,8) AU 1ER JANVIER 2023 55,6 55,6\nRÉSULTAT DE L'ENSEMBLE CONSOLIDÉ AVANT IMPÔTS (HORS S.M.E) 93,1 151,9 • Acquisitions 0,7 0,7\n• Taux effectif d'impôt (Total charge fiscale / Résultat comptable avant impôts) (0,30) (0,43) • Autres mouvements\n• Impôt sur différences permanentes AU 31 DÉCEMBRE 2023 56,3 56,3\n• Régularisation sur IS (a)\nAMORTISSEMENTS ET PERTES DE VALEURS\n• Cotisation minimale\nAU 1ER JANVIER 2022 (47,9) (47,9)\n• Autres différences (b) 2,3 8,6\n• Amortissements (2,0) (2,0)\nCHARGE FISCALE RECALCULÉE (25,5) (47,09)\n• Autres mouvements 0,0 0,0\nTAUX D'IMPÔT LÉGAL AU MAROC (CHARGE FISCALE RECALCULÉE / RÉSULTAT COMPTABLE AVANT IMPÔTS) (0,27) (0,31)\nAU 31 DÉCEMBRE 2022 (49,9) (49,9)\nAU 1ER JANVIER 2023 (49,9) (49,9)\nNOTE 13. RESULTAT PAR ACTION\n• Amortissements (2,0) (2,0)\nLe résultat de base par action est calculé en divisant le résultat net part du Groupe par le nombre • Autres mouvements 0,0 0,0\nAU 31 DÉCEMBRE 2023 (51,9) (51,9\nmoyen d’actions en circulation au cours de l’exercice. Le nombre moyen d’actions en circulation de\nVALEURS NETTES\nla période et des exercices antérieurs présentés est calculé hors actions d’auto-détention et actions\nAU 31 DÉCEMBRE 2022 5,7 0,0 0,0 5,7\ndétenues dans le cadre de plans d’options d’achat. AU 31 DÉCEMBRE 2023 4,4 0,0 0,0 4,4\n2023 2022\nNombre moyen pondéré:\n3 900 000 3 900 000\n• d'actions ordinaires émises\n- -\n• d’actions détenues dans le cadre de plans d’options d’achat\n- -\n• d’actions d’auto détention\nNOMBRE D’ACTIONS RETENU POUR LE CALCUL DU RÉSULTAT DE BASE PAR ACTION 3 900 000 3 900 000\n• Nombre d’instruments dilutifs - -\nNOMBRE D’ACTIONS RETENU POUR LE CALCUL DU RÉSULTAT DILUÉ PAR ACTION 3 900 000 3 900 000\nA ce jour, le Groupe n’a pas émis d’instrument financier ayant un effet dilutif. Dès lors, le résultat\ndebase par action est équivalent au résultat dilué par action.\n16.1. Instruments financiers dérivés\nNOTE 15. IMMOBILISATIONS CORPORELLES\nLes instruments financiers dérivés concernent les couvertures de charge à terme qualifiés de\nMatériel Immobilisations en\nEN MILLIONS DE MAD Terrains Construction Autres Total Trading.\net outillage cours\nVALEURS BRUTES\nAU 1ER JANVIER 2022 266,2 727,6 3 641,3 46,51 59,7 4 741,4 16.2. Prêts et créances\n• Acquisitions 1,7 20,8 95,5 21,5 2,2 141,7\nLes prêts et créances se décomposent en valeur nette comme suit :\n• Cessions (14,5) (5,8) (20,3)\n• Autres mouvements 0,6 17,4 (18,0) 0\nEN MILLIONS DE MAD 31-déc-23 31-déc-22\nAU 31 DÉCEMBRE 2022 267,9 749,0 3 739,7 50,0 56,1 4 862,8\nPART NON COURANTE\nAU 1ER JANVIER 2023 267,9 749,0 3 739,7 50,0 56,1 4 862,8 • Prêts au personnel 0,0 0,0\n• Acquisitions 0,5 2,9 115,8 97,6 2,2 219,0 • Dépôts et cautionnements 40,0 40,0\n• Cessions 0,0 (4,5) (4,5)\nTOTAL 40,0 40,0\n• Autres mouvements 107,3 (108,3) 1,1 0\nAU 31 DÉCEMBRE 2023 268,4 752,0 3 962,8 39,3 54,8 5 077,2\nAMORTISSEMENTS ET PERTES DE VALEURS NOTE 17. STOCKS ET EN-COURS\nAU 1ER JANVIER 2022 (23,6) (542,6) (2 948,8) 0,0 (55,3) (3 570,3)\nLes stocks et en-cours se décomposent comme suit :\n• Amortissements (0,4) (29,4) (110,7) 0,0 (1,8) (142,3)\n• Cessions 14,4 5,8 20,3\n• Autres mouvements EN MILLIONS DE MAD 31-déc-23 31-déc-22\nAU 31 DÉCEMBRE 2022 (24,1) (572,0) (3 045,0) 0,0 (51,3) (3 692,4) • Stocks de marchandises 12,1 12,9\n• Stocks de matières et fournitures consommables 483,2 417,9\nAU 1ER JANVIER 2023 (24,1) (572,0) (3 045,0) 0,0 (51,3) (3 692,4)\n• En-cours de production 160,1 71,1\n• Amortissements (0,7) (26,6) (88,1) 0,0 (1,9) (117,4)\n• Stocks de produits finis intermédiaires 415,3 616,3\n• Cessions 4,5 4,5\nTOTAL DES STOCKS EN VALEUR BRUTE 1 070,6 1 118,2\n• Autres mouvements\nAU 31 DÉCEMBRE 2023 (24,8) (598,7) (3 133,1) 0,0 (48,7) (3 805,2) MONTANT DE LA PERTE DE VALEUR EN DÉBUT DE PÉRIODE (106,1) (118,8)\n• Perte de valeur constatée sur la période (2,6)\nVALEURS NETTES\n• Reprise de perte de valeur suite à des sorties et des cessions\nAU 31 DÉCEMBRE 2022 243,9 177,0 694,7 50,0 4,8 1 170,4\n• Reprise de perte de valeur devenue sans objet 11,1 12,4\nAU 31 DÉCEMBRE 2023 243,6 153,3 829,7 39,3 6,2 1 272,0\n• Autres mouvements\nImmeubles de placement MONTANT DE LA PERTE DE VALEUR EN FIN DE PÉRIODE (95,0) (106,1)\nLe Groupe ne dispose pas d’immeubles de placement au 31 décembre 2023. TOTAL STOCKS, NET 975,7 1 012,1\nNOTE 18. CREANCES CLIENTS ET AUTRES DEBITEURS\nNOTE 16. AUTRES ACTIFS FINANCIERS\nLa valeur brute et la valeur de réalisation des créances clients et autres débiteurs au 31 décembre\nLes autres actifs financiers du Groupe se décomposent en valeur nette comme suit :\n2023 et 31 décembre 2022 sont détaillées dans le tableau ci-dessous :\nEN MILLIONS DE MAD 31-déc-23 31-déc-22\nPART NON COURANTE EN MILLIONS DE MAD 31-déc-23 31-déc-22\n• instruments financiers dérivés 0,0 0,0 • Clients et comptes rattachés 1 649,6 1 333,1\n• Actifs financiers 0,0 0,0 • Dépréciation clients et comptes rattachés (334,7) (325,9)\n• prêts et créances 40,0 40,0 TOTAL CRÉANCES CLIENTS 1 314,9 1 007,2\n• Fournisseurs débiteurs - Avances et acomptes 19,2 34,0\nTOTAL 40,0 40,0\n• Personnel – débiteur 0,4 0,5\nPART NON COURANTE • Etat – débiteur 193,6 148,6\n• instruments financiers dérivés 9,9 24,4 • Comptes d'associés débiteurs\n• Actifs financiers 0,0 0,0 • Créances sur cession d’actifs\n• prêts et créances 0,0 0,0 • Autres débiteurs 22,7 12,4\nTOTAL 9,9 24,4 • Compte de régularisation – Actif 4,6 1,6\nTOTAL AUTRES DÉBITEURS COURANTS 240,6 197,1\nTOTAL AUTRES ACTIFS FINANCIERS 49,9 64,4\nNOTE 19. TRESORERIE ET EQUIVALENTS DE TRESORERIE 20.3. Variation des réserves Groupe\nLa trésorerie et les équivalents de trésorerie se composent de fonds de caisse, des soldes bancaires Les réserves se décomposent de la façon suivante :\nainsi que des placements à court terme en instruments monétaires. Ces placements, d’échéance\nEN MILLIONS DE DHS 31-déc-23 31-déc-22\ninférieure à douze mois, sont facilement convertibles en un montant de trésorerie connu et sont\n• Réserve légale 39,0 39,0\nsoumis à un risque négligeable de changement de valeur. • Réserve de conso Groupe\n• Autres réserves Groupe 462,3 480,3\n• Autres réserves 850,1 845,7\nEN MILLIONS DE MAD 31-déc-23 31-déc-22\n• Report à nouveau 5,8 2,2\n• Titres et valeurs de placement 480,2 809,7 RÉSERVES GROUPE 1 357,3 1 367,2\n• Banque 287,7 9,0\n• Autres comptes de trésorerie 0,2 32,9\nTOTAL 768,1 851,6 • Les autres réserves Groupe comprennent l’impact de la première adoption des normes IAS/\nIFRS. Leur variation entre 2023 et 2022 a pour origine les impacts des retraitements IFRS au 31\nDécembre 2023.\nNOTE 20. CAPITAUX PROPRES\n20.1. Politique de Gestion du capital\n• Les autres réserves comprennent les réserves réglementées et les réserves facultatives de la\nDans le cadre de la gestion de son capital, le Groupe a pour objectif de préserver sa continuité\nsociété Sonasid.\nd’exploitation, afin de servir un rendement aux actionnaires, de procurer des avantages aux autres\npartenaires et de maintenir une structure de capital optimale afin de réduire le coût du capital. Afin\n20.4. Variation des intérêts minoritaires\nde maintenir ou d’ajuster la structure du capital, le Groupe peut soit :\n- ajuster le montant des dividendes versés aux actionnaires ; EN MILLIONS DE DHS 31-déc-23 31-déc-22\n- rembourser du capital aux actionnaires ; • Intérêts minoritaires en début d’exercice 2,28 2,01\n• Dividendes versés\n- émettre de nouvelles actions ; ou\n• Autres variations\n- vendre des actifs pour réduire le montant des dettes. • Résultat de l’exercice 0,27 0,27\nINTÉRÊTS MINORITAIRES DE LA CLÔTURE 2,55 2,28\nLe Groupe utilise différents indicateurs, dont le levier financier (endettement net / capitaux propres),\nNOTE 21. PROVISIONS\nqui fournit aux investisseurs une vision de l’endettement du Groupe comparativement au total des\nLes provisions courantes et non courantes s’analysent comme suit :\ncapitaux propres. Ces fonds propres incluent notamment la réserve des variations de valeur des\ncouvertures des flux de trésorerie et la réserve de variation de valeur des actifs financiers à la juste EN MILLIONS DE MAD 31-déc-23 31-déc-22\nvaleur par le biais des autres éléments du résultat global. • Litiges 0,1 0,1\n• Autres risques 86,6 86,6\nTOTAL 86,7 86,7\n20.2. Variation des capitaux propres part du Groupe DONT:\n• Part non courante 59,8 59,8\n• Part courante 26,9 26,9\nEN MILLIONS DE DHS 31-déc-23 31-déc-22\n• Capitaux propres consolidés en début d’exercice 1 844,8 1 888,1\nLa variation de ces provisions entre 2022 et 2023 s’analyse comme suit :\n• Dividendes versés (117,0) (148,2)\n• Autres variations 20,6 18,9\nEN MILLIONS DE MAD Solde au 31 décembre 2022 Dotation de l’exercice Reprise provisions Solde au 31 décembre 2023\n• Augmentation de capital\n• Résultat net (Part du Groupe) de la période 65,1 85,9 • Litiges 0,1 0,1\nCAPITAUX PROPRES CONSOLIDÉS PART DU GROUPE 1 813,9 1 844,8 • Autres risques 86,6 86,6\nTOTAL 86,7 86,7\nDONT:\n• Part non courante 61,6 59,8\n• Part courante 28,6 26,9\nNOTE 22. AVANTAGES DU PERSONNEL BASE ACTUARIELLE\nLes engagements du Groupe SONASID ne sont pas couverts par des actifs de couverture. A. Méthode actuarielle\nLes niveaux des provisions au 31 décembre 2023 : La méthode actuarielle utilisée pour ces évaluations est la « projected unit credit method»\n(« PUC Proratée ») :\nGroupe SONASID SONASID\nL’indemnité susceptible d’être versée d’après les accords en vigueur dans l’entreprise, est estimée\nFiliale SONASID SONASID\nAvantages IDR Maladie pour chaque participant à partir de ses données personnelles projetées (ancienneté et salaire) à\n31/12/2023 31/12/2023\nl’âge de versement de la prestation.\nProvisions au 1er Janvier 2023 (8.458.503) (102.191.319)\n• Coût de service de la période (816.801) (8.294.048) Les engagements de la société envers le participant (Valeur Actuarielle des Prestations Futures ou\n• Reprises pour utilisation/Prestations payées 626.750 3.394.957\nVAP) sont alors calculés en multipliant la prestation estimée par un facteur actuariel, tenant compte :\n• Variation de périmètre 0 0\n• Business combination (seulement si significatif) 0 0 • de la probabilité de présence du participant dans l’entreprise et de survie jusqu’au versement\n• Ecart de conversion 0 0 de la prestation,\n• Ecarts actuarials 1.027.735 26.085.828\n• de l’actualisation de la prestation à la date de l’évaluation.\nProvisions au 31 décembre 2023 (7.620.819) (81.004.582)\nRésumé des principales dispositions des régimes Ces engagements globaux, calculés pour la carrière totale projetée du participant, sont ensuite\nrepartis uniformément sur chacun des exercices, passés et futurs, entraînant une attribution de droits\nA. Indemnités de Fin de Carrière auprès du régime pour le participant.\nLes salariés du Groupe SONASID perçoivent une indemnité au moment de leur départ en retraite. La part des engagements affectée aux exercices antérieurs à la date de l’évaluation (Dette\nActuarielle) correspond aux engagements de la société pour services « rendus ».\nCette indemnité est soumise aux charges sociales, et dépend de la catégorie socioprofessionnelle La part des engagements affectée à l’exercice qui suit la date de l’évaluation est appelée Coût des\ndu salarié. Les modalités de calcul en sont présentées ci-dessous : services rendus ou Coût Normal. Elle correspond à l’accroissement probable des engagements du\nfait de l’année de service supplémentaire que le participant aura effectuée à la fin de cet exercice.\nLes résultats individuels de l’évaluation sont ensuite cumulés pour obtenir les résultats globaux au\nCatégorie Socioprofessionnelle (CSP) Indemnité en MAD\nniveau de la société.\n• Personnel d’exécution 30 000\nLa durée résiduelle moyenne probable est la moyenne des durées restantes jusqu’au versement de la\n• Agent de maîtrise 35 000\n• Cadre 40 000 prestation considérée, pondérée par les probabilités de décès et de mobilité. Elle est nulle pour les\n• Cadre directeur 50 000\nretraités.\nB. Couverture de Frais de santé\nSONASID offre une couverture médicale à ses salariés et retraités par le biais de contrats\nd’assurance. Sous réserve d’être présent au moment du départ à la retraite, la couverture médicale\nest viagère pour tout le personnel du Groupe SONASID.\nLes conjoints et les ayants droit bénéficient de la couverture médicale tant que l’ouvrant droit (i.e. le\nretraité) est en vie. En cas de décès de ce dernier, ils ne sont plus couverts par le contrat.\nL’assurance couvre les frais médicaux engagés à un taux généralement compris entre 70 % et 80 %.\nPar ailleurs, le contrat d’assurance prévoit des frais de gestion à la charge de l’employeur à hauteur\nde 38 % des sommes remboursées.\nB. Hypothèses actuarielles NOTE 24. DETTES FOURNISSEURS ET AUTRES CREDITEURS\nLes dettes fournisseurs et autres créditeurs du Groupe se décomposent comme suit :\nHYPOTHESES ECONOMIQUES\nDATE D’ÉVALUATION 31.12.2023 EN MILLIONS DE MAD 31-déc-23 31-déc-22\nTAUX D’INFLATION 1,50% DETTES FOURNISSEURS NON COURANTS\nTAUX D’INFLATION MÉDICALE 4%\n• Compte de régularisation - passif - part > 1 an 17,9 20,5\nTAUX D’ACTUALISATION\nTOTAL AUTRES CRÉDITEURS NON COURANTS 17,9 20,5\n• Frais de Santé 6,40%\nTOTAL FOURNISSEURS ET AUTRES CRÉDITEURS NON COURANTS 17,9 20,5\n• Indemnités de Fin de Carrière 5,00 %\nTAUX MOYEN DE CHARGES SOCIALES 15,00 %\nEN MILLIONS DE MAD 31-déc-23 31-déc-22\nTAUX D’AUGMENTATION DES RÉMUNÉRATIONS ( BRUT D’INFLATION ) 3,50%\nFOURNISSEURS ET COMPTES RATTACHÉS 2 032,6 1 619,0\nTAUX DE REVALORISATION DES INDEMNITÉS FORFAITAIRES 1,50%\n• Clients créditeurs Avances & Acomptes 12,5 158,5\nHYPOTHESES DEMOGRAPHIQUES\n• Personnel créditeur 6,5 5,8\nMORTALITÉ TG CIMR 2012\n• Organismes sociaux 2,3 8,8\nINVALIDITÉ Non prise en compte\n• Etat créditeur 482,2 370,5\nTAUX DE MOBILITE PAR TRANCHES D’AGES\n• Comptes d'associés créditeurs 1,2 1,9\nTRANCHES D’ÂGES Cadres Non Cadres\n• Dettes s/ acquis. d'actifs\n• 29 ans et avant 20.00 % 10.00%\n• Autres créanciers 0,7 0,7\n• 30 à 34 ans 10.00 % 5.00 %\n• Compte de régularisation – passif 1,0 0,1\n• 35 à 39 ans 7.50 % 3.75%\nTOTAL AUTRES CRÉDITEURS COURANTS 506,4 546,4\n• 40 à 44 ans 5.00 % 2,50 %\n• 45 à 49 ans 2.00 % 1,00 % TOTAL FOURNISSEURS ET AUTRES CRÉDITEURS NON COURANTS 2 539,0 2 165,4\n• 50 ans et plus 0.00% 0.00%\nLe compte de régularisation-passif - part > 1 an comprend la part à plus d’un an des subventions\nIdentique à celui de la date\nTAUX D’OCCUPATION JUSQU’À LA RETRAITE d’investissements.\nd’évaluation\nAGE DE DÉPART À LA RETRAITE 60 ans\nNOTE 25. INSTRUMENTS FINANCIERS\n25.1. Juste valeur des actifs financiers\nNOTE 23. DETTES FINANCIERES En raison de leur caractère court terme, la valeur comptable des créances d’exploitation, de la\nLes dettes financières courantes et non courantes du Groupe se décomposent comme suit : trésorerie, des comptes courants de trésorerie est une estimation de leur juste valeur.\nEN MILLIONS DE MAD 31-déc-23 31-déc-22\nLa juste valeur des autres instruments financiers est déterminée par référence au prix de marché\n• Emprunts auprès des établissements de crédit 0,00 0,00\nrésultant d’échanges sur une bourse de valeurs nationales ou un marché de gré à gré.\n• Dettes de location financement 0,00 0,00\n• Dettes liées aux contrats à droit d'usage 109,0 109,0\nTOTAL DETTES FINANCIÈRES NON COURANTES 115,7 123 Lorsqu’aucun cours de marché coté n’est disponible, la juste valeur est estimée à partir d’autres\n• Emprunts obligataires 0,00 0,00\nméthodes de valorisation, telle que la valeur actualisée des flux de trésorerie. En tout état de\n• Emprunts auprès des établissements de crédit 0,00 0,00\n• Dettes de location financement 0,00 0,00 cause, l’estimation des valeurs de marché se fonde sur une certaine interprétation des informations\n• Instruments dérivés de couverture 0,00 0,00 de marché nécessaires à la valorisation. L’utilisation de différentes estimations, méthodes et\nTOTAL DETTES FINANCIÈRES COURANTES 0,00 0,00\nhypothèses peut avoir un effet important sur les montants estimés de juste valeur. Les méthodes\nTOTAL 109,0 109,0\nutilisées sont les suivantes :\nLes emprunts courants auprès des établissements de crédit concernent essentiellement les\n• Titres de participation dans des sociétés non consolidées :\ndécouverts bancaires et autres crédits de trésorerie.\n- Pour les actions de sociétés cotées, la juste valeur est déterminée sur la base du cours\nde bourse publié le jour de la clôture considérée.\n- Pour les actions de sociétés non cotées, lorsque la juste valeur ne peut être déterminée\nde façon fiable, les titres sont valorisés à la quote-part de situation nette IFRS, ou à\ndéfaut à la quote-part de la situation nette établie selon les règles marocaines. En\nl’absence d’information sur la situation nette IFRS ou Maroc Gaap, les titres sont valorisés\nà leur coût.\n• Instruments dérivés : la valeur de marché des opérations de taux, de change et de matières est Le tableau ci-après détaille la valeur comptable et la juste valeur des passifs financiers\nestimée à partir de valorisations provenant des contreparties bancaires ou de modèles financiers comptabilisés au bilan pour lesquels ces deux valeurs sont identiques :\ncommunément utilisés sur les marchés financiers, sur la base des données de marché à la date de\nEN MILLIONS DE MAD 31-déc-23 31-déc-22\nclôture de l’exercice.\n• Fournisseurs et autres créditeurs 2 556,9 2 185,9\n• Dettes financières non courantes 109,0 109,0\nLe tableau ci-après détaille la valeur comptable et la juste valeur des actifs financiers comptabilisés • Dettes financières courantes 0,0 0,0\nau bilan pour lesquels ces deux valeurs sont identiques : TOTAL 2.666,6 2.295,0\nEN MILLIONS DE MAD 31-déc-23 31-déc-22 25.3. Gestion des risques\n• Autres actifs financiers 49,9 64,4\nDe par ses activités, le Groupe est exposé au risque de change.\n• Clients et autres débiteurs 1 555,5 1 204,3\n• Trésorerie et Equivalents de trésorerie 768,1 851,6\nTOTAL 2 373,5 2 120,3\nPour réduire et gérer son exposition au risque de variation de change, le Groupe Sonasid utilise\ndes instruments financiers dérivés dans le but de couvrir les expositions budgétaires en devises\n25.2. Juste valeur des passifs financiers\nhautement probables et/ou les engagements fermes à l’importation. Comptablement, ces\nDettes fournisseurs et autres créditeurs et des emprunts à court terme apparaît comme une\ninstruments dérivés ne sont pas qualifiés de couverture.\nestimation de leur juste valeur.\nCes risques sont contrôlés par une équipe dédiée et indépendante, ayant la faculté le cas échéant\nLa juste valeur des autres instruments financiers est déterminée par référence au prix de marché\nde rapporter directement à la Direction Générale.\nrésultant d’échanges sur une bourse de valeurs nationales ou un marché de gré à gré.\nL’intégralité de ces dérivés est comptabilisée à la juste valeur au bilan.\nLorsqu’aucun cours de marché coté n’est disponible, la juste valeur est estimée à partir d’autres\nméthodes de valorisation, telle que la valeur actualisée des flux de trésorerie. En tout état de\nLa juste valeur des instruments dérivés de change se présente comme suit :\ncause, l’estimation des valeurs de marché se fonde sur une certaine interprétation des informations\nde marché nécessaires à la valorisation. L’utilisation de différentes estimations, méthodes et\nEN MILLIONS DE MAD 31-déc-23 31-déc-22\nhypothèses peut avoir un effet important sur les montants estimés de juste valeur. Les méthodes\nINSTRUMENTS DÉRIVÉS – ACTIF 9,9 24,4\nutilisées sont les suivantes : • change 9,9 24,4\n• Dettes de financement : la juste valeur des dettes de financement (emprunts obligataires,\nINSTRUMENTS DÉRIVÉS – PASSIF\ndettes auprès des établissements de crédit…) correspond à leur coût amorti (valeur nominale • change\ndiminuée des frais d’émission de l’emprunt si ces derniers représentent au moins 1% de cette\nvaleur).\nRisque de crédit et de contrepartie\n• Instruments dérivés : la valeur de marché des opérations de taux et de change est estimée\nLe Groupe est exposé au risque de crédit en cas de défaillance d’une contrepartie. Le Groupe a\nà partir de valorisations provenant des contreparties bancaires ou de modèles financiers\nmis en place des politiques visant à limiter son exposition au risque de contrepartie. Ces politiques\ncommunément utilisés sur les marchés financiers, sur la base des données de marché à la date\nreposent sur une sélection rigoureuse des contreparties en fonction de plusieurs critères (ex : actifs\nde clôture de l’exercice.\net capitaux propres, notations des agences de notation…), et selon les échéances de transaction.\nLes principales mesures prises pour le groupe concernent la limitation du risque de crédit clients.\nAinsi, dès début Janvier 2007, le Groupe a souscrit à une Assurance couvrant le Crédit Client.\nNOTE 26. CONTRATS DE LOCATION NOTE 29. PARTIES LIEES\nConformément à l’IFRS 16, les contrats de location exclus du champ d’application sont ceux dont la La rémunération des administrateurs et des membres du comité de direction incluses dans les\ndurée restante est inférieure à 12 mois ou dont la valeur est faible. Les charges locatives annuelles de charges de la période se décompose comme suit :\nces contrats se détaillent comme suit :\nEN MILLIONS DE MAD 31-déc-23 31-déc-22\nEN MILLIONS DE MAD 31-déc-23 31-déc-22 • Administrateurs 2,0 2,0\n• Membres du comité de direction 8,5 7,4\n• Charges locatives des biens hors scope < 12 mois (0,51) (0,72)\nTOTAL 10,5 9,4\n• Charges locatives des biens hors scope de faible valeur (0,12) (0,12)\n• Charges relatives aux paiements de loyers variables\n• Produits de sous-location tirés d'actifs au titre de droits d'utilisation S’ajoutant à ces rémunérations, d’autres opérations avec les parties liés :\n• Sortie de trésorerie relatives aux contrats de location\n- Assistance technique à travers des conventions réglementées\nTOTAL (0,63) (0,84)\n- Achat et vente auprès des filiales du groupe aux conditions normales du marché\nL’échéancier des paiements futurs de la dette comptabilisée sous IFRS 16 se détaille ci-dessous : NOTE 30. TABLEAU DES FLUX DE TRESORERIE\n30.1. Détail de l’incidence de la variation du BFR sur la trésorerie de l’exercice\nEN MILLIONS DE MAD 31-déc-23 31-déc-22\n• Dans 1 an 19,85 11,44\n• Entre 1 et 5 ans 48,35 26,02 EN MILLIONS DE MAD 31-déc-23 31-déc-22\n• Supérieur à 5 ans 125,91 71,59 • Variation des stocks 36,91 (370,92)\nTOTAL 194,11 109,05 • Variation des créances (349,93) (425,51)\n• Variation des dettes 371,63 739,10\nLa charge d’intérêt de l’exercice relative à la dette de location est de (6,59). VARIATION DU BFR 58,60 (57,33)\n30.2. Réconciliation de la trésorerie affichée au bilan et au TFT\nNOTE 27. AUTRES ENGAGEMENTS\nEngagements donnés EN MILLIONS DE MAD 31-déc-23 31-déc-22\n• Trésorerie et équivalents de trésorerie 768,1 851,6\nEN MILLIONS DE MAD 31-déc-23 31-déc-22 • Trésorerie Passive (Montant inclus dans les dettes courantes envers les établissements de crédit) (0,0) (0,0)\n• Avals, cautions et garanties donnés 300,1 267,5 TRÉSORERIE ET ÉQUIVALENTS DE TRÉSORERIE – BILAN 768,1 851,6\n• Dettes garanties par des actifs nantis ou hypothéqués 0 0 TRÉSORERIE ET ÉQUIVALENTS DE TRÉSORERIE – TFT 768,1 851,6\n• Autres engagements donnés 298,5 52,3\nTOTAL 598,7 319,8\nNOTE 31. EVENEMENTS POSTERIEURS A LA CLÔTURE\nAucun événement significatif n’est intervenu depuis le 31 Décembre 2023.\nEngagements reçus\nNOTE 32. PERIMETRE DE CONSOLIDATION AU 31 DECEMBRE 2023\nEN MILLIONS DE MAD 31-déc-23 31-déc-22\n• Avals, cautions et garanties reçus 248,5 299,6\n31 Décembre 2023 31 Décembre 2022\n• Nantissement et hypothèques reçus 0 0\n• Autres engagements reçus 0 0 % d’intérêt % de contrôle Méthode % d’intérêt % de contrôle Méthode\nTOTAL 248,5 299,6 • SONASID 100% 100% IG 100% 100% IG\n• LONGOMETAL ARMATURE 96,93% 96,93% IG 96,93% 96,93% IG\nNOTE 28. PASSIFS EVENTUELS\nLe Groupe a des passifs éventuels se rapportant à des garanties bancaires et autres éléments\nsurvenant dans le cadre habituel de ses activités. Le Groupe ne s’attend pas à ce que ces éléments\ndonnent lieu à des passifs significatifs.\nPar ailleurs, le Groupe a d’autres passifs éventuels liés aux lois sur l’environnement (les décrets\nd’application n’ayant pas encore été promulgués). Toutefois, ces éléments ne devraient pas amener\nle groupe à comptabiliser un passif.\nRAPPORT GÉNÉRAL\nDES COMMISSAIRES\nAUX COMPTES\nSUR LES COMPTES\nCONSOLIDÉS\nSONASID\nPage4\na\na\na\n29 2024\nSi nous concluons I' existence d'une incertitude significative, nous sommes ten us\n11.aroc\nd'attirer !'attention des lecteurs de notre rapport sur les informations fournies dans\nLot • • sa Anfa,\nles etats financiers au sujet de cette incertitude ou, si ces inform:\"'r:!.a�tio�ns� nneca sont pas\nadequates, d'exprimer une opinion modifieeT. .N+os c0o nclusions s'appuie2n 2t3 8s8u 7r0 les\nelements probants obtenus jusqu'a la date de notreC r apport. Des• e. v•3 e9 n13e5m en•t s ou\nI • 110·, ., ., -i..\nsituations futurs pourraient par ailleurs amener le groupe cesser son exploitation\nNous evaluons la presentation d'ensemble, la structure et le contenu des etats\nfinanciers consolides, y compris les informations fournies dans les notes, et\napprecions si les etats financiers consolides representent les operations et\nevenements sous-jacents d'une maniere propre donner une image fidele.\nNous obtenons des elements probants suffisants et appropries concernant les\ninformations financieres des entites et activites du groupe pour exprimer une\nopinion sur les etats financiers consolides. Nous sommes responsables de la\ndirection, de la supervision et de la realisation de l'audit du groupe. Nous assumons\nl'entiere responsabilite de !'opinion d'audit.\nNous communiquons aux responsables de la gouvernance notamment l'etendue et le calendrier\nprevus des travaux d'audit et nos constatations importantes, y compris toute deficience\nimportante du controle interne que nous aurions relevee au cours de notre audit.\nCasablanca, le avril\nLes Commissaires aux Comptes\nDELOITTE AUDIT PwCMaroc\nSakina Bensouda Karachi\nAssociee\n7;_,_ , 0 4 5\nMohamed Rqibate\nAssocie",
    "tables": [
        [],
        [],
        [
            {
                "BILAN - PASSIF (modèle normal)": "PASSIF",
                "null": "Exercice Précédent",
                "EXERCICE DU 01/01/2023 AU 31/12/2023": ""
            },
            {
                "BILAN - PASSIF (modèle normal)": "TNENAMREP\nTNEMECNANIF",
                "null": "",
                "EXERCICE DU 01/01/2023 AU 31/12/2023": ""
            },
            {
                "BILAN - PASSIF (modèle normal)": "",
                "null": "390.000.000,00",
                "EXERCICE DU 01/01/2023 AU 31/12/2023": ""
            },
            {
                "BILAN - PASSIF (modèle normal)": "",
                "null": "",
                "EXERCICE DU 01/01/2023 AU 31/12/2023": ""
            },
            {
                "BILAN - PASSIF (modèle normal)": "",
                "null": "390.000.000,00",
                "EXERCICE DU 01/01/2023 AU 31/12/2023": ""
            },
            {
                "BILAN - PASSIF (modèle normal)": "",
                "null": "1.604.062,88",
                "EXERCICE DU 01/01/2023 AU 31/12/2023": ""
            },
            {
                "BILAN - PASSIF (modèle normal)": "",
                "null": "-",
                "EXERCICE DU 01/01/2023 AU 31/12/2023": ""
            },
            {
                "BILAN - PASSIF (modèle normal)": "",
                "null": "39.000.000,00",
                "EXERCICE DU 01/01/2023 AU 31/12/2023": ""
            },
            {
                "BILAN - PASSIF (modèle normal)": "",
                "null": "845.654.313,94",
                "EXERCICE DU 01/01/2023 AU 31/12/2023": ""
            },
            {
                "BILAN - PASSIF (modèle normal)": "",
                "null": "2.245.237,09",
                "EXERCICE DU 01/01/2023 AU 31/12/2023": ""
            },
            {
                "BILAN - PASSIF (modèle normal)": "",
                "null": "-",
                "EXERCICE DU 01/01/2023 AU 31/12/2023": ""
            },
            {
                "BILAN - PASSIF (modèle normal)": "",
                "null": "120.600.011,79",
                "EXERCICE DU 01/01/2023 AU 31/12/2023": ""
            },
            {
                "BILAN - PASSIF (modèle normal)": "",
                "null": "1.399.103.625,70",
                "EXERCICE DU 01/01/2023 AU 31/12/2023": ""
            },
            {
                "BILAN - PASSIF (modèle normal)": "",
                "null": "",
                "EXERCICE DU 01/01/2023 AU 31/12/2023": ""
            },
            {
                "BILAN - PASSIF (modèle normal)": "",
                "null": "",
                "EXERCICE DU 01/01/2023 AU 31/12/2023": ""
            },
            {
                "BILAN - PASSIF (modèle normal)": "",
                "null": "-",
                "EXERCICE DU 01/01/2023 AU 31/12/2023": ""
            },
            {
                "BILAN - PASSIF (modèle normal)": "",
                "null": "-",
                "EXERCICE DU 01/01/2023 AU 31/12/2023": ""
            },
            {
                "BILAN - PASSIF (modèle normal)": "",
                "null": "-",
                "EXERCICE DU 01/01/2023 AU 31/12/2023": ""
            },
            {
                "BILAN - PASSIF (modèle normal)": "",
                "null": "-",
                "EXERCICE DU 01/01/2023 AU 31/12/2023": ""
            },
            {
                "BILAN - PASSIF (modèle normal)": "",
                "null": "-",
                "EXERCICE DU 01/01/2023 AU 31/12/2023": ""
            },
            {
                "BILAN - PASSIF (modèle normal)": "",
                "null": "-",
                "EXERCICE DU 01/01/2023 AU 31/12/2023": ""
            },
            {
                "BILAN - PASSIF (modèle normal)": "",
                "null": "",
                "EXERCICE DU 01/01/2023 AU 31/12/2023": ""
            },
            {
                "BILAN - PASSIF (modèle normal)": "",
                "null": "-",
                "EXERCICE DU 01/01/2023 AU 31/12/2023": ""
            },
            {
                "BILAN - PASSIF (modèle normal)": "",
                "null": "-",
                "EXERCICE DU 01/01/2023 AU 31/12/2023": ""
            },
            {
                "BILAN - PASSIF (modèle normal)": "",
                "null": "-",
                "EXERCICE DU 01/01/2023 AU 31/12/2023": ""
            },
            {
                "BILAN - PASSIF (modèle normal)": "",
                "null": "-",
                "EXERCICE DU 01/01/2023 AU 31/12/2023": ""
            },
            {
                "BILAN - PASSIF (modèle normal)": "",
                "null": "-",
                "EXERCICE DU 01/01/2023 AU 31/12/2023": ""
            },
            {
                "BILAN - PASSIF (modèle normal)": "",
                "null": "-",
                "EXERCICE DU 01/01/2023 AU 31/12/2023": ""
            },
            {
                "BILAN - PASSIF (modèle normal)": "",
                "null": "57.220.585,85",
                "EXERCICE DU 01/01/2023 AU 31/12/2023": ""
            },
            {
                "BILAN - PASSIF (modèle normal)": "",
                "null": "57.220.585,85",
                "EXERCICE DU 01/01/2023 AU 31/12/2023": ""
            },
            {
                "BILAN - PASSIF (modèle normal)": "",
                "null": "-",
                "EXERCICE DU 01/01/2023 AU 31/12/2023": ""
            },
            {
                "BILAN - PASSIF (modèle normal)": "",
                "null": "",
                "EXERCICE DU 01/01/2023 AU 31/12/2023": ""
            },
            {
                "BILAN - PASSIF (modèle normal)": "",
                "null": "-",
                "EXERCICE DU 01/01/2023 AU 31/12/2023": ""
            },
            {
                "BILAN - PASSIF (modèle normal)": "",
                "null": "-",
                "EXERCICE DU 01/01/2023 AU 31/12/2023": ""
            },
            {
                "BILAN - PASSIF (modèle normal)": "",
                "null": "-",
                "EXERCICE DU 01/01/2023 AU 31/12/2023": ""
            },
            {
                "BILAN - PASSIF (modèle normal)": "TNALUCRIC\nFISSAP",
                "null": "2.078.214.090,15",
                "EXERCICE DU 01/01/2023 AU 31/12/2023": ""
            },
            {
                "BILAN - PASSIF (modèle normal)": "",
                "null": "1.613.146.889,96",
                "EXERCICE DU 01/01/2023 AU 31/12/2023": ""
            },
            {
                "BILAN - PASSIF (modèle normal)": "",
                "null": "156.346.373,90",
                "EXERCICE DU 01/01/2023 AU 31/12/2023": ""
            },
            {
                "BILAN - PASSIF (modèle normal)": "",
                "null": "4.404.964,96",
                "EXERCICE DU 01/01/2023 AU 31/12/2023": ""
            },
            {
                "BILAN - PASSIF (modèle normal)": "",
                "null": "6.860.877,89",
                "EXERCICE DU 01/01/2023 AU 31/12/2023": ""
            },
            {
                "BILAN - PASSIF (modèle normal)": "",
                "null": "294.856.114,59",
                "EXERCICE DU 01/01/2023 AU 31/12/2023": ""
            },
            {
                "BILAN - PASSIF (modèle normal)": "",
                "null": "1.920.000,00",
                "EXERCICE DU 01/01/2023 AU 31/12/2023": ""
            },
            {
                "BILAN - PASSIF (modèle normal)": "",
                "null": "678.868,85",
                "EXERCICE DU 01/01/2023 AU 31/12/2023": ""
            },
            {
                "BILAN - PASSIF (modèle normal)": "",
                "null": "-",
                "EXERCICE DU 01/01/2023 AU 31/12/2023": ""
            },
            {
                "BILAN - PASSIF (modèle normal)": "",
                "null": "36.672.714,00",
                "EXERCICE DU 01/01/2023 AU 31/12/2023": ""
            },
            {
                "BILAN - PASSIF (modèle normal)": "",
                "null": "394.285,58",
                "EXERCICE DU 01/01/2023 AU 31/12/2023": ""
            },
            {
                "BILAN - PASSIF (modèle normal)": "",
                "null": "2.115.281.089,73",
                "EXERCICE DU 01/01/2023 AU 31/12/2023": ""
            },
            {
                "BILAN - PASSIF (modèle normal)": "",
                "null": "",
                "EXERCICE DU 01/01/2023 AU 31/12/2023": ""
            },
            {
                "BILAN - PASSIF (modèle normal)": "EIREROSERT",
                "null": "",
                "EXERCICE DU 01/01/2023 AU 31/12/2023": ""
            },
            {
                "BILAN - PASSIF (modèle normal)": "",
                "null": "-",
                "EXERCICE DU 01/01/2023 AU 31/12/2023": ""
            },
            {
                "BILAN - PASSIF (modèle normal)": "",
                "null": "-",
                "EXERCICE DU 01/01/2023 AU 31/12/2023": ""
            },
            {
                "BILAN - PASSIF (modèle normal)": "",
                "null": "-",
                "EXERCICE DU 01/01/2023 AU 31/12/2023": ""
            },
            {
                "BILAN - PASSIF (modèle normal)": "",
                "null": "-",
                "EXERCICE DU 01/01/2023 AU 31/12/2023": ""
            },
            {
                "BILAN - PASSIF (modèle normal)": "",
                "null": "3.571.605.301,28",
                "EXERCICE DU 01/01/2023 AU 31/12/2023": ""
            }
        ],
        [
            {
                "BILAN - ACTIF": "ACTIF",
                "null": "Exercice Précedent",
                "Au : 31/12/2023": ""
            },
            {
                "BILAN - ACTIF": "",
                "null": "Net",
                "Au : 31/12/2023": "Amort. et prov."
            },
            {
                "BILAN - ACTIF": "ESILIBOMMI\nFITCA",
                "null": "",
                "Au : 31/12/2023": "-"
            },
            {
                "BILAN - ACTIF": "",
                "null": "",
                "Au : 31/12/2023": "-"
            },
            {
                "BILAN - ACTIF": "",
                "null": "",
                "Au : 31/12/2023": "-"
            },
            {
                "BILAN - ACTIF": "",
                "null": "",
                "Au : 31/12/2023": "-"
            },
            {
                "BILAN - ACTIF": "",
                "null": "4.529.220,91",
                "Au : 31/12/2023": "55.576.491,77"
            },
            {
                "BILAN - ACTIF": "",
                "null": "",
                "Au : 31/12/2023": "-"
            },
            {
                "BILAN - ACTIF": "",
                "null": "4.529.220,91",
                "Au : 31/12/2023": "48.084.865,28"
            },
            {
                "BILAN - ACTIF": "",
                "null": "",
                "Au : 31/12/2023": "7.491.626,49"
            },
            {
                "BILAN - ACTIF": "",
                "null": "",
                "Au : 31/12/2023": "-"
            },
            {
                "BILAN - ACTIF": "",
                "null": "510.144.453,89",
                "Au : 31/12/2023": "3.853.304.430,99"
            },
            {
                "BILAN - ACTIF": "",
                "null": "104.798.703,64",
                "Au : 31/12/2023": "-"
            },
            {
                "BILAN - ACTIF": "",
                "null": "79.546.973,44",
                "Au : 31/12/2023": "493.081.383,30"
            },
            {
                "BILAN - ACTIF": "",
                "null": "275.448.744,46",
                "Au : 31/12/2023": "3.287.119.152,05"
            },
            {
                "BILAN - ACTIF": "",
                "null": "1.239.058,01",
                "Au : 31/12/2023": "33.679.806,09"
            },
            {
                "BILAN - ACTIF": "",
                "null": "2.755.681,80",
                "Au : 31/12/2023": "35.258.021,74"
            },
            {
                "BILAN - ACTIF": "",
                "null": "",
                "Au : 31/12/2023": "4.166.067,81"
            },
            {
                "BILAN - ACTIF": "",
                "null": "46.355.292,54",
                "Au : 31/12/2023": ""
            },
            {
                "BILAN - ACTIF": "",
                "null": "98.375.316,81",
                "Au : 31/12/2023": "-"
            },
            {
                "BILAN - ACTIF": "",
                "null": "13.225,25",
                "Au : 31/12/2023": "-"
            },
            {
                "BILAN - ACTIF": "",
                "null": "39.867.991,56",
                "Au : 31/12/2023": "-"
            },
            {
                "BILAN - ACTIF": "",
                "null": "58.494.100,00",
                "Au : 31/12/2023": "-"
            },
            {
                "BILAN - ACTIF": "",
                "null": "",
                "Au : 31/12/2023": "-"
            },
            {
                "BILAN - ACTIF": "",
                "null": "",
                "Au : 31/12/2023": ""
            },
            {
                "BILAN - ACTIF": "",
                "null": "",
                "Au : 31/12/2023": ""
            },
            {
                "BILAN - ACTIF": "",
                "null": "",
                "Au : 31/12/2023": ""
            },
            {
                "BILAN - ACTIF": "",
                "null": "613.048.991,61",
                "Au : 31/12/2023": "3.908.880.922,76"
            },
            {
                "BILAN - ACTIF": "TNALUCRIC\nFITCA",
                "null": "936.118.785,30",
                "Au : 31/12/2023": "69.888.365,00"
            },
            {
                "BILAN - ACTIF": "",
                "null": "12.881.172,35",
                "Au : 31/12/2023": "-"
            },
            {
                "BILAN - ACTIF": "",
                "null": "293.964.374,04",
                "Au : 31/12/2023": "69.888.365,00"
            },
            {
                "BILAN - ACTIF": "",
                "null": "70.125.949,37",
                "Au : 31/12/2023": "-"
            },
            {
                "BILAN - ACTIF": "",
                "null": "74.699.647,35",
                "Au : 31/12/2023": "-"
            },
            {
                "BILAN - ACTIF": "",
                "null": "484.447.642,19",
                "Au : 31/12/2023": "-"
            },
            {
                "BILAN - ACTIF": "",
                "null": "1.171.166.530,74",
                "Au : 31/12/2023": "242.223.739,34"
            },
            {
                "BILAN - ACTIF": "",
                "null": "25.025.054,70",
                "Au : 31/12/2023": "-"
            },
            {
                "BILAN - ACTIF": "",
                "null": "1.040.738.302,18",
                "Au : 31/12/2023": "231.870.524,56"
            },
            {
                "BILAN - ACTIF": "",
                "null": "311.911,87",
                "Au : 31/12/2023": "-"
            },
            {
                "BILAN - ACTIF": "",
                "null": "91.803.762,28",
                "Au : 31/12/2023": "-"
            },
            {
                "BILAN - ACTIF": "",
                "null": "-",
                "Au : 31/12/2023": "-"
            },
            {
                "BILAN - ACTIF": "",
                "null": "12.337.482,19",
                "Au : 31/12/2023": "10.353.214,78"
            },
            {
                "BILAN - ACTIF": "",
                "null": "950.017,52",
                "Au : 31/12/2023": ""
            },
            {
                "BILAN - ACTIF": "",
                "null": "809.735.705,26",
                "Au : 31/12/2023": "-"
            },
            {
                "BILAN - ACTIF": "",
                "null": "10.271.673,00",
                "Au : 31/12/2023": "-"
            },
            {
                "BILAN - ACTIF": "",
                "null": "2.927.292.694,30",
                "Au : 31/12/2023": "312.112.104,34"
            },
            {
                "BILAN - ACTIF": "EIREROSÉRT",
                "null": "31.263.615,37",
                "Au : 31/12/2023": "-"
            },
            {
                "BILAN - ACTIF": "",
                "null": "870.218,00",
                "Au : 31/12/2023": "-"
            },
            {
                "BILAN - ACTIF": "",
                "null": "30.202.050,32",
                "Au : 31/12/2023": "-"
            },
            {
                "BILAN - ACTIF": "",
                "null": "191.347,05",
                "Au : 31/12/2023": "-"
            },
            {
                "BILAN - ACTIF": "",
                "null": "31.263.615,37",
                "Au : 31/12/2023": "-"
            },
            {
                "BILAN - ACTIF": "",
                "null": "3.571.605.301,28",
                "Au : 31/12/2023": "4.220.993.027,10"
            }
        ],
        [
            {
                "COMPTE PRODUITS ET CHARGES (hors taxes) (modèle normal)": "NATURE",
                "null": "Situation\ncomparative au\n31/12/2020",
                "Exercice du : 01/01/2023 au 31/12/2023": ""
            },
            {
                "COMPTE PRODUITS ET CHARGES (hors taxes) (modèle normal)": "",
                "null": "",
                "Exercice du : 01/01/2023 au 31/12/2023": "Concernant\nles exercices\nprécédents\n2"
            },
            {
                "COMPTE PRODUITS ET CHARGES (hors taxes) (modèle normal)": "NOITATIOLPXE",
                "null": "",
                "Exercice du : 01/01/2023 au 31/12/2023": ""
            },
            {
                "COMPTE PRODUITS ET CHARGES (hors taxes) (modèle normal)": "",
                "null": "18.687.908,95",
                "Exercice du : 01/01/2023 au 31/12/2023": ""
            },
            {
                "COMPTE PRODUITS ET CHARGES (hors taxes) (modèle normal)": "",
                "null": "4.831.985.506,55",
                "Exercice du : 01/01/2023 au 31/12/2023": ""
            },
            {
                "COMPTE PRODUITS ET CHARGES (hors taxes) (modèle normal)": "",
                "null": "218.215.953,50",
                "Exercice du : 01/01/2023 au 31/12/2023": ""
            },
            {
                "COMPTE PRODUITS ET CHARGES (hors taxes) (modèle normal)": "",
                "null": "-",
                "Exercice du : 01/01/2023 au 31/12/2023": "-"
            },
            {
                "COMPTE PRODUITS ET CHARGES (hors taxes) (modèle normal)": "",
                "null": "-",
                "Exercice du : 01/01/2023 au 31/12/2023": ""
            },
            {
                "COMPTE PRODUITS ET CHARGES (hors taxes) (modèle normal)": "",
                "null": "-",
                "Exercice du : 01/01/2023 au 31/12/2023": "-"
            },
            {
                "COMPTE PRODUITS ET CHARGES (hors taxes) (modèle normal)": "",
                "null": "108.391.289,70",
                "Exercice du : 01/01/2023 au 31/12/2023": ""
            },
            {
                "COMPTE PRODUITS ET CHARGES (hors taxes) (modèle normal)": "",
                "null": "5.177.280.658,70",
                "Exercice du : 01/01/2023 au 31/12/2023": "-"
            },
            {
                "COMPTE PRODUITS ET CHARGES (hors taxes) (modèle normal)": "",
                "null": "",
                "Exercice du : 01/01/2023 au 31/12/2023": ""
            },
            {
                "COMPTE PRODUITS ET CHARGES (hors taxes) (modèle normal)": "",
                "null": "",
                "Exercice du : 01/01/2023 au 31/12/2023": ""
            },
            {
                "COMPTE PRODUITS ET CHARGES (hors taxes) (modèle normal)": "",
                "null": "8.859.805,40",
                "Exercice du : 01/01/2023 au 31/12/2023": ""
            },
            {
                "COMPTE PRODUITS ET CHARGES (hors taxes) (modèle normal)": "",
                "null": "4.276.627.204,79",
                "Exercice du : 01/01/2023 au 31/12/2023": "114.741,51"
            },
            {
                "COMPTE PRODUITS ET CHARGES (hors taxes) (modèle normal)": "",
                "null": "292.756.177,07",
                "Exercice du : 01/01/2023 au 31/12/2023": "80.228,86"
            },
            {
                "COMPTE PRODUITS ET CHARGES (hors taxes) (modèle normal)": "",
                "null": "57.465.187,20",
                "Exercice du : 01/01/2023 au 31/12/2023": ""
            },
            {
                "COMPTE PRODUITS ET CHARGES (hors taxes) (modèle normal)": "",
                "null": "160.441.930,19",
                "Exercice du : 01/01/2023 au 31/12/2023": ""
            },
            {
                "COMPTE PRODUITS ET CHARGES (hors taxes) (modèle normal)": "",
                "null": "1.908.000,00",
                "Exercice du : 01/01/2023 au 31/12/2023": ""
            },
            {
                "COMPTE PRODUITS ET CHARGES (hors taxes) (modèle normal)": "",
                "null": "182.408.339,18",
                "Exercice du : 01/01/2023 au 31/12/2023": ""
            },
            {
                "COMPTE PRODUITS ET CHARGES (hors taxes) (modèle normal)": "",
                "null": "4.980.466.643,83",
                "Exercice du : 01/01/2023 au 31/12/2023": "194.970,37"
            },
            {
                "COMPTE PRODUITS ET CHARGES (hors taxes) (modèle normal)": "",
                "null": "196.814.014,87",
                "Exercice du : 01/01/2023 au 31/12/2023": "-"
            },
            {
                "COMPTE PRODUITS ET CHARGES (hors taxes) (modèle normal)": "",
                "null": "",
                "Exercice du : 01/01/2023 au 31/12/2023": ""
            },
            {
                "COMPTE PRODUITS ET CHARGES (hors taxes) (modèle normal)": "REICNANIF",
                "null": "",
                "Exercice du : 01/01/2023 au 31/12/2023": ""
            },
            {
                "COMPTE PRODUITS ET CHARGES (hors taxes) (modèle normal)": "",
                "null": "-",
                "Exercice du : 01/01/2023 au 31/12/2023": "-"
            },
            {
                "COMPTE PRODUITS ET CHARGES (hors taxes) (modèle normal)": "",
                "null": "6.866.137,68",
                "Exercice du : 01/01/2023 au 31/12/2023": "-"
            },
            {
                "COMPTE PRODUITS ET CHARGES (hors taxes) (modèle normal)": "",
                "null": "14.466.521,35",
                "Exercice du : 01/01/2023 au 31/12/2023": "-"
            },
            {
                "COMPTE PRODUITS ET CHARGES (hors taxes) (modèle normal)": "",
                "null": "7.050.146,30",
                "Exercice du : 01/01/2023 au 31/12/2023": "-"
            },
            {
                "COMPTE PRODUITS ET CHARGES (hors taxes) (modèle normal)": "",
                "null": "28.382.805,33",
                "Exercice du : 01/01/2023 au 31/12/2023": ""
            },
            {
                "COMPTE PRODUITS ET CHARGES (hors taxes) (modèle normal)": "",
                "null": "",
                "Exercice du : 01/01/2023 au 31/12/2023": ""
            },
            {
                "COMPTE PRODUITS ET CHARGES (hors taxes) (modèle normal)": "",
                "null": "",
                "Exercice du : 01/01/2023 au 31/12/2023": ""
            },
            {
                "COMPTE PRODUITS ET CHARGES (hors taxes) (modèle normal)": "",
                "null": "7.612.934,23",
                "Exercice du : 01/01/2023 au 31/12/2023": "-"
            },
            {
                "COMPTE PRODUITS ET CHARGES (hors taxes) (modèle normal)": "",
                "null": "31.053.588,28",
                "Exercice du : 01/01/2023 au 31/12/2023": "-"
            },
            {
                "COMPTE PRODUITS ET CHARGES (hors taxes) (modèle normal)": "",
                "null": "-",
                "Exercice du : 01/01/2023 au 31/12/2023": "-"
            },
            {
                "COMPTE PRODUITS ET CHARGES (hors taxes) (modèle normal)": "",
                "null": "10.271.673,00",
                "Exercice du : 01/01/2023 au 31/12/2023": "-"
            },
            {
                "COMPTE PRODUITS ET CHARGES (hors taxes) (modèle normal)": "",
                "null": "48.938.195,51",
                "Exercice du : 01/01/2023 au 31/12/2023": "-"
            },
            {
                "COMPTE PRODUITS ET CHARGES (hors taxes) (modèle normal)": "",
                "null": "-20.555.390,18",
                "Exercice du : 01/01/2023 au 31/12/2023": "-"
            },
            {
                "COMPTE PRODUITS ET CHARGES (hors taxes) (modèle normal)": "",
                "null": "176.258.624,69",
                "Exercice du : 01/01/2023 au 31/12/2023": "-"
            }
        ],
        [
            {
                "COMPTE PRODUITS ET CHARGES (hors taxes) (modèle normal)": "NATURE",
                "null": "SITUATION\nCOMPARATIVE\nAU 31/12/2020",
                "Exercice du : 01/01/2023 au 31/12/2023": ""
            },
            {
                "COMPTE PRODUITS ET CHARGES (hors taxes) (modèle normal)": "",
                "null": "",
                "Exercice du : 01/01/2023 au 31/12/2023": "Concernant\nles exercices\nprécédents\n2"
            },
            {
                "COMPTE PRODUITS ET CHARGES (hors taxes) (modèle normal)": "",
                "null": "176.258.624,69",
                "Exercice du : 01/01/2023 au 31/12/2023": "-"
            },
            {
                "COMPTE PRODUITS ET CHARGES (hors taxes) (modèle normal)": "TNARUOC\nNON",
                "null": "",
                "Exercice du : 01/01/2023 au 31/12/2023": ""
            },
            {
                "COMPTE PRODUITS ET CHARGES (hors taxes) (modèle normal)": "",
                "null": "-",
                "Exercice du : 01/01/2023 au 31/12/2023": "-"
            },
            {
                "COMPTE PRODUITS ET CHARGES (hors taxes) (modèle normal)": "",
                "null": "-",
                "Exercice du : 01/01/2023 au 31/12/2023": "-"
            },
            {
                "COMPTE PRODUITS ET CHARGES (hors taxes) (modèle normal)": "",
                "null": "-",
                "Exercice du : 01/01/2023 au 31/12/2023": "-"
            },
            {
                "COMPTE PRODUITS ET CHARGES (hors taxes) (modèle normal)": "",
                "null": "25.503.894,96",
                "Exercice du : 01/01/2023 au 31/12/2023": "-"
            },
            {
                "COMPTE PRODUITS ET CHARGES (hors taxes) (modèle normal)": "",
                "null": "383.034,95",
                "Exercice du : 01/01/2023 au 31/12/2023": "-"
            },
            {
                "COMPTE PRODUITS ET CHARGES (hors taxes) (modèle normal)": "",
                "null": "103.751.039,76",
                "Exercice du : 01/01/2023 au 31/12/2023": ""
            },
            {
                "COMPTE PRODUITS ET CHARGES (hors taxes) (modèle normal)": "",
                "null": "",
                "Exercice du : 01/01/2023 au 31/12/2023": ""
            },
            {
                "COMPTE PRODUITS ET CHARGES (hors taxes) (modèle normal)": "",
                "null": "",
                "Exercice du : 01/01/2023 au 31/12/2023": ""
            },
            {
                "COMPTE PRODUITS ET CHARGES (hors taxes) (modèle normal)": "",
                "null": "8.361.482,73",
                "Exercice du : 01/01/2023 au 31/12/2023": ""
            },
            {
                "COMPTE PRODUITS ET CHARGES (hors taxes) (modèle normal)": "",
                "null": "-",
                "Exercice du : 01/01/2023 au 31/12/2023": "-"
            },
            {
                "COMPTE PRODUITS ET CHARGES (hors taxes) (modèle normal)": "",
                "null": "14.530.020,75",
                "Exercice du : 01/01/2023 au 31/12/2023": ""
            },
            {
                "COMPTE PRODUITS ET CHARGES (hors taxes) (modèle normal)": "",
                "null": "-",
                "Exercice du : 01/01/2023 au 31/12/2023": "-"
            },
            {
                "COMPTE PRODUITS ET CHARGES (hors taxes) (modèle normal)": "",
                "null": "22.891.503,48",
                "Exercice du : 01/01/2023 au 31/12/2023": "-"
            },
            {
                "COMPTE PRODUITS ET CHARGES (hors taxes) (modèle normal)": "",
                "null": "2.995.426,43",
                "Exercice du : 01/01/2023 au 31/12/2023": ""
            },
            {
                "COMPTE PRODUITS ET CHARGES (hors taxes) (modèle normal)": "",
                "null": "179.254.051,12",
                "Exercice du : 01/01/2023 au 31/12/2023": ""
            },
            {
                "COMPTE PRODUITS ET CHARGES (hors taxes) (modèle normal)": "",
                "null": "58.654.039,33",
                "Exercice du : 01/01/2023 au 31/12/2023": ""
            },
            {
                "COMPTE PRODUITS ET CHARGES (hors taxes) (modèle normal)": "",
                "null": "120.600.011,79",
                "Exercice du : 01/01/2023 au 31/12/2023": ""
            },
            {
                "COMPTE PRODUITS ET CHARGES (hors taxes) (modèle normal)": "",
                "null": "5.231.550.393,94",
                "Exercice du : 01/01/2023 au 31/12/2023": ""
            },
            {
                "COMPTE PRODUITS ET CHARGES (hors taxes) (modèle normal)": "",
                "null": "5.110.950.382,15",
                "Exercice du : 01/01/2023 au 31/12/2023": ""
            },
            {
                "COMPTE PRODUITS ET CHARGES (hors taxes) (modèle normal)": "",
                "null": "120.600.011,79",
                "Exercice du : 01/01/2023 au 31/12/2023": ""
            }
        ],
        [
            {
                "INTITULE": "",
                "Au : 31/12/2023": "",
                "null": "MONTANT"
            },
            {
                "INTITULE": "I - RESULTAT NET COMPTABLE",
                "Au : 31/12/2023": "",
                "null": ""
            },
            {
                "INTITULE": "• Bénéfice net",
                "Au : 31/12/2023": "",
                "null": "-"
            },
            {
                "INTITULE": "• Perte nette",
                "Au : 31/12/2023": "",
                "null": "-"
            },
            {
                "INTITULE": "II - REINTEGRATIONS FISCALES",
                "Au : 31/12/2023": "",
                "null": "-"
            },
            {
                "INTITULE": "1. COURANTES",
                "Au : 31/12/2023": "",
                "null": ""
            },
            {
                "INTITULE": "• PROVISION POUR DEPRECIATION DES STOCKS",
                "Au : 31/12/2023": "",
                "null": "-"
            },
            {
                "INTITULE": "• PROVISION POUR DEPRECIATION DES COMPTES CLIENTS",
                "Au : 31/12/2023": "",
                "null": "-"
            },
            {
                "INTITULE": "• Excédent non déductible sur les cadeaux publicitaires",
                "Au : 31/12/2023": "",
                "null": "-"
            },
            {
                "INTITULE": "• Dons non déductibles",
                "Au : 31/12/2023": "",
                "null": "-"
            },
            {
                "INTITULE": "• CHARGES DES EXERCICES ANTERIEURS",
                "Au : 31/12/2023": "",
                "null": "-"
            },
            {
                "INTITULE": "• Provisions non déductibles",
                "Au : 31/12/2023": "",
                "null": "-"
            },
            {
                "INTITULE": "• Excédent non déductible sur les intérêts des comptes courants",
                "Au : 31/12/2023": "",
                "null": "-"
            },
            {
                "INTITULE": "• ECART DE CONVERSION PASSIF",
                "Au : 31/12/2023": "",
                "null": "-"
            },
            {
                "INTITULE": "TOTAL DES RÉINTÉGRATIONS COURANTES",
                "Au : 31/12/2023": "",
                "null": "-"
            },
            {
                "INTITULE": "2. NON COURANTES",
                "Au : 31/12/2023": "",
                "null": ""
            },
            {
                "INTITULE": "• Amendes, pénalités et majorations de retard",
                "Au : 31/12/2023": "",
                "null": "-"
            },
            {
                "INTITULE": "• Cohésion sociale",
                "Au : 31/12/2023": "",
                "null": "-"
            },
            {
                "INTITULE": "• Subvention d’investissement",
                "Au : 31/12/2023": "",
                "null": "-"
            },
            {
                "INTITULE": "• Fraction de la plus-value réalisée par la Sté absorbée et dont l’imposition est différée entre les mains de la Sté absorbante»",
                "Au : 31/12/2023": "",
                "null": "-"
            },
            {
                "INTITULE": "• IS",
                "Au : 31/12/2023": "",
                "null": "-"
            },
            {
                "INTITULE": "• Autres charges non courantes non déductibles",
                "Au : 31/12/2023": "",
                "null": "-"
            },
            {
                "INTITULE": "TOTAL DES RÉINTÉGRATIONS NON COURANTES",
                "Au : 31/12/2023": "",
                "null": "-"
            },
            {
                "INTITULE": "III - DEDUCTIONS FISCALES",
                "Au : 31/12/2023": "",
                "null": "85.860.095,94"
            },
            {
                "INTITULE": "1. COURANTES",
                "Au : 31/12/2023": "",
                "null": "9 827 524,66"
            },
            {
                "INTITULE": "• Ecart de conversion passif exercice 2013",
                "Au : 31/12/2023": "",
                "null": "394.285,58"
            },
            {
                "INTITULE": "• Reprise provision pour depreciation des stocks",
                "Au : 31/12/2023": "",
                "null": "85.264.024,99"
            },
            {
                "INTITULE": "• Reprise provision pour depreciation des clients",
                "Au : 31/12/2023": "",
                "null": "201.785,37"
            },
            {
                "INTITULE": "TOTAL DES DÉDUCTIONS FISCALES COURANTES",
                "Au : 31/12/2023": "",
                "null": "85.860.095,94"
            },
            {
                "INTITULE": "2. NON COURANTES",
                "Au : 31/12/2023": "",
                "null": "9 827 524,66"
            },
            {
                "INTITULE": "• Abattement sur le profit net global des cessions ou des retraits effectués au cours de l’exercice (art. 19 de l’I.s.)",
                "Au : 31/12/2023": "",
                "null": "-"
            },
            {
                "INTITULE": "• Reprise subvention d’investissement",
                "Au : 31/12/2023": "",
                "null": "-"
            },
            {
                "INTITULE": "• Abattement de la plus-value constatée par la société absorbante sur les titres de participation détenus dans la Sté",
                "Au : 31/12/2023": "",
                "null": "-"
            },
            {
                "INTITULE": "• Profit net global de cession exonéré en cas de réinvestissement du produit global des cessions",
                "Au : 31/12/2023": "",
                "null": "-"
            },
            {
                "INTITULE": "TOTAL DES DÉDUCTIONS FISCALES NON COURANTES",
                "Au : 31/12/2023": "",
                "null": "-"
            },
            {
                "INTITULE": "TOTAL",
                "Au : 31/12/2023": "",
                "null": "85.860.095,94"
            },
            {
                "INTITULE": "IV - RESULTAT BRUT FISCAL",
                "Au : 31/12/2023": "",
                "null": "Montants"
            },
            {
                "INTITULE": "Bénéfice brut si T1 > T2 (A)",
                "Au : 31/12/2023": "",
                "null": "-"
            },
            {
                "INTITULE": "Déficit brut fiscal si T1 < T2 (B)",
                "Au : 31/12/2023": "",
                "null": "-"
            },
            {
                "INTITULE": "• Déficit ou fraction de déficit correspondant à la dotation aux amortissements pratiqués",
                "Au : 31/12/2023": "",
                "null": "-"
            },
            {
                "INTITULE": "• Surplus correspondant au déficit d’exploitation.",
                "Au : 31/12/2023": "",
                "null": "-"
            },
            {
                "INTITULE": "V - REPORTS DEFICITAIRES IMPUTES (C) (1)",
                "Au : 31/12/2023": "",
                "null": ""
            },
            {
                "INTITULE": "• Exercice N-4",
                "Au : 31/12/2023": "",
                "null": "-"
            },
            {
                "INTITULE": "• Exercice N-3",
                "Au : 31/12/2023": "",
                "null": "-"
            },
            {
                "INTITULE": "• Exercice N-2",
                "Au : 31/12/2023": "",
                "null": "-"
            },
            {
                "INTITULE": "• Exercice N-1",
                "Au : 31/12/2023": "",
                "null": "-"
            },
            {
                "INTITULE": "• Déficit absorbé sur les amortissements indéfiniment reportables",
                "Au : 31/12/2023": "",
                "null": "-"
            },
            {
                "INTITULE": "VI - RESULTAT NET FISCAL",
                "Au : 31/12/2023": "",
                "null": ""
            },
            {
                "INTITULE": "Bénéfice net fiscal (A-C)",
                "Au : 31/12/2023": "",
                "null": "117.274.282,44"
            },
            {
                "INTITULE": "ou Déficit net fiscal (B)",
                "Au : 31/12/2023": "",
                "null": "-"
            },
            {
                "INTITULE": "VII - CUMUL DES REPORTS DE DEFICITS SUR AMORTISSEMENTS",
                "Au : 31/12/2023": "",
                "null": "Montants"
            },
            {
                "INTITULE": "VIII - CUMUL DES DEFICITS D’EXPLOITATION RESTANT A REPORTER FISCALEMENT",
                "Au : 31/12/2023": "",
                "null": ""
            },
            {
                "INTITULE": "• Exercice N-4",
                "Au : 31/12/2023": "",
                "null": "-"
            },
            {
                "INTITULE": "• Exercice N-3",
                "Au : 31/12/2023": "",
                "null": "-"
            },
            {
                "INTITULE": "• Exercice N-2",
                "Au : 31/12/2023": "",
                "null": "-"
            },
            {
                "INTITULE": "• Exercice N-1",
                "Au : 31/12/2023": "",
                "null": "-"
            }
        ],
        [
            {
                "TABLEAU DES IMMOBILISATIONS AUTRES QUE FINANCIÈRES": "NATURE",
                "null": "MONTANT BRUT\nFIN\nEXERCICE",
                "Exercice du : 01/01/2023 au 31/12/2023": ""
            },
            {
                "TABLEAU DES IMMOBILISATIONS AUTRES QUE FINANCIÈRES": "",
                "null": "",
                "Exercice du : 01/01/2023 au 31/12/2023": "VIREMENT"
            },
            {
                "TABLEAU DES IMMOBILISATIONS AUTRES QUE FINANCIÈRES": "IMMOBILISATIONS EN NON VALEURS",
                "null": "0,00",
                "Exercice du : 01/01/2023 au 31/12/2023": "0,00"
            },
            {
                "TABLEAU DES IMMOBILISATIONS AUTRES QUE FINANCIÈRES": "• Frais préliminaires",
                "null": "0,00",
                "Exercice du : 01/01/2023 au 31/12/2023": "-"
            },
            {
                "TABLEAU DES IMMOBILISATIONS AUTRES QUE FINANCIÈRES": "• Charges à répartir sur plusieurs exercices",
                "null": "0,00",
                "Exercice du : 01/01/2023 au 31/12/2023": "-"
            },
            {
                "TABLEAU DES IMMOBILISATIONS AUTRES QUE FINANCIÈRES": "• Primes de remboursement d'obligations",
                "null": "0,00",
                "Exercice du : 01/01/2023 au 31/12/2023": "-"
            },
            {
                "TABLEAU DES IMMOBILISATIONS AUTRES QUE FINANCIÈRES": "IMMOBILISATIONS INCORPORELLES",
                "null": "59.306.024,18",
                "Exercice du : 01/01/2023 au 31/12/2023": "731.961,00"
            },
            {
                "TABLEAU DES IMMOBILISATIONS AUTRES QUE FINANCIÈRES": "• Immobilisation en recherche et\ndéveloppement",
                "null": "0,00",
                "Exercice du : 01/01/2023 au 31/12/2023": "-"
            },
            {
                "TABLEAU DES IMMOBILISATIONS AUTRES QUE FINANCIÈRES": "• Brevets, marques, droits et\nvaleurs similaires",
                "null": "51.814.397,69",
                "Exercice du : 01/01/2023 au 31/12/2023": "731.961,00"
            },
            {
                "TABLEAU DES IMMOBILISATIONS AUTRES QUE FINANCIÈRES": "• Fonds commercial",
                "null": "7 491 626,49",
                "Exercice du : 01/01/2023 au 31/12/2023": "-"
            },
            {
                "TABLEAU DES IMMOBILISATIONS AUTRES QUE FINANCIÈRES": "• Autres immobilisations incorporelles",
                "null": "0,00",
                "Exercice du : 01/01/2023 au 31/12/2023": "-"
            },
            {
                "TABLEAU DES IMMOBILISATIONS AUTRES QUE FINANCIÈRES": "IMMOBILISATIONS CORPORELLES",
                "null": "4.466.831.409,02",
                "Exercice du : 01/01/2023 au 31/12/2023": "- 222.911.679,50"
            },
            {
                "TABLEAU DES IMMOBILISATIONS AUTRES QUE FINANCIÈRES": "• Terrains",
                "null": "113.576.646,66",
                "Exercice du : 01/01/2023 au 31/12/2023": "378.318,00"
            },
            {
                "TABLEAU DES IMMOBILISATIONS AUTRES QUE FINANCIÈRES": "• Constructions",
                "null": "543.260.464,75",
                "Exercice du : 01/01/2023 au 31/12/2023": "2.327.979,25"
            },
            {
                "TABLEAU DES IMMOBILISATIONS AUTRES QUE FINANCIÈRES": "• Installations techniques, maté-\nriel et outillage",
                "null": "3.704.544.370,85",
                "Exercice du : 01/01/2023 au 31/12/2023": "217.406.265,87"
            },
            {
                "TABLEAU DES IMMOBILISATIONS AUTRES QUE FINANCIÈRES": "• Matériel de transport",
                "null": "34.872.066,22",
                "Exercice du : 01/01/2023 au 31/12/2023": "412.784,44"
            },
            {
                "TABLEAU DES IMMOBILISATIONS AUTRES QUE FINANCIÈRES": "• Mobilier, matériel de bureau et\naménagement",
                "null": "39.159.564,11",
                "Exercice du : 01/01/2023 au 31/12/2023": "2.386.331,94"
            },
            {
                "TABLEAU DES IMMOBILISATIONS AUTRES QUE FINANCIÈRES": "• Autres immobilisations corporelles",
                "null": "4.166.067,81",
                "Exercice du : 01/01/2023 au 31/12/2023": "0,00"
            },
            {
                "TABLEAU DES IMMOBILISATIONS AUTRES QUE FINANCIÈRES": "• Immobilisations corporelles en cours",
                "null": "27.252.228,62",
                "Exercice du : 01/01/2023 au 31/12/2023": "-"
            },
            {
                "TABLEAU DES IMMOBILISATIONS AUTRES QUE FINANCIÈRES": "Total",
                "null": "4.526.137.433,20",
                "Exercice du : 01/01/2023 au 31/12/2023": "223.643.640,50"
            }
        ],
        [
            {
                "ETAT DES SOLDES DE GESTION ESG": "I - TABLEAU DE FORMATION DES RESULTATS (T.F.R.)",
                "null": "",
                "Exercice du : 01/01/2023 au 31/12/2023": ""
            },
            {
                "ETAT DES SOLDES DE GESTION ESG": "",
                "null": "Exercice précédent",
                "Exercice du : 01/01/2023 au 31/12/2023": ""
            },
            {
                "ETAT DES SOLDES DE GESTION ESG": "",
                "null": "18.687.908,95",
                "Exercice du : 01/01/2023 au 31/12/2023": ""
            },
            {
                "ETAT DES SOLDES DE GESTION ESG": "",
                "null": "8.859.805,40",
                "Exercice du : 01/01/2023 au 31/12/2023": ""
            },
            {
                "ETAT DES SOLDES DE GESTION ESG": "I",
                "null": "9.828.103,55",
                "Exercice du : 01/01/2023 au 31/12/2023": ""
            },
            {
                "ETAT DES SOLDES DE GESTION ESG": "II",
                "null": "5.050.201.460,05",
                "Exercice du : 01/01/2023 au 31/12/2023": ""
            },
            {
                "ETAT DES SOLDES DE GESTION ESG": "",
                "null": "4.831.985.506,55",
                "Exercice du : 01/01/2023 au 31/12/2023": ""
            },
            {
                "ETAT DES SOLDES DE GESTION ESG": "",
                "null": "218.215.953,50",
                "Exercice du : 01/01/2023 au 31/12/2023": ""
            },
            {
                "ETAT DES SOLDES DE GESTION ESG": "",
                "null": "-",
                "Exercice du : 01/01/2023 au 31/12/2023": ""
            },
            {
                "ETAT DES SOLDES DE GESTION ESG": "III",
                "null": "4.569.383.381,86",
                "Exercice du : 01/01/2023 au 31/12/2023": ""
            },
            {
                "ETAT DES SOLDES DE GESTION ESG": "",
                "null": "4.276.627.204,79",
                "Exercice du : 01/01/2023 au 31/12/2023": ""
            },
            {
                "ETAT DES SOLDES DE GESTION ESG": "",
                "null": "292.756.177,07",
                "Exercice du : 01/01/2023 au 31/12/2023": ""
            },
            {
                "ETAT DES SOLDES DE GESTION ESG": "IV",
                "null": "490.646.181,74",
                "Exercice du : 01/01/2023 au 31/12/2023": ""
            },
            {
                "ETAT DES SOLDES DE GESTION ESG": "",
                "null": "-",
                "Exercice du : 01/01/2023 au 31/12/2023": ""
            },
            {
                "ETAT DES SOLDES DE GESTION ESG": "V",
                "null": "57.465.187,20",
                "Exercice du : 01/01/2023 au 31/12/2023": ""
            },
            {
                "ETAT DES SOLDES DE GESTION ESG": "",
                "null": "160.441.930,19",
                "Exercice du : 01/01/2023 au 31/12/2023": ""
            },
            {
                "ETAT DES SOLDES DE GESTION ESG": "",
                "null": "272.739.064,35",
                "Exercice du : 01/01/2023 au 31/12/2023": ""
            },
            {
                "ETAT DES SOLDES DE GESTION ESG": "",
                "null": "-",
                "Exercice du : 01/01/2023 au 31/12/2023": ""
            },
            {
                "ETAT DES SOLDES DE GESTION ESG": "",
                "null": "-",
                "Exercice du : 01/01/2023 au 31/12/2023": ""
            },
            {
                "ETAT DES SOLDES DE GESTION ESG": "",
                "null": "1.908.000,00",
                "Exercice du : 01/01/2023 au 31/12/2023": ""
            },
            {
                "ETAT DES SOLDES DE GESTION ESG": "",
                "null": "108.391.289,70",
                "Exercice du : 01/01/2023 au 31/12/2023": ""
            },
            {
                "ETAT DES SOLDES DE GESTION ESG": "",
                "null": "182.408.339,18",
                "Exercice du : 01/01/2023 au 31/12/2023": ""
            },
            {
                "ETAT DES SOLDES DE GESTION ESG": "VI",
                "null": "196.814.014,87",
                "Exercice du : 01/01/2023 au 31/12/2023": ""
            },
            {
                "ETAT DES SOLDES DE GESTION ESG": "VII",
                "null": "-20.555.390,18",
                "Exercice du : 01/01/2023 au 31/12/2023": ""
            },
            {
                "ETAT DES SOLDES DE GESTION ESG": "VIII",
                "null": "176.258.624,69",
                "Exercice du : 01/01/2023 au 31/12/2023": ""
            },
            {
                "ETAT DES SOLDES DE GESTION ESG": "IX",
                "null": "2.995.426,43",
                "Exercice du : 01/01/2023 au 31/12/2023": ""
            },
            {
                "ETAT DES SOLDES DE GESTION ESG": "",
                "null": "58.654.039,33",
                "Exercice du : 01/01/2023 au 31/12/2023": ""
            },
            {
                "ETAT DES SOLDES DE GESTION ESG": "X",
                "null": "120.600.011,79",
                "Exercice du : 01/01/2023 au 31/12/2023": ""
            },
            {
                "ETAT DES SOLDES DE GESTION ESG": "II - CAPACITE D’AUTOFINANCEMENT (C.A.F.) - AUTOFINANCEMENT",
                "null": "",
                "Exercice du : 01/01/2023 au 31/12/2023": ""
            },
            {
                "ETAT DES SOLDES DE GESTION ESG": "",
                "null": "",
                "Exercice du : 01/01/2023 au 31/12/2023": ""
            },
            {
                "ETAT DES SOLDES DE GESTION ESG": "",
                "null": "120.600.011,79",
                "Exercice du : 01/01/2023 au 31/12/2023": ""
            },
            {
                "ETAT DES SOLDES DE GESTION ESG": "",
                "null": "-",
                "Exercice du : 01/01/2023 au 31/12/2023": ""
            },
            {
                "ETAT DES SOLDES DE GESTION ESG": "",
                "null": "89.380.203,85",
                "Exercice du : 01/01/2023 au 31/12/2023": ""
            },
            {
                "ETAT DES SOLDES DE GESTION ESG": "",
                "null": "-",
                "Exercice du : 01/01/2023 au 31/12/2023": ""
            },
            {
                "ETAT DES SOLDES DE GESTION ESG": "",
                "null": "-",
                "Exercice du : 01/01/2023 au 31/12/2023": ""
            },
            {
                "ETAT DES SOLDES DE GESTION ESG": "",
                "null": "-",
                "Exercice du : 01/01/2023 au 31/12/2023": ""
            },
            {
                "ETAT DES SOLDES DE GESTION ESG": "",
                "null": "6.460.598,88",
                "Exercice du : 01/01/2023 au 31/12/2023": ""
            },
            {
                "ETAT DES SOLDES DE GESTION ESG": "",
                "null": "383.034,95",
                "Exercice du : 01/01/2023 au 31/12/2023": ""
            },
            {
                "ETAT DES SOLDES DE GESTION ESG": "",
                "null": "-",
                "Exercice du : 01/01/2023 au 31/12/2023": ""
            },
            {
                "ETAT DES SOLDES DE GESTION ESG": "",
                "null": "76.975,00",
                "Exercice du : 01/01/2023 au 31/12/2023": ""
            },
            {
                "ETAT DES SOLDES DE GESTION ESG": "I",
                "null": "203.213.556,81",
                "Exercice du : 01/01/2023 au 31/12/2023": ""
            },
            {
                "ETAT DES SOLDES DE GESTION ESG": "",
                "null": "148.200.000,00",
                "Exercice du : 01/01/2023 au 31/12/2023": ""
            },
            {
                "ETAT DES SOLDES DE GESTION ESG": "II",
                "null": "55.013.556,81",
                "Exercice du : 01/01/2023 au 31/12/2023": ""
            }
        ],
        [
            {
                "DETAIL DES POSTES DU CPC (CHARGES)": "POSTE",
                "null": "Exercice précédent",
                "Exercice du : 01/01/2023 au 31/12/2023": ""
            },
            {
                "DETAIL DES POSTES DU CPC (CHARGES)": "",
                "null": "",
                "Exercice du : 01/01/2023 au 31/12/2023": ""
            },
            {
                "DETAIL DES POSTES DU CPC (CHARGES)": "611",
                "null": "17.977.666,43",
                "Exercice du : 01/01/2023 au 31/12/2023": ""
            },
            {
                "DETAIL DES POSTES DU CPC (CHARGES)": "",
                "null": "",
                "Exercice du : 01/01/2023 au 31/12/2023": ""
            },
            {
                "DETAIL DES POSTES DU CPC (CHARGES)": "",
                "null": "-9.117.861,03",
                "Exercice du : 01/01/2023 au 31/12/2023": ""
            },
            {
                "DETAIL DES POSTES DU CPC (CHARGES)": "",
                "null": "8.859.805,40",
                "Exercice du : 01/01/2023 au 31/12/2023": ""
            },
            {
                "DETAIL DES POSTES DU CPC (CHARGES)": "612",
                "null": "",
                "Exercice du : 01/01/2023 au 31/12/2023": ""
            },
            {
                "DETAIL DES POSTES DU CPC (CHARGES)": "",
                "null": "3.353.173.122,32",
                "Exercice du : 01/01/2023 au 31/12/2023": ""
            },
            {
                "DETAIL DES POSTES DU CPC (CHARGES)": "",
                "null": "-96.332.041,67",
                "Exercice du : 01/01/2023 au 31/12/2023": ""
            },
            {
                "DETAIL DES POSTES DU CPC (CHARGES)": "",
                "null": "602.077.362,39",
                "Exercice du : 01/01/2023 au 31/12/2023": ""
            },
            {
                "DETAIL DES POSTES DU CPC (CHARGES)": "",
                "null": "-4.754.365,40",
                "Exercice du : 01/01/2023 au 31/12/2023": ""
            },
            {
                "DETAIL DES POSTES DU CPC (CHARGES)": "",
                "null": "341.065.757,34",
                "Exercice du : 01/01/2023 au 31/12/2023": ""
            },
            {
                "DETAIL DES POSTES DU CPC (CHARGES)": "",
                "null": "74.812.887,41",
                "Exercice du : 01/01/2023 au 31/12/2023": ""
            },
            {
                "DETAIL DES POSTES DU CPC (CHARGES)": "",
                "null": "4.270.042.722,39",
                "Exercice du : 01/01/2023 au 31/12/2023": ""
            },
            {
                "DETAIL DES POSTES DU CPC (CHARGES)": "613/314",
                "null": "",
                "Exercice du : 01/01/2023 au 31/12/2023": ""
            },
            {
                "DETAIL DES POSTES DU CPC (CHARGES)": "",
                "null": "14.369.824,94",
                "Exercice du : 01/01/2023 au 31/12/2023": ""
            },
            {
                "DETAIL DES POSTES DU CPC (CHARGES)": "",
                "null": "10.125.056,08",
                "Exercice du : 01/01/2023 au 31/12/2023": ""
            },
            {
                "DETAIL DES POSTES DU CPC (CHARGES)": "",
                "null": "3.325.080,16",
                "Exercice du : 01/01/2023 au 31/12/2023": ""
            },
            {
                "DETAIL DES POSTES DU CPC (CHARGES)": "",
                "null": "19.285.850,66",
                "Exercice du : 01/01/2023 au 31/12/2023": ""
            },
            {
                "DETAIL DES POSTES DU CPC (CHARGES)": "",
                "null": "9.683.168,06",
                "Exercice du : 01/01/2023 au 31/12/2023": ""
            },
            {
                "DETAIL DES POSTES DU CPC (CHARGES)": "",
                "null": "98.447.846,95",
                "Exercice du : 01/01/2023 au 31/12/2023": ""
            },
            {
                "DETAIL DES POSTES DU CPC (CHARGES)": "",
                "null": "2.858.879,41",
                "Exercice du : 01/01/2023 au 31/12/2023": ""
            },
            {
                "DETAIL DES POSTES DU CPC (CHARGES)": "",
                "null": "106.674.237,05",
                "Exercice du : 01/01/2023 au 31/12/2023": ""
            },
            {
                "DETAIL DES POSTES DU CPC (CHARGES)": "",
                "null": "9.429.879,48",
                "Exercice du : 01/01/2023 au 31/12/2023": ""
            },
            {
                "DETAIL DES POSTES DU CPC (CHARGES)": "",
                "null": "18.556.354,28",
                "Exercice du : 01/01/2023 au 31/12/2023": ""
            },
            {
                "DETAIL DES POSTES DU CPC (CHARGES)": "",
                "null": "292.756.177,07",
                "Exercice du : 01/01/2023 au 31/12/2023": ""
            },
            {
                "DETAIL DES POSTES DU CPC (CHARGES)": "617",
                "null": "9 827 524,66",
                "Exercice du : 01/01/2023 au 31/12/2023": ""
            },
            {
                "DETAIL DES POSTES DU CPC (CHARGES)": "",
                "null": "132.885.325,18",
                "Exercice du : 01/01/2023 au 31/12/2023": ""
            },
            {
                "DETAIL DES POSTES DU CPC (CHARGES)": "",
                "null": "35.966.667,72",
                "Exercice du : 01/01/2023 au 31/12/2023": ""
            },
            {
                "DETAIL DES POSTES DU CPC (CHARGES)": "",
                "null": "5.571.142,55",
                "Exercice du : 01/01/2023 au 31/12/2023": ""
            },
            {
                "DETAIL DES POSTES DU CPC (CHARGES)": "",
                "null": "174.423.135,45",
                "Exercice du : 01/01/2023 au 31/12/2023": ""
            },
            {
                "DETAIL DES POSTES DU CPC (CHARGES)": "618",
                "null": "9 827 524,66",
                "Exercice du : 01/01/2023 au 31/12/2023": ""
            },
            {
                "DETAIL DES POSTES DU CPC (CHARGES)": "",
                "null": "1.908.000,00",
                "Exercice du : 01/01/2023 au 31/12/2023": ""
            },
            {
                "DETAIL DES POSTES DU CPC (CHARGES)": "",
                "null": "0,00",
                "Exercice du : 01/01/2023 au 31/12/2023": ""
            },
            {
                "DETAIL DES POSTES DU CPC (CHARGES)": "",
                "null": "0,00",
                "Exercice du : 01/01/2023 au 31/12/2023": ""
            },
            {
                "DETAIL DES POSTES DU CPC (CHARGES)": "",
                "null": "1.908.000,00",
                "Exercice du : 01/01/2023 au 31/12/2023": ""
            },
            {
                "DETAIL DES POSTES DU CPC (CHARGES)": "",
                "null": "",
                "Exercice du : 01/01/2023 au 31/12/2023": ""
            },
            {
                "DETAIL DES POSTES DU CPC (CHARGES)": "638",
                "null": "9 827 524,66",
                "Exercice du : 01/01/2023 au 31/12/2023": ""
            },
            {
                "DETAIL DES POSTES DU CPC (CHARGES)": "",
                "null": "-",
                "Exercice du : 01/01/2023 au 31/12/2023": ""
            },
            {
                "DETAIL DES POSTES DU CPC (CHARGES)": "",
                "null": "0,00",
                "Exercice du : 01/01/2023 au 31/12/2023": ""
            },
            {
                "DETAIL DES POSTES DU CPC (CHARGES)": "",
                "null": "",
                "Exercice du : 01/01/2023 au 31/12/2023": ""
            },
            {
                "DETAIL DES POSTES DU CPC (CHARGES)": "",
                "null": "",
                "Exercice du : 01/01/2023 au 31/12/2023": ""
            },
            {
                "DETAIL DES POSTES DU CPC (CHARGES)": "658",
                "null": "9 827 524,66",
                "Exercice du : 01/01/2023 au 31/12/2023": ""
            },
            {
                "DETAIL DES POSTES DU CPC (CHARGES)": "",
                "null": "0,00",
                "Exercice du : 01/01/2023 au 31/12/2023": ""
            },
            {
                "DETAIL DES POSTES DU CPC (CHARGES)": "",
                "null": "0,00",
                "Exercice du : 01/01/2023 au 31/12/2023": ""
            },
            {
                "DETAIL DES POSTES DU CPC (CHARGES)": "",
                "null": "427.247,00",
                "Exercice du : 01/01/2023 au 31/12/2023": ""
            },
            {
                "DETAIL DES POSTES DU CPC (CHARGES)": "",
                "null": "4.130,16",
                "Exercice du : 01/01/2023 au 31/12/2023": ""
            },
            {
                "DETAIL DES POSTES DU CPC (CHARGES)": "",
                "null": "14.098.643,59",
                "Exercice du : 01/01/2023 au 31/12/2023": ""
            },
            {
                "DETAIL DES POSTES DU CPC (CHARGES)": "",
                "null": "14.530.020,75",
                "Exercice du : 01/01/2023 au 31/12/2023": ""
            }
        ],
        [
            {
                "": "711",
                "PRODUITS D’EXPLOITATION": "VENTES DE MARCHANDISES",
                "Exercice": "10 565 642,41",
                "Exercice précédent": "9 827 524,66"
            },
            {
                "": "",
                "PRODUITS D’EXPLOITATION": "• Ventes de marchandises au Maroc",
                "Exercice": "93.328,00",
                "Exercice précédent": "686.455,67"
            },
            {
                "": "",
                "PRODUITS D’EXPLOITATION": "• Ventes de marchandises à l'étranger",
                "Exercice": "21.555.370,58",
                "Exercice précédent": "18.001.453,28"
            },
            {
                "": "",
                "PRODUITS D’EXPLOITATION": "• Reste du poste des ventes de marchandises",
                "Exercice": "0,00",
                "Exercice précédent": "0,00"
            },
            {
                "": "",
                "PRODUITS D’EXPLOITATION": "TOTAL",
                "Exercice": "21.648.698,58",
                "Exercice précédent": "18.687.908,95"
            },
            {
                "": "712",
                "PRODUITS D’EXPLOITATION": "VENTES DES BIENS ET SERVICES PRODUITS",
                "Exercice": "",
                "Exercice précédent": ""
            },
            {
                "": "",
                "PRODUITS D’EXPLOITATION": "• Ventes de biens au Maroc",
                "Exercice": "4.415.733.831,81",
                "Exercice précédent": "4.691.266.817,64"
            },
            {
                "": "",
                "PRODUITS D’EXPLOITATION": "• Ventes de biens à l'étranger",
                "Exercice": "201.803.404,83",
                "Exercice précédent": "52.701.055,57"
            },
            {
                "": "",
                "PRODUITS D’EXPLOITATION": "• Ventes de services au Maroc",
                "Exercice": "33.128.698,90",
                "Exercice précédent": "19.773.978,40"
            },
            {
                "": "",
                "PRODUITS D’EXPLOITATION": "• Ventes de services à l'étranger",
                "Exercice": "0,00",
                "Exercice précédent": "0,00"
            },
            {
                "": "",
                "PRODUITS D’EXPLOITATION": "• Redevances pour brevets, marques, droits...",
                "Exercice": "0,00",
                "Exercice précédent": "0,00"
            },
            {
                "": "",
                "PRODUITS D’EXPLOITATION": "• Reste du poste des ventes et services produits",
                "Exercice": "235.879.957,72",
                "Exercice précédent": "68.243.654,94"
            },
            {
                "": "",
                "PRODUITS D’EXPLOITATION": "TOTAL",
                "Exercice": "4.886.545.893,26",
                "Exercice précédent": "4.831.985.506,55"
            },
            {
                "": "713",
                "PRODUITS D’EXPLOITATION": "VARIATION DES STOCKS DE PRODUITS",
                "Exercice": "10 565 642,41",
                "Exercice précédent": "9 827 524,66"
            },
            {
                "": "",
                "PRODUITS D’EXPLOITATION": "• Variation des stocks de biens produits",
                "Exercice": "-491.885.607,25",
                "Exercice précédent": "-565.095.601,02"
            },
            {
                "": "",
                "PRODUITS D’EXPLOITATION": "• Variation des stocks des services produits",
                "Exercice": "-3.781.081,37",
                "Exercice précédent": "-8.084.546,69"
            },
            {
                "": "",
                "PRODUITS D’EXPLOITATION": "• Variation des stocks des produits en cours",
                "Exercice": "385.539.865,38",
                "Exercice précédent": "791.396.101,21"
            },
            {
                "": "",
                "PRODUITS D’EXPLOITATION": "TOTAL",
                "Exercice": "-110.126.823,24",
                "Exercice précédent": "218.215.953,50"
            },
            {
                "": "718",
                "PRODUITS D’EXPLOITATION": "AUTRES PRODUITS D’EXPLOITATION",
                "Exercice": "10 565 642,41",
                "Exercice précédent": ""
            },
            {
                "": "",
                "PRODUITS D’EXPLOITATION": "• Jetons de présence reçus",
                "Exercice": "-",
                "Exercice précédent": "-"
            },
            {
                "": "",
                "PRODUITS D’EXPLOITATION": "• Reste du poste (produits divers)",
                "Exercice": "-",
                "Exercice précédent": "-"
            },
            {
                "": "",
                "PRODUITS D’EXPLOITATION": "TOTAL",
                "Exercice": "-",
                "Exercice précédent": "-"
            },
            {
                "": "719",
                "PRODUITS D’EXPLOITATION": "REPRISES D’EXPLOITATION; TRANSFERTS DE CHARGES",
                "Exercice": "10 565 642,41",
                "Exercice précédent": ""
            },
            {
                "": "",
                "PRODUITS D’EXPLOITATION": "• Reprises d'exploitation",
                "Exercice": "85.465.810,36",
                "Exercice précédent": "98.628.986,43"
            },
            {
                "": "",
                "PRODUITS D’EXPLOITATION": "• Transferts de charges",
                "Exercice": "31.107.088,38",
                "Exercice précédent": "9.762.303,27"
            },
            {
                "": "",
                "PRODUITS D’EXPLOITATION": "TOTAL",
                "Exercice": "116.572.898,74",
                "Exercice précédent": "108.391.289,70"
            },
            {
                "": "",
                "PRODUITS D’EXPLOITATION": "PRODUITS FINANCIERS",
                "Exercice": "",
                "Exercice précédent": ""
            },
            {
                "": "738",
                "PRODUITS D’EXPLOITATION": "INTÉRÊTS ET AUTRES PRODUITS FINANCIERS",
                "Exercice": "10 565 642,41",
                "Exercice précédent": "9 827 524,66"
            },
            {
                "": "",
                "PRODUITS D’EXPLOITATION": "• Intérêts et produits assimilés",
                "Exercice": "10.405.947,86",
                "Exercice précédent": "28.382.805,33"
            },
            {
                "": "",
                "PRODUITS D’EXPLOITATION": "• Revenus des créances rattachées à des participations",
                "Exercice": "-",
                "Exercice précédent": "-"
            },
            {
                "": "",
                "PRODUITS D’EXPLOITATION": "• Produits nets sur cessions de titres et valeurs de placement",
                "Exercice": "10.405.947,86",
                "Exercice précédent": "10.777.535,81"
            },
            {
                "": "",
                "PRODUITS D’EXPLOITATION": "• Reste du poste intérêts et autres produits financiers",
                "Exercice": "0,00",
                "Exercice précédent": "17.605.269,52"
            },
            {
                "": "",
                "PRODUITS D’EXPLOITATION": "TOTAL",
                "Exercice": "20.811.895,72",
                "Exercice précédent": "56.765.610,66"
            }
        ],
        [
            {
                "TABLEAU DES BIENS EN CREDIT-BAIL": "RUBRIQUES\n1",
                "null": "OBSERVATIONS\n11",
                "Exercice du : 01/01/2023 au 31/12/2023": "DURÉE\nTHÉORIQUE\nD’AMORTISSE-\nMENT DU BIEN\n5"
            },
            {
                "TABLEAU DES BIENS EN CREDIT-BAIL": "",
                "null": "",
                "Exercice du : 01/01/2023 au 31/12/2023": ""
            },
            {
                "TABLEAU DES BIENS EN CREDIT-BAIL": "",
                "null": "",
                "Exercice du : 01/01/2023 au 31/12/2023": ""
            },
            {
                "TABLEAU DES BIENS EN CREDIT-BAIL": "",
                "null": "",
                "Exercice du : 01/01/2023 au 31/12/2023": ""
            },
            {
                "TABLEAU DES BIENS EN CREDIT-BAIL": "TOTAL",
                "null": "-",
                "Exercice du : 01/01/2023 au 31/12/2023": "-"
            }
        ],
        [
            {
                "TABLEAU DES AMORTISSEMENTS Exercice du : 01/01/2023 au 31/12/2023": "NATURE",
                "null": "CUMUL\nD’AMORTISSMENT\nFIN EXERCICE\n(4) =1+2-3»"
            },
            {
                "TABLEAU DES AMORTISSEMENTS Exercice du : 01/01/2023 au 31/12/2023": "IMMOBILISATIONS EN NON-VALEURS",
                "null": "0,00"
            },
            {
                "TABLEAU DES AMORTISSEMENTS Exercice du : 01/01/2023 au 31/12/2023": "• Frais préliminaires",
                "null": "0,00"
            },
            {
                "TABLEAU DES AMORTISSEMENTS Exercice du : 01/01/2023 au 31/12/2023": "• Charges à répartir sur plusieurs exercices",
                "null": "0,00"
            },
            {
                "TABLEAU DES AMORTISSEMENTS Exercice du : 01/01/2023 au 31/12/2023": "• Primes de remboursement des obligations",
                "null": "0,00"
            },
            {
                "TABLEAU DES AMORTISSEMENTS Exercice du : 01/01/2023 au 31/12/2023": "IMMOBILISATIONS INCORPORELLES",
                "null": "48.084.865,28"
            },
            {
                "TABLEAU DES AMORTISSEMENTS Exercice du : 01/01/2023 au 31/12/2023": "• Immobilisation en recherche et développement",
                "null": "0,00"
            },
            {
                "TABLEAU DES AMORTISSEMENTS Exercice du : 01/01/2023 au 31/12/2023": "• Brevets, marques, droits et valeurs similaires",
                "null": "48.084.865,28"
            },
            {
                "TABLEAU DES AMORTISSEMENTS Exercice du : 01/01/2023 au 31/12/2023": "• Fonds commercial",
                "null": "0,00"
            },
            {
                "TABLEAU DES AMORTISSEMENTS Exercice du : 01/01/2023 au 31/12/2023": "• Autres Immobilisations incorporelles",
                "null": "0,00"
            },
            {
                "TABLEAU DES AMORTISSEMENTS Exercice du : 01/01/2023 au 31/12/2023": "IMMOBILISATIONS CORPORELLES",
                "null": "3.853.304.430,99"
            },
            {
                "TABLEAU DES AMORTISSEMENTS Exercice du : 01/01/2023 au 31/12/2023": "• Terrains",
                "null": "0,00"
            },
            {
                "TABLEAU DES AMORTISSEMENTS Exercice du : 01/01/2023 au 31/12/2023": "• Constructions",
                "null": "493.081.383,30"
            },
            {
                "TABLEAU DES AMORTISSEMENTS Exercice du : 01/01/2023 au 31/12/2023": "• Installations techniques, matériel et outillage",
                "null": "3.287.119.152,05"
            },
            {
                "TABLEAU DES AMORTISSEMENTS Exercice du : 01/01/2023 au 31/12/2023": "• Matériel de transport",
                "null": "33.679.806,09"
            },
            {
                "TABLEAU DES AMORTISSEMENTS Exercice du : 01/01/2023 au 31/12/2023": "• Mobilier, matériel de bureau et aménagements",
                "null": "35.258.021,74"
            },
            {
                "TABLEAU DES AMORTISSEMENTS Exercice du : 01/01/2023 au 31/12/2023": "• Autres immobilisations corporelles",
                "null": "4.166.067,81"
            },
            {
                "TABLEAU DES AMORTISSEMENTS Exercice du : 01/01/2023 au 31/12/2023": "• Immobilisations corporelles en cours",
                "null": "0,00"
            }
        ],
        [
            {
                "TABLEAU DES PROVISIONS": "NATURE",
                "null": "MONTANT\nFIN\nEXERCICE",
                "Exercice du : 01/01/2023 au 31/12/2023": ""
            },
            {
                "TABLEAU DES PROVISIONS": "",
                "null": "",
                "Exercice du : 01/01/2023 au 31/12/2023": ""
            },
            {
                "TABLEAU DES PROVISIONS": "IMMOBILISATIONS EN NON VALEURS",
                "null": "",
                "Exercice du : 01/01/2023 au 31/12/2023": ""
            },
            {
                "TABLEAU DES PROVISIONS": "1. Provisions pour dépréciation de\nl’actif immobilisé",
                "null": "7.491.626,49",
                "Exercice du : 01/01/2023 au 31/12/2023": ""
            },
            {
                "TABLEAU DES PROVISIONS": "2. Provisions réglementées",
                "null": "-",
                "Exercice du : 01/01/2023 au 31/12/2023": ""
            },
            {
                "TABLEAU DES PROVISIONS": "3. Provisions durables pour risques\net charges",
                "null": "57.220.585,85",
                "Exercice du : 01/01/2023 au 31/12/2023": ""
            },
            {
                "TABLEAU DES PROVISIONS": "SOUS TOTAL (A)",
                "null": "64.712.212,34",
                "Exercice du : 01/01/2023 au 31/12/2023": ""
            },
            {
                "TABLEAU DES PROVISIONS": "4. Provisions pour dépréciation de\nl’actif circulant (hors trésorerie)",
                "null": "312.112.104,34",
                "Exercice du : 01/01/2023 au 31/12/2023": ""
            },
            {
                "TABLEAU DES PROVISIONS": "5. Autres provisions pour risques et\ncharges",
                "null": "28.259.004,97",
                "Exercice du : 01/01/2023 au 31/12/2023": ""
            },
            {
                "TABLEAU DES PROVISIONS": "6. Provisions pour dépréciation des\ncomptes de trésorerie",
                "null": "0,00",
                "Exercice du : 01/01/2023 au 31/12/2023": ""
            },
            {
                "TABLEAU DES PROVISIONS": "SOUS TOTAL (B)",
                "null": "340.371.109,31",
                "Exercice du : 01/01/2023 au 31/12/2023": ""
            },
            {
                "TABLEAU DES PROVISIONS": "TOTAL (A+B)",
                "null": "405.083.321,65",
                "Exercice du : 01/01/2023 au 31/12/2023": ""
            }
        ],
        [
            {
                "TABLEAU DES TITRES DE PARTICIPATION": "RAISON\nSOCIALE\nDE LA SOCIÉTÉ\nÉMETTRICE",
                "null": "PRODUITS\nINSCRITS AU\nC.P.C. DE\nL’EXERCICE",
                "EXERCICE DU 01/01/2023 AU 31/12/2023": "PRIX\nD’ACQUISITION\nGLOBAL"
            },
            {
                "TABLEAU DES TITRES DE PARTICIPATION": "",
                "null": "",
                "EXERCICE DU 01/01/2023 AU 31/12/2023": ""
            },
            {
                "TABLEAU DES TITRES DE PARTICIPATION": "",
                "null": "9",
                "EXERCICE DU 01/01/2023 AU 31/12/2023": "4"
            },
            {
                "TABLEAU DES TITRES DE PARTICIPATION": "LONGOMETAL\nARMATURE",
                "null": "",
                "EXERCICE DU 01/01/2023 AU 31/12/2023": "58.494.100,00"
            },
            {
                "TABLEAU DES TITRES DE PARTICIPATION": "TOTAL",
                "null": "",
                "EXERCICE DU 01/01/2023 AU 31/12/2023": "58.494.100,00"
            }
        ],
        [
            {
                "DETAIL DE LA TAXE SUR LA VALEUR AJOUTEE Exercice du : 01/01/2023 au 31/12/2023": "NATURE",
                "null": "SOLDE FIN\nD’EXERCICE\n(1+2–3) = 4"
            },
            {
                "DETAIL DE LA TAXE SUR LA VALEUR AJOUTEE Exercice du : 01/01/2023 au 31/12/2023": "A - T.V.A. FACTURÉE",
                "null": "267.341.409,21"
            },
            {
                "DETAIL DE LA TAXE SUR LA VALEUR AJOUTEE Exercice du : 01/01/2023 au 31/12/2023": "B- T.V.A. RÉCUPÉRABLE\n• Crédit antérieur",
                "null": "85.167.670,05\n0,00"
            },
            {
                "DETAIL DE LA TAXE SUR LA VALEUR AJOUTEE Exercice du : 01/01/2023 au 31/12/2023": "• sur charges",
                "null": "83.186.202,03"
            },
            {
                "DETAIL DE LA TAXE SUR LA VALEUR AJOUTEE Exercice du : 01/01/2023 au 31/12/2023": "• sur immobilisations",
                "null": "1.981.468,02"
            },
            {
                "DETAIL DE LA TAXE SUR LA VALEUR AJOUTEE Exercice du : 01/01/2023 au 31/12/2023": "C - T.V.A. DUE OU CRÉDIT DE T.V.A. = (A-B)",
                "null": "182.173.739,16"
            }
        ],
        [
            {
                "TABLEAU DES PLUS OU MOINS VALUES SUR CESSIONS RETRAITS D’IMMOBILISATION": "DATE DE CESSION OU DE RETRAIT",
                "null": "MOINS-VALUES",
                "Exercice du : 01/01/2023 au 31/12/2023": ""
            },
            {
                "TABLEAU DES PLUS OU MOINS VALUES SUR CESSIONS RETRAITS D’IMMOBILISATION": "Immobilisations Incorporelles",
                "null": "0,00",
                "Exercice du : 01/01/2023 au 31/12/2023": ""
            },
            {
                "TABLEAU DES PLUS OU MOINS VALUES SUR CESSIONS RETRAITS D’IMMOBILISATION": "",
                "null": "-",
                "Exercice du : 01/01/2023 au 31/12/2023": ""
            },
            {
                "TABLEAU DES PLUS OU MOINS VALUES SUR CESSIONS RETRAITS D’IMMOBILISATION": "",
                "null": "-",
                "Exercice du : 01/01/2023 au 31/12/2023": ""
            },
            {
                "TABLEAU DES PLUS OU MOINS VALUES SUR CESSIONS RETRAITS D’IMMOBILISATION": "NEANT",
                "null": "",
                "Exercice du : 01/01/2023 au 31/12/2023": ""
            },
            {
                "TABLEAU DES PLUS OU MOINS VALUES SUR CESSIONS RETRAITS D’IMMOBILISATION": "",
                "null": "-",
                "Exercice du : 01/01/2023 au 31/12/2023": ""
            },
            {
                "TABLEAU DES PLUS OU MOINS VALUES SUR CESSIONS RETRAITS D’IMMOBILISATION": "",
                "null": "-",
                "Exercice du : 01/01/2023 au 31/12/2023": ""
            },
            {
                "TABLEAU DES PLUS OU MOINS VALUES SUR CESSIONS RETRAITS D’IMMOBILISATION": "Immobilisations Corporelles",
                "null": "0,00",
                "Exercice du : 01/01/2023 au 31/12/2023": ""
            },
            {
                "TABLEAU DES PLUS OU MOINS VALUES SUR CESSIONS RETRAITS D’IMMOBILISATION": "30/06/2023",
                "null": "-",
                "Exercice du : 01/01/2023 au 31/12/2023": ""
            },
            {
                "TABLEAU DES PLUS OU MOINS VALUES SUR CESSIONS RETRAITS D’IMMOBILISATION": "",
                "null": "-",
                "Exercice du : 01/01/2023 au 31/12/2023": ""
            },
            {
                "TABLEAU DES PLUS OU MOINS VALUES SUR CESSIONS RETRAITS D’IMMOBILISATION": "",
                "null": "-",
                "Exercice du : 01/01/2023 au 31/12/2023": ""
            },
            {
                "TABLEAU DES PLUS OU MOINS VALUES SUR CESSIONS RETRAITS D’IMMOBILISATION": "",
                "null": "-",
                "Exercice du : 01/01/2023 au 31/12/2023": ""
            },
            {
                "TABLEAU DES PLUS OU MOINS VALUES SUR CESSIONS RETRAITS D’IMMOBILISATION": "Immobilisations Financières",
                "null": "0,00",
                "Exercice du : 01/01/2023 au 31/12/2023": ""
            },
            {
                "TABLEAU DES PLUS OU MOINS VALUES SUR CESSIONS RETRAITS D’IMMOBILISATION": "",
                "null": "-",
                "Exercice du : 01/01/2023 au 31/12/2023": ""
            },
            {
                "TABLEAU DES PLUS OU MOINS VALUES SUR CESSIONS RETRAITS D’IMMOBILISATION": "NEANT",
                "null": "",
                "Exercice du : 01/01/2023 au 31/12/2023": ""
            },
            {
                "TABLEAU DES PLUS OU MOINS VALUES SUR CESSIONS RETRAITS D’IMMOBILISATION": "",
                "null": "",
                "Exercice du : 01/01/2023 au 31/12/2023": ""
            },
            {
                "TABLEAU DES PLUS OU MOINS VALUES SUR CESSIONS RETRAITS D’IMMOBILISATION": "TOTAL",
                "null": "0,00",
                "Exercice du : 01/01/2023 au 31/12/2023": ""
            }
        ],
        [
            {
                "ETAT DE REPARTITION DU CAPITAL SOCIAL - MONTANT DU CAPITAL : 390 000 000DH": "Nom, prénom ou\nraison sociale des\nprincipaux associés\n1",
                "null": "",
                "Au : 31/12/2023": ""
            },
            {
                "ETAT DE REPARTITION DU CAPITAL SOCIAL - MONTANT DU CAPITAL : 390 000 000DH": "",
                "null": "LIBÉRÉ\n8",
                "Au : 31/12/2023": ""
            },
            {
                "ETAT DE REPARTITION DU CAPITAL SOCIAL - MONTANT DU CAPITAL : 390 000 000DH": "NOUVELLES SIDERURGIE\nINDUSTRIELLE",
                "null": "252.934.600,00",
                "Au : 31/12/2023": ""
            },
            {
                "ETAT DE REPARTITION DU CAPITAL SOCIAL - MONTANT DU CAPITAL : 390 000 000DH": "M GUY MOTAIS de NARBONNE",
                "null": "100,00",
                "Au : 31/12/2023": ""
            },
            {
                "ETAT DE REPARTITION DU CAPITAL SOCIAL - MONTANT DU CAPITAL : 390 000 000DH": "Mr. ARROUB MOHAMED\nRAMSES",
                "null": "100,00",
                "Au : 31/12/2023": ""
            },
            {
                "ETAT DE REPARTITION DU CAPITAL SOCIAL - MONTANT DU CAPITAL : 390 000 000DH": "M. Hassan BOUHEMOU",
                "null": "100,00",
                "Au : 31/12/2023": ""
            },
            {
                "ETAT DE REPARTITION DU CAPITAL SOCIAL - MONTANT DU CAPITAL : 390 000 000DH": "M. Jean Claude Gerardy",
                "null": "100,00",
                "Au : 31/12/2023": ""
            },
            {
                "ETAT DE REPARTITION DU CAPITAL SOCIAL - MONTANT DU CAPITAL : 390 000 000DH": "M. Richard COMFORT",
                "null": "100,00",
                "Au : 31/12/2023": ""
            },
            {
                "ETAT DE REPARTITION DU CAPITAL SOCIAL - MONTANT DU CAPITAL : 390 000 000DH": "M. Berold COSTA de BEAU-\nREGARD",
                "null": "100,00",
                "Au : 31/12/2023": ""
            },
            {
                "ETAT DE REPARTITION DU CAPITAL SOCIAL - MONTANT DU CAPITAL : 390 000 000DH": "Mr. LEFEVRE FRANCIS",
                "null": "100,00",
                "Au : 31/12/2023": ""
            },
            {
                "ETAT DE REPARTITION DU CAPITAL SOCIAL - MONTANT DU CAPITAL : 390 000 000DH": "Mr. GENEST PASCAL",
                "null": "100,00",
                "Au : 31/12/2023": ""
            },
            {
                "ETAT DE REPARTITION DU CAPITAL SOCIAL - MONTANT DU CAPITAL : 390 000 000DH": "M. Abdelouahab BEN SARI",
                "null": "100,00",
                "Au : 31/12/2023": ""
            },
            {
                "ETAT DE REPARTITION DU CAPITAL SOCIAL - MONTANT DU CAPITAL : 390 000 000DH": "Mr TAZI MOHAMED HAKIM",
                "null": "100,00",
                "Au : 31/12/2023": ""
            },
            {
                "ETAT DE REPARTITION DU CAPITAL SOCIAL - MONTANT DU CAPITAL : 390 000 000DH": "Mr,OURIAGLI HASSAN",
                "null": "100,00",
                "Au : 31/12/2023": ""
            },
            {
                "ETAT DE REPARTITION DU CAPITAL SOCIAL - MONTANT DU CAPITAL : 390 000 000DH": "Mr CEDRIC BOUZAR",
                "null": "100,00",
                "Au : 31/12/2023": ""
            },
            {
                "ETAT DE REPARTITION DU CAPITAL SOCIAL - MONTANT DU CAPITAL : 390 000 000DH": "M,HUGUES FAUVILLE",
                "null": "100,00",
                "Au : 31/12/2023": ""
            },
            {
                "ETAT DE REPARTITION DU CAPITAL SOCIAL - MONTANT DU CAPITAL : 390 000 000DH": "M,CHOLET VINCENT",
                "null": "100,00",
                "Au : 31/12/2023": ""
            },
            {
                "ETAT DE REPARTITION DU CAPITAL SOCIAL - MONTANT DU CAPITAL : 390 000 000DH": "ORDINI JEAN-PAUL",
                "null": "0,00",
                "Au : 31/12/2023": ""
            },
            {
                "ETAT DE REPARTITION DU CAPITAL SOCIAL - MONTANT DU CAPITAL : 390 000 000DH": "M. SAID EL HADI",
                "null": "100,00",
                "Au : 31/12/2023": ""
            },
            {
                "ETAT DE REPARTITION DU CAPITAL SOCIAL - MONTANT DU CAPITAL : 390 000 000DH": "M. Rachid Benyakhlef",
                "null": "100,00",
                "Au : 31/12/2023": ""
            },
            {
                "ETAT DE REPARTITION DU CAPITAL SOCIAL - MONTANT DU CAPITAL : 390 000 000DH": "CIMR",
                "null": "100,00",
                "Au : 31/12/2023": ""
            },
            {
                "ETAT DE REPARTITION DU CAPITAL SOCIAL - MONTANT DU CAPITAL : 390 000 000DH": "RMA WATANYA",
                "null": "100,00",
                "Au : 31/12/2023": ""
            },
            {
                "ETAT DE REPARTITION DU CAPITAL SOCIAL - MONTANT DU CAPITAL : 390 000 000DH": "MCMA",
                "null": "100,00",
                "Au : 31/12/2023": ""
            },
            {
                "ETAT DE REPARTITION DU CAPITAL SOCIAL - MONTANT DU CAPITAL : 390 000 000DH": "TAUD AYMAN",
                "null": "100,00",
                "Au : 31/12/2023": ""
            },
            {
                "ETAT DE REPARTITION DU CAPITAL SOCIAL - MONTANT DU CAPITAL : 390 000 000DH": "BOCK ANDRE MARIE\nFREDERIC",
                "null": "100,00",
                "Au : 31/12/2023": ""
            },
            {
                "ETAT DE REPARTITION DU CAPITAL SOCIAL - MONTANT DU CAPITAL : 390 000 000DH": "ATTIJARI WAFABANK",
                "null": "100,00",
                "Au : 31/12/2023": ""
            },
            {
                "ETAT DE REPARTITION DU CAPITAL SOCIAL - MONTANT DU CAPITAL : 390 000 000DH": "Mme. LOULIDI FARAH",
                "null": "100,00",
                "Au : 31/12/2023": ""
            },
            {
                "ETAT DE REPARTITION DU CAPITAL SOCIAL - MONTANT DU CAPITAL : 390 000 000DH": "Mr. LE GOUIC VINCENT",
                "null": "100,00",
                "Au : 31/12/2023": ""
            },
            {
                "ETAT DE REPARTITION DU CAPITAL SOCIAL - MONTANT DU CAPITAL : 390 000 000DH": "Mr. SERRA CALLEJO JAVIER",
                "null": "100,00",
                "Au : 31/12/2023": ""
            },
            {
                "ETAT DE REPARTITION DU CAPITAL SOCIAL - MONTANT DU CAPITAL : 390 000 000DH": "M,QUINKE CHRISTIAN",
                "null": "100,00",
                "Au : 31/12/2023": ""
            },
            {
                "ETAT DE REPARTITION DU CAPITAL SOCIAL - MONTANT DU CAPITAL : 390 000 000DH": "SANAA BAKKAL",
                "null": "100,00",
                "Au : 31/12/2023": ""
            },
            {
                "ETAT DE REPARTITION DU CAPITAL SOCIAL - MONTANT DU CAPITAL : 390 000 000DH": "MAKRAM TARIQ",
                "null": "100,00",
                "Au : 31/12/2023": ""
            },
            {
                "ETAT DE REPARTITION DU CAPITAL SOCIAL - MONTANT DU CAPITAL : 390 000 000DH": "Mr. TETTEROO PAUL",
                "null": "100,00",
                "Au : 31/12/2023": ""
            },
            {
                "ETAT DE REPARTITION DU CAPITAL SOCIAL - MONTANT DU CAPITAL : 390 000 000DH": "ERIC NIEDZELA\nActions au Porteurs",
                "null": "100,00\n137.062.400,00",
                "Au : 31/12/2023": ""
            },
            {
                "ETAT DE REPARTITION DU CAPITAL SOCIAL - MONTANT DU CAPITAL : 390 000 000DH": "ACTIONS AU PORTEURS",
                "null": "390 000 000",
                "Au : 31/12/2023": ""
            }
        ],
        [
            {
                "ETAT D’AFFECTATION DES RESULTATS INTERVENUE AU COURS DE L’EXERCICE Au : 31/12/2023": "A. ORIGINE DES RÉSULTATS A AFFECTER\nDécision AGO du 08 juin 2021",
                "null": "MONTANT"
            },
            {
                "ETAT D’AFFECTATION DES RESULTATS INTERVENUE AU COURS DE L’EXERCICE Au : 31/12/2023": "• Report à nouveau\n• Résultats nets en instance d'affectation",
                "null": "-"
            },
            {
                "ETAT D’AFFECTATION DES RESULTATS INTERVENUE AU COURS DE L’EXERCICE Au : 31/12/2023": "",
                "null": "-"
            },
            {
                "ETAT D’AFFECTATION DES RESULTATS INTERVENUE AU COURS DE L’EXERCICE Au : 31/12/2023": "• Résultat net de l’exercice 2013",
                "null": "-\n117.000.000,00"
            },
            {
                "ETAT D’AFFECTATION DES RESULTATS INTERVENUE AU COURS DE L’EXERCICE Au : 31/12/2023": "• Prélèvements sur les réserves",
                "null": ""
            },
            {
                "ETAT D’AFFECTATION DES RESULTATS INTERVENUE AU COURS DE L’EXERCICE Au : 31/12/2023": "• Autres prélèvements",
                "null": "0,00"
            },
            {
                "ETAT D’AFFECTATION DES RESULTATS INTERVENUE AU COURS DE L’EXERCICE Au : 31/12/2023": "",
                "null": "5.845.248,88"
            },
            {
                "ETAT D’AFFECTATION DES RESULTATS INTERVENUE AU COURS DE L’EXERCICE Au : 31/12/2023": "TOTAL A",
                "null": "122.845.248,88"
            }
        ],
        [
            {
                "TABLEAU DES OPÉRATIONS EN DEVISES COMPTABILISÉES PENDANT L’EXERCICE": "NATURE",
                "Au : 31/12/2023": "",
                "null": "SORTIE CONTRE-VALEUR\nEN DH"
            },
            {
                "TABLEAU DES OPÉRATIONS EN DEVISES COMPTABILISÉES PENDANT L’EXERCICE": "• Financement permanent",
                "Au : 31/12/2023": "",
                "null": "-"
            },
            {
                "TABLEAU DES OPÉRATIONS EN DEVISES COMPTABILISÉES PENDANT L’EXERCICE": "• Immobilisations brutes",
                "Au : 31/12/2023": "",
                "null": "107.423.687,57"
            },
            {
                "TABLEAU DES OPÉRATIONS EN DEVISES COMPTABILISÉES PENDANT L’EXERCICE": "• Rentrées sur immobilisations",
                "Au : 31/12/2023": "",
                "null": "-"
            },
            {
                "TABLEAU DES OPÉRATIONS EN DEVISES COMPTABILISÉES PENDANT L’EXERCICE": "• Remboursement des dettes de financement",
                "Au : 31/12/2023": "",
                "null": "-"
            },
            {
                "TABLEAU DES OPÉRATIONS EN DEVISES COMPTABILISÉES PENDANT L’EXERCICE": "• Produits",
                "Au : 31/12/2023": "",
                "null": "-"
            },
            {
                "TABLEAU DES OPÉRATIONS EN DEVISES COMPTABILISÉES PENDANT L’EXERCICE": "• Charges",
                "Au : 31/12/2023": "",
                "null": "2.833.277.405,55"
            },
            {
                "TABLEAU DES OPÉRATIONS EN DEVISES COMPTABILISÉES PENDANT L’EXERCICE": "TOTAL DES ENTREES",
                "Au : 31/12/2023": "",
                "null": "-"
            },
            {
                "TABLEAU DES OPÉRATIONS EN DEVISES COMPTABILISÉES PENDANT L’EXERCICE": "TOTAL DES SORTIES",
                "Au : 31/12/2023": "",
                "null": "2.940.701.093,12"
            },
            {
                "TABLEAU DES OPÉRATIONS EN DEVISES COMPTABILISÉES PENDANT L’EXERCICE": "BALANCE DEVISES",
                "Au : 31/12/2023": "",
                "null": "-"
            },
            {
                "TABLEAU DES OPÉRATIONS EN DEVISES COMPTABILISÉES PENDANT L’EXERCICE": "TOTAL",
                "Au : 31/12/2023": "",
                "null": "2.940.701.093,12"
            }
        ],
        [
            {
                "ETAT DES CHANGEMENTS DE METHODES": "NATURE DES CHANGEMENTS",
                "Au : 31/12/2023": "",
                "null": "INFLUENCE SUR LE PATRIMOINE,\nLA SITUATION FINANCIERE ET\nLES RESULTATS."
            },
            {
                "ETAT DES CHANGEMENTS DE METHODES": "I. Changements affectant les méthodes d’évaluation",
                "Au : 31/12/2023": "",
                "null": "NEANT"
            },
            {
                "ETAT DES CHANGEMENTS DE METHODES": "II. Changements affectant les règles de présentation",
                "Au : 31/12/2023": "",
                "null": "NEANT"
            }
        ],
        [
            {
                "TABLEAU DE FINANCEMENT DE L’EXERCICE (modèle normal) Exercice du : 01/01/2023 au 31/12/2023": "I. SYNTHESE DES MASSES DU BILAN",
                "null": ""
            },
            {
                "TABLEAU DE FINANCEMENT DE L’EXERCICE (modèle normal) Exercice du : 01/01/2023 au 31/12/2023": "MASSES",
                "null": ""
            },
            {
                "TABLEAU DE FINANCEMENT DE L’EXERCICE (modèle normal) Exercice du : 01/01/2023 au 31/12/2023": "",
                "null": "Ressources\nd"
            },
            {
                "TABLEAU DE FINANCEMENT DE L’EXERCICE (modèle normal) Exercice du : 01/01/2023 au 31/12/2023": "1",
                "null": "0,00"
            },
            {
                "TABLEAU DE FINANCEMENT DE L’EXERCICE (modèle normal) Exercice du : 01/01/2023 au 31/12/2023": "2",
                "null": "0,00"
            },
            {
                "TABLEAU DE FINANCEMENT DE L’EXERCICE (modèle normal) Exercice du : 01/01/2023 au 31/12/2023": "3",
                "null": "0,00"
            },
            {
                "TABLEAU DE FINANCEMENT DE L’EXERCICE (modèle normal) Exercice du : 01/01/2023 au 31/12/2023": "4",
                "null": "34.995.913,15"
            },
            {
                "TABLEAU DE FINANCEMENT DE L’EXERCICE (modèle normal) Exercice du : 01/01/2023 au 31/12/2023": "5",
                "null": "350.242.747,44"
            },
            {
                "TABLEAU DE FINANCEMENT DE L’EXERCICE (modèle normal) Exercice du : 01/01/2023 au 31/12/2023": "6",
                "null": "385.238.660,59"
            },
            {
                "TABLEAU DE FINANCEMENT DE L’EXERCICE (modèle normal) Exercice du : 01/01/2023 au 31/12/2023": "7",
                "null": "0,00"
            }
        ],
        [
            {
                "ETAT DES DEROGATIONS": "INDICATION DES DEROGATIONS",
                "Au : 31/12/2023": "",
                "null": "INFLUENCE DES DEROGATIONS SUR\nLE PATRIMOINE, LA SITUATION\nFINANCIERE ET LES RESULTATS."
            },
            {
                "ETAT DES DEROGATIONS": "I. Dérogations aux principes comptables fondamentaux",
                "Au : 31/12/2023": "",
                "null": "NEANT"
            },
            {
                "ETAT DES DEROGATIONS": "II. Dérogations aux méthodes d’évaluation",
                "Au : 31/12/2023": "",
                "null": "NEANT"
            },
            {
                "ETAT DES DEROGATIONS": "III. Dérogations aux règles d’établissement et de présentation\ndes états de synthèse",
                "Au : 31/12/2023": "",
                "null": "NEANT"
            }
        ],
        [
            {
                "II. EMPLOIS ET RESSOURCES": "",
                "null": ""
            },
            {
                "II. EMPLOIS ET RESSOURCES": "",
                "null": "RESSOURCES"
            },
            {
                "II. EMPLOIS ET RESSOURCES": "I. RESSOURCES STABLES DE L’EXERCICE (FLUX)",
                "null": ""
            },
            {
                "II. EMPLOIS ET RESSOURCES": "• AUTOFINANCEMENT",
                "null": "203.213.556,81"
            },
            {
                "II. EMPLOIS ET RESSOURCES": "• Capacité d'autofinancement",
                "null": "203.213.556,81"
            },
            {
                "II. EMPLOIS ET RESSOURCES": "• Distributions de bénéfices",
                "null": "0,00"
            },
            {
                "II. EMPLOIS ET RESSOURCES": "• CESSIONS ET REDUCTIONS D’IMMOBILISATIONS",
                "null": "0,00"
            },
            {
                "II. EMPLOIS ET RESSOURCES": "• Cession d'immobilisations incorporelles",
                "null": "0,00"
            },
            {
                "II. EMPLOIS ET RESSOURCES": "• Cession d'immobilisations corporelles",
                "null": "0,00"
            },
            {
                "II. EMPLOIS ET RESSOURCES": "• Cession d'immobilisations financières",
                "null": "0,00"
            },
            {
                "II. EMPLOIS ET RESSOURCES": "• Récupération sur créances immobilisées",
                "null": "0,00"
            },
            {
                "II. EMPLOIS ET RESSOURCES": "• AUGMENTATION DES CAPITAUX PROPRES ET ASSIMILES",
                "null": "0,00"
            },
            {
                "II. EMPLOIS ET RESSOURCES": "• Augmentations de capital, apports",
                "null": "0,00"
            },
            {
                "II. EMPLOIS ET RESSOURCES": "• Subventions d’investissement",
                "null": "0,00"
            },
            {
                "II. EMPLOIS ET RESSOURCES": "• AUGMENTATION DES DETTES DE FINANCEMENT",
                "null": "0,00"
            },
            {
                "II. EMPLOIS ET RESSOURCES": "(nettes de primes de remboursement)",
                "null": "0,00"
            },
            {
                "II. EMPLOIS ET RESSOURCES": "TOTAL I - RESSOURCES STABLES (A+B+C+D)",
                "null": "55.013.556,81"
            },
            {
                "II. EMPLOIS ET RESSOURCES": "II. EMPLOIS STABLES DE L’EXERCICE (FLUX)",
                "null": "0"
            },
            {
                "II. EMPLOIS ET RESSOURCES": "• ACQUISITIONS D’IMMOBILISATIONS",
                "null": "0,00"
            },
            {
                "II. EMPLOIS ET RESSOURCES": "• Acquisitions d'immobilisations incorporelles",
                "null": "0"
            },
            {
                "II. EMPLOIS ET RESSOURCES": "• Acquisitions d'immobilisations corporelles",
                "null": "0"
            },
            {
                "II. EMPLOIS ET RESSOURCES": "• Acquisitions d'immobilisations financières",
                "null": "0,00"
            },
            {
                "II. EMPLOIS ET RESSOURCES": "• Augmentations des créances immobilisées",
                "null": "0,00"
            },
            {
                "II. EMPLOIS ET RESSOURCES": "• REMBOURSEMENT DES CAPITAUX PROPRES",
                "null": "-"
            },
            {
                "II. EMPLOIS ET RESSOURCES": "• REMBOURSEMENT DES DETTES DE FINANCEMENT",
                "null": "-"
            },
            {
                "II. EMPLOIS ET RESSOURCES": "• EMPLOIS EN NON-VALEURS",
                "null": "-"
            },
            {
                "II. EMPLOIS ET RESSOURCES": "TOTAL II - EMPLOIS STABLES (E+F+G+H)",
                "null": "0"
            },
            {
                "II. EMPLOIS ET RESSOURCES": "III. VARIATION DU BESOIN DE FINANCEMENT GLOBAL\n(B.F.G.)",
                "null": "64.194.377,73"
            },
            {
                "II. EMPLOIS ET RESSOURCES": "IV. VARIATION DE LA TRESORERIE",
                "null": "64.194.377,73"
            },
            {
                "II. EMPLOIS ET RESSOURCES": "TOTAL GENERAL",
                "null": "136.006.761,72"
            }
        ],
        [
            {
                "DETAIL DES NON-VALEURS": "COMPTE PRINCIPAL",
                "null": "MONTANT"
            },
            {
                "DETAIL DES NON-VALEURS": "211",
                "null": "TNAEN"
            },
            {
                "DETAIL DES NON-VALEURS": "2112",
                "null": ""
            },
            {
                "DETAIL DES NON-VALEURS": "2113",
                "null": ""
            },
            {
                "DETAIL DES NON-VALEURS": "2114",
                "null": ""
            },
            {
                "DETAIL DES NON-VALEURS": "2116",
                "null": ""
            },
            {
                "DETAIL DES NON-VALEURS": "2117",
                "null": ""
            },
            {
                "DETAIL DES NON-VALEURS": "2118",
                "null": ""
            },
            {
                "DETAIL DES NON-VALEURS": "212",
                "null": ""
            },
            {
                "DETAIL DES NON-VALEURS": "21210000",
                "null": ""
            },
            {
                "DETAIL DES NON-VALEURS": "21210000",
                "null": ""
            },
            {
                "DETAIL DES NON-VALEURS": "21210000",
                "null": ""
            },
            {
                "DETAIL DES NON-VALEURS": "21210000",
                "null": ""
            },
            {
                "DETAIL DES NON-VALEURS": "21210000",
                "null": ""
            },
            {
                "DETAIL DES NON-VALEURS": "21210000",
                "null": ""
            },
            {
                "DETAIL DES NON-VALEURS": "213",
                "null": ""
            },
            {
                "DETAIL DES NON-VALEURS": "2130",
                "null": ""
            },
            {
                "DETAIL DES NON-VALEURS": "",
                "null": ""
            }
        ],
        [
            {
                "INDICATION DES METHODES D’EVALUATION APPLIQUEES PAR L’ENTREPRISE": "Ne sont reprises ci-dessous que les méthodes propres à la Société.",
                "null": ""
            },
            {
                "INDICATION DES METHODES D’EVALUATION APPLIQUEES PAR L’ENTREPRISE": "I. ACTIF IMMOBILISE",
                "null": ""
            },
            {
                "INDICATION DES METHODES D’EVALUATION APPLIQUEES PAR L’ENTREPRISE": "A. EVALUATION DE L’ENTREPRISE",
                "null": ""
            },
            {
                "INDICATION DES METHODES D’EVALUATION APPLIQUEES PAR L’ENTREPRISE": "1. Immobilisations en non-valeurs",
                "null": "au coût réel suivant facture ou contrat"
            },
            {
                "INDICATION DES METHODES D’EVALUATION APPLIQUEES PAR L’ENTREPRISE": "2. Immobilisations incorporelles",
                "null": "au coût réel suivant facture ou contrat"
            },
            {
                "INDICATION DES METHODES D’EVALUATION APPLIQUEES PAR L’ENTREPRISE": "3. Immobilisations corporelles",
                "null": "au coût réel suivant facture ou contrat"
            },
            {
                "INDICATION DES METHODES D’EVALUATION APPLIQUEES PAR L’ENTREPRISE": "4. Immobilisations financières",
                "null": "au prix d'aquisition"
            },
            {
                "INDICATION DES METHODES D’EVALUATION APPLIQUEES PAR L’ENTREPRISE": "B. CORRECTIONS DE VALEUR",
                "null": ""
            },
            {
                "INDICATION DES METHODES D’EVALUATION APPLIQUEES PAR L’ENTREPRISE": "1. Méthodes d’amortissements",
                "null": "linéaire suivant taux d’usage généralement admis"
            },
            {
                "INDICATION DES METHODES D’EVALUATION APPLIQUEES PAR L’ENTREPRISE": "2. Méthodes d’évaluation des provisions pour dépréciation",
                "null": "matériel obsolète: suivant valeur d’usage\ntitres de participation: suivant situation nette de la société concernée"
            },
            {
                "INDICATION DES METHODES D’EVALUATION APPLIQUEES PAR L’ENTREPRISE": "3. Méthodes de détermination des écarts de conversion - Actif",
                "null": "Différence entre le cours historique et le cours de clôture"
            },
            {
                "INDICATION DES METHODES D’EVALUATION APPLIQUEES PAR L’ENTREPRISE": "II. ACTIF CIRCULANT (Hors trésorerie)",
                "null": ""
            },
            {
                "INDICATION DES METHODES D’EVALUATION APPLIQUEES PAR L’ENTREPRISE": "A. EVALUATION A L’ENTREE",
                "null": ""
            },
            {
                "INDICATION DES METHODES D’EVALUATION APPLIQUEES PAR L’ENTREPRISE": "1. Stocks",
                "null": "Marchandises et matières premières: coût d’achat comprenant les\nfrais d’approche et n’incluant pas les charges indirectes et les frais\nfinanciers selon la méthode du PRMP mensuel"
            },
            {
                "INDICATION DES METHODES D’EVALUATION APPLIQUEES PAR L’ENTREPRISE": "2. Créances",
                "null": "Produits finis:coût direct de production n’incluant pas les frais\nfinanciers selon la méthode du PRMP mensuel.\ncoût réel (sur facture)"
            },
            {
                "INDICATION DES METHODES D’EVALUATION APPLIQUEES PAR L’ENTREPRISE": "3. Titres et valeurs de placement",
                "null": "prix d’acquisition"
            },
            {
                "INDICATION DES METHODES D’EVALUATION APPLIQUEES PAR L’ENTREPRISE": "B. CORRECTIONS DE VALEUR",
                "null": ""
            },
            {
                "INDICATION DES METHODES D’EVALUATION APPLIQUEES PAR L’ENTREPRISE": "1. Méthodes d’évaluation des provisions pour dépréciation",
                "null": "stock pièces de rechange : Un inventaire Qualitatif + Une Provision statistique pour\nrotation longue du stock, en dehor des articles stratégique:\n{1 - 2} : Provision = 25% x Valeur du stock à la clôture\n{2 - 3} : Provision = 50% x Valeur du stock à la clôture\n{3 - 4} : Provision = 75% x Valeur du stock à la clôture\n4 et Plus: Provision = Valeur du stock à la clôture\nstock Matière et Produit Finis : Un inventaire Qualitatif\ncréances : suivant dégré d’insolvabilité au cas par cas"
            },
            {
                "INDICATION DES METHODES D’EVALUATION APPLIQUEES PAR L’ENTREPRISE": "2. Méthodes de détermination des écarts de conversion - Actif",
                "null": "Différence entre le cours historique et le cours de clôture"
            }
        ],
        [
            {
                "TABLEAU DES CREANCES": "CREANCES",
                "null": "",
                "Au : 31/12/2023": ""
            },
            {
                "TABLEAU DES CREANCES": "",
                "null": "MONTANTS\nREPRÉSENTÉS\nPAR EFFETS",
                "Au : 31/12/2023": ""
            },
            {
                "TABLEAU DES CREANCES": "DE L’ACTIF IMMOBILISÉ",
                "null": "-",
                "Au : 31/12/2023": ""
            },
            {
                "TABLEAU DES CREANCES": "• Prêts immobilisés",
                "null": "0,00",
                "Au : 31/12/2023": ""
            },
            {
                "TABLEAU DES CREANCES": "• Autres créances financières",
                "null": "0,00",
                "Au : 31/12/2023": ""
            },
            {
                "TABLEAU DES CREANCES": "DE L’ACTIF CIRCULANT",
                "null": "-",
                "Au : 31/12/2023": ""
            },
            {
                "TABLEAU DES CREANCES": "• Fournisseurs débiteurs,\navances et acomptes",
                "null": "-",
                "Au : 31/12/2023": ""
            },
            {
                "TABLEAU DES CREANCES": "• Clients et comptes rattachés",
                "null": "-",
                "Au : 31/12/2023": ""
            },
            {
                "TABLEAU DES CREANCES": "• Personnel",
                "null": "-",
                "Au : 31/12/2023": ""
            },
            {
                "TABLEAU DES CREANCES": "• Etat",
                "null": "-",
                "Au : 31/12/2023": ""
            },
            {
                "TABLEAU DES CREANCES": "• Comptes d'associés",
                "null": "-",
                "Au : 31/12/2023": ""
            },
            {
                "TABLEAU DES CREANCES": "• Autres débiteurs",
                "null": "-",
                "Au : 31/12/2023": ""
            },
            {
                "TABLEAU DES CREANCES": "• Comptes de régularisation-Actif",
                "null": "-",
                "Au : 31/12/2023": ""
            }
        ],
        [
            {
                "III. FINANCEMENT PERMANENT": "1. Méthodes de réévaluation",
                "null": "Néant"
            },
            {
                "III. FINANCEMENT PERMANENT": "2. Méthodes d’évaluation des provisions réglementées",
                "null": "amortissement dégressif selon la réglementation fiscale"
            },
            {
                "III. FINANCEMENT PERMANENT": "3. Dettes de financement permanent",
                "null": "Montant octroyé par la banque suivant contrat"
            },
            {
                "III. FINANCEMENT PERMANENT": "4. Méthodes d’évaluation des provisions durables pour risques et charges",
                "null": "selon l’estimation à la fin de l’exercice des charges à payer"
            },
            {
                "III. FINANCEMENT PERMANENT": "5. Méthodes de détermination des écarts de conversion - Passif",
                "null": "différence entre le cours historique et le cours de clôture"
            },
            {
                "III. FINANCEMENT PERMANENT": "IV. PASSIF CIRCULANT (Hors trésorerie)",
                "null": ""
            },
            {
                "III. FINANCEMENT PERMANENT": "1. Dettes du passif circulant",
                "null": "coût réel selon facture ou contrat\nconversion des dettes en devises au cours négocié ou de clôture à la fin de\nl’exercice"
            },
            {
                "III. FINANCEMENT PERMANENT": "2. Méthodes d’évaluation des autres provisions pour risques et charges",
                "null": ""
            },
            {
                "III. FINANCEMENT PERMANENT": "3. Méthodes de détermination des écarts de conversion - Passsif",
                "null": "différence entre le cours historique et le cours de clôture"
            },
            {
                "III. FINANCEMENT PERMANENT": "V. TRESORERIE",
                "null": ""
            },
            {
                "III. FINANCEMENT PERMANENT": "1. Trésorerie - Actif",
                "null": "suivant pièces bancaires"
            },
            {
                "III. FINANCEMENT PERMANENT": "2. Trésorerie - Passif",
                "null": "suivant pièces bancaires"
            },
            {
                "III. FINANCEMENT PERMANENT": "3. Méthodes d’évaluation des provisions pour dépréciation",
                "null": ""
            }
        ],
        [
            {
                "TABLEAU DES DETTES": "DETTES",
                "null": "",
                "Au : 31/12/2023": ""
            },
            {
                "TABLEAU DES DETTES": "",
                "null": "MONTANTS\nREPRÉSENTÉS PAR\nEFFETS",
                "Au : 31/12/2023": "ECHUES ET NON\nPAYÉES"
            },
            {
                "TABLEAU DES DETTES": "DE FINANCEMENT",
                "null": "",
                "Au : 31/12/2023": ""
            },
            {
                "TABLEAU DES DETTES": "• Prêts immobilisés",
                "null": "-",
                "Au : 31/12/2023": "-"
            },
            {
                "TABLEAU DES DETTES": "• Autres créances financières",
                "null": "-",
                "Au : 31/12/2023": "-"
            },
            {
                "TABLEAU DES DETTES": "DU PASSIF CIRCULANT",
                "null": "-",
                "Au : 31/12/2023": "-"
            },
            {
                "TABLEAU DES DETTES": "• Fournisseurs et comptes rattachés",
                "null": "-",
                "Au : 31/12/2023": "-"
            },
            {
                "TABLEAU DES DETTES": "• Clients créditeurs, avances et acomptes",
                "null": "-",
                "Au : 31/12/2023": "-"
            },
            {
                "TABLEAU DES DETTES": "• Personnel",
                "null": "-",
                "Au : 31/12/2023": "-"
            },
            {
                "TABLEAU DES DETTES": "• Organismes sociaux",
                "null": "-",
                "Au : 31/12/2023": "-"
            },
            {
                "TABLEAU DES DETTES": "• Etat",
                "null": "-",
                "Au : 31/12/2023": "-"
            },
            {
                "TABLEAU DES DETTES": "• Comptes d'associés",
                "null": "-",
                "Au : 31/12/2023": "-"
            },
            {
                "TABLEAU DES DETTES": "• Autres créanciers",
                "null": "-",
                "Au : 31/12/2023": "-"
            },
            {
                "TABLEAU DES DETTES": "• Comptes de régularisation - Passif",
                "null": "-",
                "Au : 31/12/2023": "-"
            }
        ],
        [
            {
                "ETAT DU RÉSULTAT GLOBAL CONSOLIDÉ": "",
                "EN MILLIIERS DE MAD": "2023.12",
                "null": "2022.12"
            },
            {
                "ETAT DU RÉSULTAT GLOBAL CONSOLIDÉ": "EXERCICES DU 1ER JANVIER AU 31 DÉCEMBRE",
                "EN MILLIIERS DE MAD": "",
                "null": ""
            },
            {
                "ETAT DU RÉSULTAT GLOBAL CONSOLIDÉ": "RÉSULTAT DE L’EXERCICE",
                "EN MILLIIERS DE MAD": "65.251",
                "null": "86.147"
            },
            {
                "ETAT DU RÉSULTAT GLOBAL CONSOLIDÉ": "• Autres éléments du résultat global (bruts d’impôts)",
                "EN MILLIIERS DE MAD": "-",
                "null": "-"
            },
            {
                "ETAT DU RÉSULTAT GLOBAL CONSOLIDÉ": "• Ecart de conversion des activités à l'étranger",
                "EN MILLIIERS DE MAD": "-",
                "null": "-"
            },
            {
                "ETAT DU RÉSULTAT GLOBAL CONSOLIDÉ": "• Pertes et profits relatifs à la réévaluation des Actifs financiers disponibles à la vente",
                "EN MILLIIERS DE MAD": "-",
                "null": "-"
            },
            {
                "ETAT DU RÉSULTAT GLOBAL CONSOLIDÉ": "• Partie efficace des produits ou pertes sur instruments de couverture de flux\nde trésorerie",
                "EN MILLIIERS DE MAD": "-",
                "null": "-"
            },
            {
                "ETAT DU RÉSULTAT GLOBAL CONSOLIDÉ": "• Variation de la réserve de réévaluation des immobilisations",
                "EN MILLIIERS DE MAD": "-",
                "null": "-"
            },
            {
                "ETAT DU RÉSULTAT GLOBAL CONSOLIDÉ": "• Ecarts actuariels sur les obligations des régimes à prestations définies",
                "EN MILLIIERS DE MAD": "30.218",
                "null": "28.765"
            },
            {
                "ETAT DU RÉSULTAT GLOBAL CONSOLIDÉ": "• Impôt sur le résultat sur les autres éléments du résultat global",
                "EN MILLIIERS DE MAD": "-9.490",
                "null": "-8.917"
            },
            {
                "ETAT DU RÉSULTAT GLOBAL CONSOLIDÉ": "• Quote Part des autres éléments du résultat global dans les entreprises associées",
                "EN MILLIIERS DE MAD": "20.728",
                "null": "19.848"
            },
            {
                "ETAT DU RÉSULTAT GLOBAL CONSOLIDÉ": "• Autres éléments du résultat global nets d'impôts",
                "EN MILLIIERS DE MAD": "20.728",
                "null": "19.848"
            },
            {
                "ETAT DU RÉSULTAT GLOBAL CONSOLIDÉ": "RESULTAT GLOBAL TOTAL DE L›ANNEE",
                "EN MILLIIERS DE MAD": "85.979",
                "null": "105.995"
            },
            {
                "ETAT DU RÉSULTAT GLOBAL CONSOLIDÉ": "DONT INTÉRÊTS MINORITAIRES",
                "EN MILLIIERS DE MAD": "267",
                "null": "274"
            },
            {
                "ETAT DU RÉSULTAT GLOBAL CONSOLIDÉ": "RÉSULTAT NET - PART DU GROUPE",
                "EN MILLIIERS DE MAD": "85.712",
                "null": "105.721"
            }
        ],
        [
            {
                "KMAD": "• Chiffre d'affaires",
                "2023.12": "4.995.795",
                "2022.12": "4.888.161",
                "Variation": "2%"
            },
            {
                "KMAD": "• Autres produits de l'activité",
                "2023.12": "-112.448",
                "2022.12": "236.270",
                "Variation": "-148%"
            },
            {
                "KMAD": "Produits des activités ordinaires",
                "2023.12": "4.883.347",
                "2022.12": "5.124.431",
                "Variation": "-5%"
            },
            {
                "KMAD": "• Achats",
                "2023.12": "-4.082.092",
                "2022.12": "-4.282.473",
                "Variation": "-5%"
            },
            {
                "KMAD": "• Autres charges externes",
                "2023.12": "-301.377",
                "2022.12": "-293.456",
                "Variation": "3%"
            },
            {
                "KMAD": "• Frais de personnel",
                "2023.12": "-213.949",
                "2022.12": "-185.364",
                "Variation": "15%"
            },
            {
                "KMAD": "• Impôts et taxes",
                "2023.12": "-63.044",
                "2022.12": "-57.704",
                "Variation": "9%"
            },
            {
                "KMAD": "• Amortissements et provisions d'exploitation",
                "2023.12": "-136.648",
                "2022.12": "-155.687",
                "Variation": "-12%"
            },
            {
                "KMAD": "• Autres produits et charges d'exploitation",
                "2023.12": "30.704",
                "2022.12": "13.046",
                "Variation": "135%"
            },
            {
                "KMAD": "Charges d'exploitation courantes",
                "2023.12": "-4.766.406",
                "2022.12": "-4.961.638",
                "Variation": "-4%"
            },
            {
                "KMAD": "Résultat d'exploitation courant",
                "2023.12": "116.941",
                "2022.12": "162.793",
                "Variation": "-28%"
            },
            {
                "KMAD": "• Cessions d'actifs",
                "2023.12": "475",
                "2022.12": "-77",
                "Variation": "-717%"
            },
            {
                "KMAD": "• Résultats sur instruments financiers",
                "2023.12": "-14.484",
                "2022.12": "22.780",
                "Variation": "-164%"
            },
            {
                "KMAD": "• Autres produits et charges d'exploitation non courants",
                "2023.12": "2.240",
                "2022.12": "237",
                "Variation": "845%"
            },
            {
                "KMAD": "Autres produits et charges d'exploitation",
                "2023.12": "-11.769",
                "2022.12": "22.940",
                "Variation": "-151%"
            },
            {
                "KMAD": "Résultat des activités opérationnelles",
                "2023.12": "105.172",
                "2022.12": "185.733",
                "Variation": "-43%"
            },
            {
                "KMAD": "• Produits d'intérêts",
                "2023.12": "10.778",
                "2022.12": "14.657",
                "Variation": "-26%"
            },
            {
                "KMAD": "• Charges d'intérêts",
                "2023.12": "-34.302",
                "2022.12": "-12.550",
                "Variation": "173%"
            },
            {
                "KMAD": "• Autres produits et charges financiers",
                "2023.12": "11.412",
                "2022.12": "-35.933",
                "Variation": "-132%"
            },
            {
                "KMAD": "Résultat financier",
                "2023.12": "-12.112",
                "2022.12": "-33.826",
                "Variation": "-64%"
            },
            {
                "KMAD": "Résultat avant impôts des entreprises intégrées",
                "2023.12": "93.060",
                "2022.12": "151.907",
                "Variation": "-39%"
            },
            {
                "KMAD": "• Impôts sur les bénéfices",
                "2023.12": "-41.891",
                "2022.12": "-64.510",
                "Variation": "-35%"
            },
            {
                "KMAD": "• Impôts différés",
                "2023.12": "14.082",
                "2022.12": "-1.250",
                "Variation": "-1227%"
            },
            {
                "KMAD": "Résultat net des entreprises intégrées",
                "2023.12": "65.251",
                "2022.12": "86.147",
                "Variation": "-24%"
            },
            {
                "KMAD": "• Intérêts minoritaires",
                "2023.12": "174",
                "2022.12": "217",
                "Variation": "-20%"
            },
            {
                "KMAD": "Résultat net - Part du groupe",
                "2023.12": "65.077",
                "2022.12": "85.930",
                "Variation": "-24%"
            }
        ],
        [
            {
                "Résultat net par action en dirhams": "- de base",
                "16,69": "16,69",
                "22,03": "22,03"
            },
            {
                "Résultat net par action en dirhams": "- dilué",
                "16,69": "16,69",
                "22,03": "22,03"
            },
            {
                "Résultat net par action en dirhams": "Résultat net par action des activités poursuivies en dirhams",
                "16,69": "16,69",
                "22,03": "22,03"
            },
            {
                "Résultat net par action en dirhams": "- de base",
                "16,69": "16,69",
                "22,03": "22,03"
            },
            {
                "Résultat net par action en dirhams": "- dilué",
                "16,69": "16,69",
                "22,03": "22,03"
            }
        ],
        [
            {
                "VARIATION DES CAPITAUX PROPRES CONSOLIDÉS": "En KMAD",
                "null": "TOTAL"
            },
            {
                "VARIATION DES CAPITAUX PROPRES CONSOLIDÉS": "Situation à la clôture de l'exercice\n2021.12",
                "null": "1.890.135"
            },
            {
                "VARIATION DES CAPITAUX PROPRES CONSOLIDÉS": "• Affectation du résultat de\nl'exercice N-1",
                "null": "-"
            },
            {
                "VARIATION DES CAPITAUX PROPRES CONSOLIDÉS": "• Dividendes versés",
                "null": "-148.200"
            },
            {
                "VARIATION DES CAPITAUX PROPRES CONSOLIDÉS": "• Changement de méthodes\ncomptables",
                "null": "-"
            },
            {
                "VARIATION DES CAPITAUX PROPRES CONSOLIDÉS": "• Part du groupe dans\nle résultat",
                "null": "86.204"
            },
            {
                "VARIATION DES CAPITAUX PROPRES CONSOLIDÉS": "• Gains et pertes actuariels",
                "null": "28.682"
            },
            {
                "VARIATION DES CAPITAUX PROPRES CONSOLIDÉS": "• Autres mouvements",
                "null": "-9.781"
            },
            {
                "VARIATION DES CAPITAUX PROPRES CONSOLIDÉS": "Situation à la clôture de l'exercice\n2022.12",
                "null": "1.847.040"
            },
            {
                "VARIATION DES CAPITAUX PROPRES CONSOLIDÉS": "• Affectation du résultat de\nl'exercice N-1",
                "null": "-"
            },
            {
                "VARIATION DES CAPITAUX PROPRES CONSOLIDÉS": "• Dividendes versés",
                "null": "-117.000"
            },
            {
                "VARIATION DES CAPITAUX PROPRES CONSOLIDÉS": "• Changement de méthodes\ncomptables",
                "null": "-"
            },
            {
                "VARIATION DES CAPITAUX PROPRES CONSOLIDÉS": "• Part du groupe dans le résultat",
                "null": "65.344"
            },
            {
                "VARIATION DES CAPITAUX PROPRES CONSOLIDÉS": "• Gains et pertes actuariels",
                "null": "30.125"
            },
            {
                "VARIATION DES CAPITAUX PROPRES CONSOLIDÉS": "• Autres mouvements",
                "null": "-9.490"
            },
            {
                "VARIATION DES CAPITAUX PROPRES CONSOLIDÉS": "Situation à la clôture de l'exercice\n2023.12",
                "null": "1.816.488"
            }
        ],
        [
            {
                "Actif (En KMAD)": "• Immobilisations incorporelles",
                "2023.12": "4.419",
                "2022.12": "5.667",
                "Variation": "-22%"
            },
            {
                "Actif (En KMAD)": "• Immobilisations corporelles",
                "2023.12": "1.272.015",
                "2022.12": "1.170.357",
                "Variation": "9%"
            },
            {
                "Actif (En KMAD)": "• Immobilisations en droit d'usage",
                "2023.12": "99.524",
                "2022.12": "102.927",
                "Variation": "-3%"
            },
            {
                "Actif (En KMAD)": "• Autres actifs financiers",
                "2023.12": "39.962",
                "2022.12": "39.962",
                "Variation": "0%"
            },
            {
                "Actif (En KMAD)": "• Impôts différés actifs",
                "2023.12": "-",
                "2022.12": "1.267",
                "Variation": "-100%"
            },
            {
                "Actif (En KMAD)": "• Autres débiteurs non courants",
                "2023.12": "158.065",
                "2022.12": "168.042",
                "Variation": "-6%"
            },
            {
                "Actif (En KMAD)": "Actifs non-courants",
                "2023.12": "1.573.985",
                "2022.12": "1.488.222",
                "Variation": "6%"
            },
            {
                "Actif (En KMAD)": "• Autres actifs financiers courants",
                "2023.12": "9.922",
                "2022.12": "24.406",
                "Variation": "-59%"
            },
            {
                "Actif (En KMAD)": "• Stocks et en-cours",
                "2023.12": "975.673",
                "2022.12": "1.012.111",
                "Variation": "-4%"
            },
            {
                "Actif (En KMAD)": "• Créances clients",
                "2023.12": "1.314.860",
                "2022.12": "1.007.176",
                "Variation": "31%"
            },
            {
                "Actif (En KMAD)": "• Autres débiteurs courants",
                "2023.12": "240.600",
                "2022.12": "197.083",
                "Variation": "22%"
            },
            {
                "Actif (En KMAD)": "• Trésorerie et équivalent de trésorerie",
                "2023.12": "768.137",
                "2022.12": "851.638",
                "Variation": "-10%"
            },
            {
                "Actif (En KMAD)": "Actifs courants",
                "2023.12": "3.309.192",
                "2022.12": "3.092.414",
                "Variation": "7%"
            },
            {
                "Actif (En KMAD)": "TOTAL ACTIF",
                "2023.12": "4.883.177",
                "2022.12": "4.580.636",
                "Variation": "7%"
            },
            {
                "Actif (En KMAD)": "Passif (En KMAD)",
                "2023.12": "2023.12",
                "2022.12": "2022.12",
                "Variation": "Variation"
            },
            {
                "Actif (En KMAD)": "• Capital",
                "2023.12": "390.000",
                "2022.12": "390.000",
                "Variation": "0%"
            },
            {
                "Actif (En KMAD)": "• Primes d'émission et de fusion",
                "2023.12": "1.604",
                "2022.12": "1.604",
                "Variation": "0%"
            },
            {
                "Actif (En KMAD)": "• Réserves",
                "2023.12": "1.357.260",
                "2022.12": "1.367.225",
                "Variation": "-1%"
            },
            {
                "Actif (En KMAD)": "• Résultats net part du groupe",
                "2023.12": "65.077",
                "2022.12": "85.930",
                "Variation": "-24%"
            },
            {
                "Actif (En KMAD)": "Capitaux propres attribuables aux actionnaires ordinaires de la société mère",
                "2023.12": "1.813.941",
                "2022.12": "1.844.760",
                "Variation": "-2%"
            },
            {
                "Actif (En KMAD)": "• Participations ne donnant pas le contrôle",
                "2023.12": "2.547",
                "2022.12": "2.280",
                "Variation": "12%"
            },
            {
                "Actif (En KMAD)": "Capitaux propres de l'ensemble consolidé",
                "2023.12": "1.816.488",
                "2022.12": "1.847.040",
                "Variation": "-2%"
            },
            {
                "Actif (En KMAD)": "• Provisions non courantes",
                "2023.12": "59.799",
                "2022.12": "59.799",
                "Variation": "0%"
            },
            {
                "Actif (En KMAD)": "• Avantages du personnel",
                "2023.12": "97.196",
                "2022.12": "121.185",
                "Variation": "-20%"
            },
            {
                "Actif (En KMAD)": "• Dettes financières non courantes",
                "2023.12": "109.759",
                "2022.12": "109.047",
                "Variation": "1%"
            },
            {
                "Actif (En KMAD)": "• Impôts différés passifs",
                "2023.12": "216.158",
                "2022.12": "230.727",
                "Variation": "-6%"
            },
            {
                "Actif (En KMAD)": "• Autres créditeurs non courants",
                "2023.12": "17.865",
                "2022.12": "20.508",
                "Variation": "-13%"
            },
            {
                "Actif (En KMAD)": "Passifs non courants",
                "2023.12": "500.777",
                "2022.12": "541.266",
                "Variation": "-7%"
            },
            {
                "Actif (En KMAD)": "• Provisions courantes",
                "2023.12": "26.901",
                "2022.12": "26.901",
                "Variation": "0%"
            },
            {
                "Actif (En KMAD)": "• Dettes financières courantes",
                "2023.12": "-",
                "2022.12": "-",
                "Variation": "-"
            },
            {
                "Actif (En KMAD)": "• Dettes fournisseurs courantes",
                "2023.12": "2.032.644",
                "2022.12": "1.619.035",
                "Variation": "26%"
            },
            {
                "Actif (En KMAD)": "• Autres créditeurs courants",
                "2023.12": "506.367",
                "2022.12": "546.394",
                "Variation": "-7%"
            },
            {
                "Actif (En KMAD)": "Passifs courants",
                "2023.12": "2.565.912",
                "2022.12": "2.192.330",
                "Variation": "17%"
            },
            {
                "Actif (En KMAD)": "TOTAL PASSIF",
                "2023.12": "3.066.689",
                "2022.12": "2.733.596",
                "Variation": "12%"
            },
            {
                "Actif (En KMAD)": "TOTAL CAPITAUX PROPRES ET PASSIF",
                "2023.12": "4.883.177",
                "2022.12": "4.580.636",
                "Variation": "7%"
            }
        ],
        [
            {
                "TABLEAU DE FLUX DE TRÉSORERIE CONSOLIDÉ": "KMAD",
                "null": "2022.12"
            },
            {
                "TABLEAU DE FLUX DE TRÉSORERIE CONSOLIDÉ": "• Résultat net de l'ensemble consolidé",
                "null": "86.147"
            },
            {
                "TABLEAU DE FLUX DE TRÉSORERIE CONSOLIDÉ": "AJUSTEMENTS :",
                "null": ""
            },
            {
                "TABLEAU DE FLUX DE TRÉSORERIE CONSOLIDÉ": "• Elim. des amortissements et provisions",
                "null": "166.152"
            },
            {
                "TABLEAU DE FLUX DE TRÉSORERIE CONSOLIDÉ": "• Elim. des profits / pertes de réévaluation (juste valeur)",
                "null": "-22.780"
            },
            {
                "TABLEAU DE FLUX DE TRÉSORERIE CONSOLIDÉ": "• Elim. des résultats de cession et des pertes et profits de dilution",
                "null": "77"
            },
            {
                "TABLEAU DE FLUX DE TRÉSORERIE CONSOLIDÉ": "CAPACITÉ D'AUTOFINANCEMENT APRÈS COÛT DE L'ENDETTEMENT FINANCIER NET ET\nIMPÔT",
                "null": "229.596"
            },
            {
                "TABLEAU DE FLUX DE TRÉSORERIE CONSOLIDÉ": "• Elim. de la charge (produit) d'impôt",
                "null": "65.760"
            },
            {
                "TABLEAU DE FLUX DE TRÉSORERIE CONSOLIDÉ": "• Elim. du coût de l'endettement financier net",
                "null": "12.550"
            },
            {
                "TABLEAU DE FLUX DE TRÉSORERIE CONSOLIDÉ": "CAPACITÉ D'AUTOFINANCEMENT AVANT COÛT DE L'ENDETTEMENT FINANCIER NET ET\nIMPÔT",
                "null": "307.906"
            },
            {
                "TABLEAU DE FLUX DE TRÉSORERIE CONSOLIDÉ": "• Incidence de la variation du BFR Impôts différés",
                "null": "-57.330"
            },
            {
                "TABLEAU DE FLUX DE TRÉSORERIE CONSOLIDÉ": "• Impôts payés",
                "null": "-64.510"
            },
            {
                "TABLEAU DE FLUX DE TRÉSORERIE CONSOLIDÉ": "FLUX DE TRÉSORERIE LIÉS AUX ACTIVITÉS OPÉRATIONNELLES",
                "null": "186.066"
            },
            {
                "TABLEAU DE FLUX DE TRÉSORERIE CONSOLIDÉ": "• Acquisition d'immobilisations corporelles et incorporelles",
                "null": "-147.410"
            },
            {
                "TABLEAU DE FLUX DE TRÉSORERIE CONSOLIDÉ": "• Variation des autres actifs financiers",
                "null": "-15"
            },
            {
                "TABLEAU DE FLUX DE TRÉSORERIE CONSOLIDÉ": "• Cession d'immobilisations corporelles et incorporelles",
                "null": "0"
            },
            {
                "TABLEAU DE FLUX DE TRÉSORERIE CONSOLIDÉ": "• Intérêts financiers versés",
                "null": "-12.550"
            },
            {
                "TABLEAU DE FLUX DE TRÉSORERIE CONSOLIDÉ": "FLUX DE TRÉSORERIE LIÉS AUX ACTIVITÉS D›INVESTISSEMENT",
                "null": "-159.975"
            },
            {
                "TABLEAU DE FLUX DE TRÉSORERIE CONSOLIDÉ": "• Variations de dettes résultant de contrats location",
                "null": "-6.664"
            },
            {
                "TABLEAU DE FLUX DE TRÉSORERIE CONSOLIDÉ": "• Dividendes payés aux actionnaires de la mère",
                "null": "-148.200"
            },
            {
                "TABLEAU DE FLUX DE TRÉSORERIE CONSOLIDÉ": "• Variation des comptes courants associés",
                "null": "534"
            },
            {
                "TABLEAU DE FLUX DE TRÉSORERIE CONSOLIDÉ": "FLUX DE TRÉSORERIE LIÉS AUX ACTIVITÉS DE FINANCEMENT",
                "null": "-154.330"
            },
            {
                "TABLEAU DE FLUX DE TRÉSORERIE CONSOLIDÉ": "• Incidence des changements de principes comptables",
                "null": "-"
            },
            {
                "TABLEAU DE FLUX DE TRÉSORERIE CONSOLIDÉ": "VARIATION DE LA TRÉSORERIE",
                "null": "-128.239"
            },
            {
                "TABLEAU DE FLUX DE TRÉSORERIE CONSOLIDÉ": "• Trésorerie d'ouverture",
                "null": "979.877"
            },
            {
                "TABLEAU DE FLUX DE TRÉSORERIE CONSOLIDÉ": "• Trésorerie de clôture",
                "null": "851.638"
            },
            {
                "TABLEAU DE FLUX DE TRÉSORERIE CONSOLIDÉ": "VARIATION DE LA TRÉSORERIE",
                "null": "-128.239"
            }
        ],
        [
            {
                "null": "• Entre 1 et 2 ans",
                "% Provision": "25%"
            },
            {
                "null": "• Entre 2 et 3 ans",
                "% Provision": "50%"
            },
            {
                "null": "• Entre 3 et 4 ans",
                "% Provision": "75%"
            },
            {
                "null": "• Plus de quatre ans",
                "% Provision": "100%"
            }
        ],
        [
            {
                "• Installations techniques, matériel et outillage": "• Matériel de transport",
                "de 3 à 35 ans": "de 1 à 9 ans"
            },
            {
                "• Installations techniques, matériel et outillage": "• Mobilier, matériel de bureau et aménagements divers",
                "de 3 à 35 ans": "de 2 à 7 ans"
            },
            {
                "• Installations techniques, matériel et outillage": "• Autres immobilisations corporelles",
                "de 3 à 35 ans": "de 2 à 5 ans"
            }
        ],
        [
            {
                "": "• Gros œuvres – Charpente métallique",
                "F 1*": "50 ans",
                "F 2*": "50 ans",
                "F 3*": "50 ans",
                "F 4*": "25 ans",
                "F 5*": "33 ans",
                "F 6*": "40 ans",
                "F 7*": ""
            },
            {
                "": "• Etanchéité, toiture et autres",
                "F 1*": "10 ans",
                "F 2*": "10 ans",
                "F 3*": "10 ans",
                "F 4*": "10 ans",
                "F 5*": "10 ans",
                "F 6*": "",
                "F 7*": ""
            },
            {
                "": "• gencements et aménagements",
                "F 1*": "15 ans",
                "F 2*": "15 ans",
                "F 3*": "15 ans",
                "F 4*": "15 ans",
                "F 5*": "15 ans",
                "F 6*": "",
                "F 7*": "20 ans"
            },
            {
                "": "• Installations techniques fixes",
                "F 1*": "25 ans",
                "F 2*": "25 ans",
                "F 3*": "25 ans",
                "F 4*": "20 ans",
                "F 5*": "20 ans",
                "F 6*": "",
                "F 7*": ""
            },
            {
                "": "• Menuiserie intérieure & extérieure",
                "F 1*": "15 ans",
                "F 2*": "15 ans",
                "F 3*": "15 ans",
                "F 4*": "15 ans",
                "F 5*": "15 ans",
                "F 6*": "",
                "F 7*": ""
            }
        ],
        [
            {
                "EN MILLIONS DE MAD": "• Achats revendus de marchandises",
                "2023": "(98,0)",
                "2022": "(57,1)"
            },
            {
                "EN MILLIONS DE MAD": "• Achats consommés de matières et fournitures",
                "2023": "(3 984,1)",
                "2022": "(4 225,4)"
            },
            {
                "EN MILLIONS DE MAD": "ACHATS",
                "2023": "(4 082,1)",
                "2022": "(4 282,5)"
            },
            {
                "EN MILLIONS DE MAD": "• Loyers opérationnels",
                "2023": "3,6",
                "2022": "(2,3)"
            },
            {
                "EN MILLIONS DE MAD": "• Entretien et réparations",
                "2023": "(5,8)",
                "2022": "(3,5)"
            },
            {
                "EN MILLIONS DE MAD": "• Rémunération de personnel extérieur à l'entreprise",
                "2023": "(11,7)",
                "2022": "(14,0)"
            },
            {
                "EN MILLIONS DE MAD": "• Charges externes diverses",
                "2023": "(287,5)",
                "2022": "(273,6)"
            },
            {
                "EN MILLIONS DE MAD": "AUTRES CHARGES EXTERNES",
                "2023": "(301,4)",
                "2022": "(293,5)"
            },
            {
                "EN MILLIONS DE MAD": "",
                "2023": "",
                "2022": ""
            },
            {
                "EN MILLIONS DE MAD": "TOTAL ACHATS ET AUTRES CHARGES EXTERNES",
                "2023": "(4 383,5)",
                "2022": "(4 575,9)"
            }
        ],
        [
            {
                "EN MILLIONS DE MAD": "• Salaires et traitements",
                "2023": "(152,6)",
                "2022": "(133,0)"
            },
            {
                "EN MILLIONS DE MAD": "• Autres charges sociales",
                "2023": "(55,1)",
                "2022": "(44,1)"
            },
            {
                "EN MILLIONS DE MAD": "• Dotations nettes aux provisions pour avantages du personnel",
                "2023": "(6,2)",
                "2022": "(8,3)"
            },
            {
                "EN MILLIONS DE MAD": "TOTAL",
                "2023": "(213,9)",
                "2022": "(185,4)"
            }
        ],
        [
            {
                "EN MILLIONS DE MAD": "• Chiffre d'affaires",
                "2023": "4 995,8",
                "2022": "4 888,2"
            },
            {
                "EN MILLIONS DE MAD": "• Autres produits de l'activité",
                "2023": "-112,4",
                "2022": "236,3"
            },
            {
                "EN MILLIONS DE MAD": "TOTAL PRODUITS DES ACTIVITÉS ORDINAIRES",
                "2023": "4 883,3",
                "2022": "5 124,4"
            }
        ],
        [
            {
                "": "• Cadres",
                "2023": "120",
                "2022": "113",
                "Var %": "(6,2%)"
            },
            {
                "": "• Non cadres",
                "2023": "598",
                "2022": "610",
                "Var %": "(2,0%)"
            },
            {
                "": "TOTAL",
                "2023": "718",
                "2022": "723",
                "Var %": "(0,7%)"
            }
        ],
        [
            {
                "EN MILLIONS DE MAD": "• Production vendue de biens et services",
                "2023": "4 642,2",
                "2022": "4 557,0"
            },
            {
                "EN MILLIONS DE MAD": "• Ventes de Marchandises en l’état",
                "2023": "353,6",
                "2022": "331,1"
            },
            {
                "EN MILLIONS DE MAD": "CHIFFRE D'AFFAIRES",
                "2023": "4 995,8",
                "2022": "4 888,2"
            }
        ],
        [
            {
                "EN MILLIONS DE MAD": "AMORTISSEMENTS NETS IMPACTANT LE RÉSULTAT D'EXPLOITATION COURANT",
                "2023": "",
                "2022": ""
            },
            {
                "EN MILLIONS DE MAD": "• Immobilisations incorporelles",
                "2023": "(2,0)",
                "2022": "(2,0)"
            },
            {
                "EN MILLIONS DE MAD": "• Immobilisations corporelles",
                "2023": "(122,6)",
                "2022": "(142,3)"
            },
            {
                "EN MILLIONS DE MAD": "• Immobilisations en droit d’usage",
                "2023": "(14,4)",
                "2022": "(13,6)"
            },
            {
                "EN MILLIONS DE MAD": "SOUS-TOTAL",
                "2023": "(139,0)",
                "2022": "(157,9)"
            },
            {
                "EN MILLIONS DE MAD": "PROVISIONS ET PERTES DE VALEUR NETTES IMPACTANT LE RÉSULTAT D'EXPLOITATION COURANT",
                "2023": "",
                "2022": ""
            },
            {
                "EN MILLIONS DE MAD": "• Stocks et créances",
                "2023": "2,3",
                "2022": "2,2"
            },
            {
                "EN MILLIONS DE MAD": "• Provisions pour risques et charges",
                "2023": "",
                "2022": ""
            },
            {
                "EN MILLIONS DE MAD": "SOUS-TOTAL",
                "2023": "2,3",
                "2022": "(2,2)"
            },
            {
                "EN MILLIONS DE MAD": "TOTAL (136,6) (155,7)",
                "2023": "",
                "2022": ""
            },
            {
                "EN MILLIONS DE MAD": "DONT AMORTISSEMENTS ET PROVISIONS DES ACTIVITÉS POURSUIVIES",
                "2023": "(136,6)",
                "2022": "(155,7)"
            },
            {
                "EN MILLIONS DE MAD": "DONT AMORTISSEMENTS ET PROVISIONS DES ACTIVITÉS NON POURSUIVIES",
                "2023": "",
                "2022": ""
            }
        ],
        [
            {
                "EN MILLIONS DE MAD": "PRODUITS D'INTÉRÊTS",
                "2023": "10,8",
                "2022": "14,7"
            },
            {
                "EN MILLIONS DE MAD": "CHARGES D'INTÉRÊTS",
                "2023": "(34,3)",
                "2022": "(12,6)"
            },
            {
                "EN MILLIONS DE MAD": "• Reprises des pertes de valeur",
                "2023": "",
                "2022": ""
            },
            {
                "EN MILLIONS DE MAD": "• Gains et pertes de change",
                "2023": "11,4",
                "2022": "(33,9)"
            },
            {
                "EN MILLIONS DE MAD": "• Autres charges financières",
                "2023": "",
                "2022": "(2,0)"
            },
            {
                "EN MILLIONS DE MAD": "AUTRES PRODUITS ET CHARGES FINANCIERS 11,4 (35,9)",
                "2023": "",
                "2022": ""
            },
            {
                "EN MILLIONS DE MAD": "RÉSULTAT FINANCIER",
                "2023": "(12,1)",
                "2022": "(33,8)"
            }
        ],
        [
            {
                "EN MILLIONS DE MAD": "CHARGE D'IMPÔT COURANT",
                "2023": "",
                "2022": ""
            },
            {
                "EN MILLIONS DE MAD": "• Charge de l'exercice",
                "2023": "(41,9)",
                "2022": "(64,5)"
            },
            {
                "EN MILLIONS DE MAD": "• Ajustement de la charge d'impôt provenant d'exercices antérieurs",
                "2023": "0,0",
                "2022": "0,0"
            },
            {
                "EN MILLIONS DE MAD": "",
                "2023": "(41,9)",
                "2022": "(64,5)"
            },
            {
                "EN MILLIONS DE MAD": "",
                "2023": "",
                "2022": ""
            },
            {
                "EN MILLIONS DE MAD": "CHARGES / PRODUITS D'IMPÔTS DIFFÉRÉS",
                "2023": "",
                "2022": ""
            },
            {
                "EN MILLIONS DE MAD": "• Variations des différences temporaires",
                "2023": "15,2",
                "2022": "9,1"
            },
            {
                "EN MILLIONS DE MAD": "• Variations des taux d'imposition",
                "2023": "(1,1)",
                "2022": "(10,4)"
            },
            {
                "EN MILLIONS DE MAD": "• Variation des déficits fiscaux antérieurs",
                "2023": "",
                "2022": ""
            },
            {
                "EN MILLIONS DE MAD": "",
                "2023": "(14,1)",
                "2022": "(1,3)"
            },
            {
                "EN MILLIONS DE MAD": "",
                "2023": "",
                "2022": ""
            },
            {
                "EN MILLIONS DE MAD": "CHARGE / PRODUIT TOTAL D'IMPÔT",
                "2023": "(27,8)",
                "2022": "(65,8)"
            }
        ],
        [
            {
                "EN MILLIONS DE MAD": "• Cession d'actifs",
                "2023": "0,5",
                "2022": "(0,1)"
            },
            {
                "EN MILLIONS DE MAD": "• Résultats sur dérivés de change – Trading",
                "2023": "(14,5)",
                "2022": "22,8"
            },
            {
                "EN MILLIONS DE MAD": "• Autres produits et charges d'exploitation",
                "2023": "30,7",
                "2022": "13,0"
            },
            {
                "EN MILLIONS DE MAD": "• Autres produits et charges d'exploitation non courante*",
                "2023": "2,2",
                "2022": "0,2"
            },
            {
                "EN MILLIONS DE MAD": "TOTAL PRODUITS ET CHARGES D'EXPLOITATION",
                "2023": "18,9",
                "2022": "36,0"
            }
        ],
        [
            {
                "EN MILLIONS DE MAD": "• Autres produits non courants",
                "2023": "23,1",
                "2022": "25,5"
            },
            {
                "EN MILLIONS DE MAD": "• Autres charges non courantes",
                "2023": "(20,9)",
                "2022": "(25,3)"
            },
            {
                "EN MILLIONS DE MAD": "TOTAL AUTRES PRODUITS ET CHARGES D'EXPLOITATION NON COURANTS",
                "2023": "2,2",
                "2022": "0,2"
            }
        ],
        [
            {
                "null": "31-déc-23",
                "ACTIF": "31-déc-23",
                "PASSIF": "31-déc-23",
                "NET": "31-déc-23"
            },
            {
                "null": "",
                "ACTIF": "",
                "PASSIF": "",
                "NET": ""
            },
            {
                "null": "",
                "ACTIF": "",
                "PASSIF": "",
                "NET": ""
            },
            {
                "null": "(62,7)",
                "ACTIF": "158,1",
                "PASSIF": "216,2",
                "NET": "(58,1)"
            },
            {
                "null": "0,0",
                "ACTIF": "0,0",
                "PASSIF": "0,0",
                "NET": "0,0"
            },
            {
                "null": "",
                "ACTIF": "",
                "PASSIF": "",
                "NET": ""
            },
            {
                "null": "",
                "ACTIF": "",
                "PASSIF": "",
                "NET": ""
            },
            {
                "null": "(62,7)",
                "ACTIF": "158,1",
                "PASSIF": "216,2",
                "NET": "(58,1)"
            }
        ],
        [
            {
                "EXERCICES CLOS LE 31 DÉCEMBRE": "• Résultat net de l’exercice imputable aux actionnaires de la société-mère",
                "2023": "65,1",
                "2022": "85,9"
            },
            {
                "EXERCICES CLOS LE 31 DÉCEMBRE": "• Nombre d'actions retenu pour le calcul du résultat par action",
                "2023": "3 900 000",
                "2022": "3 900 000"
            },
            {
                "EXERCICES CLOS LE 31 DÉCEMBRE": "RÉSULTAT DE BASE PAR ACTION DES ACTIVITÉS POURSUIVIES",
                "2023": "16,69 MAD",
                "2022": "22,03 MAD"
            },
            {
                "EXERCICES CLOS LE 31 DÉCEMBRE": "RÉSULTAT DILUÉ PAR ACTION DES ACTIVITÉS POURSUIVIES",
                "2023": "16,69 MAD",
                "2022": "22,03 MAD"
            }
        ],
        [
            {
                "EN MILLIONS DE MAD": "",
                "Logiciels": "",
                "Concessions brevets\net droits similaires": "",
                "Autres": "",
                "Total": ""
            },
            {
                "EN MILLIONS DE MAD": "VALEURS BRUTES",
                "Logiciels": "",
                "Concessions brevets\net droits similaires": "",
                "Autres": "",
                "Total": ""
            },
            {
                "EN MILLIONS DE MAD": "AU 1ER JANVIER 2022",
                "Logiciels": "54,8",
                "Concessions brevets\net droits similaires": "",
                "Autres": "",
                "Total": "54,8"
            },
            {
                "EN MILLIONS DE MAD": "• Acquisitions",
                "Logiciels": "0,8",
                "Concessions brevets\net droits similaires": "",
                "Autres": "",
                "Total": "0,8"
            },
            {
                "EN MILLIONS DE MAD": "• Autres mouvements",
                "Logiciels": "",
                "Concessions brevets\net droits similaires": "",
                "Autres": "",
                "Total": ""
            },
            {
                "EN MILLIONS DE MAD": "AU 31 DÉCEMBRE 2022",
                "Logiciels": "55,6",
                "Concessions brevets\net droits similaires": "",
                "Autres": "",
                "Total": "55,6"
            },
            {
                "EN MILLIONS DE MAD": "",
                "Logiciels": "",
                "Concessions brevets\net droits similaires": "",
                "Autres": "",
                "Total": ""
            },
            {
                "EN MILLIONS DE MAD": "AU 1ER JANVIER 2023",
                "Logiciels": "55,6",
                "Concessions brevets\net droits similaires": "",
                "Autres": "",
                "Total": "55,6"
            },
            {
                "EN MILLIONS DE MAD": "• Acquisitions",
                "Logiciels": "0,7",
                "Concessions brevets\net droits similaires": "",
                "Autres": "",
                "Total": "0,7"
            },
            {
                "EN MILLIONS DE MAD": "• Autres mouvements",
                "Logiciels": "",
                "Concessions brevets\net droits similaires": "",
                "Autres": "",
                "Total": ""
            },
            {
                "EN MILLIONS DE MAD": "AU 31 DÉCEMBRE 2023",
                "Logiciels": "56,3",
                "Concessions brevets\net droits similaires": "",
                "Autres": "",
                "Total": "56,3"
            },
            {
                "EN MILLIONS DE MAD": "",
                "Logiciels": "",
                "Concessions brevets\net droits similaires": "",
                "Autres": "",
                "Total": ""
            },
            {
                "EN MILLIONS DE MAD": "AMORTISSEMENTS ET PERTES DE VALEURS",
                "Logiciels": "",
                "Concessions brevets\net droits similaires": "",
                "Autres": "",
                "Total": ""
            },
            {
                "EN MILLIONS DE MAD": "AU 1ER JANVIER 2022",
                "Logiciels": "(47,9)",
                "Concessions brevets\net droits similaires": "",
                "Autres": "",
                "Total": "(47,9)"
            },
            {
                "EN MILLIONS DE MAD": "• Amortissements",
                "Logiciels": "(2,0)",
                "Concessions brevets\net droits similaires": "",
                "Autres": "",
                "Total": "(2,0)"
            },
            {
                "EN MILLIONS DE MAD": "• Autres mouvements",
                "Logiciels": "0,0",
                "Concessions brevets\net droits similaires": "",
                "Autres": "",
                "Total": "0,0"
            },
            {
                "EN MILLIONS DE MAD": "AU 31 DÉCEMBRE 2022",
                "Logiciels": "(49,9)",
                "Concessions brevets\net droits similaires": "",
                "Autres": "",
                "Total": "(49,9)"
            },
            {
                "EN MILLIONS DE MAD": "",
                "Logiciels": "",
                "Concessions brevets\net droits similaires": "",
                "Autres": "",
                "Total": ""
            },
            {
                "EN MILLIONS DE MAD": "AU 1ER JANVIER 2023",
                "Logiciels": "(49,9)",
                "Concessions brevets\net droits similaires": "",
                "Autres": "",
                "Total": "(49,9)"
            },
            {
                "EN MILLIONS DE MAD": "• Amortissements",
                "Logiciels": "(2,0)",
                "Concessions brevets\net droits similaires": "",
                "Autres": "",
                "Total": "(2,0)"
            },
            {
                "EN MILLIONS DE MAD": "• Autres mouvements",
                "Logiciels": "0,0",
                "Concessions brevets\net droits similaires": "",
                "Autres": "",
                "Total": "0,0"
            },
            {
                "EN MILLIONS DE MAD": "AU 31 DÉCEMBRE 2023",
                "Logiciels": "(51,9)",
                "Concessions brevets\net droits similaires": "",
                "Autres": "",
                "Total": "(51,9"
            },
            {
                "EN MILLIONS DE MAD": "",
                "Logiciels": "",
                "Concessions brevets\net droits similaires": "",
                "Autres": "",
                "Total": ""
            },
            {
                "EN MILLIONS DE MAD": "VALEURS NETTES",
                "Logiciels": "",
                "Concessions brevets\net droits similaires": "",
                "Autres": "",
                "Total": ""
            },
            {
                "EN MILLIONS DE MAD": "AU 31 DÉCEMBRE 2022",
                "Logiciels": "5,7",
                "Concessions brevets\net droits similaires": "0,0",
                "Autres": "0,0",
                "Total": "5,7"
            },
            {
                "EN MILLIONS DE MAD": "AU 31 DÉCEMBRE 2023",
                "Logiciels": "4,4",
                "Concessions brevets\net droits similaires": "0,0",
                "Autres": "0,0",
                "Total": "4,4"
            }
        ],
        [
            {
                "EN MILLIONS DE MAD": "",
                "2023": "",
                "2022": ""
            },
            {
                "EN MILLIONS DE MAD": "RÉSULTAT NET DE L'ENSEMBLE CONSOLIDÉ",
                "2023": "65,3",
                "2022": "86,1"
            },
            {
                "EN MILLIONS DE MAD": "• Quote-part de résultat des sociétés mises en équivalence",
                "2023": "",
                "2022": ""
            },
            {
                "EN MILLIONS DE MAD": "RÉSULTAT NET DE L'ENSEMBLE CONSOLIDÉ (HORS S.M.E)",
                "2023": "65,1",
                "2022": "85,9"
            },
            {
                "EN MILLIONS DE MAD": "• Impôt sur les bénéfices",
                "2023": "(41,9)",
                "2022": "(64,5)"
            },
            {
                "EN MILLIONS DE MAD": "• Impôts différés",
                "2023": "14,1",
                "2022": "(1,3)"
            },
            {
                "EN MILLIONS DE MAD": "TOTAL CHARGE FISCALE",
                "2023": "(27,8)",
                "2022": "(65,8)"
            },
            {
                "EN MILLIONS DE MAD": "RÉSULTAT DE L'ENSEMBLE CONSOLIDÉ AVANT IMPÔTS (HORS S.M.E)",
                "2023": "93,1",
                "2022": "151,9"
            },
            {
                "EN MILLIONS DE MAD": "• Taux effectif d'impôt (Total charge fiscale / Résultat comptable avant impôts)",
                "2023": "(0,30)",
                "2022": "(0,43)"
            },
            {
                "EN MILLIONS DE MAD": "• Impôt sur différences permanentes",
                "2023": "",
                "2022": ""
            },
            {
                "EN MILLIONS DE MAD": "• Régularisation sur IS (a)",
                "2023": "",
                "2022": ""
            },
            {
                "EN MILLIONS DE MAD": "• Cotisation minimale",
                "2023": "",
                "2022": ""
            },
            {
                "EN MILLIONS DE MAD": "• Autres différences (b)",
                "2023": "2,3",
                "2022": "8,6"
            },
            {
                "EN MILLIONS DE MAD": "CHARGE FISCALE RECALCULÉE",
                "2023": "(25,5)",
                "2022": "(47,09)"
            },
            {
                "EN MILLIONS DE MAD": "TAUX D'IMPÔT LÉGAL AU MAROC (CHARGE FISCALE RECALCULÉE / RÉSULTAT COMPTABLE AVANT IMPÔTS)",
                "2023": "(0,27)",
                "2022": "(0,31)"
            }
        ],
        [
            {
                "": "Nombre moyen pondéré:\n• d'actions ordinaires émises\n• d’actions détenues dans le cadre de plans d’options d’achat\n• d’actions d’auto détention",
                "2023": "3 900 000\n-\n-",
                "2022": "3 900 000\n-\n-"
            },
            {
                "": "NOMBRE D’ACTIONS RETENU POUR LE CALCUL DU RÉSULTAT DE BASE PAR ACTION",
                "2023": "3 900 000",
                "2022": "3 900 000"
            },
            {
                "": "• Nombre d’instruments dilutifs",
                "2023": "-",
                "2022": "-"
            },
            {
                "": "NOMBRE D’ACTIONS RETENU POUR LE CALCUL DU RÉSULTAT DILUÉ PAR ACTION",
                "2023": "3 900 000",
                "2022": "3 900 000"
            }
        ],
        [
            {
                "EN MILLIONS DE MAD": "",
                "Terrains": "",
                "Construction": "",
                "Matériel\net outillage": "",
                "Immobilisations en\ncours": "",
                "Autres": "",
                "Total": ""
            },
            {
                "EN MILLIONS DE MAD": "VALEURS BRUTES",
                "Terrains": "",
                "Construction": "",
                "Matériel\net outillage": "",
                "Immobilisations en\ncours": "",
                "Autres": "",
                "Total": ""
            },
            {
                "EN MILLIONS DE MAD": "AU 1ER JANVIER 2022",
                "Terrains": "266,2",
                "Construction": "727,6",
                "Matériel\net outillage": "3 641,3",
                "Immobilisations en\ncours": "46,51",
                "Autres": "59,7",
                "Total": "4 741,4"
            },
            {
                "EN MILLIONS DE MAD": "• Acquisitions",
                "Terrains": "1,7",
                "Construction": "20,8",
                "Matériel\net outillage": "95,5",
                "Immobilisations en\ncours": "21,5",
                "Autres": "2,2",
                "Total": "141,7"
            },
            {
                "EN MILLIONS DE MAD": "• Cessions",
                "Terrains": "",
                "Construction": "",
                "Matériel\net outillage": "(14,5)",
                "Immobilisations en\ncours": "",
                "Autres": "(5,8)",
                "Total": "(20,3)"
            },
            {
                "EN MILLIONS DE MAD": "• Autres mouvements",
                "Terrains": "",
                "Construction": "0,6",
                "Matériel\net outillage": "17,4",
                "Immobilisations en\ncours": "(18,0)",
                "Autres": "",
                "Total": "0"
            },
            {
                "EN MILLIONS DE MAD": "AU 31 DÉCEMBRE 2022",
                "Terrains": "267,9",
                "Construction": "749,0",
                "Matériel\net outillage": "3 739,7",
                "Immobilisations en\ncours": "50,0",
                "Autres": "56,1",
                "Total": "4 862,8"
            },
            {
                "EN MILLIONS DE MAD": "",
                "Terrains": "",
                "Construction": "",
                "Matériel\net outillage": "",
                "Immobilisations en\ncours": "",
                "Autres": "",
                "Total": ""
            },
            {
                "EN MILLIONS DE MAD": "AU 1ER JANVIER 2023",
                "Terrains": "267,9",
                "Construction": "749,0",
                "Matériel\net outillage": "3 739,7",
                "Immobilisations en\ncours": "50,0",
                "Autres": "56,1",
                "Total": "4 862,8"
            },
            {
                "EN MILLIONS DE MAD": "• Acquisitions",
                "Terrains": "0,5",
                "Construction": "2,9",
                "Matériel\net outillage": "115,8",
                "Immobilisations en\ncours": "97,6",
                "Autres": "2,2",
                "Total": "219,0"
            },
            {
                "EN MILLIONS DE MAD": "• Cessions",
                "Terrains": "",
                "Construction": "",
                "Matériel\net outillage": "0,0",
                "Immobilisations en\ncours": "",
                "Autres": "(4,5)",
                "Total": "(4,5)"
            },
            {
                "EN MILLIONS DE MAD": "• Autres mouvements",
                "Terrains": "",
                "Construction": "",
                "Matériel\net outillage": "107,3",
                "Immobilisations en\ncours": "(108,3)",
                "Autres": "1,1",
                "Total": "0"
            },
            {
                "EN MILLIONS DE MAD": "AU 31 DÉCEMBRE 2023",
                "Terrains": "268,4",
                "Construction": "752,0",
                "Matériel\net outillage": "3 962,8",
                "Immobilisations en\ncours": "39,3",
                "Autres": "54,8",
                "Total": "5 077,2"
            },
            {
                "EN MILLIONS DE MAD": "",
                "Terrains": "",
                "Construction": "",
                "Matériel\net outillage": "",
                "Immobilisations en\ncours": "",
                "Autres": "",
                "Total": ""
            },
            {
                "EN MILLIONS DE MAD": "AMORTISSEMENTS ET PERTES DE VALEURS",
                "Terrains": "",
                "Construction": "",
                "Matériel\net outillage": "",
                "Immobilisations en\ncours": "",
                "Autres": "",
                "Total": ""
            },
            {
                "EN MILLIONS DE MAD": "AU 1ER JANVIER 2022",
                "Terrains": "(23,6)",
                "Construction": "(542,6)",
                "Matériel\net outillage": "(2 948,8)",
                "Immobilisations en\ncours": "0,0",
                "Autres": "(55,3)",
                "Total": "(3 570,3)"
            },
            {
                "EN MILLIONS DE MAD": "• Amortissements",
                "Terrains": "(0,4)",
                "Construction": "(29,4)",
                "Matériel\net outillage": "(110,7)",
                "Immobilisations en\ncours": "0,0",
                "Autres": "(1,8)",
                "Total": "(142,3)"
            },
            {
                "EN MILLIONS DE MAD": "• Cessions",
                "Terrains": "",
                "Construction": "",
                "Matériel\net outillage": "14,4",
                "Immobilisations en\ncours": "",
                "Autres": "5,8",
                "Total": "20,3"
            },
            {
                "EN MILLIONS DE MAD": "• Autres mouvements",
                "Terrains": "",
                "Construction": "",
                "Matériel\net outillage": "",
                "Immobilisations en\ncours": "",
                "Autres": "",
                "Total": ""
            },
            {
                "EN MILLIONS DE MAD": "AU 31 DÉCEMBRE 2022",
                "Terrains": "(24,1)",
                "Construction": "(572,0)",
                "Matériel\net outillage": "(3 045,0)",
                "Immobilisations en\ncours": "0,0",
                "Autres": "(51,3)",
                "Total": "(3 692,4)"
            },
            {
                "EN MILLIONS DE MAD": "",
                "Terrains": "",
                "Construction": "",
                "Matériel\net outillage": "",
                "Immobilisations en\ncours": "",
                "Autres": "",
                "Total": ""
            },
            {
                "EN MILLIONS DE MAD": "AU 1ER JANVIER 2023",
                "Terrains": "(24,1)",
                "Construction": "(572,0)",
                "Matériel\net outillage": "(3 045,0)",
                "Immobilisations en\ncours": "0,0",
                "Autres": "(51,3)",
                "Total": "(3 692,4)"
            },
            {
                "EN MILLIONS DE MAD": "• Amortissements",
                "Terrains": "(0,7)",
                "Construction": "(26,6)",
                "Matériel\net outillage": "(88,1)",
                "Immobilisations en\ncours": "0,0",
                "Autres": "(1,9)",
                "Total": "(117,4)"
            },
            {
                "EN MILLIONS DE MAD": "• Cessions",
                "Terrains": "",
                "Construction": "",
                "Matériel\net outillage": "",
                "Immobilisations en\ncours": "",
                "Autres": "4,5",
                "Total": "4,5"
            },
            {
                "EN MILLIONS DE MAD": "• Autres mouvements",
                "Terrains": "",
                "Construction": "",
                "Matériel\net outillage": "",
                "Immobilisations en\ncours": "",
                "Autres": "",
                "Total": ""
            },
            {
                "EN MILLIONS DE MAD": "AU 31 DÉCEMBRE 2023",
                "Terrains": "(24,8)",
                "Construction": "(598,7)",
                "Matériel\net outillage": "(3 133,1)",
                "Immobilisations en\ncours": "0,0",
                "Autres": "(48,7)",
                "Total": "(3 805,2)"
            },
            {
                "EN MILLIONS DE MAD": "",
                "Terrains": "",
                "Construction": "",
                "Matériel\net outillage": "",
                "Immobilisations en\ncours": "",
                "Autres": "",
                "Total": ""
            },
            {
                "EN MILLIONS DE MAD": "VALEURS NETTES",
                "Terrains": "",
                "Construction": "",
                "Matériel\net outillage": "",
                "Immobilisations en\ncours": "",
                "Autres": "",
                "Total": ""
            },
            {
                "EN MILLIONS DE MAD": "AU 31 DÉCEMBRE 2022",
                "Terrains": "243,9",
                "Construction": "177,0",
                "Matériel\net outillage": "694,7",
                "Immobilisations en\ncours": "50,0",
                "Autres": "4,8",
                "Total": "1 170,4"
            },
            {
                "EN MILLIONS DE MAD": "AU 31 DÉCEMBRE 2023",
                "Terrains": "243,6",
                "Construction": "153,3",
                "Matériel\net outillage": "829,7",
                "Immobilisations en\ncours": "39,3",
                "Autres": "6,2",
                "Total": "1 272,0"
            }
        ],
        [
            {
                "EN MILLIONS DE MAD": "PART NON COURANTE",
                "31-déc-23": "",
                "31-déc-22": ""
            },
            {
                "EN MILLIONS DE MAD": "• Prêts au personnel",
                "31-déc-23": "0,0",
                "31-déc-22": "0,0"
            },
            {
                "EN MILLIONS DE MAD": "• Dépôts et cautionnements",
                "31-déc-23": "40,0",
                "31-déc-22": "40,0"
            },
            {
                "EN MILLIONS DE MAD": "",
                "31-déc-23": "",
                "31-déc-22": ""
            },
            {
                "EN MILLIONS DE MAD": "TOTAL",
                "31-déc-23": "40,0",
                "31-déc-22": "40,0"
            }
        ],
        [
            {
                "EN MILLIONS DE MAD": "• Stocks de marchandises",
                "31-déc-23": "12,1",
                "31-déc-22": "12,9"
            },
            {
                "EN MILLIONS DE MAD": "• Stocks de matières et fournitures consommables",
                "31-déc-23": "483,2",
                "31-déc-22": "417,9"
            },
            {
                "EN MILLIONS DE MAD": "• En-cours de production",
                "31-déc-23": "160,1",
                "31-déc-22": "71,1"
            },
            {
                "EN MILLIONS DE MAD": "• Stocks de produits finis intermédiaires",
                "31-déc-23": "415,3",
                "31-déc-22": "616,3"
            },
            {
                "EN MILLIONS DE MAD": "TOTAL DES STOCKS EN VALEUR BRUTE",
                "31-déc-23": "1 070,6",
                "31-déc-22": "1 118,2"
            },
            {
                "EN MILLIONS DE MAD": "",
                "31-déc-23": "",
                "31-déc-22": ""
            },
            {
                "EN MILLIONS DE MAD": "MONTANT DE LA PERTE DE VALEUR EN DÉBUT DE PÉRIODE",
                "31-déc-23": "(106,1)",
                "31-déc-22": "(118,8)"
            },
            {
                "EN MILLIONS DE MAD": "• Perte de valeur constatée sur la période",
                "31-déc-23": "",
                "31-déc-22": "(2,6)"
            },
            {
                "EN MILLIONS DE MAD": "• Reprise de perte de valeur suite à des sorties et des cessions",
                "31-déc-23": "",
                "31-déc-22": ""
            },
            {
                "EN MILLIONS DE MAD": "• Reprise de perte de valeur devenue sans objet",
                "31-déc-23": "11,1",
                "31-déc-22": "12,4"
            },
            {
                "EN MILLIONS DE MAD": "• Autres mouvements",
                "31-déc-23": "",
                "31-déc-22": ""
            },
            {
                "EN MILLIONS DE MAD": "MONTANT DE LA PERTE DE VALEUR EN FIN DE PÉRIODE",
                "31-déc-23": "(95,0)",
                "31-déc-22": "(106,1)"
            },
            {
                "EN MILLIONS DE MAD": "",
                "31-déc-23": "",
                "31-déc-22": ""
            },
            {
                "EN MILLIONS DE MAD": "TOTAL STOCKS, NET",
                "31-déc-23": "975,7",
                "31-déc-22": "1 012,1"
            }
        ],
        [
            {
                "EN MILLIONS DE MAD": "PART NON COURANTE",
                "31-déc-23": "",
                "31-déc-22": ""
            },
            {
                "EN MILLIONS DE MAD": "• instruments financiers dérivés",
                "31-déc-23": "0,0",
                "31-déc-22": "0,0"
            },
            {
                "EN MILLIONS DE MAD": "• Actifs financiers",
                "31-déc-23": "0,0",
                "31-déc-22": "0,0"
            },
            {
                "EN MILLIONS DE MAD": "• prêts et créances",
                "31-déc-23": "40,0",
                "31-déc-22": "40,0"
            },
            {
                "EN MILLIONS DE MAD": "",
                "31-déc-23": "",
                "31-déc-22": ""
            },
            {
                "EN MILLIONS DE MAD": "TOTAL",
                "31-déc-23": "40,0",
                "31-déc-22": "40,0"
            },
            {
                "EN MILLIONS DE MAD": "",
                "31-déc-23": "",
                "31-déc-22": ""
            },
            {
                "EN MILLIONS DE MAD": "PART NON COURANTE",
                "31-déc-23": "",
                "31-déc-22": ""
            },
            {
                "EN MILLIONS DE MAD": "• instruments financiers dérivés",
                "31-déc-23": "9,9",
                "31-déc-22": "24,4"
            },
            {
                "EN MILLIONS DE MAD": "• Actifs financiers",
                "31-déc-23": "0,0",
                "31-déc-22": "0,0"
            },
            {
                "EN MILLIONS DE MAD": "• prêts et créances",
                "31-déc-23": "0,0",
                "31-déc-22": "0,0"
            },
            {
                "EN MILLIONS DE MAD": "TOTAL",
                "31-déc-23": "9,9",
                "31-déc-22": "24,4"
            },
            {
                "EN MILLIONS DE MAD": "",
                "31-déc-23": "",
                "31-déc-22": ""
            },
            {
                "EN MILLIONS DE MAD": "TOTAL AUTRES ACTIFS FINANCIERS",
                "31-déc-23": "49,9",
                "31-déc-22": "64,4"
            }
        ],
        [
            {
                "EN MILLIONS DE MAD": "• Clients et comptes rattachés",
                "31-déc-23": "1 649,6",
                "31-déc-22": "1 333,1"
            },
            {
                "EN MILLIONS DE MAD": "• Dépréciation clients et comptes rattachés",
                "31-déc-23": "(334,7)",
                "31-déc-22": "(325,9)"
            },
            {
                "EN MILLIONS DE MAD": "TOTAL CRÉANCES CLIENTS",
                "31-déc-23": "1 314,9",
                "31-déc-22": "1 007,2"
            },
            {
                "EN MILLIONS DE MAD": "• Fournisseurs débiteurs - Avances et acomptes",
                "31-déc-23": "19,2",
                "31-déc-22": "34,0"
            },
            {
                "EN MILLIONS DE MAD": "• Personnel – débiteur",
                "31-déc-23": "0,4",
                "31-déc-22": "0,5"
            },
            {
                "EN MILLIONS DE MAD": "• Etat – débiteur",
                "31-déc-23": "193,6",
                "31-déc-22": "148,6"
            },
            {
                "EN MILLIONS DE MAD": "• Comptes d'associés débiteurs",
                "31-déc-23": "",
                "31-déc-22": ""
            },
            {
                "EN MILLIONS DE MAD": "• Créances sur cession d’actifs",
                "31-déc-23": "",
                "31-déc-22": ""
            },
            {
                "EN MILLIONS DE MAD": "• Autres débiteurs",
                "31-déc-23": "22,7",
                "31-déc-22": "12,4"
            },
            {
                "EN MILLIONS DE MAD": "• Compte de régularisation – Actif",
                "31-déc-23": "4,6",
                "31-déc-22": "1,6"
            },
            {
                "EN MILLIONS DE MAD": "TOTAL AUTRES DÉBITEURS COURANTS",
                "31-déc-23": "240,6",
                "31-déc-22": "197,1"
            }
        ],
        [
            {
                "EN MILLIONS DE DHS": "• Réserve légale",
                "31-déc-23": "39,0",
                "31-déc-22": "39,0"
            },
            {
                "EN MILLIONS DE DHS": "• Réserve de conso Groupe",
                "31-déc-23": "",
                "31-déc-22": ""
            },
            {
                "EN MILLIONS DE DHS": "• Autres réserves Groupe",
                "31-déc-23": "462,3",
                "31-déc-22": "480,3"
            },
            {
                "EN MILLIONS DE DHS": "• Autres réserves",
                "31-déc-23": "850,1",
                "31-déc-22": "845,7"
            },
            {
                "EN MILLIONS DE DHS": "• Report à nouveau",
                "31-déc-23": "5,8",
                "31-déc-22": "2,2"
            },
            {
                "EN MILLIONS DE DHS": "RÉSERVES GROUPE",
                "31-déc-23": "1 357,3",
                "31-déc-22": "1 367,2"
            }
        ],
        [
            {
                "EN MILLIONS DE MAD": "",
                "31-déc-23": "",
                "31-déc-22": ""
            },
            {
                "EN MILLIONS DE MAD": "• Titres et valeurs de placement",
                "31-déc-23": "480,2",
                "31-déc-22": "809,7"
            },
            {
                "EN MILLIONS DE MAD": "• Banque",
                "31-déc-23": "287,7",
                "31-déc-22": "9,0"
            },
            {
                "EN MILLIONS DE MAD": "• Autres comptes de trésorerie",
                "31-déc-23": "0,2",
                "31-déc-22": "32,9"
            },
            {
                "EN MILLIONS DE MAD": "TOTAL",
                "31-déc-23": "768,1",
                "31-déc-22": "851,6"
            }
        ],
        [
            {
                "EN MILLIONS DE DHS": "• Intérêts minoritaires en début d’exercice",
                "31-déc-23": "2,28",
                "31-déc-22": "2,01"
            },
            {
                "EN MILLIONS DE DHS": "• Dividendes versés",
                "31-déc-23": "",
                "31-déc-22": ""
            },
            {
                "EN MILLIONS DE DHS": "• Autres variations",
                "31-déc-23": "",
                "31-déc-22": ""
            },
            {
                "EN MILLIONS DE DHS": "• Résultat de l’exercice",
                "31-déc-23": "0,27",
                "31-déc-22": "0,27"
            },
            {
                "EN MILLIONS DE DHS": "INTÉRÊTS MINORITAIRES DE LA CLÔTURE",
                "31-déc-23": "2,55",
                "31-déc-22": "2,28"
            }
        ],
        [
            {
                "EN MILLIONS DE MAD": "• Litiges",
                "31-déc-23": "0,1",
                "31-déc-22": "0,1"
            },
            {
                "EN MILLIONS DE MAD": "• Autres risques",
                "31-déc-23": "86,6",
                "31-déc-22": "86,6"
            },
            {
                "EN MILLIONS DE MAD": "TOTAL",
                "31-déc-23": "86,7",
                "31-déc-22": "86,7"
            },
            {
                "EN MILLIONS DE MAD": "DONT:",
                "31-déc-23": "",
                "31-déc-22": ""
            },
            {
                "EN MILLIONS DE MAD": "• Part non courante",
                "31-déc-23": "59,8",
                "31-déc-22": "59,8"
            },
            {
                "EN MILLIONS DE MAD": "• Part courante",
                "31-déc-23": "26,9",
                "31-déc-22": "26,9"
            }
        ],
        [
            {
                "EN MILLIONS DE DHS": "• Capitaux propres consolidés en début d’exercice",
                "31-déc-23": "1 844,8",
                "31-déc-22": "1 888,1"
            },
            {
                "EN MILLIONS DE DHS": "• Dividendes versés",
                "31-déc-23": "(117,0)",
                "31-déc-22": "(148,2)"
            },
            {
                "EN MILLIONS DE DHS": "• Autres variations",
                "31-déc-23": "20,6",
                "31-déc-22": "18,9"
            },
            {
                "EN MILLIONS DE DHS": "• Augmentation de capital",
                "31-déc-23": "",
                "31-déc-22": ""
            },
            {
                "EN MILLIONS DE DHS": "• Résultat net (Part du Groupe) de la période",
                "31-déc-23": "65,1",
                "31-déc-22": "85,9"
            },
            {
                "EN MILLIONS DE DHS": "CAPITAUX PROPRES CONSOLIDÉS PART DU GROUPE",
                "31-déc-23": "1 813,9",
                "31-déc-22": "1 844,8"
            }
        ],
        [
            {
                "EN MILLIONS DE MAD": "",
                "Solde au 31 décembre 2022": "",
                "Dotation de l’exercice": "",
                "Reprise provisions": "",
                "Solde au 31 décembre 2023": ""
            },
            {
                "EN MILLIONS DE MAD": "• Litiges",
                "Solde au 31 décembre 2022": "0,1",
                "Dotation de l’exercice": "",
                "Reprise provisions": "",
                "Solde au 31 décembre 2023": "0,1"
            },
            {
                "EN MILLIONS DE MAD": "• Autres risques",
                "Solde au 31 décembre 2022": "86,6",
                "Dotation de l’exercice": "",
                "Reprise provisions": "",
                "Solde au 31 décembre 2023": "86,6"
            },
            {
                "EN MILLIONS DE MAD": "TOTAL",
                "Solde au 31 décembre 2022": "86,7",
                "Dotation de l’exercice": "",
                "Reprise provisions": "",
                "Solde au 31 décembre 2023": "86,7"
            },
            {
                "EN MILLIONS DE MAD": "DONT:",
                "Solde au 31 décembre 2022": "",
                "Dotation de l’exercice": "",
                "Reprise provisions": "",
                "Solde au 31 décembre 2023": ""
            },
            {
                "EN MILLIONS DE MAD": "• Part non courante",
                "Solde au 31 décembre 2022": "61,6",
                "Dotation de l’exercice": "",
                "Reprise provisions": "",
                "Solde au 31 décembre 2023": "59,8"
            },
            {
                "EN MILLIONS DE MAD": "• Part courante",
                "Solde au 31 décembre 2022": "28,6",
                "Dotation de l’exercice": "",
                "Reprise provisions": "",
                "Solde au 31 décembre 2023": "26,9"
            }
        ],
        [
            {
                "Groupe": "Filiale",
                "SONASID": "SONASID"
            },
            {
                "Groupe": "Avantages",
                "SONASID": "Maladie"
            },
            {
                "Groupe": "",
                "SONASID": "31/12/2023"
            },
            {
                "Groupe": "Provisions au 1er Janvier 2023",
                "SONASID": "(102.191.319)"
            },
            {
                "Groupe": "• Coût de service de la période",
                "SONASID": "(8.294.048)"
            },
            {
                "Groupe": "• Reprises pour utilisation/Prestations payées",
                "SONASID": "3.394.957"
            },
            {
                "Groupe": "• Variation de périmètre",
                "SONASID": "0"
            },
            {
                "Groupe": "• Business combination (seulement si significatif)",
                "SONASID": "0"
            },
            {
                "Groupe": "• Ecart de conversion",
                "SONASID": "0"
            },
            {
                "Groupe": "• Ecarts actuarials",
                "SONASID": "26.085.828"
            },
            {
                "Groupe": "Provisions au 31 décembre 2023",
                "SONASID": "(81.004.582)"
            }
        ],
        [
            {
                "Catégorie Socioprofessionnelle (CSP)": "• Personnel d’exécution",
                "Indemnité en MAD": "30 000"
            },
            {
                "Catégorie Socioprofessionnelle (CSP)": "• Agent de maîtrise",
                "Indemnité en MAD": "35 000"
            },
            {
                "Catégorie Socioprofessionnelle (CSP)": "• Cadre",
                "Indemnité en MAD": "40 000"
            },
            {
                "Catégorie Socioprofessionnelle (CSP)": "• Cadre directeur",
                "Indemnité en MAD": "50 000"
            }
        ],
        [
            {
                "HYPOTHESES ECONOMIQUES": "DATE D’ÉVALUATION",
                "null": ""
            },
            {
                "HYPOTHESES ECONOMIQUES": "TAUX D’INFLATION",
                "null": ""
            },
            {
                "HYPOTHESES ECONOMIQUES": "TAUX D’INFLATION MÉDICALE",
                "null": ""
            },
            {
                "HYPOTHESES ECONOMIQUES": "TAUX D’ACTUALISATION",
                "null": ""
            },
            {
                "HYPOTHESES ECONOMIQUES": "• Frais de Santé",
                "null": ""
            },
            {
                "HYPOTHESES ECONOMIQUES": "• Indemnités de Fin de Carrière",
                "null": ""
            },
            {
                "HYPOTHESES ECONOMIQUES": "TAUX MOYEN DE CHARGES SOCIALES",
                "null": ""
            },
            {
                "HYPOTHESES ECONOMIQUES": "TAUX D’AUGMENTATION DES RÉMUNÉRATIONS ( BRUT D’INFLATION )",
                "null": ""
            },
            {
                "HYPOTHESES ECONOMIQUES": "TAUX DE REVALORISATION DES INDEMNITÉS FORFAITAIRES",
                "null": ""
            },
            {
                "HYPOTHESES ECONOMIQUES": "HYPOTHESES DEMOGRAPHIQUES",
                "null": ""
            },
            {
                "HYPOTHESES ECONOMIQUES": "MORTALITÉ",
                "null": ""
            },
            {
                "HYPOTHESES ECONOMIQUES": "INVALIDITÉ",
                "null": ""
            },
            {
                "HYPOTHESES ECONOMIQUES": "TAUX DE MOBILITE PAR TRANCHES D’AGES",
                "null": ""
            },
            {
                "HYPOTHESES ECONOMIQUES": "TRANCHES D’ÂGES",
                "null": "Non Cadres"
            },
            {
                "HYPOTHESES ECONOMIQUES": "• 29 ans et avant",
                "null": "10.00%"
            },
            {
                "HYPOTHESES ECONOMIQUES": "• 30 à 34 ans",
                "null": "5.00 %"
            },
            {
                "HYPOTHESES ECONOMIQUES": "• 35 à 39 ans",
                "null": "3.75%"
            },
            {
                "HYPOTHESES ECONOMIQUES": "• 40 à 44 ans",
                "null": "2,50 %"
            },
            {
                "HYPOTHESES ECONOMIQUES": "• 45 à 49 ans",
                "null": "1,00 %"
            },
            {
                "HYPOTHESES ECONOMIQUES": "• 50 ans et plus",
                "null": "0.00%"
            },
            {
                "HYPOTHESES ECONOMIQUES": "",
                "null": ""
            },
            {
                "HYPOTHESES ECONOMIQUES": "TAUX D’OCCUPATION JUSQU’À LA RETRAITE",
                "null": "Identique à celui de la date\nd’évaluation"
            },
            {
                "HYPOTHESES ECONOMIQUES": "AGE DE DÉPART À LA RETRAITE",
                "null": "60 ans"
            }
        ],
        [
            {
                "EN MILLIONS DE MAD": "DETTES FOURNISSEURS NON COURANTS",
                "31-déc-23": "",
                "31-déc-22": ""
            },
            {
                "EN MILLIONS DE MAD": "• Compte de régularisation - passif - part > 1 an",
                "31-déc-23": "17,9",
                "31-déc-22": "20,5"
            },
            {
                "EN MILLIONS DE MAD": "TOTAL AUTRES CRÉDITEURS NON COURANTS",
                "31-déc-23": "17,9",
                "31-déc-22": "20,5"
            },
            {
                "EN MILLIONS DE MAD": "TOTAL FOURNISSEURS ET AUTRES CRÉDITEURS NON COURANTS",
                "31-déc-23": "17,9",
                "31-déc-22": "20,5"
            }
        ],
        [
            {
                "EN MILLIONS DE MAD": "FOURNISSEURS ET COMPTES RATTACHÉS",
                "31-déc-23": "2 032,6",
                "31-déc-22": "1 619,0"
            },
            {
                "EN MILLIONS DE MAD": "• Clients créditeurs Avances & Acomptes",
                "31-déc-23": "12,5",
                "31-déc-22": "158,5"
            },
            {
                "EN MILLIONS DE MAD": "• Personnel créditeur",
                "31-déc-23": "6,5",
                "31-déc-22": "5,8"
            },
            {
                "EN MILLIONS DE MAD": "• Organismes sociaux",
                "31-déc-23": "2,3",
                "31-déc-22": "8,8"
            },
            {
                "EN MILLIONS DE MAD": "• Etat créditeur",
                "31-déc-23": "482,2",
                "31-déc-22": "370,5"
            },
            {
                "EN MILLIONS DE MAD": "• Comptes d'associés créditeurs",
                "31-déc-23": "1,2",
                "31-déc-22": "1,9"
            },
            {
                "EN MILLIONS DE MAD": "• Dettes s/ acquis. d'actifs",
                "31-déc-23": "",
                "31-déc-22": ""
            },
            {
                "EN MILLIONS DE MAD": "• Autres créanciers",
                "31-déc-23": "0,7",
                "31-déc-22": "0,7"
            },
            {
                "EN MILLIONS DE MAD": "• Compte de régularisation – passif",
                "31-déc-23": "1,0",
                "31-déc-22": "0,1"
            },
            {
                "EN MILLIONS DE MAD": "TOTAL AUTRES CRÉDITEURS COURANTS",
                "31-déc-23": "506,4",
                "31-déc-22": "546,4"
            },
            {
                "EN MILLIONS DE MAD": "TOTAL FOURNISSEURS ET AUTRES CRÉDITEURS NON COURANTS",
                "31-déc-23": "2 539,0",
                "31-déc-22": "2 165,4"
            }
        ],
        [
            {
                "EN MILLIONS DE MAD": "• Emprunts auprès des établissements de crédit",
                "31-déc-23": "0,00",
                "31-déc-22": "0,00"
            },
            {
                "EN MILLIONS DE MAD": "• Dettes de location financement",
                "31-déc-23": "0,00",
                "31-déc-22": "0,00"
            },
            {
                "EN MILLIONS DE MAD": "• Dettes liées aux contrats à droit d'usage",
                "31-déc-23": "109,0",
                "31-déc-22": "109,0"
            },
            {
                "EN MILLIONS DE MAD": "TOTAL DETTES FINANCIÈRES NON COURANTES",
                "31-déc-23": "115,7",
                "31-déc-22": "123"
            },
            {
                "EN MILLIONS DE MAD": "• Emprunts obligataires",
                "31-déc-23": "0,00",
                "31-déc-22": "0,00"
            },
            {
                "EN MILLIONS DE MAD": "• Emprunts auprès des établissements de crédit",
                "31-déc-23": "0,00",
                "31-déc-22": "0,00"
            },
            {
                "EN MILLIONS DE MAD": "• Dettes de location financement",
                "31-déc-23": "0,00",
                "31-déc-22": "0,00"
            },
            {
                "EN MILLIONS DE MAD": "• Instruments dérivés de couverture",
                "31-déc-23": "0,00",
                "31-déc-22": "0,00"
            },
            {
                "EN MILLIONS DE MAD": "TOTAL DETTES FINANCIÈRES COURANTES",
                "31-déc-23": "0,00",
                "31-déc-22": "0,00"
            },
            {
                "EN MILLIONS DE MAD": "TOTAL",
                "31-déc-23": "109,0",
                "31-déc-22": "109,0"
            }
        ],
        [
            {
                "EN MILLIONS DE MAD": "• Fournisseurs et autres créditeurs",
                "31-déc-23": "2 556,9",
                "31-déc-22": "2 185,9"
            },
            {
                "EN MILLIONS DE MAD": "• Dettes financières non courantes",
                "31-déc-23": "109,0",
                "31-déc-22": "109,0"
            },
            {
                "EN MILLIONS DE MAD": "• Dettes financières courantes",
                "31-déc-23": "0,0",
                "31-déc-22": "0,0"
            },
            {
                "EN MILLIONS DE MAD": "",
                "31-déc-23": "",
                "31-déc-22": ""
            },
            {
                "EN MILLIONS DE MAD": "TOTAL",
                "31-déc-23": "2.666,6",
                "31-déc-22": "2.295,0"
            }
        ],
        [
            {
                "EN MILLIONS DE MAD": "• Autres actifs financiers",
                "31-déc-23": "49,9",
                "31-déc-22": "64,4"
            },
            {
                "EN MILLIONS DE MAD": "• Clients et autres débiteurs",
                "31-déc-23": "1 555,5",
                "31-déc-22": "1 204,3"
            },
            {
                "EN MILLIONS DE MAD": "• Trésorerie et Equivalents de trésorerie",
                "31-déc-23": "768,1",
                "31-déc-22": "851,6"
            },
            {
                "EN MILLIONS DE MAD": "TOTAL",
                "31-déc-23": "2 373,5",
                "31-déc-22": "2 120,3"
            }
        ],
        [
            {
                "EN MILLIONS DE MAD": "INSTRUMENTS DÉRIVÉS – ACTIF",
                "31-déc-23": "9,9",
                "31-déc-22": "24,4"
            },
            {
                "EN MILLIONS DE MAD": "• change",
                "31-déc-23": "9,9",
                "31-déc-22": "24,4"
            },
            {
                "EN MILLIONS DE MAD": "",
                "31-déc-23": "",
                "31-déc-22": ""
            },
            {
                "EN MILLIONS DE MAD": "INSTRUMENTS DÉRIVÉS – PASSIF",
                "31-déc-23": "",
                "31-déc-22": ""
            },
            {
                "EN MILLIONS DE MAD": "• change",
                "31-déc-23": "",
                "31-déc-22": ""
            }
        ],
        [
            {
                "EN MILLIONS DE MAD": "• Administrateurs",
                "31-déc-23": "2,0",
                "31-déc-22": "2,0"
            },
            {
                "EN MILLIONS DE MAD": "• Membres du comité de direction",
                "31-déc-23": "8,5",
                "31-déc-22": "7,4"
            },
            {
                "EN MILLIONS DE MAD": "TOTAL",
                "31-déc-23": "10,5",
                "31-déc-22": "9,4"
            }
        ],
        [
            {
                "EN MILLIONS DE MAD": "• Charges locatives des biens hors scope < 12 mois",
                "31-déc-23": "(0,51)",
                "31-déc-22": "(0,72)"
            },
            {
                "EN MILLIONS DE MAD": "• Charges locatives des biens hors scope de faible valeur",
                "31-déc-23": "(0,12)",
                "31-déc-22": "(0,12)"
            },
            {
                "EN MILLIONS DE MAD": "• Charges relatives aux paiements de loyers variables",
                "31-déc-23": "",
                "31-déc-22": ""
            },
            {
                "EN MILLIONS DE MAD": "• Produits de sous-location tirés d'actifs au titre de droits d'utilisation",
                "31-déc-23": "",
                "31-déc-22": ""
            },
            {
                "EN MILLIONS DE MAD": "• Sortie de trésorerie relatives aux contrats de location",
                "31-déc-23": "",
                "31-déc-22": ""
            },
            {
                "EN MILLIONS DE MAD": "TOTAL",
                "31-déc-23": "(0,63)",
                "31-déc-22": "(0,84)"
            }
        ],
        [
            {
                "EN MILLIONS DE MAD": "• Dans 1 an",
                "31-déc-23": "19,85",
                "31-déc-22": "11,44"
            },
            {
                "EN MILLIONS DE MAD": "• Entre 1 et 5 ans",
                "31-déc-23": "48,35",
                "31-déc-22": "26,02"
            },
            {
                "EN MILLIONS DE MAD": "• Supérieur à 5 ans",
                "31-déc-23": "125,91",
                "31-déc-22": "71,59"
            },
            {
                "EN MILLIONS DE MAD": "TOTAL",
                "31-déc-23": "194,11",
                "31-déc-22": "109,05"
            }
        ],
        [
            {
                "EN MILLIONS DE MAD": "• Variation des stocks",
                "31-déc-23": "36,91",
                "31-déc-22": "(370,92)"
            },
            {
                "EN MILLIONS DE MAD": "• Variation des créances",
                "31-déc-23": "(349,93)",
                "31-déc-22": "(425,51)"
            },
            {
                "EN MILLIONS DE MAD": "• Variation des dettes",
                "31-déc-23": "371,63",
                "31-déc-22": "739,10"
            },
            {
                "EN MILLIONS DE MAD": "VARIATION DU BFR",
                "31-déc-23": "58,60",
                "31-déc-22": "(57,33)"
            }
        ],
        [
            {
                "EN MILLIONS DE MAD": "• Trésorerie et équivalents de trésorerie",
                "31-déc-23": "768,1",
                "31-déc-22": "851,6"
            },
            {
                "EN MILLIONS DE MAD": "• Trésorerie Passive (Montant inclus dans les dettes courantes envers les établissements de crédit)",
                "31-déc-23": "(0,0)",
                "31-déc-22": "(0,0)"
            },
            {
                "EN MILLIONS DE MAD": "TRÉSORERIE ET ÉQUIVALENTS DE TRÉSORERIE – BILAN",
                "31-déc-23": "768,1",
                "31-déc-22": "851,6"
            },
            {
                "EN MILLIONS DE MAD": "TRÉSORERIE ET ÉQUIVALENTS DE TRÉSORERIE – TFT",
                "31-déc-23": "768,1",
                "31-déc-22": "851,6"
            }
        ],
        [
            {
                "EN MILLIONS DE MAD": "• Avals, cautions et garanties donnés",
                "31-déc-23": "300,1",
                "31-déc-22": "267,5"
            },
            {
                "EN MILLIONS DE MAD": "• Dettes garanties par des actifs nantis ou hypothéqués",
                "31-déc-23": "0",
                "31-déc-22": "0"
            },
            {
                "EN MILLIONS DE MAD": "• Autres engagements donnés",
                "31-déc-23": "298,5",
                "31-déc-22": "52,3"
            },
            {
                "EN MILLIONS DE MAD": "TOTAL",
                "31-déc-23": "598,7",
                "31-déc-22": "319,8"
            }
        ],
        [
            {
                "EN MILLIONS DE MAD": "• Avals, cautions et garanties reçus",
                "31-déc-23": "248,5",
                "31-déc-22": "299,6"
            },
            {
                "EN MILLIONS DE MAD": "• Nantissement et hypothèques reçus",
                "31-déc-23": "0",
                "31-déc-22": "0"
            },
            {
                "EN MILLIONS DE MAD": "• Autres engagements reçus",
                "31-déc-23": "0",
                "31-déc-22": "0"
            },
            {
                "EN MILLIONS DE MAD": "TOTAL",
                "31-déc-23": "248,5",
                "31-déc-22": "299,6"
            }
        ],
        [
            {
                "": "",
                "31 Décembre 2023": "% d’intérêt",
                "null": "Méthode",
                "31 Décembre 2022": "% d’intérêt"
            },
            {
                "": "• SONASID",
                "31 Décembre 2023": "100%",
                "null": "IG",
                "31 Décembre 2022": "100%"
            },
            {
                "": "• LONGOMETAL ARMATURE",
                "31 Décembre 2023": "96,93%",
                "null": "IG",
                "31 Décembre 2022": "96,93%"
            }
        ]
    ]
}