{
    "text": "COMMUNIQUÉ FINANCIER\nRÉSULLTTAATTS ANNUELS 2023\nCCrrooiissssaannncccceee dduu cchhiiffffrreee dddd’’’aaaffffaaiiress ppoorrttéée aussi bien par l’activité Vie quue par l’activité Non--vie.\nRésuullttaattss eenn pprrooggrreesssionn eennnn rraaiissoon de l’amélioration des indicateurss techniques et finannciers.\nLee CCoonseeiilll dddd’’AAddministrationn de Wafa Assurance s’est réuni le Jeuudi 14 mars 2024, sous la\nPPrréésidence de Monsieur Bouubker JAI, en vue d’examiner l’activité dee la compagnie et d’arrêter\nlles comptes au 31 décembree 2023.\nRésultats sociaux\nChiffre d’affaires social (en MDH)\nEn 2023, le chiffre d’affaires social de Wafa Assurance atteint 11 164 MDH,\n+7,1%\nsoit +7,1% par rapport à 2022.\n10 425 11 164\nLL’’activité Vie s’élève à 6 273 MDH en progression de +5,6% portéée par la\nppeerrfformancee eenn EEppaarrggnnee eett PPrrévoyyance.\nLL’’activité Non-Vie progresse de +9,1%, à 4 891 MDH conséquemmment à la\nDéc 2022 Déc 2023\nperformance de l’ensemble des branches Noon-Vie.\nLe résultat Vie s’établit à 464 MDH en pprogression de 1,5% suuite à la\nRésultat net social (en MDH)\ncroissance de l’activité en Epargne et en Déccès.\n+15,4%\n607 701 Le résultat Non-Vie ressort à 436 MDH en prrogression par rapport aau niveau\nenregistré en 2022 (157 MDH), portée par la croissance de l’activité et par la\nbonne tenue du résultat financierr..\nLe résultat net social atteint 701 MDH en prrogression de 15,4%.\nDéc 2022 Déc 2023\nLes fonds propres sociaux s’élèvent à 6 601 MDH en hausse de 3,9%.\nFonds propres sociaux (en MDH)\nRésultats consolidés\n+3,9%\n6 356 6 601\nAu 31 décembre 2023, le chiffre d’affairees consolidé annuel s’établit à\n12 724 MDH enregistrant une hausse de 99,3% portée par la perfformance\nréalisée sur l’ensemble des branches Vie et Non-vie au Maroc et à\nl’international.\nDéc 2022 Déc 2023\nLe RNPG de l’exercice 2023 ressort à 670 MDDH vs 776 MDH en 2022 en baisse\nde 13,6% impacté par l’évolution des marchés financiers et les chaarges non\nChiffre d’affaires consolidé (en MDH)\ncourantes en 2023 (notamment le don au foonds spécial pour la gestion des\n+9,3% effets du séisme d’Al Haouz).\n11 639 12 724\nLes capitaux propres part du groupe s’élèvent à 9 232 MDH au 31 ddécembre\n2023 vs. 8 057 MDH en 2022 en hausse de 144,6%.\nLe périmètre de consolidation, comprenantt Wafa Assurance et sees filiales\nDéc2022 Déc 2023 africaines, a connu courant 2023 l’entréee de deux fonds communs de\nplacement dédiés.\nRN Part du groupe (en MDH) Au vu des résultats enregistrés et des peerspectives de la comppagnie, le\nConseil d’Administration a décidé de prooposer à l’Assemblée Générale\n-13,6%\nOrdinaire, convoquée pour le 15 Mai 2024 à 11h00, la distribution au titre de\n776 670\nl’exercice 2023, d’un dividende de 140 dirhamms par action.\nWafa Assurance confirme ainsi son leadership et la soliditéé de ses\nfondamentaux, et poursuit le développement de ses activités.\nDéc2022 Déc 2023\nContact : information.financiere@wafaassurance.co.ma\nLien internet : https://www.wafaassurance.ma/fr/compagnnie-assurance-maroc\nSA au Capital de 350.000.000,00 de dirhams- Régie par la loi 17/99 portant code ddes assurances - RC 31.719\nAVIS DE REUNION DE L’ASSEMBLEE GENERALE ORDINAIRE ANNUELLE\nL’ORDRE DU JOUR DE L’ASSEMBLEE GENERALE ORDINAIRE ANNUELLE\nLes actionnaires de WAFA ASSURANCE sont priés d’assister à son Assemblée Générale Ordinaire qui se tiendra le Mercredi 15 mai 2024 à 11 heures au siège social, sis\n1, Boulevard Abdelmoumen – Casablanca, en vue de délibérer et statuer sur l’ordre du jour suivant :\n1. Rapports du Conseil d’Administration et des Commissaires aux Comptes au titre de l’exercice 2023 ;\n2. Approbation des comptes de l’exercice clos le 31 décembre 2023 ;\n3. Rapport spécial des commissaires aux comptes sur les conventions visées à l’article 56 de la loi 17/95 relative aux sociétés anonymes telle que modifiée et\ncomplétée;\n4. Affectation du résultat de l’exercice ;\n5. Prise d'acte de la démission d’un administrateur\n6. Renouvellement du mandat d’un administrateur\n7. Nomination de deux nouveaux administrateurs\n8. Prise d'acte de la désignation du nouveau représentant permanent de la société Omnium de Gestion Marocain\n9. Quitus aux administrateurs et aux commissaires aux comptes ;\n10. Pouvoirs à conférer.\nAVIS DE DE PARTICIPATION A L’ASSEMBLEE GENERALE ORDINAIRE ANNUELLE DE WAFA ASSURANCE DU MARDI 15 MAI 2024\nLes actionnaires de WAFA ASSURANCE sont priés d’assister à l’Assemblée Générale Ordinaire Vote par procuration :Les actionnaires qui ne peuvent participer à cette Assemblée ni voter\nqui se tiendra le Mardi 15 Mai 2024 à 11 heures au siège social, sis 1, Boulevard Abdelmoumen – par correspondance, peuvent se faire représenter par le Président de l’assemblée et actionnaire\nCasablanca. de la Société ou par tout autre actionnaire en remplissant la formule de pouvoirs et en procédant\nà sa signature, dont le modèle est disponible et peut être téléchargé sur le site internet de Wafa\nModalités de vote à l’Assemblée Générale\nAssurance : www.wafaassurance.ma.\nLes détenteurs d’actions au porteur doivent fournir au siège de la société une attestation émanant\nd’un organisme bancaire ou d’une société de bourse agréée, justifiant de la qualité de l’actionnaire\nLa procuration doit être accompagnée de l’attestation originale de propriété des actions, délivrée\net ce, au plus tard cinq (5) jours avant la tenue de l’assemblée.\npar l’organisme dépositaire de celles-ci et, devra être envoyée par courrier recommandé avec\naccusé de réception à l’adresse du siège de Wafa Assurance et par courriel à l’adresse\nLes titulaires d’actions nominatives, pour être admis à l’Assemblée sont tenus d’être inscrits, cinq\nago2023@wafaassurance.co.ma, au moins trois (3) jours ouvrés avant la réunion de l’Assemblée\n(5) jours avant la tenue de l’Assemblée, dans les registres de la société.\nGénérale, soit au plus tard le 10 Mai 2024.\nLes actionnaires présents à l’Assemblée Générale participent en leur nom propre, au vote du projet\ndes résolutions qui leur sont soumises. Ils peuvent également participer à ce vote au nom des Les documents requis par la loi 17-95 telle que modifiée et complétée sont mis à la disposition des\nactionnaires représentés, suivant les modalités ci-après définies. actionnaires sur le site internet de la Société www.wafaassurance.ma.\nPROJET DE RESOLUTIONS AGO DU 15 MAI 2024\nPREMIERE RESOLUTION\nL’Assemblée Générale Ordinaire, après avoir entendu lecture des rapports du SEPTIEME RESOLUTION\nconseil d’administration et des commissaires aux comptes, approuve les états de L’Assemblée Générale Ordinaire prend acte que le mandat d’administrateur de\nsynthèse sociaux arrêtés à la date du 31 décembre 2023, tels qu’ils viennent de Monsieur Abdelmjid TAZLAOUI arrive à échéance à l’issue de la présente Assemblée\nlui être présentés, faisant ressortir un bénéfice net après impôts de 700.563.187,82 et décide, sur proposition du Conseil d’Administration, de le renouveler pour une\nDH. période de six ans.\nCe mandat viendra à expiration à la date de l’Assemblée Générale Ordinaire qui\nDEUXIEME RESOLUTION statuera sur les comptes de l’exercice 2029.\nL’Assemblée Générale Ordinaire, après avoir entendu lecture des rapports du Conseil\nd’Administration et des Commissaires aux Comptes, approuve les comptes HUITIEME RESOLUTION\nconsolidés arrêtés à la date du 31 décembre 2023, tels qu’ils viennent de lui être L’Assemblée Générale Ordinaire nomme, sur proposition du Conseil\nprésentés, faisant ressortir un Résultat Net Part du Groupe de 670.499.153,62 DH. d’Administration, Messieurs Karim CHBANI et Badr ALIOUA en qualité\nd’Administrateurs pour une durée statutaire de 6 ans, soit jusqu’à la date de\nTROISIEME RESOLUTION l’Assemblée Générale Ordinaire appelée à statuer sur les comptes de l’exercice\nL’Assemblée Générale Ordinaire, après avoir entendu lecture du rapport spécial 2029.\ndes commissaires aux comptes, sur les conventions relevant de l’article 56 et\nsuivants de la loi 17/95 relative aux sociétés anonymes telle que modifiée et NEUVIEME RESOLUTION\ncomplétée, approuve les conclusions dudit rapport et les conventions qui y sont L’Assemblée Générale Ordinaire prend acte de la désignation de Madame Yasmine\nmentionnées. ABOUDRAR en tant que nouveau représentant permanent de la société Omnium\nde Gestion Marocain au sein du Conseil d’Administration de Wafa Assurance.\nQUATRIEME RESOLUTION Ainsi, le Conseil d’Administration de Wafa Assurance se composera de :\nL’Assemblée Générale Ordinaire décide, sur proposition du conseild’administration,\nd’affecter le bénéfice net de l’exercice 2023 comme suit : (cid:129)Monsieur Boubker JAI Président Directeur Général\nBénéfice net de l’exercice 2023 : 700.563.187,82 (cid:129)Monsieur Hassan OURIAGLI Administrateur\nReport à nouveau 2022 : 4.939.579.336,55 (cid:129)Monsieur Abdelmjid TAZLAOUI Administrateur\nMontant distribuable : 5.640.142.524,37 (cid:129)Monsieur Aymane TAUD Administrateur\nRéserve légale : - (cid:129)Monsieur Mohamed EL KETTANI Administrateur\nDividende : 490.000.000,00 (cid:129)OGM représenté par\nRéserve facultative : - Madame Yasmine ABOUDRAR Administrateur\nReport à nouveau : 5.150.142.524,37 (cid:129)Monsieur Ahmed Ismail DOUIRI Administrateur\nLe dividende ordinaire de l’exercice 2023 est fixé à 140 Dirhams par action. (cid:129)Monsieur Hassan BERTAL Administrateur\nLe dividende ainsi fixé sera mis en paiement à partir du Mercredi 26 Juin 2024 (cid:129)Monsieur Karim CHBANI Administrateur\naux guichets d’Attijariwafa bank. (cid:129)Monsieur Badr ALIOUA Administrateur\n(cid:129)Monsieur Gilles DUPIN Administrateur\nCINQUIEME RESOLUTION (cid:129)Madame Magali NOE Administratrice\nL’Assemblée Générale Ordinaire donne quitus entier et définitif de leurs mandats (cid:129)Madame Marie-Laure Mazaud Administratrice\naux administrateurs et aux commissaires aux comptes au titre de l’exercice 2023. (cid:129)Madame Rachida BENABDELLAH Administratrice\nSIXIEME RESOLUTION DIXIEME RESOLUTION\nL'Assemblée Générale Ordinaire prend acte de la démission de Monsieur Mohamed L’Assemblée Générale Ordinaire donne tous pouvoirs au porteur d’une copie ou\nRamses ARROUB de son mandat d’administrateur et lui donne quitus définitif et d’un extrait des présentes pour accomplir toutes les formalités légales prescrites\nsans réserve. par la loi.\nRÉSULTATS ANNUELS 2023\nBILAN\n31/12/2023 31/12/2022\nA C T I F Brut Amort./Prov. Net Net P A S S I F 31/12/2023 31/12/2022\nACTIF IMMOBILISE 45 530 888 255,40 1 647 017 504,40 43 883 870 751,00 41 391 234 100,29 FINANCEMENT PERMANENT 49 797 741 470,25 46 360 365 615,14\nImmobilisation en non-valeurs 286 421 143,46 142 786 450,78 143 634 692,68 63 143 906,80 Capitaux propres 6 601 142 524,37 6 355 579 336,55\nFrais préliminaires -\nCapital social ou fonds d’établissement 350 000 000,00 350 000 000,00\nCharges à répartir sur plusieurs exercices 286 421 143,46 142 786 450,78 143 634 692,68 63 143 906,80\nà déduire : Actionnaires, capital souscrit non appelé -\nPrimes de remboursement des obligations -\nCapital appelé, (dont versé..................................) -\nImmobilisations incorporelles 419 919 338,93 217 048 509,18 202 870 829,75 186 722 856,86\nPrimes d'émission, de fusion, d'apport -\nImmobilisation en recherche et développement -\nEcarts de réévaluation -\nBrevets, marques, droits et valeurs similaires 399 934 648,57 217 048 509,18 182 886 139,39 162 881 386,48\nFonds commercial - Réserve légale 35 000 000,00 35 000 000,00\nAutres immobilisations incorporelles 19 984 690,36 19 984 690,36 23 841 470,38 Autres réserves 576 000 000,00 576 000 000,00\nImmobilisations corporelles 479 077 669,04 319 741 359,21 159 336 309,83 75 252 373,34 Report à nouveau (1) 4 939 579 336,55 4 787 433 001,26\nTerrains 66 025 580,00 66 025 580,00 5 305 580,00 Fonds social complémentaire -\nConstructions 106 475 752,54 71 372 682,95 35 103 069,59 15 443 239,52 Résultats nets en instance d’affectation (1) -\nInstallations techniques, matériel et outillage 10 938 265,26 7 742 773,86 3 195 491,40 3 924 163,92 Résultat net de l'exercice (1) 700 563 187,82 607 146 335,29\nMatériel de transport 1 833 803,23 1 762 611,87 71 191,36 181 472,76 Capitaux propres assimilés - -\nMobilier, matériel de bureau et aménagements divers 276 286 067,80 238 863 290,53 37 422 777,27 37 579 955,72 Provisions réglementées - -\nAutres immobilisations corporelles 1 497 045,96 1 497 045,96 1 497 045,96 Dettes de financement 3 726 289,92 3 332 569,92\nImmobilisations corporelles en cours 16 021 154,25 16 021 154,25 11 320 915,46 Emprunts obligataires -\nImmobilisations financières 2 458 511 109,95 122 497 094,41 2 336 014 015,54 2 326 165 699,42 Emprunts pour fonds d’établissement -\nPrêts immobilisés - Autres dettes de financement 3 726 289,92 3 332 569,92\nAutres créances financières 518 929 852,32 518 929 852,32 1 125 689 146,21 Provisions durables pour risques et charges 76 000 000,00 40 000 000,00\nTitres de participation - Provisions pour risques -\nAutres titres immobilisés 1 939 581 257,63 122 497 094,41 1 817 084 163,22 1 200 476 553,21 Provisions pour charges 76 000 000,00 40 000 000,00\nPlacements affectés aux opérations d’assurance 41 886 958 994,02 844 944 090,82 41 042 014 903,20 38 739 949 263,87 Provisions techniques brutes 43 116 872 655,96 39 961 453 708,67\nPlacements immobiliers 2 124 767 365,91 361 284 907,49 1 763 482 458,42 1 024 352 577,74 Provisions pour primes non acquises 936 159 459,00 936 262 885,00\nObligations, bons et titres de créances négociables 16 712 742 244,27 100 000 000,00 16 612 742 244,27 14 950 574 284,22 Provisions pour sinistres à payer 10 394 173 120,96 10 203 168 427,87\nActions et parts sociales 20 480 793 591,32 329 886 208,04 20 150 907 383,28 19 301 726 685,50 Provisions des assurances vie 28 611 533 465,92 25 963 202 350,07\nPrêts et effets assimilés 682 725 125,15 53 772 975,29 628 952 149,86 644 576 455,70 Provisions pour fluctuations de sinistralité 735 887 157,74 651 128 883,74\nDépôts en comptes indisponibles 642 671 750,45 642 671 750,45 1 471 995 322,26 Provisions pour aléas financiers - -\nPlacements affectés aux contrats en unités de compte 1 131 703 985,45 1 131 703 985,45 1 239 664 036,98 Provisions techniques des contrats en unités de compte 1 131 703 985,45 1 239 664 036,98\nDépôts auprès des cédantes - - Provisions pour participations aux bénéfices 938 021 906,28 790 382 891,97\nAutres placements 111 554 931,47 111 554 931,47 107 059 901,47 Provisions techniques sur placements 22 639 173,04 22 639 173,04\nEcarts de conversion – actif - Autres provisions techniques 346 754 387,57 155 005 060,00\nDiminution de créances immobilisées et des placements - Ecarts de conversion –passif -\nAugmentation des dettes de financement et des provisions - Augmentation des créances immobilisées et des placements -\ntechniques Diminution des dettes de financement et des provisions techniques -\nACTIF CIRCULANT (hors trésorerie) 10 882 068 764,66 1 617 783 229,14 9 264 285 535,52 8 436 984 951,91 PASSIF CIRCULANT (hors trésorerie) 3 861 113 882,95 4 035 135 430,67\nPart des cessionnaires dans les provisions techniques 2 240 270 950,00 - 2 240 270 950,00 2 002 572 301,00 Dettes pour espèces remises par les cessionnaires 670 384 477,24 519 982 021,70\nProvisions pour primes non acquises 208 965 563,00 208 965 563,00 213 207 996,00 Dettes pour espèces remises par les cessionnaires 670 384 477,24 519 982 021,70\nProvisions pour sinistres à payer 1 458 087 377,00 1 458 087 377,00 1 328 645 168,00 Dettes de passif circulant 3 190 729 405,71 3 515 153 408,97\nProvisions des assurances vie 446 526 863,00 446 526 863,00 450 395 849,00 Cessionnaires et comptes rattachés créditeurs 111 403 935,48 128 272 375,76\nAutres provisions techniques 126 691 147,00 126 691 147,00 10 323 288,00\nAssurés, intermédiaires, cédants, coassureurs et comptes rattachés créditeurs 870 470 937,38 786 851 093,10\nCréances de l’actif circulant 6 651 411 574,72 1 617 783 229,14 5 033 628 345,58 4 970 510 941,99\nPersonnel créditeur 67 523 757,10 49 003 048,12\nCessionnaires et comptes rattachés débiteurs 185 597 458,98 185 597 458,98 115 285 340,34\nOrganismes sociaux créditeurs 14 839 783,66 14 089 451,31\nAssurés, intermédiaires, cédants, coassureurs et comptes rattachés\n4 075 792 864,83 1 603 314 959,53 2 472 477 905,30 2 678 554 528,89\ndébiteurs Etat créditeur 311 620 262,05 303 376 872,81\nPersonnel débiteur 1 659 780,24 - 1 659 780,24 1 600 875,95\nEtat débiteur 703 925 951,81 703 925 951,81 680 760 031,42 Comptes d'associés créditeurs 109 005,04 108 745,04\nComptes d'associés débiteurs - - Autres créanciers 1 107 469 673,66 1 112 818 110,97\nAutres débiteurs 1 059 576 819,44 12 667 194,93 1 046 909 624,51 965 893 518,69 Comptes de régularisation-passif 707 292 051,34 1 120 633 711,86\nComptes de régularisation-actif 624 858 699,42 1 801 074,68 623 057 624,74 528 416 646,70 Autres provisions pour risques et charges -\nTitres et valeurs de placement (non affectés aux opérations Ecarts de conversion -passif (éléments circulants) -\nd’assurance) 1 990 386 239,94 1 990 386 239,94 1 463 901 708,92 -\nEcarts de conversion -actif (éléments circulants) - -\nTRESORERIE 511 962 586,72 - 511 962 586,72 578 663 860,19 TRESORERIE 1 263 520,04 11 381 866,58\nTrésorerie-actif 511 962 586,72 - 511 962 586,72 578 663 860,19 Trésorerie-passif 1 263 520,04 11 381 866,58\nChèques et valeurs à encaisser 46 696 015,97 46 696 015,97 38 771 526,31 Crédits d'escompte -\nBanques, TGR, C.C.P. 465 266 377,80 - 465 266 377,80 539 891 979,74 Crédits de trésorerie -\nCaisses, régies d’avances et accréditifs 192,95 192,95 354,14 Banques 1 263 520,04 11 381 866,58\nTOTAL GENERAL 56 924 919 606,78 3 264 800 733,54 53 660 118 873,24 50 406 882 912,39 TOTAL GENERAL 53 660 118 873,24 50 406 882 912,39\nI - COMPTE TECHNIQUE ASSURANCES VIE II - COMPTE TECHNIQUE ASSURANCES NON VIE\nLibellé 31/12/2023 31/12/2022 Libellé 31/12/2023 31/12/2022\nBrut Cessions Net Net Brut Cessions Net Net\n1 Primes 6 272 568 725,04 24 012 922,07 6 248 555 802,97 5 915 359 361,42 1 Primes 4 891 401 660,55 987 106 736,47 3 904 294 924,08 3 679 308 300,49\nPrimes émises 6 272 568 725,04 24 012 922,07 6 248 555 802,97 5 915 359 361,42 Primes émises 4 891 298 234,55 982 864 303,47 3 908 433 931,08 3 773 854 058,49\n2 Produits techniques d’exploitation 59 143 569,71 59 143 569,71 81 043 242,66 Variation des provisions pour primes non acquises -103 426,00 -4 242 433,00 4 139 007,00 94 545 758,00\nSubventions d’exploitation 2 Produits techniques d’exploitation 76 680 390,72 76 680 390,72 58 064 702,27\nAutres produits d’exploitation 47 265 970,92 47 265 970,92 71 453 054,69 Subventions d’exploitation\nReprises d’exploitation, transferts de charges 11 877 598,79 11 877 598,79 9 590 187,96 Autres produits d’exploitation 33 711 442,06 33 711 442,06 23 370 796,40\n3 Prestations et frais 6 433 210 652,42 41 052 731,73 6 392 157 920,69 5 864 371 366,68 Reprises d’exploitation, transferts de charges 42 968 948,66 42 968 948,66 34 693 905,88\nPrestations et frais payés 3 689 384 973,40 48 760 080,73 3 640 624 892,67 4 202 828 712,94 3 Prestations et frais 3 414 040 754,41 481 045 042,99 2 932 995 711,42 2 766 383 604,48\nVariation des provisions pour sinistres à payer -37 327 894,60 -3 838 363,00 -33 489 531,60 5 297 544,26 Prestations et frais payés 3 002 344 060,15 231 396 611,99 2 770 947 448,16 2 517 789 446,10\nVariation des provisions des assurances vie 2 648 331 115,85 -3 868 986,00 2 652 200 101,85 1 709 071 792,81 Variation des provisions pour sinistres à payer 228 332 587,69 133 280 572,00 95 052 015,69 106 012 764,43\nVariation des provisions pour fluctuations de sinistralité 93 143 495,00 93 143 495,00 24 959 862,00 Variation des provisions pour fluctuations de sinistralité -8 385 221,00 -8 385 221,00 22 192 015,95\nVariation des provisions pour aléas financiers Variation des provisions pour aléas financiers\nVariation des provisions techniques des contrats en unités de compte -107 960 051,54 -107 960 051,54 -122 489 705,64 Variation des provisions pour participations aux bénéfices\nVariation des provisions pour participation aux bénéfices 147 639 014,31 147 639 014,31 44 703 160,31 Variation des autres provisions techniques 191 749 327,57 116 367 859,00 75 381 468,57 120 389 378,00\nVariation des autres provisions techniques 4 Charges techniques d’exploitation 1 279 788 556,76 1 279 788 556,76 1 208 270 415,45\n4 Charges techniques d’exploitation 564 008 995,58 564 008 995,58 527 743 146,28 Charges d’acquisition des contrats 558 423 182,69 558 423 182,69 545 897 107,96\nCharges d’acquisition des contrats 391 052 267,85 391 052 267,85 371 800 556,77 Achats consommés de matières et fournitures 12 171 596,38 12 171 596,38 10 396 260,50\nAchats consommés de matières et fournitures 3 364 507,23 3 364 507,23 2 873 763,85 Autres charges externes 199 105 589,43 199 105 589,43 167 480 788,58\nAutres charges externes 55 037 332,32 55 037 332,32 46 295 515,08 Impôts et taxes 45 724 105,28 45 724 105,28 43 089 617,02\nImpôts et taxes 12 639 187,00 12 639 187,00 11 910 954,28 Charges de personnel 265 663 127,11 265 663 127,11 236 517 022,67\nCharges de personnel 73 435 355,86 73 435 355,86 65 378 706,92 Autres charges d'exploitation 7 720 695,44 7 720 695,44 9 137 740,69\nAutres charges d'exploitation 2 134 176,56 2 134 176,56 2 525 880,23 Dotations d'exploitation 190 980 260,42 190 980 260,42 195 751 878,02\nDotations d'exploitation 26 346 168,77 26 346 168,77 26 957 769,16 5 Produits des placements affectes aux opérations d’assurance 693 956 481,98 693 956 481,98 495 002 616,87\n5 Produits des placements affectés aux opérations d’assurance. 1 220 449 188,30 1 220 449 188,30 1 112 213 590,16 Revenus des placements 449 604 587,95 449 604 587,95 409 924 926,15\nRevenus des placements 974 679 118,47 974 679 118,47 912 682 751,65 Gains de change 513 591,95 513 591,95 6 213 499,84\nGains de change Produits des différences sur prix de remboursement à\n1 126 355,11 1 126 355,11 842 718,75\nProduits des différences sur prix de remboursement à percevoir 18 887 630,27 18 887 630,27 6 914 372,70 percevoir\nProfits sur réalisation de placements 165 409 374,79 165 409 374,79 186 017 149,77 Profits sur réalisation de placements 10 028 251,46 10 028 251,46 66 346 024,54\nAjustements de VARCUC (1)(plus-values non réalisées) 54 366 642,01 54 366 642,01 Profits provenant de la réévaluation des placements affectés\nProfits provenant de la réévaluation des placements affectés Intérêts et autres produits de placements 443 686,02 443 686,02 165 384,19\nIntérêts et autres produits de placements Reprises sur charges de placements ; Transferts de charges 232 240 009,49 232 240 009,49 11 510 063,40\nReprises sur charges de placement ; Transferts de charges 7 106 422,76 7 106 422,76 6 599 316,04 6 Charges des placements affectes aux opérations d’assurance 26 173 511,71 26 173 511,71 101 022 866,12\n6 Charges des placements affectes aux opérations d’assurance 108 379 752,82 108 379 752,82 259 553 869,24 Charges d’intérêts\nCharges d’intérêts Frais de gestion des placements 5 430 177,89 5 430 177,89 7 022 657,87\nPertes de change 2 291 683,79 2 291 683,79 1 892 229,67\nFrais de gestion des placements 13 881 154,32 13 881 154,32 14 245 219,41\nAmortissement des différences sur prix de remboursement 170 745,30 170 745,30 170 745,30\nPertes de change\nPertes sur réalisation de placements 7 602 100,00\nAmortissement des différences sur prix de remboursement 32 503 764,22 32 503 764,22 29 632 243,16\nPertes provenant de la réévaluation des placements affectés\nPertes sur réalisation de placements\nAutres charges de placements 3 530 000,00\nPertes provenant de la réévaluation des placements affectés\nDotations sur placements 18 280 904,73 18 280 904,73 80 805 133,28\nAjustements de VARCUC(1) (moins-values non réalisées) 99 118 485,40\nAutres charges de placements RESULTAT TECHNIQUE NON-VIE (1 + 2 - 3 - 4 + 5 - 6) 942 035 710,37 506 061 693,48 435 974 016,89 156 698 733,59\nDotations sur placement 61 994 834,28 61 994 834,28 116 557 921,27\nRESULTAT TECHNIQUE VIE (1+2 - 3 - 4+5 - 6) 446 562 082,23 -17 039 809,66 463 601 891,89 456 947 812,03\nRÉSULTATS ANNUELS 2023\nIII - COMPTE NON TECHNIQUE IV - RECAPITULATION\nOpérations 31/12/2023 31/12/2022\nConcernant les\nPropres à Totaux I RESULTAT TECHNIQUE VIE 463 601 891,89 456 947 812,03\nexercices\nLibellé !\"#$#%&'&# précédents 31/12/2023 31/12/2022 II RESULTAT TECHNIQUE NON-VIE 435 974 016,89 156 698 733,59\nIII RESULTAT NON TECHNIQUE -81 517 032,96 57 044 501,67\nIV RESULTAT AVANT IMPOTS 818 058 875,82 670 691 047,29\n1 Produits non techniques courants 96 602 557,22 96 602 557,22 85 960 178,14 V IMPOTS SUR LES RESULTATS 117 495 688,00 63 544 712,00\nProduits d’exploitation non techniques courants 150,00 VIRESULTAT NET 700 563 187,82 607 146 335,29\nIntérêts et autres produits non techniques courants 70 959 616,47 70 959 616,47 78 088 036,58\nProduits des différences sur prix de remboursement à percevoir 7 208 991,56 TOTAL DES PRODUITS ASSURANCES VIE 7 528 148 560,98 7 108 616 194,24\nTOTAL DES PRODUITS ASSURANCES NON-VIE 4 674 931 796,78 4 232 375 619,63\nAutres produits non techniques courants 278 000,00 278 000,00 663 000,00\nTOTAL DES PRODUITS NON TECHNIQUES 186 605 709,06 106 930 178,14\nReprises non techniques, transferts de charges 25 364 940,75 25 364 940,75\nTOTAL DES PRODUITS 12 389 686 066,82 11 447 921 992,01\n2 Charges non techniques courantes 107 680 315,96 2 519 561,63 110 199 877,59 37 019 616,43 TOTAL DES CHARGES ASSURANCES VIE 7 064 546 669,09 6 651 668 382,20\nCharges d’exploitation non techniques courantes 6 000 713,71 2 519 561,63 8 520 275,34 8 731 250,38 TOTAL DES CHARGES ASSURANCES NON-VIE 4 238 957 779,89 4 075 676 886,05\nCharges financières non techniques courantes 2 971 073,29 2 971 073,29 3 144 621,85 TOTAL DES CHARGES NON TECHNIQUES 268 122 742,02 49 885 676,47\nAmortissement des différences sur prix de remboursement IMPOTS SUR LES RESULTATS 117 495 688,00 63 544 712,00\nAutres charges non techniques courantes TOTAL DES CHARGES 11 689 122 879,00 10 840 775 656,72\nRESULTAT NET 700 563 187,82 607 146 335,29\nDotations non techniques courantes 98 708 528,96 98 708 528,96 25 143 744,20\nRésultat non technique courant (1 - 2) -13 597 320,37 48 940 561,71 TABLEAU DE FINANCEMENT DE L’EXERCICE\n3 Produits non techniques non courants 90 003 090,00 61,84 90 003 151,84 20 970 000,00\nI - SYNTHESE DES MASSES DU BILAN\nProduits des cessions d'immobilisations 3 090,00 3 090,00 970 000,00\nSubventions d’équilibre Exercice Exercice précédent Variations (a-b)\nMASSES\nProfits provenant de la réévaluation des éléments d’actif (a) (b) emplois (c) ressources (d)\nAutres produits non courants 61,84 61,84 1 Financement permanent (moins rubrique 16) 6 680 868 814,29 6 398 911 906,47 281 956 907,82\nReprises non courantes, transferts de charges 90 000 000,00 90 000 000,00 20 000 000,00 2 Moins Actif immobilisé (moins rubrique 26) 2 841 855 847,80 2 651 284 836,42 190 571 011,38\n3 = Fonds de roulement fonctionnel (1-2) (A) 3 839 012 966,49 3 747 627 070,05 91 385 896,44\n4 Charges non techniques non courantes 142 790 011,61 15 132 852,82 157 922 864,43 12 866 060,04\n4 Provisions techniques nettes de cessions (16 – 32) 40 876 601 705,96 37 958 881 407,67 2 917 720 298,29\nValeurs nettes d'amortissements des immobilisations cédées 8 218,75 8 218,75 302 750,05 5 Placements moins dépôts des réassureurs (26 – 42) 40 371 630 425,96 38 219 967 242,17 2 151 663 183,79\nSubventions accordées 6 = Besoin en couverture (4 – 5) (B) 504 971 280,00 -261 085 834,50 766 057 114,50\nPertes provenant de la réévaluation des éléments d’actif 7 Actif circulant (moins rubrique 32) 7 024 014 585,52 6 434 412 650,91 589 601 934,61\n8 Moins Passif circulant (moins rubrique 42) 3 190 729 405,71 3 515 153 408,97 324 424 003,26\nAutres charges non courantes 86 781 792,86 15 132 852,82 101 914 645,68 12 563 309,99\n9 = Besoin de financement (7-8) (C) 3 833 285 179,81 2 919 259 241,94 914 025 937,87\nDotations non courantes 56 000 000,00 56 000 000,00 10 Trésorerie nette (actif - passif) = (A+ B - C) 510 699 066,68 567 281 993,61 56 582 926,93\nRésultat non technique non courant (3 - 4) -67 919 712,59 8 103 939,96\nII – FLUX DE TRESORERIE\nRESULTAT NON TECHNIQUE (1 - 2 + 3 - 4) -81 517 032,96 57 044 501,67 Exercice Exercice précédent\nRésultat net 700 563 187,82 607 146 335,29\n+ Variation des provisions techniques nettes de cessions 2 917 720 298,29 2 004 682 570,13\nETAT DES SOLDES DE GESTION\n- Variation des frais d'acquisition reportés 5 568 764,00 10 593 885,00\n- Variation des amortissements et provisions (1) -112 752 776,71 -362 822 972,65\nI - TABLEAU DE FORMATION DES RÉSULTATS (TFR)\n- Variation des ajustements VARCUC (736 – 636) 54 366 642,01 -99 118 485,40\nExercice + + ou – values provenant de la réévaluation d’éléments d’actif\nExercice\nPrécédent - + ou – values réalisées sur cessions d'éléments d'actifs 3 090,00 970 000,00\n1 Primes acquises (1a – 1b) 11 163 970 385,59 10 378 302 134,35 - Variations des créances et dettes techniques (341 + 342 - 441 - 442 - 42) -256 568 303,13 794 584 052,60\n1a Primes émises 11 163 866 959,59 10 425 138 745,35 - Variation des créances pour espèces ou titres déposées (267)\n1b Variation des provisions pour primes non acquises -103 426,00 46 836 611,00 - Variation des débiteurs et créditeurs divers (343 à 348 – 443 à 448) 88 741 872,17 -125 715 336,36\n2 Variation des provisions mathématiques (60311+60317 + 6032 + 6033 + 60261+60267) 2 417 411 010,55 1 416 976 715,16 - Autres variations (349 – 449) 502 413 874,56 -538 149 202,53\n3 Ajustement VARCUC -54 366 642,01 99 118 485,40 A – flux d'exploitation 3 336 510 323,21 2 931 486 964,76\n4 Charges des prestations (4a + 4b) 7 024 580 443,04 7 040 609 827,48 - Acquisitions - cessions d'immeubles (261) 764 137 862,12 307 299 114,31\n4a Prestations et frais payés (hors rubrique 9) 6 660 074 566,92 6 891 280 118,48 - Acquisitions - cessions d'obligations (262) 1 662 167 960,05 1 071 148 965,27\n4b Variation des provisions pour prestations et diverses 364 505 876,12 149 329 709,00 - Acquisitions - cessions d'actions (263) 650 502 194,28 258 731 236,09\nA - Solde de souscription (Marge brute) (1 – 2- 3 -4) 1 776 345 574,01 1 821 597 106,31 - Autres Acquisitions - cessions du (26) -1 001 946 703,18 -555 624 342,36\n5 Charges d’acquisition 949 475 450,54 917 697 664,73 - Autres Acquisitions - cessions (21 22 23 24 25 35) 863 625 656,87 1 174 042 294,45\n6 Autres charges techniques d’exploitation 894 322 101,80 818 315 897,00 B – flux net d'investissement -2 938 486 970,14 -2 255 597 267,76\n7 Produits techniques d’exploitation 135 823 960,43 139 107 944,93 - Dividendes versés 455 000 000,00 420 000 000,00\nB - Charges d’acquisition et de gestion nettes (5 + 6 - 7) 1 707 973 591,91 1 596 905 616,80 + Emissions/(remboursement) nets d'emprunts 393 720,00 -395 760,00\nC - Marge d’exploitation (A – B) 68 371 982,10 224 691 489,51 + Augmentation /(réduction) de capital et fonds d’établissement\n8 Produits nets des placements (73 – 63) (hors ajustement VARCUC) 1 725 485 763,74 1 345 757 957,07 + Augmentation /(réduction) d'actions auto-détenues\n9 Participations aux résultats et charges des intérêts crédités (60115,60316, 60266, 6071) 405 259 953,24 357 549 157,65 - C – flux de financement -454 606 280,00 -420 395 760,00\nD - Solde financier (8 – 9) 1 320 225 810,50 988 208 799,42 D - Impact de change (+17- 27-37+47)\nE - Résultat technique brut (C + D) 1 388 597 792,60 1 212 900 288,93 E -Variation nette de la trésorerie ( A + B + C + D) -56 582 926,93 255 493 937,00\n10 Part des réassureurs dans les primes acquises 1 011 119 658,54 783 634 472,44 F - Trésorerie au 1er janvier 567 281 993,61 311 788 056,61\n11 Part des réassureurs dans les prestations payées 280 156 692,72 199 069 529,13 G - Trésorerie en fin de période (E + F) 510 699 066,68 567 281 993,61\n12 Part des réassureurs dans les provisions 241 941 082,00 -14 688 800,00 !\"!\"#$#%\"&'()\"%&'(*+,*%'+'\nF - Solde de réassurance (11 + 12 – 10) -489 021 883,82 -599 253 743,31\nETAT A2- ETAT DES DEROGATIONS\nG - Résultat technique net (E + F) 899 575 908,78 613 646 545,62\n13 Résultat non technique courant -13 597 320,37 48 940 561,71\n!\"#$%&\"'&()&*()+,-./01-\"*(*%,((\n14 Résultat non technique non courant -67 919 712,59 8 103 939,96 !\")1'/01-\"()&*()+,-./01-\"* 2%*01#1'/01-\"()&*()+,-./01-\"* $&(3/0,14-1\"&5($/(*10%/01-\"(\nH - Résultat non technique (13 + 14) -81 517 032,96 57 044 501,67 #1\"/\"'16,&(&0($&*(,+*%$0/0*\nI – Résultat avant impôts (G + H) 818 058 875,82 670 691 047,29 !\"#\"$%&'()*+',-\")./\"0&+,1+02-\"\n\"\"\"\"1'30*)452-\"6',7)32,*)./ 7(8(9(7(: 7(8(9(7(:\n15 Impôts sur les sociétés 117 495 688,00 63 544 712,00\nJ - Résultat net (I – 15) 700 563 187,82 607 146 335,29\n!!\"#\"$%&'()*+',-\")./\"3%*8'72-\"\n16 C’ - Marge d’exploitation nette de réassurance (C + F) -420 649 901,72 -374 562 253,80 \"\"\"\"79%:)5.)*+',\n7(8(9(7(: 7(8(9(7(:\nII - CAPACITE D’AUTOFINANCEMENT (CAF) - AUTOFINANCEMENT\nExercice !!!\"#\"$%&'()*+',-\")./\"&;(52-\"\"\"\nExercice \"\"\"\"\"79%*)45+--232,*\"2*\"72\nPrécédent\n\"\"\"\"\"0&%-2,*)*+',\"72-\"%*)*- 7(8(9(7(: 7(8(9(7(:\n1 Résultat net de l’exercice Bénéfice + 700 563 187,82 607 146 335,29 \"\"\"\"72\"-<,*8;-2\nPerte - 0\n2 + Dotations d’exploitation (1) 217 326 429,19 222 709 647,18\n3 + Dotations sur placements (1) 80 275 739,01 197 363 054,55 ETAT A3 - ETAT DES CHANGEMENTS DE METHODES\n4 + Dotations non techniques courantes 98 708 528,96 25 143 744,20\n5 + Dotations non techniques non courantes 56 000 000,00 0,00 !\"#$%&'(&)'*+\",-&.&,#) /$)#0102\"#03,' 4,15$&,2&')$%'5&'6\"#%0.30,&7'5\"''\n6 - Reprises d’exploitation (2) 54 846 547,45 44 284 093,84 8$'2+\",-&.&,# )0#$\"#03,'10,\",209%&'&#'5&)'%:)$5#\"#)\n7 - Reprises sur placements (2) 239 346 432,25 18 109 379,44 4';'*+\",-&.&,#)'\"11&2#\",#'5&)\n8 - Reprises non techniques courantes 25 364 940,75 0,00 !!!!.:#+3(&)'(<:=\"5$\"#03,\n9 - Reprises non techniques non courantes (2) (3) 20 000 000,00 20 000 000,00 !'>'?'!'@ !'>'?'!'@\n10 - Profits provenant de la réévaluation 0\n11 + Pertes provenant de la réévaluation 0\n12 - Produits des cessions d’immobilisations 3 090,00 970 000,00 44';'*+\",-&.&,#)'\"11&2#\",#''5&)\n'''''%9-5&)'(&'6%:)&,#\"#03, !'>'?'!'@ !'>'?'!'@\n13 + Valeur nette d’amortissements des immobilisations cédées 8 218,75 302 750,05\n= CAPACITE D’AUTOFINANCEMENT 813 321 093,28 969 302 057,99\n14 - Distribution de bénéfices 455 000 000,00 420 000 000,00\n= AUTOFINANCEMENT 358 321 093,28 549 302 057,99\n(1) A l’exclusion des dotations relatives aux actifs et passifs circulants et à la trésorerie.\n(2) A l’exclusion des reprises relatives aux actifs et passifs circulants et à la trésorerie.\n(3) Y compris les reprises sur subventions.\nRÉSULTATS ANNUELS 2023\nETAT B4 - TABLEAU DES TITRES DE PARTICIPATION (EXERCICE DU 01/01/2023 AU 31/12/2023)\nRaison Sociale Secteur Capital % Prix PROVISION Valeur Extrait des derniers états de synthèse de la sté émettrice Produits inscrits\nde la société d'Activité social particiaption d'acquisition comptable Date de Situation Résultat au CPC\némettrice au capital global nette clôture nette net de l'exercice\nI - IMMOBILISATIONS FINANCIERES\nPanorama Immobilier 110(cid:2)000(cid:2)000 100,0% 209(cid:2)638(cid:2)000 46(cid:2)638(cid:2)000 163(cid:2)000(cid:2)000 31/12/2023 21(cid:2)310(cid:2)733 - 6 (cid:2)165(cid:2)477 3(cid:2)727(cid:2)917\nWAA Nvie Sénégal Assurance 68(cid:2)048(cid:2)000 100,0% 67(cid:2)331(cid:2)521 - 67(cid:2)331(cid:2)521 31/12/2023 23(cid:2)974(cid:2)321 - 18(cid:2)521(cid:2)395\nPRO ASSUR SA Assurance 85(cid:2)060(cid:2)000 65,0% 58(cid:2)228(cid:2)798 6(cid:2)888(cid:2)436 51(cid:2)340(cid:2)362 31/12/2023 46(cid:2)531(cid:2)226 4(cid:2)634(cid:2)646\nWAA NVie Côte d'ivoire Assurance 68(cid:2)048(cid:2)000 100,0% 66(cid:2)550(cid:2)795 - 66(cid:2)550(cid:2)795 31/12/2023 44(cid:2)758(cid:2)588 - 2 (cid:2)416(cid:2)173\nWafa Life Insurance Egypt Assurance 92(cid:2)046(cid:2)396 99,9% 91(cid:2)954(cid:2)350 26(cid:2)222(cid:2)241 65(cid:2)732(cid:2)109 31/12/2022 20(cid:2)524(cid:2)847 - 10(cid:2)355(cid:2)940\nWAFA ASSURANCE REAL ESTATE INVESTMENT Immobilier 137(cid:2)800(cid:2)000 100,0% 137(cid:2)800(cid:2)000 - 137(cid:2)800(cid:2)000 31/12/2023 133(cid:2)728(cid:2)480 - 1 (cid:2)067(cid:2)754 3(cid:2)223(cid:2)506\nWAFA ASSURANCE REAL ESTATE MANAGEMENT Immobilier 300(cid:2)000 100,0% 300(cid:2)000 - 300(cid:2)000 31/12/2023 122(cid:2)455 - 6 5(cid:2)140\nWafa Takaful Assurance 50(cid:2)000(cid:2)000 100,0% 50(cid:2)000(cid:2)000 - 50(cid:2)000(cid:2)000 31/12/2022 41(cid:2)429(cid:2)037 - 6 (cid:2)337(cid:2)672\nTOTAL 681(cid:2)803(cid:2)464 79(cid:2)748(cid:2)678 602(cid:2)054(cid:2)787\nII - PLACEMENTS AFFECTES AUX OPERATIONS\nD'ASSURANCE\nWAA Vie Sénégal Assurance 51(cid:2)036(cid:2)000 100,0% 50(cid:2)383(cid:2)025 - 50(cid:2)383(cid:2)025 31/12/2023 121(cid:2)079(cid:2)621 21(cid:2)779(cid:2)547\nWAA Vie Cameroun Assurance 77(cid:2)601(cid:2)939 97,5% 72(cid:2)448(cid:2)984 - 72(cid:2)448(cid:2)984 31/12/2023 92(cid:2)521(cid:2)017 6(cid:2)860(cid:2)061\nWAA Vie Côte d'ivoire Assurance 59(cid:2)542(cid:2)000 100,0% 58(cid:2)406(cid:2)206 - 58(cid:2)406(cid:2)206 31/12/2023 157(cid:2)243(cid:2)931 34(cid:2)948(cid:2)219\nATTIJARI ASSURANCE TUNISIE Assurances 33(cid:2)954(cid:2)000 55,0% 64(cid:2)483(cid:2)528 - 64(cid:2)483(cid:2)528 31/12/2023 227(cid:2)598(cid:2)273 42(cid:2)548(cid:2)840\nAFRICA RE Assurances 2(cid:2)991(cid:2)813(cid:2)820 0,2% 4(cid:2)934(cid:2)106 - 4(cid:2)934(cid:2)106 31/12/2022 10(cid:2)354(cid:2)328(cid:2)905 247(cid:2)955(cid:2)264 482(cid:2)115\nWAFA IMA Assistance 50(cid:2)000(cid:2)000 32,5% 16(cid:2)249(cid:2)800 - 16(cid:2)249(cid:2)800 31/12/2023 245(cid:2)013(cid:2)045 52(cid:2)368(cid:2)842 5(cid:2)849(cid:2)892\nRMA WATANIYA Assurances 1(cid:2)796(cid:2)170(cid:2)800 0,8% 58(cid:2)917(cid:2)202 - 58(cid:2)917(cid:2)202 31/12/2022 6(cid:2)007(cid:2)552(cid:2)353 905(cid:2)458(cid:2)408 7(cid:2)475(cid:2)610\nC.A.T. Assurances 162(cid:2)656(cid:2)000 9,1% 14(cid:2)747(cid:2)600 - 14(cid:2)747(cid:2)600 31/12/2022 853(cid:2)933(cid:2)041 260(cid:2)975(cid:2)512 22(cid:2)563(cid:2)828\nSTE DES SELS DE MOHAMEDIA Mines 53(cid:2)300(cid:2)000 24,5% 160(cid:2)475(cid:2)001 1(cid:2)850(cid:2)976 158(cid:2)624(cid:2)025 31/12/2022 121(cid:2)979(cid:2)829 47(cid:2)334(cid:2)158 7(cid:2)351(cid:2)936\nTOTAL 501(cid:2)045(cid:2)452 1(cid:2)850(cid:2)976 499(cid:2)194(cid:2)477 43(cid:2)723(cid:2)381\nETAT B4 BIS - TABLEAU DES PLACEMENTS (EXERCICE 31/12/2023) ETAT B5 - I - PROVISIONS (EXERCICE DU 01/01/2023 AU 31/12/2023\n!\"#$%& !\"#$%& !\"#$%& '#%()*% !\"#\"$%&'!(!&)(\"*+,-)!./+(\nIHIJIK3L)EMGN3OP +&%,$ -$,,$ .$)&/\"#0(\",0*- 1*0-(\n2\"#%$)#\",$-,$ E894F94\"F3\"GHI34\"G5\"JK5L52M7M5 'F27F47896\"G5\"JK5L52M7M5 E894F94\"F\"JF\"N79\"G5\"JK5L52M7M5\n)0*/%+ 1234 ,5667896 )54 1234 ,5667896 )54 1234 ,5667896 )54\n!\"##$%&' ())*+,-*.(, ())*+,-*.(, ())*+,-*.(, /\n01&'2#342%1&' 5)6*,6,*+(/ (/6*+/,*.,, (/6*+/,*.,, / !\"#$%&%#'&()#*\"()\"%+,&('#'(-./*%&,& 012(323(445 361(378(002 831(759(440:(((((((((((671(932( :(((((9(393(911( 9(610(778 012(650(950 374(025(521 838(601(402\n7$#2'*\"2*$42%1&'*8\"*'14%929'*%::1;%<%=#\"' >./*(,/*6/+ .,(*+/>*6/+ .,(*+/>*6/+ /\n!\"#$%&%#'&()#*\"(&%'%&;\",&(<()-=,\" 67(371(624(9346(134(295(624 4(489(531(327((((606(779(201( (630(993(370( 26(523(94967(109(681(6366(954(748(188 4(012(745(899\n?32#\"'*@<$4\":\"&2'*%::1;%<%\"#' .*5+.*--.*.-( .*5+.*--.*.-( .*5+.*--.*.-( /\n7<$4\":\"&2'*%::1;%<%\"#'*\"&*413#' .,*/>.*.+) .,*/>.*.+) .,*/>.*.+) / !\"#$%&%#'&(>,&(-&&*\"-'.,&($%,(?,@)A%.-;%#'&(.%:>,&&#*&B 35(021(373(157 957(105(49435(563(472(573(3(294(116(662( :(((((1(424(042( 3(253(377(67334(266(511(928 992(532(42334(625(772(275\n3*,\"#)4#\"5$1$-,()011*60#0$&( 7)89:);<=)=:9 <)>=?)>@8)?>7 <)>=?)>@8)?>7 8\n!\"#$%&%#'()#*\"(CA*.;*-;%#'&(>,(&%'%&;\"-A%;D 256(634(449 256(634(449((((((49(854(389( 49(854(389 815(448(654 815(448(654\nA;<%B$2%1&'*8CD2$2\nE1&'*83*2#9'1# ..*5)+*,/-*,5, ..*,-.*>(-*6,+ ..*,-.*>(-*6,+ / !\"#$%&%#'&()#*\"(-AD-&(C%'-'.%,\"&\nA;<%B$2%1&'*B$#$&2%\"'*@$#*<CD2$2 /\n!%2#\"'*FG@12F94$%#\"'*H,I ()-*.,+*/>- ()-*.,+*/>- ()-*.,+*/>- / !\"#$%&%#'&(>,&(.#';\"-;&(,'(*'%;D&(>,(.#+);, 6(310(229(718 6(310(229(718 :678(027(753 :678(027(753 6(616(871(045 6(616(871(045\n!%2#\"'*8\"*4#9$&4\"'*&9B14%$;<\"' .*(,5*,//*/// .*(,5*,//*/// .*(,5*,//*/// / !\"#$%&%#'&()#*\"()-\";%.%)-;%#'&(-*@(ED'DC%.,& 807(143(403 807(143(403 698(210(769 698(210(769 014(736(072 014(736(072\n!%2#\"'*8\"*4#9$&4\"'*94F3\"' .//*///*/// / /\n?32#\"'*1;<%B$2%1&'*\"2*;1&' (*)+-*>>.*/5> (*(,+*(-,*(), (*(,+*(-,*(), / !\"#$%&%#'&(&*\"()A-.,+,';& 33(210(681 33(210(681 33(210(681 33(210(681\nF*;\",&()\"#$%&%#'&(;,.G'%/*,& 655(775(727 67(131(340 699(246(886 606(890(134 662(128(450 85(146(920 192(859(144 632(206(694 337(721(397\n3*,\"#)A6#0B\",0*-(C)6*-()$,),0,&$().$)5&/\"-5$()-/B*50\"6#$( :9)8<:)>@>)999 :;)997)?8:)<?8 :;)997)?8:)<?8 8\n!%2#\"'*8\"*@$#2%4%@$2%1&'* .*/(,*)6>*+(- .*//.*+>/*66, .*(6-*-(-*(.+ (66*).6*)>- *&*0: ;<\"<=>\"?@;\"AB<C\"BBC\"@AC\";B>;A\"<@D\"DD>\"?BD ;\">@@\"?>D\"<?A C;A\"=<D\"=?<C\"<>A\"ACB\"C<D?;\">>=\"DAC\"=@AC\"C?B\"CAB\"<@B?B\"DA=\"=B>\"ABA\n?42%1&'*4J29\"'*H.I -*(((*6-(*+,/ -*.56*)/+*/.- .>*>(.*()5*6.( (*/+>*-)>*5-) !!\"#\"$%&'()\"*'+,!)!+-)\nA70KL*A;<%B$2$%#\"' )*),/*)-,*(5. )*),/*)-,*(5. )*6>5*-+5*/,- (,5*),/*,-6\nA70KL*?42%1&' / /\n./01201\" 8+&$&!+-) '(*'!)() ./01201\"\nA70KL*M%N\"#'*H+I >*55+*,.5*//- >*55+*,.5*//- (*+.5*/>6*/,5 5).*)..*/+6\n?32#\"'*$42%1&'*\"2*@$#2'*'14%$<\"'*H>I )*>5+*(6(*(/( )*/,/*/66*.-/ )*.6-*+,5*>,- .>-*)5-*/6/\n/ -$&%'( 23\"45631\"47 897:;</=121=/0 >=020?=@A7B 0/0\"?/3A2017B 897:;</=121=/0 >=020?=@A7B 0/0\"?/3A2017B C\"<2\">=0\"47\n3*,\"#)\"5,0*-()$,),0,&$().$)4\"&,0504\",0*- <:)==:)=9<)9=< <:)?9;):<9)?9> <;):>>)=7@)>77 ?);9@)9:<)8>= <97:7A?=?7 <97:7A?=?7\n7#O2'*\"&*@#\":%=#\"*FG@12F=P3\" .6*,5+*+). .)*(>6*./. .)*(>6*./. /\n?N$&4\"'*'3#*@1<%4\"'*K%\" ),)*.(,*+5- ),)*.(,*+5- ),)*.(,*+5- /\n!\"#\"$%&'()(&*)\"+&,%\"-.+%./(01(&*\"-2\"340/1(5\"(66&7(3(). 898\":;<\";8; !=>\"<>?\"!88 :9;\"8!!\">8> 9=9\">89\":8<\n7#O2'*&$&2%'*@$#*8\"'*1;<%B$2%1&' )*/))*++, .*(,- .*(,- /\n?32#\"'*@#O2'*H(I +.5*)--*5/, )5>*..5*(+6 )5>*..5*(+6 /\n:\"#\"$%&'()(&*)\"%.@3262*1.)\n3*,\"#)4&D,()$,)5&/\"-5$()011*60#0(/( :)88?)7>;)7=< @>8)>=7)?8; @>8)>=7)?8; 8\nM9@J2'*Q*2\"#:\" / / / / >\"#\"$%&'()(&*)\"-,%0732)\"+&,%\"%()A,2)\"21\"/B0%@2)\nA70KL*:1&92$%#\"' >*((/*(,>*()6 >*((/*(,>*()6 >*()-*)6>*>>. .-*..-*65(\n?32#\"'*89@J2'R -(*5-5*//) -(*5-5*//) -(*5-5*//) / )+%)\"&+&$D\"E\"$\"F GHG\"IJK\"JGJ LMN\"KNO\"LGG IHJ\"GLL\"NGN HMH\"NGH\"IGK\nK$<\"3#'*#\":%'\"'*$3S*498$&2\"'\n0#9$&4\"'*@13#*\"'@=4\"'*#\":%'\"'*$3S*498$&2\"'\n;\"#\"$%&'()(&*)\"+&,%\"-.+%./(01(&*\"-2\"340/1(5\"/(%/,30*1 !\"C!;\"89C\"?8> !=>\"=!8\":C9 !\"9!8\"8<>\"::?\n3*,\"#)E/4F,( <)?<?):>@)7>< <)?<?):>@)7>< <)??7)<9@)<<> :@)::@)=97\n* / / / / C\"#\"D,1%2)\"+%&'()(&*)\"+&,%\"%()A,2)\"21\"/B0%@2)\nA;<%B$2%1&'*\"2*;1&' / / / /\n?42%1&'*\"2*@$#2'*$32#\"'*P3\"*<\"'*A70KL / / / / 9\"#\"$%&'()(&*)\"+&,%\"-.+%./(01(&*\"-2)\"/&6+12)\"-2\"1%.)&%2%(\n7$#2'*\"2*$42%1&'*A70KL .*.(.*5/(*-6+ .*.(.*5/(*-6+ .*.(.*5/(*-6+ /\n7$#2'*\"2*$42%1&'*$32#\"'*A70KL / / / /\n)+%)\"&+&$D\"E\"PF L\"QLJ\"GHQ\"OGN LMN\"MLG\"IQH L\"HLG\"GKN\"IIO\n?32#\"'*@<$4\":\"&2' / / / /\n3*,\"#)'#\"5$1$-,()%-0,/().$)5*14,$( :):7:)987)@=> :):7:)987)@=> :):7:)987)@=> 8\n&+&$D\"E\"$RP\"F I\"IKI\"MLJ\"JJG LMN\"MLG\"IQH LMN\"KNO\"LGG IHJ\"GLL\"NGN I\"IIJ\"LQO\"QMG\n3A3GH ?;)>7>)7:9)8@; ?>)7?8)>;>)@:< >8)87@)7@9)=?7 ?);@=)=7:)@7:\nETAT B6 - TABLEAU DES CREANCES (EXERCICE DU 01/01/2023 AU 31/12/2023) ETAT B7 - TABLEAU DES DETTES (31/12/2023)\n!\"!#$%&'(!)'&*+&!\"*& !,-)&%'!\"!#$%&% !\"!#$%&'(!)'&*+&!\"*& !,-)&%'!\"!#$%&%\n&./012 34567562'208 3456756' 34567562' &./012 34567562'208 3456756' 34567562'\nF&'#<!*-GH'G339IG#G%* &) ''&!\"*&% -9-!# (:02';<05'75 34=52';<05'75 81' .1 46' 05 A4 85 ?' 12 34 ;5 16 A7 =5 26 12 2'15' 48: B @>? 7 06 5 D7 =6 :2 =' .1 C 26' 12 152 60 :8 =1 ?8' @ 1:1 8 2=2 2' 12 81 @@ 178? E8 E'2 1;1 61 25 26?2\n9&'HI\"!\"*&3&\"-\n9&--&% -:-!# (;02'<=05'75 34>5 72 5'<=05' ' A1 76' B5 @4 15 2' 34 <5 16 C7 >5 26 12 2'15' 48; AD?@ 076 5 F7 >6 ;2 >' .1 E 26' 12 152 6 ;0 8 >1 @8' A 1;1 28>2 2' 12 81A A 18 7@ G8 G2 ' 1<1 61 25 26@2\nJ'GCC4D=:=276=452'E=575.=K812\n!!!!\"!#$%&'!())*+(,('-' !!!!\"!#$%&'()*!+,-./0)0.&1*\n!!!!\"!./&$0'!1$-2310'!4(3231(5$0' 678!9:9!86:;<: 678!9:9!86:;<: !!!!\"!2')&1*!31))1*!31!4.(0(51$1() 6!789!8:;<;8 6!789!8:;<;8 =<==\nJ'(:7.1C1562'7EE1.6?2'70L'4@?876=452';<7220875.1\n!!!\"=+,(>2&(*3'!0&!+*3'!0&!?@A 7B!C7:!CD:!:DD;:C76!BE6!<6<!:B9;<77!EEC!<88!9CD;9B7EE!EEE!EEE;EE:D:!:E8!6:7;ED77!D6D!D7:!7C9;B97!6EE!EEE!EEE;EE\n!!!\"!#$%&'!0&!0440&'!2''()(,-' B8:!C:6!7:6;76 B8:!C:6!7:6;76 7E6!E9<!7D:;B: J'KLM'LNOPOL J'KLM'LNOPOL QPQQ QPQQ QPQQ QPQQ QPQQ QPQQ\n!!!\"!@$-2310'!F*/$!G-FH&'!2/F$5'!G0'!1-G23&0' E;EE E;EE 9&%'!,-)&%'(!%%IH%'*I)*,#!\"-%\nMN'OMP'QON'RRMSNPMT'UVN'VVU'RPTSNUM'VVN'QUU'ONPSOTMVV'VVV'VVVSVVRPR'RVU'WRMSVPMM'PWP'PMR'MNOSTOM'WVV'VVV'VVVSVVMVW'VOQ'MPRSTR !\"!>1))1*!%+'&!3?%@)*!31*!&?0**'&0(51* 97=!6:A!A77<8A 97=!6:A!A77<8A\nF&'#<!*-GH'*G)*,#!\"- !\"!B1**.+((0.&1*!1)!5+$%)1*!&0))05C?* DDD!A=6!;6E<A: DDD!A=6!;6E<A:\n!\"!#2$&!G0'!$-2''/$0/$'!G23'!,0'!F$*I('(*3'!&01J3(K/0' :!:DE!:CE!96E;EE :!:DE!:CE!96E;EE !\"!2**'&?*<!.()1&$?3.0.&1*<!5?30()*<!5+0**'&1'&*!1)!5+$%)1*!&0))05C?* :7=!A7=!;67<6: :7=!A7=!;67<6:\n!\"!@0''(*332($0'!0&!1*)F&0'!$2&&21J-' 786!69C!D68;98 786!69C!D68;98 !\"!F1&*+((1- 97!E86!7E7<D= 97!E86!7E7<D=\n!\"!L3&0$)-G(2($0';!1-G23&';!1*2''/$0/$'!0&!1*)F&0'!$2&&21J-' D!EC6!C9:!8BD;8< D!EC6!C9:!8BD;8< !\"!G&/0(.*$1*!*+5.0'H DA!:6;!7:6<99 DA!:6;!7:6<99\n!\"!#0$'*330, 7!B69!C8E;:D 7!B69!C8E;:D\n!\"!M&2& CE<!9:6!967;87 CE<!9:6!967;87 CE<!9:6!967;87 !\"!#)0) 6DD!98=!898<=E 6DD!98=!898<=E 6DD!98=!898<=E\n!\"!@*)F&0'!GN2''*1(-' E;EE !\"!B+$%)1*!3I0**+5.?* D=;!==E<=A D=;!==E<=A D=;!==E<=A\n!\"!./&$0'!G-+(&0/$' 7!E69!6CB!879;DD 7!E69!6CB!879;DD !\"!2')&1*!5&?0(5.1&* D!D=7!A9;!976<99 D!D=7!A9;!976<99\n!\"!@*)F&0'!G0!$->/,2$('2&(*3\"21&(4 B:D!868!B99;D: B:D!868!B99;D: !\"!B+$%)1*!31!&?/'-0&.*0).+(\"%0**.4 7=7!8;8!=ED<6A 7=7!8;8!=ED<6A\nU'UOM'TUR'WRPSNR VSVVU'UOM'TUR'WRPSNR VSVV VSVV NVQ'ORW'OWMSUM VSVV VSVV J'NMR'RRJ'NNLPOS QPQQ J'NMR'RRJ'NNLPOS QPQQ QPQQJRR'MLQ'LMLPQS RQO'QQSPQT QPQQ\n-9-!#'' RT'UVT'VNO'NPTSPTMT'UVN'VVU'RPTSNUO'UOO'VNM'POOSTUMVV'VVV'VVVSVVRPR'RVU'WRMSVPMR'MWU'QQU'MQMSWVM'WVV'VVV'VVVSVVMVW'VOQ'MPRSTR -:-!#'' J'NMT'NTQ'RKLPNK J'KLM'LNOPOL J'NMR'RRJ'NNLPOS QPQQ QPQQJRR'MLQ'LMLPQS RQO'QQSPQT QPQQ\nRÉSULTATS ANNUELS 2023\nETAT B8 - TABLEAU DES SURETES REELLES DONNEES OU REÇUES ETAT B9 - ENGAGEMENTS FINANCIERS REÇUS OU DONNES HORS OPERATIONS\nDE CREDIT-BAIL (AU 31/12/2023)\n!\"#$%\"&'(')'*&+%!%*'+%%$$%*',-..%%*\n\"&'/01021232/ !\"#$#!%!\"&'()*\"\"!' %+,-.,-/(01023430 %+,-.,-/(01023430\n5263670,-\n!(%+*',%#(!%&+* 4567867'95:;<=7' ,87<'<7'>?<: @8><:='95AB78C><'6<77<' !\"!#$%&'!()!*%+),-.'!\n'-&'!(%+*'D+%,(!%&+* B8='>8'EF=<7G .87:=< HI?6E9=?B7?56 -CJ<7 H<'>8'EF=<7G'H566G< !\"!/%&(+0'!0(1,'('!%+2!*34%.)('\n!\"!#+)0('!(.5%5(1(.)'!4-..3'\nK'>8'H87<'H<'9>L7:=<\n&*&$8(9:; <=<< <=<<\n678!4-.)!(.5%5(1(.)'!9!&:35%04!4:;<'(!&,3('\n!\"#$%\"&'(')'*&+%!%*'+%%$$%*'+%D&*\n\"&'/01021232/ !\"#$#!%!\"&'(>!?@' %+,-.,-/(01023430 %+,-.,-/(01023430\n5263670,-\n!(%+*',%#(!%&+* 4567867'95:;<=7' ,87<'<7'>?<: @8><:='95AB78C><'6<77<' !\"!#$%&'!()!*%+),-.'\n!\"!/%&(+0'!0(1,'('!=%0!&('!03%''+0(+0'\n'-&'!(%+*'D+%,(!%&+* B8='>8'EF=<7G .87:=< HI?6E9=?B7?56 -CJ<7 H<'>8'EF=<7G'H566G< !\"!#+)0('!(.5%5(1(.)'!0(>+'\nK'>8'H87<'H<'9>L7:=<\nM=N7E'OPB57O<98?=<E /3'Q23'R/ST0R 0U'VR2'SUVTW0\nM=N7E'6867?E R'RUQ'23QTRR !\"#$#%& S'3SS'WWVT2R\n&*&$8 <=<< <=<<\nATTESTATION DES COMMISSAIRES AUX COMPTES - COMPTES SOCIAUX\nRÉSULTATS ANNUELS 2023\nBILAN CONSOLIDE IFRS RÉSULTAT NET ET GAINS ET PERTES COMPTABILISÉS DIRECTEMENT\nEN CAPITAUX PROPRES\n!\"#$%&'&()&*+,&- ./0/10121. ./0/101211\n!\"#$%&%#' !\"#$%&%#'\n()(*+,( ()((+,(\n!\"#$%&'()#\"*+,&,%,-. /'012 /'012\n3+%$4&'#\"%,5&',.\"-$6-$47& 891':/0 8;:'809 -./01232'4#2'5#'16#4/#781#'%94/91&5. :(;'::; <(;',=;\n!34567&5)389:89(;7 /<2&<2< /./&=1/\n<==->,7,4$'(4'67#\"4=4.% 8';8;'2?1 8'8??';:? >02$#/'.1.7#42/'50'$./01232'?19831\n@7#\"4=4.%&'5,.#.\",4$& 18'0?A'?8A /:'A/0';99\n!\"#$%&\"#&'%&(')#*+,('%&'#-\".&+($-\" /01'212 34'104\n@7#\"4=4.%&'7,B&'C'(4&'\"-.%$#%&'(-.%'74'$,&*+4'5,.#.\",4$'4&%'&+66-$%B'6#$'7D#&&+$B 8'898':A/ 8';9?'00/ 5)(&+.&('%&'#-\".&+($-\"'6+-78& /02'93: 4;':93\n<.E4&%,&&4=4.%&'(#.&'74&'4.%$46$,&4&'#&&-\",B4&'-+'\"-F4.%$46$,&4& 5)(&+.&('%&'#-\".&+($-\"'<-+('6+-78& /2':=9 ='441\n>;?3(@()47&A(7&?345B54C7&AD?77E9?)3( F<&2.F&F2G <G&<=F&/HI >&+,&('&,'8+-?$,('+&@*,$?('A'@*'+)).*@7*,$-\"'%&('*#,$?('?$\"*\"#$&+('\n0'=:9'0:0 /4'414'2=C\n>?94&A(7&9C?77E9(E97&A?)7&A(7&:?77567&;5C7&J&A(7&38)49?47&AK?77E9?)3(&(4& %$(8-\"$B@&('A'@*'.&\",&\nAK5)B(74577(@()4 1&.HF&FFG 1&//H&12F D??&,'%E$F8G,('(7+'@&(')@)F&\",('H$/%&((7( /:49'C13 ;;2';0;\n<==4+>74&'()4G67-,%#%,-.'4%'#+%$4&',==->,7,&#%,-.&'\"-$6-$4774& ;/9'208 80:'A;1 !1.7#42/'$#%@%1381#/'#4'$./01232 =()'A:B C,'B<B'<()\n@#$%,\",6#%,-.'#+G'>B.B5,\"4&'(,55B$B4'#\"%,E4 ;'20; /'?AA\n!1.7#42/'494'$#%@%1381#/'#4'$./01232\n<=6H%&'(,55B$B&'#\"%,5& 9A'9/; /1'A:?\nI$B#.\"4&'.B4&'(D-6B$#%,-.&'(D#&&+$#.\"4'(,$4\"%4'4%'(4'$B#&&+$#.\"4'#\"\"46%B4 ;'21;'?29 ;'??8';1; >02$#/'.1.7#42/'50'$./01232'?19831'4#2/'56&7DE2/ =()'A:B C,'B<B'<()\nI$B#.\"4&'.B4&'(D-6B$#%,-.&'(4'$B#&&+$#.\"4'\"B(B4 ;0?'8:1 8?8'29:\nI$B#.\"4&'(D,=6H%'4G,J,>74 :/?'8?8 :/2':8/ -./01232'?19831'5#'16#4/#781#'%94/91&5. ,';B:'*A) C;A<';(A\n3+%$4&'\"$B#.\"4& ;'??0';;2 ;'120'00;\nF942'&42.$G2/'7&49$&23&$#/ B:'*=) BA',:)\n!E49(7&?34567 H&/<<&I<. I&H.F&<H2\n!34567&A(7&?345B54C7&A(745)C(7&J&L49(&3CAC(7&8E&?M?)A8))C(7 F942'-./01232'?19831'4#2'C'H3$2'50'I$90D# ,'A=='=;) C:)*':=;\n#9C789(95(&(4&CNE5B?;()47&A(&49C789(95( /&2/=&=I2 GF=&//=\nETAT DE VARIATION DES CAPITAUX PROPRES CONSOLIDÉS\n#84?;&!3456 I<&H/<&GH< FG&<1H&HG2 Capital social Total Capitaux\nRéserves non Réserve de Réserves de Ecarts Intérêts\net primes propres part Total\ndistribuées conversion réévaluation actuarials minoritaires\nd'émission du groupe\nSituation à l'ouverture de l'exercice 2022.12 350(cid:2)000 6(cid:2)037(cid:2)266 -11(cid:2)001 2(cid:2)818(cid:2)510 9(cid:2)194(cid:2)776 223(cid:2)986 9(cid:2)418(cid:2)762\n>!OO$%&'&()&*+,&- ./0/10121. ./0/101211\nAjustement de la situation d'ouverture -5(cid:2)912 0 -5(cid:2)912 5 -5(cid:2)907\nI#6,%#7'&-\",#7 91A'AAA 91A'AAA Situation ajustée à l'ouverture de l'exercice 2022.12 350(cid:2)000 6(cid:2)031(cid:2)355 -11(cid:2)001 2(cid:2)818(cid:2)510 0 9(cid:2)188(cid:2)864 223(cid:2)991 9(cid:2)412(cid:2)855\n@$,=4&'()B=,&&,-.K'(4'5+&,-.'4%'()#66-$% A A Résultat de la période 776(cid:2)079 776(cid:2)079 50(cid:2)116 826(cid:2)196\nLB&4$E4&'\"-.&-7,(B4& 2';8;'AA1 0'?9A'/0/ Autres éléments du résultat global 0 27(cid:2)683 -1(cid:2)507(cid:2)558 -1(cid:2)479(cid:2)875 -4(cid:2)946 -1(cid:2)484(cid:2)820\nTotal des pertes et profits de la période 776(cid:2)079 27(cid:2)683 -1(cid:2)507(cid:2)558 -703(cid:2)796 45(cid:2)170 -658(cid:2)625\nLB&+7%#%'.4%'\"-.&-7,(B'F'@#$%'M+'N$-+64 0:A'/?? ::0'A:?\nDividendes versés -420(cid:2)000 -420(cid:2)000 -10(cid:2)125 -430(cid:2)125\n\"?:54?EP&:98:9(7Q:?94&AE&R98E:( G&1.1&F2< =&2FI&F<.\nAugmentation de capital -\n>?94535:?458)7&)(&A8))?)4&:?7&;(&38)49S;( 1HI&F=F 1I2&=H. Diminution de capital -\n\"?:54?EP&:98:9(7 G&F2G&2=G =&./H&</I Variation de perimètre 0 -1(cid:2)996 45 -1(cid:2)952 1(cid:2)838 -114\n+(44(7&A(&65)?)3(@()4 .&=.I 11&.G/ Autres variations 0 -6(cid:2)578 4 -6(cid:2)574 -1 -6(cid:2)575\nSituation à la clôture de l'exercice 2022.12 350(cid:2)000 6(cid:2)378(cid:2)861 16(cid:2)727 1(cid:2)310(cid:2)955 8(cid:2)056(cid:2)543 260(cid:2)873 8(cid:2)317(cid:2)416\n>98B5758)7&:8E9&957NE(7&(4&3T?9R(7 /F/&1G/ /<=&=H2\n@#&&,5&'%4\"O.,*+4&'$47#%,5&'C'(4&'\"-.%$#%&'()#&&+$#.\"4 /1'2:0'A2: /;';;9'/1? Situation à l'ouverture de l'exercice 2023.12 350(cid:2)000 6(cid:2)378(cid:2)861 16(cid:2)727 1(cid:2)310(cid:2)955 8(cid:2)056(cid:2)543 260(cid:2)873 8(cid:2)317(cid:2)416\n@#&&,5&''$47#%,5&'C'(4&'\"-.%$#%&'(),.E4&%,&&4=4.%'(-.%'74'$,&*+4'5,.#.\",4$'4&%' Ajustement de la situation d'ouverture\n8'898':A/ 8';9?'00/\n&+66-$%B'6#$'7)#&&+$B Situation ajustée à l'ouverture de l'exercice 2023.12 350(cid:2)000 6(cid:2)378(cid:2)861 16(cid:2)727 1(cid:2)310(cid:2)955 8(cid:2)056(cid:2)543 260(cid:2)873 8(cid:2)317(cid:2)416\n@#$%,\",6#%,-.'#+G'>B.B5,\"4&'(,55B$B4'6#&&,E4 8'010'A:1 8':?2':A: Résultat de la période 670(cid:2)499 670(cid:2)499 56(cid:2)277 726(cid:2)776\nAutres éléments du résultat global 60 -14(cid:2)836 944(cid:2)236 929(cid:2)460 -8(cid:2)887 920(cid:2)574\n>?77567&4(3T)5NE(7 <=&II.&=II <F&1I/&=.2\nTotal des pertes et profits de la période 670(cid:2)559 -14(cid:2)836 944(cid:2)236 0 1(cid:2)599(cid:2)959 47(cid:2)390 1(cid:2)647(cid:2)350\n$@:S47&A566C9C7&:?77567 /&1/F&IF< IHF&./2 Dividendes versés -455(cid:2)445 -455(cid:2)445 -12(cid:2)150 -467(cid:2)595\nM4%%4&'.B4&'(D-6B$#%,-.&'(D#&&+$#.\"4'(,$4\"%4'4%'(4'$B#&&+$#.\"4'#\"\"46%B4 ?0?'819 2:;'101 Augmentation de capital -\nM4%%4&'.B4&'(D-6B$#%,-.&'(4'$B#&&+$#.\"4'\"B(B4 2??'0:1 :0:'/?1 Diminution de capital -\nM4%%4&'(D,=6H%'4G,J,>74 :08'2A9 :20'2/8 Variation de perimètre 0 -10(cid:2)042 -10(cid:2)042 -18(cid:2)181 -28(cid:2)223\nAutres variations 0 41(cid:2)489 0 0 0 41(cid:2)489 -1(cid:2)347 40(cid:2)142\nM4%%4&'5,.#.\",P$4&'$46$B&4.%B4&'6#$'(4&'%,%$4& 18:':02 801'8:8\nSituation à la clôture de l'exercice 2023.12 350(cid:2)000 6(cid:2)625(cid:2)422 1(cid:2)891 2(cid:2)255(cid:2)191 0 9(cid:2)232(cid:2)504 276(cid:2)585 9(cid:2)509(cid:2)089\n3+%$4&'(4%%4& ;'A;;'29? ;'/A?'?AA\n!E49(7&:?77567 F&/H/&1.= F&22/&GH1\n>?77567&A(7&?345B54C7&A(745)C(7&J&L49(&3CAC(7&8E&?M?)A8))C(7 TABLEAU DES FLUX DE TRÉSORERIE CONSOLIDÉS\n( en KDH )\nExercice Exercice\nTableau de flux de trésorerie consolidé\n#84?;&>?7756 I<&H/<&GH< FG&<1H&HG2 2023.12 2022.12\nRésultat net de l'ensemble consolidé avant impôt 902(cid:2)014 1(cid:2)092(cid:2)184\nAjustements :\nCOMPTE DE RESULTAT CONSOLIDÉ\nDotations et reprises aux amortissements 103(cid:2)574 98(cid:2)036\nDotations nettes aux provisions techniques d'assurance et passifs financiers 3(cid:2)705(cid:2)330 2(cid:2)534(cid:2)348\n!\"#\"$#$%$! !\"#\"$#$%$$ Variation des frais d'acquisitions reportés -9(cid:2)975 -14(cid:2)299\n!\"#$%&'($#&%& ''''''''''''''''''')*'+*,')**'''''''''''''''''''))'-./'.*.''' Dotations nettes aux provisions et dépréciations 140(cid:2)792 -1(cid:2)741\nDotations nettes aux autres provisions 3(cid:2)445 8(cid:2)784\n01\"#12#34&'5%&'6\"#$%&'434'1789#&%& :'''''''''''''''''''''''''*/';--'''':''''''''''''''''''''';*';-.''' Elim. des profits / pertes de réévaluation (juste valeur par resulat) 0 0\n&'()*+,-./0(+*+ ,,,,,,,,,,,,,,,,,,,\"$,123,$41,,,,,,,,,,,,,,,,,,,\"\",441,31\",,, Corrections des éléments inclus dans le résultat sans impact sur les flux de\n3(cid:2)943(cid:2)165 2(cid:2)625(cid:2)128\n&'560(7,6*+,-07'*+,-.7(8(79+ ,,,,,,,,,,,,,,,,,,,,,,,,,,:3,$$2,,,,,,,,,,,,,,,,,,,,,,,,,,;1,:%$,,, trésorerie\nPlus ou moins values nettes sur cessions 74(cid:2)333 -110(cid:2)742\n!\"359#2&'4%2&'5%&'6<17%$%42& ''''''''''''''''''''')'-=,',;+''''''''''''''''''''')'-;;'.;)''' Charges liées aux dettes de financement 11(cid:2)434 6(cid:2)111\n!<9&'39'$3#4&:>1<9%&'\"(1<#&(%&'%2'>1\"#12#34'5%'<1'?9&2%'>1<%9\"'5%&' Reclassement des opérations de financement et d'investissement 85(cid:2)767 -104(cid:2)631\n6<17%$%42&'73$621@#<#&(&'A'<1'B0'61\"'\"(&9<212 !!!!!!!!!!!!!!!!!!!!!!!!!\"#!$%&!!! ':'''''''''''''''''''''//')C;''' Autres éléments sans décaissement de trésorerie compris dans le résultat -9(cid:2)169 -32(cid:2)867\nVariation des créances et dettes nées des opérations d'assurance et de -200(cid:2)194 -799(cid:2)677\n'()*!+,!-,./,*/()!01!234*1!-,+13.!014!5+,6171)*4!0()*!+1!./4831! Variation des autres actifs et passifs -472(cid:2)981 244(cid:2)665\n''''''''''''''''''''''''''=,'.-+'''!<!!!!!!!!!!!!!!!!!!!!==!>?@!!!\n9/),)6/1.!14*!4355(.*:!5,.!+;,443.: Charge d’impôt de l'exercice -203(cid:2)841 -145(cid:2)713\n01\"#12#34'5%&'1$3\"2#&&%$%42&'%2'6\"3>#&#34&'&9\"'6<17%$%42& :''''''''''''''''''''''')+,'.C,'''':'''''''''''''''''''''*-';.;''' Flux de trésorerie nets provenant des activités opérationnelles 4(cid:2)044(cid:2)762 2(cid:2)879(cid:2)090\nAcquisitions de filiales et co-entreprises, nettes de la trésorerie acquise -39(cid:2)576 -16(cid:2)449\n<*+0=7-7,>*7,6*,?=-.*)*>7 ,,,,,,,,,,,,,,,,,,,,,\",4!3,44\",,,,,,,,,,,,,,,,,,,,,\",41$,3!4,,, Cessions et rembourssement des obligations 1(cid:2)473(cid:2)921 1(cid:2)293(cid:2)033\nDE1\"F%&'2%7E4#89%&'5%&'172#>#2(&'5G1&&9\"147% :'''''''''''''''''')C'+)-'C.)'''':''''''''''''''''/'=,;'/,+''' Cessions des actions et des opcvm 16(cid:2)298(cid:2)431 15(cid:2)036(cid:2)731\nAcquisitions des obligations -2(cid:2)130(cid:2)756 -2(cid:2)482(cid:2)199\nH(&9<212'4%2'5%&'7%&&#34&'%4'\"(1&&9\"147% :'''''''''''''''''''''''=.='=./'''':'''''''''''''''''''-,,';)+''' Acquisitions des actions et des opcvm -18(cid:2)926(cid:2)031 -15(cid:2)518(cid:2)709\nI\"1#&'5G1789#&#2#34'5%&'7342\"12& :'''''''''''''''''''')'C;)'.;.'''':'''''''''''''''')'C*-'*);''' Acquisition des immeubles -36(cid:2)683 -307(cid:2)319\nDE1\"F%&'F(4(\"1<%&'5J%K6<3#212#34 :'''''''''''''''''''')')))'//;'''':'''''''''''''''''''/C*'*,*''' Cessions des immobilisations corporelles et incorporelles 0 996\nAcquisitions des immobilisations corporelles et incorporelles -210(cid:2)545 -64(cid:2)957\nL92\"%&'6\"359#2&'%2'7E1\"F%&'36(\"12#344%<& '''''''''''''''''''''''''',.'/.C'''''''''''''''''''''''''''';';))''' Intérêts payés sur dettes de financement -11(cid:2)434 -6(cid:2)111\n<9+0=7-7,5?9'-7(5>>*= ,,,,,,,,,,,,,,,,,,,,,,,,2%$,%\"3,,,,,,,,,,,,,,,,,,,,,\",%2$,\";3,,, Flux de trésorerie liés aux activités d'investissement -3(cid:2)582(cid:2)672 -2(cid:2)064(cid:2)984\nDE1\"F%&'<#(%&'19K'5%22%&'5%'M#4147%$%42 ' Dividendes payés aux actionnaires de la mère -455(cid:2)445 -420(cid:2)000\nDividendes payés aux minoritaires -12(cid:2)150 -10(cid:2)125\nN932%:61\"2'514&'<%&'\"(&9<212&'5%&'%42\"%6\"#&%&'1&&37#(%&'39'73: Transactions entre actionnaires (acq / cess) 11(cid:2)353 16(cid:2)335\n'\n%42\"%6\"#&%& Variation nettes des dépots à terme, des autres prêts et cautionnements 77(cid:2)659 3(cid:2)062\nTrésorerie générée par les émissions de dettes financières\nO$6P2&'&9\"'<%&'\"(&9<212& :''''''''''''''''''''''')+='*.;'''':'''''''''''''''''''*-='/;/''' Trésorerie affectée aux remboursements de dettes financières 0 -60\nH(&9<212'4%2'5J#$6P2'5%&'172#>#2(&'1@145344(%& ' Flux de trésorerie liés aux activités de financement -378(cid:2)584 -410(cid:2)788\n<9+0=7-7,>*7,.5>+5=(69 ,,,,,,,,,,,,,,,,,,,,,,,,:$1,::1,,,,,,,,,,,,,,,,,,,,,,,,;$1,\"21,,, Incidence de la variation des taux de change -12(cid:2)645 17(cid:2)067\nIncidence des changements de principes comptables 0\n!1\"2'59'F\"396% ''''''''''''''''''''''''-+C',//''''''''''''''''''''''''++-'C+/''' Variation de la trésorerie 70(cid:2)860 420(cid:2)386\n!1\"2#7#612#34&'4%'5344142'61&'<%'7342\"P<% ''''''''''''''''''''''''''=-'*++''''''''''''''''''''''''''=C'))-'''\n' Trésorerie d'ouverture 946(cid:2)736 526(cid:2)350\nTrésorerie de clôture 1(cid:2)017(cid:2)596 946(cid:2)736\n<9+0=7-7,>*7,?-',-.7(5>,@*>,ABCD ,,,,,,,,,,,,,,,,,,,,,,,,,,,,,,,\"2$,,,,,,,,,,,,,,,,,,,,,,,,,,,,,,,$$$,,, Variation de la trésorerie 70(cid:2)860 420(cid:2)386\nRÉSULTATS ANNUELS 2023\nEXTRAIT DES NOTES ANNEXES AUX COMPTES CONSOLIDÉS\nNote 1 Principes et méthodes a. Contrats d’assurance et contrats financiers avec PB discrétionnaire\nLes contrats d’assurance et les contrats financiers avec participation aux bénéfices discrétionnaire\nWafa Assurance SA est une société anonyme, filiale du groupe Al Mada et du groupe Attijariwafa sont comptabilisés selon les principes comptables appliqués par le groupe Wafa Assurance, à\nbank. Elle est domiciliée au Maroc et son siège social est situé au 1, Boulevard Abdelmoumen, l’exception des dispositions spécifiques introduites par la norme IFRS 4 et relatives à la comptabilité\nCasablanca. reflet et au test de suffisance des passifs.\nLe groupe Wafa Assurance a pour principales activités : l’assurance de personnes, de professionnels Les engagements font l’objet de ce test pour vérifier si les passifs d’assurance, nets d’actifs\net d’entreprises. d’assurance (participation aux bénéfices différées active, et autres actifs incorporels liées à\nLes états financiers consolidés de Wafa Assurance au titre de l’exercice clos le 31 décembre l’assurance) sont suffisants, par comparaison avec la valeur estimée des flux de trésorerie futurs\n2023 portent sur la société Wafa Assurance SA et ses filiales, et sur les intérêts du Groupe dans générés par les contrats d’assurance et d’investissement avec participation aux bénéfices\nles entreprises associées et les entités sous contrôle conjoint le cas échéant (l’ensemble désigné discrétionnaire.\ncomme « le Groupe »). Ils ont été arrêtés par le conseil d’administration du 14 mars 2024.\n1.1 Référentiel comptable de consolidation a.1. Contrats d’assurance\nAu 31 décembre 2023, le Groupe Wafa Assurance a opté pour l’application du « référentiel Les contrats en vertu desquels la Compagnie accepte un risque d’assurance significatif de la\ncomptable transitoire de consolidation » pour l’établissement des comptes consolidés. Ce part d’un tiers (l’assuré) en acceptant d’indemniser l’assuré ou un autre bénéficiaire, si un\nréférentiel correspond aux normes IFRS dont l’application était obligatoire au 31 décembre 2022, événement futur incertain déterminé (l’événement assuré) a des conséquences défavorables\ntelles qu’adoptées par l’UE et appliquées par le groupe Wafa Assurance pour l’exercice 2022. pour le titulaire ou un autre bénéficiaire, sont classés dans la catégorie des contrats d’assurance.\nL’application du référentiel transitoire de consolidation implique la poursuite de l’application Un risque d’assurance se définit comme un risque autre que financier, le risque financier\nen 2023 des normes IFRS 4 et IAS 39, en lieu et place respectivement des normes IFRS 17 et correspondant lui-même à un risque de variation potentielle future d’un taux d’intérêt, cours\nIFRS 9, conformément à l’avis n° 26 du Conseil National de la Comptabilité et tel qu’autorisé d’une valeur mobilière, cours d’une matière première, taux de change ou d’une autre variable\npar l’ACAPS en date du 4 Août 2023, et ce jusqu’à l’adoption de la norme IFRS 17 par les non financière dès lors que celle-ci n’est pas spécifique à l’une des parties au contrat (il s’agirait\ncompagnies d’assurance au Maroc. sinon d’un risque d’assurance).\nLes principaux risques d’assurance portent sur la mortalité, la longévité, la morbidité,\n1.2 Principes et méthodes de consolidation l’incapacité, la santé, ou encore sur la responsabilité civile et les dommages aux biens.\nLes états financiers consolidés incluent les comptes de Wafa Assurance et ceux de toutes les\nsociétés sur lesquelles, selon les dispositions des normes IFRS 10, IFRS 11 et IAS 28, Wafa a.2. Contrats financiers avec participation aux bénéfices discrétionnaire\nAssurance dispose du contrôle ou d’une influence notable. Les contrats qui n’exposent pas l’assureur à un risque d’assurance ou l’exposent à un risque\nConformément aux normes comptables internationales, toutes les entités contrôlées, sous d’assurance non significatif sont classés dans la catégorie des contrats financiers lorsqu’ils\ncréent un actif ou un passif financier.\ncontrôle conjoint ou sous influence notable sont consolidées, sous réserve qu’elles n’entrent\nIls sont qualifiés de contrat financier avec participation aux bénéfices discrétionnaire dès lors\npas dans le cadre des exclusions évoquées ci-après.\nqu’il existe un droit pour le titulaire d’un contrat d’obtenir en raison de dispositions contractuelles\nLe contrôle exclusif sur une entité est présumé exister lorsque Wafa Assurance est exposée ou\net/ou réglementaires, en supplément des éléments garantis, des bénéfices additionnels.\na droit aux rendements variables résultant de son implication dans l’entité et si le pouvoir qu’elle\nLes contrats d’investissement avec participation aux bénéfices discrétionnaire recouvrent\ndétient sur cette dernière lui permet d’influer sur ces rendements.\nprincipalement les contrats d’épargne en dirhams.\nLe contrôle d’une entité structurée ne s’apprécie pas sur la base du pourcentage des droits de\nvote qui n’ont, par nature, pas d’incidence sur les rendements de l’entité. L’analyse du contrôle\na.3. Contrats hybrides\ntient compte des accords contractuels, mais également d’autres facteurs.\nEn application des règles normatives, notamment IFRS 4, les composantes des contrats dits\nLorsqu’il existe un mandat de gestion, l’étendue du pouvoir décisionnel relatif à la délégation\nmulti-supports émis par le groupe ne sont pas séparées et sont traités dans le cadre des contrats\nde pouvoir au gérant ainsi que les rémunérations auxquelles donnent droit les accords contractuels\nd’assurance\nsont analysées afin de déterminer si le gérant agit en tant qu’agent (pouvoir délégué) ou principal\n(pour son propre compte). b. Contrats d’investissement (IAS 39)\nLe contrôle conjoint s’exerce lorsqu’il existe un partage contractuel du contrôle sur une activité Les contrats financiers sont évalués à l’origine à leur juste valeur. Les chargements sur primes\néconomique. Les décisions affectant les activités pertinentes de l’entité requièrent l’unanimité sont comptabilisés dans le poste produits des autres activités.\ndes parties partageant le contrôle. Les contrats financiers en unités de compte sont valorisés ultérieurement à la juste valeur, avec\nLes entreprises associées sont les entités sur lesquelles le groupe exerce une influence notable comptabilisation des variations de juste valeur en résultat.\nsur les politiques financières et opérationnelles sans en avoir le contrôle. Les évaluations ultérieures des contrats d’investissement en unités monétaires sont effectuées\nAu 31 décembre 2023, les entités contrôlées par le groupe sont consolidées par intégration à la juste valeur qui correspond à la valeur de rachat par le souscripteur.\nglobale.\nAu cas par cas, Wafa Assurance applique l’exemption prévue au paragraphe 18 d’IAS 28 lorsqu’une COMPTABILISATION DES CONTRATS D’ASSURANCE ET DES CONTRATS\nparticipation, dans laquelle elle exerce une influence notable, est détenue au regard de contrats D’INVESTISSEMENT COMPORTANT UNE CLAUSE DE PARTICIPATION AUX\nparticipatifs. BÉNÉFICES DISCRÉTIONNAIRE\nWafa Assurance apprécie également le champ de consolidation des filiales détenues en fonction\nde leur caractère significatif ou non. Comme l’autorise IFRS 4, les contrats d’assurance et les contrats d’investissement avec\nUne filiale est significative dès lors qu’elle dépasse un des seuils suivants : participation aux bénéfices discrétionnaire sont comptabilisés selon les principes retenus par\nWafa Assurance en application des normes locales, à l’exception des dispositions spécifiques\n- Le total bilan de la filiale est supérieur à 0,5% du total bilan consolidé ; introduites par la norme IFRS 4 au titre des provisions d’égalisation, de la comptabilité reflet et\n- La situation nette de la filiale est supérieure à 0,5% de la situation nette consolidée ; du test de suffisance des passifs.\n- Le chiffre d’affaires de la filiale est supérieur à 0,5% du chiffre d’affaires consolidés.\nc. Passifs techniques des contrats d’assurance et des contrats financiers avec\nEn plus, de ces critères quantitatifs, il est retenu un critère qualitatif lié à la notion d’investissement participation discrétionnaire\nstratégique ou non pour Wafa Assurance. De ce fait, même si une société ne dépasse pas le\nc.1. Assurance non-vie\nseuil de signification, elle peut être intégrée dans le périmètre de consolidation car jugée comme\nLes provisions techniques des contrats d’assurance non-vie comportent :\nactivité stratégique.\n(cid:129) les provisions de sinistres, permettant de couvrir le coût total des sinistres survenus et restant\nLes OPCVM dédiés sont consolidés conformément à IFRS 10 qui explicite la consolidation des\nà régler ;\nentités ad hoc et plus particulièrement les fonds sous contrôle exclusif.\n(cid:129) les provisions relatives à l’acquisition des primes (principalement les provisions pour primes\nnon acquises), permettant de reconnaître dans le résultat d’un exercice les primes relatives aux\nrisques réellement couverts au cours de cet exercice et donc de reporter la part des primes\n1.3 Règles et méthodes d’évaluation\némises au cours de l’exercice qui concerne une période de couverture des risques postérieure\nà l’exercice en cours.\n1.3.1. Passifs techniques\nLes provisions de sinistres résultent d’une part d’une évaluation dossier par dossier des sinistres\nCLASSIFICATION DES CONTRATS\ndéclarés mais non payés, et d’autre part d’une estimation des sinistres tardifs. Ces provisions\nLes contrats dont les principes de comptabilisation et d’évaluation relèvent de la norme IFRS 4\nsont minorées des recours. Les provisions pour sinistres tardifs (Incurred But Not Reported –\nincluent:\nIBNR) correspondent à une estimation de la charge des sinistres survenus sur l’exercice mais\n(cid:129) Les contrats d’assurance comportant un aléa pour l’assuré. Cette catégorie recouvre les\nnon encore déclarés et, le cas échéant, à une évaluation complémentaire de la provision\ncontrats de prévoyance, retraite, dommages aux biens et les contrats d’épargne en unités de\ndéterminée dossier par dossier. Leur détermination résulte d’une part, de l’application de\ncompte avec garantie plancher ;\nméthodes statistiques déterministes sur la base de données historiques et d’autre part, de\n(cid:129) Les contrats financiers émis par l’assureur comportant un élément de participation aux\nl’utilisation d’hypothèses actuarielles faisant appel aux jugements d’experts pour estimer la\nbénéfices (PB) discrétionnaire\ncharge à l’ultime.\n(cid:129) Les contrats financiers relevant de la norme IAS 39 correspondent aux contrats d’investissement\nsans participation aux bénéfices discrétionnaire : contrats d’épargne en unités de compte sans\nc.2. Assurance vie et contrats financiers avec participation aux bénéfices\nsupport dirham et sans garantie plancher.\ndiscrétionnaire\nLes contrats qui ne répondent pas à la définition d’un contrat d’assurance et qui ne sont pas\nLes provisions mathématiques des contrats d’assurance vie ou des contrats financiers avec\nnon plus des contrats financiers relèvent :\nparticipation discrétionnaire correspondent à la différence de valeur actuelle des engagements\n(cid:129) soit de la norme IFRS 15 s’ils correspondent à une prestation de services ;\nde l’assureur et de l’assuré. Les provisions sont calculées en utilisant des méthodes actuarielles\n(cid:129) soit de la norme IAS 19 pour les contrats souscrits dans le cadre d’un engagement social du\nqui incluent des hypothèses portant sur les primes, la performance des actifs financiers, les taux\ngroupe envers ses salariés.\nde rachat des contrats et l’évolution des frais généraux. Dans le cas particulier des contrats en\nRÉSULTATS ANNUELS 2023\nunités de compte, la valeur de l’épargne comptabilisée au passif repose sur la valeur des Les actifs disponibles à la vente ainsi que les actifs en juste valeur avec variation de juste\nactifs financiers (les unités de compte) détenus en représentation des contrats. Les valeur par résultat sont valorisés ultérieurement à la juste valeur.\nrevalorisations des actifs et des passifs des contrats en unités de compte sont constatées en La variation de juste valeur des actifs disponibles à la vente sur la période est enregistrée\nrésultat où elles se neutralisent. directement en capitaux propres en tenant compte des droits des assurés et de la fiscalité\nLorsque les chargements sur primes, sur encours ou les prélèvements sur les produits financiers (principe de la comptabilité reflet).\ns’avèrent insuffisants pour couvrir les charges de gestion futures, Wafa Assurance enregistre La variation de juste valeur des actifs en juste valeur par résultat est constatée dans le compte\nune provision de gestion. de résultat en tenant compte des droits des assurés et de la fiscalité (principe de la comptabilité\nEnfin, une provision pour participation aux bénéfices est comptabilisée lorsqu’une rémunération reflet).\nexcédant le minimum garanti est affectée, contractuellement ou réglementairement, aux Les prêts et créances et les actifs détenus jusqu’à l’échéance sont comptabilisés au coût\nassurés ou aux souscripteurs de contrats individuels ou collectifs et ne leur a pas été distribuée amorti.\nau cours de la période. Cette provision est, le cas échéant, complétée de la participation aux Le groupe Wafa Assurance distingue trois catégories d’instruments financiers :\nbénéfices différée qui résulte de l’application du principe de la comptabilité reflet. Catégorie 1 : instruments financiers faisant l’objet de cotations sur un marché actif.\nCatégorie 2 : instruments financiers dont l’évaluation fait appel à l’utilisation de techniques\nd. Application de la comptabilité reflet et participation aux bénéfices différée de valorisation standards reposant sur des paramètres principalement observables.\nLes contrats d’assurance ou d’investissement avec participation aux bénéfices discrétionnaire Catégorie 3 : instruments financiers dont l’évaluation fait appel à l’utilisation de techniques\nfont l’objet d’une “comptabilité reflet” (shadow accounting) conformément à l’option offerte de valorisation reposant principalement sur des paramètres inobservables.\npar IFRS 4. Cette comptabilité reflet consiste à enregistrer dans un poste de participation Les actifs financiers évalués à la juste valeur se présentent par catégorie de juste valeur\naux bénéfices différée la part des revalorisations positives ou négatives des actifs financiers comme suit :\nadossés à ces contrats qui, potentiellement, reviennent aux assurés.\nCette participation aux bénéfices différée est comptabilisée au passif (passifs techniques des !\"#$%&'()*+,-*./ 0\"#1')*23\"4#(56 0(7)\"1*8 0(7)\"1*9 0(7)\"1*. .8:89:9;9.\ncontrats) ou à l’actif, selon les mêmes modalités que le sous-jacent : en contrepartie du résultat !\"#$%&'('$%)%*+&',\"-%& ./'0.1'233 ./'0.1'233\n45#\",&'D\"&@6*\"89%&'('97')%*#%\nou des autres éléments du résultat global. 45#\"6*&'%#'7+#$%&'#\"#$%&'('$%)%*+')7$\"789% :/';<1';1/ ;'2;2'3.; .1'3/='=;.'\nLa provision pour participation aux bénéfices différée est déterminée en appliquant aux B975%C%*#&'$%@$A&%*#7*#'D%&'56*#$7#&'D6*#'9%'\n45#\",&'('97'>?'@7$'9%'$A&+9#7# :':3:';=1 :':3:';=1\nmontants des réévaluations de l’actif les taux de participation estimés sur la base des clauses $\"&E+%',\"*7*5\"%$'%&#'&+@@6$#A'@7$'9F7&&+$A\nde participation aux bénéfices réglementaires et contractuelles et de la politique de distribution <&#\"= >>*?>;*/?9 @*A@A*.9@ A9*>8B*.;/\nde la compagnie.\nEn cas de moins-value latente nette, une participation différée active n’est enregistrée que !\"#$%&'()*+,-*./ 0\"#1')*23\"4#(56 0(7)\"1*8 0(7)\"1*9 0(7)\"1*. .8:89:9;99\nsi son imputation, par entité, sur des participations futures est fortement probable. !\"#$%&'('$%)%*+&',\"-%& ./'0/0'123 ./'0/0'123\n45#\",&'C\"&?6*\"89%&'('97')%*#%\n45#\"6*&'%#'7+#$%&'#\"#$%&'('$%)%*+')7$\"789% :;'1<1';2; 0';1:'2/2 ..'/:2';/<\ne. Test de suffisance des passifs\nWafa Assurance s’assure à chaque arrêté que les passifs des contrats d’assurance et des 45#\",&'('97'=>'?7$'9%'$@&+9#7# A 9%9 '7 $5 \"&% DB +% %* ',# \"*&' 7$ *% 5? \"$ %@ $& '%% &* ## '7 &+* ?#' ?C 6% $& #'5 @6 '?* 7# $$ '7 9E# 7& &'C &+6 $* @#' :'./2'00< :'./2'00<\ncontrats d’investissement avec participation discrétionnaire comptabilisés (nets des frais <&#\"= >;*?9>*;>/ ?*@A8*/./ ; >A*8/@*/BB\nd’acquisition reportés correspondants et des immobilisations incorporelles liées) sont suffisants\nau regard de leurs flux de trésorerie futurs estimés.\nLe test de suffisance des passifs à appliquer pour cette vérification doit respecter au minimum c. Modalités de dépréciation\nles critères suivants définis par la norme : Les actifs financiers autres que ceux évalués à la juste valeur par résultat sont soumis à un\n(cid:129) prise en compte de l’ensemble des flux de trésorerie futurs contractuels y compris les frais test de dépréciation à chaque date d'arrêté des comptes.\nde gestion associés, les commissions ainsi que les options et garanties implicites de ces\ncontrats ; c.1.Actifs comptabilisés au coût amorti et instruments de dette disponibles à la vente\n(cid:129) si le test fait apparaître une insuffisance, celle-ci est intégralement provisionnée avec Pour les obligations détenues jusqu'à l'échéance ou disponibles à la vente, une dépréciation\nincidence en résultat. fondée sur la juste valeur est enregistrée au compte de résultat s'il est probable que les flux\nEn outre, lorsqu’une provision pour insuffisance de prime est comptabilisée dans les comptes de trésorerie ne seront pas pleinement recouvrés du fait de l'existence d'une ou plusieurs\nlocaux (provision pour risque en cours), celle-ci est conservée dans les comptes consolidés. indications objectives de dépréciation. Pour cela, le Groupe considère divers facteurs (occurrence\nd’un événement de crédit, faillite de l’entité de référence, défaut de paiement et restructuration,\n1.3.2. Revenus des contrats d’assurance et des contrats financiers avec participation observation de difficultés financières significatives de la contrepartie, concessions significatives\ndiscrétionnaire consenties au profit de l’emprunteur, etc.).\nPrimes c.2. Instruments de capitaux propres disponibles à la vente\nLe chiffre d’affaires relatif aux contrats d’assurance vie et d’investissement avec participation Le groupe Wafa Assurance détermine à chaque arrêté pour les instruments de capitaux\ndiscrétionnaire correspond aux primes des contrats en vigueur durant l’exercice, nettes propres disponibles à la vente s’il existe une indication objective de dépréciation caractérisée\nd’annulation et corrigées des primes à émettre pour la part acquise à des exercices ultérieurs. par :\nLe chiffre d’affaires des contrats d’assurance non-vie correspond aux primes émises hors (cid:129) une moins-value latente prolongée :une juste valeur inférieure au coût d’acquisition\ntaxes brutes de réassurance, nettes d’annulations, de réductions et de ristournes, de la variation depuis plus de 12 mois; ou\ndes primes restant à émettre et de la variation des primes à annuler. Les primes émises (cid:129) une moins-value latente significative :une juste valeur inférieure de plus de 30 % du\najustées de la variation des provisions pour primes non acquises constituent les primes coût moyen d’acquisition de l’instrument à la date d'arrêté.\nacquises. Lorsqu'une telle indication objective de dépréciation est constatée, la moins-value latente\ncumulée comptabilisée jusqu'ici directement en capitaux propres est enregistrée\nCharges des prestations des contrats automatiquement en résultat.\nLes charges des prestations des contrats d’assurance vie et des contrats d’investissement\navec participation aux bénéfices discrétionnaire regroupent : 1.3.4. Immeubles de placement\n(cid:129) l’ensemble des prestations dès lors qu’elles ont fait l’objet d’un règlement au bénéficiaire ; Un immeuble de placement est un bien immobilier (terrain ou construction) détenu par le\n(cid:129) les intérêts techniques et participations aux bénéfices pouvant être inclus dans ces groupe pour en retirer des loyers ou pour valoriser le capital, plutôt que pour l’utiliser dans la\nprestations ; production ou la fourniture de biens ou de services ou à des fins administratives ou le vendre\n(cid:129) les variations des provisions techniques ; dans le cadre de l’activité ordinaire.\n(cid:129) l’ensemble des frais supportés dans le cadre de la gestion et du règlement des prestations. Conformément à l’option prévue par IAS 40, le groupe a choisi le modèle d’évaluation au\nLes charges des prestations des contrats d’assurance non-vie comprennent essentiellement coût pour ses immeubles, à l’exception des immeubles supports de contrats en unités de\nles prestations et frais payés, ainsi que la variation des provisions pour sinistres à payer. compte, qui sont évalués à la juste valeur.\nÀ chaque date de clôture, l’existence d’un quelconque indice montrant une perte de valeur\n1.3.3. Placements des activités d’assurance est appréciée. L’existence d’indications de pertes de valeur conduit le groupe à estimer la\nvaleur recouvrable de l’immeuble concerné, déterminée selon l’expertise à laquelle procède\na.Classification le groupe Wafa Assurance pour son patrimoine immobilier.\nLes actifs financiers sont classés dans une des quatre catégories suivantes:\n(cid:129) Les actifs à la juste valeur avec comptabilisation des variations de juste valeur en résultat,\nqui regroupent les actifs financiers en représentation des contrats en unités de compte. Le\nGroupe n’a pas désigné à la première comptabilisation par option des titres à la juste valeur\npar résultat.\n(cid:129) Les actifs détenus jusqu’à l’échéance (dits HTM « Held-To-Maturity ») qui correspondent\naux titres que le groupe a l’intention et la capacité de conserver jusqu’à leur remboursement\nou leur échéance. Cette catégorie n’est pas utilisée par le Groupe au 31 décembre 2023.\n(cid:129) Les prêts et créances recouvrent les actifs financiers non dérivés avec des paiements fixes\nou déterminables qui ne sont pas cotés sur un marché actif et autres que ceux qui sont\nclassés parmi les actifs détenus à des fins de transaction ou disponibles à la vente.\n(cid:129) Les actifs disponibles à la vente (dits AFS « Available-For-Sale ») sont ceux que l’entreprise\nn’a pas l’intention manifeste de céder mais qu’elle pourra être amenée à vendre pour répondre\npar exemple à des besoins de liquidité. Ils regroupent les actifs financiers qui ne sont pas\nclassés dans les autres catégories.\nb. Méthode d’évaluation\nRÉSULTATS ANNUELS 2023\nPÉRIMETRE DE CONSOLIDATION IMMEUBLES DE PLACEMENT\n% de contrôle Méthode de % de contrôle Méthode de 31/12/2023 31/12/2022\nEntité\nDéc-2023 consolidation Déc-2022 consolidation\nWafa Assurance - Mère - Mère\nWafa Ima Assistance 65% IG 65% IG Terrains 474(cid:2)220 470(cid:2)204\nAttijari Assurance 57% IG 59% IG Constructions 652(cid:2)453 651(cid:2)569\nWafa Assurance vie Sénégal 100% IG 100% IG\nWafa Assurance vie Côte d’Ivoire 100% IG 100% IG Autres placements immobiliers 486(cid:2)962 450(cid:2)813\nWafa Assurance vie Cameroun 98% IG 98% IG\nTotal Brut 1(cid:2)613(cid:2)635 1(cid:2)572(cid:2)586\nWafa Assurance Non Vie Sénégal 100% IG 100% IG\nWafa Assurance Non Vie Côte d’Ivoire 100% IG 100% IG\nPro Assur S.A Cameroun 65% IG 65% IG\nFCP Expansion 100% IG 100% IG Amortissements/ dépréciations des constructions -395(cid:2)185 -367(cid:2)682\nFCP Sécurité 100% IG 100% IG Amortissements/dépréciations des autres placements immobiliers -5(cid:2)554 -5(cid:2)625\nFCP Optimisation 100% IG 100% IG\nFCP Stratégie 100% IG 100% IG Total Amortissement -400(cid:2)740 -373(cid:2)307\nFructi Valeurs 100% IG 100% IG\nSte Immobilière Panorama 100% IG 100% IG\nWG Bond Fund 100% IG Total net immobilier de placement 1(cid:2)212(cid:2)895 1(cid:2)199(cid:2)279\nWafa Assurance UEMOA 100% IG\nPRIMES ÉMISES ET PRODUITS DES AUTRES ACTIVITÉS IMPÔT DIFFÉRE\nExercice Exercice 31/12/2023 31/12/2022\n2023.12 2022.12 Impôts différés actifs - En KMAD\nImpôts sur les instruments financiers 255(cid:2)411 255(cid:2)794\nVie Non-vie Total Vie Non-vie Total\nImpôts sur les immeubles de placement 13(cid:2)797 12(cid:2)971\nPrimes Emises 7(cid:2)216(cid:2)1835(cid:2)507(cid:2)939 12(cid:2)724(cid:2)122 6(cid:2)626(cid:2)4845(cid:2)012(cid:2)839 11(cid:2)639(cid:2)323 Impôts sur les avantages au personnel 15(cid:2)868 17(cid:2)284\nProduits des autres activités 40(cid:2)518 33(cid:2)711 74(cid:2)229 63(cid:2)331 23(cid:2)371 86(cid:2)702 Impôts sur les immobilisations incorporelles 19(cid:2)488 8(cid:2)735\nImpôts sur les contrats de locations -211 216\nRÉSULTAT NET DE PLACEMENT Impôts sur les provisions pour risques et charges 100(cid:2)705 121(cid:2)240\nImpôts sur les contrats d'assurances 459(cid:2)250 396(cid:2)064\nCompensation Actif- Passif -833(cid:2)967 -767(cid:2)225\nEXERCICE 2023.12 EXERCICE 2022.12\nRevenus des obligations et bons 940(cid:2)331 794(cid:2)816 Total 30(cid:2)342 45(cid:2)079\nRevenus des actions et parts sociales 753(cid:2)019 730(cid:2)829\nRevenus des prêts, avances et effets assimilés 21(cid:2)047 19(cid:2)596 31/12/2023 31/12/2022\nRevenus des placements immobiliers 55(cid:2)608 53(cid:2)289\nAutres intérêts perçus sur créances financières 17(cid:2)292 14(cid:2)598 Impôts différés passifs - En KMAD\nPlus value de cession instruments de capitaux propres 109(cid:2)807 118(cid:2)370 Impôts sur les instruments financiers 1(cid:2)080(cid:2)076 638(cid:2)014\nPlus values de cession obligations et bons -184(cid:2)233 -7(cid:2)906 Impôts sur les immeubles de placement 26(cid:2)709 26(cid:2)771\nCharges d'intérêts -11(cid:2)434 -6(cid:2)111 Impôts sur les différences temporaires en social 386(cid:2)784 333(cid:2)423\nFrais de gestion des placements -50(cid:2)620 -34(cid:2)485 Impôts sur les immobilisations corporelles 14(cid:2)355 17(cid:2)234\nDotations aux amortissements des placements immobiliers -33(cid:2)061 -27(cid:2)908\nAutres produits financiers 15(cid:2)329 21(cid:2)800 Impôts sur les provisions pour risques et charges 985 1(cid:2)004\nAutres charges financières -2(cid:2)292 -1(cid:2)896 Impôts sur les contrats d'assurance 540(cid:2)713 426(cid:2)088\nVariation de la JV des placements à la JV par résultat dont le Compensation Actif- Passif -833(cid:2)967 -767(cid:2)225\n54(cid:2)367 -99(cid:2)108\nrisque financier est supporté par l’assuré\nSurcote/décote obligations -9(cid:2)367 -14(cid:2)518 Total 1(cid:2)215(cid:2)654 675(cid:2)310\nVariation des dépréciation sur placements -141(cid:2)242 1(cid:2)070\nTotal 1(cid:2)534(cid:2)551 1(cid:2)562(cid:2)435 CRÉANCES RELATIVES AUX CONTRATS D'ASSURANCE ET DE RÉASSURANCE\nCHARGES NETTES D'EXPLOITATION ET AUTRES PRODUITS ET CHARGES OPÉRATIONNELS Exercice 2023.12 Exercice 2022.12\nBrut Dépréciation Net Brut Dépréciation Net\nEXERCICE 2023.12 EXERCICE 2022.12 Primes acquises non émises 1(cid:2)042(cid:2)548 1(cid:2)042(cid:2)548 1(cid:2)400(cid:2)778 1(cid:2)400(cid:2)778\nComptes courants avec d'autres compagnies d'assurance 12(cid:2)471 12(cid:2)471 7(cid:2)590 7(cid:2)590\nConsommation de matières et fournitures -23(cid:2)387 -15(cid:2)576 Créances sur des assurés 1(cid:2)866(cid:2)181 -1(cid:2)149(cid:2)856 716(cid:2)326 1(cid:2)704(cid:2)352 -1(cid:2)166(cid:2)564 537(cid:2)788\nCharges externes -477(cid:2)052 -337(cid:2)977 Créances sur des courtiers et agents généraux relatives à des\nCharge de personnel -465(cid:2)325 -404(cid:2)547 1(cid:2)384(cid:2)686 -343(cid:2)897 1(cid:2)040(cid:2)789 1(cid:2)317(cid:2)000 -311(cid:2)4731(cid:2)005(cid:2)527\nImpôts et taxes -84(cid:2)292 -75(cid:2)065 opérations d'assurance directes ou d'acceptations\nPertes sur créances irrécouvrables -381 -818 Cessionnaires et comptes rattachés débiteurs 269(cid:2)175 269(cid:2)175 191(cid:2)837 191(cid:2)837\nMAD D D imé o mp tar oté i boc ini la isst a io a tin u o x nd sae m cl' oa o rc r ptt .i . f e ec t ti r a ic nuu cxl oa p rn prt o ov reis lli eo sns sur - -4 72 2(cid:2) (cid:2)2 09 85 8 - -5 69 4(cid:2) (cid:2)3 558 09 A Tou ttr ae ls producteurs débiteurs 4(cid:2)64 10 5(cid:2) (cid:2)8 94 19 1 -1(cid:2)493(cid:2)753 3(cid:2)14 20 2(cid:2) (cid:2)8 14 59 8 4(cid:2)63 69 1(cid:2) (cid:2)5 16 28 6 -1(cid:2)478(cid:2)0373(cid:2)13 89 3(cid:2) (cid:2)5 06 98 0\nAutres charges opérationnelles -109(cid:2)789 -111(cid:2)279\nAutres produits opérationnels 206(cid:2)540 175(cid:2)771\nDETTES RELATIVES AUX CONTRATS D'ASSURANCE ET DE RÉASSURANCE\nTotal -1(cid:2)068(cid:2)069 -893(cid:2)431\n!\"##\"$%&\"'(#)*\"$%(+,%-./#&(#$%01($$+&(/-\"%\"#%0\"%&2($$+&(/-\" !\"#\"$#$%$! !\"#\"$#$%$$\nCHARGES TECHNIQUES DES ACTIVITÉS D'ASSURANCES\n!\"#$%&'()\"*+,-%'()+./0%&*+'(,1&)(/2,*%+&'()\"#$,3-0&' 456(475 78(9:7\nEXERCICE 2023.12 EXERCICE 2022.12 ;&%%&'(&-1&+'(<&'(,''*+.' 7(476 44(579\nSinistres payés -3(cid:2)V 8i 4e 4(cid:2)526 N -3o (cid:2)2n 6 V 1i (cid:2)e 111 -7T (cid:2)1o 0ta 5l (cid:2)637 -4(cid:2)V 2i 9e 7(cid:2)278 N -2o (cid:2)8n 8 V 0i (cid:2)e 458 -7T (cid:2)1o 7ta 7l (cid:2)736 ; /2& ,% '% '& *' +( ,'* -+ )( &/ (& /' 0+() &\" )* %&+% (\"0& *+ (' /(& 2,% )(, )3 && $- %,%' %( 03 \". -- '.+,*=(+&<,%01&'(>(/&'(\"$.+,%0\"-'( ?@@(?7@ 9:8(:48\nVariation pour sinistres à payer -58(cid:2)805 -183(cid:2)337 -242(cid:2)142 -26(cid:2)896 -221(cid:2)097 -247(cid:2)992 ;&%%&'('*+(/&'(+.,''*+&*+'(+&<,%01&'(>(/&'(\"$.+,%0\"-'(/2,''*+,-)&(/0+&)%&( ?9?(:75 9:?(898\nVariation des provisions mathématiques -3(cid:2)196(cid:2)535 -3(cid:2)196(cid:2)535 -2(cid:2)238(cid:2)791 0 -2(cid:2)238(cid:2)791 \"*(/2,))&$%,%0\"-'\nVariation des provisions pour frais de gestion -1(cid:2)878 -1(cid:2)878 3(cid:2)261 3(cid:2)261 A+0#&'(>(,--*<&+ :8(784 48(?45\nVariation des provisions pour participation aux bénéfices -150(cid:2)496 -633 -151(cid:2)129 -59(cid:2)030 -2(cid:2)396 -61(cid:2)426 3.#(' 4%565%575 4%689%969\nVariation pour provisions pour PB différée 227(cid:2)410 227(cid:2)410 105(cid:2)814 105(cid:2)814\nVariation de la provision pour capitalisation PART DES CESSIONNAIRES ET RETROCESSIONNAIRES DANS LES PASSIFS\nVariation de la provision pour risques en cours\nVariation des autres provisions techniques -54(cid:2)372 -191(cid:2)749 -246(cid:2)121 97(cid:2)463 -29(cid:2)541 67(cid:2)922 RELATIFS AUX CONTRATS D’ASSURANCE ET FINANCIERS -EN KMDAD\nTotal -7(cid:2)079(cid:2)201 -3(cid:2)636(cid:2)830 -10(cid:2)716(cid:2)031 -6(cid:2)415(cid:2)456 -3(cid:2)133(cid:2)491 -9(cid:2)548(cid:2)947 P rea lart t id fse s a uc xe s cs oi no tn rn aa tsir des 'a e st s uré rt ar no cc ee s es t i fo inn an na cir ie es rs d -a En ns l Ke Ms Apa Dssifs 31/12/2023 31/12/2022\nPLACEMENTS FINANCIERS PAR CATÉGORIE\nPart des réassureurs dans les provisions d'assurance Non Vie\n31/12/2023 31/12/2022 Provisions pour primes non acquises 228(cid:2)748 239(cid:2)966\nProvisions pour sinistres à payer 32(cid:2)152 38(cid:2)525\nTitres à revenus fixes 26(cid:2)924(cid:2)533 23(cid:2)636(cid:2)790 Autres provisions techniques 450(cid:2)952 451(cid:2)409\nActifs disponibles à la vente\nActions et autres titres à revenu variable 24(cid:2)360(cid:2)072 22(cid:2)319(cid:2)534 Total 711(cid:2)851 729(cid:2)901\nPlacements représentant des contrats dont le\nActifs à la JV par le résultat risque financier est supporté par l’assuré 1(cid:2)131(cid:2)704 1(cid:2)239(cid:2)664 Part des réassureurs dans les provisions d'assurance Vie\nProvisions pour sinistres à payer 1(cid:2)537(cid:2)017 1(cid:2)376(cid:2)989\nAutres provisions techniques 126(cid:2)691 10(cid:2)316\nCréances financières Dépôts et autres créances financières 406(cid:2)305 1(cid:2)089(cid:2)909\nTotal 1(cid:2)663(cid:2)708 1(cid:2)387(cid:2)305\nTotal 52(cid:2)822(cid:2)614 48(cid:2)285(cid:2)897\nT po asta sl i fp sa rr et ld ae tis fs c ae us xs i co on nn ta ri ar te ss de 't a sré st uro rac ne cs es i eo tn fn ina air ne cs i ed ra sns les 2(cid:2)375(cid:2)559 2(cid:2)117(cid:2)205\nAUTRES IMMOBILISATIONS INCORPORELLES\nPROVISIONS TECHNIQUES RELATIVES AUX CONTRATS D'ASSURANCE\n31/12/2023 31/12/2022\n31/12/2023 31/12/2022\nValeur des portefeuilles des contrats de sociétés d'assurance acquis 0 0 Provisions mathématiques 32(cid:2)542(cid:2)406 29(cid:2)489(cid:2)422\nAutres immobilisations incorporelles 436(cid:2)848 387(cid:2)121 Provisions pour sinistres à payer 10(cid:2)764(cid:2)190 10(cid:2)644(cid:2)063\nProvisions pour frais de gestion de sinistres 58(cid:2)070 56(cid:2)186\nTotal Brut 436(cid:2)848 387(cid:2)121\nProvisions pour primes non acquises 1(cid:2)132(cid:2)065 1(cid:2)103(cid:2)054\nAmortissement des valeurs des portefeuilles des contrats de Provisions pour participations aux bénéfices 1(cid:2)031(cid:2)982 869(cid:2)144\nsociétés d'assurance Autres provisions techniques 347(cid:2)375 6 1(cid:2)591\nAmortissement des autres immobilisations incorporelles -301(cid:2)102 -259(cid:2)958\nTotal 45(cid:2)876(cid:2)087 42(cid:2)223(cid:2)459\nTotal Amortissement -301(cid:2)102 -259(cid:2)958\nTotal Net 135(cid:2)746 127(cid:2)163\nRÉSULTATS ANNUELS 2023\nINFORMATIONS SECTORIELLES PAR SECTEUR D'ACTIVITÉS\nEXERCICE 2023.12 EXERCICE 2022.12\nAutres Autres\nAssurance Assistance Total Assurance Assistance Total\nactivités activités\nChiffre d'affaires 12(cid:2)384(cid:2)727 339(cid:2)395 12(cid:2)724(cid:2)122 11(cid:2)323(cid:2)637 315(cid:2)686 11(cid:2)639(cid:2)323\nRésultat opérationnel 810(cid:2)969 97(cid:2)211 -6(cid:2)165 902(cid:2)014 1(cid:2)019(cid:2)372 78(cid:2)841 -6(cid:2)029 1(cid:2)092(cid:2)184\nImpôts sur les sociétés -159(cid:2)002 -44(cid:2)839 -203(cid:2)841 -108(cid:2)287 -37(cid:2)426 -145(cid:2)713\nCapitaux propres part du groupe 8(cid:2)771(cid:2)838 62(cid:2)892 397(cid:2)774 9(cid:2)232(cid:2)504 7(cid:2)904(cid:2)609 70(cid:2)159 81(cid:2)774 8(cid:2)056(cid:2)543\nRésultat net part du groupe 659(cid:2)644 17(cid:2)020 -6(cid:2)165 670(cid:2)499 768(cid:2)649 13(cid:2)460 -6(cid:2)029 776(cid:2)079\nDettes de financement 3(cid:2)726 110 3(cid:2)836 11(cid:2)802 10(cid:2)479 110 22(cid:2)391\nPlacements 53(cid:2)073(cid:2)181 478(cid:2)913 483(cid:2)415 54(cid:2)035(cid:2)509 48(cid:2)857(cid:2)029 466(cid:2)900 161(cid:2)247 49(cid:2)485(cid:2)176\nActifs incorporels 135(cid:2)125 221 400 135(cid:2)746 126(cid:2)112 651 400 127(cid:2)163\nActifs corporels 220(cid:2)536 19(cid:2)681 3(cid:2)644 243(cid:2)861 140(cid:2)597 21(cid:2)898 4(cid:2)530 167(cid:2)025\nAutres actifs non courants 33(cid:2)205 0 0 33(cid:2)205 49(cid:2)978 0 0 49(cid:2)978\nTotal Actif 63(cid:2)570(cid:2)696 622(cid:2)114 522(cid:2)164 64(cid:2)714(cid:2)974 58(cid:2)602(cid:2)838 625(cid:2)806 199(cid:2)146 59(cid:2)427(cid:2)790\nINFORMATIONS SECTORIELLES PAR PAYS - EN KMAD\nEXERCICE 2023.12 EXERCICE 2022.12\nCOTE COTE\nMAROC TUNISIE CAMEROUN Sénégal Total MAROC TUNISIE CAMEROUN Sénégal Total\nD'IVOIRE D'IVOIRE\nChiffre d'affaires 11(cid:2)346(cid:2)409 437(cid:2)735 197(cid:2)116 404(cid:2)766 338(cid:2)096 12(cid:2)724(cid:2)122 10(cid:2)466(cid:2)792 372(cid:2)517 150(cid:2)174 343(cid:2)526 306(cid:2)314 11(cid:2)639(cid:2)323\nRésultat opérationnel 779(cid:2)306 71(cid:2)964 14(cid:2)263 33(cid:2)139 3(cid:2)342 902(cid:2)014 971(cid:2)118 74(cid:2)442 330 30(cid:2)388 15(cid:2)906 1(cid:2)092(cid:2)184\nImpôts sur les sociétés -170(cid:2)922 -29(cid:2)460 -2(cid:2)769 -607 -84 -203(cid:2)841 -112(cid:2)272 -27(cid:2)264 -3(cid:2)464 -966 -1(cid:2)747 -145(cid:2)713\nCapitaux propres part du groupe 9(cid:2)074(cid:2)559 51(cid:2)045 -7(cid:2)281 89(cid:2)763 24(cid:2)419 9(cid:2)232(cid:2)504 7(cid:2)535(cid:2)110 80(cid:2)867 116(cid:2)178 182(cid:2)759 141(cid:2)628 8(cid:2)056(cid:2)543\nRésultat net part du groupe 601(cid:2)620 23(cid:2)386 9(cid:2)703 32(cid:2)532 3(cid:2)258 670(cid:2)499 710(cid:2)828 21(cid:2)232 652 29(cid:2)422 13(cid:2)945 776(cid:2)079\nDettes de financement 3(cid:2)836 3(cid:2)836 22(cid:2)391 22(cid:2)391\nPlacements 49(cid:2)880(cid:2)994 2(cid:2)291(cid:2)332 321(cid:2)163 909(cid:2)892 632(cid:2)127 54(cid:2)035(cid:2)509 45(cid:2)369(cid:2)837 2(cid:2)070(cid:2)793 417(cid:2)118 854(cid:2)204 773(cid:2)223 49(cid:2)485(cid:2)176\nActifs incorporels 131(cid:2)855 1(cid:2)879 159 424 1(cid:2)428 135(cid:2)746 122(cid:2)322 2(cid:2)159 404 280 1(cid:2)998 127(cid:2)163\nActifs corporels 223(cid:2)256 4(cid:2)980 4(cid:2)431 8(cid:2)284 2(cid:2)911 243(cid:2)861 151(cid:2)364 540 4(cid:2)860 7(cid:2)635 2(cid:2)626 167(cid:2)025\nAutres actifs non courants 29(cid:2)827 3(cid:2)362 16 0 33(cid:2)205 44(cid:2)216 5(cid:2)762 0 0 49(cid:2)978\nTotal Actif 59(cid:2)457(cid:2)432 2(cid:2)633(cid:2)018 601(cid:2)896 1(cid:2)134(cid:2)554 888(cid:2)074 64(cid:2)714(cid:2)974 54(cid:2)321(cid:2)215 2(cid:2)436(cid:2)040 671(cid:2)234 1(cid:2)059(cid:2)797 939(cid:2)503 59(cid:2)427(cid:2)790\nATTESTATION DES COMMISSAIRES AUX COMPTES - COMPTES CONSOLIDES",
    "tables": [
        [
            {
                "COMMUNIQUÉ FINANCIER\nRÉSULLTTAATTS ANNUELS 2023\nCCrrooiissssaannncccceee dduu cchhiiffffrreee dddd’’’aaaffffaaiiress ppoorrttéée aussi bien par l’activité Vie q\nRésuullttaattss eenn pprrooggrreesssionn eennnn rraaiissoon de l’amélioration des indicateur\nLee CCoonseeiilll dddd’’AAddministrationn de Wafa Assurance s’est réuni le J\nPPrréésidence de Monsieur Bouubker JAI, en vue d’examiner l’activité\nlles comptes au 31 décembree 2023.\nRésultats sociaux\nChiffre d’affaires social (en MDH)\nEn 2023, le chiffre d’affaires social de Wa\n+7,1%\nsoit +7,1% par rapport à 2022.\n10 425 11 164\nLL’’activité Vie s’élève à 6 273 MDH en pro\nppeerrfformancee eenn EEppaarrggnnee eett PPrrévoyyance.\nLL’’activité Non-Vie progresse de +9,1%, à\nDéc 2022 Déc 2023\nperformance de l’ensemble des branches\nLe résultat Vie s’établit à 464 MDH en\nRésultat net social (en MDH)\ncroissance de l’activité en Epargne et en D\n+15,4%\n607 701 Le résultat Non-Vie ressort à 436 MDH en\nenregistré en 2022 (157 MDH), portée par l\nbonne tenue du résultat financierr..\nLe résultat net social atteint 701 MDH en\nDéc 2022 Déc 2023\nLes fonds propres sociaux s’élèvent à 6 6\nFonds propres sociaux (en MDH)\nRésultats consolidés\n+3,9%\n6 356 6 601\nAu 31 décembre 2023, le chiffre d’affai\n12 724 MDH enregistrant une hausse de\nréalisée sur l’ensemble des branches\nl’international.\nDéc 2022 Déc 2023\nLe RNPG de l’exercice 2023 ressort à 670 M\nde 13,6% impacté par l’évolution des marc\nChiffre d’affaires consolidé (en MDH)\ncourantes en 2023 (notamment le don au\n+9,3% effets du séisme d’Al Haouz).\n11 639 12 724\nLes capitaux propres part du groupe s’élè\n2023 vs. 8 057 MDH en 2022 en hausse de\nLe périmètre de consolidation, comprena\nDéc2022 Déc 2023 africaines, a connu courant 2023 l’entr\nplacement dédiés.\nRN Part du groupe (en MDH) Au vu des résultats enregistrés et des\nConseil d’Administration a décidé de p\n-13,6%\nOrdinaire, convoquée pour le 15 Mai 2024\n776 670\nl’exercice 2023, d’un dividende de 140 dirh\nWafa Assurance confirme ainsi son le\nfondamentaux, et poursuit le développem\nDéc2022 Déc 2023\nContact : information.financiere@wafaassurance.co.ma\nLien internet : https://www.wafaassurance.ma/fr/compa": "",
                "": "",
                "null": "",
                "uue par l’activité Non--vie.\nss techniques et finannciers.\neuudi 14 mars 2024, sous la\ndee la compagnie et d’arrêter\nfa Assurance atteint 11 164 MDH,\ngression de +5,6% portéée par la\n4 891 MDH conséquemmment à la\nNoon-Vie.\npprogression de 1,5% suuite à la\néccès.\nprrogression par rapport aau niveau\na croissance de l’activité et par la\nprrogression de 15,4%.\n01 MDH en hausse de 3,9%.\nrees consolidé annuel s’établit à\n99,3% portée par la perfformance\nVie et Non-vie au Maroc et à\nDDH vs 776 MDH en 2022 en baisse\nhés financiers et les chaarges non\nfoonds spécial pour la gestion des\nvent à 9 232 MDH au 31 ddécembre\n144,6%.\nntt Wafa Assurance et sees filiales\néee de deux fonds communs de\npeerspectives de la comppagnie, le\nrooposer à l’Assemblée Générale\nà 11h00, la distribution au titre de\namms par action.\nadership et la soliditéé de ses\nent de ses activités.\ngnnie-assurance-maroc": "uue par l’activité Non--vie.\nss techniques et finannciers.\neuudi 14 mars 2024, sous la"
            },
            {
                "COMMUNIQUÉ FINANCIER\nRÉSULLTTAATTS ANNUELS 2023\nCCrrooiissssaannncccceee dduu cchhiiffffrreee dddd’’’aaaffffaaiiress ppoorrttéée aussi bien par l’activité Vie q\nRésuullttaattss eenn pprrooggrreesssionn eennnn rraaiissoon de l’amélioration des indicateur\nLee CCoonseeiilll dddd’’AAddministrationn de Wafa Assurance s’est réuni le J\nPPrréésidence de Monsieur Bouubker JAI, en vue d’examiner l’activité\nlles comptes au 31 décembree 2023.\nRésultats sociaux\nChiffre d’affaires social (en MDH)\nEn 2023, le chiffre d’affaires social de Wa\n+7,1%\nsoit +7,1% par rapport à 2022.\n10 425 11 164\nLL’’activité Vie s’élève à 6 273 MDH en pro\nppeerrfformancee eenn EEppaarrggnnee eett PPrrévoyyance.\nLL’’activité Non-Vie progresse de +9,1%, à\nDéc 2022 Déc 2023\nperformance de l’ensemble des branches\nLe résultat Vie s’établit à 464 MDH en\nRésultat net social (en MDH)\ncroissance de l’activité en Epargne et en D\n+15,4%\n607 701 Le résultat Non-Vie ressort à 436 MDH en\nenregistré en 2022 (157 MDH), portée par l\nbonne tenue du résultat financierr..\nLe résultat net social atteint 701 MDH en\nDéc 2022 Déc 2023\nLes fonds propres sociaux s’élèvent à 6 6\nFonds propres sociaux (en MDH)\nRésultats consolidés\n+3,9%\n6 356 6 601\nAu 31 décembre 2023, le chiffre d’affai\n12 724 MDH enregistrant une hausse de\nréalisée sur l’ensemble des branches\nl’international.\nDéc 2022 Déc 2023\nLe RNPG de l’exercice 2023 ressort à 670 M\nde 13,6% impacté par l’évolution des marc\nChiffre d’affaires consolidé (en MDH)\ncourantes en 2023 (notamment le don au\n+9,3% effets du séisme d’Al Haouz).\n11 639 12 724\nLes capitaux propres part du groupe s’élè\n2023 vs. 8 057 MDH en 2022 en hausse de\nLe périmètre de consolidation, comprena\nDéc2022 Déc 2023 africaines, a connu courant 2023 l’entr\nplacement dédiés.\nRN Part du groupe (en MDH) Au vu des résultats enregistrés et des\nConseil d’Administration a décidé de p\n-13,6%\nOrdinaire, convoquée pour le 15 Mai 2024\n776 670\nl’exercice 2023, d’un dividende de 140 dirh\nWafa Assurance confirme ainsi son le\nfondamentaux, et poursuit le développem\nDéc2022 Déc 2023\nContact : information.financiere@wafaassurance.co.ma\nLien internet : https://www.wafaassurance.ma/fr/compa": "",
                "": "uubker",
                "null": "JAI, en vue d’examiner l’activité",
                "uue par l’activité Non--vie.\nss techniques et finannciers.\neuudi 14 mars 2024, sous la\ndee la compagnie et d’arrêter\nfa Assurance atteint 11 164 MDH,\ngression de +5,6% portéée par la\n4 891 MDH conséquemmment à la\nNoon-Vie.\npprogression de 1,5% suuite à la\néccès.\nprrogression par rapport aau niveau\na croissance de l’activité et par la\nprrogression de 15,4%.\n01 MDH en hausse de 3,9%.\nrees consolidé annuel s’établit à\n99,3% portée par la perfformance\nVie et Non-vie au Maroc et à\nDDH vs 776 MDH en 2022 en baisse\nhés financiers et les chaarges non\nfoonds spécial pour la gestion des\nvent à 9 232 MDH au 31 ddécembre\n144,6%.\nntt Wafa Assurance et sees filiales\néee de deux fonds communs de\npeerspectives de la comppagnie, le\nrooposer à l’Assemblée Générale\nà 11h00, la distribution au titre de\namms par action.\nadership et la soliditéé de ses\nent de ses activités.\ngnnie-assurance-maroc": "dee la compagnie et d’arrêter"
            },
            {
                "COMMUNIQUÉ FINANCIER\nRÉSULLTTAATTS ANNUELS 2023\nCCrrooiissssaannncccceee dduu cchhiiffffrreee dddd’’’aaaffffaaiiress ppoorrttéée aussi bien par l’activité Vie q\nRésuullttaattss eenn pprrooggrreesssionn eennnn rraaiissoon de l’amélioration des indicateur\nLee CCoonseeiilll dddd’’AAddministrationn de Wafa Assurance s’est réuni le J\nPPrréésidence de Monsieur Bouubker JAI, en vue d’examiner l’activité\nlles comptes au 31 décembree 2023.\nRésultats sociaux\nChiffre d’affaires social (en MDH)\nEn 2023, le chiffre d’affaires social de Wa\n+7,1%\nsoit +7,1% par rapport à 2022.\n10 425 11 164\nLL’’activité Vie s’élève à 6 273 MDH en pro\nppeerrfformancee eenn EEppaarrggnnee eett PPrrévoyyance.\nLL’’activité Non-Vie progresse de +9,1%, à\nDéc 2022 Déc 2023\nperformance de l’ensemble des branches\nLe résultat Vie s’établit à 464 MDH en\nRésultat net social (en MDH)\ncroissance de l’activité en Epargne et en D\n+15,4%\n607 701 Le résultat Non-Vie ressort à 436 MDH en\nenregistré en 2022 (157 MDH), portée par l\nbonne tenue du résultat financierr..\nLe résultat net social atteint 701 MDH en\nDéc 2022 Déc 2023\nLes fonds propres sociaux s’élèvent à 6 6\nFonds propres sociaux (en MDH)\nRésultats consolidés\n+3,9%\n6 356 6 601\nAu 31 décembre 2023, le chiffre d’affai\n12 724 MDH enregistrant une hausse de\nréalisée sur l’ensemble des branches\nl’international.\nDéc 2022 Déc 2023\nLe RNPG de l’exercice 2023 ressort à 670 M\nde 13,6% impacté par l’évolution des marc\nChiffre d’affaires consolidé (en MDH)\ncourantes en 2023 (notamment le don au\n+9,3% effets du séisme d’Al Haouz).\n11 639 12 724\nLes capitaux propres part du groupe s’élè\n2023 vs. 8 057 MDH en 2022 en hausse de\nLe périmètre de consolidation, comprena\nDéc2022 Déc 2023 africaines, a connu courant 2023 l’entr\nplacement dédiés.\nRN Part du groupe (en MDH) Au vu des résultats enregistrés et des\nConseil d’Administration a décidé de p\n-13,6%\nOrdinaire, convoquée pour le 15 Mai 2024\n776 670\nl’exercice 2023, d’un dividende de 140 dirh\nWafa Assurance confirme ainsi son le\nfondamentaux, et poursuit le développem\nDéc2022 Déc 2023\nContact : information.financiere@wafaassurance.co.ma\nLien internet : https://www.wafaassurance.ma/fr/compa": "",
                "": "",
                "null": "",
                "uue par l’activité Non--vie.\nss techniques et finannciers.\neuudi 14 mars 2024, sous la\ndee la compagnie et d’arrêter\nfa Assurance atteint 11 164 MDH,\ngression de +5,6% portéée par la\n4 891 MDH conséquemmment à la\nNoon-Vie.\npprogression de 1,5% suuite à la\néccès.\nprrogression par rapport aau niveau\na croissance de l’activité et par la\nprrogression de 15,4%.\n01 MDH en hausse de 3,9%.\nrees consolidé annuel s’établit à\n99,3% portée par la perfformance\nVie et Non-vie au Maroc et à\nDDH vs 776 MDH en 2022 en baisse\nhés financiers et les chaarges non\nfoonds spécial pour la gestion des\nvent à 9 232 MDH au 31 ddécembre\n144,6%.\nntt Wafa Assurance et sees filiales\néee de deux fonds communs de\npeerspectives de la comppagnie, le\nrooposer à l’Assemblée Générale\nà 11h00, la distribution au titre de\namms par action.\nadership et la soliditéé de ses\nent de ses activités.\ngnnie-assurance-maroc": ""
            },
            {
                "COMMUNIQUÉ FINANCIER\nRÉSULLTTAATTS ANNUELS 2023\nCCrrooiissssaannncccceee dduu cchhiiffffrreee dddd’’’aaaffffaaiiress ppoorrttéée aussi bien par l’activité Vie q\nRésuullttaattss eenn pprrooggrreesssionn eennnn rraaiissoon de l’amélioration des indicateur\nLee CCoonseeiilll dddd’’AAddministrationn de Wafa Assurance s’est réuni le J\nPPrréésidence de Monsieur Bouubker JAI, en vue d’examiner l’activité\nlles comptes au 31 décembree 2023.\nRésultats sociaux\nChiffre d’affaires social (en MDH)\nEn 2023, le chiffre d’affaires social de Wa\n+7,1%\nsoit +7,1% par rapport à 2022.\n10 425 11 164\nLL’’activité Vie s’élève à 6 273 MDH en pro\nppeerrfformancee eenn EEppaarrggnnee eett PPrrévoyyance.\nLL’’activité Non-Vie progresse de +9,1%, à\nDéc 2022 Déc 2023\nperformance de l’ensemble des branches\nLe résultat Vie s’établit à 464 MDH en\nRésultat net social (en MDH)\ncroissance de l’activité en Epargne et en D\n+15,4%\n607 701 Le résultat Non-Vie ressort à 436 MDH en\nenregistré en 2022 (157 MDH), portée par l\nbonne tenue du résultat financierr..\nLe résultat net social atteint 701 MDH en\nDéc 2022 Déc 2023\nLes fonds propres sociaux s’élèvent à 6 6\nFonds propres sociaux (en MDH)\nRésultats consolidés\n+3,9%\n6 356 6 601\nAu 31 décembre 2023, le chiffre d’affai\n12 724 MDH enregistrant une hausse de\nréalisée sur l’ensemble des branches\nl’international.\nDéc 2022 Déc 2023\nLe RNPG de l’exercice 2023 ressort à 670 M\nde 13,6% impacté par l’évolution des marc\nChiffre d’affaires consolidé (en MDH)\ncourantes en 2023 (notamment le don au\n+9,3% effets du séisme d’Al Haouz).\n11 639 12 724\nLes capitaux propres part du groupe s’élè\n2023 vs. 8 057 MDH en 2022 en hausse de\nLe périmètre de consolidation, comprena\nDéc2022 Déc 2023 africaines, a connu courant 2023 l’entr\nplacement dédiés.\nRN Part du groupe (en MDH) Au vu des résultats enregistrés et des\nConseil d’Administration a décidé de p\n-13,6%\nOrdinaire, convoquée pour le 15 Mai 2024\n776 670\nl’exercice 2023, d’un dividende de 140 dirh\nWafa Assurance confirme ainsi son le\nfondamentaux, et poursuit le développem\nDéc2022 Déc 2023\nContact : information.financiere@wafaassurance.co.ma\nLien internet : https://www.wafaassurance.ma/fr/compa": "",
                "": "2023.",
                "null": "",
                "uue par l’activité Non--vie.\nss techniques et finannciers.\neuudi 14 mars 2024, sous la\ndee la compagnie et d’arrêter\nfa Assurance atteint 11 164 MDH,\ngression de +5,6% portéée par la\n4 891 MDH conséquemmment à la\nNoon-Vie.\npprogression de 1,5% suuite à la\néccès.\nprrogression par rapport aau niveau\na croissance de l’activité et par la\nprrogression de 15,4%.\n01 MDH en hausse de 3,9%.\nrees consolidé annuel s’établit à\n99,3% portée par la perfformance\nVie et Non-vie au Maroc et à\nDDH vs 776 MDH en 2022 en baisse\nhés financiers et les chaarges non\nfoonds spécial pour la gestion des\nvent à 9 232 MDH au 31 ddécembre\n144,6%.\nntt Wafa Assurance et sees filiales\néee de deux fonds communs de\npeerspectives de la comppagnie, le\nrooposer à l’Assemblée Générale\nà 11h00, la distribution au titre de\namms par action.\nadership et la soliditéé de ses\nent de ses activités.\ngnnie-assurance-maroc": ""
            },
            {
                "COMMUNIQUÉ FINANCIER\nRÉSULLTTAATTS ANNUELS 2023\nCCrrooiissssaannncccceee dduu cchhiiffffrreee dddd’’’aaaffffaaiiress ppoorrttéée aussi bien par l’activité Vie q\nRésuullttaattss eenn pprrooggrreesssionn eennnn rraaiissoon de l’amélioration des indicateur\nLee CCoonseeiilll dddd’’AAddministrationn de Wafa Assurance s’est réuni le J\nPPrréésidence de Monsieur Bouubker JAI, en vue d’examiner l’activité\nlles comptes au 31 décembree 2023.\nRésultats sociaux\nChiffre d’affaires social (en MDH)\nEn 2023, le chiffre d’affaires social de Wa\n+7,1%\nsoit +7,1% par rapport à 2022.\n10 425 11 164\nLL’’activité Vie s’élève à 6 273 MDH en pro\nppeerrfformancee eenn EEppaarrggnnee eett PPrrévoyyance.\nLL’’activité Non-Vie progresse de +9,1%, à\nDéc 2022 Déc 2023\nperformance de l’ensemble des branches\nLe résultat Vie s’établit à 464 MDH en\nRésultat net social (en MDH)\ncroissance de l’activité en Epargne et en D\n+15,4%\n607 701 Le résultat Non-Vie ressort à 436 MDH en\nenregistré en 2022 (157 MDH), portée par l\nbonne tenue du résultat financierr..\nLe résultat net social atteint 701 MDH en\nDéc 2022 Déc 2023\nLes fonds propres sociaux s’élèvent à 6 6\nFonds propres sociaux (en MDH)\nRésultats consolidés\n+3,9%\n6 356 6 601\nAu 31 décembre 2023, le chiffre d’affai\n12 724 MDH enregistrant une hausse de\nréalisée sur l’ensemble des branches\nl’international.\nDéc 2022 Déc 2023\nLe RNPG de l’exercice 2023 ressort à 670 M\nde 13,6% impacté par l’évolution des marc\nChiffre d’affaires consolidé (en MDH)\ncourantes en 2023 (notamment le don au\n+9,3% effets du séisme d’Al Haouz).\n11 639 12 724\nLes capitaux propres part du groupe s’élè\n2023 vs. 8 057 MDH en 2022 en hausse de\nLe périmètre de consolidation, comprena\nDéc2022 Déc 2023 africaines, a connu courant 2023 l’entr\nplacement dédiés.\nRN Part du groupe (en MDH) Au vu des résultats enregistrés et des\nConseil d’Administration a décidé de p\n-13,6%\nOrdinaire, convoquée pour le 15 Mai 2024\n776 670\nl’exercice 2023, d’un dividende de 140 dirh\nWafa Assurance confirme ainsi son le\nfondamentaux, et poursuit le développem\nDéc2022 Déc 2023\nContact : information.financiere@wafaassurance.co.ma\nLien internet : https://www.wafaassurance.ma/fr/compa": "",
                "": "",
                "null": "",
                "uue par l’activité Non--vie.\nss techniques et finannciers.\neuudi 14 mars 2024, sous la\ndee la compagnie et d’arrêter\nfa Assurance atteint 11 164 MDH,\ngression de +5,6% portéée par la\n4 891 MDH conséquemmment à la\nNoon-Vie.\npprogression de 1,5% suuite à la\néccès.\nprrogression par rapport aau niveau\na croissance de l’activité et par la\nprrogression de 15,4%.\n01 MDH en hausse de 3,9%.\nrees consolidé annuel s’établit à\n99,3% portée par la perfformance\nVie et Non-vie au Maroc et à\nDDH vs 776 MDH en 2022 en baisse\nhés financiers et les chaarges non\nfoonds spécial pour la gestion des\nvent à 9 232 MDH au 31 ddécembre\n144,6%.\nntt Wafa Assurance et sees filiales\néee de deux fonds communs de\npeerspectives de la comppagnie, le\nrooposer à l’Assemblée Générale\nà 11h00, la distribution au titre de\namms par action.\nadership et la soliditéé de ses\nent de ses activités.\ngnnie-assurance-maroc": ""
            },
            {
                "COMMUNIQUÉ FINANCIER\nRÉSULLTTAATTS ANNUELS 2023\nCCrrooiissssaannncccceee dduu cchhiiffffrreee dddd’’’aaaffffaaiiress ppoorrttéée aussi bien par l’activité Vie q\nRésuullttaattss eenn pprrooggrreesssionn eennnn rraaiissoon de l’amélioration des indicateur\nLee CCoonseeiilll dddd’’AAddministrationn de Wafa Assurance s’est réuni le J\nPPrréésidence de Monsieur Bouubker JAI, en vue d’examiner l’activité\nlles comptes au 31 décembree 2023.\nRésultats sociaux\nChiffre d’affaires social (en MDH)\nEn 2023, le chiffre d’affaires social de Wa\n+7,1%\nsoit +7,1% par rapport à 2022.\n10 425 11 164\nLL’’activité Vie s’élève à 6 273 MDH en pro\nppeerrfformancee eenn EEppaarrggnnee eett PPrrévoyyance.\nLL’’activité Non-Vie progresse de +9,1%, à\nDéc 2022 Déc 2023\nperformance de l’ensemble des branches\nLe résultat Vie s’établit à 464 MDH en\nRésultat net social (en MDH)\ncroissance de l’activité en Epargne et en D\n+15,4%\n607 701 Le résultat Non-Vie ressort à 436 MDH en\nenregistré en 2022 (157 MDH), portée par l\nbonne tenue du résultat financierr..\nLe résultat net social atteint 701 MDH en\nDéc 2022 Déc 2023\nLes fonds propres sociaux s’élèvent à 6 6\nFonds propres sociaux (en MDH)\nRésultats consolidés\n+3,9%\n6 356 6 601\nAu 31 décembre 2023, le chiffre d’affai\n12 724 MDH enregistrant une hausse de\nréalisée sur l’ensemble des branches\nl’international.\nDéc 2022 Déc 2023\nLe RNPG de l’exercice 2023 ressort à 670 M\nde 13,6% impacté par l’évolution des marc\nChiffre d’affaires consolidé (en MDH)\ncourantes en 2023 (notamment le don au\n+9,3% effets du séisme d’Al Haouz).\n11 639 12 724\nLes capitaux propres part du groupe s’élè\n2023 vs. 8 057 MDH en 2022 en hausse de\nLe périmètre de consolidation, comprena\nDéc2022 Déc 2023 africaines, a connu courant 2023 l’entr\nplacement dédiés.\nRN Part du groupe (en MDH) Au vu des résultats enregistrés et des\nConseil d’Administration a décidé de p\n-13,6%\nOrdinaire, convoquée pour le 15 Mai 2024\n776 670\nl’exercice 2023, d’un dividende de 140 dirh\nWafa Assurance confirme ainsi son le\nfondamentaux, et poursuit le développem\nDéc2022 Déc 2023\nContact : information.financiere@wafaassurance.co.ma\nLien internet : https://www.wafaassurance.ma/fr/compa": "",
                "": "",
                "null": "",
                "uue par l’activité Non--vie.\nss techniques et finannciers.\neuudi 14 mars 2024, sous la\ndee la compagnie et d’arrêter\nfa Assurance atteint 11 164 MDH,\ngression de +5,6% portéée par la\n4 891 MDH conséquemmment à la\nNoon-Vie.\npprogression de 1,5% suuite à la\néccès.\nprrogression par rapport aau niveau\na croissance de l’activité et par la\nprrogression de 15,4%.\n01 MDH en hausse de 3,9%.\nrees consolidé annuel s’établit à\n99,3% portée par la perfformance\nVie et Non-vie au Maroc et à\nDDH vs 776 MDH en 2022 en baisse\nhés financiers et les chaarges non\nfoonds spécial pour la gestion des\nvent à 9 232 MDH au 31 ddécembre\n144,6%.\nntt Wafa Assurance et sees filiales\néee de deux fonds communs de\npeerspectives de la comppagnie, le\nrooposer à l’Assemblée Générale\nà 11h00, la distribution au titre de\namms par action.\nadership et la soliditéé de ses\nent de ses activités.\ngnnie-assurance-maroc": ""
            },
            {
                "COMMUNIQUÉ FINANCIER\nRÉSULLTTAATTS ANNUELS 2023\nCCrrooiissssaannncccceee dduu cchhiiffffrreee dddd’’’aaaffffaaiiress ppoorrttéée aussi bien par l’activité Vie q\nRésuullttaattss eenn pprrooggrreesssionn eennnn rraaiissoon de l’amélioration des indicateur\nLee CCoonseeiilll dddd’’AAddministrationn de Wafa Assurance s’est réuni le J\nPPrréésidence de Monsieur Bouubker JAI, en vue d’examiner l’activité\nlles comptes au 31 décembree 2023.\nRésultats sociaux\nChiffre d’affaires social (en MDH)\nEn 2023, le chiffre d’affaires social de Wa\n+7,1%\nsoit +7,1% par rapport à 2022.\n10 425 11 164\nLL’’activité Vie s’élève à 6 273 MDH en pro\nppeerrfformancee eenn EEppaarrggnnee eett PPrrévoyyance.\nLL’’activité Non-Vie progresse de +9,1%, à\nDéc 2022 Déc 2023\nperformance de l’ensemble des branches\nLe résultat Vie s’établit à 464 MDH en\nRésultat net social (en MDH)\ncroissance de l’activité en Epargne et en D\n+15,4%\n607 701 Le résultat Non-Vie ressort à 436 MDH en\nenregistré en 2022 (157 MDH), portée par l\nbonne tenue du résultat financierr..\nLe résultat net social atteint 701 MDH en\nDéc 2022 Déc 2023\nLes fonds propres sociaux s’élèvent à 6 6\nFonds propres sociaux (en MDH)\nRésultats consolidés\n+3,9%\n6 356 6 601\nAu 31 décembre 2023, le chiffre d’affai\n12 724 MDH enregistrant une hausse de\nréalisée sur l’ensemble des branches\nl’international.\nDéc 2022 Déc 2023\nLe RNPG de l’exercice 2023 ressort à 670 M\nde 13,6% impacté par l’évolution des marc\nChiffre d’affaires consolidé (en MDH)\ncourantes en 2023 (notamment le don au\n+9,3% effets du séisme d’Al Haouz).\n11 639 12 724\nLes capitaux propres part du groupe s’élè\n2023 vs. 8 057 MDH en 2022 en hausse de\nLe périmètre de consolidation, comprena\nDéc2022 Déc 2023 africaines, a connu courant 2023 l’entr\nplacement dédiés.\nRN Part du groupe (en MDH) Au vu des résultats enregistrés et des\nConseil d’Administration a décidé de p\n-13,6%\nOrdinaire, convoquée pour le 15 Mai 2024\n776 670\nl’exercice 2023, d’un dividende de 140 dirh\nWafa Assurance confirme ainsi son le\nfondamentaux, et poursuit le développem\nDéc2022 Déc 2023\nContact : information.financiere@wafaassurance.co.ma\nLien internet : https://www.wafaassurance.ma/fr/compa": "",
                "": "",
                "null": "",
                "uue par l’activité Non--vie.\nss techniques et finannciers.\neuudi 14 mars 2024, sous la\ndee la compagnie et d’arrêter\nfa Assurance atteint 11 164 MDH,\ngression de +5,6% portéée par la\n4 891 MDH conséquemmment à la\nNoon-Vie.\npprogression de 1,5% suuite à la\néccès.\nprrogression par rapport aau niveau\na croissance de l’activité et par la\nprrogression de 15,4%.\n01 MDH en hausse de 3,9%.\nrees consolidé annuel s’établit à\n99,3% portée par la perfformance\nVie et Non-vie au Maroc et à\nDDH vs 776 MDH en 2022 en baisse\nhés financiers et les chaarges non\nfoonds spécial pour la gestion des\nvent à 9 232 MDH au 31 ddécembre\n144,6%.\nntt Wafa Assurance et sees filiales\néee de deux fonds communs de\npeerspectives de la comppagnie, le\nrooposer à l’Assemblée Générale\nà 11h00, la distribution au titre de\namms par action.\nadership et la soliditéé de ses\nent de ses activités.\ngnnie-assurance-maroc": ""
            },
            {
                "COMMUNIQUÉ FINANCIER\nRÉSULLTTAATTS ANNUELS 2023\nCCrrooiissssaannncccceee dduu cchhiiffffrreee dddd’’’aaaffffaaiiress ppoorrttéée aussi bien par l’activité Vie q\nRésuullttaattss eenn pprrooggrreesssionn eennnn rraaiissoon de l’amélioration des indicateur\nLee CCoonseeiilll dddd’’AAddministrationn de Wafa Assurance s’est réuni le J\nPPrréésidence de Monsieur Bouubker JAI, en vue d’examiner l’activité\nlles comptes au 31 décembree 2023.\nRésultats sociaux\nChiffre d’affaires social (en MDH)\nEn 2023, le chiffre d’affaires social de Wa\n+7,1%\nsoit +7,1% par rapport à 2022.\n10 425 11 164\nLL’’activité Vie s’élève à 6 273 MDH en pro\nppeerrfformancee eenn EEppaarrggnnee eett PPrrévoyyance.\nLL’’activité Non-Vie progresse de +9,1%, à\nDéc 2022 Déc 2023\nperformance de l’ensemble des branches\nLe résultat Vie s’établit à 464 MDH en\nRésultat net social (en MDH)\ncroissance de l’activité en Epargne et en D\n+15,4%\n607 701 Le résultat Non-Vie ressort à 436 MDH en\nenregistré en 2022 (157 MDH), portée par l\nbonne tenue du résultat financierr..\nLe résultat net social atteint 701 MDH en\nDéc 2022 Déc 2023\nLes fonds propres sociaux s’élèvent à 6 6\nFonds propres sociaux (en MDH)\nRésultats consolidés\n+3,9%\n6 356 6 601\nAu 31 décembre 2023, le chiffre d’affai\n12 724 MDH enregistrant une hausse de\nréalisée sur l’ensemble des branches\nl’international.\nDéc 2022 Déc 2023\nLe RNPG de l’exercice 2023 ressort à 670 M\nde 13,6% impacté par l’évolution des marc\nChiffre d’affaires consolidé (en MDH)\ncourantes en 2023 (notamment le don au\n+9,3% effets du séisme d’Al Haouz).\n11 639 12 724\nLes capitaux propres part du groupe s’élè\n2023 vs. 8 057 MDH en 2022 en hausse de\nLe périmètre de consolidation, comprena\nDéc2022 Déc 2023 africaines, a connu courant 2023 l’entr\nplacement dédiés.\nRN Part du groupe (en MDH) Au vu des résultats enregistrés et des\nConseil d’Administration a décidé de p\n-13,6%\nOrdinaire, convoquée pour le 15 Mai 2024\n776 670\nl’exercice 2023, d’un dividende de 140 dirh\nWafa Assurance confirme ainsi son le\nfondamentaux, et poursuit le développem\nDéc2022 Déc 2023\nContact : information.financiere@wafaassurance.co.ma\nLien internet : https://www.wafaassurance.ma/fr/compa": "",
                "": "",
                "null": "2023, le chiffre d’affaires social de Wa",
                "uue par l’activité Non--vie.\nss techniques et finannciers.\neuudi 14 mars 2024, sous la\ndee la compagnie et d’arrêter\nfa Assurance atteint 11 164 MDH,\ngression de +5,6% portéée par la\n4 891 MDH conséquemmment à la\nNoon-Vie.\npprogression de 1,5% suuite à la\néccès.\nprrogression par rapport aau niveau\na croissance de l’activité et par la\nprrogression de 15,4%.\n01 MDH en hausse de 3,9%.\nrees consolidé annuel s’établit à\n99,3% portée par la perfformance\nVie et Non-vie au Maroc et à\nDDH vs 776 MDH en 2022 en baisse\nhés financiers et les chaarges non\nfoonds spécial pour la gestion des\nvent à 9 232 MDH au 31 ddécembre\n144,6%.\nntt Wafa Assurance et sees filiales\néee de deux fonds communs de\npeerspectives de la comppagnie, le\nrooposer à l’Assemblée Générale\nà 11h00, la distribution au titre de\namms par action.\nadership et la soliditéé de ses\nent de ses activités.\ngnnie-assurance-maroc": "fa Assurance atteint 11 164 MDH,"
            },
            {
                "COMMUNIQUÉ FINANCIER\nRÉSULLTTAATTS ANNUELS 2023\nCCrrooiissssaannncccceee dduu cchhiiffffrreee dddd’’’aaaffffaaiiress ppoorrttéée aussi bien par l’activité Vie q\nRésuullttaattss eenn pprrooggrreesssionn eennnn rraaiissoon de l’amélioration des indicateur\nLee CCoonseeiilll dddd’’AAddministrationn de Wafa Assurance s’est réuni le J\nPPrréésidence de Monsieur Bouubker JAI, en vue d’examiner l’activité\nlles comptes au 31 décembree 2023.\nRésultats sociaux\nChiffre d’affaires social (en MDH)\nEn 2023, le chiffre d’affaires social de Wa\n+7,1%\nsoit +7,1% par rapport à 2022.\n10 425 11 164\nLL’’activité Vie s’élève à 6 273 MDH en pro\nppeerrfformancee eenn EEppaarrggnnee eett PPrrévoyyance.\nLL’’activité Non-Vie progresse de +9,1%, à\nDéc 2022 Déc 2023\nperformance de l’ensemble des branches\nLe résultat Vie s’établit à 464 MDH en\nRésultat net social (en MDH)\ncroissance de l’activité en Epargne et en D\n+15,4%\n607 701 Le résultat Non-Vie ressort à 436 MDH en\nenregistré en 2022 (157 MDH), portée par l\nbonne tenue du résultat financierr..\nLe résultat net social atteint 701 MDH en\nDéc 2022 Déc 2023\nLes fonds propres sociaux s’élèvent à 6 6\nFonds propres sociaux (en MDH)\nRésultats consolidés\n+3,9%\n6 356 6 601\nAu 31 décembre 2023, le chiffre d’affai\n12 724 MDH enregistrant une hausse de\nréalisée sur l’ensemble des branches\nl’international.\nDéc 2022 Déc 2023\nLe RNPG de l’exercice 2023 ressort à 670 M\nde 13,6% impacté par l’évolution des marc\nChiffre d’affaires consolidé (en MDH)\ncourantes en 2023 (notamment le don au\n+9,3% effets du séisme d’Al Haouz).\n11 639 12 724\nLes capitaux propres part du groupe s’élè\n2023 vs. 8 057 MDH en 2022 en hausse de\nLe périmètre de consolidation, comprena\nDéc2022 Déc 2023 africaines, a connu courant 2023 l’entr\nplacement dédiés.\nRN Part du groupe (en MDH) Au vu des résultats enregistrés et des\nConseil d’Administration a décidé de p\n-13,6%\nOrdinaire, convoquée pour le 15 Mai 2024\n776 670\nl’exercice 2023, d’un dividende de 140 dirh\nWafa Assurance confirme ainsi son le\nfondamentaux, et poursuit le développem\nDéc2022 Déc 2023\nContact : information.financiere@wafaassurance.co.ma\nLien internet : https://www.wafaassurance.ma/fr/compa": "",
                "": "",
                "null": "",
                "uue par l’activité Non--vie.\nss techniques et finannciers.\neuudi 14 mars 2024, sous la\ndee la compagnie et d’arrêter\nfa Assurance atteint 11 164 MDH,\ngression de +5,6% portéée par la\n4 891 MDH conséquemmment à la\nNoon-Vie.\npprogression de 1,5% suuite à la\néccès.\nprrogression par rapport aau niveau\na croissance de l’activité et par la\nprrogression de 15,4%.\n01 MDH en hausse de 3,9%.\nrees consolidé annuel s’établit à\n99,3% portée par la perfformance\nVie et Non-vie au Maroc et à\nDDH vs 776 MDH en 2022 en baisse\nhés financiers et les chaarges non\nfoonds spécial pour la gestion des\nvent à 9 232 MDH au 31 ddécembre\n144,6%.\nntt Wafa Assurance et sees filiales\néee de deux fonds communs de\npeerspectives de la comppagnie, le\nrooposer à l’Assemblée Générale\nà 11h00, la distribution au titre de\namms par action.\nadership et la soliditéé de ses\nent de ses activités.\ngnnie-assurance-maroc": ""
            },
            {
                "COMMUNIQUÉ FINANCIER\nRÉSULLTTAATTS ANNUELS 2023\nCCrrooiissssaannncccceee dduu cchhiiffffrreee dddd’’’aaaffffaaiiress ppoorrttéée aussi bien par l’activité Vie q\nRésuullttaattss eenn pprrooggrreesssionn eennnn rraaiissoon de l’amélioration des indicateur\nLee CCoonseeiilll dddd’’AAddministrationn de Wafa Assurance s’est réuni le J\nPPrréésidence de Monsieur Bouubker JAI, en vue d’examiner l’activité\nlles comptes au 31 décembree 2023.\nRésultats sociaux\nChiffre d’affaires social (en MDH)\nEn 2023, le chiffre d’affaires social de Wa\n+7,1%\nsoit +7,1% par rapport à 2022.\n10 425 11 164\nLL’’activité Vie s’élève à 6 273 MDH en pro\nppeerrfformancee eenn EEppaarrggnnee eett PPrrévoyyance.\nLL’’activité Non-Vie progresse de +9,1%, à\nDéc 2022 Déc 2023\nperformance de l’ensemble des branches\nLe résultat Vie s’établit à 464 MDH en\nRésultat net social (en MDH)\ncroissance de l’activité en Epargne et en D\n+15,4%\n607 701 Le résultat Non-Vie ressort à 436 MDH en\nenregistré en 2022 (157 MDH), portée par l\nbonne tenue du résultat financierr..\nLe résultat net social atteint 701 MDH en\nDéc 2022 Déc 2023\nLes fonds propres sociaux s’élèvent à 6 6\nFonds propres sociaux (en MDH)\nRésultats consolidés\n+3,9%\n6 356 6 601\nAu 31 décembre 2023, le chiffre d’affai\n12 724 MDH enregistrant une hausse de\nréalisée sur l’ensemble des branches\nl’international.\nDéc 2022 Déc 2023\nLe RNPG de l’exercice 2023 ressort à 670 M\nde 13,6% impacté par l’évolution des marc\nChiffre d’affaires consolidé (en MDH)\ncourantes en 2023 (notamment le don au\n+9,3% effets du séisme d’Al Haouz).\n11 639 12 724\nLes capitaux propres part du groupe s’élè\n2023 vs. 8 057 MDH en 2022 en hausse de\nLe périmètre de consolidation, comprena\nDéc2022 Déc 2023 africaines, a connu courant 2023 l’entr\nplacement dédiés.\nRN Part du groupe (en MDH) Au vu des résultats enregistrés et des\nConseil d’Administration a décidé de p\n-13,6%\nOrdinaire, convoquée pour le 15 Mai 2024\n776 670\nl’exercice 2023, d’un dividende de 140 dirh\nWafa Assurance confirme ainsi son le\nfondamentaux, et poursuit le développem\nDéc2022 Déc 2023\nContact : information.financiere@wafaassurance.co.ma\nLien internet : https://www.wafaassurance.ma/fr/compa": "",
                "": "",
                "null": "",
                "uue par l’activité Non--vie.\nss techniques et finannciers.\neuudi 14 mars 2024, sous la\ndee la compagnie et d’arrêter\nfa Assurance atteint 11 164 MDH,\ngression de +5,6% portéée par la\n4 891 MDH conséquemmment à la\nNoon-Vie.\npprogression de 1,5% suuite à la\néccès.\nprrogression par rapport aau niveau\na croissance de l’activité et par la\nprrogression de 15,4%.\n01 MDH en hausse de 3,9%.\nrees consolidé annuel s’établit à\n99,3% portée par la perfformance\nVie et Non-vie au Maroc et à\nDDH vs 776 MDH en 2022 en baisse\nhés financiers et les chaarges non\nfoonds spécial pour la gestion des\nvent à 9 232 MDH au 31 ddécembre\n144,6%.\nntt Wafa Assurance et sees filiales\néee de deux fonds communs de\npeerspectives de la comppagnie, le\nrooposer à l’Assemblée Générale\nà 11h00, la distribution au titre de\namms par action.\nadership et la soliditéé de ses\nent de ses activités.\ngnnie-assurance-maroc": ""
            },
            {
                "COMMUNIQUÉ FINANCIER\nRÉSULLTTAATTS ANNUELS 2023\nCCrrooiissssaannncccceee dduu cchhiiffffrreee dddd’’’aaaffffaaiiress ppoorrttéée aussi bien par l’activité Vie q\nRésuullttaattss eenn pprrooggrreesssionn eennnn rraaiissoon de l’amélioration des indicateur\nLee CCoonseeiilll dddd’’AAddministrationn de Wafa Assurance s’est réuni le J\nPPrréésidence de Monsieur Bouubker JAI, en vue d’examiner l’activité\nlles comptes au 31 décembree 2023.\nRésultats sociaux\nChiffre d’affaires social (en MDH)\nEn 2023, le chiffre d’affaires social de Wa\n+7,1%\nsoit +7,1% par rapport à 2022.\n10 425 11 164\nLL’’activité Vie s’élève à 6 273 MDH en pro\nppeerrfformancee eenn EEppaarrggnnee eett PPrrévoyyance.\nLL’’activité Non-Vie progresse de +9,1%, à\nDéc 2022 Déc 2023\nperformance de l’ensemble des branches\nLe résultat Vie s’établit à 464 MDH en\nRésultat net social (en MDH)\ncroissance de l’activité en Epargne et en D\n+15,4%\n607 701 Le résultat Non-Vie ressort à 436 MDH en\nenregistré en 2022 (157 MDH), portée par l\nbonne tenue du résultat financierr..\nLe résultat net social atteint 701 MDH en\nDéc 2022 Déc 2023\nLes fonds propres sociaux s’élèvent à 6 6\nFonds propres sociaux (en MDH)\nRésultats consolidés\n+3,9%\n6 356 6 601\nAu 31 décembre 2023, le chiffre d’affai\n12 724 MDH enregistrant une hausse de\nréalisée sur l’ensemble des branches\nl’international.\nDéc 2022 Déc 2023\nLe RNPG de l’exercice 2023 ressort à 670 M\nde 13,6% impacté par l’évolution des marc\nChiffre d’affaires consolidé (en MDH)\ncourantes en 2023 (notamment le don au\n+9,3% effets du séisme d’Al Haouz).\n11 639 12 724\nLes capitaux propres part du groupe s’élè\n2023 vs. 8 057 MDH en 2022 en hausse de\nLe périmètre de consolidation, comprena\nDéc2022 Déc 2023 africaines, a connu courant 2023 l’entr\nplacement dédiés.\nRN Part du groupe (en MDH) Au vu des résultats enregistrés et des\nConseil d’Administration a décidé de p\n-13,6%\nOrdinaire, convoquée pour le 15 Mai 2024\n776 670\nl’exercice 2023, d’un dividende de 140 dirh\nWafa Assurance confirme ainsi son le\nfondamentaux, et poursuit le développem\nDéc2022 Déc 2023\nContact : information.financiere@wafaassurance.co.ma\nLien internet : https://www.wafaassurance.ma/fr/compa": "",
                "": "",
                "null": "",
                "uue par l’activité Non--vie.\nss techniques et finannciers.\neuudi 14 mars 2024, sous la\ndee la compagnie et d’arrêter\nfa Assurance atteint 11 164 MDH,\ngression de +5,6% portéée par la\n4 891 MDH conséquemmment à la\nNoon-Vie.\npprogression de 1,5% suuite à la\néccès.\nprrogression par rapport aau niveau\na croissance de l’activité et par la\nprrogression de 15,4%.\n01 MDH en hausse de 3,9%.\nrees consolidé annuel s’établit à\n99,3% portée par la perfformance\nVie et Non-vie au Maroc et à\nDDH vs 776 MDH en 2022 en baisse\nhés financiers et les chaarges non\nfoonds spécial pour la gestion des\nvent à 9 232 MDH au 31 ddécembre\n144,6%.\nntt Wafa Assurance et sees filiales\néee de deux fonds communs de\npeerspectives de la comppagnie, le\nrooposer à l’Assemblée Générale\nà 11h00, la distribution au titre de\namms par action.\nadership et la soliditéé de ses\nent de ses activités.\ngnnie-assurance-maroc": ""
            },
            {
                "COMMUNIQUÉ FINANCIER\nRÉSULLTTAATTS ANNUELS 2023\nCCrrooiissssaannncccceee dduu cchhiiffffrreee dddd’’’aaaffffaaiiress ppoorrttéée aussi bien par l’activité Vie q\nRésuullttaattss eenn pprrooggrreesssionn eennnn rraaiissoon de l’amélioration des indicateur\nLee CCoonseeiilll dddd’’AAddministrationn de Wafa Assurance s’est réuni le J\nPPrréésidence de Monsieur Bouubker JAI, en vue d’examiner l’activité\nlles comptes au 31 décembree 2023.\nRésultats sociaux\nChiffre d’affaires social (en MDH)\nEn 2023, le chiffre d’affaires social de Wa\n+7,1%\nsoit +7,1% par rapport à 2022.\n10 425 11 164\nLL’’activité Vie s’élève à 6 273 MDH en pro\nppeerrfformancee eenn EEppaarrggnnee eett PPrrévoyyance.\nLL’’activité Non-Vie progresse de +9,1%, à\nDéc 2022 Déc 2023\nperformance de l’ensemble des branches\nLe résultat Vie s’établit à 464 MDH en\nRésultat net social (en MDH)\ncroissance de l’activité en Epargne et en D\n+15,4%\n607 701 Le résultat Non-Vie ressort à 436 MDH en\nenregistré en 2022 (157 MDH), portée par l\nbonne tenue du résultat financierr..\nLe résultat net social atteint 701 MDH en\nDéc 2022 Déc 2023\nLes fonds propres sociaux s’élèvent à 6 6\nFonds propres sociaux (en MDH)\nRésultats consolidés\n+3,9%\n6 356 6 601\nAu 31 décembre 2023, le chiffre d’affai\n12 724 MDH enregistrant une hausse de\nréalisée sur l’ensemble des branches\nl’international.\nDéc 2022 Déc 2023\nLe RNPG de l’exercice 2023 ressort à 670 M\nde 13,6% impacté par l’évolution des marc\nChiffre d’affaires consolidé (en MDH)\ncourantes en 2023 (notamment le don au\n+9,3% effets du séisme d’Al Haouz).\n11 639 12 724\nLes capitaux propres part du groupe s’élè\n2023 vs. 8 057 MDH en 2022 en hausse de\nLe périmètre de consolidation, comprena\nDéc2022 Déc 2023 africaines, a connu courant 2023 l’entr\nplacement dédiés.\nRN Part du groupe (en MDH) Au vu des résultats enregistrés et des\nConseil d’Administration a décidé de p\n-13,6%\nOrdinaire, convoquée pour le 15 Mai 2024\n776 670\nl’exercice 2023, d’un dividende de 140 dirh\nWafa Assurance confirme ainsi son le\nfondamentaux, et poursuit le développem\nDéc2022 Déc 2023\nContact : information.financiere@wafaassurance.co.ma\nLien internet : https://www.wafaassurance.ma/fr/compa": "",
                "": "LL’’activité Vie s’élève à 6 273 MDH en pro",
                "null": "",
                "uue par l’activité Non--vie.\nss techniques et finannciers.\neuudi 14 mars 2024, sous la\ndee la compagnie et d’arrêter\nfa Assurance atteint 11 164 MDH,\ngression de +5,6% portéée par la\n4 891 MDH conséquemmment à la\nNoon-Vie.\npprogression de 1,5% suuite à la\néccès.\nprrogression par rapport aau niveau\na croissance de l’activité et par la\nprrogression de 15,4%.\n01 MDH en hausse de 3,9%.\nrees consolidé annuel s’établit à\n99,3% portée par la perfformance\nVie et Non-vie au Maroc et à\nDDH vs 776 MDH en 2022 en baisse\nhés financiers et les chaarges non\nfoonds spécial pour la gestion des\nvent à 9 232 MDH au 31 ddécembre\n144,6%.\nntt Wafa Assurance et sees filiales\néee de deux fonds communs de\npeerspectives de la comppagnie, le\nrooposer à l’Assemblée Générale\nà 11h00, la distribution au titre de\namms par action.\nadership et la soliditéé de ses\nent de ses activités.\ngnnie-assurance-maroc": "gression de +5,6% portéée par la"
            },
            {
                "COMMUNIQUÉ FINANCIER\nRÉSULLTTAATTS ANNUELS 2023\nCCrrooiissssaannncccceee dduu cchhiiffffrreee dddd’’’aaaffffaaiiress ppoorrttéée aussi bien par l’activité Vie q\nRésuullttaattss eenn pprrooggrreesssionn eennnn rraaiissoon de l’amélioration des indicateur\nLee CCoonseeiilll dddd’’AAddministrationn de Wafa Assurance s’est réuni le J\nPPrréésidence de Monsieur Bouubker JAI, en vue d’examiner l’activité\nlles comptes au 31 décembree 2023.\nRésultats sociaux\nChiffre d’affaires social (en MDH)\nEn 2023, le chiffre d’affaires social de Wa\n+7,1%\nsoit +7,1% par rapport à 2022.\n10 425 11 164\nLL’’activité Vie s’élève à 6 273 MDH en pro\nppeerrfformancee eenn EEppaarrggnnee eett PPrrévoyyance.\nLL’’activité Non-Vie progresse de +9,1%, à\nDéc 2022 Déc 2023\nperformance de l’ensemble des branches\nLe résultat Vie s’établit à 464 MDH en\nRésultat net social (en MDH)\ncroissance de l’activité en Epargne et en D\n+15,4%\n607 701 Le résultat Non-Vie ressort à 436 MDH en\nenregistré en 2022 (157 MDH), portée par l\nbonne tenue du résultat financierr..\nLe résultat net social atteint 701 MDH en\nDéc 2022 Déc 2023\nLes fonds propres sociaux s’élèvent à 6 6\nFonds propres sociaux (en MDH)\nRésultats consolidés\n+3,9%\n6 356 6 601\nAu 31 décembre 2023, le chiffre d’affai\n12 724 MDH enregistrant une hausse de\nréalisée sur l’ensemble des branches\nl’international.\nDéc 2022 Déc 2023\nLe RNPG de l’exercice 2023 ressort à 670 M\nde 13,6% impacté par l’évolution des marc\nChiffre d’affaires consolidé (en MDH)\ncourantes en 2023 (notamment le don au\n+9,3% effets du séisme d’Al Haouz).\n11 639 12 724\nLes capitaux propres part du groupe s’élè\n2023 vs. 8 057 MDH en 2022 en hausse de\nLe périmètre de consolidation, comprena\nDéc2022 Déc 2023 africaines, a connu courant 2023 l’entr\nplacement dédiés.\nRN Part du groupe (en MDH) Au vu des résultats enregistrés et des\nConseil d’Administration a décidé de p\n-13,6%\nOrdinaire, convoquée pour le 15 Mai 2024\n776 670\nl’exercice 2023, d’un dividende de 140 dirh\nWafa Assurance confirme ainsi son le\nfondamentaux, et poursuit le développem\nDéc2022 Déc 2023\nContact : information.financiere@wafaassurance.co.ma\nLien internet : https://www.wafaassurance.ma/fr/compa": "",
                "": "",
                "null": "fformancee eenn EEppaarrggnnee eett PPrrévoyyance.",
                "uue par l’activité Non--vie.\nss techniques et finannciers.\neuudi 14 mars 2024, sous la\ndee la compagnie et d’arrêter\nfa Assurance atteint 11 164 MDH,\ngression de +5,6% portéée par la\n4 891 MDH conséquemmment à la\nNoon-Vie.\npprogression de 1,5% suuite à la\néccès.\nprrogression par rapport aau niveau\na croissance de l’activité et par la\nprrogression de 15,4%.\n01 MDH en hausse de 3,9%.\nrees consolidé annuel s’établit à\n99,3% portée par la perfformance\nVie et Non-vie au Maroc et à\nDDH vs 776 MDH en 2022 en baisse\nhés financiers et les chaarges non\nfoonds spécial pour la gestion des\nvent à 9 232 MDH au 31 ddécembre\n144,6%.\nntt Wafa Assurance et sees filiales\néee de deux fonds communs de\npeerspectives de la comppagnie, le\nrooposer à l’Assemblée Générale\nà 11h00, la distribution au titre de\namms par action.\nadership et la soliditéé de ses\nent de ses activités.\ngnnie-assurance-maroc": ""
            },
            {
                "COMMUNIQUÉ FINANCIER\nRÉSULLTTAATTS ANNUELS 2023\nCCrrooiissssaannncccceee dduu cchhiiffffrreee dddd’’’aaaffffaaiiress ppoorrttéée aussi bien par l’activité Vie q\nRésuullttaattss eenn pprrooggrreesssionn eennnn rraaiissoon de l’amélioration des indicateur\nLee CCoonseeiilll dddd’’AAddministrationn de Wafa Assurance s’est réuni le J\nPPrréésidence de Monsieur Bouubker JAI, en vue d’examiner l’activité\nlles comptes au 31 décembree 2023.\nRésultats sociaux\nChiffre d’affaires social (en MDH)\nEn 2023, le chiffre d’affaires social de Wa\n+7,1%\nsoit +7,1% par rapport à 2022.\n10 425 11 164\nLL’’activité Vie s’élève à 6 273 MDH en pro\nppeerrfformancee eenn EEppaarrggnnee eett PPrrévoyyance.\nLL’’activité Non-Vie progresse de +9,1%, à\nDéc 2022 Déc 2023\nperformance de l’ensemble des branches\nLe résultat Vie s’établit à 464 MDH en\nRésultat net social (en MDH)\ncroissance de l’activité en Epargne et en D\n+15,4%\n607 701 Le résultat Non-Vie ressort à 436 MDH en\nenregistré en 2022 (157 MDH), portée par l\nbonne tenue du résultat financierr..\nLe résultat net social atteint 701 MDH en\nDéc 2022 Déc 2023\nLes fonds propres sociaux s’élèvent à 6 6\nFonds propres sociaux (en MDH)\nRésultats consolidés\n+3,9%\n6 356 6 601\nAu 31 décembre 2023, le chiffre d’affai\n12 724 MDH enregistrant une hausse de\nréalisée sur l’ensemble des branches\nl’international.\nDéc 2022 Déc 2023\nLe RNPG de l’exercice 2023 ressort à 670 M\nde 13,6% impacté par l’évolution des marc\nChiffre d’affaires consolidé (en MDH)\ncourantes en 2023 (notamment le don au\n+9,3% effets du séisme d’Al Haouz).\n11 639 12 724\nLes capitaux propres part du groupe s’élè\n2023 vs. 8 057 MDH en 2022 en hausse de\nLe périmètre de consolidation, comprena\nDéc2022 Déc 2023 africaines, a connu courant 2023 l’entr\nplacement dédiés.\nRN Part du groupe (en MDH) Au vu des résultats enregistrés et des\nConseil d’Administration a décidé de p\n-13,6%\nOrdinaire, convoquée pour le 15 Mai 2024\n776 670\nl’exercice 2023, d’un dividende de 140 dirh\nWafa Assurance confirme ainsi son le\nfondamentaux, et poursuit le développem\nDéc2022 Déc 2023\nContact : information.financiere@wafaassurance.co.ma\nLien internet : https://www.wafaassurance.ma/fr/compa": "",
                "": "",
                "null": "",
                "uue par l’activité Non--vie.\nss techniques et finannciers.\neuudi 14 mars 2024, sous la\ndee la compagnie et d’arrêter\nfa Assurance atteint 11 164 MDH,\ngression de +5,6% portéée par la\n4 891 MDH conséquemmment à la\nNoon-Vie.\npprogression de 1,5% suuite à la\néccès.\nprrogression par rapport aau niveau\na croissance de l’activité et par la\nprrogression de 15,4%.\n01 MDH en hausse de 3,9%.\nrees consolidé annuel s’établit à\n99,3% portée par la perfformance\nVie et Non-vie au Maroc et à\nDDH vs 776 MDH en 2022 en baisse\nhés financiers et les chaarges non\nfoonds spécial pour la gestion des\nvent à 9 232 MDH au 31 ddécembre\n144,6%.\nntt Wafa Assurance et sees filiales\néee de deux fonds communs de\npeerspectives de la comppagnie, le\nrooposer à l’Assemblée Générale\nà 11h00, la distribution au titre de\namms par action.\nadership et la soliditéé de ses\nent de ses activités.\ngnnie-assurance-maroc": ""
            },
            {
                "COMMUNIQUÉ FINANCIER\nRÉSULLTTAATTS ANNUELS 2023\nCCrrooiissssaannncccceee dduu cchhiiffffrreee dddd’’’aaaffffaaiiress ppoorrttéée aussi bien par l’activité Vie q\nRésuullttaattss eenn pprrooggrreesssionn eennnn rraaiissoon de l’amélioration des indicateur\nLee CCoonseeiilll dddd’’AAddministrationn de Wafa Assurance s’est réuni le J\nPPrréésidence de Monsieur Bouubker JAI, en vue d’examiner l’activité\nlles comptes au 31 décembree 2023.\nRésultats sociaux\nChiffre d’affaires social (en MDH)\nEn 2023, le chiffre d’affaires social de Wa\n+7,1%\nsoit +7,1% par rapport à 2022.\n10 425 11 164\nLL’’activité Vie s’élève à 6 273 MDH en pro\nppeerrfformancee eenn EEppaarrggnnee eett PPrrévoyyance.\nLL’’activité Non-Vie progresse de +9,1%, à\nDéc 2022 Déc 2023\nperformance de l’ensemble des branches\nLe résultat Vie s’établit à 464 MDH en\nRésultat net social (en MDH)\ncroissance de l’activité en Epargne et en D\n+15,4%\n607 701 Le résultat Non-Vie ressort à 436 MDH en\nenregistré en 2022 (157 MDH), portée par l\nbonne tenue du résultat financierr..\nLe résultat net social atteint 701 MDH en\nDéc 2022 Déc 2023\nLes fonds propres sociaux s’élèvent à 6 6\nFonds propres sociaux (en MDH)\nRésultats consolidés\n+3,9%\n6 356 6 601\nAu 31 décembre 2023, le chiffre d’affai\n12 724 MDH enregistrant une hausse de\nréalisée sur l’ensemble des branches\nl’international.\nDéc 2022 Déc 2023\nLe RNPG de l’exercice 2023 ressort à 670 M\nde 13,6% impacté par l’évolution des marc\nChiffre d’affaires consolidé (en MDH)\ncourantes en 2023 (notamment le don au\n+9,3% effets du séisme d’Al Haouz).\n11 639 12 724\nLes capitaux propres part du groupe s’élè\n2023 vs. 8 057 MDH en 2022 en hausse de\nLe périmètre de consolidation, comprena\nDéc2022 Déc 2023 africaines, a connu courant 2023 l’entr\nplacement dédiés.\nRN Part du groupe (en MDH) Au vu des résultats enregistrés et des\nConseil d’Administration a décidé de p\n-13,6%\nOrdinaire, convoquée pour le 15 Mai 2024\n776 670\nl’exercice 2023, d’un dividende de 140 dirh\nWafa Assurance confirme ainsi son le\nfondamentaux, et poursuit le développem\nDéc2022 Déc 2023\nContact : information.financiere@wafaassurance.co.ma\nLien internet : https://www.wafaassurance.ma/fr/compa": "",
                "": "",
                "null": "",
                "uue par l’activité Non--vie.\nss techniques et finannciers.\neuudi 14 mars 2024, sous la\ndee la compagnie et d’arrêter\nfa Assurance atteint 11 164 MDH,\ngression de +5,6% portéée par la\n4 891 MDH conséquemmment à la\nNoon-Vie.\npprogression de 1,5% suuite à la\néccès.\nprrogression par rapport aau niveau\na croissance de l’activité et par la\nprrogression de 15,4%.\n01 MDH en hausse de 3,9%.\nrees consolidé annuel s’établit à\n99,3% portée par la perfformance\nVie et Non-vie au Maroc et à\nDDH vs 776 MDH en 2022 en baisse\nhés financiers et les chaarges non\nfoonds spécial pour la gestion des\nvent à 9 232 MDH au 31 ddécembre\n144,6%.\nntt Wafa Assurance et sees filiales\néee de deux fonds communs de\npeerspectives de la comppagnie, le\nrooposer à l’Assemblée Générale\nà 11h00, la distribution au titre de\namms par action.\nadership et la soliditéé de ses\nent de ses activités.\ngnnie-assurance-maroc": "4 891 MDH conséquemmment à la"
            },
            {
                "COMMUNIQUÉ FINANCIER\nRÉSULLTTAATTS ANNUELS 2023\nCCrrooiissssaannncccceee dduu cchhiiffffrreee dddd’’’aaaffffaaiiress ppoorrttéée aussi bien par l’activité Vie q\nRésuullttaattss eenn pprrooggrreesssionn eennnn rraaiissoon de l’amélioration des indicateur\nLee CCoonseeiilll dddd’’AAddministrationn de Wafa Assurance s’est réuni le J\nPPrréésidence de Monsieur Bouubker JAI, en vue d’examiner l’activité\nlles comptes au 31 décembree 2023.\nRésultats sociaux\nChiffre d’affaires social (en MDH)\nEn 2023, le chiffre d’affaires social de Wa\n+7,1%\nsoit +7,1% par rapport à 2022.\n10 425 11 164\nLL’’activité Vie s’élève à 6 273 MDH en pro\nppeerrfformancee eenn EEppaarrggnnee eett PPrrévoyyance.\nLL’’activité Non-Vie progresse de +9,1%, à\nDéc 2022 Déc 2023\nperformance de l’ensemble des branches\nLe résultat Vie s’établit à 464 MDH en\nRésultat net social (en MDH)\ncroissance de l’activité en Epargne et en D\n+15,4%\n607 701 Le résultat Non-Vie ressort à 436 MDH en\nenregistré en 2022 (157 MDH), portée par l\nbonne tenue du résultat financierr..\nLe résultat net social atteint 701 MDH en\nDéc 2022 Déc 2023\nLes fonds propres sociaux s’élèvent à 6 6\nFonds propres sociaux (en MDH)\nRésultats consolidés\n+3,9%\n6 356 6 601\nAu 31 décembre 2023, le chiffre d’affai\n12 724 MDH enregistrant une hausse de\nréalisée sur l’ensemble des branches\nl’international.\nDéc 2022 Déc 2023\nLe RNPG de l’exercice 2023 ressort à 670 M\nde 13,6% impacté par l’évolution des marc\nChiffre d’affaires consolidé (en MDH)\ncourantes en 2023 (notamment le don au\n+9,3% effets du séisme d’Al Haouz).\n11 639 12 724\nLes capitaux propres part du groupe s’élè\n2023 vs. 8 057 MDH en 2022 en hausse de\nLe périmètre de consolidation, comprena\nDéc2022 Déc 2023 africaines, a connu courant 2023 l’entr\nplacement dédiés.\nRN Part du groupe (en MDH) Au vu des résultats enregistrés et des\nConseil d’Administration a décidé de p\n-13,6%\nOrdinaire, convoquée pour le 15 Mai 2024\n776 670\nl’exercice 2023, d’un dividende de 140 dirh\nWafa Assurance confirme ainsi son le\nfondamentaux, et poursuit le développem\nDéc2022 Déc 2023\nContact : information.financiere@wafaassurance.co.ma\nLien internet : https://www.wafaassurance.ma/fr/compa": "",
                "": "",
                "null": "",
                "uue par l’activité Non--vie.\nss techniques et finannciers.\neuudi 14 mars 2024, sous la\ndee la compagnie et d’arrêter\nfa Assurance atteint 11 164 MDH,\ngression de +5,6% portéée par la\n4 891 MDH conséquemmment à la\nNoon-Vie.\npprogression de 1,5% suuite à la\néccès.\nprrogression par rapport aau niveau\na croissance de l’activité et par la\nprrogression de 15,4%.\n01 MDH en hausse de 3,9%.\nrees consolidé annuel s’établit à\n99,3% portée par la perfformance\nVie et Non-vie au Maroc et à\nDDH vs 776 MDH en 2022 en baisse\nhés financiers et les chaarges non\nfoonds spécial pour la gestion des\nvent à 9 232 MDH au 31 ddécembre\n144,6%.\nntt Wafa Assurance et sees filiales\néee de deux fonds communs de\npeerspectives de la comppagnie, le\nrooposer à l’Assemblée Générale\nà 11h00, la distribution au titre de\namms par action.\nadership et la soliditéé de ses\nent de ses activités.\ngnnie-assurance-maroc": "Noon-Vie."
            },
            {
                "COMMUNIQUÉ FINANCIER\nRÉSULLTTAATTS ANNUELS 2023\nCCrrooiissssaannncccceee dduu cchhiiffffrreee dddd’’’aaaffffaaiiress ppoorrttéée aussi bien par l’activité Vie q\nRésuullttaattss eenn pprrooggrreesssionn eennnn rraaiissoon de l’amélioration des indicateur\nLee CCoonseeiilll dddd’’AAddministrationn de Wafa Assurance s’est réuni le J\nPPrréésidence de Monsieur Bouubker JAI, en vue d’examiner l’activité\nlles comptes au 31 décembree 2023.\nRésultats sociaux\nChiffre d’affaires social (en MDH)\nEn 2023, le chiffre d’affaires social de Wa\n+7,1%\nsoit +7,1% par rapport à 2022.\n10 425 11 164\nLL’’activité Vie s’élève à 6 273 MDH en pro\nppeerrfformancee eenn EEppaarrggnnee eett PPrrévoyyance.\nLL’’activité Non-Vie progresse de +9,1%, à\nDéc 2022 Déc 2023\nperformance de l’ensemble des branches\nLe résultat Vie s’établit à 464 MDH en\nRésultat net social (en MDH)\ncroissance de l’activité en Epargne et en D\n+15,4%\n607 701 Le résultat Non-Vie ressort à 436 MDH en\nenregistré en 2022 (157 MDH), portée par l\nbonne tenue du résultat financierr..\nLe résultat net social atteint 701 MDH en\nDéc 2022 Déc 2023\nLes fonds propres sociaux s’élèvent à 6 6\nFonds propres sociaux (en MDH)\nRésultats consolidés\n+3,9%\n6 356 6 601\nAu 31 décembre 2023, le chiffre d’affai\n12 724 MDH enregistrant une hausse de\nréalisée sur l’ensemble des branches\nl’international.\nDéc 2022 Déc 2023\nLe RNPG de l’exercice 2023 ressort à 670 M\nde 13,6% impacté par l’évolution des marc\nChiffre d’affaires consolidé (en MDH)\ncourantes en 2023 (notamment le don au\n+9,3% effets du séisme d’Al Haouz).\n11 639 12 724\nLes capitaux propres part du groupe s’élè\n2023 vs. 8 057 MDH en 2022 en hausse de\nLe périmètre de consolidation, comprena\nDéc2022 Déc 2023 africaines, a connu courant 2023 l’entr\nplacement dédiés.\nRN Part du groupe (en MDH) Au vu des résultats enregistrés et des\nConseil d’Administration a décidé de p\n-13,6%\nOrdinaire, convoquée pour le 15 Mai 2024\n776 670\nl’exercice 2023, d’un dividende de 140 dirh\nWafa Assurance confirme ainsi son le\nfondamentaux, et poursuit le développem\nDéc2022 Déc 2023\nContact : information.financiere@wafaassurance.co.ma\nLien internet : https://www.wafaassurance.ma/fr/compa": "",
                "": "",
                "null": "formance de l’ensemble des branches",
                "uue par l’activité Non--vie.\nss techniques et finannciers.\neuudi 14 mars 2024, sous la\ndee la compagnie et d’arrêter\nfa Assurance atteint 11 164 MDH,\ngression de +5,6% portéée par la\n4 891 MDH conséquemmment à la\nNoon-Vie.\npprogression de 1,5% suuite à la\néccès.\nprrogression par rapport aau niveau\na croissance de l’activité et par la\nprrogression de 15,4%.\n01 MDH en hausse de 3,9%.\nrees consolidé annuel s’établit à\n99,3% portée par la perfformance\nVie et Non-vie au Maroc et à\nDDH vs 776 MDH en 2022 en baisse\nhés financiers et les chaarges non\nfoonds spécial pour la gestion des\nvent à 9 232 MDH au 31 ddécembre\n144,6%.\nntt Wafa Assurance et sees filiales\néee de deux fonds communs de\npeerspectives de la comppagnie, le\nrooposer à l’Assemblée Générale\nà 11h00, la distribution au titre de\namms par action.\nadership et la soliditéé de ses\nent de ses activités.\ngnnie-assurance-maroc": ""
            },
            {
                "COMMUNIQUÉ FINANCIER\nRÉSULLTTAATTS ANNUELS 2023\nCCrrooiissssaannncccceee dduu cchhiiffffrreee dddd’’’aaaffffaaiiress ppoorrttéée aussi bien par l’activité Vie q\nRésuullttaattss eenn pprrooggrreesssionn eennnn rraaiissoon de l’amélioration des indicateur\nLee CCoonseeiilll dddd’’AAddministrationn de Wafa Assurance s’est réuni le J\nPPrréésidence de Monsieur Bouubker JAI, en vue d’examiner l’activité\nlles comptes au 31 décembree 2023.\nRésultats sociaux\nChiffre d’affaires social (en MDH)\nEn 2023, le chiffre d’affaires social de Wa\n+7,1%\nsoit +7,1% par rapport à 2022.\n10 425 11 164\nLL’’activité Vie s’élève à 6 273 MDH en pro\nppeerrfformancee eenn EEppaarrggnnee eett PPrrévoyyance.\nLL’’activité Non-Vie progresse de +9,1%, à\nDéc 2022 Déc 2023\nperformance de l’ensemble des branches\nLe résultat Vie s’établit à 464 MDH en\nRésultat net social (en MDH)\ncroissance de l’activité en Epargne et en D\n+15,4%\n607 701 Le résultat Non-Vie ressort à 436 MDH en\nenregistré en 2022 (157 MDH), portée par l\nbonne tenue du résultat financierr..\nLe résultat net social atteint 701 MDH en\nDéc 2022 Déc 2023\nLes fonds propres sociaux s’élèvent à 6 6\nFonds propres sociaux (en MDH)\nRésultats consolidés\n+3,9%\n6 356 6 601\nAu 31 décembre 2023, le chiffre d’affai\n12 724 MDH enregistrant une hausse de\nréalisée sur l’ensemble des branches\nl’international.\nDéc 2022 Déc 2023\nLe RNPG de l’exercice 2023 ressort à 670 M\nde 13,6% impacté par l’évolution des marc\nChiffre d’affaires consolidé (en MDH)\ncourantes en 2023 (notamment le don au\n+9,3% effets du séisme d’Al Haouz).\n11 639 12 724\nLes capitaux propres part du groupe s’élè\n2023 vs. 8 057 MDH en 2022 en hausse de\nLe périmètre de consolidation, comprena\nDéc2022 Déc 2023 africaines, a connu courant 2023 l’entr\nplacement dédiés.\nRN Part du groupe (en MDH) Au vu des résultats enregistrés et des\nConseil d’Administration a décidé de p\n-13,6%\nOrdinaire, convoquée pour le 15 Mai 2024\n776 670\nl’exercice 2023, d’un dividende de 140 dirh\nWafa Assurance confirme ainsi son le\nfondamentaux, et poursuit le développem\nDéc2022 Déc 2023\nContact : information.financiere@wafaassurance.co.ma\nLien internet : https://www.wafaassurance.ma/fr/compa": "",
                "": "",
                "null": "",
                "uue par l’activité Non--vie.\nss techniques et finannciers.\neuudi 14 mars 2024, sous la\ndee la compagnie et d’arrêter\nfa Assurance atteint 11 164 MDH,\ngression de +5,6% portéée par la\n4 891 MDH conséquemmment à la\nNoon-Vie.\npprogression de 1,5% suuite à la\néccès.\nprrogression par rapport aau niveau\na croissance de l’activité et par la\nprrogression de 15,4%.\n01 MDH en hausse de 3,9%.\nrees consolidé annuel s’établit à\n99,3% portée par la perfformance\nVie et Non-vie au Maroc et à\nDDH vs 776 MDH en 2022 en baisse\nhés financiers et les chaarges non\nfoonds spécial pour la gestion des\nvent à 9 232 MDH au 31 ddécembre\n144,6%.\nntt Wafa Assurance et sees filiales\néee de deux fonds communs de\npeerspectives de la comppagnie, le\nrooposer à l’Assemblée Générale\nà 11h00, la distribution au titre de\namms par action.\nadership et la soliditéé de ses\nent de ses activités.\ngnnie-assurance-maroc": ""
            },
            {
                "COMMUNIQUÉ FINANCIER\nRÉSULLTTAATTS ANNUELS 2023\nCCrrooiissssaannncccceee dduu cchhiiffffrreee dddd’’’aaaffffaaiiress ppoorrttéée aussi bien par l’activité Vie q\nRésuullttaattss eenn pprrooggrreesssionn eennnn rraaiissoon de l’amélioration des indicateur\nLee CCoonseeiilll dddd’’AAddministrationn de Wafa Assurance s’est réuni le J\nPPrréésidence de Monsieur Bouubker JAI, en vue d’examiner l’activité\nlles comptes au 31 décembree 2023.\nRésultats sociaux\nChiffre d’affaires social (en MDH)\nEn 2023, le chiffre d’affaires social de Wa\n+7,1%\nsoit +7,1% par rapport à 2022.\n10 425 11 164\nLL’’activité Vie s’élève à 6 273 MDH en pro\nppeerrfformancee eenn EEppaarrggnnee eett PPrrévoyyance.\nLL’’activité Non-Vie progresse de +9,1%, à\nDéc 2022 Déc 2023\nperformance de l’ensemble des branches\nLe résultat Vie s’établit à 464 MDH en\nRésultat net social (en MDH)\ncroissance de l’activité en Epargne et en D\n+15,4%\n607 701 Le résultat Non-Vie ressort à 436 MDH en\nenregistré en 2022 (157 MDH), portée par l\nbonne tenue du résultat financierr..\nLe résultat net social atteint 701 MDH en\nDéc 2022 Déc 2023\nLes fonds propres sociaux s’élèvent à 6 6\nFonds propres sociaux (en MDH)\nRésultats consolidés\n+3,9%\n6 356 6 601\nAu 31 décembre 2023, le chiffre d’affai\n12 724 MDH enregistrant une hausse de\nréalisée sur l’ensemble des branches\nl’international.\nDéc 2022 Déc 2023\nLe RNPG de l’exercice 2023 ressort à 670 M\nde 13,6% impacté par l’évolution des marc\nChiffre d’affaires consolidé (en MDH)\ncourantes en 2023 (notamment le don au\n+9,3% effets du séisme d’Al Haouz).\n11 639 12 724\nLes capitaux propres part du groupe s’élè\n2023 vs. 8 057 MDH en 2022 en hausse de\nLe périmètre de consolidation, comprena\nDéc2022 Déc 2023 africaines, a connu courant 2023 l’entr\nplacement dédiés.\nRN Part du groupe (en MDH) Au vu des résultats enregistrés et des\nConseil d’Administration a décidé de p\n-13,6%\nOrdinaire, convoquée pour le 15 Mai 2024\n776 670\nl’exercice 2023, d’un dividende de 140 dirh\nWafa Assurance confirme ainsi son le\nfondamentaux, et poursuit le développem\nDéc2022 Déc 2023\nContact : information.financiere@wafaassurance.co.ma\nLien internet : https://www.wafaassurance.ma/fr/compa": "",
                "": "",
                "null": "résultat Vie s’établit à 464 MDH en",
                "uue par l’activité Non--vie.\nss techniques et finannciers.\neuudi 14 mars 2024, sous la\ndee la compagnie et d’arrêter\nfa Assurance atteint 11 164 MDH,\ngression de +5,6% portéée par la\n4 891 MDH conséquemmment à la\nNoon-Vie.\npprogression de 1,5% suuite à la\néccès.\nprrogression par rapport aau niveau\na croissance de l’activité et par la\nprrogression de 15,4%.\n01 MDH en hausse de 3,9%.\nrees consolidé annuel s’établit à\n99,3% portée par la perfformance\nVie et Non-vie au Maroc et à\nDDH vs 776 MDH en 2022 en baisse\nhés financiers et les chaarges non\nfoonds spécial pour la gestion des\nvent à 9 232 MDH au 31 ddécembre\n144,6%.\nntt Wafa Assurance et sees filiales\néee de deux fonds communs de\npeerspectives de la comppagnie, le\nrooposer à l’Assemblée Générale\nà 11h00, la distribution au titre de\namms par action.\nadership et la soliditéé de ses\nent de ses activités.\ngnnie-assurance-maroc": "pprogression de 1,5% suuite à la"
            },
            {
                "COMMUNIQUÉ FINANCIER\nRÉSULLTTAATTS ANNUELS 2023\nCCrrooiissssaannncccceee dduu cchhiiffffrreee dddd’’’aaaffffaaiiress ppoorrttéée aussi bien par l’activité Vie q\nRésuullttaattss eenn pprrooggrreesssionn eennnn rraaiissoon de l’amélioration des indicateur\nLee CCoonseeiilll dddd’’AAddministrationn de Wafa Assurance s’est réuni le J\nPPrréésidence de Monsieur Bouubker JAI, en vue d’examiner l’activité\nlles comptes au 31 décembree 2023.\nRésultats sociaux\nChiffre d’affaires social (en MDH)\nEn 2023, le chiffre d’affaires social de Wa\n+7,1%\nsoit +7,1% par rapport à 2022.\n10 425 11 164\nLL’’activité Vie s’élève à 6 273 MDH en pro\nppeerrfformancee eenn EEppaarrggnnee eett PPrrévoyyance.\nLL’’activité Non-Vie progresse de +9,1%, à\nDéc 2022 Déc 2023\nperformance de l’ensemble des branches\nLe résultat Vie s’établit à 464 MDH en\nRésultat net social (en MDH)\ncroissance de l’activité en Epargne et en D\n+15,4%\n607 701 Le résultat Non-Vie ressort à 436 MDH en\nenregistré en 2022 (157 MDH), portée par l\nbonne tenue du résultat financierr..\nLe résultat net social atteint 701 MDH en\nDéc 2022 Déc 2023\nLes fonds propres sociaux s’élèvent à 6 6\nFonds propres sociaux (en MDH)\nRésultats consolidés\n+3,9%\n6 356 6 601\nAu 31 décembre 2023, le chiffre d’affai\n12 724 MDH enregistrant une hausse de\nréalisée sur l’ensemble des branches\nl’international.\nDéc 2022 Déc 2023\nLe RNPG de l’exercice 2023 ressort à 670 M\nde 13,6% impacté par l’évolution des marc\nChiffre d’affaires consolidé (en MDH)\ncourantes en 2023 (notamment le don au\n+9,3% effets du séisme d’Al Haouz).\n11 639 12 724\nLes capitaux propres part du groupe s’élè\n2023 vs. 8 057 MDH en 2022 en hausse de\nLe périmètre de consolidation, comprena\nDéc2022 Déc 2023 africaines, a connu courant 2023 l’entr\nplacement dédiés.\nRN Part du groupe (en MDH) Au vu des résultats enregistrés et des\nConseil d’Administration a décidé de p\n-13,6%\nOrdinaire, convoquée pour le 15 Mai 2024\n776 670\nl’exercice 2023, d’un dividende de 140 dirh\nWafa Assurance confirme ainsi son le\nfondamentaux, et poursuit le développem\nDéc2022 Déc 2023\nContact : information.financiere@wafaassurance.co.ma\nLien internet : https://www.wafaassurance.ma/fr/compa": "",
                "": "",
                "null": "",
                "uue par l’activité Non--vie.\nss techniques et finannciers.\neuudi 14 mars 2024, sous la\ndee la compagnie et d’arrêter\nfa Assurance atteint 11 164 MDH,\ngression de +5,6% portéée par la\n4 891 MDH conséquemmment à la\nNoon-Vie.\npprogression de 1,5% suuite à la\néccès.\nprrogression par rapport aau niveau\na croissance de l’activité et par la\nprrogression de 15,4%.\n01 MDH en hausse de 3,9%.\nrees consolidé annuel s’établit à\n99,3% portée par la perfformance\nVie et Non-vie au Maroc et à\nDDH vs 776 MDH en 2022 en baisse\nhés financiers et les chaarges non\nfoonds spécial pour la gestion des\nvent à 9 232 MDH au 31 ddécembre\n144,6%.\nntt Wafa Assurance et sees filiales\néee de deux fonds communs de\npeerspectives de la comppagnie, le\nrooposer à l’Assemblée Générale\nà 11h00, la distribution au titre de\namms par action.\nadership et la soliditéé de ses\nent de ses activités.\ngnnie-assurance-maroc": "éccès."
            },
            {
                "COMMUNIQUÉ FINANCIER\nRÉSULLTTAATTS ANNUELS 2023\nCCrrooiissssaannncccceee dduu cchhiiffffrreee dddd’’’aaaffffaaiiress ppoorrttéée aussi bien par l’activité Vie q\nRésuullttaattss eenn pprrooggrreesssionn eennnn rraaiissoon de l’amélioration des indicateur\nLee CCoonseeiilll dddd’’AAddministrationn de Wafa Assurance s’est réuni le J\nPPrréésidence de Monsieur Bouubker JAI, en vue d’examiner l’activité\nlles comptes au 31 décembree 2023.\nRésultats sociaux\nChiffre d’affaires social (en MDH)\nEn 2023, le chiffre d’affaires social de Wa\n+7,1%\nsoit +7,1% par rapport à 2022.\n10 425 11 164\nLL’’activité Vie s’élève à 6 273 MDH en pro\nppeerrfformancee eenn EEppaarrggnnee eett PPrrévoyyance.\nLL’’activité Non-Vie progresse de +9,1%, à\nDéc 2022 Déc 2023\nperformance de l’ensemble des branches\nLe résultat Vie s’établit à 464 MDH en\nRésultat net social (en MDH)\ncroissance de l’activité en Epargne et en D\n+15,4%\n607 701 Le résultat Non-Vie ressort à 436 MDH en\nenregistré en 2022 (157 MDH), portée par l\nbonne tenue du résultat financierr..\nLe résultat net social atteint 701 MDH en\nDéc 2022 Déc 2023\nLes fonds propres sociaux s’élèvent à 6 6\nFonds propres sociaux (en MDH)\nRésultats consolidés\n+3,9%\n6 356 6 601\nAu 31 décembre 2023, le chiffre d’affai\n12 724 MDH enregistrant une hausse de\nréalisée sur l’ensemble des branches\nl’international.\nDéc 2022 Déc 2023\nLe RNPG de l’exercice 2023 ressort à 670 M\nde 13,6% impacté par l’évolution des marc\nChiffre d’affaires consolidé (en MDH)\ncourantes en 2023 (notamment le don au\n+9,3% effets du séisme d’Al Haouz).\n11 639 12 724\nLes capitaux propres part du groupe s’élè\n2023 vs. 8 057 MDH en 2022 en hausse de\nLe périmètre de consolidation, comprena\nDéc2022 Déc 2023 africaines, a connu courant 2023 l’entr\nplacement dédiés.\nRN Part du groupe (en MDH) Au vu des résultats enregistrés et des\nConseil d’Administration a décidé de p\n-13,6%\nOrdinaire, convoquée pour le 15 Mai 2024\n776 670\nl’exercice 2023, d’un dividende de 140 dirh\nWafa Assurance confirme ainsi son le\nfondamentaux, et poursuit le développem\nDéc2022 Déc 2023\nContact : information.financiere@wafaassurance.co.ma\nLien internet : https://www.wafaassurance.ma/fr/compa": "",
                "": "",
                "null": "ssance de l’activité en Epargne et en D",
                "uue par l’activité Non--vie.\nss techniques et finannciers.\neuudi 14 mars 2024, sous la\ndee la compagnie et d’arrêter\nfa Assurance atteint 11 164 MDH,\ngression de +5,6% portéée par la\n4 891 MDH conséquemmment à la\nNoon-Vie.\npprogression de 1,5% suuite à la\néccès.\nprrogression par rapport aau niveau\na croissance de l’activité et par la\nprrogression de 15,4%.\n01 MDH en hausse de 3,9%.\nrees consolidé annuel s’établit à\n99,3% portée par la perfformance\nVie et Non-vie au Maroc et à\nDDH vs 776 MDH en 2022 en baisse\nhés financiers et les chaarges non\nfoonds spécial pour la gestion des\nvent à 9 232 MDH au 31 ddécembre\n144,6%.\nntt Wafa Assurance et sees filiales\néee de deux fonds communs de\npeerspectives de la comppagnie, le\nrooposer à l’Assemblée Générale\nà 11h00, la distribution au titre de\namms par action.\nadership et la soliditéé de ses\nent de ses activités.\ngnnie-assurance-maroc": ""
            },
            {
                "COMMUNIQUÉ FINANCIER\nRÉSULLTTAATTS ANNUELS 2023\nCCrrooiissssaannncccceee dduu cchhiiffffrreee dddd’’’aaaffffaaiiress ppoorrttéée aussi bien par l’activité Vie q\nRésuullttaattss eenn pprrooggrreesssionn eennnn rraaiissoon de l’amélioration des indicateur\nLee CCoonseeiilll dddd’’AAddministrationn de Wafa Assurance s’est réuni le J\nPPrréésidence de Monsieur Bouubker JAI, en vue d’examiner l’activité\nlles comptes au 31 décembree 2023.\nRésultats sociaux\nChiffre d’affaires social (en MDH)\nEn 2023, le chiffre d’affaires social de Wa\n+7,1%\nsoit +7,1% par rapport à 2022.\n10 425 11 164\nLL’’activité Vie s’élève à 6 273 MDH en pro\nppeerrfformancee eenn EEppaarrggnnee eett PPrrévoyyance.\nLL’’activité Non-Vie progresse de +9,1%, à\nDéc 2022 Déc 2023\nperformance de l’ensemble des branches\nLe résultat Vie s’établit à 464 MDH en\nRésultat net social (en MDH)\ncroissance de l’activité en Epargne et en D\n+15,4%\n607 701 Le résultat Non-Vie ressort à 436 MDH en\nenregistré en 2022 (157 MDH), portée par l\nbonne tenue du résultat financierr..\nLe résultat net social atteint 701 MDH en\nDéc 2022 Déc 2023\nLes fonds propres sociaux s’élèvent à 6 6\nFonds propres sociaux (en MDH)\nRésultats consolidés\n+3,9%\n6 356 6 601\nAu 31 décembre 2023, le chiffre d’affai\n12 724 MDH enregistrant une hausse de\nréalisée sur l’ensemble des branches\nl’international.\nDéc 2022 Déc 2023\nLe RNPG de l’exercice 2023 ressort à 670 M\nde 13,6% impacté par l’évolution des marc\nChiffre d’affaires consolidé (en MDH)\ncourantes en 2023 (notamment le don au\n+9,3% effets du séisme d’Al Haouz).\n11 639 12 724\nLes capitaux propres part du groupe s’élè\n2023 vs. 8 057 MDH en 2022 en hausse de\nLe périmètre de consolidation, comprena\nDéc2022 Déc 2023 africaines, a connu courant 2023 l’entr\nplacement dédiés.\nRN Part du groupe (en MDH) Au vu des résultats enregistrés et des\nConseil d’Administration a décidé de p\n-13,6%\nOrdinaire, convoquée pour le 15 Mai 2024\n776 670\nl’exercice 2023, d’un dividende de 140 dirh\nWafa Assurance confirme ainsi son le\nfondamentaux, et poursuit le développem\nDéc2022 Déc 2023\nContact : information.financiere@wafaassurance.co.ma\nLien internet : https://www.wafaassurance.ma/fr/compa": "",
                "": "",
                "null": "",
                "uue par l’activité Non--vie.\nss techniques et finannciers.\neuudi 14 mars 2024, sous la\ndee la compagnie et d’arrêter\nfa Assurance atteint 11 164 MDH,\ngression de +5,6% portéée par la\n4 891 MDH conséquemmment à la\nNoon-Vie.\npprogression de 1,5% suuite à la\néccès.\nprrogression par rapport aau niveau\na croissance de l’activité et par la\nprrogression de 15,4%.\n01 MDH en hausse de 3,9%.\nrees consolidé annuel s’établit à\n99,3% portée par la perfformance\nVie et Non-vie au Maroc et à\nDDH vs 776 MDH en 2022 en baisse\nhés financiers et les chaarges non\nfoonds spécial pour la gestion des\nvent à 9 232 MDH au 31 ddécembre\n144,6%.\nntt Wafa Assurance et sees filiales\néee de deux fonds communs de\npeerspectives de la comppagnie, le\nrooposer à l’Assemblée Générale\nà 11h00, la distribution au titre de\namms par action.\nadership et la soliditéé de ses\nent de ses activités.\ngnnie-assurance-maroc": ""
            },
            {
                "COMMUNIQUÉ FINANCIER\nRÉSULLTTAATTS ANNUELS 2023\nCCrrooiissssaannncccceee dduu cchhiiffffrreee dddd’’’aaaffffaaiiress ppoorrttéée aussi bien par l’activité Vie q\nRésuullttaattss eenn pprrooggrreesssionn eennnn rraaiissoon de l’amélioration des indicateur\nLee CCoonseeiilll dddd’’AAddministrationn de Wafa Assurance s’est réuni le J\nPPrréésidence de Monsieur Bouubker JAI, en vue d’examiner l’activité\nlles comptes au 31 décembree 2023.\nRésultats sociaux\nChiffre d’affaires social (en MDH)\nEn 2023, le chiffre d’affaires social de Wa\n+7,1%\nsoit +7,1% par rapport à 2022.\n10 425 11 164\nLL’’activité Vie s’élève à 6 273 MDH en pro\nppeerrfformancee eenn EEppaarrggnnee eett PPrrévoyyance.\nLL’’activité Non-Vie progresse de +9,1%, à\nDéc 2022 Déc 2023\nperformance de l’ensemble des branches\nLe résultat Vie s’établit à 464 MDH en\nRésultat net social (en MDH)\ncroissance de l’activité en Epargne et en D\n+15,4%\n607 701 Le résultat Non-Vie ressort à 436 MDH en\nenregistré en 2022 (157 MDH), portée par l\nbonne tenue du résultat financierr..\nLe résultat net social atteint 701 MDH en\nDéc 2022 Déc 2023\nLes fonds propres sociaux s’élèvent à 6 6\nFonds propres sociaux (en MDH)\nRésultats consolidés\n+3,9%\n6 356 6 601\nAu 31 décembre 2023, le chiffre d’affai\n12 724 MDH enregistrant une hausse de\nréalisée sur l’ensemble des branches\nl’international.\nDéc 2022 Déc 2023\nLe RNPG de l’exercice 2023 ressort à 670 M\nde 13,6% impacté par l’évolution des marc\nChiffre d’affaires consolidé (en MDH)\ncourantes en 2023 (notamment le don au\n+9,3% effets du séisme d’Al Haouz).\n11 639 12 724\nLes capitaux propres part du groupe s’élè\n2023 vs. 8 057 MDH en 2022 en hausse de\nLe périmètre de consolidation, comprena\nDéc2022 Déc 2023 africaines, a connu courant 2023 l’entr\nplacement dédiés.\nRN Part du groupe (en MDH) Au vu des résultats enregistrés et des\nConseil d’Administration a décidé de p\n-13,6%\nOrdinaire, convoquée pour le 15 Mai 2024\n776 670\nl’exercice 2023, d’un dividende de 140 dirh\nWafa Assurance confirme ainsi son le\nfondamentaux, et poursuit le développem\nDéc2022 Déc 2023\nContact : information.financiere@wafaassurance.co.ma\nLien internet : https://www.wafaassurance.ma/fr/compa": "",
                "": "Le résultat Non-Vie ressort à 436 MDH en",
                "null": "",
                "uue par l’activité Non--vie.\nss techniques et finannciers.\neuudi 14 mars 2024, sous la\ndee la compagnie et d’arrêter\nfa Assurance atteint 11 164 MDH,\ngression de +5,6% portéée par la\n4 891 MDH conséquemmment à la\nNoon-Vie.\npprogression de 1,5% suuite à la\néccès.\nprrogression par rapport aau niveau\na croissance de l’activité et par la\nprrogression de 15,4%.\n01 MDH en hausse de 3,9%.\nrees consolidé annuel s’établit à\n99,3% portée par la perfformance\nVie et Non-vie au Maroc et à\nDDH vs 776 MDH en 2022 en baisse\nhés financiers et les chaarges non\nfoonds spécial pour la gestion des\nvent à 9 232 MDH au 31 ddécembre\n144,6%.\nntt Wafa Assurance et sees filiales\néee de deux fonds communs de\npeerspectives de la comppagnie, le\nrooposer à l’Assemblée Générale\nà 11h00, la distribution au titre de\namms par action.\nadership et la soliditéé de ses\nent de ses activités.\ngnnie-assurance-maroc": "prrogression par rapport aau niveau"
            },
            {
                "COMMUNIQUÉ FINANCIER\nRÉSULLTTAATTS ANNUELS 2023\nCCrrooiissssaannncccceee dduu cchhiiffffrreee dddd’’’aaaffffaaiiress ppoorrttéée aussi bien par l’activité Vie q\nRésuullttaattss eenn pprrooggrreesssionn eennnn rraaiissoon de l’amélioration des indicateur\nLee CCoonseeiilll dddd’’AAddministrationn de Wafa Assurance s’est réuni le J\nPPrréésidence de Monsieur Bouubker JAI, en vue d’examiner l’activité\nlles comptes au 31 décembree 2023.\nRésultats sociaux\nChiffre d’affaires social (en MDH)\nEn 2023, le chiffre d’affaires social de Wa\n+7,1%\nsoit +7,1% par rapport à 2022.\n10 425 11 164\nLL’’activité Vie s’élève à 6 273 MDH en pro\nppeerrfformancee eenn EEppaarrggnnee eett PPrrévoyyance.\nLL’’activité Non-Vie progresse de +9,1%, à\nDéc 2022 Déc 2023\nperformance de l’ensemble des branches\nLe résultat Vie s’établit à 464 MDH en\nRésultat net social (en MDH)\ncroissance de l’activité en Epargne et en D\n+15,4%\n607 701 Le résultat Non-Vie ressort à 436 MDH en\nenregistré en 2022 (157 MDH), portée par l\nbonne tenue du résultat financierr..\nLe résultat net social atteint 701 MDH en\nDéc 2022 Déc 2023\nLes fonds propres sociaux s’élèvent à 6 6\nFonds propres sociaux (en MDH)\nRésultats consolidés\n+3,9%\n6 356 6 601\nAu 31 décembre 2023, le chiffre d’affai\n12 724 MDH enregistrant une hausse de\nréalisée sur l’ensemble des branches\nl’international.\nDéc 2022 Déc 2023\nLe RNPG de l’exercice 2023 ressort à 670 M\nde 13,6% impacté par l’évolution des marc\nChiffre d’affaires consolidé (en MDH)\ncourantes en 2023 (notamment le don au\n+9,3% effets du séisme d’Al Haouz).\n11 639 12 724\nLes capitaux propres part du groupe s’élè\n2023 vs. 8 057 MDH en 2022 en hausse de\nLe périmètre de consolidation, comprena\nDéc2022 Déc 2023 africaines, a connu courant 2023 l’entr\nplacement dédiés.\nRN Part du groupe (en MDH) Au vu des résultats enregistrés et des\nConseil d’Administration a décidé de p\n-13,6%\nOrdinaire, convoquée pour le 15 Mai 2024\n776 670\nl’exercice 2023, d’un dividende de 140 dirh\nWafa Assurance confirme ainsi son le\nfondamentaux, et poursuit le développem\nDéc2022 Déc 2023\nContact : information.financiere@wafaassurance.co.ma\nLien internet : https://www.wafaassurance.ma/fr/compa": "",
                "": "enr",
                "null": "egistré en 2022 (157 MDH), portée par l",
                "uue par l’activité Non--vie.\nss techniques et finannciers.\neuudi 14 mars 2024, sous la\ndee la compagnie et d’arrêter\nfa Assurance atteint 11 164 MDH,\ngression de +5,6% portéée par la\n4 891 MDH conséquemmment à la\nNoon-Vie.\npprogression de 1,5% suuite à la\néccès.\nprrogression par rapport aau niveau\na croissance de l’activité et par la\nprrogression de 15,4%.\n01 MDH en hausse de 3,9%.\nrees consolidé annuel s’établit à\n99,3% portée par la perfformance\nVie et Non-vie au Maroc et à\nDDH vs 776 MDH en 2022 en baisse\nhés financiers et les chaarges non\nfoonds spécial pour la gestion des\nvent à 9 232 MDH au 31 ddécembre\n144,6%.\nntt Wafa Assurance et sees filiales\néee de deux fonds communs de\npeerspectives de la comppagnie, le\nrooposer à l’Assemblée Générale\nà 11h00, la distribution au titre de\namms par action.\nadership et la soliditéé de ses\nent de ses activités.\ngnnie-assurance-maroc": "a croissance de l’activité et par la"
            },
            {
                "COMMUNIQUÉ FINANCIER\nRÉSULLTTAATTS ANNUELS 2023\nCCrrooiissssaannncccceee dduu cchhiiffffrreee dddd’’’aaaffffaaiiress ppoorrttéée aussi bien par l’activité Vie q\nRésuullttaattss eenn pprrooggrreesssionn eennnn rraaiissoon de l’amélioration des indicateur\nLee CCoonseeiilll dddd’’AAddministrationn de Wafa Assurance s’est réuni le J\nPPrréésidence de Monsieur Bouubker JAI, en vue d’examiner l’activité\nlles comptes au 31 décembree 2023.\nRésultats sociaux\nChiffre d’affaires social (en MDH)\nEn 2023, le chiffre d’affaires social de Wa\n+7,1%\nsoit +7,1% par rapport à 2022.\n10 425 11 164\nLL’’activité Vie s’élève à 6 273 MDH en pro\nppeerrfformancee eenn EEppaarrggnnee eett PPrrévoyyance.\nLL’’activité Non-Vie progresse de +9,1%, à\nDéc 2022 Déc 2023\nperformance de l’ensemble des branches\nLe résultat Vie s’établit à 464 MDH en\nRésultat net social (en MDH)\ncroissance de l’activité en Epargne et en D\n+15,4%\n607 701 Le résultat Non-Vie ressort à 436 MDH en\nenregistré en 2022 (157 MDH), portée par l\nbonne tenue du résultat financierr..\nLe résultat net social atteint 701 MDH en\nDéc 2022 Déc 2023\nLes fonds propres sociaux s’élèvent à 6 6\nFonds propres sociaux (en MDH)\nRésultats consolidés\n+3,9%\n6 356 6 601\nAu 31 décembre 2023, le chiffre d’affai\n12 724 MDH enregistrant une hausse de\nréalisée sur l’ensemble des branches\nl’international.\nDéc 2022 Déc 2023\nLe RNPG de l’exercice 2023 ressort à 670 M\nde 13,6% impacté par l’évolution des marc\nChiffre d’affaires consolidé (en MDH)\ncourantes en 2023 (notamment le don au\n+9,3% effets du séisme d’Al Haouz).\n11 639 12 724\nLes capitaux propres part du groupe s’élè\n2023 vs. 8 057 MDH en 2022 en hausse de\nLe périmètre de consolidation, comprena\nDéc2022 Déc 2023 africaines, a connu courant 2023 l’entr\nplacement dédiés.\nRN Part du groupe (en MDH) Au vu des résultats enregistrés et des\nConseil d’Administration a décidé de p\n-13,6%\nOrdinaire, convoquée pour le 15 Mai 2024\n776 670\nl’exercice 2023, d’un dividende de 140 dirh\nWafa Assurance confirme ainsi son le\nfondamentaux, et poursuit le développem\nDéc2022 Déc 2023\nContact : information.financiere@wafaassurance.co.ma\nLien internet : https://www.wafaassurance.ma/fr/compa": "",
                "": "bonne tenue du résultat financierr..",
                "null": "",
                "uue par l’activité Non--vie.\nss techniques et finannciers.\neuudi 14 mars 2024, sous la\ndee la compagnie et d’arrêter\nfa Assurance atteint 11 164 MDH,\ngression de +5,6% portéée par la\n4 891 MDH conséquemmment à la\nNoon-Vie.\npprogression de 1,5% suuite à la\néccès.\nprrogression par rapport aau niveau\na croissance de l’activité et par la\nprrogression de 15,4%.\n01 MDH en hausse de 3,9%.\nrees consolidé annuel s’établit à\n99,3% portée par la perfformance\nVie et Non-vie au Maroc et à\nDDH vs 776 MDH en 2022 en baisse\nhés financiers et les chaarges non\nfoonds spécial pour la gestion des\nvent à 9 232 MDH au 31 ddécembre\n144,6%.\nntt Wafa Assurance et sees filiales\néee de deux fonds communs de\npeerspectives de la comppagnie, le\nrooposer à l’Assemblée Générale\nà 11h00, la distribution au titre de\namms par action.\nadership et la soliditéé de ses\nent de ses activités.\ngnnie-assurance-maroc": "prrogression de 15,4%."
            },
            {
                "COMMUNIQUÉ FINANCIER\nRÉSULLTTAATTS ANNUELS 2023\nCCrrooiissssaannncccceee dduu cchhiiffffrreee dddd’’’aaaffffaaiiress ppoorrttéée aussi bien par l’activité Vie q\nRésuullttaattss eenn pprrooggrreesssionn eennnn rraaiissoon de l’amélioration des indicateur\nLee CCoonseeiilll dddd’’AAddministrationn de Wafa Assurance s’est réuni le J\nPPrréésidence de Monsieur Bouubker JAI, en vue d’examiner l’activité\nlles comptes au 31 décembree 2023.\nRésultats sociaux\nChiffre d’affaires social (en MDH)\nEn 2023, le chiffre d’affaires social de Wa\n+7,1%\nsoit +7,1% par rapport à 2022.\n10 425 11 164\nLL’’activité Vie s’élève à 6 273 MDH en pro\nppeerrfformancee eenn EEppaarrggnnee eett PPrrévoyyance.\nLL’’activité Non-Vie progresse de +9,1%, à\nDéc 2022 Déc 2023\nperformance de l’ensemble des branches\nLe résultat Vie s’établit à 464 MDH en\nRésultat net social (en MDH)\ncroissance de l’activité en Epargne et en D\n+15,4%\n607 701 Le résultat Non-Vie ressort à 436 MDH en\nenregistré en 2022 (157 MDH), portée par l\nbonne tenue du résultat financierr..\nLe résultat net social atteint 701 MDH en\nDéc 2022 Déc 2023\nLes fonds propres sociaux s’élèvent à 6 6\nFonds propres sociaux (en MDH)\nRésultats consolidés\n+3,9%\n6 356 6 601\nAu 31 décembre 2023, le chiffre d’affai\n12 724 MDH enregistrant une hausse de\nréalisée sur l’ensemble des branches\nl’international.\nDéc 2022 Déc 2023\nLe RNPG de l’exercice 2023 ressort à 670 M\nde 13,6% impacté par l’évolution des marc\nChiffre d’affaires consolidé (en MDH)\ncourantes en 2023 (notamment le don au\n+9,3% effets du séisme d’Al Haouz).\n11 639 12 724\nLes capitaux propres part du groupe s’élè\n2023 vs. 8 057 MDH en 2022 en hausse de\nLe périmètre de consolidation, comprena\nDéc2022 Déc 2023 africaines, a connu courant 2023 l’entr\nplacement dédiés.\nRN Part du groupe (en MDH) Au vu des résultats enregistrés et des\nConseil d’Administration a décidé de p\n-13,6%\nOrdinaire, convoquée pour le 15 Mai 2024\n776 670\nl’exercice 2023, d’un dividende de 140 dirh\nWafa Assurance confirme ainsi son le\nfondamentaux, et poursuit le développem\nDéc2022 Déc 2023\nContact : information.financiere@wafaassurance.co.ma\nLien internet : https://www.wafaassurance.ma/fr/compa": "",
                "": "",
                "null": "",
                "uue par l’activité Non--vie.\nss techniques et finannciers.\neuudi 14 mars 2024, sous la\ndee la compagnie et d’arrêter\nfa Assurance atteint 11 164 MDH,\ngression de +5,6% portéée par la\n4 891 MDH conséquemmment à la\nNoon-Vie.\npprogression de 1,5% suuite à la\néccès.\nprrogression par rapport aau niveau\na croissance de l’activité et par la\nprrogression de 15,4%.\n01 MDH en hausse de 3,9%.\nrees consolidé annuel s’établit à\n99,3% portée par la perfformance\nVie et Non-vie au Maroc et à\nDDH vs 776 MDH en 2022 en baisse\nhés financiers et les chaarges non\nfoonds spécial pour la gestion des\nvent à 9 232 MDH au 31 ddécembre\n144,6%.\nntt Wafa Assurance et sees filiales\néee de deux fonds communs de\npeerspectives de la comppagnie, le\nrooposer à l’Assemblée Générale\nà 11h00, la distribution au titre de\namms par action.\nadership et la soliditéé de ses\nent de ses activités.\ngnnie-assurance-maroc": ""
            },
            {
                "COMMUNIQUÉ FINANCIER\nRÉSULLTTAATTS ANNUELS 2023\nCCrrooiissssaannncccceee dduu cchhiiffffrreee dddd’’’aaaffffaaiiress ppoorrttéée aussi bien par l’activité Vie q\nRésuullttaattss eenn pprrooggrreesssionn eennnn rraaiissoon de l’amélioration des indicateur\nLee CCoonseeiilll dddd’’AAddministrationn de Wafa Assurance s’est réuni le J\nPPrréésidence de Monsieur Bouubker JAI, en vue d’examiner l’activité\nlles comptes au 31 décembree 2023.\nRésultats sociaux\nChiffre d’affaires social (en MDH)\nEn 2023, le chiffre d’affaires social de Wa\n+7,1%\nsoit +7,1% par rapport à 2022.\n10 425 11 164\nLL’’activité Vie s’élève à 6 273 MDH en pro\nppeerrfformancee eenn EEppaarrggnnee eett PPrrévoyyance.\nLL’’activité Non-Vie progresse de +9,1%, à\nDéc 2022 Déc 2023\nperformance de l’ensemble des branches\nLe résultat Vie s’établit à 464 MDH en\nRésultat net social (en MDH)\ncroissance de l’activité en Epargne et en D\n+15,4%\n607 701 Le résultat Non-Vie ressort à 436 MDH en\nenregistré en 2022 (157 MDH), portée par l\nbonne tenue du résultat financierr..\nLe résultat net social atteint 701 MDH en\nDéc 2022 Déc 2023\nLes fonds propres sociaux s’élèvent à 6 6\nFonds propres sociaux (en MDH)\nRésultats consolidés\n+3,9%\n6 356 6 601\nAu 31 décembre 2023, le chiffre d’affai\n12 724 MDH enregistrant une hausse de\nréalisée sur l’ensemble des branches\nl’international.\nDéc 2022 Déc 2023\nLe RNPG de l’exercice 2023 ressort à 670 M\nde 13,6% impacté par l’évolution des marc\nChiffre d’affaires consolidé (en MDH)\ncourantes en 2023 (notamment le don au\n+9,3% effets du séisme d’Al Haouz).\n11 639 12 724\nLes capitaux propres part du groupe s’élè\n2023 vs. 8 057 MDH en 2022 en hausse de\nLe périmètre de consolidation, comprena\nDéc2022 Déc 2023 africaines, a connu courant 2023 l’entr\nplacement dédiés.\nRN Part du groupe (en MDH) Au vu des résultats enregistrés et des\nConseil d’Administration a décidé de p\n-13,6%\nOrdinaire, convoquée pour le 15 Mai 2024\n776 670\nl’exercice 2023, d’un dividende de 140 dirh\nWafa Assurance confirme ainsi son le\nfondamentaux, et poursuit le développem\nDéc2022 Déc 2023\nContact : information.financiere@wafaassurance.co.ma\nLien internet : https://www.wafaassurance.ma/fr/compa": "",
                "": "",
                "null": "",
                "uue par l’activité Non--vie.\nss techniques et finannciers.\neuudi 14 mars 2024, sous la\ndee la compagnie et d’arrêter\nfa Assurance atteint 11 164 MDH,\ngression de +5,6% portéée par la\n4 891 MDH conséquemmment à la\nNoon-Vie.\npprogression de 1,5% suuite à la\néccès.\nprrogression par rapport aau niveau\na croissance de l’activité et par la\nprrogression de 15,4%.\n01 MDH en hausse de 3,9%.\nrees consolidé annuel s’établit à\n99,3% portée par la perfformance\nVie et Non-vie au Maroc et à\nDDH vs 776 MDH en 2022 en baisse\nhés financiers et les chaarges non\nfoonds spécial pour la gestion des\nvent à 9 232 MDH au 31 ddécembre\n144,6%.\nntt Wafa Assurance et sees filiales\néee de deux fonds communs de\npeerspectives de la comppagnie, le\nrooposer à l’Assemblée Générale\nà 11h00, la distribution au titre de\namms par action.\nadership et la soliditéé de ses\nent de ses activités.\ngnnie-assurance-maroc": ""
            },
            {
                "COMMUNIQUÉ FINANCIER\nRÉSULLTTAATTS ANNUELS 2023\nCCrrooiissssaannncccceee dduu cchhiiffffrreee dddd’’’aaaffffaaiiress ppoorrttéée aussi bien par l’activité Vie q\nRésuullttaattss eenn pprrooggrreesssionn eennnn rraaiissoon de l’amélioration des indicateur\nLee CCoonseeiilll dddd’’AAddministrationn de Wafa Assurance s’est réuni le J\nPPrréésidence de Monsieur Bouubker JAI, en vue d’examiner l’activité\nlles comptes au 31 décembree 2023.\nRésultats sociaux\nChiffre d’affaires social (en MDH)\nEn 2023, le chiffre d’affaires social de Wa\n+7,1%\nsoit +7,1% par rapport à 2022.\n10 425 11 164\nLL’’activité Vie s’élève à 6 273 MDH en pro\nppeerrfformancee eenn EEppaarrggnnee eett PPrrévoyyance.\nLL’’activité Non-Vie progresse de +9,1%, à\nDéc 2022 Déc 2023\nperformance de l’ensemble des branches\nLe résultat Vie s’établit à 464 MDH en\nRésultat net social (en MDH)\ncroissance de l’activité en Epargne et en D\n+15,4%\n607 701 Le résultat Non-Vie ressort à 436 MDH en\nenregistré en 2022 (157 MDH), portée par l\nbonne tenue du résultat financierr..\nLe résultat net social atteint 701 MDH en\nDéc 2022 Déc 2023\nLes fonds propres sociaux s’élèvent à 6 6\nFonds propres sociaux (en MDH)\nRésultats consolidés\n+3,9%\n6 356 6 601\nAu 31 décembre 2023, le chiffre d’affai\n12 724 MDH enregistrant une hausse de\nréalisée sur l’ensemble des branches\nl’international.\nDéc 2022 Déc 2023\nLe RNPG de l’exercice 2023 ressort à 670 M\nde 13,6% impacté par l’évolution des marc\nChiffre d’affaires consolidé (en MDH)\ncourantes en 2023 (notamment le don au\n+9,3% effets du séisme d’Al Haouz).\n11 639 12 724\nLes capitaux propres part du groupe s’élè\n2023 vs. 8 057 MDH en 2022 en hausse de\nLe périmètre de consolidation, comprena\nDéc2022 Déc 2023 africaines, a connu courant 2023 l’entr\nplacement dédiés.\nRN Part du groupe (en MDH) Au vu des résultats enregistrés et des\nConseil d’Administration a décidé de p\n-13,6%\nOrdinaire, convoquée pour le 15 Mai 2024\n776 670\nl’exercice 2023, d’un dividende de 140 dirh\nWafa Assurance confirme ainsi son le\nfondamentaux, et poursuit le développem\nDéc2022 Déc 2023\nContact : information.financiere@wafaassurance.co.ma\nLien internet : https://www.wafaassurance.ma/fr/compa": "",
                "": "",
                "null": "",
                "uue par l’activité Non--vie.\nss techniques et finannciers.\neuudi 14 mars 2024, sous la\ndee la compagnie et d’arrêter\nfa Assurance atteint 11 164 MDH,\ngression de +5,6% portéée par la\n4 891 MDH conséquemmment à la\nNoon-Vie.\npprogression de 1,5% suuite à la\néccès.\nprrogression par rapport aau niveau\na croissance de l’activité et par la\nprrogression de 15,4%.\n01 MDH en hausse de 3,9%.\nrees consolidé annuel s’établit à\n99,3% portée par la perfformance\nVie et Non-vie au Maroc et à\nDDH vs 776 MDH en 2022 en baisse\nhés financiers et les chaarges non\nfoonds spécial pour la gestion des\nvent à 9 232 MDH au 31 ddécembre\n144,6%.\nntt Wafa Assurance et sees filiales\néee de deux fonds communs de\npeerspectives de la comppagnie, le\nrooposer à l’Assemblée Générale\nà 11h00, la distribution au titre de\namms par action.\nadership et la soliditéé de ses\nent de ses activités.\ngnnie-assurance-maroc": ""
            },
            {
                "COMMUNIQUÉ FINANCIER\nRÉSULLTTAATTS ANNUELS 2023\nCCrrooiissssaannncccceee dduu cchhiiffffrreee dddd’’’aaaffffaaiiress ppoorrttéée aussi bien par l’activité Vie q\nRésuullttaattss eenn pprrooggrreesssionn eennnn rraaiissoon de l’amélioration des indicateur\nLee CCoonseeiilll dddd’’AAddministrationn de Wafa Assurance s’est réuni le J\nPPrréésidence de Monsieur Bouubker JAI, en vue d’examiner l’activité\nlles comptes au 31 décembree 2023.\nRésultats sociaux\nChiffre d’affaires social (en MDH)\nEn 2023, le chiffre d’affaires social de Wa\n+7,1%\nsoit +7,1% par rapport à 2022.\n10 425 11 164\nLL’’activité Vie s’élève à 6 273 MDH en pro\nppeerrfformancee eenn EEppaarrggnnee eett PPrrévoyyance.\nLL’’activité Non-Vie progresse de +9,1%, à\nDéc 2022 Déc 2023\nperformance de l’ensemble des branches\nLe résultat Vie s’établit à 464 MDH en\nRésultat net social (en MDH)\ncroissance de l’activité en Epargne et en D\n+15,4%\n607 701 Le résultat Non-Vie ressort à 436 MDH en\nenregistré en 2022 (157 MDH), portée par l\nbonne tenue du résultat financierr..\nLe résultat net social atteint 701 MDH en\nDéc 2022 Déc 2023\nLes fonds propres sociaux s’élèvent à 6 6\nFonds propres sociaux (en MDH)\nRésultats consolidés\n+3,9%\n6 356 6 601\nAu 31 décembre 2023, le chiffre d’affai\n12 724 MDH enregistrant une hausse de\nréalisée sur l’ensemble des branches\nl’international.\nDéc 2022 Déc 2023\nLe RNPG de l’exercice 2023 ressort à 670 M\nde 13,6% impacté par l’évolution des marc\nChiffre d’affaires consolidé (en MDH)\ncourantes en 2023 (notamment le don au\n+9,3% effets du séisme d’Al Haouz).\n11 639 12 724\nLes capitaux propres part du groupe s’élè\n2023 vs. 8 057 MDH en 2022 en hausse de\nLe périmètre de consolidation, comprena\nDéc2022 Déc 2023 africaines, a connu courant 2023 l’entr\nplacement dédiés.\nRN Part du groupe (en MDH) Au vu des résultats enregistrés et des\nConseil d’Administration a décidé de p\n-13,6%\nOrdinaire, convoquée pour le 15 Mai 2024\n776 670\nl’exercice 2023, d’un dividende de 140 dirh\nWafa Assurance confirme ainsi son le\nfondamentaux, et poursuit le développem\nDéc2022 Déc 2023\nContact : information.financiere@wafaassurance.co.ma\nLien internet : https://www.wafaassurance.ma/fr/compa": "",
                "": "",
                "null": "",
                "uue par l’activité Non--vie.\nss techniques et finannciers.\neuudi 14 mars 2024, sous la\ndee la compagnie et d’arrêter\nfa Assurance atteint 11 164 MDH,\ngression de +5,6% portéée par la\n4 891 MDH conséquemmment à la\nNoon-Vie.\npprogression de 1,5% suuite à la\néccès.\nprrogression par rapport aau niveau\na croissance de l’activité et par la\nprrogression de 15,4%.\n01 MDH en hausse de 3,9%.\nrees consolidé annuel s’établit à\n99,3% portée par la perfformance\nVie et Non-vie au Maroc et à\nDDH vs 776 MDH en 2022 en baisse\nhés financiers et les chaarges non\nfoonds spécial pour la gestion des\nvent à 9 232 MDH au 31 ddécembre\n144,6%.\nntt Wafa Assurance et sees filiales\néee de deux fonds communs de\npeerspectives de la comppagnie, le\nrooposer à l’Assemblée Générale\nà 11h00, la distribution au titre de\namms par action.\nadership et la soliditéé de ses\nent de ses activités.\ngnnie-assurance-maroc": "01 MDH en hausse de 3,9%."
            },
            {
                "COMMUNIQUÉ FINANCIER\nRÉSULLTTAATTS ANNUELS 2023\nCCrrooiissssaannncccceee dduu cchhiiffffrreee dddd’’’aaaffffaaiiress ppoorrttéée aussi bien par l’activité Vie q\nRésuullttaattss eenn pprrooggrreesssionn eennnn rraaiissoon de l’amélioration des indicateur\nLee CCoonseeiilll dddd’’AAddministrationn de Wafa Assurance s’est réuni le J\nPPrréésidence de Monsieur Bouubker JAI, en vue d’examiner l’activité\nlles comptes au 31 décembree 2023.\nRésultats sociaux\nChiffre d’affaires social (en MDH)\nEn 2023, le chiffre d’affaires social de Wa\n+7,1%\nsoit +7,1% par rapport à 2022.\n10 425 11 164\nLL’’activité Vie s’élève à 6 273 MDH en pro\nppeerrfformancee eenn EEppaarrggnnee eett PPrrévoyyance.\nLL’’activité Non-Vie progresse de +9,1%, à\nDéc 2022 Déc 2023\nperformance de l’ensemble des branches\nLe résultat Vie s’établit à 464 MDH en\nRésultat net social (en MDH)\ncroissance de l’activité en Epargne et en D\n+15,4%\n607 701 Le résultat Non-Vie ressort à 436 MDH en\nenregistré en 2022 (157 MDH), portée par l\nbonne tenue du résultat financierr..\nLe résultat net social atteint 701 MDH en\nDéc 2022 Déc 2023\nLes fonds propres sociaux s’élèvent à 6 6\nFonds propres sociaux (en MDH)\nRésultats consolidés\n+3,9%\n6 356 6 601\nAu 31 décembre 2023, le chiffre d’affai\n12 724 MDH enregistrant une hausse de\nréalisée sur l’ensemble des branches\nl’international.\nDéc 2022 Déc 2023\nLe RNPG de l’exercice 2023 ressort à 670 M\nde 13,6% impacté par l’évolution des marc\nChiffre d’affaires consolidé (en MDH)\ncourantes en 2023 (notamment le don au\n+9,3% effets du séisme d’Al Haouz).\n11 639 12 724\nLes capitaux propres part du groupe s’élè\n2023 vs. 8 057 MDH en 2022 en hausse de\nLe périmètre de consolidation, comprena\nDéc2022 Déc 2023 africaines, a connu courant 2023 l’entr\nplacement dédiés.\nRN Part du groupe (en MDH) Au vu des résultats enregistrés et des\nConseil d’Administration a décidé de p\n-13,6%\nOrdinaire, convoquée pour le 15 Mai 2024\n776 670\nl’exercice 2023, d’un dividende de 140 dirh\nWafa Assurance confirme ainsi son le\nfondamentaux, et poursuit le développem\nDéc2022 Déc 2023\nContact : information.financiere@wafaassurance.co.ma\nLien internet : https://www.wafaassurance.ma/fr/compa": "",
                "": "",
                "null": "",
                "uue par l’activité Non--vie.\nss techniques et finannciers.\neuudi 14 mars 2024, sous la\ndee la compagnie et d’arrêter\nfa Assurance atteint 11 164 MDH,\ngression de +5,6% portéée par la\n4 891 MDH conséquemmment à la\nNoon-Vie.\npprogression de 1,5% suuite à la\néccès.\nprrogression par rapport aau niveau\na croissance de l’activité et par la\nprrogression de 15,4%.\n01 MDH en hausse de 3,9%.\nrees consolidé annuel s’établit à\n99,3% portée par la perfformance\nVie et Non-vie au Maroc et à\nDDH vs 776 MDH en 2022 en baisse\nhés financiers et les chaarges non\nfoonds spécial pour la gestion des\nvent à 9 232 MDH au 31 ddécembre\n144,6%.\nntt Wafa Assurance et sees filiales\néee de deux fonds communs de\npeerspectives de la comppagnie, le\nrooposer à l’Assemblée Générale\nà 11h00, la distribution au titre de\namms par action.\nadership et la soliditéé de ses\nent de ses activités.\ngnnie-assurance-maroc": ""
            },
            {
                "COMMUNIQUÉ FINANCIER\nRÉSULLTTAATTS ANNUELS 2023\nCCrrooiissssaannncccceee dduu cchhiiffffrreee dddd’’’aaaffffaaiiress ppoorrttéée aussi bien par l’activité Vie q\nRésuullttaattss eenn pprrooggrreesssionn eennnn rraaiissoon de l’amélioration des indicateur\nLee CCoonseeiilll dddd’’AAddministrationn de Wafa Assurance s’est réuni le J\nPPrréésidence de Monsieur Bouubker JAI, en vue d’examiner l’activité\nlles comptes au 31 décembree 2023.\nRésultats sociaux\nChiffre d’affaires social (en MDH)\nEn 2023, le chiffre d’affaires social de Wa\n+7,1%\nsoit +7,1% par rapport à 2022.\n10 425 11 164\nLL’’activité Vie s’élève à 6 273 MDH en pro\nppeerrfformancee eenn EEppaarrggnnee eett PPrrévoyyance.\nLL’’activité Non-Vie progresse de +9,1%, à\nDéc 2022 Déc 2023\nperformance de l’ensemble des branches\nLe résultat Vie s’établit à 464 MDH en\nRésultat net social (en MDH)\ncroissance de l’activité en Epargne et en D\n+15,4%\n607 701 Le résultat Non-Vie ressort à 436 MDH en\nenregistré en 2022 (157 MDH), portée par l\nbonne tenue du résultat financierr..\nLe résultat net social atteint 701 MDH en\nDéc 2022 Déc 2023\nLes fonds propres sociaux s’élèvent à 6 6\nFonds propres sociaux (en MDH)\nRésultats consolidés\n+3,9%\n6 356 6 601\nAu 31 décembre 2023, le chiffre d’affai\n12 724 MDH enregistrant une hausse de\nréalisée sur l’ensemble des branches\nl’international.\nDéc 2022 Déc 2023\nLe RNPG de l’exercice 2023 ressort à 670 M\nde 13,6% impacté par l’évolution des marc\nChiffre d’affaires consolidé (en MDH)\ncourantes en 2023 (notamment le don au\n+9,3% effets du séisme d’Al Haouz).\n11 639 12 724\nLes capitaux propres part du groupe s’élè\n2023 vs. 8 057 MDH en 2022 en hausse de\nLe périmètre de consolidation, comprena\nDéc2022 Déc 2023 africaines, a connu courant 2023 l’entr\nplacement dédiés.\nRN Part du groupe (en MDH) Au vu des résultats enregistrés et des\nConseil d’Administration a décidé de p\n-13,6%\nOrdinaire, convoquée pour le 15 Mai 2024\n776 670\nl’exercice 2023, d’un dividende de 140 dirh\nWafa Assurance confirme ainsi son le\nfondamentaux, et poursuit le développem\nDéc2022 Déc 2023\nContact : information.financiere@wafaassurance.co.ma\nLien internet : https://www.wafaassurance.ma/fr/compa": "",
                "": "",
                "null": "",
                "uue par l’activité Non--vie.\nss techniques et finannciers.\neuudi 14 mars 2024, sous la\ndee la compagnie et d’arrêter\nfa Assurance atteint 11 164 MDH,\ngression de +5,6% portéée par la\n4 891 MDH conséquemmment à la\nNoon-Vie.\npprogression de 1,5% suuite à la\néccès.\nprrogression par rapport aau niveau\na croissance de l’activité et par la\nprrogression de 15,4%.\n01 MDH en hausse de 3,9%.\nrees consolidé annuel s’établit à\n99,3% portée par la perfformance\nVie et Non-vie au Maroc et à\nDDH vs 776 MDH en 2022 en baisse\nhés financiers et les chaarges non\nfoonds spécial pour la gestion des\nvent à 9 232 MDH au 31 ddécembre\n144,6%.\nntt Wafa Assurance et sees filiales\néee de deux fonds communs de\npeerspectives de la comppagnie, le\nrooposer à l’Assemblée Générale\nà 11h00, la distribution au titre de\namms par action.\nadership et la soliditéé de ses\nent de ses activités.\ngnnie-assurance-maroc": ""
            },
            {
                "COMMUNIQUÉ FINANCIER\nRÉSULLTTAATTS ANNUELS 2023\nCCrrooiissssaannncccceee dduu cchhiiffffrreee dddd’’’aaaffffaaiiress ppoorrttéée aussi bien par l’activité Vie q\nRésuullttaattss eenn pprrooggrreesssionn eennnn rraaiissoon de l’amélioration des indicateur\nLee CCoonseeiilll dddd’’AAddministrationn de Wafa Assurance s’est réuni le J\nPPrréésidence de Monsieur Bouubker JAI, en vue d’examiner l’activité\nlles comptes au 31 décembree 2023.\nRésultats sociaux\nChiffre d’affaires social (en MDH)\nEn 2023, le chiffre d’affaires social de Wa\n+7,1%\nsoit +7,1% par rapport à 2022.\n10 425 11 164\nLL’’activité Vie s’élève à 6 273 MDH en pro\nppeerrfformancee eenn EEppaarrggnnee eett PPrrévoyyance.\nLL’’activité Non-Vie progresse de +9,1%, à\nDéc 2022 Déc 2023\nperformance de l’ensemble des branches\nLe résultat Vie s’établit à 464 MDH en\nRésultat net social (en MDH)\ncroissance de l’activité en Epargne et en D\n+15,4%\n607 701 Le résultat Non-Vie ressort à 436 MDH en\nenregistré en 2022 (157 MDH), portée par l\nbonne tenue du résultat financierr..\nLe résultat net social atteint 701 MDH en\nDéc 2022 Déc 2023\nLes fonds propres sociaux s’élèvent à 6 6\nFonds propres sociaux (en MDH)\nRésultats consolidés\n+3,9%\n6 356 6 601\nAu 31 décembre 2023, le chiffre d’affai\n12 724 MDH enregistrant une hausse de\nréalisée sur l’ensemble des branches\nl’international.\nDéc 2022 Déc 2023\nLe RNPG de l’exercice 2023 ressort à 670 M\nde 13,6% impacté par l’évolution des marc\nChiffre d’affaires consolidé (en MDH)\ncourantes en 2023 (notamment le don au\n+9,3% effets du séisme d’Al Haouz).\n11 639 12 724\nLes capitaux propres part du groupe s’élè\n2023 vs. 8 057 MDH en 2022 en hausse de\nLe périmètre de consolidation, comprena\nDéc2022 Déc 2023 africaines, a connu courant 2023 l’entr\nplacement dédiés.\nRN Part du groupe (en MDH) Au vu des résultats enregistrés et des\nConseil d’Administration a décidé de p\n-13,6%\nOrdinaire, convoquée pour le 15 Mai 2024\n776 670\nl’exercice 2023, d’un dividende de 140 dirh\nWafa Assurance confirme ainsi son le\nfondamentaux, et poursuit le développem\nDéc2022 Déc 2023\nContact : information.financiere@wafaassurance.co.ma\nLien internet : https://www.wafaassurance.ma/fr/compa": "",
                "": "",
                "null": "",
                "uue par l’activité Non--vie.\nss techniques et finannciers.\neuudi 14 mars 2024, sous la\ndee la compagnie et d’arrêter\nfa Assurance atteint 11 164 MDH,\ngression de +5,6% portéée par la\n4 891 MDH conséquemmment à la\nNoon-Vie.\npprogression de 1,5% suuite à la\néccès.\nprrogression par rapport aau niveau\na croissance de l’activité et par la\nprrogression de 15,4%.\n01 MDH en hausse de 3,9%.\nrees consolidé annuel s’établit à\n99,3% portée par la perfformance\nVie et Non-vie au Maroc et à\nDDH vs 776 MDH en 2022 en baisse\nhés financiers et les chaarges non\nfoonds spécial pour la gestion des\nvent à 9 232 MDH au 31 ddécembre\n144,6%.\nntt Wafa Assurance et sees filiales\néee de deux fonds communs de\npeerspectives de la comppagnie, le\nrooposer à l’Assemblée Générale\nà 11h00, la distribution au titre de\namms par action.\nadership et la soliditéé de ses\nent de ses activités.\ngnnie-assurance-maroc": ""
            },
            {
                "COMMUNIQUÉ FINANCIER\nRÉSULLTTAATTS ANNUELS 2023\nCCrrooiissssaannncccceee dduu cchhiiffffrreee dddd’’’aaaffffaaiiress ppoorrttéée aussi bien par l’activité Vie q\nRésuullttaattss eenn pprrooggrreesssionn eennnn rraaiissoon de l’amélioration des indicateur\nLee CCoonseeiilll dddd’’AAddministrationn de Wafa Assurance s’est réuni le J\nPPrréésidence de Monsieur Bouubker JAI, en vue d’examiner l’activité\nlles comptes au 31 décembree 2023.\nRésultats sociaux\nChiffre d’affaires social (en MDH)\nEn 2023, le chiffre d’affaires social de Wa\n+7,1%\nsoit +7,1% par rapport à 2022.\n10 425 11 164\nLL’’activité Vie s’élève à 6 273 MDH en pro\nppeerrfformancee eenn EEppaarrggnnee eett PPrrévoyyance.\nLL’’activité Non-Vie progresse de +9,1%, à\nDéc 2022 Déc 2023\nperformance de l’ensemble des branches\nLe résultat Vie s’établit à 464 MDH en\nRésultat net social (en MDH)\ncroissance de l’activité en Epargne et en D\n+15,4%\n607 701 Le résultat Non-Vie ressort à 436 MDH en\nenregistré en 2022 (157 MDH), portée par l\nbonne tenue du résultat financierr..\nLe résultat net social atteint 701 MDH en\nDéc 2022 Déc 2023\nLes fonds propres sociaux s’élèvent à 6 6\nFonds propres sociaux (en MDH)\nRésultats consolidés\n+3,9%\n6 356 6 601\nAu 31 décembre 2023, le chiffre d’affai\n12 724 MDH enregistrant une hausse de\nréalisée sur l’ensemble des branches\nl’international.\nDéc 2022 Déc 2023\nLe RNPG de l’exercice 2023 ressort à 670 M\nde 13,6% impacté par l’évolution des marc\nChiffre d’affaires consolidé (en MDH)\ncourantes en 2023 (notamment le don au\n+9,3% effets du séisme d’Al Haouz).\n11 639 12 724\nLes capitaux propres part du groupe s’élè\n2023 vs. 8 057 MDH en 2022 en hausse de\nLe périmètre de consolidation, comprena\nDéc2022 Déc 2023 africaines, a connu courant 2023 l’entr\nplacement dédiés.\nRN Part du groupe (en MDH) Au vu des résultats enregistrés et des\nConseil d’Administration a décidé de p\n-13,6%\nOrdinaire, convoquée pour le 15 Mai 2024\n776 670\nl’exercice 2023, d’un dividende de 140 dirh\nWafa Assurance confirme ainsi son le\nfondamentaux, et poursuit le développem\nDéc2022 Déc 2023\nContact : information.financiere@wafaassurance.co.ma\nLien internet : https://www.wafaassurance.ma/fr/compa": "",
                "": "",
                "null": "31 décembre 2023, le chiffre d’affai",
                "uue par l’activité Non--vie.\nss techniques et finannciers.\neuudi 14 mars 2024, sous la\ndee la compagnie et d’arrêter\nfa Assurance atteint 11 164 MDH,\ngression de +5,6% portéée par la\n4 891 MDH conséquemmment à la\nNoon-Vie.\npprogression de 1,5% suuite à la\néccès.\nprrogression par rapport aau niveau\na croissance de l’activité et par la\nprrogression de 15,4%.\n01 MDH en hausse de 3,9%.\nrees consolidé annuel s’établit à\n99,3% portée par la perfformance\nVie et Non-vie au Maroc et à\nDDH vs 776 MDH en 2022 en baisse\nhés financiers et les chaarges non\nfoonds spécial pour la gestion des\nvent à 9 232 MDH au 31 ddécembre\n144,6%.\nntt Wafa Assurance et sees filiales\néee de deux fonds communs de\npeerspectives de la comppagnie, le\nrooposer à l’Assemblée Générale\nà 11h00, la distribution au titre de\namms par action.\nadership et la soliditéé de ses\nent de ses activités.\ngnnie-assurance-maroc": "rees consolidé annuel s’établit à"
            },
            {
                "COMMUNIQUÉ FINANCIER\nRÉSULLTTAATTS ANNUELS 2023\nCCrrooiissssaannncccceee dduu cchhiiffffrreee dddd’’’aaaffffaaiiress ppoorrttéée aussi bien par l’activité Vie q\nRésuullttaattss eenn pprrooggrreesssionn eennnn rraaiissoon de l’amélioration des indicateur\nLee CCoonseeiilll dddd’’AAddministrationn de Wafa Assurance s’est réuni le J\nPPrréésidence de Monsieur Bouubker JAI, en vue d’examiner l’activité\nlles comptes au 31 décembree 2023.\nRésultats sociaux\nChiffre d’affaires social (en MDH)\nEn 2023, le chiffre d’affaires social de Wa\n+7,1%\nsoit +7,1% par rapport à 2022.\n10 425 11 164\nLL’’activité Vie s’élève à 6 273 MDH en pro\nppeerrfformancee eenn EEppaarrggnnee eett PPrrévoyyance.\nLL’’activité Non-Vie progresse de +9,1%, à\nDéc 2022 Déc 2023\nperformance de l’ensemble des branches\nLe résultat Vie s’établit à 464 MDH en\nRésultat net social (en MDH)\ncroissance de l’activité en Epargne et en D\n+15,4%\n607 701 Le résultat Non-Vie ressort à 436 MDH en\nenregistré en 2022 (157 MDH), portée par l\nbonne tenue du résultat financierr..\nLe résultat net social atteint 701 MDH en\nDéc 2022 Déc 2023\nLes fonds propres sociaux s’élèvent à 6 6\nFonds propres sociaux (en MDH)\nRésultats consolidés\n+3,9%\n6 356 6 601\nAu 31 décembre 2023, le chiffre d’affai\n12 724 MDH enregistrant une hausse de\nréalisée sur l’ensemble des branches\nl’international.\nDéc 2022 Déc 2023\nLe RNPG de l’exercice 2023 ressort à 670 M\nde 13,6% impacté par l’évolution des marc\nChiffre d’affaires consolidé (en MDH)\ncourantes en 2023 (notamment le don au\n+9,3% effets du séisme d’Al Haouz).\n11 639 12 724\nLes capitaux propres part du groupe s’élè\n2023 vs. 8 057 MDH en 2022 en hausse de\nLe périmètre de consolidation, comprena\nDéc2022 Déc 2023 africaines, a connu courant 2023 l’entr\nplacement dédiés.\nRN Part du groupe (en MDH) Au vu des résultats enregistrés et des\nConseil d’Administration a décidé de p\n-13,6%\nOrdinaire, convoquée pour le 15 Mai 2024\n776 670\nl’exercice 2023, d’un dividende de 140 dirh\nWafa Assurance confirme ainsi son le\nfondamentaux, et poursuit le développem\nDéc2022 Déc 2023\nContact : information.financiere@wafaassurance.co.ma\nLien internet : https://www.wafaassurance.ma/fr/compa": "",
                "": "",
                "null": "",
                "uue par l’activité Non--vie.\nss techniques et finannciers.\neuudi 14 mars 2024, sous la\ndee la compagnie et d’arrêter\nfa Assurance atteint 11 164 MDH,\ngression de +5,6% portéée par la\n4 891 MDH conséquemmment à la\nNoon-Vie.\npprogression de 1,5% suuite à la\néccès.\nprrogression par rapport aau niveau\na croissance de l’activité et par la\nprrogression de 15,4%.\n01 MDH en hausse de 3,9%.\nrees consolidé annuel s’établit à\n99,3% portée par la perfformance\nVie et Non-vie au Maroc et à\nDDH vs 776 MDH en 2022 en baisse\nhés financiers et les chaarges non\nfoonds spécial pour la gestion des\nvent à 9 232 MDH au 31 ddécembre\n144,6%.\nntt Wafa Assurance et sees filiales\néee de deux fonds communs de\npeerspectives de la comppagnie, le\nrooposer à l’Assemblée Générale\nà 11h00, la distribution au titre de\namms par action.\nadership et la soliditéé de ses\nent de ses activités.\ngnnie-assurance-maroc": ""
            },
            {
                "COMMUNIQUÉ FINANCIER\nRÉSULLTTAATTS ANNUELS 2023\nCCrrooiissssaannncccceee dduu cchhiiffffrreee dddd’’’aaaffffaaiiress ppoorrttéée aussi bien par l’activité Vie q\nRésuullttaattss eenn pprrooggrreesssionn eennnn rraaiissoon de l’amélioration des indicateur\nLee CCoonseeiilll dddd’’AAddministrationn de Wafa Assurance s’est réuni le J\nPPrréésidence de Monsieur Bouubker JAI, en vue d’examiner l’activité\nlles comptes au 31 décembree 2023.\nRésultats sociaux\nChiffre d’affaires social (en MDH)\nEn 2023, le chiffre d’affaires social de Wa\n+7,1%\nsoit +7,1% par rapport à 2022.\n10 425 11 164\nLL’’activité Vie s’élève à 6 273 MDH en pro\nppeerrfformancee eenn EEppaarrggnnee eett PPrrévoyyance.\nLL’’activité Non-Vie progresse de +9,1%, à\nDéc 2022 Déc 2023\nperformance de l’ensemble des branches\nLe résultat Vie s’établit à 464 MDH en\nRésultat net social (en MDH)\ncroissance de l’activité en Epargne et en D\n+15,4%\n607 701 Le résultat Non-Vie ressort à 436 MDH en\nenregistré en 2022 (157 MDH), portée par l\nbonne tenue du résultat financierr..\nLe résultat net social atteint 701 MDH en\nDéc 2022 Déc 2023\nLes fonds propres sociaux s’élèvent à 6 6\nFonds propres sociaux (en MDH)\nRésultats consolidés\n+3,9%\n6 356 6 601\nAu 31 décembre 2023, le chiffre d’affai\n12 724 MDH enregistrant une hausse de\nréalisée sur l’ensemble des branches\nl’international.\nDéc 2022 Déc 2023\nLe RNPG de l’exercice 2023 ressort à 670 M\nde 13,6% impacté par l’évolution des marc\nChiffre d’affaires consolidé (en MDH)\ncourantes en 2023 (notamment le don au\n+9,3% effets du séisme d’Al Haouz).\n11 639 12 724\nLes capitaux propres part du groupe s’élè\n2023 vs. 8 057 MDH en 2022 en hausse de\nLe périmètre de consolidation, comprena\nDéc2022 Déc 2023 africaines, a connu courant 2023 l’entr\nplacement dédiés.\nRN Part du groupe (en MDH) Au vu des résultats enregistrés et des\nConseil d’Administration a décidé de p\n-13,6%\nOrdinaire, convoquée pour le 15 Mai 2024\n776 670\nl’exercice 2023, d’un dividende de 140 dirh\nWafa Assurance confirme ainsi son le\nfondamentaux, et poursuit le développem\nDéc2022 Déc 2023\nContact : information.financiere@wafaassurance.co.ma\nLien internet : https://www.wafaassurance.ma/fr/compa": "",
                "": "",
                "null": "724 MDH enregistrant une hausse de",
                "uue par l’activité Non--vie.\nss techniques et finannciers.\neuudi 14 mars 2024, sous la\ndee la compagnie et d’arrêter\nfa Assurance atteint 11 164 MDH,\ngression de +5,6% portéée par la\n4 891 MDH conséquemmment à la\nNoon-Vie.\npprogression de 1,5% suuite à la\néccès.\nprrogression par rapport aau niveau\na croissance de l’activité et par la\nprrogression de 15,4%.\n01 MDH en hausse de 3,9%.\nrees consolidé annuel s’établit à\n99,3% portée par la perfformance\nVie et Non-vie au Maroc et à\nDDH vs 776 MDH en 2022 en baisse\nhés financiers et les chaarges non\nfoonds spécial pour la gestion des\nvent à 9 232 MDH au 31 ddécembre\n144,6%.\nntt Wafa Assurance et sees filiales\néee de deux fonds communs de\npeerspectives de la comppagnie, le\nrooposer à l’Assemblée Générale\nà 11h00, la distribution au titre de\namms par action.\nadership et la soliditéé de ses\nent de ses activités.\ngnnie-assurance-maroc": "99,3% portée par la perfformance"
            },
            {
                "COMMUNIQUÉ FINANCIER\nRÉSULLTTAATTS ANNUELS 2023\nCCrrooiissssaannncccceee dduu cchhiiffffrreee dddd’’’aaaffffaaiiress ppoorrttéée aussi bien par l’activité Vie q\nRésuullttaattss eenn pprrooggrreesssionn eennnn rraaiissoon de l’amélioration des indicateur\nLee CCoonseeiilll dddd’’AAddministrationn de Wafa Assurance s’est réuni le J\nPPrréésidence de Monsieur Bouubker JAI, en vue d’examiner l’activité\nlles comptes au 31 décembree 2023.\nRésultats sociaux\nChiffre d’affaires social (en MDH)\nEn 2023, le chiffre d’affaires social de Wa\n+7,1%\nsoit +7,1% par rapport à 2022.\n10 425 11 164\nLL’’activité Vie s’élève à 6 273 MDH en pro\nppeerrfformancee eenn EEppaarrggnnee eett PPrrévoyyance.\nLL’’activité Non-Vie progresse de +9,1%, à\nDéc 2022 Déc 2023\nperformance de l’ensemble des branches\nLe résultat Vie s’établit à 464 MDH en\nRésultat net social (en MDH)\ncroissance de l’activité en Epargne et en D\n+15,4%\n607 701 Le résultat Non-Vie ressort à 436 MDH en\nenregistré en 2022 (157 MDH), portée par l\nbonne tenue du résultat financierr..\nLe résultat net social atteint 701 MDH en\nDéc 2022 Déc 2023\nLes fonds propres sociaux s’élèvent à 6 6\nFonds propres sociaux (en MDH)\nRésultats consolidés\n+3,9%\n6 356 6 601\nAu 31 décembre 2023, le chiffre d’affai\n12 724 MDH enregistrant une hausse de\nréalisée sur l’ensemble des branches\nl’international.\nDéc 2022 Déc 2023\nLe RNPG de l’exercice 2023 ressort à 670 M\nde 13,6% impacté par l’évolution des marc\nChiffre d’affaires consolidé (en MDH)\ncourantes en 2023 (notamment le don au\n+9,3% effets du séisme d’Al Haouz).\n11 639 12 724\nLes capitaux propres part du groupe s’élè\n2023 vs. 8 057 MDH en 2022 en hausse de\nLe périmètre de consolidation, comprena\nDéc2022 Déc 2023 africaines, a connu courant 2023 l’entr\nplacement dédiés.\nRN Part du groupe (en MDH) Au vu des résultats enregistrés et des\nConseil d’Administration a décidé de p\n-13,6%\nOrdinaire, convoquée pour le 15 Mai 2024\n776 670\nl’exercice 2023, d’un dividende de 140 dirh\nWafa Assurance confirme ainsi son le\nfondamentaux, et poursuit le développem\nDéc2022 Déc 2023\nContact : information.financiere@wafaassurance.co.ma\nLien internet : https://www.wafaassurance.ma/fr/compa": "",
                "": "",
                "null": "",
                "uue par l’activité Non--vie.\nss techniques et finannciers.\neuudi 14 mars 2024, sous la\ndee la compagnie et d’arrêter\nfa Assurance atteint 11 164 MDH,\ngression de +5,6% portéée par la\n4 891 MDH conséquemmment à la\nNoon-Vie.\npprogression de 1,5% suuite à la\néccès.\nprrogression par rapport aau niveau\na croissance de l’activité et par la\nprrogression de 15,4%.\n01 MDH en hausse de 3,9%.\nrees consolidé annuel s’établit à\n99,3% portée par la perfformance\nVie et Non-vie au Maroc et à\nDDH vs 776 MDH en 2022 en baisse\nhés financiers et les chaarges non\nfoonds spécial pour la gestion des\nvent à 9 232 MDH au 31 ddécembre\n144,6%.\nntt Wafa Assurance et sees filiales\néee de deux fonds communs de\npeerspectives de la comppagnie, le\nrooposer à l’Assemblée Générale\nà 11h00, la distribution au titre de\namms par action.\nadership et la soliditéé de ses\nent de ses activités.\ngnnie-assurance-maroc": ""
            },
            {
                "COMMUNIQUÉ FINANCIER\nRÉSULLTTAATTS ANNUELS 2023\nCCrrooiissssaannncccceee dduu cchhiiffffrreee dddd’’’aaaffffaaiiress ppoorrttéée aussi bien par l’activité Vie q\nRésuullttaattss eenn pprrooggrreesssionn eennnn rraaiissoon de l’amélioration des indicateur\nLee CCoonseeiilll dddd’’AAddministrationn de Wafa Assurance s’est réuni le J\nPPrréésidence de Monsieur Bouubker JAI, en vue d’examiner l’activité\nlles comptes au 31 décembree 2023.\nRésultats sociaux\nChiffre d’affaires social (en MDH)\nEn 2023, le chiffre d’affaires social de Wa\n+7,1%\nsoit +7,1% par rapport à 2022.\n10 425 11 164\nLL’’activité Vie s’élève à 6 273 MDH en pro\nppeerrfformancee eenn EEppaarrggnnee eett PPrrévoyyance.\nLL’’activité Non-Vie progresse de +9,1%, à\nDéc 2022 Déc 2023\nperformance de l’ensemble des branches\nLe résultat Vie s’établit à 464 MDH en\nRésultat net social (en MDH)\ncroissance de l’activité en Epargne et en D\n+15,4%\n607 701 Le résultat Non-Vie ressort à 436 MDH en\nenregistré en 2022 (157 MDH), portée par l\nbonne tenue du résultat financierr..\nLe résultat net social atteint 701 MDH en\nDéc 2022 Déc 2023\nLes fonds propres sociaux s’élèvent à 6 6\nFonds propres sociaux (en MDH)\nRésultats consolidés\n+3,9%\n6 356 6 601\nAu 31 décembre 2023, le chiffre d’affai\n12 724 MDH enregistrant une hausse de\nréalisée sur l’ensemble des branches\nl’international.\nDéc 2022 Déc 2023\nLe RNPG de l’exercice 2023 ressort à 670 M\nde 13,6% impacté par l’évolution des marc\nChiffre d’affaires consolidé (en MDH)\ncourantes en 2023 (notamment le don au\n+9,3% effets du séisme d’Al Haouz).\n11 639 12 724\nLes capitaux propres part du groupe s’élè\n2023 vs. 8 057 MDH en 2022 en hausse de\nLe périmètre de consolidation, comprena\nDéc2022 Déc 2023 africaines, a connu courant 2023 l’entr\nplacement dédiés.\nRN Part du groupe (en MDH) Au vu des résultats enregistrés et des\nConseil d’Administration a décidé de p\n-13,6%\nOrdinaire, convoquée pour le 15 Mai 2024\n776 670\nl’exercice 2023, d’un dividende de 140 dirh\nWafa Assurance confirme ainsi son le\nfondamentaux, et poursuit le développem\nDéc2022 Déc 2023\nContact : information.financiere@wafaassurance.co.ma\nLien internet : https://www.wafaassurance.ma/fr/compa": "",
                "": "",
                "null": "",
                "uue par l’activité Non--vie.\nss techniques et finannciers.\neuudi 14 mars 2024, sous la\ndee la compagnie et d’arrêter\nfa Assurance atteint 11 164 MDH,\ngression de +5,6% portéée par la\n4 891 MDH conséquemmment à la\nNoon-Vie.\npprogression de 1,5% suuite à la\néccès.\nprrogression par rapport aau niveau\na croissance de l’activité et par la\nprrogression de 15,4%.\n01 MDH en hausse de 3,9%.\nrees consolidé annuel s’établit à\n99,3% portée par la perfformance\nVie et Non-vie au Maroc et à\nDDH vs 776 MDH en 2022 en baisse\nhés financiers et les chaarges non\nfoonds spécial pour la gestion des\nvent à 9 232 MDH au 31 ddécembre\n144,6%.\nntt Wafa Assurance et sees filiales\néee de deux fonds communs de\npeerspectives de la comppagnie, le\nrooposer à l’Assemblée Générale\nà 11h00, la distribution au titre de\namms par action.\nadership et la soliditéé de ses\nent de ses activités.\ngnnie-assurance-maroc": "Vie et Non-vie au Maroc et à"
            },
            {
                "COMMUNIQUÉ FINANCIER\nRÉSULLTTAATTS ANNUELS 2023\nCCrrooiissssaannncccceee dduu cchhiiffffrreee dddd’’’aaaffffaaiiress ppoorrttéée aussi bien par l’activité Vie q\nRésuullttaattss eenn pprrooggrreesssionn eennnn rraaiissoon de l’amélioration des indicateur\nLee CCoonseeiilll dddd’’AAddministrationn de Wafa Assurance s’est réuni le J\nPPrréésidence de Monsieur Bouubker JAI, en vue d’examiner l’activité\nlles comptes au 31 décembree 2023.\nRésultats sociaux\nChiffre d’affaires social (en MDH)\nEn 2023, le chiffre d’affaires social de Wa\n+7,1%\nsoit +7,1% par rapport à 2022.\n10 425 11 164\nLL’’activité Vie s’élève à 6 273 MDH en pro\nppeerrfformancee eenn EEppaarrggnnee eett PPrrévoyyance.\nLL’’activité Non-Vie progresse de +9,1%, à\nDéc 2022 Déc 2023\nperformance de l’ensemble des branches\nLe résultat Vie s’établit à 464 MDH en\nRésultat net social (en MDH)\ncroissance de l’activité en Epargne et en D\n+15,4%\n607 701 Le résultat Non-Vie ressort à 436 MDH en\nenregistré en 2022 (157 MDH), portée par l\nbonne tenue du résultat financierr..\nLe résultat net social atteint 701 MDH en\nDéc 2022 Déc 2023\nLes fonds propres sociaux s’élèvent à 6 6\nFonds propres sociaux (en MDH)\nRésultats consolidés\n+3,9%\n6 356 6 601\nAu 31 décembre 2023, le chiffre d’affai\n12 724 MDH enregistrant une hausse de\nréalisée sur l’ensemble des branches\nl’international.\nDéc 2022 Déc 2023\nLe RNPG de l’exercice 2023 ressort à 670 M\nde 13,6% impacté par l’évolution des marc\nChiffre d’affaires consolidé (en MDH)\ncourantes en 2023 (notamment le don au\n+9,3% effets du séisme d’Al Haouz).\n11 639 12 724\nLes capitaux propres part du groupe s’élè\n2023 vs. 8 057 MDH en 2022 en hausse de\nLe périmètre de consolidation, comprena\nDéc2022 Déc 2023 africaines, a connu courant 2023 l’entr\nplacement dédiés.\nRN Part du groupe (en MDH) Au vu des résultats enregistrés et des\nConseil d’Administration a décidé de p\n-13,6%\nOrdinaire, convoquée pour le 15 Mai 2024\n776 670\nl’exercice 2023, d’un dividende de 140 dirh\nWafa Assurance confirme ainsi son le\nfondamentaux, et poursuit le développem\nDéc2022 Déc 2023\nContact : information.financiere@wafaassurance.co.ma\nLien internet : https://www.wafaassurance.ma/fr/compa": "",
                "": "",
                "null": "",
                "uue par l’activité Non--vie.\nss techniques et finannciers.\neuudi 14 mars 2024, sous la\ndee la compagnie et d’arrêter\nfa Assurance atteint 11 164 MDH,\ngression de +5,6% portéée par la\n4 891 MDH conséquemmment à la\nNoon-Vie.\npprogression de 1,5% suuite à la\néccès.\nprrogression par rapport aau niveau\na croissance de l’activité et par la\nprrogression de 15,4%.\n01 MDH en hausse de 3,9%.\nrees consolidé annuel s’établit à\n99,3% portée par la perfformance\nVie et Non-vie au Maroc et à\nDDH vs 776 MDH en 2022 en baisse\nhés financiers et les chaarges non\nfoonds spécial pour la gestion des\nvent à 9 232 MDH au 31 ddécembre\n144,6%.\nntt Wafa Assurance et sees filiales\néee de deux fonds communs de\npeerspectives de la comppagnie, le\nrooposer à l’Assemblée Générale\nà 11h00, la distribution au titre de\namms par action.\nadership et la soliditéé de ses\nent de ses activités.\ngnnie-assurance-maroc": ""
            },
            {
                "COMMUNIQUÉ FINANCIER\nRÉSULLTTAATTS ANNUELS 2023\nCCrrooiissssaannncccceee dduu cchhiiffffrreee dddd’’’aaaffffaaiiress ppoorrttéée aussi bien par l’activité Vie q\nRésuullttaattss eenn pprrooggrreesssionn eennnn rraaiissoon de l’amélioration des indicateur\nLee CCoonseeiilll dddd’’AAddministrationn de Wafa Assurance s’est réuni le J\nPPrréésidence de Monsieur Bouubker JAI, en vue d’examiner l’activité\nlles comptes au 31 décembree 2023.\nRésultats sociaux\nChiffre d’affaires social (en MDH)\nEn 2023, le chiffre d’affaires social de Wa\n+7,1%\nsoit +7,1% par rapport à 2022.\n10 425 11 164\nLL’’activité Vie s’élève à 6 273 MDH en pro\nppeerrfformancee eenn EEppaarrggnnee eett PPrrévoyyance.\nLL’’activité Non-Vie progresse de +9,1%, à\nDéc 2022 Déc 2023\nperformance de l’ensemble des branches\nLe résultat Vie s’établit à 464 MDH en\nRésultat net social (en MDH)\ncroissance de l’activité en Epargne et en D\n+15,4%\n607 701 Le résultat Non-Vie ressort à 436 MDH en\nenregistré en 2022 (157 MDH), portée par l\nbonne tenue du résultat financierr..\nLe résultat net social atteint 701 MDH en\nDéc 2022 Déc 2023\nLes fonds propres sociaux s’élèvent à 6 6\nFonds propres sociaux (en MDH)\nRésultats consolidés\n+3,9%\n6 356 6 601\nAu 31 décembre 2023, le chiffre d’affai\n12 724 MDH enregistrant une hausse de\nréalisée sur l’ensemble des branches\nl’international.\nDéc 2022 Déc 2023\nLe RNPG de l’exercice 2023 ressort à 670 M\nde 13,6% impacté par l’évolution des marc\nChiffre d’affaires consolidé (en MDH)\ncourantes en 2023 (notamment le don au\n+9,3% effets du séisme d’Al Haouz).\n11 639 12 724\nLes capitaux propres part du groupe s’élè\n2023 vs. 8 057 MDH en 2022 en hausse de\nLe périmètre de consolidation, comprena\nDéc2022 Déc 2023 africaines, a connu courant 2023 l’entr\nplacement dédiés.\nRN Part du groupe (en MDH) Au vu des résultats enregistrés et des\nConseil d’Administration a décidé de p\n-13,6%\nOrdinaire, convoquée pour le 15 Mai 2024\n776 670\nl’exercice 2023, d’un dividende de 140 dirh\nWafa Assurance confirme ainsi son le\nfondamentaux, et poursuit le développem\nDéc2022 Déc 2023\nContact : information.financiere@wafaassurance.co.ma\nLien internet : https://www.wafaassurance.ma/fr/compa": "",
                "": "",
                "null": "ternational.",
                "uue par l’activité Non--vie.\nss techniques et finannciers.\neuudi 14 mars 2024, sous la\ndee la compagnie et d’arrêter\nfa Assurance atteint 11 164 MDH,\ngression de +5,6% portéée par la\n4 891 MDH conséquemmment à la\nNoon-Vie.\npprogression de 1,5% suuite à la\néccès.\nprrogression par rapport aau niveau\na croissance de l’activité et par la\nprrogression de 15,4%.\n01 MDH en hausse de 3,9%.\nrees consolidé annuel s’établit à\n99,3% portée par la perfformance\nVie et Non-vie au Maroc et à\nDDH vs 776 MDH en 2022 en baisse\nhés financiers et les chaarges non\nfoonds spécial pour la gestion des\nvent à 9 232 MDH au 31 ddécembre\n144,6%.\nntt Wafa Assurance et sees filiales\néee de deux fonds communs de\npeerspectives de la comppagnie, le\nrooposer à l’Assemblée Générale\nà 11h00, la distribution au titre de\namms par action.\nadership et la soliditéé de ses\nent de ses activités.\ngnnie-assurance-maroc": ""
            },
            {
                "COMMUNIQUÉ FINANCIER\nRÉSULLTTAATTS ANNUELS 2023\nCCrrooiissssaannncccceee dduu cchhiiffffrreee dddd’’’aaaffffaaiiress ppoorrttéée aussi bien par l’activité Vie q\nRésuullttaattss eenn pprrooggrreesssionn eennnn rraaiissoon de l’amélioration des indicateur\nLee CCoonseeiilll dddd’’AAddministrationn de Wafa Assurance s’est réuni le J\nPPrréésidence de Monsieur Bouubker JAI, en vue d’examiner l’activité\nlles comptes au 31 décembree 2023.\nRésultats sociaux\nChiffre d’affaires social (en MDH)\nEn 2023, le chiffre d’affaires social de Wa\n+7,1%\nsoit +7,1% par rapport à 2022.\n10 425 11 164\nLL’’activité Vie s’élève à 6 273 MDH en pro\nppeerrfformancee eenn EEppaarrggnnee eett PPrrévoyyance.\nLL’’activité Non-Vie progresse de +9,1%, à\nDéc 2022 Déc 2023\nperformance de l’ensemble des branches\nLe résultat Vie s’établit à 464 MDH en\nRésultat net social (en MDH)\ncroissance de l’activité en Epargne et en D\n+15,4%\n607 701 Le résultat Non-Vie ressort à 436 MDH en\nenregistré en 2022 (157 MDH), portée par l\nbonne tenue du résultat financierr..\nLe résultat net social atteint 701 MDH en\nDéc 2022 Déc 2023\nLes fonds propres sociaux s’élèvent à 6 6\nFonds propres sociaux (en MDH)\nRésultats consolidés\n+3,9%\n6 356 6 601\nAu 31 décembre 2023, le chiffre d’affai\n12 724 MDH enregistrant une hausse de\nréalisée sur l’ensemble des branches\nl’international.\nDéc 2022 Déc 2023\nLe RNPG de l’exercice 2023 ressort à 670 M\nde 13,6% impacté par l’évolution des marc\nChiffre d’affaires consolidé (en MDH)\ncourantes en 2023 (notamment le don au\n+9,3% effets du séisme d’Al Haouz).\n11 639 12 724\nLes capitaux propres part du groupe s’élè\n2023 vs. 8 057 MDH en 2022 en hausse de\nLe périmètre de consolidation, comprena\nDéc2022 Déc 2023 africaines, a connu courant 2023 l’entr\nplacement dédiés.\nRN Part du groupe (en MDH) Au vu des résultats enregistrés et des\nConseil d’Administration a décidé de p\n-13,6%\nOrdinaire, convoquée pour le 15 Mai 2024\n776 670\nl’exercice 2023, d’un dividende de 140 dirh\nWafa Assurance confirme ainsi son le\nfondamentaux, et poursuit le développem\nDéc2022 Déc 2023\nContact : information.financiere@wafaassurance.co.ma\nLien internet : https://www.wafaassurance.ma/fr/compa": "",
                "": "",
                "null": "",
                "uue par l’activité Non--vie.\nss techniques et finannciers.\neuudi 14 mars 2024, sous la\ndee la compagnie et d’arrêter\nfa Assurance atteint 11 164 MDH,\ngression de +5,6% portéée par la\n4 891 MDH conséquemmment à la\nNoon-Vie.\npprogression de 1,5% suuite à la\néccès.\nprrogression par rapport aau niveau\na croissance de l’activité et par la\nprrogression de 15,4%.\n01 MDH en hausse de 3,9%.\nrees consolidé annuel s’établit à\n99,3% portée par la perfformance\nVie et Non-vie au Maroc et à\nDDH vs 776 MDH en 2022 en baisse\nhés financiers et les chaarges non\nfoonds spécial pour la gestion des\nvent à 9 232 MDH au 31 ddécembre\n144,6%.\nntt Wafa Assurance et sees filiales\néee de deux fonds communs de\npeerspectives de la comppagnie, le\nrooposer à l’Assemblée Générale\nà 11h00, la distribution au titre de\namms par action.\nadership et la soliditéé de ses\nent de ses activités.\ngnnie-assurance-maroc": ""
            },
            {
                "COMMUNIQUÉ FINANCIER\nRÉSULLTTAATTS ANNUELS 2023\nCCrrooiissssaannncccceee dduu cchhiiffffrreee dddd’’’aaaffffaaiiress ppoorrttéée aussi bien par l’activité Vie q\nRésuullttaattss eenn pprrooggrreesssionn eennnn rraaiissoon de l’amélioration des indicateur\nLee CCoonseeiilll dddd’’AAddministrationn de Wafa Assurance s’est réuni le J\nPPrréésidence de Monsieur Bouubker JAI, en vue d’examiner l’activité\nlles comptes au 31 décembree 2023.\nRésultats sociaux\nChiffre d’affaires social (en MDH)\nEn 2023, le chiffre d’affaires social de Wa\n+7,1%\nsoit +7,1% par rapport à 2022.\n10 425 11 164\nLL’’activité Vie s’élève à 6 273 MDH en pro\nppeerrfformancee eenn EEppaarrggnnee eett PPrrévoyyance.\nLL’’activité Non-Vie progresse de +9,1%, à\nDéc 2022 Déc 2023\nperformance de l’ensemble des branches\nLe résultat Vie s’établit à 464 MDH en\nRésultat net social (en MDH)\ncroissance de l’activité en Epargne et en D\n+15,4%\n607 701 Le résultat Non-Vie ressort à 436 MDH en\nenregistré en 2022 (157 MDH), portée par l\nbonne tenue du résultat financierr..\nLe résultat net social atteint 701 MDH en\nDéc 2022 Déc 2023\nLes fonds propres sociaux s’élèvent à 6 6\nFonds propres sociaux (en MDH)\nRésultats consolidés\n+3,9%\n6 356 6 601\nAu 31 décembre 2023, le chiffre d’affai\n12 724 MDH enregistrant une hausse de\nréalisée sur l’ensemble des branches\nl’international.\nDéc 2022 Déc 2023\nLe RNPG de l’exercice 2023 ressort à 670 M\nde 13,6% impacté par l’évolution des marc\nChiffre d’affaires consolidé (en MDH)\ncourantes en 2023 (notamment le don au\n+9,3% effets du séisme d’Al Haouz).\n11 639 12 724\nLes capitaux propres part du groupe s’élè\n2023 vs. 8 057 MDH en 2022 en hausse de\nLe périmètre de consolidation, comprena\nDéc2022 Déc 2023 africaines, a connu courant 2023 l’entr\nplacement dédiés.\nRN Part du groupe (en MDH) Au vu des résultats enregistrés et des\nConseil d’Administration a décidé de p\n-13,6%\nOrdinaire, convoquée pour le 15 Mai 2024\n776 670\nl’exercice 2023, d’un dividende de 140 dirh\nWafa Assurance confirme ainsi son le\nfondamentaux, et poursuit le développem\nDéc2022 Déc 2023\nContact : information.financiere@wafaassurance.co.ma\nLien internet : https://www.wafaassurance.ma/fr/compa": "",
                "": "",
                "null": "RNPG de l’exercice 2023 ressort à 670 M",
                "uue par l’activité Non--vie.\nss techniques et finannciers.\neuudi 14 mars 2024, sous la\ndee la compagnie et d’arrêter\nfa Assurance atteint 11 164 MDH,\ngression de +5,6% portéée par la\n4 891 MDH conséquemmment à la\nNoon-Vie.\npprogression de 1,5% suuite à la\néccès.\nprrogression par rapport aau niveau\na croissance de l’activité et par la\nprrogression de 15,4%.\n01 MDH en hausse de 3,9%.\nrees consolidé annuel s’établit à\n99,3% portée par la perfformance\nVie et Non-vie au Maroc et à\nDDH vs 776 MDH en 2022 en baisse\nhés financiers et les chaarges non\nfoonds spécial pour la gestion des\nvent à 9 232 MDH au 31 ddécembre\n144,6%.\nntt Wafa Assurance et sees filiales\néee de deux fonds communs de\npeerspectives de la comppagnie, le\nrooposer à l’Assemblée Générale\nà 11h00, la distribution au titre de\namms par action.\nadership et la soliditéé de ses\nent de ses activités.\ngnnie-assurance-maroc": "DDH vs 776 MDH en 2022 en baisse"
            },
            {
                "COMMUNIQUÉ FINANCIER\nRÉSULLTTAATTS ANNUELS 2023\nCCrrooiissssaannncccceee dduu cchhiiffffrreee dddd’’’aaaffffaaiiress ppoorrttéée aussi bien par l’activité Vie q\nRésuullttaattss eenn pprrooggrreesssionn eennnn rraaiissoon de l’amélioration des indicateur\nLee CCoonseeiilll dddd’’AAddministrationn de Wafa Assurance s’est réuni le J\nPPrréésidence de Monsieur Bouubker JAI, en vue d’examiner l’activité\nlles comptes au 31 décembree 2023.\nRésultats sociaux\nChiffre d’affaires social (en MDH)\nEn 2023, le chiffre d’affaires social de Wa\n+7,1%\nsoit +7,1% par rapport à 2022.\n10 425 11 164\nLL’’activité Vie s’élève à 6 273 MDH en pro\nppeerrfformancee eenn EEppaarrggnnee eett PPrrévoyyance.\nLL’’activité Non-Vie progresse de +9,1%, à\nDéc 2022 Déc 2023\nperformance de l’ensemble des branches\nLe résultat Vie s’établit à 464 MDH en\nRésultat net social (en MDH)\ncroissance de l’activité en Epargne et en D\n+15,4%\n607 701 Le résultat Non-Vie ressort à 436 MDH en\nenregistré en 2022 (157 MDH), portée par l\nbonne tenue du résultat financierr..\nLe résultat net social atteint 701 MDH en\nDéc 2022 Déc 2023\nLes fonds propres sociaux s’élèvent à 6 6\nFonds propres sociaux (en MDH)\nRésultats consolidés\n+3,9%\n6 356 6 601\nAu 31 décembre 2023, le chiffre d’affai\n12 724 MDH enregistrant une hausse de\nréalisée sur l’ensemble des branches\nl’international.\nDéc 2022 Déc 2023\nLe RNPG de l’exercice 2023 ressort à 670 M\nde 13,6% impacté par l’évolution des marc\nChiffre d’affaires consolidé (en MDH)\ncourantes en 2023 (notamment le don au\n+9,3% effets du séisme d’Al Haouz).\n11 639 12 724\nLes capitaux propres part du groupe s’élè\n2023 vs. 8 057 MDH en 2022 en hausse de\nLe périmètre de consolidation, comprena\nDéc2022 Déc 2023 africaines, a connu courant 2023 l’entr\nplacement dédiés.\nRN Part du groupe (en MDH) Au vu des résultats enregistrés et des\nConseil d’Administration a décidé de p\n-13,6%\nOrdinaire, convoquée pour le 15 Mai 2024\n776 670\nl’exercice 2023, d’un dividende de 140 dirh\nWafa Assurance confirme ainsi son le\nfondamentaux, et poursuit le développem\nDéc2022 Déc 2023\nContact : information.financiere@wafaassurance.co.ma\nLien internet : https://www.wafaassurance.ma/fr/compa": "",
                "": "",
                "null": "",
                "uue par l’activité Non--vie.\nss techniques et finannciers.\neuudi 14 mars 2024, sous la\ndee la compagnie et d’arrêter\nfa Assurance atteint 11 164 MDH,\ngression de +5,6% portéée par la\n4 891 MDH conséquemmment à la\nNoon-Vie.\npprogression de 1,5% suuite à la\néccès.\nprrogression par rapport aau niveau\na croissance de l’activité et par la\nprrogression de 15,4%.\n01 MDH en hausse de 3,9%.\nrees consolidé annuel s’établit à\n99,3% portée par la perfformance\nVie et Non-vie au Maroc et à\nDDH vs 776 MDH en 2022 en baisse\nhés financiers et les chaarges non\nfoonds spécial pour la gestion des\nvent à 9 232 MDH au 31 ddécembre\n144,6%.\nntt Wafa Assurance et sees filiales\néee de deux fonds communs de\npeerspectives de la comppagnie, le\nrooposer à l’Assemblée Générale\nà 11h00, la distribution au titre de\namms par action.\nadership et la soliditéé de ses\nent de ses activités.\ngnnie-assurance-maroc": ""
            },
            {
                "COMMUNIQUÉ FINANCIER\nRÉSULLTTAATTS ANNUELS 2023\nCCrrooiissssaannncccceee dduu cchhiiffffrreee dddd’’’aaaffffaaiiress ppoorrttéée aussi bien par l’activité Vie q\nRésuullttaattss eenn pprrooggrreesssionn eennnn rraaiissoon de l’amélioration des indicateur\nLee CCoonseeiilll dddd’’AAddministrationn de Wafa Assurance s’est réuni le J\nPPrréésidence de Monsieur Bouubker JAI, en vue d’examiner l’activité\nlles comptes au 31 décembree 2023.\nRésultats sociaux\nChiffre d’affaires social (en MDH)\nEn 2023, le chiffre d’affaires social de Wa\n+7,1%\nsoit +7,1% par rapport à 2022.\n10 425 11 164\nLL’’activité Vie s’élève à 6 273 MDH en pro\nppeerrfformancee eenn EEppaarrggnnee eett PPrrévoyyance.\nLL’’activité Non-Vie progresse de +9,1%, à\nDéc 2022 Déc 2023\nperformance de l’ensemble des branches\nLe résultat Vie s’établit à 464 MDH en\nRésultat net social (en MDH)\ncroissance de l’activité en Epargne et en D\n+15,4%\n607 701 Le résultat Non-Vie ressort à 436 MDH en\nenregistré en 2022 (157 MDH), portée par l\nbonne tenue du résultat financierr..\nLe résultat net social atteint 701 MDH en\nDéc 2022 Déc 2023\nLes fonds propres sociaux s’élèvent à 6 6\nFonds propres sociaux (en MDH)\nRésultats consolidés\n+3,9%\n6 356 6 601\nAu 31 décembre 2023, le chiffre d’affai\n12 724 MDH enregistrant une hausse de\nréalisée sur l’ensemble des branches\nl’international.\nDéc 2022 Déc 2023\nLe RNPG de l’exercice 2023 ressort à 670 M\nde 13,6% impacté par l’évolution des marc\nChiffre d’affaires consolidé (en MDH)\ncourantes en 2023 (notamment le don au\n+9,3% effets du séisme d’Al Haouz).\n11 639 12 724\nLes capitaux propres part du groupe s’élè\n2023 vs. 8 057 MDH en 2022 en hausse de\nLe périmètre de consolidation, comprena\nDéc2022 Déc 2023 africaines, a connu courant 2023 l’entr\nplacement dédiés.\nRN Part du groupe (en MDH) Au vu des résultats enregistrés et des\nConseil d’Administration a décidé de p\n-13,6%\nOrdinaire, convoquée pour le 15 Mai 2024\n776 670\nl’exercice 2023, d’un dividende de 140 dirh\nWafa Assurance confirme ainsi son le\nfondamentaux, et poursuit le développem\nDéc2022 Déc 2023\nContact : information.financiere@wafaassurance.co.ma\nLien internet : https://www.wafaassurance.ma/fr/compa": "",
                "": "de 13,6% impacté par l’évolution des marc",
                "null": "",
                "uue par l’activité Non--vie.\nss techniques et finannciers.\neuudi 14 mars 2024, sous la\ndee la compagnie et d’arrêter\nfa Assurance atteint 11 164 MDH,\ngression de +5,6% portéée par la\n4 891 MDH conséquemmment à la\nNoon-Vie.\npprogression de 1,5% suuite à la\néccès.\nprrogression par rapport aau niveau\na croissance de l’activité et par la\nprrogression de 15,4%.\n01 MDH en hausse de 3,9%.\nrees consolidé annuel s’établit à\n99,3% portée par la perfformance\nVie et Non-vie au Maroc et à\nDDH vs 776 MDH en 2022 en baisse\nhés financiers et les chaarges non\nfoonds spécial pour la gestion des\nvent à 9 232 MDH au 31 ddécembre\n144,6%.\nntt Wafa Assurance et sees filiales\néee de deux fonds communs de\npeerspectives de la comppagnie, le\nrooposer à l’Assemblée Générale\nà 11h00, la distribution au titre de\namms par action.\nadership et la soliditéé de ses\nent de ses activités.\ngnnie-assurance-maroc": "hés financiers et les chaarges non"
            },
            {
                "COMMUNIQUÉ FINANCIER\nRÉSULLTTAATTS ANNUELS 2023\nCCrrooiissssaannncccceee dduu cchhiiffffrreee dddd’’’aaaffffaaiiress ppoorrttéée aussi bien par l’activité Vie q\nRésuullttaattss eenn pprrooggrreesssionn eennnn rraaiissoon de l’amélioration des indicateur\nLee CCoonseeiilll dddd’’AAddministrationn de Wafa Assurance s’est réuni le J\nPPrréésidence de Monsieur Bouubker JAI, en vue d’examiner l’activité\nlles comptes au 31 décembree 2023.\nRésultats sociaux\nChiffre d’affaires social (en MDH)\nEn 2023, le chiffre d’affaires social de Wa\n+7,1%\nsoit +7,1% par rapport à 2022.\n10 425 11 164\nLL’’activité Vie s’élève à 6 273 MDH en pro\nppeerrfformancee eenn EEppaarrggnnee eett PPrrévoyyance.\nLL’’activité Non-Vie progresse de +9,1%, à\nDéc 2022 Déc 2023\nperformance de l’ensemble des branches\nLe résultat Vie s’établit à 464 MDH en\nRésultat net social (en MDH)\ncroissance de l’activité en Epargne et en D\n+15,4%\n607 701 Le résultat Non-Vie ressort à 436 MDH en\nenregistré en 2022 (157 MDH), portée par l\nbonne tenue du résultat financierr..\nLe résultat net social atteint 701 MDH en\nDéc 2022 Déc 2023\nLes fonds propres sociaux s’élèvent à 6 6\nFonds propres sociaux (en MDH)\nRésultats consolidés\n+3,9%\n6 356 6 601\nAu 31 décembre 2023, le chiffre d’affai\n12 724 MDH enregistrant une hausse de\nréalisée sur l’ensemble des branches\nl’international.\nDéc 2022 Déc 2023\nLe RNPG de l’exercice 2023 ressort à 670 M\nde 13,6% impacté par l’évolution des marc\nChiffre d’affaires consolidé (en MDH)\ncourantes en 2023 (notamment le don au\n+9,3% effets du séisme d’Al Haouz).\n11 639 12 724\nLes capitaux propres part du groupe s’élè\n2023 vs. 8 057 MDH en 2022 en hausse de\nLe périmètre de consolidation, comprena\nDéc2022 Déc 2023 africaines, a connu courant 2023 l’entr\nplacement dédiés.\nRN Part du groupe (en MDH) Au vu des résultats enregistrés et des\nConseil d’Administration a décidé de p\n-13,6%\nOrdinaire, convoquée pour le 15 Mai 2024\n776 670\nl’exercice 2023, d’un dividende de 140 dirh\nWafa Assurance confirme ainsi son le\nfondamentaux, et poursuit le développem\nDéc2022 Déc 2023\nContact : information.financiere@wafaassurance.co.ma\nLien internet : https://www.wafaassurance.ma/fr/compa": "",
                "": "cou",
                "null": "rantes en 2023 (notamment le don au",
                "uue par l’activité Non--vie.\nss techniques et finannciers.\neuudi 14 mars 2024, sous la\ndee la compagnie et d’arrêter\nfa Assurance atteint 11 164 MDH,\ngression de +5,6% portéée par la\n4 891 MDH conséquemmment à la\nNoon-Vie.\npprogression de 1,5% suuite à la\néccès.\nprrogression par rapport aau niveau\na croissance de l’activité et par la\nprrogression de 15,4%.\n01 MDH en hausse de 3,9%.\nrees consolidé annuel s’établit à\n99,3% portée par la perfformance\nVie et Non-vie au Maroc et à\nDDH vs 776 MDH en 2022 en baisse\nhés financiers et les chaarges non\nfoonds spécial pour la gestion des\nvent à 9 232 MDH au 31 ddécembre\n144,6%.\nntt Wafa Assurance et sees filiales\néee de deux fonds communs de\npeerspectives de la comppagnie, le\nrooposer à l’Assemblée Générale\nà 11h00, la distribution au titre de\namms par action.\nadership et la soliditéé de ses\nent de ses activités.\ngnnie-assurance-maroc": "foonds spécial pour la gestion des"
            },
            {
                "COMMUNIQUÉ FINANCIER\nRÉSULLTTAATTS ANNUELS 2023\nCCrrooiissssaannncccceee dduu cchhiiffffrreee dddd’’’aaaffffaaiiress ppoorrttéée aussi bien par l’activité Vie q\nRésuullttaattss eenn pprrooggrreesssionn eennnn rraaiissoon de l’amélioration des indicateur\nLee CCoonseeiilll dddd’’AAddministrationn de Wafa Assurance s’est réuni le J\nPPrréésidence de Monsieur Bouubker JAI, en vue d’examiner l’activité\nlles comptes au 31 décembree 2023.\nRésultats sociaux\nChiffre d’affaires social (en MDH)\nEn 2023, le chiffre d’affaires social de Wa\n+7,1%\nsoit +7,1% par rapport à 2022.\n10 425 11 164\nLL’’activité Vie s’élève à 6 273 MDH en pro\nppeerrfformancee eenn EEppaarrggnnee eett PPrrévoyyance.\nLL’’activité Non-Vie progresse de +9,1%, à\nDéc 2022 Déc 2023\nperformance de l’ensemble des branches\nLe résultat Vie s’établit à 464 MDH en\nRésultat net social (en MDH)\ncroissance de l’activité en Epargne et en D\n+15,4%\n607 701 Le résultat Non-Vie ressort à 436 MDH en\nenregistré en 2022 (157 MDH), portée par l\nbonne tenue du résultat financierr..\nLe résultat net social atteint 701 MDH en\nDéc 2022 Déc 2023\nLes fonds propres sociaux s’élèvent à 6 6\nFonds propres sociaux (en MDH)\nRésultats consolidés\n+3,9%\n6 356 6 601\nAu 31 décembre 2023, le chiffre d’affai\n12 724 MDH enregistrant une hausse de\nréalisée sur l’ensemble des branches\nl’international.\nDéc 2022 Déc 2023\nLe RNPG de l’exercice 2023 ressort à 670 M\nde 13,6% impacté par l’évolution des marc\nChiffre d’affaires consolidé (en MDH)\ncourantes en 2023 (notamment le don au\n+9,3% effets du séisme d’Al Haouz).\n11 639 12 724\nLes capitaux propres part du groupe s’élè\n2023 vs. 8 057 MDH en 2022 en hausse de\nLe périmètre de consolidation, comprena\nDéc2022 Déc 2023 africaines, a connu courant 2023 l’entr\nplacement dédiés.\nRN Part du groupe (en MDH) Au vu des résultats enregistrés et des\nConseil d’Administration a décidé de p\n-13,6%\nOrdinaire, convoquée pour le 15 Mai 2024\n776 670\nl’exercice 2023, d’un dividende de 140 dirh\nWafa Assurance confirme ainsi son le\nfondamentaux, et poursuit le développem\nDéc2022 Déc 2023\nContact : information.financiere@wafaassurance.co.ma\nLien internet : https://www.wafaassurance.ma/fr/compa": "",
                "": "effets du séisme d’Al Haouz).",
                "null": "",
                "uue par l’activité Non--vie.\nss techniques et finannciers.\neuudi 14 mars 2024, sous la\ndee la compagnie et d’arrêter\nfa Assurance atteint 11 164 MDH,\ngression de +5,6% portéée par la\n4 891 MDH conséquemmment à la\nNoon-Vie.\npprogression de 1,5% suuite à la\néccès.\nprrogression par rapport aau niveau\na croissance de l’activité et par la\nprrogression de 15,4%.\n01 MDH en hausse de 3,9%.\nrees consolidé annuel s’établit à\n99,3% portée par la perfformance\nVie et Non-vie au Maroc et à\nDDH vs 776 MDH en 2022 en baisse\nhés financiers et les chaarges non\nfoonds spécial pour la gestion des\nvent à 9 232 MDH au 31 ddécembre\n144,6%.\nntt Wafa Assurance et sees filiales\néee de deux fonds communs de\npeerspectives de la comppagnie, le\nrooposer à l’Assemblée Générale\nà 11h00, la distribution au titre de\namms par action.\nadership et la soliditéé de ses\nent de ses activités.\ngnnie-assurance-maroc": ""
            },
            {
                "COMMUNIQUÉ FINANCIER\nRÉSULLTTAATTS ANNUELS 2023\nCCrrooiissssaannncccceee dduu cchhiiffffrreee dddd’’’aaaffffaaiiress ppoorrttéée aussi bien par l’activité Vie q\nRésuullttaattss eenn pprrooggrreesssionn eennnn rraaiissoon de l’amélioration des indicateur\nLee CCoonseeiilll dddd’’AAddministrationn de Wafa Assurance s’est réuni le J\nPPrréésidence de Monsieur Bouubker JAI, en vue d’examiner l’activité\nlles comptes au 31 décembree 2023.\nRésultats sociaux\nChiffre d’affaires social (en MDH)\nEn 2023, le chiffre d’affaires social de Wa\n+7,1%\nsoit +7,1% par rapport à 2022.\n10 425 11 164\nLL’’activité Vie s’élève à 6 273 MDH en pro\nppeerrfformancee eenn EEppaarrggnnee eett PPrrévoyyance.\nLL’’activité Non-Vie progresse de +9,1%, à\nDéc 2022 Déc 2023\nperformance de l’ensemble des branches\nLe résultat Vie s’établit à 464 MDH en\nRésultat net social (en MDH)\ncroissance de l’activité en Epargne et en D\n+15,4%\n607 701 Le résultat Non-Vie ressort à 436 MDH en\nenregistré en 2022 (157 MDH), portée par l\nbonne tenue du résultat financierr..\nLe résultat net social atteint 701 MDH en\nDéc 2022 Déc 2023\nLes fonds propres sociaux s’élèvent à 6 6\nFonds propres sociaux (en MDH)\nRésultats consolidés\n+3,9%\n6 356 6 601\nAu 31 décembre 2023, le chiffre d’affai\n12 724 MDH enregistrant une hausse de\nréalisée sur l’ensemble des branches\nl’international.\nDéc 2022 Déc 2023\nLe RNPG de l’exercice 2023 ressort à 670 M\nde 13,6% impacté par l’évolution des marc\nChiffre d’affaires consolidé (en MDH)\ncourantes en 2023 (notamment le don au\n+9,3% effets du séisme d’Al Haouz).\n11 639 12 724\nLes capitaux propres part du groupe s’élè\n2023 vs. 8 057 MDH en 2022 en hausse de\nLe périmètre de consolidation, comprena\nDéc2022 Déc 2023 africaines, a connu courant 2023 l’entr\nplacement dédiés.\nRN Part du groupe (en MDH) Au vu des résultats enregistrés et des\nConseil d’Administration a décidé de p\n-13,6%\nOrdinaire, convoquée pour le 15 Mai 2024\n776 670\nl’exercice 2023, d’un dividende de 140 dirh\nWafa Assurance confirme ainsi son le\nfondamentaux, et poursuit le développem\nDéc2022 Déc 2023\nContact : information.financiere@wafaassurance.co.ma\nLien internet : https://www.wafaassurance.ma/fr/compa": "",
                "": "",
                "null": "",
                "uue par l’activité Non--vie.\nss techniques et finannciers.\neuudi 14 mars 2024, sous la\ndee la compagnie et d’arrêter\nfa Assurance atteint 11 164 MDH,\ngression de +5,6% portéée par la\n4 891 MDH conséquemmment à la\nNoon-Vie.\npprogression de 1,5% suuite à la\néccès.\nprrogression par rapport aau niveau\na croissance de l’activité et par la\nprrogression de 15,4%.\n01 MDH en hausse de 3,9%.\nrees consolidé annuel s’établit à\n99,3% portée par la perfformance\nVie et Non-vie au Maroc et à\nDDH vs 776 MDH en 2022 en baisse\nhés financiers et les chaarges non\nfoonds spécial pour la gestion des\nvent à 9 232 MDH au 31 ddécembre\n144,6%.\nntt Wafa Assurance et sees filiales\néee de deux fonds communs de\npeerspectives de la comppagnie, le\nrooposer à l’Assemblée Générale\nà 11h00, la distribution au titre de\namms par action.\nadership et la soliditéé de ses\nent de ses activités.\ngnnie-assurance-maroc": ""
            },
            {
                "COMMUNIQUÉ FINANCIER\nRÉSULLTTAATTS ANNUELS 2023\nCCrrooiissssaannncccceee dduu cchhiiffffrreee dddd’’’aaaffffaaiiress ppoorrttéée aussi bien par l’activité Vie q\nRésuullttaattss eenn pprrooggrreesssionn eennnn rraaiissoon de l’amélioration des indicateur\nLee CCoonseeiilll dddd’’AAddministrationn de Wafa Assurance s’est réuni le J\nPPrréésidence de Monsieur Bouubker JAI, en vue d’examiner l’activité\nlles comptes au 31 décembree 2023.\nRésultats sociaux\nChiffre d’affaires social (en MDH)\nEn 2023, le chiffre d’affaires social de Wa\n+7,1%\nsoit +7,1% par rapport à 2022.\n10 425 11 164\nLL’’activité Vie s’élève à 6 273 MDH en pro\nppeerrfformancee eenn EEppaarrggnnee eett PPrrévoyyance.\nLL’’activité Non-Vie progresse de +9,1%, à\nDéc 2022 Déc 2023\nperformance de l’ensemble des branches\nLe résultat Vie s’établit à 464 MDH en\nRésultat net social (en MDH)\ncroissance de l’activité en Epargne et en D\n+15,4%\n607 701 Le résultat Non-Vie ressort à 436 MDH en\nenregistré en 2022 (157 MDH), portée par l\nbonne tenue du résultat financierr..\nLe résultat net social atteint 701 MDH en\nDéc 2022 Déc 2023\nLes fonds propres sociaux s’élèvent à 6 6\nFonds propres sociaux (en MDH)\nRésultats consolidés\n+3,9%\n6 356 6 601\nAu 31 décembre 2023, le chiffre d’affai\n12 724 MDH enregistrant une hausse de\nréalisée sur l’ensemble des branches\nl’international.\nDéc 2022 Déc 2023\nLe RNPG de l’exercice 2023 ressort à 670 M\nde 13,6% impacté par l’évolution des marc\nChiffre d’affaires consolidé (en MDH)\ncourantes en 2023 (notamment le don au\n+9,3% effets du séisme d’Al Haouz).\n11 639 12 724\nLes capitaux propres part du groupe s’élè\n2023 vs. 8 057 MDH en 2022 en hausse de\nLe périmètre de consolidation, comprena\nDéc2022 Déc 2023 africaines, a connu courant 2023 l’entr\nplacement dédiés.\nRN Part du groupe (en MDH) Au vu des résultats enregistrés et des\nConseil d’Administration a décidé de p\n-13,6%\nOrdinaire, convoquée pour le 15 Mai 2024\n776 670\nl’exercice 2023, d’un dividende de 140 dirh\nWafa Assurance confirme ainsi son le\nfondamentaux, et poursuit le développem\nDéc2022 Déc 2023\nContact : information.financiere@wafaassurance.co.ma\nLien internet : https://www.wafaassurance.ma/fr/compa": "",
                "": "",
                "null": "capitaux propres part du groupe s’élè",
                "uue par l’activité Non--vie.\nss techniques et finannciers.\neuudi 14 mars 2024, sous la\ndee la compagnie et d’arrêter\nfa Assurance atteint 11 164 MDH,\ngression de +5,6% portéée par la\n4 891 MDH conséquemmment à la\nNoon-Vie.\npprogression de 1,5% suuite à la\néccès.\nprrogression par rapport aau niveau\na croissance de l’activité et par la\nprrogression de 15,4%.\n01 MDH en hausse de 3,9%.\nrees consolidé annuel s’établit à\n99,3% portée par la perfformance\nVie et Non-vie au Maroc et à\nDDH vs 776 MDH en 2022 en baisse\nhés financiers et les chaarges non\nfoonds spécial pour la gestion des\nvent à 9 232 MDH au 31 ddécembre\n144,6%.\nntt Wafa Assurance et sees filiales\néee de deux fonds communs de\npeerspectives de la comppagnie, le\nrooposer à l’Assemblée Générale\nà 11h00, la distribution au titre de\namms par action.\nadership et la soliditéé de ses\nent de ses activités.\ngnnie-assurance-maroc": "vent à 9 232 MDH au 31 ddécembre"
            },
            {
                "COMMUNIQUÉ FINANCIER\nRÉSULLTTAATTS ANNUELS 2023\nCCrrooiissssaannncccceee dduu cchhiiffffrreee dddd’’’aaaffffaaiiress ppoorrttéée aussi bien par l’activité Vie q\nRésuullttaattss eenn pprrooggrreesssionn eennnn rraaiissoon de l’amélioration des indicateur\nLee CCoonseeiilll dddd’’AAddministrationn de Wafa Assurance s’est réuni le J\nPPrréésidence de Monsieur Bouubker JAI, en vue d’examiner l’activité\nlles comptes au 31 décembree 2023.\nRésultats sociaux\nChiffre d’affaires social (en MDH)\nEn 2023, le chiffre d’affaires social de Wa\n+7,1%\nsoit +7,1% par rapport à 2022.\n10 425 11 164\nLL’’activité Vie s’élève à 6 273 MDH en pro\nppeerrfformancee eenn EEppaarrggnnee eett PPrrévoyyance.\nLL’’activité Non-Vie progresse de +9,1%, à\nDéc 2022 Déc 2023\nperformance de l’ensemble des branches\nLe résultat Vie s’établit à 464 MDH en\nRésultat net social (en MDH)\ncroissance de l’activité en Epargne et en D\n+15,4%\n607 701 Le résultat Non-Vie ressort à 436 MDH en\nenregistré en 2022 (157 MDH), portée par l\nbonne tenue du résultat financierr..\nLe résultat net social atteint 701 MDH en\nDéc 2022 Déc 2023\nLes fonds propres sociaux s’élèvent à 6 6\nFonds propres sociaux (en MDH)\nRésultats consolidés\n+3,9%\n6 356 6 601\nAu 31 décembre 2023, le chiffre d’affai\n12 724 MDH enregistrant une hausse de\nréalisée sur l’ensemble des branches\nl’international.\nDéc 2022 Déc 2023\nLe RNPG de l’exercice 2023 ressort à 670 M\nde 13,6% impacté par l’évolution des marc\nChiffre d’affaires consolidé (en MDH)\ncourantes en 2023 (notamment le don au\n+9,3% effets du séisme d’Al Haouz).\n11 639 12 724\nLes capitaux propres part du groupe s’élè\n2023 vs. 8 057 MDH en 2022 en hausse de\nLe périmètre de consolidation, comprena\nDéc2022 Déc 2023 africaines, a connu courant 2023 l’entr\nplacement dédiés.\nRN Part du groupe (en MDH) Au vu des résultats enregistrés et des\nConseil d’Administration a décidé de p\n-13,6%\nOrdinaire, convoquée pour le 15 Mai 2024\n776 670\nl’exercice 2023, d’un dividende de 140 dirh\nWafa Assurance confirme ainsi son le\nfondamentaux, et poursuit le développem\nDéc2022 Déc 2023\nContact : information.financiere@wafaassurance.co.ma\nLien internet : https://www.wafaassurance.ma/fr/compa": "",
                "": "2023 vs. 8 057 MDH en 2022 en hausse de",
                "null": "",
                "uue par l’activité Non--vie.\nss techniques et finannciers.\neuudi 14 mars 2024, sous la\ndee la compagnie et d’arrêter\nfa Assurance atteint 11 164 MDH,\ngression de +5,6% portéée par la\n4 891 MDH conséquemmment à la\nNoon-Vie.\npprogression de 1,5% suuite à la\néccès.\nprrogression par rapport aau niveau\na croissance de l’activité et par la\nprrogression de 15,4%.\n01 MDH en hausse de 3,9%.\nrees consolidé annuel s’établit à\n99,3% portée par la perfformance\nVie et Non-vie au Maroc et à\nDDH vs 776 MDH en 2022 en baisse\nhés financiers et les chaarges non\nfoonds spécial pour la gestion des\nvent à 9 232 MDH au 31 ddécembre\n144,6%.\nntt Wafa Assurance et sees filiales\néee de deux fonds communs de\npeerspectives de la comppagnie, le\nrooposer à l’Assemblée Générale\nà 11h00, la distribution au titre de\namms par action.\nadership et la soliditéé de ses\nent de ses activités.\ngnnie-assurance-maroc": "144,6%."
            },
            {
                "COMMUNIQUÉ FINANCIER\nRÉSULLTTAATTS ANNUELS 2023\nCCrrooiissssaannncccceee dduu cchhiiffffrreee dddd’’’aaaffffaaiiress ppoorrttéée aussi bien par l’activité Vie q\nRésuullttaattss eenn pprrooggrreesssionn eennnn rraaiissoon de l’amélioration des indicateur\nLee CCoonseeiilll dddd’’AAddministrationn de Wafa Assurance s’est réuni le J\nPPrréésidence de Monsieur Bouubker JAI, en vue d’examiner l’activité\nlles comptes au 31 décembree 2023.\nRésultats sociaux\nChiffre d’affaires social (en MDH)\nEn 2023, le chiffre d’affaires social de Wa\n+7,1%\nsoit +7,1% par rapport à 2022.\n10 425 11 164\nLL’’activité Vie s’élève à 6 273 MDH en pro\nppeerrfformancee eenn EEppaarrggnnee eett PPrrévoyyance.\nLL’’activité Non-Vie progresse de +9,1%, à\nDéc 2022 Déc 2023\nperformance de l’ensemble des branches\nLe résultat Vie s’établit à 464 MDH en\nRésultat net social (en MDH)\ncroissance de l’activité en Epargne et en D\n+15,4%\n607 701 Le résultat Non-Vie ressort à 436 MDH en\nenregistré en 2022 (157 MDH), portée par l\nbonne tenue du résultat financierr..\nLe résultat net social atteint 701 MDH en\nDéc 2022 Déc 2023\nLes fonds propres sociaux s’élèvent à 6 6\nFonds propres sociaux (en MDH)\nRésultats consolidés\n+3,9%\n6 356 6 601\nAu 31 décembre 2023, le chiffre d’affai\n12 724 MDH enregistrant une hausse de\nréalisée sur l’ensemble des branches\nl’international.\nDéc 2022 Déc 2023\nLe RNPG de l’exercice 2023 ressort à 670 M\nde 13,6% impacté par l’évolution des marc\nChiffre d’affaires consolidé (en MDH)\ncourantes en 2023 (notamment le don au\n+9,3% effets du séisme d’Al Haouz).\n11 639 12 724\nLes capitaux propres part du groupe s’élè\n2023 vs. 8 057 MDH en 2022 en hausse de\nLe périmètre de consolidation, comprena\nDéc2022 Déc 2023 africaines, a connu courant 2023 l’entr\nplacement dédiés.\nRN Part du groupe (en MDH) Au vu des résultats enregistrés et des\nConseil d’Administration a décidé de p\n-13,6%\nOrdinaire, convoquée pour le 15 Mai 2024\n776 670\nl’exercice 2023, d’un dividende de 140 dirh\nWafa Assurance confirme ainsi son le\nfondamentaux, et poursuit le développem\nDéc2022 Déc 2023\nContact : information.financiere@wafaassurance.co.ma\nLien internet : https://www.wafaassurance.ma/fr/compa": "",
                "": "",
                "null": "",
                "uue par l’activité Non--vie.\nss techniques et finannciers.\neuudi 14 mars 2024, sous la\ndee la compagnie et d’arrêter\nfa Assurance atteint 11 164 MDH,\ngression de +5,6% portéée par la\n4 891 MDH conséquemmment à la\nNoon-Vie.\npprogression de 1,5% suuite à la\néccès.\nprrogression par rapport aau niveau\na croissance de l’activité et par la\nprrogression de 15,4%.\n01 MDH en hausse de 3,9%.\nrees consolidé annuel s’établit à\n99,3% portée par la perfformance\nVie et Non-vie au Maroc et à\nDDH vs 776 MDH en 2022 en baisse\nhés financiers et les chaarges non\nfoonds spécial pour la gestion des\nvent à 9 232 MDH au 31 ddécembre\n144,6%.\nntt Wafa Assurance et sees filiales\néee de deux fonds communs de\npeerspectives de la comppagnie, le\nrooposer à l’Assemblée Générale\nà 11h00, la distribution au titre de\namms par action.\nadership et la soliditéé de ses\nent de ses activités.\ngnnie-assurance-maroc": ""
            },
            {
                "COMMUNIQUÉ FINANCIER\nRÉSULLTTAATTS ANNUELS 2023\nCCrrooiissssaannncccceee dduu cchhiiffffrreee dddd’’’aaaffffaaiiress ppoorrttéée aussi bien par l’activité Vie q\nRésuullttaattss eenn pprrooggrreesssionn eennnn rraaiissoon de l’amélioration des indicateur\nLee CCoonseeiilll dddd’’AAddministrationn de Wafa Assurance s’est réuni le J\nPPrréésidence de Monsieur Bouubker JAI, en vue d’examiner l’activité\nlles comptes au 31 décembree 2023.\nRésultats sociaux\nChiffre d’affaires social (en MDH)\nEn 2023, le chiffre d’affaires social de Wa\n+7,1%\nsoit +7,1% par rapport à 2022.\n10 425 11 164\nLL’’activité Vie s’élève à 6 273 MDH en pro\nppeerrfformancee eenn EEppaarrggnnee eett PPrrévoyyance.\nLL’’activité Non-Vie progresse de +9,1%, à\nDéc 2022 Déc 2023\nperformance de l’ensemble des branches\nLe résultat Vie s’établit à 464 MDH en\nRésultat net social (en MDH)\ncroissance de l’activité en Epargne et en D\n+15,4%\n607 701 Le résultat Non-Vie ressort à 436 MDH en\nenregistré en 2022 (157 MDH), portée par l\nbonne tenue du résultat financierr..\nLe résultat net social atteint 701 MDH en\nDéc 2022 Déc 2023\nLes fonds propres sociaux s’élèvent à 6 6\nFonds propres sociaux (en MDH)\nRésultats consolidés\n+3,9%\n6 356 6 601\nAu 31 décembre 2023, le chiffre d’affai\n12 724 MDH enregistrant une hausse de\nréalisée sur l’ensemble des branches\nl’international.\nDéc 2022 Déc 2023\nLe RNPG de l’exercice 2023 ressort à 670 M\nde 13,6% impacté par l’évolution des marc\nChiffre d’affaires consolidé (en MDH)\ncourantes en 2023 (notamment le don au\n+9,3% effets du séisme d’Al Haouz).\n11 639 12 724\nLes capitaux propres part du groupe s’élè\n2023 vs. 8 057 MDH en 2022 en hausse de\nLe périmètre de consolidation, comprena\nDéc2022 Déc 2023 africaines, a connu courant 2023 l’entr\nplacement dédiés.\nRN Part du groupe (en MDH) Au vu des résultats enregistrés et des\nConseil d’Administration a décidé de p\n-13,6%\nOrdinaire, convoquée pour le 15 Mai 2024\n776 670\nl’exercice 2023, d’un dividende de 140 dirh\nWafa Assurance confirme ainsi son le\nfondamentaux, et poursuit le développem\nDéc2022 Déc 2023\nContact : information.financiere@wafaassurance.co.ma\nLien internet : https://www.wafaassurance.ma/fr/compa": "",
                "": "",
                "null": "périmètre de consolidation, comprena",
                "uue par l’activité Non--vie.\nss techniques et finannciers.\neuudi 14 mars 2024, sous la\ndee la compagnie et d’arrêter\nfa Assurance atteint 11 164 MDH,\ngression de +5,6% portéée par la\n4 891 MDH conséquemmment à la\nNoon-Vie.\npprogression de 1,5% suuite à la\néccès.\nprrogression par rapport aau niveau\na croissance de l’activité et par la\nprrogression de 15,4%.\n01 MDH en hausse de 3,9%.\nrees consolidé annuel s’établit à\n99,3% portée par la perfformance\nVie et Non-vie au Maroc et à\nDDH vs 776 MDH en 2022 en baisse\nhés financiers et les chaarges non\nfoonds spécial pour la gestion des\nvent à 9 232 MDH au 31 ddécembre\n144,6%.\nntt Wafa Assurance et sees filiales\néee de deux fonds communs de\npeerspectives de la comppagnie, le\nrooposer à l’Assemblée Générale\nà 11h00, la distribution au titre de\namms par action.\nadership et la soliditéé de ses\nent de ses activités.\ngnnie-assurance-maroc": "ntt Wafa Assurance et sees filiales"
            },
            {
                "COMMUNIQUÉ FINANCIER\nRÉSULLTTAATTS ANNUELS 2023\nCCrrooiissssaannncccceee dduu cchhiiffffrreee dddd’’’aaaffffaaiiress ppoorrttéée aussi bien par l’activité Vie q\nRésuullttaattss eenn pprrooggrreesssionn eennnn rraaiissoon de l’amélioration des indicateur\nLee CCoonseeiilll dddd’’AAddministrationn de Wafa Assurance s’est réuni le J\nPPrréésidence de Monsieur Bouubker JAI, en vue d’examiner l’activité\nlles comptes au 31 décembree 2023.\nRésultats sociaux\nChiffre d’affaires social (en MDH)\nEn 2023, le chiffre d’affaires social de Wa\n+7,1%\nsoit +7,1% par rapport à 2022.\n10 425 11 164\nLL’’activité Vie s’élève à 6 273 MDH en pro\nppeerrfformancee eenn EEppaarrggnnee eett PPrrévoyyance.\nLL’’activité Non-Vie progresse de +9,1%, à\nDéc 2022 Déc 2023\nperformance de l’ensemble des branches\nLe résultat Vie s’établit à 464 MDH en\nRésultat net social (en MDH)\ncroissance de l’activité en Epargne et en D\n+15,4%\n607 701 Le résultat Non-Vie ressort à 436 MDH en\nenregistré en 2022 (157 MDH), portée par l\nbonne tenue du résultat financierr..\nLe résultat net social atteint 701 MDH en\nDéc 2022 Déc 2023\nLes fonds propres sociaux s’élèvent à 6 6\nFonds propres sociaux (en MDH)\nRésultats consolidés\n+3,9%\n6 356 6 601\nAu 31 décembre 2023, le chiffre d’affai\n12 724 MDH enregistrant une hausse de\nréalisée sur l’ensemble des branches\nl’international.\nDéc 2022 Déc 2023\nLe RNPG de l’exercice 2023 ressort à 670 M\nde 13,6% impacté par l’évolution des marc\nChiffre d’affaires consolidé (en MDH)\ncourantes en 2023 (notamment le don au\n+9,3% effets du séisme d’Al Haouz).\n11 639 12 724\nLes capitaux propres part du groupe s’élè\n2023 vs. 8 057 MDH en 2022 en hausse de\nLe périmètre de consolidation, comprena\nDéc2022 Déc 2023 africaines, a connu courant 2023 l’entr\nplacement dédiés.\nRN Part du groupe (en MDH) Au vu des résultats enregistrés et des\nConseil d’Administration a décidé de p\n-13,6%\nOrdinaire, convoquée pour le 15 Mai 2024\n776 670\nl’exercice 2023, d’un dividende de 140 dirh\nWafa Assurance confirme ainsi son le\nfondamentaux, et poursuit le développem\nDéc2022 Déc 2023\nContact : information.financiere@wafaassurance.co.ma\nLien internet : https://www.wafaassurance.ma/fr/compa": "",
                "": "",
                "null": "",
                "uue par l’activité Non--vie.\nss techniques et finannciers.\neuudi 14 mars 2024, sous la\ndee la compagnie et d’arrêter\nfa Assurance atteint 11 164 MDH,\ngression de +5,6% portéée par la\n4 891 MDH conséquemmment à la\nNoon-Vie.\npprogression de 1,5% suuite à la\néccès.\nprrogression par rapport aau niveau\na croissance de l’activité et par la\nprrogression de 15,4%.\n01 MDH en hausse de 3,9%.\nrees consolidé annuel s’établit à\n99,3% portée par la perfformance\nVie et Non-vie au Maroc et à\nDDH vs 776 MDH en 2022 en baisse\nhés financiers et les chaarges non\nfoonds spécial pour la gestion des\nvent à 9 232 MDH au 31 ddécembre\n144,6%.\nntt Wafa Assurance et sees filiales\néee de deux fonds communs de\npeerspectives de la comppagnie, le\nrooposer à l’Assemblée Générale\nà 11h00, la distribution au titre de\namms par action.\nadership et la soliditéé de ses\nent de ses activités.\ngnnie-assurance-maroc": ""
            },
            {
                "COMMUNIQUÉ FINANCIER\nRÉSULLTTAATTS ANNUELS 2023\nCCrrooiissssaannncccceee dduu cchhiiffffrreee dddd’’’aaaffffaaiiress ppoorrttéée aussi bien par l’activité Vie q\nRésuullttaattss eenn pprrooggrreesssionn eennnn rraaiissoon de l’amélioration des indicateur\nLee CCoonseeiilll dddd’’AAddministrationn de Wafa Assurance s’est réuni le J\nPPrréésidence de Monsieur Bouubker JAI, en vue d’examiner l’activité\nlles comptes au 31 décembree 2023.\nRésultats sociaux\nChiffre d’affaires social (en MDH)\nEn 2023, le chiffre d’affaires social de Wa\n+7,1%\nsoit +7,1% par rapport à 2022.\n10 425 11 164\nLL’’activité Vie s’élève à 6 273 MDH en pro\nppeerrfformancee eenn EEppaarrggnnee eett PPrrévoyyance.\nLL’’activité Non-Vie progresse de +9,1%, à\nDéc 2022 Déc 2023\nperformance de l’ensemble des branches\nLe résultat Vie s’établit à 464 MDH en\nRésultat net social (en MDH)\ncroissance de l’activité en Epargne et en D\n+15,4%\n607 701 Le résultat Non-Vie ressort à 436 MDH en\nenregistré en 2022 (157 MDH), portée par l\nbonne tenue du résultat financierr..\nLe résultat net social atteint 701 MDH en\nDéc 2022 Déc 2023\nLes fonds propres sociaux s’élèvent à 6 6\nFonds propres sociaux (en MDH)\nRésultats consolidés\n+3,9%\n6 356 6 601\nAu 31 décembre 2023, le chiffre d’affai\n12 724 MDH enregistrant une hausse de\nréalisée sur l’ensemble des branches\nl’international.\nDéc 2022 Déc 2023\nLe RNPG de l’exercice 2023 ressort à 670 M\nde 13,6% impacté par l’évolution des marc\nChiffre d’affaires consolidé (en MDH)\ncourantes en 2023 (notamment le don au\n+9,3% effets du séisme d’Al Haouz).\n11 639 12 724\nLes capitaux propres part du groupe s’élè\n2023 vs. 8 057 MDH en 2022 en hausse de\nLe périmètre de consolidation, comprena\nDéc2022 Déc 2023 africaines, a connu courant 2023 l’entr\nplacement dédiés.\nRN Part du groupe (en MDH) Au vu des résultats enregistrés et des\nConseil d’Administration a décidé de p\n-13,6%\nOrdinaire, convoquée pour le 15 Mai 2024\n776 670\nl’exercice 2023, d’un dividende de 140 dirh\nWafa Assurance confirme ainsi son le\nfondamentaux, et poursuit le développem\nDéc2022 Déc 2023\nContact : information.financiere@wafaassurance.co.ma\nLien internet : https://www.wafaassurance.ma/fr/compa": "",
                "": "",
                "null": "caines, a connu courant 2023 l’entr",
                "uue par l’activité Non--vie.\nss techniques et finannciers.\neuudi 14 mars 2024, sous la\ndee la compagnie et d’arrêter\nfa Assurance atteint 11 164 MDH,\ngression de +5,6% portéée par la\n4 891 MDH conséquemmment à la\nNoon-Vie.\npprogression de 1,5% suuite à la\néccès.\nprrogression par rapport aau niveau\na croissance de l’activité et par la\nprrogression de 15,4%.\n01 MDH en hausse de 3,9%.\nrees consolidé annuel s’établit à\n99,3% portée par la perfformance\nVie et Non-vie au Maroc et à\nDDH vs 776 MDH en 2022 en baisse\nhés financiers et les chaarges non\nfoonds spécial pour la gestion des\nvent à 9 232 MDH au 31 ddécembre\n144,6%.\nntt Wafa Assurance et sees filiales\néee de deux fonds communs de\npeerspectives de la comppagnie, le\nrooposer à l’Assemblée Générale\nà 11h00, la distribution au titre de\namms par action.\nadership et la soliditéé de ses\nent de ses activités.\ngnnie-assurance-maroc": "éee de deux fonds communs de"
            },
            {
                "COMMUNIQUÉ FINANCIER\nRÉSULLTTAATTS ANNUELS 2023\nCCrrooiissssaannncccceee dduu cchhiiffffrreee dddd’’’aaaffffaaiiress ppoorrttéée aussi bien par l’activité Vie q\nRésuullttaattss eenn pprrooggrreesssionn eennnn rraaiissoon de l’amélioration des indicateur\nLee CCoonseeiilll dddd’’AAddministrationn de Wafa Assurance s’est réuni le J\nPPrréésidence de Monsieur Bouubker JAI, en vue d’examiner l’activité\nlles comptes au 31 décembree 2023.\nRésultats sociaux\nChiffre d’affaires social (en MDH)\nEn 2023, le chiffre d’affaires social de Wa\n+7,1%\nsoit +7,1% par rapport à 2022.\n10 425 11 164\nLL’’activité Vie s’élève à 6 273 MDH en pro\nppeerrfformancee eenn EEppaarrggnnee eett PPrrévoyyance.\nLL’’activité Non-Vie progresse de +9,1%, à\nDéc 2022 Déc 2023\nperformance de l’ensemble des branches\nLe résultat Vie s’établit à 464 MDH en\nRésultat net social (en MDH)\ncroissance de l’activité en Epargne et en D\n+15,4%\n607 701 Le résultat Non-Vie ressort à 436 MDH en\nenregistré en 2022 (157 MDH), portée par l\nbonne tenue du résultat financierr..\nLe résultat net social atteint 701 MDH en\nDéc 2022 Déc 2023\nLes fonds propres sociaux s’élèvent à 6 6\nFonds propres sociaux (en MDH)\nRésultats consolidés\n+3,9%\n6 356 6 601\nAu 31 décembre 2023, le chiffre d’affai\n12 724 MDH enregistrant une hausse de\nréalisée sur l’ensemble des branches\nl’international.\nDéc 2022 Déc 2023\nLe RNPG de l’exercice 2023 ressort à 670 M\nde 13,6% impacté par l’évolution des marc\nChiffre d’affaires consolidé (en MDH)\ncourantes en 2023 (notamment le don au\n+9,3% effets du séisme d’Al Haouz).\n11 639 12 724\nLes capitaux propres part du groupe s’élè\n2023 vs. 8 057 MDH en 2022 en hausse de\nLe périmètre de consolidation, comprena\nDéc2022 Déc 2023 africaines, a connu courant 2023 l’entr\nplacement dédiés.\nRN Part du groupe (en MDH) Au vu des résultats enregistrés et des\nConseil d’Administration a décidé de p\n-13,6%\nOrdinaire, convoquée pour le 15 Mai 2024\n776 670\nl’exercice 2023, d’un dividende de 140 dirh\nWafa Assurance confirme ainsi son le\nfondamentaux, et poursuit le développem\nDéc2022 Déc 2023\nContact : information.financiere@wafaassurance.co.ma\nLien internet : https://www.wafaassurance.ma/fr/compa": "",
                "": "",
                "null": "",
                "uue par l’activité Non--vie.\nss techniques et finannciers.\neuudi 14 mars 2024, sous la\ndee la compagnie et d’arrêter\nfa Assurance atteint 11 164 MDH,\ngression de +5,6% portéée par la\n4 891 MDH conséquemmment à la\nNoon-Vie.\npprogression de 1,5% suuite à la\néccès.\nprrogression par rapport aau niveau\na croissance de l’activité et par la\nprrogression de 15,4%.\n01 MDH en hausse de 3,9%.\nrees consolidé annuel s’établit à\n99,3% portée par la perfformance\nVie et Non-vie au Maroc et à\nDDH vs 776 MDH en 2022 en baisse\nhés financiers et les chaarges non\nfoonds spécial pour la gestion des\nvent à 9 232 MDH au 31 ddécembre\n144,6%.\nntt Wafa Assurance et sees filiales\néee de deux fonds communs de\npeerspectives de la comppagnie, le\nrooposer à l’Assemblée Générale\nà 11h00, la distribution au titre de\namms par action.\nadership et la soliditéé de ses\nent de ses activités.\ngnnie-assurance-maroc": ""
            },
            {
                "COMMUNIQUÉ FINANCIER\nRÉSULLTTAATTS ANNUELS 2023\nCCrrooiissssaannncccceee dduu cchhiiffffrreee dddd’’’aaaffffaaiiress ppoorrttéée aussi bien par l’activité Vie q\nRésuullttaattss eenn pprrooggrreesssionn eennnn rraaiissoon de l’amélioration des indicateur\nLee CCoonseeiilll dddd’’AAddministrationn de Wafa Assurance s’est réuni le J\nPPrréésidence de Monsieur Bouubker JAI, en vue d’examiner l’activité\nlles comptes au 31 décembree 2023.\nRésultats sociaux\nChiffre d’affaires social (en MDH)\nEn 2023, le chiffre d’affaires social de Wa\n+7,1%\nsoit +7,1% par rapport à 2022.\n10 425 11 164\nLL’’activité Vie s’élève à 6 273 MDH en pro\nppeerrfformancee eenn EEppaarrggnnee eett PPrrévoyyance.\nLL’’activité Non-Vie progresse de +9,1%, à\nDéc 2022 Déc 2023\nperformance de l’ensemble des branches\nLe résultat Vie s’établit à 464 MDH en\nRésultat net social (en MDH)\ncroissance de l’activité en Epargne et en D\n+15,4%\n607 701 Le résultat Non-Vie ressort à 436 MDH en\nenregistré en 2022 (157 MDH), portée par l\nbonne tenue du résultat financierr..\nLe résultat net social atteint 701 MDH en\nDéc 2022 Déc 2023\nLes fonds propres sociaux s’élèvent à 6 6\nFonds propres sociaux (en MDH)\nRésultats consolidés\n+3,9%\n6 356 6 601\nAu 31 décembre 2023, le chiffre d’affai\n12 724 MDH enregistrant une hausse de\nréalisée sur l’ensemble des branches\nl’international.\nDéc 2022 Déc 2023\nLe RNPG de l’exercice 2023 ressort à 670 M\nde 13,6% impacté par l’évolution des marc\nChiffre d’affaires consolidé (en MDH)\ncourantes en 2023 (notamment le don au\n+9,3% effets du séisme d’Al Haouz).\n11 639 12 724\nLes capitaux propres part du groupe s’élè\n2023 vs. 8 057 MDH en 2022 en hausse de\nLe périmètre de consolidation, comprena\nDéc2022 Déc 2023 africaines, a connu courant 2023 l’entr\nplacement dédiés.\nRN Part du groupe (en MDH) Au vu des résultats enregistrés et des\nConseil d’Administration a décidé de p\n-13,6%\nOrdinaire, convoquée pour le 15 Mai 2024\n776 670\nl’exercice 2023, d’un dividende de 140 dirh\nWafa Assurance confirme ainsi son le\nfondamentaux, et poursuit le développem\nDéc2022 Déc 2023\nContact : information.financiere@wafaassurance.co.ma\nLien internet : https://www.wafaassurance.ma/fr/compa": "",
                "": "",
                "null": "cement dédiés.",
                "uue par l’activité Non--vie.\nss techniques et finannciers.\neuudi 14 mars 2024, sous la\ndee la compagnie et d’arrêter\nfa Assurance atteint 11 164 MDH,\ngression de +5,6% portéée par la\n4 891 MDH conséquemmment à la\nNoon-Vie.\npprogression de 1,5% suuite à la\néccès.\nprrogression par rapport aau niveau\na croissance de l’activité et par la\nprrogression de 15,4%.\n01 MDH en hausse de 3,9%.\nrees consolidé annuel s’établit à\n99,3% portée par la perfformance\nVie et Non-vie au Maroc et à\nDDH vs 776 MDH en 2022 en baisse\nhés financiers et les chaarges non\nfoonds spécial pour la gestion des\nvent à 9 232 MDH au 31 ddécembre\n144,6%.\nntt Wafa Assurance et sees filiales\néee de deux fonds communs de\npeerspectives de la comppagnie, le\nrooposer à l’Assemblée Générale\nà 11h00, la distribution au titre de\namms par action.\nadership et la soliditéé de ses\nent de ses activités.\ngnnie-assurance-maroc": ""
            },
            {
                "COMMUNIQUÉ FINANCIER\nRÉSULLTTAATTS ANNUELS 2023\nCCrrooiissssaannncccceee dduu cchhiiffffrreee dddd’’’aaaffffaaiiress ppoorrttéée aussi bien par l’activité Vie q\nRésuullttaattss eenn pprrooggrreesssionn eennnn rraaiissoon de l’amélioration des indicateur\nLee CCoonseeiilll dddd’’AAddministrationn de Wafa Assurance s’est réuni le J\nPPrréésidence de Monsieur Bouubker JAI, en vue d’examiner l’activité\nlles comptes au 31 décembree 2023.\nRésultats sociaux\nChiffre d’affaires social (en MDH)\nEn 2023, le chiffre d’affaires social de Wa\n+7,1%\nsoit +7,1% par rapport à 2022.\n10 425 11 164\nLL’’activité Vie s’élève à 6 273 MDH en pro\nppeerrfformancee eenn EEppaarrggnnee eett PPrrévoyyance.\nLL’’activité Non-Vie progresse de +9,1%, à\nDéc 2022 Déc 2023\nperformance de l’ensemble des branches\nLe résultat Vie s’établit à 464 MDH en\nRésultat net social (en MDH)\ncroissance de l’activité en Epargne et en D\n+15,4%\n607 701 Le résultat Non-Vie ressort à 436 MDH en\nenregistré en 2022 (157 MDH), portée par l\nbonne tenue du résultat financierr..\nLe résultat net social atteint 701 MDH en\nDéc 2022 Déc 2023\nLes fonds propres sociaux s’élèvent à 6 6\nFonds propres sociaux (en MDH)\nRésultats consolidés\n+3,9%\n6 356 6 601\nAu 31 décembre 2023, le chiffre d’affai\n12 724 MDH enregistrant une hausse de\nréalisée sur l’ensemble des branches\nl’international.\nDéc 2022 Déc 2023\nLe RNPG de l’exercice 2023 ressort à 670 M\nde 13,6% impacté par l’évolution des marc\nChiffre d’affaires consolidé (en MDH)\ncourantes en 2023 (notamment le don au\n+9,3% effets du séisme d’Al Haouz).\n11 639 12 724\nLes capitaux propres part du groupe s’élè\n2023 vs. 8 057 MDH en 2022 en hausse de\nLe périmètre de consolidation, comprena\nDéc2022 Déc 2023 africaines, a connu courant 2023 l’entr\nplacement dédiés.\nRN Part du groupe (en MDH) Au vu des résultats enregistrés et des\nConseil d’Administration a décidé de p\n-13,6%\nOrdinaire, convoquée pour le 15 Mai 2024\n776 670\nl’exercice 2023, d’un dividende de 140 dirh\nWafa Assurance confirme ainsi son le\nfondamentaux, et poursuit le développem\nDéc2022 Déc 2023\nContact : information.financiere@wafaassurance.co.ma\nLien internet : https://www.wafaassurance.ma/fr/compa": "",
                "": "",
                "null": "",
                "uue par l’activité Non--vie.\nss techniques et finannciers.\neuudi 14 mars 2024, sous la\ndee la compagnie et d’arrêter\nfa Assurance atteint 11 164 MDH,\ngression de +5,6% portéée par la\n4 891 MDH conséquemmment à la\nNoon-Vie.\npprogression de 1,5% suuite à la\néccès.\nprrogression par rapport aau niveau\na croissance de l’activité et par la\nprrogression de 15,4%.\n01 MDH en hausse de 3,9%.\nrees consolidé annuel s’établit à\n99,3% portée par la perfformance\nVie et Non-vie au Maroc et à\nDDH vs 776 MDH en 2022 en baisse\nhés financiers et les chaarges non\nfoonds spécial pour la gestion des\nvent à 9 232 MDH au 31 ddécembre\n144,6%.\nntt Wafa Assurance et sees filiales\néee de deux fonds communs de\npeerspectives de la comppagnie, le\nrooposer à l’Assemblée Générale\nà 11h00, la distribution au titre de\namms par action.\nadership et la soliditéé de ses\nent de ses activités.\ngnnie-assurance-maroc": ""
            },
            {
                "COMMUNIQUÉ FINANCIER\nRÉSULLTTAATTS ANNUELS 2023\nCCrrooiissssaannncccceee dduu cchhiiffffrreee dddd’’’aaaffffaaiiress ppoorrttéée aussi bien par l’activité Vie q\nRésuullttaattss eenn pprrooggrreesssionn eennnn rraaiissoon de l’amélioration des indicateur\nLee CCoonseeiilll dddd’’AAddministrationn de Wafa Assurance s’est réuni le J\nPPrréésidence de Monsieur Bouubker JAI, en vue d’examiner l’activité\nlles comptes au 31 décembree 2023.\nRésultats sociaux\nChiffre d’affaires social (en MDH)\nEn 2023, le chiffre d’affaires social de Wa\n+7,1%\nsoit +7,1% par rapport à 2022.\n10 425 11 164\nLL’’activité Vie s’élève à 6 273 MDH en pro\nppeerrfformancee eenn EEppaarrggnnee eett PPrrévoyyance.\nLL’’activité Non-Vie progresse de +9,1%, à\nDéc 2022 Déc 2023\nperformance de l’ensemble des branches\nLe résultat Vie s’établit à 464 MDH en\nRésultat net social (en MDH)\ncroissance de l’activité en Epargne et en D\n+15,4%\n607 701 Le résultat Non-Vie ressort à 436 MDH en\nenregistré en 2022 (157 MDH), portée par l\nbonne tenue du résultat financierr..\nLe résultat net social atteint 701 MDH en\nDéc 2022 Déc 2023\nLes fonds propres sociaux s’élèvent à 6 6\nFonds propres sociaux (en MDH)\nRésultats consolidés\n+3,9%\n6 356 6 601\nAu 31 décembre 2023, le chiffre d’affai\n12 724 MDH enregistrant une hausse de\nréalisée sur l’ensemble des branches\nl’international.\nDéc 2022 Déc 2023\nLe RNPG de l’exercice 2023 ressort à 670 M\nde 13,6% impacté par l’évolution des marc\nChiffre d’affaires consolidé (en MDH)\ncourantes en 2023 (notamment le don au\n+9,3% effets du séisme d’Al Haouz).\n11 639 12 724\nLes capitaux propres part du groupe s’élè\n2023 vs. 8 057 MDH en 2022 en hausse de\nLe périmètre de consolidation, comprena\nDéc2022 Déc 2023 africaines, a connu courant 2023 l’entr\nplacement dédiés.\nRN Part du groupe (en MDH) Au vu des résultats enregistrés et des\nConseil d’Administration a décidé de p\n-13,6%\nOrdinaire, convoquée pour le 15 Mai 2024\n776 670\nl’exercice 2023, d’un dividende de 140 dirh\nWafa Assurance confirme ainsi son le\nfondamentaux, et poursuit le développem\nDéc2022 Déc 2023\nContact : information.financiere@wafaassurance.co.ma\nLien internet : https://www.wafaassurance.ma/fr/compa": "",
                "": "",
                "null": "vu des résultats enregistrés et des",
                "uue par l’activité Non--vie.\nss techniques et finannciers.\neuudi 14 mars 2024, sous la\ndee la compagnie et d’arrêter\nfa Assurance atteint 11 164 MDH,\ngression de +5,6% portéée par la\n4 891 MDH conséquemmment à la\nNoon-Vie.\npprogression de 1,5% suuite à la\néccès.\nprrogression par rapport aau niveau\na croissance de l’activité et par la\nprrogression de 15,4%.\n01 MDH en hausse de 3,9%.\nrees consolidé annuel s’établit à\n99,3% portée par la perfformance\nVie et Non-vie au Maroc et à\nDDH vs 776 MDH en 2022 en baisse\nhés financiers et les chaarges non\nfoonds spécial pour la gestion des\nvent à 9 232 MDH au 31 ddécembre\n144,6%.\nntt Wafa Assurance et sees filiales\néee de deux fonds communs de\npeerspectives de la comppagnie, le\nrooposer à l’Assemblée Générale\nà 11h00, la distribution au titre de\namms par action.\nadership et la soliditéé de ses\nent de ses activités.\ngnnie-assurance-maroc": "peerspectives de la comppagnie, le"
            },
            {
                "COMMUNIQUÉ FINANCIER\nRÉSULLTTAATTS ANNUELS 2023\nCCrrooiissssaannncccceee dduu cchhiiffffrreee dddd’’’aaaffffaaiiress ppoorrttéée aussi bien par l’activité Vie q\nRésuullttaattss eenn pprrooggrreesssionn eennnn rraaiissoon de l’amélioration des indicateur\nLee CCoonseeiilll dddd’’AAddministrationn de Wafa Assurance s’est réuni le J\nPPrréésidence de Monsieur Bouubker JAI, en vue d’examiner l’activité\nlles comptes au 31 décembree 2023.\nRésultats sociaux\nChiffre d’affaires social (en MDH)\nEn 2023, le chiffre d’affaires social de Wa\n+7,1%\nsoit +7,1% par rapport à 2022.\n10 425 11 164\nLL’’activité Vie s’élève à 6 273 MDH en pro\nppeerrfformancee eenn EEppaarrggnnee eett PPrrévoyyance.\nLL’’activité Non-Vie progresse de +9,1%, à\nDéc 2022 Déc 2023\nperformance de l’ensemble des branches\nLe résultat Vie s’établit à 464 MDH en\nRésultat net social (en MDH)\ncroissance de l’activité en Epargne et en D\n+15,4%\n607 701 Le résultat Non-Vie ressort à 436 MDH en\nenregistré en 2022 (157 MDH), portée par l\nbonne tenue du résultat financierr..\nLe résultat net social atteint 701 MDH en\nDéc 2022 Déc 2023\nLes fonds propres sociaux s’élèvent à 6 6\nFonds propres sociaux (en MDH)\nRésultats consolidés\n+3,9%\n6 356 6 601\nAu 31 décembre 2023, le chiffre d’affai\n12 724 MDH enregistrant une hausse de\nréalisée sur l’ensemble des branches\nl’international.\nDéc 2022 Déc 2023\nLe RNPG de l’exercice 2023 ressort à 670 M\nde 13,6% impacté par l’évolution des marc\nChiffre d’affaires consolidé (en MDH)\ncourantes en 2023 (notamment le don au\n+9,3% effets du séisme d’Al Haouz).\n11 639 12 724\nLes capitaux propres part du groupe s’élè\n2023 vs. 8 057 MDH en 2022 en hausse de\nLe périmètre de consolidation, comprena\nDéc2022 Déc 2023 africaines, a connu courant 2023 l’entr\nplacement dédiés.\nRN Part du groupe (en MDH) Au vu des résultats enregistrés et des\nConseil d’Administration a décidé de p\n-13,6%\nOrdinaire, convoquée pour le 15 Mai 2024\n776 670\nl’exercice 2023, d’un dividende de 140 dirh\nWafa Assurance confirme ainsi son le\nfondamentaux, et poursuit le développem\nDéc2022 Déc 2023\nContact : information.financiere@wafaassurance.co.ma\nLien internet : https://www.wafaassurance.ma/fr/compa": "",
                "": "",
                "null": "",
                "uue par l’activité Non--vie.\nss techniques et finannciers.\neuudi 14 mars 2024, sous la\ndee la compagnie et d’arrêter\nfa Assurance atteint 11 164 MDH,\ngression de +5,6% portéée par la\n4 891 MDH conséquemmment à la\nNoon-Vie.\npprogression de 1,5% suuite à la\néccès.\nprrogression par rapport aau niveau\na croissance de l’activité et par la\nprrogression de 15,4%.\n01 MDH en hausse de 3,9%.\nrees consolidé annuel s’établit à\n99,3% portée par la perfformance\nVie et Non-vie au Maroc et à\nDDH vs 776 MDH en 2022 en baisse\nhés financiers et les chaarges non\nfoonds spécial pour la gestion des\nvent à 9 232 MDH au 31 ddécembre\n144,6%.\nntt Wafa Assurance et sees filiales\néee de deux fonds communs de\npeerspectives de la comppagnie, le\nrooposer à l’Assemblée Générale\nà 11h00, la distribution au titre de\namms par action.\nadership et la soliditéé de ses\nent de ses activités.\ngnnie-assurance-maroc": ""
            },
            {
                "COMMUNIQUÉ FINANCIER\nRÉSULLTTAATTS ANNUELS 2023\nCCrrooiissssaannncccceee dduu cchhiiffffrreee dddd’’’aaaffffaaiiress ppoorrttéée aussi bien par l’activité Vie q\nRésuullttaattss eenn pprrooggrreesssionn eennnn rraaiissoon de l’amélioration des indicateur\nLee CCoonseeiilll dddd’’AAddministrationn de Wafa Assurance s’est réuni le J\nPPrréésidence de Monsieur Bouubker JAI, en vue d’examiner l’activité\nlles comptes au 31 décembree 2023.\nRésultats sociaux\nChiffre d’affaires social (en MDH)\nEn 2023, le chiffre d’affaires social de Wa\n+7,1%\nsoit +7,1% par rapport à 2022.\n10 425 11 164\nLL’’activité Vie s’élève à 6 273 MDH en pro\nppeerrfformancee eenn EEppaarrggnnee eett PPrrévoyyance.\nLL’’activité Non-Vie progresse de +9,1%, à\nDéc 2022 Déc 2023\nperformance de l’ensemble des branches\nLe résultat Vie s’établit à 464 MDH en\nRésultat net social (en MDH)\ncroissance de l’activité en Epargne et en D\n+15,4%\n607 701 Le résultat Non-Vie ressort à 436 MDH en\nenregistré en 2022 (157 MDH), portée par l\nbonne tenue du résultat financierr..\nLe résultat net social atteint 701 MDH en\nDéc 2022 Déc 2023\nLes fonds propres sociaux s’élèvent à 6 6\nFonds propres sociaux (en MDH)\nRésultats consolidés\n+3,9%\n6 356 6 601\nAu 31 décembre 2023, le chiffre d’affai\n12 724 MDH enregistrant une hausse de\nréalisée sur l’ensemble des branches\nl’international.\nDéc 2022 Déc 2023\nLe RNPG de l’exercice 2023 ressort à 670 M\nde 13,6% impacté par l’évolution des marc\nChiffre d’affaires consolidé (en MDH)\ncourantes en 2023 (notamment le don au\n+9,3% effets du séisme d’Al Haouz).\n11 639 12 724\nLes capitaux propres part du groupe s’élè\n2023 vs. 8 057 MDH en 2022 en hausse de\nLe périmètre de consolidation, comprena\nDéc2022 Déc 2023 africaines, a connu courant 2023 l’entr\nplacement dédiés.\nRN Part du groupe (en MDH) Au vu des résultats enregistrés et des\nConseil d’Administration a décidé de p\n-13,6%\nOrdinaire, convoquée pour le 15 Mai 2024\n776 670\nl’exercice 2023, d’un dividende de 140 dirh\nWafa Assurance confirme ainsi son le\nfondamentaux, et poursuit le développem\nDéc2022 Déc 2023\nContact : information.financiere@wafaassurance.co.ma\nLien internet : https://www.wafaassurance.ma/fr/compa": "",
                "": "",
                "null": "",
                "uue par l’activité Non--vie.\nss techniques et finannciers.\neuudi 14 mars 2024, sous la\ndee la compagnie et d’arrêter\nfa Assurance atteint 11 164 MDH,\ngression de +5,6% portéée par la\n4 891 MDH conséquemmment à la\nNoon-Vie.\npprogression de 1,5% suuite à la\néccès.\nprrogression par rapport aau niveau\na croissance de l’activité et par la\nprrogression de 15,4%.\n01 MDH en hausse de 3,9%.\nrees consolidé annuel s’établit à\n99,3% portée par la perfformance\nVie et Non-vie au Maroc et à\nDDH vs 776 MDH en 2022 en baisse\nhés financiers et les chaarges non\nfoonds spécial pour la gestion des\nvent à 9 232 MDH au 31 ddécembre\n144,6%.\nntt Wafa Assurance et sees filiales\néee de deux fonds communs de\npeerspectives de la comppagnie, le\nrooposer à l’Assemblée Générale\nà 11h00, la distribution au titre de\namms par action.\nadership et la soliditéé de ses\nent de ses activités.\ngnnie-assurance-maroc": "rooposer à l’Assemblée Générale"
            },
            {
                "COMMUNIQUÉ FINANCIER\nRÉSULLTTAATTS ANNUELS 2023\nCCrrooiissssaannncccceee dduu cchhiiffffrreee dddd’’’aaaffffaaiiress ppoorrttéée aussi bien par l’activité Vie q\nRésuullttaattss eenn pprrooggrreesssionn eennnn rraaiissoon de l’amélioration des indicateur\nLee CCoonseeiilll dddd’’AAddministrationn de Wafa Assurance s’est réuni le J\nPPrréésidence de Monsieur Bouubker JAI, en vue d’examiner l’activité\nlles comptes au 31 décembree 2023.\nRésultats sociaux\nChiffre d’affaires social (en MDH)\nEn 2023, le chiffre d’affaires social de Wa\n+7,1%\nsoit +7,1% par rapport à 2022.\n10 425 11 164\nLL’’activité Vie s’élève à 6 273 MDH en pro\nppeerrfformancee eenn EEppaarrggnnee eett PPrrévoyyance.\nLL’’activité Non-Vie progresse de +9,1%, à\nDéc 2022 Déc 2023\nperformance de l’ensemble des branches\nLe résultat Vie s’établit à 464 MDH en\nRésultat net social (en MDH)\ncroissance de l’activité en Epargne et en D\n+15,4%\n607 701 Le résultat Non-Vie ressort à 436 MDH en\nenregistré en 2022 (157 MDH), portée par l\nbonne tenue du résultat financierr..\nLe résultat net social atteint 701 MDH en\nDéc 2022 Déc 2023\nLes fonds propres sociaux s’élèvent à 6 6\nFonds propres sociaux (en MDH)\nRésultats consolidés\n+3,9%\n6 356 6 601\nAu 31 décembre 2023, le chiffre d’affai\n12 724 MDH enregistrant une hausse de\nréalisée sur l’ensemble des branches\nl’international.\nDéc 2022 Déc 2023\nLe RNPG de l’exercice 2023 ressort à 670 M\nde 13,6% impacté par l’évolution des marc\nChiffre d’affaires consolidé (en MDH)\ncourantes en 2023 (notamment le don au\n+9,3% effets du séisme d’Al Haouz).\n11 639 12 724\nLes capitaux propres part du groupe s’élè\n2023 vs. 8 057 MDH en 2022 en hausse de\nLe périmètre de consolidation, comprena\nDéc2022 Déc 2023 africaines, a connu courant 2023 l’entr\nplacement dédiés.\nRN Part du groupe (en MDH) Au vu des résultats enregistrés et des\nConseil d’Administration a décidé de p\n-13,6%\nOrdinaire, convoquée pour le 15 Mai 2024\n776 670\nl’exercice 2023, d’un dividende de 140 dirh\nWafa Assurance confirme ainsi son le\nfondamentaux, et poursuit le développem\nDéc2022 Déc 2023\nContact : information.financiere@wafaassurance.co.ma\nLien internet : https://www.wafaassurance.ma/fr/compa": "",
                "": "",
                "null": "",
                "uue par l’activité Non--vie.\nss techniques et finannciers.\neuudi 14 mars 2024, sous la\ndee la compagnie et d’arrêter\nfa Assurance atteint 11 164 MDH,\ngression de +5,6% portéée par la\n4 891 MDH conséquemmment à la\nNoon-Vie.\npprogression de 1,5% suuite à la\néccès.\nprrogression par rapport aau niveau\na croissance de l’activité et par la\nprrogression de 15,4%.\n01 MDH en hausse de 3,9%.\nrees consolidé annuel s’établit à\n99,3% portée par la perfformance\nVie et Non-vie au Maroc et à\nDDH vs 776 MDH en 2022 en baisse\nhés financiers et les chaarges non\nfoonds spécial pour la gestion des\nvent à 9 232 MDH au 31 ddécembre\n144,6%.\nntt Wafa Assurance et sees filiales\néee de deux fonds communs de\npeerspectives de la comppagnie, le\nrooposer à l’Assemblée Générale\nà 11h00, la distribution au titre de\namms par action.\nadership et la soliditéé de ses\nent de ses activités.\ngnnie-assurance-maroc": ""
            },
            {
                "COMMUNIQUÉ FINANCIER\nRÉSULLTTAATTS ANNUELS 2023\nCCrrooiissssaannncccceee dduu cchhiiffffrreee dddd’’’aaaffffaaiiress ppoorrttéée aussi bien par l’activité Vie q\nRésuullttaattss eenn pprrooggrreesssionn eennnn rraaiissoon de l’amélioration des indicateur\nLee CCoonseeiilll dddd’’AAddministrationn de Wafa Assurance s’est réuni le J\nPPrréésidence de Monsieur Bouubker JAI, en vue d’examiner l’activité\nlles comptes au 31 décembree 2023.\nRésultats sociaux\nChiffre d’affaires social (en MDH)\nEn 2023, le chiffre d’affaires social de Wa\n+7,1%\nsoit +7,1% par rapport à 2022.\n10 425 11 164\nLL’’activité Vie s’élève à 6 273 MDH en pro\nppeerrfformancee eenn EEppaarrggnnee eett PPrrévoyyance.\nLL’’activité Non-Vie progresse de +9,1%, à\nDéc 2022 Déc 2023\nperformance de l’ensemble des branches\nLe résultat Vie s’établit à 464 MDH en\nRésultat net social (en MDH)\ncroissance de l’activité en Epargne et en D\n+15,4%\n607 701 Le résultat Non-Vie ressort à 436 MDH en\nenregistré en 2022 (157 MDH), portée par l\nbonne tenue du résultat financierr..\nLe résultat net social atteint 701 MDH en\nDéc 2022 Déc 2023\nLes fonds propres sociaux s’élèvent à 6 6\nFonds propres sociaux (en MDH)\nRésultats consolidés\n+3,9%\n6 356 6 601\nAu 31 décembre 2023, le chiffre d’affai\n12 724 MDH enregistrant une hausse de\nréalisée sur l’ensemble des branches\nl’international.\nDéc 2022 Déc 2023\nLe RNPG de l’exercice 2023 ressort à 670 M\nde 13,6% impacté par l’évolution des marc\nChiffre d’affaires consolidé (en MDH)\ncourantes en 2023 (notamment le don au\n+9,3% effets du séisme d’Al Haouz).\n11 639 12 724\nLes capitaux propres part du groupe s’élè\n2023 vs. 8 057 MDH en 2022 en hausse de\nLe périmètre de consolidation, comprena\nDéc2022 Déc 2023 africaines, a connu courant 2023 l’entr\nplacement dédiés.\nRN Part du groupe (en MDH) Au vu des résultats enregistrés et des\nConseil d’Administration a décidé de p\n-13,6%\nOrdinaire, convoquée pour le 15 Mai 2024\n776 670\nl’exercice 2023, d’un dividende de 140 dirh\nWafa Assurance confirme ainsi son le\nfondamentaux, et poursuit le développem\nDéc2022 Déc 2023\nContact : information.financiere@wafaassurance.co.ma\nLien internet : https://www.wafaassurance.ma/fr/compa": "",
                "": "",
                "null": "inaire, convoquée pour le 15 Mai 2024",
                "uue par l’activité Non--vie.\nss techniques et finannciers.\neuudi 14 mars 2024, sous la\ndee la compagnie et d’arrêter\nfa Assurance atteint 11 164 MDH,\ngression de +5,6% portéée par la\n4 891 MDH conséquemmment à la\nNoon-Vie.\npprogression de 1,5% suuite à la\néccès.\nprrogression par rapport aau niveau\na croissance de l’activité et par la\nprrogression de 15,4%.\n01 MDH en hausse de 3,9%.\nrees consolidé annuel s’établit à\n99,3% portée par la perfformance\nVie et Non-vie au Maroc et à\nDDH vs 776 MDH en 2022 en baisse\nhés financiers et les chaarges non\nfoonds spécial pour la gestion des\nvent à 9 232 MDH au 31 ddécembre\n144,6%.\nntt Wafa Assurance et sees filiales\néee de deux fonds communs de\npeerspectives de la comppagnie, le\nrooposer à l’Assemblée Générale\nà 11h00, la distribution au titre de\namms par action.\nadership et la soliditéé de ses\nent de ses activités.\ngnnie-assurance-maroc": "à 11h00, la distribution au titre de"
            },
            {
                "COMMUNIQUÉ FINANCIER\nRÉSULLTTAATTS ANNUELS 2023\nCCrrooiissssaannncccceee dduu cchhiiffffrreee dddd’’’aaaffffaaiiress ppoorrttéée aussi bien par l’activité Vie q\nRésuullttaattss eenn pprrooggrreesssionn eennnn rraaiissoon de l’amélioration des indicateur\nLee CCoonseeiilll dddd’’AAddministrationn de Wafa Assurance s’est réuni le J\nPPrréésidence de Monsieur Bouubker JAI, en vue d’examiner l’activité\nlles comptes au 31 décembree 2023.\nRésultats sociaux\nChiffre d’affaires social (en MDH)\nEn 2023, le chiffre d’affaires social de Wa\n+7,1%\nsoit +7,1% par rapport à 2022.\n10 425 11 164\nLL’’activité Vie s’élève à 6 273 MDH en pro\nppeerrfformancee eenn EEppaarrggnnee eett PPrrévoyyance.\nLL’’activité Non-Vie progresse de +9,1%, à\nDéc 2022 Déc 2023\nperformance de l’ensemble des branches\nLe résultat Vie s’établit à 464 MDH en\nRésultat net social (en MDH)\ncroissance de l’activité en Epargne et en D\n+15,4%\n607 701 Le résultat Non-Vie ressort à 436 MDH en\nenregistré en 2022 (157 MDH), portée par l\nbonne tenue du résultat financierr..\nLe résultat net social atteint 701 MDH en\nDéc 2022 Déc 2023\nLes fonds propres sociaux s’élèvent à 6 6\nFonds propres sociaux (en MDH)\nRésultats consolidés\n+3,9%\n6 356 6 601\nAu 31 décembre 2023, le chiffre d’affai\n12 724 MDH enregistrant une hausse de\nréalisée sur l’ensemble des branches\nl’international.\nDéc 2022 Déc 2023\nLe RNPG de l’exercice 2023 ressort à 670 M\nde 13,6% impacté par l’évolution des marc\nChiffre d’affaires consolidé (en MDH)\ncourantes en 2023 (notamment le don au\n+9,3% effets du séisme d’Al Haouz).\n11 639 12 724\nLes capitaux propres part du groupe s’élè\n2023 vs. 8 057 MDH en 2022 en hausse de\nLe périmètre de consolidation, comprena\nDéc2022 Déc 2023 africaines, a connu courant 2023 l’entr\nplacement dédiés.\nRN Part du groupe (en MDH) Au vu des résultats enregistrés et des\nConseil d’Administration a décidé de p\n-13,6%\nOrdinaire, convoquée pour le 15 Mai 2024\n776 670\nl’exercice 2023, d’un dividende de 140 dirh\nWafa Assurance confirme ainsi son le\nfondamentaux, et poursuit le développem\nDéc2022 Déc 2023\nContact : information.financiere@wafaassurance.co.ma\nLien internet : https://www.wafaassurance.ma/fr/compa": "",
                "": "",
                "null": "",
                "uue par l’activité Non--vie.\nss techniques et finannciers.\neuudi 14 mars 2024, sous la\ndee la compagnie et d’arrêter\nfa Assurance atteint 11 164 MDH,\ngression de +5,6% portéée par la\n4 891 MDH conséquemmment à la\nNoon-Vie.\npprogression de 1,5% suuite à la\néccès.\nprrogression par rapport aau niveau\na croissance de l’activité et par la\nprrogression de 15,4%.\n01 MDH en hausse de 3,9%.\nrees consolidé annuel s’établit à\n99,3% portée par la perfformance\nVie et Non-vie au Maroc et à\nDDH vs 776 MDH en 2022 en baisse\nhés financiers et les chaarges non\nfoonds spécial pour la gestion des\nvent à 9 232 MDH au 31 ddécembre\n144,6%.\nntt Wafa Assurance et sees filiales\néee de deux fonds communs de\npeerspectives de la comppagnie, le\nrooposer à l’Assemblée Générale\nà 11h00, la distribution au titre de\namms par action.\nadership et la soliditéé de ses\nent de ses activités.\ngnnie-assurance-maroc": "amms par action."
            },
            {
                "COMMUNIQUÉ FINANCIER\nRÉSULLTTAATTS ANNUELS 2023\nCCrrooiissssaannncccceee dduu cchhiiffffrreee dddd’’’aaaffffaaiiress ppoorrttéée aussi bien par l’activité Vie q\nRésuullttaattss eenn pprrooggrreesssionn eennnn rraaiissoon de l’amélioration des indicateur\nLee CCoonseeiilll dddd’’AAddministrationn de Wafa Assurance s’est réuni le J\nPPrréésidence de Monsieur Bouubker JAI, en vue d’examiner l’activité\nlles comptes au 31 décembree 2023.\nRésultats sociaux\nChiffre d’affaires social (en MDH)\nEn 2023, le chiffre d’affaires social de Wa\n+7,1%\nsoit +7,1% par rapport à 2022.\n10 425 11 164\nLL’’activité Vie s’élève à 6 273 MDH en pro\nppeerrfformancee eenn EEppaarrggnnee eett PPrrévoyyance.\nLL’’activité Non-Vie progresse de +9,1%, à\nDéc 2022 Déc 2023\nperformance de l’ensemble des branches\nLe résultat Vie s’établit à 464 MDH en\nRésultat net social (en MDH)\ncroissance de l’activité en Epargne et en D\n+15,4%\n607 701 Le résultat Non-Vie ressort à 436 MDH en\nenregistré en 2022 (157 MDH), portée par l\nbonne tenue du résultat financierr..\nLe résultat net social atteint 701 MDH en\nDéc 2022 Déc 2023\nLes fonds propres sociaux s’élèvent à 6 6\nFonds propres sociaux (en MDH)\nRésultats consolidés\n+3,9%\n6 356 6 601\nAu 31 décembre 2023, le chiffre d’affai\n12 724 MDH enregistrant une hausse de\nréalisée sur l’ensemble des branches\nl’international.\nDéc 2022 Déc 2023\nLe RNPG de l’exercice 2023 ressort à 670 M\nde 13,6% impacté par l’évolution des marc\nChiffre d’affaires consolidé (en MDH)\ncourantes en 2023 (notamment le don au\n+9,3% effets du séisme d’Al Haouz).\n11 639 12 724\nLes capitaux propres part du groupe s’élè\n2023 vs. 8 057 MDH en 2022 en hausse de\nLe périmètre de consolidation, comprena\nDéc2022 Déc 2023 africaines, a connu courant 2023 l’entr\nplacement dédiés.\nRN Part du groupe (en MDH) Au vu des résultats enregistrés et des\nConseil d’Administration a décidé de p\n-13,6%\nOrdinaire, convoquée pour le 15 Mai 2024\n776 670\nl’exercice 2023, d’un dividende de 140 dirh\nWafa Assurance confirme ainsi son le\nfondamentaux, et poursuit le développem\nDéc2022 Déc 2023\nContact : information.financiere@wafaassurance.co.ma\nLien internet : https://www.wafaassurance.ma/fr/compa": "",
                "": "",
                "null": "ercice 2023, d’un dividende de 140 dirh",
                "uue par l’activité Non--vie.\nss techniques et finannciers.\neuudi 14 mars 2024, sous la\ndee la compagnie et d’arrêter\nfa Assurance atteint 11 164 MDH,\ngression de +5,6% portéée par la\n4 891 MDH conséquemmment à la\nNoon-Vie.\npprogression de 1,5% suuite à la\néccès.\nprrogression par rapport aau niveau\na croissance de l’activité et par la\nprrogression de 15,4%.\n01 MDH en hausse de 3,9%.\nrees consolidé annuel s’établit à\n99,3% portée par la perfformance\nVie et Non-vie au Maroc et à\nDDH vs 776 MDH en 2022 en baisse\nhés financiers et les chaarges non\nfoonds spécial pour la gestion des\nvent à 9 232 MDH au 31 ddécembre\n144,6%.\nntt Wafa Assurance et sees filiales\néee de deux fonds communs de\npeerspectives de la comppagnie, le\nrooposer à l’Assemblée Générale\nà 11h00, la distribution au titre de\namms par action.\nadership et la soliditéé de ses\nent de ses activités.\ngnnie-assurance-maroc": ""
            },
            {
                "COMMUNIQUÉ FINANCIER\nRÉSULLTTAATTS ANNUELS 2023\nCCrrooiissssaannncccceee dduu cchhiiffffrreee dddd’’’aaaffffaaiiress ppoorrttéée aussi bien par l’activité Vie q\nRésuullttaattss eenn pprrooggrreesssionn eennnn rraaiissoon de l’amélioration des indicateur\nLee CCoonseeiilll dddd’’AAddministrationn de Wafa Assurance s’est réuni le J\nPPrréésidence de Monsieur Bouubker JAI, en vue d’examiner l’activité\nlles comptes au 31 décembree 2023.\nRésultats sociaux\nChiffre d’affaires social (en MDH)\nEn 2023, le chiffre d’affaires social de Wa\n+7,1%\nsoit +7,1% par rapport à 2022.\n10 425 11 164\nLL’’activité Vie s’élève à 6 273 MDH en pro\nppeerrfformancee eenn EEppaarrggnnee eett PPrrévoyyance.\nLL’’activité Non-Vie progresse de +9,1%, à\nDéc 2022 Déc 2023\nperformance de l’ensemble des branches\nLe résultat Vie s’établit à 464 MDH en\nRésultat net social (en MDH)\ncroissance de l’activité en Epargne et en D\n+15,4%\n607 701 Le résultat Non-Vie ressort à 436 MDH en\nenregistré en 2022 (157 MDH), portée par l\nbonne tenue du résultat financierr..\nLe résultat net social atteint 701 MDH en\nDéc 2022 Déc 2023\nLes fonds propres sociaux s’élèvent à 6 6\nFonds propres sociaux (en MDH)\nRésultats consolidés\n+3,9%\n6 356 6 601\nAu 31 décembre 2023, le chiffre d’affai\n12 724 MDH enregistrant une hausse de\nréalisée sur l’ensemble des branches\nl’international.\nDéc 2022 Déc 2023\nLe RNPG de l’exercice 2023 ressort à 670 M\nde 13,6% impacté par l’évolution des marc\nChiffre d’affaires consolidé (en MDH)\ncourantes en 2023 (notamment le don au\n+9,3% effets du séisme d’Al Haouz).\n11 639 12 724\nLes capitaux propres part du groupe s’élè\n2023 vs. 8 057 MDH en 2022 en hausse de\nLe périmètre de consolidation, comprena\nDéc2022 Déc 2023 africaines, a connu courant 2023 l’entr\nplacement dédiés.\nRN Part du groupe (en MDH) Au vu des résultats enregistrés et des\nConseil d’Administration a décidé de p\n-13,6%\nOrdinaire, convoquée pour le 15 Mai 2024\n776 670\nl’exercice 2023, d’un dividende de 140 dirh\nWafa Assurance confirme ainsi son le\nfondamentaux, et poursuit le développem\nDéc2022 Déc 2023\nContact : information.financiere@wafaassurance.co.ma\nLien internet : https://www.wafaassurance.ma/fr/compa": "",
                "": "",
                "null": "",
                "uue par l’activité Non--vie.\nss techniques et finannciers.\neuudi 14 mars 2024, sous la\ndee la compagnie et d’arrêter\nfa Assurance atteint 11 164 MDH,\ngression de +5,6% portéée par la\n4 891 MDH conséquemmment à la\nNoon-Vie.\npprogression de 1,5% suuite à la\néccès.\nprrogression par rapport aau niveau\na croissance de l’activité et par la\nprrogression de 15,4%.\n01 MDH en hausse de 3,9%.\nrees consolidé annuel s’établit à\n99,3% portée par la perfformance\nVie et Non-vie au Maroc et à\nDDH vs 776 MDH en 2022 en baisse\nhés financiers et les chaarges non\nfoonds spécial pour la gestion des\nvent à 9 232 MDH au 31 ddécembre\n144,6%.\nntt Wafa Assurance et sees filiales\néee de deux fonds communs de\npeerspectives de la comppagnie, le\nrooposer à l’Assemblée Générale\nà 11h00, la distribution au titre de\namms par action.\nadership et la soliditéé de ses\nent de ses activités.\ngnnie-assurance-maroc": ""
            },
            {
                "COMMUNIQUÉ FINANCIER\nRÉSULLTTAATTS ANNUELS 2023\nCCrrooiissssaannncccceee dduu cchhiiffffrreee dddd’’’aaaffffaaiiress ppoorrttéée aussi bien par l’activité Vie q\nRésuullttaattss eenn pprrooggrreesssionn eennnn rraaiissoon de l’amélioration des indicateur\nLee CCoonseeiilll dddd’’AAddministrationn de Wafa Assurance s’est réuni le J\nPPrréésidence de Monsieur Bouubker JAI, en vue d’examiner l’activité\nlles comptes au 31 décembree 2023.\nRésultats sociaux\nChiffre d’affaires social (en MDH)\nEn 2023, le chiffre d’affaires social de Wa\n+7,1%\nsoit +7,1% par rapport à 2022.\n10 425 11 164\nLL’’activité Vie s’élève à 6 273 MDH en pro\nppeerrfformancee eenn EEppaarrggnnee eett PPrrévoyyance.\nLL’’activité Non-Vie progresse de +9,1%, à\nDéc 2022 Déc 2023\nperformance de l’ensemble des branches\nLe résultat Vie s’établit à 464 MDH en\nRésultat net social (en MDH)\ncroissance de l’activité en Epargne et en D\n+15,4%\n607 701 Le résultat Non-Vie ressort à 436 MDH en\nenregistré en 2022 (157 MDH), portée par l\nbonne tenue du résultat financierr..\nLe résultat net social atteint 701 MDH en\nDéc 2022 Déc 2023\nLes fonds propres sociaux s’élèvent à 6 6\nFonds propres sociaux (en MDH)\nRésultats consolidés\n+3,9%\n6 356 6 601\nAu 31 décembre 2023, le chiffre d’affai\n12 724 MDH enregistrant une hausse de\nréalisée sur l’ensemble des branches\nl’international.\nDéc 2022 Déc 2023\nLe RNPG de l’exercice 2023 ressort à 670 M\nde 13,6% impacté par l’évolution des marc\nChiffre d’affaires consolidé (en MDH)\ncourantes en 2023 (notamment le don au\n+9,3% effets du séisme d’Al Haouz).\n11 639 12 724\nLes capitaux propres part du groupe s’élè\n2023 vs. 8 057 MDH en 2022 en hausse de\nLe périmètre de consolidation, comprena\nDéc2022 Déc 2023 africaines, a connu courant 2023 l’entr\nplacement dédiés.\nRN Part du groupe (en MDH) Au vu des résultats enregistrés et des\nConseil d’Administration a décidé de p\n-13,6%\nOrdinaire, convoquée pour le 15 Mai 2024\n776 670\nl’exercice 2023, d’un dividende de 140 dirh\nWafa Assurance confirme ainsi son le\nfondamentaux, et poursuit le développem\nDéc2022 Déc 2023\nContact : information.financiere@wafaassurance.co.ma\nLien internet : https://www.wafaassurance.ma/fr/compa": "",
                "": "",
                "null": "",
                "uue par l’activité Non--vie.\nss techniques et finannciers.\neuudi 14 mars 2024, sous la\ndee la compagnie et d’arrêter\nfa Assurance atteint 11 164 MDH,\ngression de +5,6% portéée par la\n4 891 MDH conséquemmment à la\nNoon-Vie.\npprogression de 1,5% suuite à la\néccès.\nprrogression par rapport aau niveau\na croissance de l’activité et par la\nprrogression de 15,4%.\n01 MDH en hausse de 3,9%.\nrees consolidé annuel s’établit à\n99,3% portée par la perfformance\nVie et Non-vie au Maroc et à\nDDH vs 776 MDH en 2022 en baisse\nhés financiers et les chaarges non\nfoonds spécial pour la gestion des\nvent à 9 232 MDH au 31 ddécembre\n144,6%.\nntt Wafa Assurance et sees filiales\néee de deux fonds communs de\npeerspectives de la comppagnie, le\nrooposer à l’Assemblée Générale\nà 11h00, la distribution au titre de\namms par action.\nadership et la soliditéé de ses\nent de ses activités.\ngnnie-assurance-maroc": "adership et la soliditéé de ses"
            },
            {
                "COMMUNIQUÉ FINANCIER\nRÉSULLTTAATTS ANNUELS 2023\nCCrrooiissssaannncccceee dduu cchhiiffffrreee dddd’’’aaaffffaaiiress ppoorrttéée aussi bien par l’activité Vie q\nRésuullttaattss eenn pprrooggrreesssionn eennnn rraaiissoon de l’amélioration des indicateur\nLee CCoonseeiilll dddd’’AAddministrationn de Wafa Assurance s’est réuni le J\nPPrréésidence de Monsieur Bouubker JAI, en vue d’examiner l’activité\nlles comptes au 31 décembree 2023.\nRésultats sociaux\nChiffre d’affaires social (en MDH)\nEn 2023, le chiffre d’affaires social de Wa\n+7,1%\nsoit +7,1% par rapport à 2022.\n10 425 11 164\nLL’’activité Vie s’élève à 6 273 MDH en pro\nppeerrfformancee eenn EEppaarrggnnee eett PPrrévoyyance.\nLL’’activité Non-Vie progresse de +9,1%, à\nDéc 2022 Déc 2023\nperformance de l’ensemble des branches\nLe résultat Vie s’établit à 464 MDH en\nRésultat net social (en MDH)\ncroissance de l’activité en Epargne et en D\n+15,4%\n607 701 Le résultat Non-Vie ressort à 436 MDH en\nenregistré en 2022 (157 MDH), portée par l\nbonne tenue du résultat financierr..\nLe résultat net social atteint 701 MDH en\nDéc 2022 Déc 2023\nLes fonds propres sociaux s’élèvent à 6 6\nFonds propres sociaux (en MDH)\nRésultats consolidés\n+3,9%\n6 356 6 601\nAu 31 décembre 2023, le chiffre d’affai\n12 724 MDH enregistrant une hausse de\nréalisée sur l’ensemble des branches\nl’international.\nDéc 2022 Déc 2023\nLe RNPG de l’exercice 2023 ressort à 670 M\nde 13,6% impacté par l’évolution des marc\nChiffre d’affaires consolidé (en MDH)\ncourantes en 2023 (notamment le don au\n+9,3% effets du séisme d’Al Haouz).\n11 639 12 724\nLes capitaux propres part du groupe s’élè\n2023 vs. 8 057 MDH en 2022 en hausse de\nLe périmètre de consolidation, comprena\nDéc2022 Déc 2023 africaines, a connu courant 2023 l’entr\nplacement dédiés.\nRN Part du groupe (en MDH) Au vu des résultats enregistrés et des\nConseil d’Administration a décidé de p\n-13,6%\nOrdinaire, convoquée pour le 15 Mai 2024\n776 670\nl’exercice 2023, d’un dividende de 140 dirh\nWafa Assurance confirme ainsi son le\nfondamentaux, et poursuit le développem\nDéc2022 Déc 2023\nContact : information.financiere@wafaassurance.co.ma\nLien internet : https://www.wafaassurance.ma/fr/compa": "",
                "": "",
                "null": "",
                "uue par l’activité Non--vie.\nss techniques et finannciers.\neuudi 14 mars 2024, sous la\ndee la compagnie et d’arrêter\nfa Assurance atteint 11 164 MDH,\ngression de +5,6% portéée par la\n4 891 MDH conséquemmment à la\nNoon-Vie.\npprogression de 1,5% suuite à la\néccès.\nprrogression par rapport aau niveau\na croissance de l’activité et par la\nprrogression de 15,4%.\n01 MDH en hausse de 3,9%.\nrees consolidé annuel s’établit à\n99,3% portée par la perfformance\nVie et Non-vie au Maroc et à\nDDH vs 776 MDH en 2022 en baisse\nhés financiers et les chaarges non\nfoonds spécial pour la gestion des\nvent à 9 232 MDH au 31 ddécembre\n144,6%.\nntt Wafa Assurance et sees filiales\néee de deux fonds communs de\npeerspectives de la comppagnie, le\nrooposer à l’Assemblée Générale\nà 11h00, la distribution au titre de\namms par action.\nadership et la soliditéé de ses\nent de ses activités.\ngnnie-assurance-maroc": "ent de ses activités.\ngnnie-assurance-maroc"
            },
            {
                "COMMUNIQUÉ FINANCIER\nRÉSULLTTAATTS ANNUELS 2023\nCCrrooiissssaannncccceee dduu cchhiiffffrreee dddd’’’aaaffffaaiiress ppoorrttéée aussi bien par l’activité Vie q\nRésuullttaattss eenn pprrooggrreesssionn eennnn rraaiissoon de l’amélioration des indicateur\nLee CCoonseeiilll dddd’’AAddministrationn de Wafa Assurance s’est réuni le J\nPPrréésidence de Monsieur Bouubker JAI, en vue d’examiner l’activité\nlles comptes au 31 décembree 2023.\nRésultats sociaux\nChiffre d’affaires social (en MDH)\nEn 2023, le chiffre d’affaires social de Wa\n+7,1%\nsoit +7,1% par rapport à 2022.\n10 425 11 164\nLL’’activité Vie s’élève à 6 273 MDH en pro\nppeerrfformancee eenn EEppaarrggnnee eett PPrrévoyyance.\nLL’’activité Non-Vie progresse de +9,1%, à\nDéc 2022 Déc 2023\nperformance de l’ensemble des branches\nLe résultat Vie s’établit à 464 MDH en\nRésultat net social (en MDH)\ncroissance de l’activité en Epargne et en D\n+15,4%\n607 701 Le résultat Non-Vie ressort à 436 MDH en\nenregistré en 2022 (157 MDH), portée par l\nbonne tenue du résultat financierr..\nLe résultat net social atteint 701 MDH en\nDéc 2022 Déc 2023\nLes fonds propres sociaux s’élèvent à 6 6\nFonds propres sociaux (en MDH)\nRésultats consolidés\n+3,9%\n6 356 6 601\nAu 31 décembre 2023, le chiffre d’affai\n12 724 MDH enregistrant une hausse de\nréalisée sur l’ensemble des branches\nl’international.\nDéc 2022 Déc 2023\nLe RNPG de l’exercice 2023 ressort à 670 M\nde 13,6% impacté par l’évolution des marc\nChiffre d’affaires consolidé (en MDH)\ncourantes en 2023 (notamment le don au\n+9,3% effets du séisme d’Al Haouz).\n11 639 12 724\nLes capitaux propres part du groupe s’élè\n2023 vs. 8 057 MDH en 2022 en hausse de\nLe périmètre de consolidation, comprena\nDéc2022 Déc 2023 africaines, a connu courant 2023 l’entr\nplacement dédiés.\nRN Part du groupe (en MDH) Au vu des résultats enregistrés et des\nConseil d’Administration a décidé de p\n-13,6%\nOrdinaire, convoquée pour le 15 Mai 2024\n776 670\nl’exercice 2023, d’un dividende de 140 dirh\nWafa Assurance confirme ainsi son le\nfondamentaux, et poursuit le développem\nDéc2022 Déc 2023\nContact : information.financiere@wafaassurance.co.ma\nLien internet : https://www.wafaassurance.ma/fr/compa": "",
                "": "",
                "null": "",
                "uue par l’activité Non--vie.\nss techniques et finannciers.\neuudi 14 mars 2024, sous la\ndee la compagnie et d’arrêter\nfa Assurance atteint 11 164 MDH,\ngression de +5,6% portéée par la\n4 891 MDH conséquemmment à la\nNoon-Vie.\npprogression de 1,5% suuite à la\néccès.\nprrogression par rapport aau niveau\na croissance de l’activité et par la\nprrogression de 15,4%.\n01 MDH en hausse de 3,9%.\nrees consolidé annuel s’établit à\n99,3% portée par la perfformance\nVie et Non-vie au Maroc et à\nDDH vs 776 MDH en 2022 en baisse\nhés financiers et les chaarges non\nfoonds spécial pour la gestion des\nvent à 9 232 MDH au 31 ddécembre\n144,6%.\nntt Wafa Assurance et sees filiales\néee de deux fonds communs de\npeerspectives de la comppagnie, le\nrooposer à l’Assemblée Générale\nà 11h00, la distribution au titre de\namms par action.\nadership et la soliditéé de ses\nent de ses activités.\ngnnie-assurance-maroc": ""
            },
            {
                "COMMUNIQUÉ FINANCIER\nRÉSULLTTAATTS ANNUELS 2023\nCCrrooiissssaannncccceee dduu cchhiiffffrreee dddd’’’aaaffffaaiiress ppoorrttéée aussi bien par l’activité Vie q\nRésuullttaattss eenn pprrooggrreesssionn eennnn rraaiissoon de l’amélioration des indicateur\nLee CCoonseeiilll dddd’’AAddministrationn de Wafa Assurance s’est réuni le J\nPPrréésidence de Monsieur Bouubker JAI, en vue d’examiner l’activité\nlles comptes au 31 décembree 2023.\nRésultats sociaux\nChiffre d’affaires social (en MDH)\nEn 2023, le chiffre d’affaires social de Wa\n+7,1%\nsoit +7,1% par rapport à 2022.\n10 425 11 164\nLL’’activité Vie s’élève à 6 273 MDH en pro\nppeerrfformancee eenn EEppaarrggnnee eett PPrrévoyyance.\nLL’’activité Non-Vie progresse de +9,1%, à\nDéc 2022 Déc 2023\nperformance de l’ensemble des branches\nLe résultat Vie s’établit à 464 MDH en\nRésultat net social (en MDH)\ncroissance de l’activité en Epargne et en D\n+15,4%\n607 701 Le résultat Non-Vie ressort à 436 MDH en\nenregistré en 2022 (157 MDH), portée par l\nbonne tenue du résultat financierr..\nLe résultat net social atteint 701 MDH en\nDéc 2022 Déc 2023\nLes fonds propres sociaux s’élèvent à 6 6\nFonds propres sociaux (en MDH)\nRésultats consolidés\n+3,9%\n6 356 6 601\nAu 31 décembre 2023, le chiffre d’affai\n12 724 MDH enregistrant une hausse de\nréalisée sur l’ensemble des branches\nl’international.\nDéc 2022 Déc 2023\nLe RNPG de l’exercice 2023 ressort à 670 M\nde 13,6% impacté par l’évolution des marc\nChiffre d’affaires consolidé (en MDH)\ncourantes en 2023 (notamment le don au\n+9,3% effets du séisme d’Al Haouz).\n11 639 12 724\nLes capitaux propres part du groupe s’élè\n2023 vs. 8 057 MDH en 2022 en hausse de\nLe périmètre de consolidation, comprena\nDéc2022 Déc 2023 africaines, a connu courant 2023 l’entr\nplacement dédiés.\nRN Part du groupe (en MDH) Au vu des résultats enregistrés et des\nConseil d’Administration a décidé de p\n-13,6%\nOrdinaire, convoquée pour le 15 Mai 2024\n776 670\nl’exercice 2023, d’un dividende de 140 dirh\nWafa Assurance confirme ainsi son le\nfondamentaux, et poursuit le développem\nDéc2022 Déc 2023\nContact : information.financiere@wafaassurance.co.ma\nLien internet : https://www.wafaassurance.ma/fr/compa": "",
                "": "",
                "null": "",
                "uue par l’activité Non--vie.\nss techniques et finannciers.\neuudi 14 mars 2024, sous la\ndee la compagnie et d’arrêter\nfa Assurance atteint 11 164 MDH,\ngression de +5,6% portéée par la\n4 891 MDH conséquemmment à la\nNoon-Vie.\npprogression de 1,5% suuite à la\néccès.\nprrogression par rapport aau niveau\na croissance de l’activité et par la\nprrogression de 15,4%.\n01 MDH en hausse de 3,9%.\nrees consolidé annuel s’établit à\n99,3% portée par la perfformance\nVie et Non-vie au Maroc et à\nDDH vs 776 MDH en 2022 en baisse\nhés financiers et les chaarges non\nfoonds spécial pour la gestion des\nvent à 9 232 MDH au 31 ddécembre\n144,6%.\nntt Wafa Assurance et sees filiales\néee de deux fonds communs de\npeerspectives de la comppagnie, le\nrooposer à l’Assemblée Générale\nà 11h00, la distribution au titre de\namms par action.\nadership et la soliditéé de ses\nent de ses activités.\ngnnie-assurance-maroc": ""
            },
            {
                "COMMUNIQUÉ FINANCIER\nRÉSULLTTAATTS ANNUELS 2023\nCCrrooiissssaannncccceee dduu cchhiiffffrreee dddd’’’aaaffffaaiiress ppoorrttéée aussi bien par l’activité Vie q\nRésuullttaattss eenn pprrooggrreesssionn eennnn rraaiissoon de l’amélioration des indicateur\nLee CCoonseeiilll dddd’’AAddministrationn de Wafa Assurance s’est réuni le J\nPPrréésidence de Monsieur Bouubker JAI, en vue d’examiner l’activité\nlles comptes au 31 décembree 2023.\nRésultats sociaux\nChiffre d’affaires social (en MDH)\nEn 2023, le chiffre d’affaires social de Wa\n+7,1%\nsoit +7,1% par rapport à 2022.\n10 425 11 164\nLL’’activité Vie s’élève à 6 273 MDH en pro\nppeerrfformancee eenn EEppaarrggnnee eett PPrrévoyyance.\nLL’’activité Non-Vie progresse de +9,1%, à\nDéc 2022 Déc 2023\nperformance de l’ensemble des branches\nLe résultat Vie s’établit à 464 MDH en\nRésultat net social (en MDH)\ncroissance de l’activité en Epargne et en D\n+15,4%\n607 701 Le résultat Non-Vie ressort à 436 MDH en\nenregistré en 2022 (157 MDH), portée par l\nbonne tenue du résultat financierr..\nLe résultat net social atteint 701 MDH en\nDéc 2022 Déc 2023\nLes fonds propres sociaux s’élèvent à 6 6\nFonds propres sociaux (en MDH)\nRésultats consolidés\n+3,9%\n6 356 6 601\nAu 31 décembre 2023, le chiffre d’affai\n12 724 MDH enregistrant une hausse de\nréalisée sur l’ensemble des branches\nl’international.\nDéc 2022 Déc 2023\nLe RNPG de l’exercice 2023 ressort à 670 M\nde 13,6% impacté par l’évolution des marc\nChiffre d’affaires consolidé (en MDH)\ncourantes en 2023 (notamment le don au\n+9,3% effets du séisme d’Al Haouz).\n11 639 12 724\nLes capitaux propres part du groupe s’élè\n2023 vs. 8 057 MDH en 2022 en hausse de\nLe périmètre de consolidation, comprena\nDéc2022 Déc 2023 africaines, a connu courant 2023 l’entr\nplacement dédiés.\nRN Part du groupe (en MDH) Au vu des résultats enregistrés et des\nConseil d’Administration a décidé de p\n-13,6%\nOrdinaire, convoquée pour le 15 Mai 2024\n776 670\nl’exercice 2023, d’un dividende de 140 dirh\nWafa Assurance confirme ainsi son le\nfondamentaux, et poursuit le développem\nDéc2022 Déc 2023\nContact : information.financiere@wafaassurance.co.ma\nLien internet : https://www.wafaassurance.ma/fr/compa": "",
                "": "",
                "null": "",
                "uue par l’activité Non--vie.\nss techniques et finannciers.\neuudi 14 mars 2024, sous la\ndee la compagnie et d’arrêter\nfa Assurance atteint 11 164 MDH,\ngression de +5,6% portéée par la\n4 891 MDH conséquemmment à la\nNoon-Vie.\npprogression de 1,5% suuite à la\néccès.\nprrogression par rapport aau niveau\na croissance de l’activité et par la\nprrogression de 15,4%.\n01 MDH en hausse de 3,9%.\nrees consolidé annuel s’établit à\n99,3% portée par la perfformance\nVie et Non-vie au Maroc et à\nDDH vs 776 MDH en 2022 en baisse\nhés financiers et les chaarges non\nfoonds spécial pour la gestion des\nvent à 9 232 MDH au 31 ddécembre\n144,6%.\nntt Wafa Assurance et sees filiales\néee de deux fonds communs de\npeerspectives de la comppagnie, le\nrooposer à l’Assemblée Générale\nà 11h00, la distribution au titre de\namms par action.\nadership et la soliditéé de ses\nent de ses activités.\ngnnie-assurance-maroc": ""
            },
            {
                "COMMUNIQUÉ FINANCIER\nRÉSULLTTAATTS ANNUELS 2023\nCCrrooiissssaannncccceee dduu cchhiiffffrreee dddd’’’aaaffffaaiiress ppoorrttéée aussi bien par l’activité Vie q\nRésuullttaattss eenn pprrooggrreesssionn eennnn rraaiissoon de l’amélioration des indicateur\nLee CCoonseeiilll dddd’’AAddministrationn de Wafa Assurance s’est réuni le J\nPPrréésidence de Monsieur Bouubker JAI, en vue d’examiner l’activité\nlles comptes au 31 décembree 2023.\nRésultats sociaux\nChiffre d’affaires social (en MDH)\nEn 2023, le chiffre d’affaires social de Wa\n+7,1%\nsoit +7,1% par rapport à 2022.\n10 425 11 164\nLL’’activité Vie s’élève à 6 273 MDH en pro\nppeerrfformancee eenn EEppaarrggnnee eett PPrrévoyyance.\nLL’’activité Non-Vie progresse de +9,1%, à\nDéc 2022 Déc 2023\nperformance de l’ensemble des branches\nLe résultat Vie s’établit à 464 MDH en\nRésultat net social (en MDH)\ncroissance de l’activité en Epargne et en D\n+15,4%\n607 701 Le résultat Non-Vie ressort à 436 MDH en\nenregistré en 2022 (157 MDH), portée par l\nbonne tenue du résultat financierr..\nLe résultat net social atteint 701 MDH en\nDéc 2022 Déc 2023\nLes fonds propres sociaux s’élèvent à 6 6\nFonds propres sociaux (en MDH)\nRésultats consolidés\n+3,9%\n6 356 6 601\nAu 31 décembre 2023, le chiffre d’affai\n12 724 MDH enregistrant une hausse de\nréalisée sur l’ensemble des branches\nl’international.\nDéc 2022 Déc 2023\nLe RNPG de l’exercice 2023 ressort à 670 M\nde 13,6% impacté par l’évolution des marc\nChiffre d’affaires consolidé (en MDH)\ncourantes en 2023 (notamment le don au\n+9,3% effets du séisme d’Al Haouz).\n11 639 12 724\nLes capitaux propres part du groupe s’élè\n2023 vs. 8 057 MDH en 2022 en hausse de\nLe périmètre de consolidation, comprena\nDéc2022 Déc 2023 africaines, a connu courant 2023 l’entr\nplacement dédiés.\nRN Part du groupe (en MDH) Au vu des résultats enregistrés et des\nConseil d’Administration a décidé de p\n-13,6%\nOrdinaire, convoquée pour le 15 Mai 2024\n776 670\nl’exercice 2023, d’un dividende de 140 dirh\nWafa Assurance confirme ainsi son le\nfondamentaux, et poursuit le développem\nDéc2022 Déc 2023\nContact : information.financiere@wafaassurance.co.ma\nLien internet : https://www.wafaassurance.ma/fr/compa": "",
                "": "",
                "null": "",
                "uue par l’activité Non--vie.\nss techniques et finannciers.\neuudi 14 mars 2024, sous la\ndee la compagnie et d’arrêter\nfa Assurance atteint 11 164 MDH,\ngression de +5,6% portéée par la\n4 891 MDH conséquemmment à la\nNoon-Vie.\npprogression de 1,5% suuite à la\néccès.\nprrogression par rapport aau niveau\na croissance de l’activité et par la\nprrogression de 15,4%.\n01 MDH en hausse de 3,9%.\nrees consolidé annuel s’établit à\n99,3% portée par la perfformance\nVie et Non-vie au Maroc et à\nDDH vs 776 MDH en 2022 en baisse\nhés financiers et les chaarges non\nfoonds spécial pour la gestion des\nvent à 9 232 MDH au 31 ddécembre\n144,6%.\nntt Wafa Assurance et sees filiales\néee de deux fonds communs de\npeerspectives de la comppagnie, le\nrooposer à l’Assemblée Générale\nà 11h00, la distribution au titre de\namms par action.\nadership et la soliditéé de ses\nent de ses activités.\ngnnie-assurance-maroc": ""
            },
            {
                "COMMUNIQUÉ FINANCIER\nRÉSULLTTAATTS ANNUELS 2023\nCCrrooiissssaannncccceee dduu cchhiiffffrreee dddd’’’aaaffffaaiiress ppoorrttéée aussi bien par l’activité Vie q\nRésuullttaattss eenn pprrooggrreesssionn eennnn rraaiissoon de l’amélioration des indicateur\nLee CCoonseeiilll dddd’’AAddministrationn de Wafa Assurance s’est réuni le J\nPPrréésidence de Monsieur Bouubker JAI, en vue d’examiner l’activité\nlles comptes au 31 décembree 2023.\nRésultats sociaux\nChiffre d’affaires social (en MDH)\nEn 2023, le chiffre d’affaires social de Wa\n+7,1%\nsoit +7,1% par rapport à 2022.\n10 425 11 164\nLL’’activité Vie s’élève à 6 273 MDH en pro\nppeerrfformancee eenn EEppaarrggnnee eett PPrrévoyyance.\nLL’’activité Non-Vie progresse de +9,1%, à\nDéc 2022 Déc 2023\nperformance de l’ensemble des branches\nLe résultat Vie s’établit à 464 MDH en\nRésultat net social (en MDH)\ncroissance de l’activité en Epargne et en D\n+15,4%\n607 701 Le résultat Non-Vie ressort à 436 MDH en\nenregistré en 2022 (157 MDH), portée par l\nbonne tenue du résultat financierr..\nLe résultat net social atteint 701 MDH en\nDéc 2022 Déc 2023\nLes fonds propres sociaux s’élèvent à 6 6\nFonds propres sociaux (en MDH)\nRésultats consolidés\n+3,9%\n6 356 6 601\nAu 31 décembre 2023, le chiffre d’affai\n12 724 MDH enregistrant une hausse de\nréalisée sur l’ensemble des branches\nl’international.\nDéc 2022 Déc 2023\nLe RNPG de l’exercice 2023 ressort à 670 M\nde 13,6% impacté par l’évolution des marc\nChiffre d’affaires consolidé (en MDH)\ncourantes en 2023 (notamment le don au\n+9,3% effets du séisme d’Al Haouz).\n11 639 12 724\nLes capitaux propres part du groupe s’élè\n2023 vs. 8 057 MDH en 2022 en hausse de\nLe périmètre de consolidation, comprena\nDéc2022 Déc 2023 africaines, a connu courant 2023 l’entr\nplacement dédiés.\nRN Part du groupe (en MDH) Au vu des résultats enregistrés et des\nConseil d’Administration a décidé de p\n-13,6%\nOrdinaire, convoquée pour le 15 Mai 2024\n776 670\nl’exercice 2023, d’un dividende de 140 dirh\nWafa Assurance confirme ainsi son le\nfondamentaux, et poursuit le développem\nDéc2022 Déc 2023\nContact : information.financiere@wafaassurance.co.ma\nLien internet : https://www.wafaassurance.ma/fr/compa": "",
                "": "",
                "null": "",
                "uue par l’activité Non--vie.\nss techniques et finannciers.\neuudi 14 mars 2024, sous la\ndee la compagnie et d’arrêter\nfa Assurance atteint 11 164 MDH,\ngression de +5,6% portéée par la\n4 891 MDH conséquemmment à la\nNoon-Vie.\npprogression de 1,5% suuite à la\néccès.\nprrogression par rapport aau niveau\na croissance de l’activité et par la\nprrogression de 15,4%.\n01 MDH en hausse de 3,9%.\nrees consolidé annuel s’établit à\n99,3% portée par la perfformance\nVie et Non-vie au Maroc et à\nDDH vs 776 MDH en 2022 en baisse\nhés financiers et les chaarges non\nfoonds spécial pour la gestion des\nvent à 9 232 MDH au 31 ddécembre\n144,6%.\nntt Wafa Assurance et sees filiales\néee de deux fonds communs de\npeerspectives de la comppagnie, le\nrooposer à l’Assemblée Générale\nà 11h00, la distribution au titre de\namms par action.\nadership et la soliditéé de ses\nent de ses activités.\ngnnie-assurance-maroc": ""
            },
            {
                "COMMUNIQUÉ FINANCIER\nRÉSULLTTAATTS ANNUELS 2023\nCCrrooiissssaannncccceee dduu cchhiiffffrreee dddd’’’aaaffffaaiiress ppoorrttéée aussi bien par l’activité Vie q\nRésuullttaattss eenn pprrooggrreesssionn eennnn rraaiissoon de l’amélioration des indicateur\nLee CCoonseeiilll dddd’’AAddministrationn de Wafa Assurance s’est réuni le J\nPPrréésidence de Monsieur Bouubker JAI, en vue d’examiner l’activité\nlles comptes au 31 décembree 2023.\nRésultats sociaux\nChiffre d’affaires social (en MDH)\nEn 2023, le chiffre d’affaires social de Wa\n+7,1%\nsoit +7,1% par rapport à 2022.\n10 425 11 164\nLL’’activité Vie s’élève à 6 273 MDH en pro\nppeerrfformancee eenn EEppaarrggnnee eett PPrrévoyyance.\nLL’’activité Non-Vie progresse de +9,1%, à\nDéc 2022 Déc 2023\nperformance de l’ensemble des branches\nLe résultat Vie s’établit à 464 MDH en\nRésultat net social (en MDH)\ncroissance de l’activité en Epargne et en D\n+15,4%\n607 701 Le résultat Non-Vie ressort à 436 MDH en\nenregistré en 2022 (157 MDH), portée par l\nbonne tenue du résultat financierr..\nLe résultat net social atteint 701 MDH en\nDéc 2022 Déc 2023\nLes fonds propres sociaux s’élèvent à 6 6\nFonds propres sociaux (en MDH)\nRésultats consolidés\n+3,9%\n6 356 6 601\nAu 31 décembre 2023, le chiffre d’affai\n12 724 MDH enregistrant une hausse de\nréalisée sur l’ensemble des branches\nl’international.\nDéc 2022 Déc 2023\nLe RNPG de l’exercice 2023 ressort à 670 M\nde 13,6% impacté par l’évolution des marc\nChiffre d’affaires consolidé (en MDH)\ncourantes en 2023 (notamment le don au\n+9,3% effets du séisme d’Al Haouz).\n11 639 12 724\nLes capitaux propres part du groupe s’élè\n2023 vs. 8 057 MDH en 2022 en hausse de\nLe périmètre de consolidation, comprena\nDéc2022 Déc 2023 africaines, a connu courant 2023 l’entr\nplacement dédiés.\nRN Part du groupe (en MDH) Au vu des résultats enregistrés et des\nConseil d’Administration a décidé de p\n-13,6%\nOrdinaire, convoquée pour le 15 Mai 2024\n776 670\nl’exercice 2023, d’un dividende de 140 dirh\nWafa Assurance confirme ainsi son le\nfondamentaux, et poursuit le développem\nDéc2022 Déc 2023\nContact : information.financiere@wafaassurance.co.ma\nLien internet : https://www.wafaassurance.ma/fr/compa": "",
                "": "",
                "null": "",
                "uue par l’activité Non--vie.\nss techniques et finannciers.\neuudi 14 mars 2024, sous la\ndee la compagnie et d’arrêter\nfa Assurance atteint 11 164 MDH,\ngression de +5,6% portéée par la\n4 891 MDH conséquemmment à la\nNoon-Vie.\npprogression de 1,5% suuite à la\néccès.\nprrogression par rapport aau niveau\na croissance de l’activité et par la\nprrogression de 15,4%.\n01 MDH en hausse de 3,9%.\nrees consolidé annuel s’établit à\n99,3% portée par la perfformance\nVie et Non-vie au Maroc et à\nDDH vs 776 MDH en 2022 en baisse\nhés financiers et les chaarges non\nfoonds spécial pour la gestion des\nvent à 9 232 MDH au 31 ddécembre\n144,6%.\nntt Wafa Assurance et sees filiales\néee de deux fonds communs de\npeerspectives de la comppagnie, le\nrooposer à l’Assemblée Générale\nà 11h00, la distribution au titre de\namms par action.\nadership et la soliditéé de ses\nent de ses activités.\ngnnie-assurance-maroc": ""
            },
            {
                "COMMUNIQUÉ FINANCIER\nRÉSULLTTAATTS ANNUELS 2023\nCCrrooiissssaannncccceee dduu cchhiiffffrreee dddd’’’aaaffffaaiiress ppoorrttéée aussi bien par l’activité Vie q\nRésuullttaattss eenn pprrooggrreesssionn eennnn rraaiissoon de l’amélioration des indicateur\nLee CCoonseeiilll dddd’’AAddministrationn de Wafa Assurance s’est réuni le J\nPPrréésidence de Monsieur Bouubker JAI, en vue d’examiner l’activité\nlles comptes au 31 décembree 2023.\nRésultats sociaux\nChiffre d’affaires social (en MDH)\nEn 2023, le chiffre d’affaires social de Wa\n+7,1%\nsoit +7,1% par rapport à 2022.\n10 425 11 164\nLL’’activité Vie s’élève à 6 273 MDH en pro\nppeerrfformancee eenn EEppaarrggnnee eett PPrrévoyyance.\nLL’’activité Non-Vie progresse de +9,1%, à\nDéc 2022 Déc 2023\nperformance de l’ensemble des branches\nLe résultat Vie s’établit à 464 MDH en\nRésultat net social (en MDH)\ncroissance de l’activité en Epargne et en D\n+15,4%\n607 701 Le résultat Non-Vie ressort à 436 MDH en\nenregistré en 2022 (157 MDH), portée par l\nbonne tenue du résultat financierr..\nLe résultat net social atteint 701 MDH en\nDéc 2022 Déc 2023\nLes fonds propres sociaux s’élèvent à 6 6\nFonds propres sociaux (en MDH)\nRésultats consolidés\n+3,9%\n6 356 6 601\nAu 31 décembre 2023, le chiffre d’affai\n12 724 MDH enregistrant une hausse de\nréalisée sur l’ensemble des branches\nl’international.\nDéc 2022 Déc 2023\nLe RNPG de l’exercice 2023 ressort à 670 M\nde 13,6% impacté par l’évolution des marc\nChiffre d’affaires consolidé (en MDH)\ncourantes en 2023 (notamment le don au\n+9,3% effets du séisme d’Al Haouz).\n11 639 12 724\nLes capitaux propres part du groupe s’élè\n2023 vs. 8 057 MDH en 2022 en hausse de\nLe périmètre de consolidation, comprena\nDéc2022 Déc 2023 africaines, a connu courant 2023 l’entr\nplacement dédiés.\nRN Part du groupe (en MDH) Au vu des résultats enregistrés et des\nConseil d’Administration a décidé de p\n-13,6%\nOrdinaire, convoquée pour le 15 Mai 2024\n776 670\nl’exercice 2023, d’un dividende de 140 dirh\nWafa Assurance confirme ainsi son le\nfondamentaux, et poursuit le développem\nDéc2022 Déc 2023\nContact : information.financiere@wafaassurance.co.ma\nLien internet : https://www.wafaassurance.ma/fr/compa": "SA au Capital de 350.000.000,00 de dirhams- Régie par la loi 17/99 portant code ddes assurances - RC 31.719",
                "": "",
                "null": "",
                "uue par l’activité Non--vie.\nss techniques et finannciers.\neuudi 14 mars 2024, sous la\ndee la compagnie et d’arrêter\nfa Assurance atteint 11 164 MDH,\ngression de +5,6% portéée par la\n4 891 MDH conséquemmment à la\nNoon-Vie.\npprogression de 1,5% suuite à la\néccès.\nprrogression par rapport aau niveau\na croissance de l’activité et par la\nprrogression de 15,4%.\n01 MDH en hausse de 3,9%.\nrees consolidé annuel s’établit à\n99,3% portée par la perfformance\nVie et Non-vie au Maroc et à\nDDH vs 776 MDH en 2022 en baisse\nhés financiers et les chaarges non\nfoonds spécial pour la gestion des\nvent à 9 232 MDH au 31 ddécembre\n144,6%.\nntt Wafa Assurance et sees filiales\néee de deux fonds communs de\npeerspectives de la comppagnie, le\nrooposer à l’Assemblée Générale\nà 11h00, la distribution au titre de\namms par action.\nadership et la soliditéé de ses\nent de ses activités.\ngnnie-assurance-maroc": ""
            }
        ],
        [
            {
                "": "",
                "P A S S I F": "",
                "31/12/2023": "",
                "31/12/2022": ""
            },
            {
                "": "",
                "P A S S I F": "FINANCEMENT PERMANENT",
                "31/12/2023": "49 797 741 470,25",
                "31/12/2022": "46 360 365 615,14"
            },
            {
                "": "",
                "P A S S I F": "Capitaux propres",
                "31/12/2023": "6 601 142 524,37",
                "31/12/2022": "6 355 579 336,55"
            },
            {
                "": "",
                "P A S S I F": "Capital social ou fonds d’établissement",
                "31/12/2023": "350 000 000,00",
                "31/12/2022": "350 000 000,00"
            },
            {
                "": "",
                "P A S S I F": "à déduire : Actionnaires, capital souscrit non appelé",
                "31/12/2023": "",
                "31/12/2022": "-"
            },
            {
                "": "",
                "P A S S I F": "Capital appelé, (dont versé..................................)",
                "31/12/2023": "",
                "31/12/2022": "-"
            },
            {
                "": "",
                "P A S S I F": "Primes d'émission, de fusion, d'apport",
                "31/12/2023": "",
                "31/12/2022": "-"
            },
            {
                "": "",
                "P A S S I F": "Ecarts de réévaluation",
                "31/12/2023": "",
                "31/12/2022": "-"
            },
            {
                "": "",
                "P A S S I F": "Réserve légale",
                "31/12/2023": "35 000 000,00",
                "31/12/2022": "35 000 000,00"
            },
            {
                "": "",
                "P A S S I F": "Autres réserves",
                "31/12/2023": "576 000 000,00",
                "31/12/2022": "576 000 000,00"
            },
            {
                "": "",
                "P A S S I F": "Report à nouveau (1)",
                "31/12/2023": "4 939 579 336,55",
                "31/12/2022": "4 787 433 001,26"
            },
            {
                "": "",
                "P A S S I F": "Fonds social complémentaire",
                "31/12/2023": "",
                "31/12/2022": "-"
            },
            {
                "": "",
                "P A S S I F": "Résultats nets en instance d’affectation (1)",
                "31/12/2023": "",
                "31/12/2022": "-"
            },
            {
                "": "",
                "P A S S I F": "Résultat net de l'exercice (1)",
                "31/12/2023": "700 563 187,82",
                "31/12/2022": "607 146 335,29"
            },
            {
                "": "",
                "P A S S I F": "Capitaux propres assimilés",
                "31/12/2023": "-",
                "31/12/2022": "-"
            },
            {
                "": "",
                "P A S S I F": "Provisions réglementées",
                "31/12/2023": "-",
                "31/12/2022": "-"
            },
            {
                "": "",
                "P A S S I F": "Dettes de financement",
                "31/12/2023": "3 726 289,92",
                "31/12/2022": "3 332 569,92"
            },
            {
                "": "",
                "P A S S I F": "Emprunts obligataires",
                "31/12/2023": "",
                "31/12/2022": "-"
            },
            {
                "": "",
                "P A S S I F": "Emprunts pour fonds d’établissement",
                "31/12/2023": "",
                "31/12/2022": "-"
            },
            {
                "": "",
                "P A S S I F": "Autres dettes de financement",
                "31/12/2023": "3 726 289,92",
                "31/12/2022": "3 332 569,92"
            },
            {
                "": "",
                "P A S S I F": "Provisions durables pour risques et charges",
                "31/12/2023": "76 000 000,00",
                "31/12/2022": "40 000 000,00"
            },
            {
                "": "",
                "P A S S I F": "Provisions pour risques",
                "31/12/2023": "",
                "31/12/2022": "-"
            },
            {
                "": "",
                "P A S S I F": "Provisions pour charges",
                "31/12/2023": "76 000 000,00",
                "31/12/2022": "40 000 000,00"
            },
            {
                "": "",
                "P A S S I F": "Provisions techniques brutes",
                "31/12/2023": "43 116 872 655,96",
                "31/12/2022": "39 961 453 708,67"
            },
            {
                "": "",
                "P A S S I F": "Provisions pour primes non acquises",
                "31/12/2023": "936 159 459,00",
                "31/12/2022": "936 262 885,00"
            },
            {
                "": "",
                "P A S S I F": "Provisions pour sinistres à payer",
                "31/12/2023": "10 394 173 120,96",
                "31/12/2022": "10 203 168 427,87"
            },
            {
                "": "",
                "P A S S I F": "Provisions des assurances vie",
                "31/12/2023": "28 611 533 465,92",
                "31/12/2022": "25 963 202 350,07"
            },
            {
                "": "",
                "P A S S I F": "Provisions pour fluctuations de sinistralité",
                "31/12/2023": "735 887 157,74",
                "31/12/2022": "651 128 883,74"
            },
            {
                "": "",
                "P A S S I F": "Provisions pour aléas financiers",
                "31/12/2023": "-",
                "31/12/2022": "-"
            },
            {
                "": "",
                "P A S S I F": "Provisions techniques des contrats en unités de compte",
                "31/12/2023": "1 131 703 985,45",
                "31/12/2022": "1 239 664 036,98"
            },
            {
                "": "",
                "P A S S I F": "Provisions pour participations aux bénéfices",
                "31/12/2023": "938 021 906,28",
                "31/12/2022": "790 382 891,97"
            },
            {
                "": "",
                "P A S S I F": "Provisions techniques sur placements",
                "31/12/2023": "22 639 173,04",
                "31/12/2022": "22 639 173,04"
            },
            {
                "": "",
                "P A S S I F": "Autres provisions techniques",
                "31/12/2023": "346 754 387,57",
                "31/12/2022": "155 005 060,00"
            },
            {
                "": "",
                "P A S S I F": "Ecarts de conversion –passif",
                "31/12/2023": "",
                "31/12/2022": "-"
            },
            {
                "": "",
                "P A S S I F": "Augmentation des créances immobilisées et des placements",
                "31/12/2023": "",
                "31/12/2022": "-"
            },
            {
                "": "",
                "P A S S I F": "Diminution des dettes de financement et des provisions techniques",
                "31/12/2023": "",
                "31/12/2022": "-"
            },
            {
                "": "",
                "P A S S I F": "PASSIF CIRCULANT (hors trésorerie)",
                "31/12/2023": "3 861 113 882,95",
                "31/12/2022": "4 035 135 430,67"
            },
            {
                "": "",
                "P A S S I F": "Dettes pour espèces remises par les cessionnaires",
                "31/12/2023": "670 384 477,24",
                "31/12/2022": "519 982 021,70"
            },
            {
                "": "",
                "P A S S I F": "Dettes pour espèces remises par les cessionnaires",
                "31/12/2023": "670 384 477,24",
                "31/12/2022": "519 982 021,70"
            },
            {
                "": "",
                "P A S S I F": "Dettes de passif circulant",
                "31/12/2023": "3 190 729 405,71",
                "31/12/2022": "3 515 153 408,97"
            },
            {
                "": "",
                "P A S S I F": "Cessionnaires et comptes rattachés créditeurs",
                "31/12/2023": "111 403 935,48",
                "31/12/2022": "128 272 375,76"
            },
            {
                "": "",
                "P A S S I F": "Assurés, intermédiaires, cédants, coassureurs et comptes rattachés créditeurs",
                "31/12/2023": "870 470 937,38",
                "31/12/2022": "786 851 093,10"
            },
            {
                "": "",
                "P A S S I F": "Personnel créditeur",
                "31/12/2023": "67 523 757,10",
                "31/12/2022": "49 003 048,12"
            },
            {
                "": "",
                "P A S S I F": "Organismes sociaux créditeurs",
                "31/12/2023": "14 839 783,66",
                "31/12/2022": "14 089 451,31"
            },
            {
                "": "",
                "P A S S I F": "Etat créditeur",
                "31/12/2023": "311 620 262,05",
                "31/12/2022": "303 376 872,81"
            },
            {
                "": "",
                "P A S S I F": "Comptes d'associés créditeurs",
                "31/12/2023": "109 005,04",
                "31/12/2022": "108 745,04"
            },
            {
                "": "",
                "P A S S I F": "Autres créanciers",
                "31/12/2023": "1 107 469 673,66",
                "31/12/2022": "1 112 818 110,97"
            },
            {
                "": "",
                "P A S S I F": "Comptes de régularisation-passif",
                "31/12/2023": "707 292 051,34",
                "31/12/2022": "1 120 633 711,86"
            },
            {
                "": "",
                "P A S S I F": "Autres provisions pour risques et charges",
                "31/12/2023": "",
                "31/12/2022": "-"
            },
            {
                "": "",
                "P A S S I F": "Ecarts de conversion -passif (éléments circulants)",
                "31/12/2023": "",
                "31/12/2022": "-"
            },
            {
                "": "",
                "P A S S I F": "",
                "31/12/2023": "",
                "31/12/2022": "-"
            },
            {
                "": "",
                "P A S S I F": "",
                "31/12/2023": "",
                "31/12/2022": "-"
            },
            {
                "": "",
                "P A S S I F": "TRESORERIE",
                "31/12/2023": "1 263 520,04",
                "31/12/2022": "11 381 866,58"
            },
            {
                "": "",
                "P A S S I F": "Trésorerie-passif",
                "31/12/2023": "1 263 520,04",
                "31/12/2022": "11 381 866,58"
            },
            {
                "": "",
                "P A S S I F": "Crédits d'escompte",
                "31/12/2023": "",
                "31/12/2022": "-"
            },
            {
                "": "",
                "P A S S I F": "Crédits de trésorerie",
                "31/12/2023": "",
                "31/12/2022": "-"
            },
            {
                "": "",
                "P A S S I F": "Banques",
                "31/12/2023": "1 263 520,04",
                "31/12/2022": "11 381 866,58"
            },
            {
                "": "",
                "P A S S I F": "TOTAL GENERAL",
                "31/12/2023": "53 660 118 873,24",
                "31/12/2022": "50 406 882 912,39"
            }
        ],
        [
            {
                "Libellé": "",
                "null": "Net",
                "31/12/2023": "Brut",
                "31/12/2022": "Net"
            },
            {
                "Libellé": "1",
                "null": "6 248 555 802,97",
                "31/12/2023": "6 272 568 725,04",
                "31/12/2022": "5 915 359 361,42"
            },
            {
                "Libellé": "",
                "null": "6 248 555 802,97",
                "31/12/2023": "6 272 568 725,04",
                "31/12/2022": "5 915 359 361,42"
            },
            {
                "Libellé": "2",
                "null": "59 143 569,71",
                "31/12/2023": "59 143 569,71",
                "31/12/2022": "81 043 242,66"
            },
            {
                "Libellé": "",
                "null": "",
                "31/12/2023": "",
                "31/12/2022": ""
            },
            {
                "Libellé": "",
                "null": "47 265 970,92",
                "31/12/2023": "47 265 970,92",
                "31/12/2022": "71 453 054,69"
            },
            {
                "Libellé": "",
                "null": "11 877 598,79",
                "31/12/2023": "11 877 598,79",
                "31/12/2022": "9 590 187,96"
            },
            {
                "Libellé": "3",
                "null": "6 392 157 920,69",
                "31/12/2023": "6 433 210 652,42",
                "31/12/2022": "5 864 371 366,68"
            },
            {
                "Libellé": "",
                "null": "3 640 624 892,67",
                "31/12/2023": "3 689 384 973,40",
                "31/12/2022": "4 202 828 712,94"
            },
            {
                "Libellé": "",
                "null": "-33 489 531,60",
                "31/12/2023": "-37 327 894,60",
                "31/12/2022": "5 297 544,26"
            },
            {
                "Libellé": "",
                "null": "2 652 200 101,85",
                "31/12/2023": "2 648 331 115,85",
                "31/12/2022": "1 709 071 792,81"
            },
            {
                "Libellé": "",
                "null": "93 143 495,00",
                "31/12/2023": "93 143 495,00",
                "31/12/2022": "24 959 862,00"
            },
            {
                "Libellé": "",
                "null": "",
                "31/12/2023": "",
                "31/12/2022": ""
            },
            {
                "Libellé": "",
                "null": "-107 960 051,54",
                "31/12/2023": "-107 960 051,54",
                "31/12/2022": "-122 489 705,64"
            },
            {
                "Libellé": "",
                "null": "147 639 014,31",
                "31/12/2023": "147 639 014,31",
                "31/12/2022": "44 703 160,31"
            },
            {
                "Libellé": "",
                "null": "",
                "31/12/2023": "",
                "31/12/2022": ""
            },
            {
                "Libellé": "4",
                "null": "564 008 995,58",
                "31/12/2023": "564 008 995,58",
                "31/12/2022": "527 743 146,28"
            },
            {
                "Libellé": "",
                "null": "391 052 267,85",
                "31/12/2023": "391 052 267,85",
                "31/12/2022": "371 800 556,77"
            },
            {
                "Libellé": "",
                "null": "3 364 507,23",
                "31/12/2023": "3 364 507,23",
                "31/12/2022": "2 873 763,85"
            },
            {
                "Libellé": "",
                "null": "55 037 332,32",
                "31/12/2023": "55 037 332,32",
                "31/12/2022": "46 295 515,08"
            },
            {
                "Libellé": "",
                "null": "12 639 187,00",
                "31/12/2023": "12 639 187,00",
                "31/12/2022": "11 910 954,28"
            },
            {
                "Libellé": "",
                "null": "73 435 355,86",
                "31/12/2023": "73 435 355,86",
                "31/12/2022": "65 378 706,92"
            },
            {
                "Libellé": "",
                "null": "2 134 176,56",
                "31/12/2023": "2 134 176,56",
                "31/12/2022": "2 525 880,23"
            },
            {
                "Libellé": "",
                "null": "26 346 168,77",
                "31/12/2023": "26 346 168,77",
                "31/12/2022": "26 957 769,16"
            },
            {
                "Libellé": "5",
                "null": "1 220 449 188,30",
                "31/12/2023": "1 220 449 188,30",
                "31/12/2022": "1 112 213 590,16"
            },
            {
                "Libellé": "",
                "null": "974 679 118,47",
                "31/12/2023": "974 679 118,47",
                "31/12/2022": "912 682 751,65"
            },
            {
                "Libellé": "",
                "null": "",
                "31/12/2023": "",
                "31/12/2022": ""
            },
            {
                "Libellé": "",
                "null": "18 887 630,27",
                "31/12/2023": "18 887 630,27",
                "31/12/2022": "6 914 372,70"
            },
            {
                "Libellé": "",
                "null": "165 409 374,79",
                "31/12/2023": "165 409 374,79",
                "31/12/2022": "186 017 149,77"
            },
            {
                "Libellé": "",
                "null": "54 366 642,01",
                "31/12/2023": "54 366 642,01",
                "31/12/2022": ""
            },
            {
                "Libellé": "",
                "null": "",
                "31/12/2023": "",
                "31/12/2022": ""
            },
            {
                "Libellé": "",
                "null": "",
                "31/12/2023": "",
                "31/12/2022": ""
            },
            {
                "Libellé": "",
                "null": "7 106 422,76",
                "31/12/2023": "7 106 422,76",
                "31/12/2022": "6 599 316,04"
            },
            {
                "Libellé": "6",
                "null": "108 379 752,82",
                "31/12/2023": "108 379 752,82",
                "31/12/2022": "259 553 869,24"
            },
            {
                "Libellé": "",
                "null": "",
                "31/12/2023": "",
                "31/12/2022": ""
            },
            {
                "Libellé": "",
                "null": "13 881 154,32",
                "31/12/2023": "13 881 154,32",
                "31/12/2022": "14 245 219,41"
            },
            {
                "Libellé": "",
                "null": "",
                "31/12/2023": "",
                "31/12/2022": ""
            },
            {
                "Libellé": "",
                "null": "32 503 764,22",
                "31/12/2023": "32 503 764,22",
                "31/12/2022": "29 632 243,16"
            },
            {
                "Libellé": "",
                "null": "",
                "31/12/2023": "",
                "31/12/2022": ""
            },
            {
                "Libellé": "",
                "null": "",
                "31/12/2023": "",
                "31/12/2022": ""
            },
            {
                "Libellé": "",
                "null": "",
                "31/12/2023": "",
                "31/12/2022": "99 118 485,40"
            },
            {
                "Libellé": "",
                "null": "",
                "31/12/2023": "",
                "31/12/2022": ""
            },
            {
                "Libellé": "",
                "null": "61 994 834,28",
                "31/12/2023": "61 994 834,28",
                "31/12/2022": "116 557 921,27"
            },
            {
                "Libellé": "RESULTAT TECHNIQUE VIE (1+2 - 3 - 4+5 - 6)",
                "null": "463 601 891,89",
                "31/12/2023": "446 562 082,23",
                "31/12/2022": "456 947 812,03"
            }
        ],
        [
            {
                "Libellé": "",
                "null": "Net",
                "31/12/2023": "Brut",
                "31/12/2022": "Net"
            },
            {
                "Libellé": "1",
                "null": "3 904 294 924,08",
                "31/12/2023": "4 891 401 660,55",
                "31/12/2022": "3 679 308 300,49"
            },
            {
                "Libellé": "",
                "null": "3 908 433 931,08",
                "31/12/2023": "4 891 298 234,55",
                "31/12/2022": "3 773 854 058,49"
            },
            {
                "Libellé": "",
                "null": "4 139 007,00",
                "31/12/2023": "-103 426,00",
                "31/12/2022": "94 545 758,00"
            },
            {
                "Libellé": "2",
                "null": "76 680 390,72",
                "31/12/2023": "76 680 390,72",
                "31/12/2022": "58 064 702,27"
            },
            {
                "Libellé": "",
                "null": "",
                "31/12/2023": "",
                "31/12/2022": ""
            },
            {
                "Libellé": "",
                "null": "33 711 442,06",
                "31/12/2023": "33 711 442,06",
                "31/12/2022": "23 370 796,40"
            },
            {
                "Libellé": "",
                "null": "42 968 948,66",
                "31/12/2023": "42 968 948,66",
                "31/12/2022": "34 693 905,88"
            },
            {
                "Libellé": "3",
                "null": "2 932 995 711,42",
                "31/12/2023": "3 414 040 754,41",
                "31/12/2022": "2 766 383 604,48"
            },
            {
                "Libellé": "",
                "null": "2 770 947 448,16",
                "31/12/2023": "3 002 344 060,15",
                "31/12/2022": "2 517 789 446,10"
            },
            {
                "Libellé": "",
                "null": "95 052 015,69",
                "31/12/2023": "228 332 587,69",
                "31/12/2022": "106 012 764,43"
            },
            {
                "Libellé": "",
                "null": "-8 385 221,00",
                "31/12/2023": "-8 385 221,00",
                "31/12/2022": "22 192 015,95"
            },
            {
                "Libellé": "",
                "null": "",
                "31/12/2023": "",
                "31/12/2022": ""
            },
            {
                "Libellé": "",
                "null": "",
                "31/12/2023": "",
                "31/12/2022": ""
            },
            {
                "Libellé": "",
                "null": "75 381 468,57",
                "31/12/2023": "191 749 327,57",
                "31/12/2022": "120 389 378,00"
            },
            {
                "Libellé": "4",
                "null": "1 279 788 556,76",
                "31/12/2023": "1 279 788 556,76",
                "31/12/2022": "1 208 270 415,45"
            },
            {
                "Libellé": "",
                "null": "558 423 182,69",
                "31/12/2023": "558 423 182,69",
                "31/12/2022": "545 897 107,96"
            },
            {
                "Libellé": "",
                "null": "12 171 596,38",
                "31/12/2023": "12 171 596,38",
                "31/12/2022": "10 396 260,50"
            },
            {
                "Libellé": "",
                "null": "199 105 589,43",
                "31/12/2023": "199 105 589,43",
                "31/12/2022": "167 480 788,58"
            },
            {
                "Libellé": "",
                "null": "45 724 105,28",
                "31/12/2023": "45 724 105,28",
                "31/12/2022": "43 089 617,02"
            },
            {
                "Libellé": "",
                "null": "265 663 127,11",
                "31/12/2023": "265 663 127,11",
                "31/12/2022": "236 517 022,67"
            },
            {
                "Libellé": "",
                "null": "7 720 695,44",
                "31/12/2023": "7 720 695,44",
                "31/12/2022": "9 137 740,69"
            },
            {
                "Libellé": "",
                "null": "190 980 260,42",
                "31/12/2023": "190 980 260,42",
                "31/12/2022": "195 751 878,02"
            },
            {
                "Libellé": "5",
                "null": "693 956 481,98",
                "31/12/2023": "693 956 481,98",
                "31/12/2022": "495 002 616,87"
            },
            {
                "Libellé": "",
                "null": "449 604 587,95",
                "31/12/2023": "449 604 587,95",
                "31/12/2022": "409 924 926,15"
            },
            {
                "Libellé": "",
                "null": "513 591,95",
                "31/12/2023": "513 591,95",
                "31/12/2022": "6 213 499,84"
            },
            {
                "Libellé": "",
                "null": "1 126 355,11",
                "31/12/2023": "1 126 355,11",
                "31/12/2022": "842 718,75"
            },
            {
                "Libellé": "",
                "null": "10 028 251,46",
                "31/12/2023": "10 028 251,46",
                "31/12/2022": "66 346 024,54"
            },
            {
                "Libellé": "",
                "null": "",
                "31/12/2023": "",
                "31/12/2022": ""
            },
            {
                "Libellé": "",
                "null": "443 686,02",
                "31/12/2023": "443 686,02",
                "31/12/2022": "165 384,19"
            },
            {
                "Libellé": "",
                "null": "232 240 009,49",
                "31/12/2023": "232 240 009,49",
                "31/12/2022": "11 510 063,40"
            },
            {
                "Libellé": "6",
                "null": "26 173 511,71",
                "31/12/2023": "26 173 511,71",
                "31/12/2022": "101 022 866,12"
            },
            {
                "Libellé": "",
                "null": "",
                "31/12/2023": "",
                "31/12/2022": ""
            },
            {
                "Libellé": "",
                "null": "5 430 177,89",
                "31/12/2023": "5 430 177,89",
                "31/12/2022": "7 022 657,87"
            },
            {
                "Libellé": "",
                "null": "2 291 683,79",
                "31/12/2023": "2 291 683,79",
                "31/12/2022": "1 892 229,67"
            },
            {
                "Libellé": "",
                "null": "170 745,30",
                "31/12/2023": "170 745,30",
                "31/12/2022": "170 745,30"
            },
            {
                "Libellé": "",
                "null": "",
                "31/12/2023": "",
                "31/12/2022": "7 602 100,00"
            },
            {
                "Libellé": "",
                "null": "",
                "31/12/2023": "",
                "31/12/2022": ""
            },
            {
                "Libellé": "",
                "null": "",
                "31/12/2023": "",
                "31/12/2022": "3 530 000,00"
            },
            {
                "Libellé": "",
                "null": "18 280 904,73",
                "31/12/2023": "18 280 904,73",
                "31/12/2022": "80 805 133,28"
            },
            {
                "Libellé": "",
                "null": "435 974 016,89",
                "31/12/2023": "942 035 710,37",
                "31/12/2022": "156 698 733,59"
            }
        ],
        [
            {
                "IV - RECAPITULATION": "",
                "null": "31/12/2022"
            },
            {
                "IV - RECAPITULATION": "I",
                "null": "456 947 812,03"
            },
            {
                "IV - RECAPITULATION": "II",
                "null": "156 698 733,59"
            },
            {
                "IV - RECAPITULATION": "III",
                "null": "57 044 501,67"
            },
            {
                "IV - RECAPITULATION": "IV",
                "null": "670 691 047,29"
            },
            {
                "IV - RECAPITULATION": "V",
                "null": "63 544 712,00"
            },
            {
                "IV - RECAPITULATION": "VI",
                "null": "607 146 335,29"
            }
        ],
        [
            {
                "Libellé": "",
                "null": "Concernant les\nexercices\nprécédents",
                "Opérations": "Propres à\n!\"#$#%&'&#",
                "Totaux\n31/12/2023": "",
                "31/12/2022": ""
            },
            {
                "Libellé": "1",
                "null": "",
                "Opérations": "96 602 557,22",
                "Totaux\n31/12/2023": "96 602 557,22",
                "31/12/2022": "85 960 178,14"
            },
            {
                "Libellé": "",
                "null": "",
                "Opérations": "",
                "Totaux\n31/12/2023": "",
                "31/12/2022": "150,00"
            },
            {
                "Libellé": "",
                "null": "",
                "Opérations": "70 959 616,47",
                "Totaux\n31/12/2023": "70 959 616,47",
                "31/12/2022": "78 088 036,58"
            },
            {
                "Libellé": "",
                "null": "",
                "Opérations": "",
                "Totaux\n31/12/2023": "",
                "31/12/2022": "7 208 991,56"
            },
            {
                "Libellé": "",
                "null": "",
                "Opérations": "278 000,00",
                "Totaux\n31/12/2023": "278 000,00",
                "31/12/2022": "663 000,00"
            },
            {
                "Libellé": "",
                "null": "",
                "Opérations": "25 364 940,75",
                "Totaux\n31/12/2023": "25 364 940,75",
                "31/12/2022": ""
            },
            {
                "Libellé": "2",
                "null": "2 519 561,63",
                "Opérations": "107 680 315,96",
                "Totaux\n31/12/2023": "110 199 877,59",
                "31/12/2022": "37 019 616,43"
            },
            {
                "Libellé": "",
                "null": "2 519 561,63",
                "Opérations": "6 000 713,71",
                "Totaux\n31/12/2023": "8 520 275,34",
                "31/12/2022": "8 731 250,38"
            },
            {
                "Libellé": "",
                "null": "",
                "Opérations": "2 971 073,29",
                "Totaux\n31/12/2023": "2 971 073,29",
                "31/12/2022": "3 144 621,85"
            },
            {
                "Libellé": "",
                "null": "",
                "Opérations": "",
                "Totaux\n31/12/2023": "",
                "31/12/2022": ""
            },
            {
                "Libellé": "",
                "null": "",
                "Opérations": "",
                "Totaux\n31/12/2023": "",
                "31/12/2022": ""
            },
            {
                "Libellé": "",
                "null": "",
                "Opérations": "98 708 528,96",
                "Totaux\n31/12/2023": "98 708 528,96",
                "31/12/2022": "25 143 744,20"
            },
            {
                "Libellé": "Résultat non technique courant (1 - 2)",
                "null": "",
                "Opérations": "",
                "Totaux\n31/12/2023": "-13 597 320,37",
                "31/12/2022": "48 940 561,71"
            },
            {
                "Libellé": "3",
                "null": "61,84",
                "Opérations": "90 003 090,00",
                "Totaux\n31/12/2023": "90 003 151,84",
                "31/12/2022": "20 970 000,00"
            },
            {
                "Libellé": "",
                "null": "",
                "Opérations": "3 090,00",
                "Totaux\n31/12/2023": "3 090,00",
                "31/12/2022": "970 000,00"
            },
            {
                "Libellé": "",
                "null": "",
                "Opérations": "",
                "Totaux\n31/12/2023": "",
                "31/12/2022": ""
            },
            {
                "Libellé": "",
                "null": "",
                "Opérations": "",
                "Totaux\n31/12/2023": "",
                "31/12/2022": ""
            },
            {
                "Libellé": "",
                "null": "61,84",
                "Opérations": "",
                "Totaux\n31/12/2023": "61,84",
                "31/12/2022": ""
            },
            {
                "Libellé": "",
                "null": "",
                "Opérations": "90 000 000,00",
                "Totaux\n31/12/2023": "90 000 000,00",
                "31/12/2022": "20 000 000,00"
            },
            {
                "Libellé": "4",
                "null": "15 132 852,82",
                "Opérations": "142 790 011,61",
                "Totaux\n31/12/2023": "157 922 864,43",
                "31/12/2022": "12 866 060,04"
            },
            {
                "Libellé": "",
                "null": "",
                "Opérations": "8 218,75",
                "Totaux\n31/12/2023": "8 218,75",
                "31/12/2022": "302 750,05"
            },
            {
                "Libellé": "",
                "null": "",
                "Opérations": "",
                "Totaux\n31/12/2023": "",
                "31/12/2022": ""
            },
            {
                "Libellé": "",
                "null": "",
                "Opérations": "",
                "Totaux\n31/12/2023": "",
                "31/12/2022": ""
            },
            {
                "Libellé": "",
                "null": "15 132 852,82",
                "Opérations": "86 781 792,86",
                "Totaux\n31/12/2023": "101 914 645,68",
                "31/12/2022": "12 563 309,99"
            },
            {
                "Libellé": "",
                "null": "",
                "Opérations": "56 000 000,00",
                "Totaux\n31/12/2023": "56 000 000,00",
                "31/12/2022": ""
            },
            {
                "Libellé": "Résultat non technique non courant (3 - 4)",
                "null": "",
                "Opérations": "",
                "Totaux\n31/12/2023": "-67 919 712,59",
                "31/12/2022": "8 103 939,96"
            },
            {
                "Libellé": "RESULTAT NON TECHNIQUE (1 - 2 + 3 - 4)",
                "null": "",
                "Opérations": "",
                "Totaux\n31/12/2023": "-81 517 032,96",
                "31/12/2022": "57 044 501,67"
            }
        ],
        [
            {
                "TOTAL DES PRODUITS ASSURANCES VIE": "TOTAL DES PRODUITS ASSURANCES NON-VIE",
                "7 528 148 560,98": "4 674 931 796,78",
                "7 108 616 194,24": "4 232 375 619,63"
            },
            {
                "TOTAL DES PRODUITS ASSURANCES VIE": "TOTAL DES PRODUITS NON TECHNIQUES",
                "7 528 148 560,98": "186 605 709,06",
                "7 108 616 194,24": "106 930 178,14"
            },
            {
                "TOTAL DES PRODUITS ASSURANCES VIE": "TOTAL DES PRODUITS",
                "7 528 148 560,98": "12 389 686 066,82",
                "7 108 616 194,24": "11 447 921 992,01"
            },
            {
                "TOTAL DES PRODUITS ASSURANCES VIE": "TOTAL DES CHARGES ASSURANCES VIE",
                "7 528 148 560,98": "7 064 546 669,09",
                "7 108 616 194,24": "6 651 668 382,20"
            },
            {
                "TOTAL DES PRODUITS ASSURANCES VIE": "TOTAL DES CHARGES ASSURANCES NON-VIE",
                "7 528 148 560,98": "4 238 957 779,89",
                "7 108 616 194,24": "4 075 676 886,05"
            },
            {
                "TOTAL DES PRODUITS ASSURANCES VIE": "TOTAL DES CHARGES NON TECHNIQUES",
                "7 528 148 560,98": "268 122 742,02",
                "7 108 616 194,24": "49 885 676,47"
            },
            {
                "TOTAL DES PRODUITS ASSURANCES VIE": "IMPOTS SUR LES RESULTATS",
                "7 528 148 560,98": "117 495 688,00",
                "7 108 616 194,24": "63 544 712,00"
            },
            {
                "TOTAL DES PRODUITS ASSURANCES VIE": "TOTAL DES CHARGES",
                "7 528 148 560,98": "11 689 122 879,00",
                "7 108 616 194,24": "10 840 775 656,72"
            },
            {
                "TOTAL DES PRODUITS ASSURANCES VIE": "RESULTAT NET",
                "7 528 148 560,98": "700 563 187,82",
                "7 108 616 194,24": "607 146 335,29"
            }
        ],
        [
            {
                "MASSES": "",
                "null": "",
                "Exercice\n(a)": "",
                "Exercice précédent\n(b)": "",
                "Variations (a-b)": "emplois (c) ressources (d)"
            },
            {
                "MASSES": "1\n2\n3\n4\n5\n6\n7\n8\n9",
                "null": "281 956 907,82",
                "Exercice\n(a)": "6 680 868 814,29\n2 841 855 847,80",
                "Exercice précédent\n(b)": "6 398 911 906,47\n2 651 284 836,42",
                "Variations (a-b)": "190 571 011,38"
            },
            {
                "MASSES": "",
                "null": "91 385 896,44",
                "Exercice\n(a)": "3 839 012 966,49",
                "Exercice précédent\n(b)": "3 747 627 070,05",
                "Variations (a-b)": ""
            },
            {
                "MASSES": "",
                "null": "2 917 720 298,29",
                "Exercice\n(a)": "40 876 601 705,96\n40 371 630 425,96",
                "Exercice précédent\n(b)": "37 958 881 407,67\n38 219 967 242,17",
                "Variations (a-b)": "2 151 663 183,79"
            },
            {
                "MASSES": "",
                "null": "766 057 114,50",
                "Exercice\n(a)": "504 971 280,00",
                "Exercice précédent\n(b)": "-261 085 834,50",
                "Variations (a-b)": ""
            },
            {
                "MASSES": "",
                "null": "",
                "Exercice\n(a)": "7 024 014 585,52\n3 190 729 405,71",
                "Exercice précédent\n(b)": "6 434 412 650,91\n3 515 153 408,97",
                "Variations (a-b)": "589 601 934,61\n324 424 003,26"
            },
            {
                "MASSES": "",
                "null": "",
                "Exercice\n(a)": "3 833 285 179,81",
                "Exercice précédent\n(b)": "2 919 259 241,94",
                "Variations (a-b)": "914 025 937,87"
            },
            {
                "MASSES": "10",
                "null": "56 582 926,93",
                "Exercice\n(a)": "510 699 066,68",
                "Exercice précédent\n(b)": "567 281 993,61",
                "Variations (a-b)": ""
            }
        ],
        [
            {
                "": "Résultat net",
                "Exercice": "700 563 187,82",
                "Exercice précédent": "607 146 335,29"
            },
            {
                "": "Variation des provisions techniques nettes de cessions\nVariation des frais d'acquisition reportés\nVariation des amortissements et provisions (1)\nVariation des ajustements VARCUC (736 – 636)\n+ ou – values provenant de la réévaluation d’éléments d’actif\n+ ou – values réalisées sur cessions d'éléments d'actifs\nVariations des créances et dettes techniques (341 + 342 - 441 - 442 - 42)\nVariation des créances pour espèces ou titres déposées (267)\nVariation des débiteurs et créditeurs divers (343 à 348 – 443 à 448)\nAutres variations (349 – 449)",
                "Exercice": "2 917 720 298,29\n5 568 764,00\n-112 752 776,71\n54 366 642,01\n3 090,00\n-256 568 303,13\n88 741 872,17\n502 413 874,56",
                "Exercice précédent": "2 004 682 570,13\n10 593 885,00\n-362 822 972,65\n-99 118 485,40\n970 000,00\n794 584 052,60\n-125 715 336,36\n-538 149 202,53"
            },
            {
                "": "A – flux d'exploitation",
                "Exercice": "3 336 510 323,21",
                "Exercice précédent": "2 931 486 964,76"
            },
            {
                "": "Acquisitions - cessions d'immeubles (261)\nAcquisitions - cessions d'obligations (262)\nAcquisitions - cessions d'actions (263)\nAutres Acquisitions - cessions du (26)\nAutres Acquisitions - cessions (21 22 23 24 25 35)",
                "Exercice": "764 137 862,12\n1 662 167 960,05\n650 502 194,28\n-1 001 946 703,18\n863 625 656,87",
                "Exercice précédent": "307 299 114,31\n1 071 148 965,27\n258 731 236,09\n-555 624 342,36\n1 174 042 294,45"
            },
            {
                "": "B – flux net d'investissement",
                "Exercice": "-2 938 486 970,14",
                "Exercice précédent": "-2 255 597 267,76"
            },
            {
                "": "Dividendes versés\nEmissions/(remboursement) nets d'emprunts\nAugmentation /(réduction) de capital et fonds d’établissement\nAugmentation /(réduction) d'actions auto-détenues",
                "Exercice": "455 000 000,00\n393 720,00",
                "Exercice précédent": "420 000 000,00\n-395 760,00"
            },
            {
                "": "C – flux de financement",
                "Exercice": "-454 606 280,00",
                "Exercice précédent": "-420 395 760,00"
            },
            {
                "": "D - Impact de change (+17- 27-37+47)",
                "Exercice": "",
                "Exercice précédent": ""
            },
            {
                "": "E -Variation nette de la trésorerie ( A + B + C + D)",
                "Exercice": "-56 582 926,93",
                "Exercice précédent": "255 493 937,00"
            },
            {
                "": "F - Trésorerie au 1er janvier",
                "Exercice": "567 281 993,61",
                "Exercice précédent": "311 788 056,61"
            },
            {
                "": "G - Trésorerie en fin de période (E + F)",
                "Exercice": "510 699 066,68",
                "Exercice précédent": "567 281 993,61"
            }
        ],
        [
            {
                "": "Primes acquises (1a – 1b)",
                "Exercice": "11 163 970 385,59",
                "Exercice\nPrécédent": "10 378 302 134,35"
            },
            {
                "": "Primes émises",
                "Exercice": "11 163 866 959,59",
                "Exercice\nPrécédent": "10 425 138 745,35"
            },
            {
                "": "Variation des provisions pour primes non acquises",
                "Exercice": "-103 426,00",
                "Exercice\nPrécédent": "46 836 611,00"
            },
            {
                "": "Variation des provisions mathématiques (60311+60317 + 6032 + 6033 + 60261+60267)",
                "Exercice": "2 417 411 010,55",
                "Exercice\nPrécédent": "1 416 976 715,16"
            },
            {
                "": "Ajustement VARCUC",
                "Exercice": "-54 366 642,01",
                "Exercice\nPrécédent": "99 118 485,40"
            },
            {
                "": "Charges des prestations (4a + 4b)",
                "Exercice": "7 024 580 443,04",
                "Exercice\nPrécédent": "7 040 609 827,48"
            },
            {
                "": "Prestations et frais payés (hors rubrique 9)",
                "Exercice": "6 660 074 566,92",
                "Exercice\nPrécédent": "6 891 280 118,48"
            },
            {
                "": "Variation des provisions pour prestations et diverses",
                "Exercice": "364 505 876,12",
                "Exercice\nPrécédent": "149 329 709,00"
            },
            {
                "": "A - Solde de souscription (Marge brute) (1 – 2- 3 -4)",
                "Exercice": "1 776 345 574,01",
                "Exercice\nPrécédent": "1 821 597 106,31"
            },
            {
                "": "Charges d’acquisition",
                "Exercice": "949 475 450,54",
                "Exercice\nPrécédent": "917 697 664,73"
            },
            {
                "": "Autres charges techniques d’exploitation",
                "Exercice": "894 322 101,80",
                "Exercice\nPrécédent": "818 315 897,00"
            },
            {
                "": "Produits techniques d’exploitation",
                "Exercice": "135 823 960,43",
                "Exercice\nPrécédent": "139 107 944,93"
            },
            {
                "": "B - Charges d’acquisition et de gestion nettes (5 + 6 - 7)",
                "Exercice": "1 707 973 591,91",
                "Exercice\nPrécédent": "1 596 905 616,80"
            },
            {
                "": "C - Marge d’exploitation (A – B)",
                "Exercice": "68 371 982,10",
                "Exercice\nPrécédent": "224 691 489,51"
            },
            {
                "": "Produits nets des placements (73 – 63) (hors ajustement VARCUC)",
                "Exercice": "1 725 485 763,74",
                "Exercice\nPrécédent": "1 345 757 957,07"
            },
            {
                "": "Participations aux résultats et charges des intérêts crédités (60115,60316, 60266, 6071)",
                "Exercice": "405 259 953,24",
                "Exercice\nPrécédent": "357 549 157,65"
            },
            {
                "": "D - Solde financier (8 – 9)",
                "Exercice": "1 320 225 810,50",
                "Exercice\nPrécédent": "988 208 799,42"
            },
            {
                "": "E - Résultat technique brut (C + D)",
                "Exercice": "1 388 597 792,60",
                "Exercice\nPrécédent": "1 212 900 288,93"
            },
            {
                "": "Part des réassureurs dans les primes acquises",
                "Exercice": "1 011 119 658,54",
                "Exercice\nPrécédent": "783 634 472,44"
            },
            {
                "": "Part des réassureurs dans les prestations payées",
                "Exercice": "280 156 692,72",
                "Exercice\nPrécédent": "199 069 529,13"
            },
            {
                "": "Part des réassureurs dans les provisions",
                "Exercice": "241 941 082,00",
                "Exercice\nPrécédent": "-14 688 800,00"
            },
            {
                "": "F - Solde de réassurance (11 + 12 – 10)",
                "Exercice": "-489 021 883,82",
                "Exercice\nPrécédent": "-599 253 743,31"
            },
            {
                "": "G - Résultat technique net (E + F)",
                "Exercice": "899 575 908,78",
                "Exercice\nPrécédent": "613 646 545,62"
            },
            {
                "": "Résultat non technique courant\nRésultat non technique non courant",
                "Exercice": "-13 597 320,37\n-67 919 712,59",
                "Exercice\nPrécédent": "48 940 561,71\n8 103 939,96"
            },
            {
                "": "H - Résultat non technique (13 + 14)",
                "Exercice": "-81 517 032,96",
                "Exercice\nPrécédent": "57 044 501,67"
            },
            {
                "": "I – Résultat avant impôts (G + H)",
                "Exercice": "818 058 875,82",
                "Exercice\nPrécédent": "670 691 047,29"
            },
            {
                "": "Impôts sur les sociétés",
                "Exercice": "117 495 688,00",
                "Exercice\nPrécédent": "63 544 712,00"
            },
            {
                "": "J - Résultat net (I – 15)",
                "Exercice": "700 563 187,82",
                "Exercice\nPrécédent": "607 146 335,29"
            }
        ],
        [
            {
                "ETAT A2- ETAT DES DEROGATIONS": "!\")1'/01-\"()&*()+,-./01-\"*",
                "null": "!\"#$%&\"'&()&*()+,-./01-\"*(*%,((\n$&(3/0,14-1\"&5($/(*10%/01-\"(\n#1\"/\"'16,&(&0($&*(,+*%$0/0*"
            },
            {
                "ETAT A2- ETAT DES DEROGATIONS": "!\"#\"$%&'()*+',-\")./\"0&+,1+02-\"\n\"\"\"\"1'30*)452-\"6',7)32,*)./",
                "null": "7(8(9(7(:"
            },
            {
                "ETAT A2- ETAT DES DEROGATIONS": "!!\"#\"$%&'()*+',-\")./\"3%*8'72-\"\n\"\"\"\"79%:)5.)*+',",
                "null": "7(8(9(7(:"
            },
            {
                "ETAT A2- ETAT DES DEROGATIONS": "!!!\"#\"$%&'()*+',-\")./\"&;(52-\"\"\"\n\"\"\"\"\"79%*)45+--232,*\"2*\"72\n\"\"\"\"\"0&%-2,*)*+',\"72-\"%*)*-\n\"\"\"\"72\"-<,*8;-2",
                "null": "7(8(9(7(:"
            }
        ],
        [],
        [
            {
                "": "",
                "null": "Résultat net de l’exercice Bénéfice +\nPerte -",
                "Exercice": "700 563 187,82",
                "Exercice\nPrécédent": "607 146 335,29\n0"
            },
            {
                "": "",
                "null": "Dotations d’exploitation (1)",
                "Exercice": "217 326 429,19",
                "Exercice\nPrécédent": "222 709 647,18"
            },
            {
                "": "",
                "null": "Dotations sur placements (1)",
                "Exercice": "80 275 739,01",
                "Exercice\nPrécédent": "197 363 054,55"
            },
            {
                "": "",
                "null": "Dotations non techniques courantes",
                "Exercice": "98 708 528,96",
                "Exercice\nPrécédent": "25 143 744,20"
            },
            {
                "": "",
                "null": "Dotations non techniques non courantes",
                "Exercice": "56 000 000,00",
                "Exercice\nPrécédent": "0,00"
            },
            {
                "": "",
                "null": "Reprises d’exploitation (2)",
                "Exercice": "54 846 547,45",
                "Exercice\nPrécédent": "44 284 093,84"
            },
            {
                "": "",
                "null": "Reprises sur placements (2)",
                "Exercice": "239 346 432,25",
                "Exercice\nPrécédent": "18 109 379,44"
            },
            {
                "": "",
                "null": "Reprises non techniques courantes",
                "Exercice": "25 364 940,75",
                "Exercice\nPrécédent": "0,00"
            },
            {
                "": "",
                "null": "Reprises non techniques non courantes (2) (3)",
                "Exercice": "20 000 000,00",
                "Exercice\nPrécédent": "20 000 000,00"
            },
            {
                "": "",
                "null": "Profits provenant de la réévaluation",
                "Exercice": "",
                "Exercice\nPrécédent": "0"
            },
            {
                "": "",
                "null": "Pertes provenant de la réévaluation",
                "Exercice": "",
                "Exercice\nPrécédent": "0"
            },
            {
                "": "",
                "null": "Produits des cessions d’immobilisations",
                "Exercice": "3 090,00",
                "Exercice\nPrécédent": "970 000,00"
            },
            {
                "": "",
                "null": "Valeur nette d’amortissements des immobilisations cédées",
                "Exercice": "8 218,75",
                "Exercice\nPrécédent": "302 750,05"
            },
            {
                "": "",
                "null": "CAPACITE D’AUTOFINANCEMENT",
                "Exercice": "813 321 093,28",
                "Exercice\nPrécédent": "969 302 057,99"
            },
            {
                "": "",
                "null": "Distribution de bénéfices",
                "Exercice": "455 000 000,00",
                "Exercice\nPrécédent": "420 000 000,00"
            },
            {
                "": "",
                "null": "AUTOFINANCEMENT",
                "Exercice": "358 321 093,28",
                "Exercice\nPrécédent": "549 302 057,99"
            }
        ],
        [
            {
                "!\"#$%&'(&)'*+\",-&.&,#)": "4';'*+\",-&.&,#)'\"11&2#\",#'5&)\n!!!!.:#+3(&)'(<:=\"5$\"#03,",
                "/$)#0102\"#03,'\n8$'2+\",-&.&,#": "!'>'?'!'@",
                "4,15$&,2&')$%'5&'6\"#%0.30,&7'5\"''\n)0#$\"#03,'10,\",209%&'&#'5&)'%:)$5#\"#)": "!'>'?'!'@"
            },
            {
                "!\"#$%&'(&)'*+\",-&.&,#)": "44';'*+\",-&.&,#)'\"11&2#\",#''5&)\n'''''%9-5&)'(&'6%:)&,#\"#03,",
                "/$)#0102\"#03,'\n8$'2+\",-&.&,#": "!'>'?'!'@",
                "4,15$&,2&')$%'5&'6\"#%0.30,&7'5\"''\n)0#$\"#03,'10,\",209%&'&#'5&)'%:)$5#\"#)": "!'>'?'!'@"
            }
        ],
        [
            {
                "Raison Sociale\nde la société\némettrice": "",
                "Secteur\nd'Activité": "",
                "Capital\nsocial": "",
                "%\nparticiaption\nau capital": "",
                "Prix\nd'acquisition\nglobal": "",
                "PROVISION": "",
                "Valeur\ncomptable\nnette": "",
                "Extrait des derniers états de synthèse de la sté émettrice": "Date de\nclôture",
                "null": "Résultat\nnet",
                "Produits inscrits\nau CPC\nde l'exercice": ""
            },
            {
                "Raison Sociale\nde la société\némettrice": "I - IMMOBILISATIONS FINANCIERES\nPanorama\nWAA Nvie Sénégal\nPRO ASSUR SA\nWAA NVie Côte d'ivoire\nWafa Life Insurance Egypt\nWAFA ASSURANCE REAL ESTATE INVESTMENT\nWAFA ASSURANCE REAL ESTATE MANAGEMENT\nWafa Takaful",
                "Secteur\nd'Activité": "Immobilier\nAssurance\nAssurance\nAssurance\nAssurance\nImmobilier\nImmobilier\nAssurance",
                "Capital\nsocial": "110(cid:2)000(cid:2)000\n68(cid:2)048(cid:2)000\n85(cid:2)060(cid:2)000\n68(cid:2)048(cid:2)000\n92(cid:2)046(cid:2)396\n137(cid:2)800(cid:2)000\n300(cid:2)000\n50(cid:2)000(cid:2)000",
                "%\nparticiaption\nau capital": "100,0%\n100,0%\n65,0%\n100,0%\n99,9%\n100,0%\n100,0%\n100,0%",
                "Prix\nd'acquisition\nglobal": "209(cid:2)638(cid:2)000\n67(cid:2)331(cid:2)521\n58(cid:2)228(cid:2)798\n66(cid:2)550(cid:2)795\n91(cid:2)954(cid:2)350\n137(cid:2)800(cid:2)000\n300(cid:2)000\n50(cid:2)000(cid:2)000",
                "PROVISION": "46(cid:2)638(cid:2)000\n-\n6(cid:2)888(cid:2)436\n-\n26(cid:2)222(cid:2)241\n-\n-\n-",
                "Valeur\ncomptable\nnette": "163(cid:2)000(cid:2)000\n67(cid:2)331(cid:2)521\n51(cid:2)340(cid:2)362\n66(cid:2)550(cid:2)795\n65(cid:2)732(cid:2)109\n137(cid:2)800(cid:2)000\n300(cid:2)000\n50(cid:2)000(cid:2)000",
                "Extrait des derniers états de synthèse de la sté émettrice": "31/12/2023\n31/12/2023\n31/12/2023\n31/12/2023\n31/12/2022\n31/12/2023\n31/12/2023\n31/12/2022",
                "null": "- 6 (cid:2)165(cid:2)477\n- 18(cid:2)521(cid:2)395\n4(cid:2)634(cid:2)646\n- 2 (cid:2)416(cid:2)173\n- 10(cid:2)355(cid:2)940\n- 1 (cid:2)067(cid:2)754\n- 6 5(cid:2)140\n- 6 (cid:2)337(cid:2)672",
                "Produits inscrits\nau CPC\nde l'exercice": "3(cid:2)727(cid:2)917\n3(cid:2)223(cid:2)506"
            },
            {
                "Raison Sociale\nde la société\némettrice": "TOTAL",
                "Secteur\nd'Activité": "",
                "Capital\nsocial": "",
                "%\nparticiaption\nau capital": "",
                "Prix\nd'acquisition\nglobal": "681(cid:2)803(cid:2)464",
                "PROVISION": "79(cid:2)748(cid:2)678",
                "Valeur\ncomptable\nnette": "602(cid:2)054(cid:2)787",
                "Extrait des derniers états de synthèse de la sté émettrice": "",
                "null": "",
                "Produits inscrits\nau CPC\nde l'exercice": ""
            },
            {
                "Raison Sociale\nde la société\némettrice": "II - PLACEMENTS AFFECTES AUX OPERATIONS\nD'ASSURANCE\nWAA Vie Sénégal\nWAA Vie Cameroun\nWAA Vie Côte d'ivoire\nATTIJARI ASSURANCE TUNISIE\nAFRICA RE\nWAFA IMA\nRMA WATANIYA\nC.A.T.\nSTE DES SELS DE MOHAMEDIA",
                "Secteur\nd'Activité": "Assurance\nAssurance\nAssurance\nAssurances\nAssurances\nAssistance\nAssurances\nAssurances\nMines",
                "Capital\nsocial": "51(cid:2)036(cid:2)000\n77(cid:2)601(cid:2)939\n59(cid:2)542(cid:2)000\n33(cid:2)954(cid:2)000\n2(cid:2)991(cid:2)813(cid:2)820\n50(cid:2)000(cid:2)000\n1(cid:2)796(cid:2)170(cid:2)800\n162(cid:2)656(cid:2)000\n53(cid:2)300(cid:2)000",
                "%\nparticiaption\nau capital": "100,0%\n97,5%\n100,0%\n55,0%\n0,2%\n32,5%\n0,8%\n9,1%\n24,5%",
                "Prix\nd'acquisition\nglobal": "50(cid:2)383(cid:2)025\n72(cid:2)448(cid:2)984\n58(cid:2)406(cid:2)206\n64(cid:2)483(cid:2)528\n4(cid:2)934(cid:2)106\n16(cid:2)249(cid:2)800\n58(cid:2)917(cid:2)202\n14(cid:2)747(cid:2)600\n160(cid:2)475(cid:2)001",
                "PROVISION": "-\n-\n-\n-\n-\n-\n-\n-\n1(cid:2)850(cid:2)976",
                "Valeur\ncomptable\nnette": "50(cid:2)383(cid:2)025\n72(cid:2)448(cid:2)984\n58(cid:2)406(cid:2)206\n64(cid:2)483(cid:2)528\n4(cid:2)934(cid:2)106\n16(cid:2)249(cid:2)800\n58(cid:2)917(cid:2)202\n14(cid:2)747(cid:2)600\n158(cid:2)624(cid:2)025",
                "Extrait des derniers états de synthèse de la sté émettrice": "31/12/2023\n31/12/2023\n31/12/2023\n31/12/2023\n31/12/2022\n31/12/2023\n31/12/2022\n31/12/2022\n31/12/2022",
                "null": "21(cid:2)779(cid:2)547\n6(cid:2)860(cid:2)061\n34(cid:2)948(cid:2)219\n42(cid:2)548(cid:2)840\n247(cid:2)955(cid:2)264\n52(cid:2)368(cid:2)842\n905(cid:2)458(cid:2)408\n260(cid:2)975(cid:2)512\n47(cid:2)334(cid:2)158",
                "Produits inscrits\nau CPC\nde l'exercice": "482(cid:2)115\n5(cid:2)849(cid:2)892\n7(cid:2)475(cid:2)610\n22(cid:2)563(cid:2)828\n7(cid:2)351(cid:2)936"
            },
            {
                "Raison Sociale\nde la société\némettrice": "TOTAL",
                "Secteur\nd'Activité": "",
                "Capital\nsocial": "",
                "%\nparticiaption\nau capital": "",
                "Prix\nd'acquisition\nglobal": "501(cid:2)045(cid:2)452",
                "PROVISION": "1(cid:2)850(cid:2)976",
                "Valeur\ncomptable\nnette": "499(cid:2)194(cid:2)477",
                "Extrait des derniers états de synthèse de la sté émettrice": "",
                "null": "",
                "Produits inscrits\nau CPC\nde l'exercice": "43(cid:2)723(cid:2)381"
            }
        ],
        [
            {
                "ETAT B4 BIS - TABLEAU DES PLACEMENTS (EXERCICE 31/12/2023)": "IHIJIK3L)EMGN3OP",
                "null": "'#%()*%\n1*0-(\n2\"#%$)#\",$-,$"
            },
            {
                "ETAT B4 BIS - TABLEAU DES PLACEMENTS (EXERCICE 31/12/2023)": "!\"##$%&'\n01&'2#342%1&'\n7$#2'*\"2*$42%1&'*8\"*'14%929'*%::1;%<%=#\"'\n?32#\"'*@<$4\":\"&2'*%::1;%<%\"#'\n7<$4\":\"&2'*%::1;%<%\"#'*\"&*413#'",
                "null": ", /\n, /\n+ /\n( /\n) /"
            },
            {
                "ETAT B4 BIS - TABLEAU DES PLACEMENTS (EXERCICE 31/12/2023)": "3*,\"#)4#\"5$1$-,()011*60#0$&(",
                "null": "8"
            },
            {
                "ETAT B4 BIS - TABLEAU DES PLACEMENTS (EXERCICE 31/12/2023)": "A;<%B$2%1&'*8CD2$2\nE1&'*83*2#9'1#\nA;<%B$2%1&'*B$#$&2%\"'*@$#*<CD2$2\n!%2#\"'*FG@12F94$%#\"'*H,I\n!%2#\"'*8\"*4#9$&4\"'*&9B14%$;<\"'\n!%2#\"'*8\"*4#9$&4\"'*94F3\"'\n?32#\"'*1;<%B$2%1&'*\"2*;1&'",
                "null": "+ /\n/\n- /\n/ /\n/\n, /"
            },
            {
                "ETAT B4 BIS - TABLEAU DES PLACEMENTS (EXERCICE 31/12/2023)": "3*,\"#)A6#0B\",0*-(C)6*-()$,),0,&$().$)5&/\"-5$()-/B*50\"6#$(",
                "null": "8"
            },
            {
                "ETAT B4 BIS - TABLEAU DES PLACEMENTS (EXERCICE 31/12/2023)": "!%2#\"'*8\"*@$#2%4%@$2%1&'*\n?42%1&'*4J29\"'*H.I\nA70KL*A;<%B$2$%#\"'\nA70KL*?42%1&'\nA70KL*M%N\"#'*H+I\n?32#\"'*$42%1&'*\"2*@$#2'*'14%$<\"'*H>I",
                "null": "+ (66*).6*)>-\n( (*/+>*-)>*5-)\n- (,5*),/*,-6\n/\n5 5).*)..*/+6\n- .>-*)5-*/6/"
            },
            {
                "ETAT B4 BIS - TABLEAU DES PLACEMENTS (EXERCICE 31/12/2023)": "3*,\"#)\"5,0*-()$,),0,&$().$)4\"&,0504\",0*-",
                "null": "?);9@)9:<)8>="
            },
            {
                "ETAT B4 BIS - TABLEAU DES PLACEMENTS (EXERCICE 31/12/2023)": "7#O2'*\"&*@#\":%=#\"*FG@12F=P3\"\n?N$&4\"'*'3#*@1<%4\"'*K%\"\n7#O2'*&$&2%'*@$#*8\"'*1;<%B$2%1&'\n?32#\"'*@#O2'*H(I",
                "null": ". /\n- /\n- /\n6 /"
            },
            {
                "ETAT B4 BIS - TABLEAU DES PLACEMENTS (EXERCICE 31/12/2023)": "3*,\"#)4&D,()$,)5&/\"-5$()011*60#0(/(",
                "null": "8"
            },
            {
                "ETAT B4 BIS - TABLEAU DES PLACEMENTS (EXERCICE 31/12/2023)": "M9@J2'*Q*2\"#:\"\nA70KL*:1&92$%#\"'\n?32#\"'*89@J2'R\nK$<\"3#'*#\":%'\"'*$3S*498$&2\"'\n0#9$&4\"'*@13#*\"'@=4\"'*#\":%'\"'*$3S*498$&2\"'",
                "null": "/ /\n. .-*..-*65(\n) /"
            },
            {
                "ETAT B4 BIS - TABLEAU DES PLACEMENTS (EXERCICE 31/12/2023)": "3*,\"#)E/4F,(",
                "null": "> :@)::@)=97"
            },
            {
                "ETAT B4 BIS - TABLEAU DES PLACEMENTS (EXERCICE 31/12/2023)": "*\nA;<%B$2%1&'*\"2*;1&'\n?42%1&'*\"2*@$#2'*$32#\"'*P3\"*<\"'*A70KL\n7$#2'*\"2*$42%1&'*A70KL\n7$#2'*\"2*$42%1&'*$32#\"'*A70KL\n?32#\"'*@<$4\":\"&2'",
                "null": "/ /\n/ /\n/ /\n+ /\n/ /\n/ /"
            },
            {
                "ETAT B4 BIS - TABLEAU DES PLACEMENTS (EXERCICE 31/12/2023)": "3*,\"#)'#\"5$1$-,()%-0,/().$)5*14,$(",
                "null": "> 8"
            },
            {
                "ETAT B4 BIS - TABLEAU DES PLACEMENTS (EXERCICE 31/12/2023)": "3A3GH",
                "null": "7 ?);@=)=7:)@7:"
            }
        ],
        [
            {
                ")0*/%+": "",
                "E894F94\"F3\"GHI34\"G5\"JK5L52M7M5": "1234",
                "null": ")54",
                "'F27F47896\"G5\"JK5L52M7M5": "1234",
                "E894F94\"F\"JF\"N79\"G5\"JK5L52M7M5": "1234"
            },
            {
                ")0*/%+": "!\"#$%&%#'&()#*\"()\"%+,&('#'(-./*%&,&\n!\"#$%&%#'&()#*\"(&%'%&;\",&(<()-=,\"\n!\"#$%&%#'&(>,&(-&&*\"-'.,&($%,(?,@)A%.-;%#'&(.%:>,&&#*&B\n!\"#$%&%#'()#*\"(CA*.;*-;%#'&(>,(&%'%&;\"-A%;D\n!\"#$%&%#'&()#*\"(-AD-&(C%'-'.%,\"&\n!\"#$%&%#'&(>,&(.#';\"-;&(,'(*'%;D&(>,(.#+);,\n!\"#$%&%#'&()#*\"()-\";%.%)-;%#'&(-*@(ED'DC%.,&\n!\"#$%&%#'&(&*\"()A-.,+,';&\nF*;\",&()\"#$%&%#'&(;,.G'%/*,&\n*&*0:",
                "E894F94\"F3\"GHI34\"G5\"JK5L52M7M5": "012(323(445\n67(371(624(934\n35(021(373(157\n256(634(449\n6(310(229(718\n807(143(403\n33(210(681\n655(775(727",
                "null": "838(601(402\n4(012(745(899\n34(625(772(275\n815(448(654\n6(616(871(045\n014(736(072\n33(210(681\n337(721(397",
                "'F27F47896\"G5\"JK5L52M7M5": ":(((((((((((671(932(\n((((606(779(201(\n(3(294(116(662(\n((((((49(854(389(\n:678(027(753\n698(210(769\n606(890(134",
                "E894F94\"F\"JF\"N79\"G5\"JK5L52M7M5": "012(650(950\n67(109(681(636\n34(266(511(928\n815(448(654\n6(616(871(045\n014(736(072\n33(210(681\n192(859(144"
            },
            {
                ")0*/%+": "",
                "E894F94\"F3\"GHI34\"G5\"JK5L52M7M5": ";<\"<=>\"?@;\"AB<",
                "null": "?B\"DA=\"=B>\"ABA",
                "'F27F47896\"G5\"JK5L52M7M5": ";\">@@\"?>D\"<?A",
                "E894F94\"F\"JF\"N79\"G5\"JK5L52M7M5": "?;\">>=\"DAC\"=@A"
            }
        ],
        [
            {
                "-$&%'(": "",
                "./01201\"": "23\"45631\"47\n<97:7A?=?7",
                "8+&$&!+-)": "897:;</=121=/0",
                "null": "0/0\"?/3A2017B",
                "'(*'!)()": "897:;</=121=/0",
                "./01201\"\nC\"<2\">=0\"47\n<97:7A?=?7": ""
            },
            {
                "-$&%'(": "!\"#\"$%&'()(&*)\"+&,%\"-.+%./(01(&*\"-2\"340/1(5\"(66&7(3().\n:\"#\"$%&'()(&*)\"%.@3262*1.)\n>\"#\"$%&'()(&*)\"-,%0732)\"+&,%\"%()A,2)\"21\"/B0%@2)\n)+%)\"&+&$D\"E\"$\"F\n;\"#\"$%&'()(&*)\"+&,%\"-.+%./(01(&*\"-2\"340/1(5\"/(%/,30*1\nC\"#\"D,1%2)\"+%&'()(&*)\"+&,%\"%()A,2)\"21\"/B0%@2)\n9\"#\"$%&'()(&*)\"+&,%\"-.+%./(01(&*\"-2)\"/&6+12)\"-2\"1%.)&%2%\n)+%)\"&+&$D\"E\"PF\n&+&$D\"E\"$RP\"F",
                "./01201\"": "898\":;<\";8;",
                "8+&$&!+-)": "",
                "null": "",
                "'(*'!)()": "",
                "./01201\"\nC\"<2\">=0\"47\n<97:7A?=?7": "9=9\">89\":8<"
            },
            {
                "-$&%'(": "",
                "./01201\"": "GHG\"IJK\"JGJ",
                "8+&$&!+-)": "",
                "null": "",
                "'(*'!)()": "",
                "./01201\"\nC\"<2\">=0\"47\n<97:7A?=?7": "HMH\"NGH\"IGK"
            },
            {
                "-$&%'(": "",
                "./01201\"": "!\"C!;\"89C\"?8>\n(",
                "8+&$&!+-)": "!=>\"=!8\":C9",
                "null": "",
                "'(*'!)()": "",
                "./01201\"\nC\"<2\">=0\"47\n<97:7A?=?7": "!\"9!8\"8<>\"::?"
            },
            {
                "-$&%'(": "",
                "./01201\"": "L\"QLJ\"GHQ\"OGN",
                "8+&$&!+-)": "LMN\"MLG\"IQH",
                "null": "",
                "'(*'!)()": "",
                "./01201\"\nC\"<2\">=0\"47\n<97:7A?=?7": "L\"HLG\"GKN\"IIO"
            },
            {
                "-$&%'(": "",
                "./01201\"": "I\"IKI\"MLJ\"JJG",
                "8+&$&!+-)": "LMN\"MLG\"IQH",
                "null": "",
                "'(*'!)()": "",
                "./01201\"\nC\"<2\">=0\"47\n<97:7A?=?7": "I\"IIJ\"LQO\"QMG"
            }
        ],
        [
            {
                "*)&!\"*&%": "",
                "-9-!#": "",
                "!\"!#$%&'(!)'&*+&!\"*&": "(:02';<05'75",
                "null": "34567562'\n81@8?2156?2\n@78';12\n1EE162",
                "!,-)&%'!\"!#$%&%": "34567562'15'\n;1A=212"
            },
            {
                "*)&!\"*&%": "F&'#<!*-GH'G339IG#G%&''\nJ'GCC4D=:=276=452'E=575.=K812\n!!!!\"!#$%&'!())*+(,('-'\n!!!!\"!./&$0'!1$-2310'!4(3231(5$0'\nJ'(:7.1C1562'7EE1.6?2'70L'4@?876=452';<7220875.1\n!!!\"=+,(>2&(*3'!0&!+*3'!0&!?@A\n!!!\"!#$%&'!0&!0440&'!2''()(,-'\n!!!\"!@$-2310'!F*/$!G-FH&'!2/F$5'!G0'!1-G23&0'\nF&'#<!*-GH'*G)*,#!\"-\n!\"!#2$&!G0'!$-2''/$0/$'!G23'!,0'!F$*I('(*3'!&01J3(K/0'\n!\"!@0''(*332($0'!0&!1*)F&0'!$2&&21J-'\n!\"!L3&0$)-G(2($0';!1-G23&';!1*2''/$0/$'!0&!1*)F&0'!$2&&21J-'\n!\"!#0$'*330,\n!\"!M&2&\n!\"!@*)F&0'!GN2''*1(-'\n!\"!./&$0'!G-+(&0/$'\n!\"!@*)F&0'!G0!$->/,2$('2&(*3\"21&(4\n-9-!#''",
                "-9-!#": "678!9:9!86:;<\n7B!C7:!CD:!:DD;:\nB8:!C:6!7:6;7\nE;E",
                "!\"!#$%&'(!)'&*+&!\"*&": ": 678!9:9!86:;<:\nC76!BE6!<6<!:B9;<7\n6 B8:!C:6!7:6;76\nE",
                "null": "7E6!E9<!7D:;B:",
                "!,-)&%'!\"!#$%&%": ":D:!:E8!6:7;ED"
            },
            {
                "*)&!\"*&%": "",
                "-9-!#": "MN'OMP'QON'RRMSN",
                "!\"!#$%&'(!)'&*+&!\"*&": "PMT'UVN'VVU'RPTSNU",
                "null": "MVW'VOQ'MPRSTR",
                "!,-)&%'!\"!#$%&%": "RPR'RVU'WRMSVP"
            },
            {
                "*)&!\"*&%": "",
                "-9-!#": ":!:DE!:CE!96E;E\n786!69C!D68;9\nD!EC6!C9:!8BD;8\n7!B69!C8E;:\nCE<!9:6!967;8\nE;E\n7!E69!6CB!879;D\nB:D!868!B99;D",
                "!\"!#$%&'(!)'&*+&!\"*&": "E\n8\n<\nD\n7\nE\nD\n:",
                "null": "",
                "!,-)&%'!\"!#$%&%": ""
            },
            {
                "*)&!\"*&%": "",
                "-9-!#": "U'UOM'TUR'WRPSN",
                "!\"!#$%&'(!)'&*+&!\"*&": "R VSVV",
                "null": "VSVV",
                "!,-)&%'!\"!#$%&%": "VSVV"
            },
            {
                "*)&!\"*&%": "",
                "-9-!#": "RT'UVT'VNO'NPTSP",
                "!\"!#$%&'(!)'&*+&!\"*&": "TMT'UVN'VVU'RPTSNU",
                "null": "MVW'VOQ'MPRSTR",
                "!,-)&%'!\"!#$%&%": "RPR'RVU'WRMSVP"
            },
            {
                "*)&!\"*&%": "",
                "-9-!#": "",
                "!\"!#$%&'(!)'&*+&!\"*&": "",
                "null": "",
                "!,-)&%'!\"!#$%&%": ""
            }
        ],
        [
            {
                "9&--&%": "",
                "-:-!#": "",
                "!\"!#$%&'(!)'&*+&!\"*&": "(;02'<=05'75",
                "null": "34567562'\n81A8@2156@2\nA78'<12\n1GG162",
                "!,-)&%'!\"!#$%&%": "34567562'15\n<1C>212"
            },
            {
                "9&--&%": "9&'HI\"!\"*&3&\"-\n!!!!\"!#$%&'()*!+,-./0)0.&1*\n!!!!\"!2')&1*!31))1*!31!4.(0(51$1()\n9&%'!,-)&%'(!%%IH%'*I)*,#!\"-%\n!\"!>1))1*!%+'&!3?%@)*!31*!&?0**'&0(51*\n!\"!B1**.+((0.&1*!1)!5+$%)1*!&0))05C?*\n!\"!2**'&?*<!.()1&$?3.0.&1*<!5?30()*<!5+0**'&1'&*!1)!5+$%)1*!&0))05C?*\n!\"!F1&*+((1-\n!\"!G&/0(.*$1*!*+5.0'H\n!\"!#)0)\n!\"!B+$%)1*!3I0**+5.?*\n!\"!2')&1*!5&?0(5.1&*\n!\"!B+$%)1*!31!&?/'-0&.*0).+(\"%0**.4\n-:-!#''",
                "-:-!#": "6!789!8:;<;8",
                "!\"!#$%&'(!)'&*+&!\"*&": "6!789!8:;<;8",
                "null": "",
                "!,-)&%'!\"!#$%&%": ""
            },
            {
                "9&--&%": "",
                "-:-!#": "J'KLM'LNOPOL",
                "!\"!#$%&'(!)'&*+&!\"*&": "J'KLM'LNOPOL",
                "null": "Q QPQQ",
                "!,-)&%'!\"!#$%&%": "QPQQ"
            },
            {
                "9&--&%": "",
                "-:-!#": "97=!6:A!A77<8A\nDDD!A=6!;6E<A:\n:7=!A7=!;67<6:\n97!E86!7E7<D=\nDA!:6;!7:6<99\n6DD!98=!898<=E\nD=;!==E<=A\nD!D=7!A9;!976<99\n7=7!8;8!=ED<6A",
                "!\"!#$%&'(!)'&*+&!\"*&": "",
                "null": "A",
                "!,-)&%'!\"!#$%&%": ""
            },
            {
                "9&--&%": "",
                "-:-!#": "J'NMR'RRJ'NNLPOS",
                "!\"!#$%&'(!)'&*+&!\"*&": "QPQQ",
                "null": "T QPQQ",
                "!,-)&%'!\"!#$%&%": "QPQQ"
            },
            {
                "9&--&%": "",
                "-:-!#": "J'NMT'NTQ'RKLPNK",
                "!\"!#$%&'(!)'&*+&!\"*&": "J'KLM'LNOPOL",
                "null": "T QPQQ",
                "!,-)&%'!\"!#$%&%": "QPQQ"
            }
        ],
        [
            {
                "ETAT B9 - ENGAGEMENTS FINANCIERS REÇUS OU DONNES HORS OPERATIONS\nDE CREDIT-BAIL (AU 31/12/2023)": "!\"#$#!%!\"&'()*\"\"!'",
                "null": "%+,-.,-/(01023430\n5263670,-"
            },
            {
                "ETAT B9 - ENGAGEMENTS FINANCIERS REÇUS OU DONNES HORS OPERATIONS\nDE CREDIT-BAIL (AU 31/12/2023)": "!\"!#$%&'!()!*%+),-.'!\n!\"!/%&(+0'!0(1,'('!%+2!*34%.)('\n!\"!#+)0('!(.5%5(1(.)'!4-..3'\n&*&$8(9:;\n678!4-.)!(.5%5(1(.)'!9!&:35%04!4:;<'(!&,3('",
                "null": ""
            },
            {
                "ETAT B9 - ENGAGEMENTS FINANCIERS REÇUS OU DONNES HORS OPERATIONS\nDE CREDIT-BAIL (AU 31/12/2023)": "",
                "null": "<=<<"
            },
            {
                "ETAT B9 - ENGAGEMENTS FINANCIERS REÇUS OU DONNES HORS OPERATIONS\nDE CREDIT-BAIL (AU 31/12/2023)": "",
                "null": ""
            }
        ],
        [
            {
                "!(%+*',%#(!%&+*\n'-&'!(%+*'D+%,(!%&+*": "",
                "4567867'95:;<=7'\nB8='>8'EF=<7G": "",
                ".87:=<": "",
                ",87<'<7'>?<:\nHI?6E9=?B7?56": "",
                "-CJ<7": "",
                "@8><:='95AB78C><'6<77<'\nH<'>8'EF=<7G'H566G<\nK'>8'H87<'H<'9>L7:=<": ""
            }
        ],
        [
            {
                "!\"#$#!%!\"&'(>!?@'": "!\"!#$%&'!()!*%+),-.'\n!\"!/%&(+0'!0(1,'('!=%0!&('!03%''+0(+0'\n!\"!#+)0('!(.5%5(1(.)'!0(>+'\n&*&$8",
                "%+,-.,-/(01023430": "",
                "%+,-.,-/(01023430\n5263670,-": ""
            },
            {
                "!\"#$#!%!\"&'(>!?@'": "",
                "%+,-.,-/(01023430": "<=<<",
                "%+,-.,-/(01023430\n5263670,-": "<=<<"
            }
        ],
        [
            {
                "!(%+*',%#(!%&+*\n'-&'!(%+*'D+%,(!%&+*": "M=N7E'OPB57O<98?=<E\nM=N7E'6867?E",
                "4567867'95:;<=7'\nB8='>8'EF=<7G": "/3'Q23'R/ST0R\nR'RUQ'23QTRR",
                ".87:=<": "",
                ",87<'<7'>?<:\nHI?6E9=?B7?56": "",
                "-CJ<7": "!\"#$#%&",
                "@8><:='95AB78C><'6<77<'\nH<'>8'EF=<7G'H566G<\nK'>8'H87<'H<'9>L7:=<": "0U'VR2'SUVTW0\nS'3SS'WWVT2R"
            }
        ],
        [],
        [
            {
                "null": "",
                "/'012 /'012": "891':/0 8;:'809"
            },
            {
                "null": "!34567&5)389:89(;7",
                "/'012 /'012": "/<2&<2< /./&=1/"
            },
            {
                "null": "",
                "/'012 /'012": "8';8;'2?1 8'8??';:?"
            },
            {
                "null": "",
                "/'012 /'012": "18'0?A'?8A /:'A/0';99"
            },
            {
                "null": "",
                "/'012 /'012": "8'898':A/ 8';9?'00/"
            },
            {
                "null": "",
                "/'012 /'012": ""
            },
            {
                "null": ">;?3(@()47&A(7&?345B54C7&AD?77E9?)3(\n>?94&A(7&9C?77E9(E97&A?)7&A(7&:?77567&;5C7&J&A(7&38)49?47&AK?77E9?)3(&(4&\nAK5)B(74577(@()4",
                "/'012 /'012": "F<&2.F&F2G <G&<=F&/HI\n1&.HF&FFG 1&//H&12F"
            },
            {
                "null": "",
                "/'012 /'012": ";/9'208 80:'A;1"
            },
            {
                "null": "",
                "/'012 /'012": ";'20; /'?AA"
            },
            {
                "null": "",
                "/'012 /'012": "9A'9/; /1'A:?"
            },
            {
                "null": "",
                "/'012 /'012": ";'21;'?29 ;'??8';1;"
            },
            {
                "null": "",
                "/'012 /'012": ";0?'8:1 8?8'29:"
            },
            {
                "null": "",
                "/'012 /'012": ":/?'8?8 :/2':8/"
            },
            {
                "null": "",
                "/'012 /'012": ";'??0';;2 ;'120'00;"
            },
            {
                "null": "!E49(7&?34567\n!34567&A(7&?345B54C7&A(745)C(7&J&L49(&3CAC(7&8E&?M?)A8))C(7\n#9C789(95(&(4&CNE5B?;()47&A(&49C789(95(",
                "/'012 /'012": "H&/<<&I<. I&H.F&<H2\n/&2/=&=I2 GF=&//="
            }
        ],
        [],
        [],
        [],
        [],
        [
            {
                "Capital social Total Capitaux\nRéserves non Réserve de Réserves de Ecarts Intérêts\net primes propres part Total\ndistribuées conversion réévaluation actuarials minoritaires\nd'émission du groupe": "Situation à l'ouverture de l'exercice 2022.12 350(cid:2)000 6(cid:2)037(cid:2)266 -11(cid:2)001 2(cid:2)818(cid:2)510 9(cid:2)194(cid:2)776 223(cid:2)986 9(cid:2)418(cid:2)762",
                "null": ""
            },
            {
                "Capital social Total Capitaux\nRéserves non Réserve de Réserves de Ecarts Intérêts\net primes propres part Total\ndistribuées conversion réévaluation actuarials minoritaires\nd'émission du groupe": "",
                "null": "-5(cid:2)907"
            },
            {
                "Capital social Total Capitaux\nRéserves non Réserve de Réserves de Ecarts Intérêts\net primes propres part Total\ndistribuées conversion réévaluation actuarials minoritaires\nd'émission du groupe": "",
                "null": "9(cid:2)412(cid:2)855"
            },
            {
                "Capital social Total Capitaux\nRéserves non Réserve de Réserves de Ecarts Intérêts\net primes propres part Total\ndistribuées conversion réévaluation actuarials minoritaires\nd'émission du groupe": "",
                "null": "826(cid:2)196"
            },
            {
                "Capital social Total Capitaux\nRéserves non Réserve de Réserves de Ecarts Intérêts\net primes propres part Total\ndistribuées conversion réévaluation actuarials minoritaires\nd'émission du groupe": "",
                "null": "-1(cid:2)484(cid:2)820"
            },
            {
                "Capital social Total Capitaux\nRéserves non Réserve de Réserves de Ecarts Intérêts\net primes propres part Total\ndistribuées conversion réévaluation actuarials minoritaires\nd'émission du groupe": "",
                "null": "-658(cid:2)625"
            },
            {
                "Capital social Total Capitaux\nRéserves non Réserve de Réserves de Ecarts Intérêts\net primes propres part Total\ndistribuées conversion réévaluation actuarials minoritaires\nd'émission du groupe": "",
                "null": "-430(cid:2)125"
            },
            {
                "Capital social Total Capitaux\nRéserves non Réserve de Réserves de Ecarts Intérêts\net primes propres part Total\ndistribuées conversion réévaluation actuarials minoritaires\nd'émission du groupe": "",
                "null": ""
            },
            {
                "Capital social Total Capitaux\nRéserves non Réserve de Réserves de Ecarts Intérêts\net primes propres part Total\ndistribuées conversion réévaluation actuarials minoritaires\nd'émission du groupe": "",
                "null": ""
            },
            {
                "Capital social Total Capitaux\nRéserves non Réserve de Réserves de Ecarts Intérêts\net primes propres part Total\ndistribuées conversion réévaluation actuarials minoritaires\nd'émission du groupe": "",
                "null": "-114"
            }
        ],
        [
            {
                ">!OO$%&'&()&*+,&- ./0/10121. ./0/101211": "",
                "null": "91A'AAA 91A'AAA"
            },
            {
                ">!OO$%&'&()&*+,&- ./0/10121. ./0/101211": "",
                "null": "A A"
            },
            {
                ">!OO$%&'&()&*+,&- ./0/10121. ./0/101211": "",
                "null": "2';8;'AA1 0'?9A'/0/"
            },
            {
                ">!OO$%&'&()&*+,&- ./0/10121. ./0/101211": "",
                "null": "0:A'/?? ::0'A:?"
            },
            {
                ">!OO$%&'&()&*+,&- ./0/10121. ./0/101211": "\"?:54?EP&:98:9(7Q:?94&AE&R98E:(\n>?94535:?458)7&)(&A8))?)4&:?7&;(&38)49S;(",
                "null": "G&1.1&F2< =&2FI&F<.\n1HI&F=F 1I2&=H."
            },
            {
                ">!OO$%&'&()&*+,&- ./0/10121. ./0/101211": "\"?:54?EP&:98:9(7",
                "null": "G&F2G&2=G =&./H&</I"
            },
            {
                ">!OO$%&'&()&*+,&- ./0/10121. ./0/101211": "+(44(7&A(&65)?)3(@()4\n>98B5758)7&:8E9&957NE(7&(4&3T?9R(7",
                "null": ".&=.I 11&.G/\n/F/&1G/ /<=&=H2"
            },
            {
                ">!OO$%&'&()&*+,&- ./0/10121. ./0/101211": "",
                "null": "/1'2:0'A2: /;';;9'/1?"
            },
            {
                ">!OO$%&'&()&*+,&- ./0/10121. ./0/101211": "",
                "null": "8'898':A/ 8';9?'00/"
            },
            {
                ">!OO$%&'&()&*+,&- ./0/10121. ./0/101211": "",
                "null": "8'010'A:1 8':?2':A:"
            },
            {
                ">!OO$%&'&()&*+,&- ./0/10121. ./0/101211": ">?77567&4(3T)5NE(7\n$@:S47&A566C9C7&:?77567",
                "null": "<=&II.&=II <F&1I/&=.2\n/&1/F&IF< IHF&./2"
            },
            {
                ">!OO$%&'&()&*+,&- ./0/10121. ./0/101211": "",
                "null": "?0?'819 2:;'101"
            },
            {
                ">!OO$%&'&()&*+,&- ./0/10121. ./0/101211": "",
                "null": "2??'0:1 :0:'/?1"
            },
            {
                ">!OO$%&'&()&*+,&- ./0/10121. ./0/101211": "",
                "null": ":08'2A9 :20'2/8"
            },
            {
                ">!OO$%&'&()&*+,&- ./0/10121. ./0/101211": "",
                "null": "18:':02 801'8:8"
            },
            {
                ">!OO$%&'&()&*+,&- ./0/10121. ./0/101211": "",
                "null": ";'A;;'29? ;'/A?'?AA"
            },
            {
                ">!OO$%&'&()&*+,&- ./0/10121. ./0/101211": "!E49(7&:?77567\n>?77567&A(7&?345B54C7&A(745)C(7&J&L49(&3CAC(7&8E&?M?)A8))C(7",
                "null": "F&/H/&1.= F&22/&GH1"
            }
        ],
        [
            {
                "Situation à l'ouverture de l'exercice 2023.12 350(cid:2)000 6(cid:2)378(cid:2)861 16(cid:2)727 1(cid:2)310(cid:2)955 8(cid:2)056(cid:2)543 260(cid:2)873 8(cid:2)317(cid:2)416": "",
                "null": ""
            },
            {
                "Situation à l'ouverture de l'exercice 2023.12 350(cid:2)000 6(cid:2)378(cid:2)861 16(cid:2)727 1(cid:2)310(cid:2)955 8(cid:2)056(cid:2)543 260(cid:2)873 8(cid:2)317(cid:2)416": "",
                "null": "8(cid:2)317(cid:2)416"
            },
            {
                "Situation à l'ouverture de l'exercice 2023.12 350(cid:2)000 6(cid:2)378(cid:2)861 16(cid:2)727 1(cid:2)310(cid:2)955 8(cid:2)056(cid:2)543 260(cid:2)873 8(cid:2)317(cid:2)416": "",
                "null": "726(cid:2)776"
            },
            {
                "Situation à l'ouverture de l'exercice 2023.12 350(cid:2)000 6(cid:2)378(cid:2)861 16(cid:2)727 1(cid:2)310(cid:2)955 8(cid:2)056(cid:2)543 260(cid:2)873 8(cid:2)317(cid:2)416": "",
                "null": "920(cid:2)574"
            },
            {
                "Situation à l'ouverture de l'exercice 2023.12 350(cid:2)000 6(cid:2)378(cid:2)861 16(cid:2)727 1(cid:2)310(cid:2)955 8(cid:2)056(cid:2)543 260(cid:2)873 8(cid:2)317(cid:2)416": "",
                "null": "1(cid:2)647(cid:2)350"
            },
            {
                "Situation à l'ouverture de l'exercice 2023.12 350(cid:2)000 6(cid:2)378(cid:2)861 16(cid:2)727 1(cid:2)310(cid:2)955 8(cid:2)056(cid:2)543 260(cid:2)873 8(cid:2)317(cid:2)416": "",
                "null": "-467(cid:2)595"
            },
            {
                "Situation à l'ouverture de l'exercice 2023.12 350(cid:2)000 6(cid:2)378(cid:2)861 16(cid:2)727 1(cid:2)310(cid:2)955 8(cid:2)056(cid:2)543 260(cid:2)873 8(cid:2)317(cid:2)416": "",
                "null": ""
            },
            {
                "Situation à l'ouverture de l'exercice 2023.12 350(cid:2)000 6(cid:2)378(cid:2)861 16(cid:2)727 1(cid:2)310(cid:2)955 8(cid:2)056(cid:2)543 260(cid:2)873 8(cid:2)317(cid:2)416": "",
                "null": ""
            },
            {
                "Situation à l'ouverture de l'exercice 2023.12 350(cid:2)000 6(cid:2)378(cid:2)861 16(cid:2)727 1(cid:2)310(cid:2)955 8(cid:2)056(cid:2)543 260(cid:2)873 8(cid:2)317(cid:2)416": "",
                "null": "-28(cid:2)223"
            }
        ],
        [
            {
                "Exercice Exercice\nTableau de flux de trésorerie consolidé\n2023.12 2022.12": "Résultat net de l'ensemble consolidé avant impôt 902(cid:2)014 1(cid:2)092(cid:2)18"
            }
        ],
        [],
        [],
        [
            {
                "&'()*+,-./0(+*+ ,,,,,,,,,,,,,,,,,,,\"$,123,$41,,,,,,,,,,,,,,,,,,,\"\",441,31\",,,": "&'560(7,6*+,-07'*+,-.7(8(79+ ,,,,,,,,,,,,,,,,,,,,,,,,,,:3,$$2,,,,,,,,,,,,,,,,,,,,,,,,,,;1,:%$,,,"
            }
        ],
        [
            {
                "null": "",
                "31/12/2023 31/12/2022": ""
            }
        ],
        [
            {
                "Exercice Exercice\n2023.12 2022.12": "",
                "null": "Total"
            },
            {
                "Exercice Exercice\n2023.12 2022.12": "Primes Emises",
                "null": "11(cid:2)639(cid:2)323"
            },
            {
                "Exercice Exercice\n2023.12 2022.12": "Produits des autres activités",
                "null": "86(cid:2)702"
            }
        ],
        [
            {
                "null": "Impôts différés actifs - En KMAD",
                "31/12/2023 31/12/2022": ""
            }
        ],
        [
            {
                "null": "Impôts différés passifs - En KMAD",
                "31/12/2023 31/12/2022": ""
            }
        ],
        [],
        [
            {
                "null": "Brut Dépréciation Net Brut Dépréciation Net",
                "Exercice 2023.12 Exercice 2022.12": ""
            }
        ],
        [],
        [
            {
                "null": "",
                "EXERCICE 2023.12": "Vie Non Vie Total",
                "EXERCICE 2022.12": "Vie Non Vie Total"
            }
        ],
        [],
        [],
        [],
        [
            {
                "31/12/2023 31/12/2022": "Actifs disponibles à la vente",
                "null": "Titres à revenus fixes 26(cid:2)924(cid:2)533 23(cid:2)636(cid:2)790\nActions et autres titres à revenu variable 24(cid:2)360(cid:2)072 22(cid:2)319(cid:2)534"
            },
            {
                "31/12/2023 31/12/2022": "Actifs à la JV par le résultat",
                "null": "Placements représentant des contrats dont le\n1(cid:2)131(cid:2)704 1(cid:2)239(cid:2)664\nrisque financier est supporté par l’assuré"
            },
            {
                "31/12/2023 31/12/2022": "Créances financières",
                "null": "Dépôts et autres créances financières 406(cid:2)305 1(cid:2)089(cid:2)909"
            },
            {
                "31/12/2023 31/12/2022": "Total 52(cid:2)822(cid:2)614 48(cid:2)285(cid:2)897",
                "null": ""
            }
        ],
        [
            {
                "null": "",
                "31/12/2023 31/12/2022": ""
            }
        ],
        [],
        [],
        [],
        [
            {
                "null": "",
                "EXERCICE 2023.12 EXERCICE 2022.12": ""
            },
            {
                "null": "11(cid:2)639(cid:2)323",
                "EXERCICE 2023.12 EXERCICE 2022.12": ""
            },
            {
                "null": "1(cid:2)092(cid:2)184",
                "EXERCICE 2023.12 EXERCICE 2022.12": ""
            },
            {
                "null": "-145(cid:2)713",
                "EXERCICE 2023.12 EXERCICE 2022.12": ""
            },
            {
                "null": "8(cid:2)056(cid:2)543",
                "EXERCICE 2023.12 EXERCICE 2022.12": ""
            },
            {
                "null": "776(cid:2)079",
                "EXERCICE 2023.12 EXERCICE 2022.12": ""
            },
            {
                "null": "22(cid:2)391",
                "EXERCICE 2023.12 EXERCICE 2022.12": ""
            },
            {
                "null": "49(cid:2)485(cid:2)176",
                "EXERCICE 2023.12 EXERCICE 2022.12": ""
            },
            {
                "null": "127(cid:2)163",
                "EXERCICE 2023.12 EXERCICE 2022.12": ""
            },
            {
                "null": "167(cid:2)025",
                "EXERCICE 2023.12 EXERCICE 2022.12": ""
            },
            {
                "null": "49(cid:2)978",
                "EXERCICE 2023.12 EXERCICE 2022.12": ""
            },
            {
                "null": "59(cid:2)427(cid:2)790",
                "EXERCICE 2023.12 EXERCICE 2022.12": ""
            }
        ],
        [
            {
                "null": "",
                "EXERCICE 2023.12 EXERCICE 2022.12": ""
            },
            {
                "null": "11(cid:2)639(cid:2)323",
                "EXERCICE 2023.12 EXERCICE 2022.12": ""
            },
            {
                "null": "1(cid:2)092(cid:2)184",
                "EXERCICE 2023.12 EXERCICE 2022.12": ""
            },
            {
                "null": "-145(cid:2)713",
                "EXERCICE 2023.12 EXERCICE 2022.12": ""
            },
            {
                "null": "8(cid:2)056(cid:2)543",
                "EXERCICE 2023.12 EXERCICE 2022.12": ""
            },
            {
                "null": "776(cid:2)079",
                "EXERCICE 2023.12 EXERCICE 2022.12": ""
            },
            {
                "null": "22(cid:2)391",
                "EXERCICE 2023.12 EXERCICE 2022.12": ""
            },
            {
                "null": "49(cid:2)485(cid:2)176",
                "EXERCICE 2023.12 EXERCICE 2022.12": ""
            },
            {
                "null": "127(cid:2)163",
                "EXERCICE 2023.12 EXERCICE 2022.12": ""
            },
            {
                "null": "167(cid:2)025",
                "EXERCICE 2023.12 EXERCICE 2022.12": ""
            },
            {
                "null": "49(cid:2)978",
                "EXERCICE 2023.12 EXERCICE 2022.12": ""
            },
            {
                "null": "59(cid:2)427(cid:2)790",
                "EXERCICE 2023.12 EXERCICE 2022.12": ""
            }
        ]
    ]
}